1097	DATE	60	68	7/9/2063	2063-07-09
1097	DOCTOR	396	398	IC
1097	DATE	402	408	5.9.63	2063-05-09
1097	DOCTOR	438	446	L Bonnot
1097	IDNUM	27	35	43J47561
1097	IDNUM	36	44	43J47561
1097	IDNUM	835	842	43J4756
1097	MEDICALRECORD	1	11	433475.RDC
1097	PATIENT	12	26	Timmins, ELDEN
1135	CITY	199	205	TEMORA
1135	CITY	83	88	COWRA
1135	STATE	90	92	WA
1135	ZIP	94	98	6021
1135	CITY	83	88	COWRA
1135	DATE	124	132	3/6/1989	1989-03-06
1135	DATE	152	162	07/08/2062	2062-08-07
1135	DEPARTMENT	183	198	ENVOI Pathology
1135	HOSPITAL	199	214	TEMORA HOSPITAL
1135	DOCTOR	1606	1608	FA
1135	DATE	1612	1618	8/8/62	2062-08-08
1135	DOCTOR	1649	1656	F Serpe
1135	DOCTOR	218	234	ANTHONY ROCKHOLD
1135	IDNUM	13	23	23F340166Q
1135	IDNUM	66	74	23F34016
1135	MEDICALRECORD	24	35	2323401.RRQ
1135	PATIENT	37	55	Jourdan, WILLIEMAE
1135	STATE	90	92	WA
1135	STREET	75	82	Redacre
1135	ZIP	94	98	6021
1153	DATE	1082	1089	24/3/64	2064-03-24
1153	DATE	50	59	25/3/2064	2064-03-25
1153	DOCTOR	1122	1131	N Piccone
1153	IDNUM	26	34	58C41682
1153	MEDICALRECORD	2	13	5804168.HSN
1153	PATIENT	14	25	BOGEN, CARY
1156	DATE	59	68	11/6/2064	2064-06-11
1156	DOCTOR	1010	1019	H Knknown
1156	IDNUM	35	43	27P13874
1156	MEDICALRECORD	2	13	2761387.KJG
1156	PATIENT	14	34	Mccorrison, BLONDELL
1192	DATE	108	118	29.10.2062	2062-10-29
1192	DATE	4208	4218	29.10.2062	2062-10-29
1192	DATE	62	72	29/10/2062	2062-10-29
1192	DOCTOR	2028	2030	NL
1192	DATE	2036	2044	24.10.62	2062-10-24
1192	DOCTOR	2076	2085	Y Zalesky
1192	DOCTOR	4247	4256	Y Vanhise
1192	IDNUM	38	46	92T06218
1192	MEDICALRECORD	1	11	927062.DVI
1192	PATIENT	12	37	MASTRANGELO, RHETT BOBBIE
1198	CITY	78	83	COWRA
1198	STATE	85	95	Queensland
1198	CITY	78	83	COWRA
1198	DATE	127	136	25/5/1984	1984-05-25
1198	DATE	156	164	3/5/2063	2063-03-05
1198	DATE	2574	2581	11/7/63	2063-11-07
1198	DATE	299	306	11/7/63	2063-11-07
1198	DEPARTMENT	181	203	Southern IML Pathology
1198	HOSPITAL	204	227	SWAN DISTRICTS HOSPITAL
1198	DOCTOR	1051	1053	PL
1198	DATE	1057	1063	6.5.63	2063-06-06
1198	DOCTOR	1095	1102	A Benzi
1198	DOCTOR	1775	1791	Maryanne WIPPERT
1198	DOCTOR	231	253	Caden Baladji Thalmann
1198	DOCTOR	2587	2601	Vinia CHETELAT
1198	DOCTOR	2603	2619	MODBURY HOSPITAL
1198	HOSPITAL	2603	2619	MODBURY HOSPITAL
1198	DOCTOR	688	698	A Hauswald
1198	TIME	702	719	15:25 on 03/05/63	2063-05-03
1198	IDNUM	13	23	06D750650A
1198	IDNUM	64	72	06D75065
1198	MEDICALRECORD	24	34	061750.SOA
1198	PATIENT	36	53	CARTAYA, Dominick
1198	PATIENT	73	77	Wren
1198	STATE	85	95	Queensland
1198	ZIP	97	101	2163
1209	CITY	97	107	CANNONVALE
1209	STATE	109	112	TAS
1209	ZIP	114	118	4224
1209	CITY	97	107	CANNONVALE
1209	DATE	153	162	28/7/1997	1997-07-28
1209	DATE	2228	2235	17/6/64	2064-06-17
1209	DEPARTMENT	213	231	105 HAMRUN CIRCUIT
1209	HOSPITAL	234	261	JOYCE PALMER HEALTH SERVICE
1209	DOCTOR	1997	2003	Jessie
1209	DOCTOR	2010	2021	Y Margulies
1209	DOCTOR	2033	2041	Y Juarez
1209	TIME	2045	2062	14:20 on 16/06/64	2064-06-16T14:20
1209	DOCTOR	2272	2282	YMargarito
1209	DOCTOR	265	282	Ezra Kelly Borden
1209	DOCTOR	2818	2833	FERNANDO Bisbee
1209	DOCTOR	303	309	Fausto
1209	IDNUM	13	23	91E200918G
1209	IDNUM	68	76	91E20091
1209	IDNUM	77	85	91E20091
1209	MEDICALRECORD	24	35	9112009.EVG
1209	PATIENT	37	57	Amack, Jonathan Erik
1209	STATE	109	112	TAS
1209	TIME	182	192	16/06/2064	2064-06-16T11:12
1209	ZIP	114	118	4224
1250	CITY	207	218	KURRI KURRI
1250	CITY	2390	2399	MELBOURNE
1250	CITY	3170	3176	FORBES
1250	CITY	92	99	BUCASIA
1250	STATE	101	104	TAS
1250	ZIP	106	110	7210
1250	CITY	92	99	BUCASIA
1250	DATE	141	150	15/3/2030	2030-03-15
1250	DEPARTMENT	201	206	Palms
1250	HOSPITAL	213	236	KURRI DISTRICT HOSPITAL
1250	DOCTOR	1217	1219	FC
1250	DOCTOR	1221	1223	UX
1250	DATE	1228	1235	24.1.63	2063-01-24
1250	DOCTOR	1267	1276	S Redhead
1250	DOCTOR	1284	1291	S Wilda
1250	DOCTOR	2281	2293	EDDIE Donlon
1250	DOCTOR	2295	2315	DIRRANBANDI HOSPITAL
1250	DOCTOR	240	245	Reyes
1250	DOCTOR	2893	2910	ACUTE STROKE UNIT
1250	DOCTOR	3160	3168	S Rahmes
1250	HOSPITAL	3170	3194	FORBES DISTRICT HOSPITAL
1250	DOCTOR	4125	4132	Malakan
1250	DATE	4133	4139	2/7/63	2063-02-07
1250	DOCTOR	4164	4174	S Montayes
1250	DATE	4176	4183	14/2/63	2063-02-14
1250	DOCTOR	5033	5048	Bernarda Setias
1250	HOSPITAL	5050	5067	MORANBAH HOSPITAL
1250	DOCTOR	925	934	S Dingman
1250	DOCTOR	958	964	S Nori
1250	DOCTOR	968	976	S Quirin
1250	TIME	980	999	12:10pm on 23.01.63	2063-01-23
1250	HOSPITAL	2384	2422	ROYAL MELBOURNE HOSPITAL - CITY CAMPUS
1250	IDNUM	13	23	71H6840991
1250	IDNUM	4230	4239	71H684099
1250	PATIENT	4279	4297	A/Prof ENRIQUE SAR
1250	IDNUM	4711	4720	71H684099
1250	IDNUM	74	82	71H68409
1250	MEDICALRECORD	24	35	7126840.YZE
1250	PATIENT	37	63	Gressmire, FRANCISCO Karyn
1250	PATIENT	83	91	N Lenore
1250	STATE	101	104	TAS
1250	TIME	170	180	23/01/2063	2063-01-23
1250	ZIP	106	110	7210
1250	ZIP	3375	3379	2000
1393	CITY	87	97	WANGARATTA
1393	ZIP	101	105	4415
1393	DATE	131	139	8/1/2011	2011-01-08
1393	DATE	159	169	13/05/2063	2063-05-13
1393	DEPARTMENT	190	230	Tissue Pathology and Diagnostic Oncology
1393	HOSPITAL	231	283	PORT BROUGHTON DISTRICT HOSPITAL AND HEALTH SERVICES
1393	DEPARTMENT	4387	4416	PETER MACCALLUM CANCER CENTRE
1393	DOCTOR	1837	1839	PG
1393	DATE	1843	1850	14.5.63	2063-05-14
1393	DOCTOR	1880	1887	G Leuty
1393	DOCTOR	287	312	INES Ramona STEPHEN-Grich
1393	DOCTOR	4599	4608	G Dykhoff
1393	IDNUM	14	24	28D604157N
1393	IDNUM	65	73	28D60415
1393	MEDICALRECORD	25	35	281604.DNU
1393	PATIENT	37	54	MCFATE, Jere IVAN
1393	STATE	4516	4526	QUEENSLAND
1393	STREET	74	86	Harvest Park
1393	ZIP	101	105	4415
1429	DATE	55	64	17/6/2063	2063-06-17
1429	DOCTOR	1505	1507	GD
1429	DATE	1511	1518	14.6.63	2063-06-14
1429	DOCTOR	1549	1559	I Respress
1429	IDNUM	31	39	33N40272
1429	MEDICALRECORD	2	13	3354027.GMD
1429	PATIENT	14	30	Stream, Randolph
1444	CITY	79	89	NARRANDERA
1444	STATE	91	99	Tasmania
1444	ZIP	101	105	2899
1444	CITY	79	89	NARRANDERA
1444	DATE	131	140	23/4/1999	1999-04-23
1444	DATE	160	170	25/06/2063	2063-06-25
1444	DATE	337	345	8.7.2063	2063-07-08
1444	DEPARTMENT	191	201	Immunology
1444	HOSPITAL	202	231	PETER MACCALLUM CANCER CENTRE
1444	DOCTOR	2188	2190	EI
1444	DOCTOR	2192	2194	YY
1444	DATE	2198	2205	28.6.63	2063-06-28
1444	DOCTOR	235	260	Fern Tangela CYRIL-Flippo
1444	DOCTOR	2960	2962	ZF
1444	DATE	2966	2973	25.6.63	2063-06-25
1444	DOCTOR	3004	3010	E Bihm
1444	DOCTOR	5742	5752	E Headings
1444	DATE	5756	5764	8.7.2063	2063-07-08
1444	HOSPITAL	6422	6436	OAKEY HOSPITAL
1444	DOCTOR	6472	6480	E Asfour
1444	HOSPITAL	6515	6533	LIVERPOOL HOSPITAL
1444	IDNUM	14	24	13E155315T
1444	IDNUM	63	71	13E15531
1444	MEDICALRECORD	25	35	131155.JDP
1444	PATIENT	37	52	Meydid, WANDJOO
1444	PATIENT	72	78	Ellena
1444	STATE	91	99	Tasmania
1444	ZIP	101	105	2899
1482	CITY	84	90	MOONIE
1482	STATE	92	107	South Australia
1482	ZIP	109	113	6513
1482	CITY	84	90	MOONIE
1482	DATE	139	148	24/2/1999	1999-02-24
1482	DEPARTMENT	192	204	SEALSCentral
1482	HOSPITAL	207	246	FINLEY HOSPITAL & COMMUNITY HEALTH CARE
1482	DOCTOR	1345	1351	OLonny
1482	DOCTOR	1359	1367	O Streff
1482	TIME	1371	1389	9:50am on 10.11.63	2063-11-10T09:50
1482	DOCTOR	2492	2494	JL
1482	DATE	2498	2506	14.10.63	2063-10-14
1482	DOCTOR	250	268	DWIGHT DONNY Alwan
1482	DOCTOR	2537	2546	O Janocha
1482	IDNUM	14	24	55M357122P
1482	IDNUM	66	74	55M35712
1482	MEDICALRECORD	25	36	5543571.GGP
1482	PATIENT	38	55	AUSLANDER, Ramiro
1482	PATIENT	75	83	Pressley
1482	STATE	92	107	South Australia
1482	ZIP	109	113	6513
1535	CITY	75	85	CANNONVALE
1535	STATE	87	95	Tasmania
1535	ZIP	97	101	5603
1535	CITY	75	85	CANNONVALE
1535	DATE	127	135	5/3/1998	1998-03-05
1535	DATE	155	165	29/08/2063	2063-08-29
1535	DEPARTMENT	186	202	WEST GYNAECOLOGY
1535	HOSPITAL	203	245	TEXAS HOSPITAL MULTIPURPOSE HEALTH SERVICE
1535	DOCTOR	2243	2245	FC
1535	DOCTOR	2248	2250	UN
1535	DATE	2254	2261	29.8.63	2063-08-29
1535	DOCTOR	2294	2304	C Levander
1535	DOCTOR	249	269	Hollis Michel OZAINE
1535	DOCTOR	462	465	Ali
1535	IDNUM	14	24	02A124631X
1535	IDNUM	59	67	02A12463
1535	MEDICALRECORD	25	35	020124.QKD
1535	PATIENT	37	48	UMLAUF, ZAC
1535	PATIENT	68	74	Curren
1535	STATE	87	95	Tasmania
1535	ZIP	97	101	5603
1537	CITY	90	101	WARRNAMBOOL
1537	ZIP	105	109	0837
1537	CITY	90	101	WARRNAMBOOL
1537	DATE	144	154	15/11/2005	2005-11-15
1537	DATE	174	183	30/8/2063	2063-08-30
1537	DEPARTMENT	200	218	PERI-OPERATIVEUNIT
1537	HOSPITAL	219	261	CAMPBELL TOWN HEALTH AND COMMUNITY SERVICE
1537	DOCTOR	1058	1067	M Felsher
1537	TIME	1071	1089	1.26pm on 30.08.63	2063-08-30
1537	DOCTOR	2364	2366	RX
1537	DOCTOR	2369	2371	HD
1537	DATE	2374	2380	3.9.63	2063-09-03
1537	DOCTOR	2411	2419	M Pollan
1537	DOCTOR	265	284	FRED SERGIO Landing
1537	DOCTOR	338	341	Guy
1537	DOCTOR	487	494	M Leafe
1537	DATE	498	504	3/9/63	2063-09-03
1537	HOSPITAL	4493	4512	BEAUDESERT HOSPITAL
1537	DOCTOR	4548	4555	M Sardi
1537	IDNUM	14	24	13J477280Y
1537	IDNUM	4465	4471	24.963
1537	IDNUM	64	72	13J47728
1537	IDNUM	73	81	13J47728
1537	MEDICALRECORD	25	35	133477.FVB
1537	PATIENT	37	53	Clason, Napoleon
1537	STREET	82	89	Cedrela
1537	ZIP	105	109	0837
1618	CITY	208	214	PARKES
1618	CITY	80	85	DALBY
1618	STATE	87	115	Australian Capital Territory
1618	CITY	80	85	DALBY
1618	DATE	147	157	22/11/2002	2002-11-22
1618	DATE	177	187	06/12/2064	2064-12-06
1618	DATE	5232	5241	18/6/2064	2064-06-18
1618	DEPARTMENT	208	221	PARKES 7 EAST
1618	HOSPITAL	222	256	ST MARGARETS REHABILITATION CENTRE
1618	DOCTOR	270	287	JERRELL Wetherill
1618	DOCTOR	4019	4029	Z Rowlands
1618	DOCTOR	555	562	Charley
1618	TIME	616	620	2061	2061-10-2061
1618	IDNUM	14	24	97B564899D
1618	IDNUM	62	70	97B56489
1618	MEDICALRECORD	25	36	9705648.ZYD
1618	PATIENT	38	51	CADA, Sherman
1618	STATE	87	115	Australian Capital Territory
1618	STREET	71	79	Vernalis
1618	ZIP	117	121	2162
1618	ZIP	616	620	2061
1633	CITY	83	91	GRENFELL
1633	STATE	93	121	Australian Capital Territory
1633	ZIP	123	127	4360
1633	DATE	153	162	2/11/2011	2011-11-02
1633	DEPARTMENT	213	236	Molecular Oncology Unit
1633	HOSPITAL	237	270	KOOWEERUP REGIONAL HEALTH SERVICE
1633	DOCTOR	1141	1143	LK
1633	DOCTOR	1144	1146	SB
1633	DATE	1150	1157	18.7.64	2064-07-18
1633	DOCTOR	1188	1197	P Fairley
1633	DOCTOR	274	293	RENATO Teodoro Dett
1633	DOCTOR	888	904	ALEXANDER BREADY
1633	DOCTOR	911	923	Bert Druetta
1633	DOCTOR	931	947	WINSTON Broadway
1633	TIME	951	970	12:54pm on 17/07/64	2066-07-17T12:54
1633	IDNUM	14	24	59B367564K
1633	IDNUM	64	72	59B36756
1633	MEDICALRECORD	25	36	5903675.RLK
1633	PATIENT	47	53	JAMAAL
1633	STATE	93	121	Australian Capital Territory
1633	STREET	73	82	Lymerston
1633	TIME	182	192	17/07/2064	2064-07-17T08:33
1633	ZIP	123	127	4360
1919	CITY	81	91	GOLD COAST
1919	STATE	93	96	ACT
1919	ZIP	98	102	6403
1919	DATE	128	137	13/5/2009	2009-05-13
1919	DATE	157	167	30/12/2064	2064-12-30
1919	DATE	3435	3442	2/13/64	2064-02-13
1919	DEPARTMENT	188	202	ANTENATAL WARD
1919	HOSPITAL	203	222	GORDONVALE HOSPITAL
1919	DOCTOR	2169	2178	M Dallago
1919	DOCTOR	227	244	ASHLI Harold RONA
1919	DOCTOR	666	675	M. Rustad
1919	DATE	679	687	30/12/64	2064-12-30
1919	IDNUM	14	24	44C818722Q
1919	IDNUM	64	72	44C81872
1919	MEDICALRECORD	25	36	4408187.GFQ
1919	PATIENT	38	53	Distilo, BOOKER
1919	PATIENT	73	80	Yeomans
1919	STATE	3271	3274	ACT
1919	STATE	93	96	ACT
1919	ZIP	98	102	6403
1921	DATE	358	365	13.3.64	2064-03-13
1921	DATE	59	68	13/6/2064	2064-06-13
1921	DOCTOR	395	403	X Pradel
1921	IDNUM	35	43	86L01953
1921	IDNUM	702	710	86L01953
1921	MEDICALRECORD	2	13	8640195.JXN
1921	PATIENT	14	34	Ownes, ZAVIA EVERETT
1924	CITY	86	96	PARRAMATTA
1924	ZIP	100	104	2148
1924	CITY	86	96	PARRAMATTA
1924	DATE	130	139	10/1/1994	1994-01-10
1924	DEPARTMENT	190	195	SEALS
1924	HOSPITAL	196	214	LIVERPOOL HOSPITAL
1924	DOCTOR	218	238	KELLY TYREE HOLDERBY
1924	DOCTOR	2457	2459	XS
1924	DATE	2463	2470	18/8/64	2064-08-18
1924	DOCTOR	2504	2513	E Mahoney
1924	IDNUM	14	24	18R970906Q
1924	IDNUM	63	71	18R97090
1924	MEDICALRECORD	25	35	186970.YAR
1924	PATIENT	37	52	Barnick, Arlyne
1924	STREET	72	85	Chadwick Hall
1924	TIME	159	169	17/08/2064	2064-08-17T15:05
1924	ZIP	100	104	2148
1927	DATE	57	67	17/12/2064	2064-12-17
1927	DOCTOR	1085	1087	FO
1927	DOCTOR	1089	1091	UQ
1927	DATE	1095	1103	16.12.64	2064-12-16
1927	DOCTOR	1133	1143	O Embleton
1927	IDNUM	33	41	50Z17271
1927	MEDICALRECORD	2	13	5091727.CIM
1927	PATIENT	14	32	Batzri, Boyd-Milla
1932	DATE	58	68	22/12/2064	2064-12-22
1932	DOCTOR	557	559	QP
1932	DOCTOR	560	562	QO
1932	DATE	566	574	18.12.64	2064-12-18
1932	DOCTOR	605	612	L Rayes
1932	IDNUM	34	42	45A62297
1932	MEDICALRECORD	2	13	4506229.SDS
1932	PATIENT	14	33	Heckford, L GARLAND
1957	CITY	214	222	ADELAIDE
1957	CITY	4573	4580	SEYMOUR
1957	CITY	91	99	KINGSTON
1957	STATE	101	104	TAS
1957	ZIP	106	110	7151
1957	DATE	145	153	8/4/2000	2000-04-08
1957	DATE	173	183	14/10/2064	2064-10-14
1957	DATE	344	351	11/5/64	2064-05-11
1957	DATE	4484	4494	20/10/2064	2064-10-20
1957	DATE	5476	5483	11/6/64	2064-06-11
1957	DEPARTMENT	204	231	THE ROYAL ADELAIDE HOSPITAL
1957	DOCTOR	235	250	TAYLOR WARSAGER
1957	DOCTOR	269	275	HOWARD
1957	DOCTOR	280	287	TERENCE
1957	IDNUM	14	24	87J824788P
1957	IDNUM	61	69	87J82478
1957	IDNUM	70	78	87J82478
1957	MEDICALRECORD	25	35	873824.TVU
1957	ORGANIZATION	4600	4602	C8
1957	PATIENT	37	50	Sevey, Darryl
1957	STATE	101	104	TAS
1957	STREET	79	90	Trevor Toms
1957	ZIP	106	110	7151
1970	CITY	2477	2488	HEALESVILLE
1970	CITY	84	97	TENNANT CREEK
1970	STATE	99	114	New South Wales
1970	ZIP	116	120	1174
1970	CITY	84	97	TENNANT CREEK
1970	DATE	1410	1417	24.9.64	2064-09-24
1970	DATE	146	155	6/10/1999	1999-10-06
1970	DATE	175	185	26/09/2064	2064-09-26
1970	DATE	2408	2416	20.10.64	2064-10-20
1970	DEPARTMENT	206	218	SEALSCentral
1970	HOSPITAL	219	258	FINLEY HOSPITAL & COMMUNITY HEALTH CARE
1970	DOCTOR	1448	1455	T Heman
1970	DOCTOR	2443	2451	T Chubbs
1970	HOSPITAL	2477	2508	HEALESVILLE & DISTRICT HOSPITAL
1970	DOCTOR	262	278	REYES Janis ROME
1970	DOCTOR	2842	2859	OCTAVIO BURBRIDGE
1970	DATE	2861	2871	20/10/2064	2064-10-20
1970	IDNUM	14	24	72K364945V
1970	IDNUM	64	72	72K36494
1970	MEDICALRECORD	25	36	7243649.KPV
1970	PATIENT	38	53	SCARR, Patricia
1970	STATE	99	114	New South Wales
1970	STREET	73	83	New Castle
1970	ZIP	116	120	1174
1975	CITY	83	92	ESPERANCE
1975	STATE	94	102	Tasmania
1975	ZIP	104	108	2336
1975	DATE	134	142	8/4/2025	2025-04-08
1975	DATE	162	172	24/10/2064	2064-10-24
1975	DATE	2024	2031	22/3/65	2065-03-22
1975	DATE	317	324	22/3/65	2065-03-22
1975	DEPARTMENT	193	204	ACT Genetic
1975	HOSPITAL	205	228	MAITLAND HOSPITAL (NSW)
1975	DEPARTMENT	2743	2749	Exon 2
1975	DOCTOR	2078	2097	COLUMBUS A'Lavadera
1975	DOCTOR	232	250	Hung Romeo Brugman
1975	DOCTOR	292	298	Manuel
1975	DOCTOR	3102	3110	Bardelli
1975	DOCTOR	3113	3136	Siena J Clin Oncol 2010
1975	IDNUM	3137	3150	28: 1254-1261
1975	DOCTOR	4037	4047	Merchrisco
1975	DOCTOR	5342	5366	BENNIE A'Sirucek 2/13/64
1975	DOCTOR	881	883	RS
1975	DOCTOR	884	886	ZV
1975	DATE	890	898	27.10.64	2064-10-27
1975	DOCTOR	929	937	A Guziak
1975	DOCTOR	941	953	A Fullbright
1975	HOSPITAL	2222	2240	Cisco ST MARGARETS
1975	IDNUM	14	24	08K818448E
1975	IDNUM	4413	4418	T790M
1975	IDNUM	4439	4444	L861Q
1975	IDNUM	64	72	08K81844
1975	MEDICALRECORD	25	36	0838184.LWE
1975	PATIENT	38	53	RIEDLE, EDGARDO
1975	STATE	193	196	ACT
1975	STATE	2135	2138	ACT
1975	STATE	94	102	Tasmania
1975	STREET	73	82	Sharrotts
1975	ZIP	104	108	2336
1975	ZIP	2399	2403	2061
1977	CITY	98	107	TOM PRICE
1977	STATE	109	111	NT
1977	ZIP	113	117	5116
1977	CITY	98	107	TOM PRICE
1977	DATE	148	158	21/10/2006	2006-10-21
1977	DATE	178	188	18/09/2064	2064-09-18
1977	DATE	1805	1812	19/9/64	2064-09-19
1977	DEPARTMENT	209	212	ACT
1977	HOSPITAL	213	247	ST MARGARETS REHABILITATION CENTRE
1977	DOCTOR	1078	1083	Benny
1977	DOCTOR	1090	1097	N Perea
1977	DOCTOR	1105	1113	N Menton
1977	TIME	1117	1134	17:05 on 18/09/64	2064-09-18T17:05
1977	DOCTOR	1842	1849	N Esker
1977	DOCTOR	251	268	Len KELLY MAYESKI
1977	DOCTOR	788	791	Gus
1977	DOCTOR	815	830	N Baldassarreat
1977	TIME	831	848	17:05 on 18/09/64	2066-09-18T17:05
1977	IDNUM	14	24	50Y986952P
1977	IDNUM	1872	1880	50Y98695
1977	IDNUM	67	75	50Y98695
1977	IDNUM	76	84	50Y98695
1977	MEDICALRECORD	25	36	5099869.OGP
1977	PATIENT	38	56	GULLEDGE, Emil Guy
1977	STATE	109	111	NT
1977	STATE	209	212	ACT
1977	STATE	243	245	NT
1977	STREET	85	97	Potomac Club
1977	ZIP	113	117	5116
2000	CITY	87	95	WAIKERIE
2000	STATE	97	105	Victoria
2000	ZIP	107	111	4179
2000	CITY	87	95	WAIKERIE
2000	DATE	1079	1087	25.12.64	2064-12-25
2000	DATE	135	144	15/6/2007	2007-06-15
2000	DATE	164	174	24/12/2064	2064-12-24
2000	DEPARTMENT	191	207	WEST GYNAECOLOGY
2000	HOSPITAL	210	236	THE ROYAL WOMEN'S HOSPITAL
2000	DOCTOR	1121	1130	X Cirillo
2000	DOCTOR	240	261	Leigh KARRAK UCHIMURA
2000	IDNUM	14	24	92G188669L
2000	IDNUM	68	76	92G18866
2000	MEDICALRECORD	25	36	9221886.RXL
2000	PATIENT	37	58	Saturday, TABBY ANTON
2000	STATE	97	105	Victoria
2000	STREET	77	86	Appamatox
2000	ZIP	107	111	4179
2003	CITY	84	90	MOONIE
2003	STATE	92	100	Tasmania
2003	ZIP	102	106	6446
2003	CITY	84	90	MOONIE
2003	DATE	1288	1296	10.11.64	2064-11-10
2003	DATE	132	141	12/2/1986	1986-12-02
2003	DATE	361	368	21/1/64	2064-01-21
2003	DEPARTMENT	192	206	ANTENATAL WARD
2003	HOSPITAL	207	237	PORTLAND TABULAM HEALTH CENTRE
2003	DOCTOR	1328	1337	A Lebaron
2003	DOCTOR	240	258	JOSH Rosendo Amack
2003	DOCTOR	277	291	ISIAH Allinger
2003	IDNUM	14	24	08Z2298851
2003	IDNUM	66	74	08Z22988
2003	MEDICALRECORD	25	36	0892298.VOC
2003	PATIENT	38	55	Blackwell, NEWTON
2003	STATE	92	100	Tasmania
2003	STREET	75	83	Blueford
2003	TIME	161	171	07/11/2064	2064-11-07T14:23
2003	ZIP	102	106	6446
2030	CITY	89	99	TURA BEACH
2030	STATE	101	111	Queensland
2030	ZIP	113	117	1730
2030	DATE	143	153	21/10/1992	1992-10-21
2030	DATE	173	183	08/03/2065	2065-03-08
2030	DEPARTMENT	204	219	DAY SURGERYUNIT
2030	HOSPITAL	220	243	SWAN DISTRICTS HOSPITAL
2030	DOCTOR	2051	2059	K Cubias
2030	DOCTOR	2075	2086	K Shurtliff
2030	DOCTOR	247	262	CHAS Wierzbicki
2030	IDNUM	14	24	40H421592Z
2030	IDNUM	72	80	40H42159
2030	MEDICALRECORD	25	36	4034215.XFZ
2030	PATIENT	38	61	Stassen, Dwayne Richard
2030	PATIENT	81	88	Trubody
2030	STATE	101	111	Queensland
2030	ZIP	113	117	1730
2070	CITY	235	244	NEWCASTLE
2070	CITY	2436	2444	CESSNOCK
2070	CITY	97	106	MITTAGONG
2070	STATE	108	110	NT
2070	ZIP	112	116	1360
2070	CITY	97	106	MITTAGONG
2070	DATE	142	151	21/2/2011	2011-02-21
2070	DATE	171	181	21/12/2064	2064-12-21
2070	DATE	2403	2410	25.1.65	2065-01-25
2070	DATE	328	335	25.1.65	2065-01-25
2070	DEPARTMENT	198	207	Anat Path
2070	DOCTOR	1222	1224	UD
2070	DATE	1231	1239	22.12.64	2064-12-22
2070	DOCTOR	1404	1406	FZ
2070	DOCTOR	1408	1410	DI
2070	DATE	1414	1422	22.12.64	2064-12-22
2070	DOCTOR	1452	1464	R R Borkoski
2070	DOCTOR	2132	2139	R Doshi
2070	DOCTOR	255	268	PAT KRIS EANS
2070	DOCTOR	2807	2815	R Mccamy
2070	DOCTOR	693	700	R Butac
2070	TIME	704	722	6:40pm on 21.12.64	2064-12-21T6:40
2070	DOCTOR	1030	1038	R Gariti
2070	TIME	1042	1060	7:05pm on 21.12.64	2064-12-21T7:05
2070	HOSPITAL	2222	2246	WILCANNIA HEALTH SERVICE
2070	HOSPITAL	2436	2462	CESSNOCK DISTRICT HOSPITAL
2070	IDNUM	13	23	62N392959C
2070	IDNUM	74	82	62N39295
2070	MEDICALRECORD	24	35	6253929.OZC
2070	PATIENT	37	45	Saracino
2070	DOCTOR	47	63	KENZIE Johnathan
2070	STATE	108	110	NT
2070	STATE	215	217	NT
2070	STATE	2389	2391	NT
2070	STATE	247	249	NT
2070	STATE	314	316	NT
2070	STREET	83	96	Little Marlow
2070	ZIP	112	116	1360
2071	CITY	94	107	VICTOR HARBOR
2071	STATE	109	137	Australian Capital Territory
2071	ZIP	139	143	5045
2071	DATE	178	187	11/3/1985	1985-11-03
2071	DATE	207	216	2/12/2064	2064-12-02
2071	DATE	3457	3464	25.1.65	2065-01-25
2071	DATE	358	365	25.1.65	2065-01-25
2071	DEPARTMENT	233	254	DOMAIN AGED CARE RM 2
2071	HOSPITAL	257	275	ESPERANCE HOSPITAL
2071	DOCTOR	2164	2169	Kilts
2071	DATE	2181	2188	3.12.64	2064-03-12
2071	DOCTOR	2218	2228	K Mackaman
2071	DOCTOR	279	298	Clarence Alton PETO
2071	IDNUM	14	24	41B913966W
2071	IDNUM	61	69	41B91396
2071	IDNUM	70	78	41B91396
2071	MEDICALRECORD	25	36	4109139.RQW
2071	PATIENT	38	50	JEHL, Jospeh
2071	STATE	109	137	Australian Capital Territory
2071	STREET	79	93	Winnington Old
2071	ZIP	139	143	5045
2072	CITY	86	92	MOONIE
2072	STATE	94	104	Queensland
2072	ZIP	106	110	6392
2072	CITY	86	92	MOONIE
2072	DATE	136	146	21/10/2015	2015-10-21
2072	DATE	166	176	16/12/2064	2064-12-16
2072	DATE	2128	2137	21/8/2063	2063-08-21
2072	DATE	3160	3168	19/12/64	2064-12-19
2072	DOCTOR	236	258	Iva FRANCISCO QUARESMA
2072	DOCTOR	277	280	Ali
2072	IDNUM	14	24	10O635882Q
2072	IDNUM	65	73	10O63588
2072	MEDICALRECORD	25	36	1056358.VHQ
2072	PATIENT	38	54	NACHMIAS, THERON
2072	STATE	94	104	Queensland
2072	STREET	74	85	The Sraight
2072	ZIP	106	110	6392
2073	CITY	191	197	BOWRAL
2073	CITY	82	88	MUDGEE
2073	STATE	90	93	ACT
2073	ZIP	95	99	3058
2073	DATE	125	134	27/4/2008	2008-04-27
2073	DATE	154	164	19/04/2065	2065-04-19
2073	DATE	5881	5890	26.4.2065	2065-04-26
2073	DEPARTMENT	185	190	SWAPS
2073	HOSPITAL	191	206	BOWRAL HOSPITAL
2073	DOCTOR	211	228	Lael HIRAM Zmolek
2073	DOCTOR	3319	3328	O Kalisch
2073	IDNUM	13	23	52X837699M
2073	IDNUM	65	73	52X83769
2073	MEDICALRECORD	24	35	5298376.XZM
2073	PATIENT	37	54	Colantuono, Daron
2073	PATIENT	74	81	Harrell
2073	STATE	90	93	ACT
2073	ZIP	95	99	3058
2074	CITY	84	95	TWEED HEADS
2074	STATE	97	100	QLD
2074	ZIP	102	106	2173
2074	CITY	84	95	TWEED HEADS
2074	DATE	132	141	13/7/2014	2014-07-13
2074	DATE	161	171	04/03/2065	2065-03-04
2074	DEPARTMENT	192	209	ST GEORGE PRIVATE
2074	HOSPITAL	210	228	CARNARVON HOSPITAL
2074	DOCTOR	1980	1987	M Somma
2074	DOCTOR	233	251	KYOKO BRICE NORALS
2074	IDNUM	14	24	46Y387857S
2074	IDNUM	2958	2965	46Y3878
2074	IDNUM	63	71	46Y38785
2074	MEDICALRECORD	25	36	4693878.NTS
2074	PATIENT	38	52	GRAVITT, Merri
2074	STATE	97	100	QLD
2074	STREET	72	83	East Fosket
2074	ZIP	102	106	2173
2075	DATE	55	63	4/5/2065	2065-05-04
2075	DOCTOR	891	902	F. Ballmann
2075	IDNUM	31	39	25L90986
2075	MEDICALRECORD	2	13	2549098.RKM
2075	PATIENT	13	27	WEEN, Giuseppe
2076	CITY	77	83	CAIRNS
2076	STATE	85	100	South Australia
2076	ZIP	102	106	6059
2076	CITY	77	83	CAIRNS
2076	DATE	132	141	24/2/2005	2005-02-24
2076	DEPARTMENT	192	210	Molecular Oncology
2076	DOCTOR	1267	1276	E Chumley
2076	DOCTOR	1284	1291	E Emert
2076	DOCTOR	253	272	Sergio Phung STEELY
2076	DOCTOR	291	297	Kelvin
2076	DOCTOR	302	306	Saul
2076	IDNUM	13	23	15Q221638R
2076	IDNUM	61	69	15Q22163
2076	MEDICALRECORD	24	34	156221.RIX
2076	PATIENT	36	50	PARZYCH, ELLIS
2076	PATIENT	70	76	Donora
2076	STATE	85	100	South Australia
2076	TIME	161	180	02/06/2065 at 10:40	2065-06-02T10:40
2076	ZIP	102	106	6059
2077	CITY	1829	1834	YOUNG
2077	CITY	87	98	CHARLEVILLE
2077	STATE	100	118	Northern Territory
2077	ZIP	120	124	2832
2077	DATE	150	159	5/12/1991	1991-05-12
2077	DATE	2143	2150	25.1.65	2065-01-25
2077	DATE	309	316	25.1.65	2065-01-25
2077	DATE	883	891	07.01.65	2065-01-07
2077	DEPARTMENT	210	229	PERI-OPERATIVE UNIT
2077	HOSPITAL	230	244	OAKEY HOSPITAL
2077	DOCTOR	1114	1123	C Bibbins
2077	DOCTOR	248	270	Evelyn Myrtie RUDESILL
2077	DOCTOR	2543	2551	C Dishaw
2077	DOCTOR	826	835	C Dipaolo
2077	DOCTOR	840	851	C Schaffert
2077	DOCTOR	826	827	C
2077	DOCTOR	840	841	C
2077	DOCTOR	859	860	C
2077	HOSPITAL	2176	2197	ONSLOW HEALTH SERVICE
2077	IDNUM	13	23	00R662996X
2077	IDNUM	71	79	00R66299
2077	MEDICALRECORD	24	35	0066629.YRX
2077	PATIENT	37	60	ZINGER, IRA Eric MATHEW
2077	STATE	100	118	Northern Territory
2077	STREET	80	86	Elkins
2077	TIME	179	198	07/01/2065 at 10:10	2065-01-07T10:10
2077	ZIP	120	124	2832
2078	DATE	2658	2665	22/1/65	2065-01-22
2078	DATE	53	62	22/1/2065	2065-01-22
2078	DOCTOR	1181	1191	V. Koinzan
2078	DOCTOR	439	449	V. Forslin
2078	DATE	453	460	15.1.65	2065-01-15
2078	IDNUM	29	37	89F39480
2078	MEDICALRECORD	2	13	8923948.CIR
2078	PATIENT	14	28	GOETTLE, RONNY
2079	CITY	208	213	JUNEE
2079	CITY	80	95	GREENWELL POINT
2079	STATE	97	99	WA
2079	ZIP	101	105	5522
2079	CITY	80	95	GREENWELL POINT
2079	DATE	131	141	15/10/2018	2018-10-15
2079	DEPARTMENT	185	207	St Vincent's Pathology
2079	HOSPITAL	208	235	JUNEE MULTI PURPOSE SERVICE
2079	DOCTOR	2016	2026	F Rumbaugh
2079	DOCTOR	239	261	Lincoln OTTO Sundquist
2079	IDNUM	13	23	21O595610N
2079	IDNUM	63	71	21O59561
2079	MEDICALRECORD	24	35	2155956.EAN
2079	PATIENT	37	52	Grimlie, Sherri
2079	PATIENT	72	79	Bestick
2079	STATE	97	99	WA
2079	ZIP	101	105	5522
2080	CITY	99	106	FORSTER
2080	STATE	108	136	Australian Capital Territory
2080	ZIP	138	142	2474
2080	CITY	99	106	FORSTER
2080	DATE	174	182	4/6/2000	2000-06-04
2080	DATE	202	210	8/3/2065	2065-08-03
2080	DEPARTMENT	227	236	Anat Path
2080	HOSPITAL	239	267	BINGARA MULTIPURPOSE SERVICE
2080	DOCTOR	1311	1323	DEBRAH MANZI
2080	DOCTOR	1331	1339	D Probst
2080	TIME	1343	1361	5:03pm on 08.03.65	65-03-08T05:03
2080	DOCTOR	2452	2463	D Remington
2080	DOCTOR	2470	2478	D Sobrio
2080	TIME	2482	2500	6:01pm on 08.03.65	65-03-08T06:01
2080	DOCTOR	271	292	Tanner Augustine OTIZ
2080	DOCTOR	2814	2816	IC
2080	DOCTOR	2818	2820	HG
2080	DATE	2824	2830	9.3.64	2064-03-09
2080	DOCTOR	2861	2869	D Anthis
2080	IDNUM	14	24	16P036878T
2080	IDNUM	73	81	16P03687
2080	IDNUM	82	90	16P03687
2080	MEDICALRECORD	25	36	1650368.UUT
2080	PATIENT	38	62	SHERWIN, Patrice Djarrun
2080	PATIENT	91	98	Sackett
2080	STATE	108	136	Australian Capital Territory
2080	ZIP	138	142	2474
2081	CITY	82	95	BACCHUS MARSH
2081	STATE	97	114	Western Australia
2081	ZIP	116	120	2115
2081	CITY	82	95	BACCHUS MARSH
2081	DATE	146	155	24/5/2009	2009-05-24
2081	DATE	175	185	12/12/2064	2064-12-12
2081	DEPARTMENT	206	219	EAST SURGICAL
2081	HOSPITAL	220	249	CALVARY HEALTH CARE BETHLEHEM
2081	DOCTOR	253	274	SAUL Teresa BETSCHMAN
2081	DOCTOR	3918	3920	RO
2081	DATE	3924	3932	12/12/64	2064-12-12
2081	DOCTOR	3967	3974	N Taula
2081	DOCTOR	3990	3998	N Gorham
2081	DOCTOR	498	504	Ersery
2081	TIME	508	516	16/12/64	2064-12-16T15:00
2081	IDNUM	13	23	58X238684Q
2081	IDNUM	65	73	58X23868
2081	MEDICALRECORD	24	35	5892386.XMQ
2081	PATIENT	37	54	Mosbarger, TAYLOR
2081	PATIENT	74	81	Serrano
2081	STATE	97	114	Western Australia
2081	ZIP	116	120	2115
2082	CITY	3988	3997	NEWCASTLE
2082	CITY	88	94	BAXTER
2082	STATE	96	114	Northern Territory
2082	ZIP	114	118	3076
2082	DATE	144	153	29/9/1980	1980-09-29
2082	DATE	173	183	25/12/2064	2064-12-25
2082	DATE	2263	2271	26.12.64	2064-12-26
2082	DEPARTMENT	200	219	PERI-OPERATIVE UNIT
2082	DOCTOR	238	261	LOWELL Eila SYNDERGAARD
2082	DOCTOR	2468	2470	OJ
2082	TIME	2478	2486	30.12.64	2064-12-30
2082	DOCTOR	2518	2526	L Eddens
2082	DOCTOR	902	911	L Gabossi
2082	TIME	915	933	3:05pm on 25/12/64	2064-12-25T15:05
2082	IDNUM	13	23	42Y678842W
2082	IDNUM	68	76	42Y67884
2082	MEDICALRECORD	24	34	429678.WMG
2082	ORGANIZATION	3954	3972	Lennar Corporation
2082	HOSPITAL	3974	3997	CALVARY MATER NEWCASTLE
2082	PATIENT	36	57	EKAS, Dominick GROVER
2082	STREET	77	87	Triphammer
2083	CITY	2998	3010	MUSWELLBROOK
2083	CITY	82	91	DELORAINE
2083	STATE	93	108	New South Wales
2083	ZIP	110	114	4858
2083	DATE	140	150	26/10/2013	2013-10-26
2083	DATE	170	178	2/6/2065	2065-06-02
2083	DATE	360	367	29/4/65	2065-04-29
2083	DEPARTMENT	195	217	Southern IML Pathology
2083	DOCTOR	1072	1080	K Grigas
2083	DOCTOR	1096	1103	Linwood
2083	DOCTOR	1110	1125	GUADALUPE DOLLE
2083	TIME	1129	1149	3:35pm on 02.06.2065	2065-06-02T15:35
2083	DOCTOR	1203	1213	K Carkhuff
2083	DOCTOR	1217	1222	K Pry
2083	DOCTOR	221	241	Millard DIGNA MCSHAW
2083	DOCTOR	2988	2994	Arties
2083	HOSPITAL	2998	3019	MUSWELLBROOK HOSPITAL
2083	IDNUM	14	24	40S010255A
2083	IDNUM	60	68	40S01025
2083	MEDICALRECORD	25	35	407010.FNN
2083	PATIENT	37	49	BOULDS, SANG
2083	STATE	93	108	New South Wales
2083	STREET	69	81	W Park Place
2083	ZIP	110	114	4858
2084	CITY	208	218	DENILIQUIN
2084	CITY	85	100	MOUNT GAMBIERWA
2084	ZIP	102	106	3915
2084	DATE	132	141	24/2/1980	1980-02-24
2084	DATE	161	171	22/03/2064	2064-03-22
2084	DATE	3478	3485	23/3/64	2064-03-23
2084	DEPARTMENT	192	207	DAY SURGERYUNIT
2084	DOCTOR	231	254	ELISHA WINSTON Matusiak
2084	DOCTOR	273	278	Jonas
2084	DOCTOR	3518	3524	C Edie
2084	IDNUM	13	23	06N7410278
2084	IDNUM	64	72	06N74102
2084	MEDICALRECORD	24	35	0657410.GSW
2084	PATIENT	37	53	Mielcarek, RAYNA
2084	STREET	73	84	Barlborough
2084	ZIP	102	106	3915
2085	DATE	61	70	21/4/2064	2064-04-21
2085	DOCTOR	826	828	ZV
2085	DOCTOR	829	831	RO
2085	DATE	835	842	16.4.64	2064-04-16
2085	DOCTOR	873	882	M Cadavid
2085	IDNUM	37	45	48W04283
2085	MEDICALRECORD	1	12	4880428.IJS
2085	PATIENT	13	36	Schmeisser, HORACE TORY
2086	CITY	86	91	EUROA
2086	STATE	93	108	New South Wales
2086	CITY	86	91	EUROA
2086	DATE	140	148	9/8/1987	1987-09-08
2086	DATE	168	178	17/01/2064	2064-01-17
2086	DEPARTMENT	198	206	Southern
2086	HOSPITAL	207	225	MONA VALE HOSPITAL
2086	DOCTOR	1488	1490	MK
2086	DATE	1494	1501	17/1/64	2064-01-17
2086	DOCTOR	1532	1542	K Lainhart
2086	DOCTOR	229	242	DONOVAN Maura
2086	IDNUM	14	24	43X483091Y
2086	IDNUM	61	69	43X48309
2086	MEDICALRECORD	25	36	4384830.YEY
2086	PATIENT	38	50	BALWIN, Leon
2086	STATE	93	108	New South Wales
2086	STREET	70	85	South Dickenson
2086	ZIP	110	114	2203
2087	DATE	53	62	28/8/2064	2064-08-28
2087	DATE	728	735	25.8.64	2064-08-25
2087	DOCTOR	767	774	Z Insco
2087	IDNUM	1288	1296	96X38676
2087	IDNUM	29	37	96X38676
2087	MEDICALRECORD	1	12	9683867.PRG
2087	PATIENT	13	28	Vajda, BIRRUNGA
2088	CITY	110	117	MAREEBA
2088	STATE	119	122	ACT
2088	ZIP	124	128	5470
2088	CITY	110	117	MAREEBA
2088	DATE	154	162	1/8/1999	1999-01-08
2088	DATE	182	191	13/8/2064	2064-08-13
2088	DATE	1859	1866	14.8.64	2064-08-14
2088	DEPARTMENT	208	213	PaLMS
2088	HOSPITAL	214	231	NARROGIN HOSPITAL
2088	DOCTOR	1899	1906	X Reels
2088	DOCTOR	1910	1917	X Grass
2088	DOCTOR	235	256	SIDNEY Anton FRATRICK
2088	DOCTOR	955	957	RS
2088	DATE	961	968	19/8/64	2064-08-19
2088	IDNUM	13	23	81Y736924M
2088	IDNUM	73	81	81Y73692
2088	MEDICALRECORD	24	34	819736.YFM
2088	PATIENT	36	62	GUILLEREAULT, Dong Sherell
2088	STATE	119	122	ACT
2088	ZIP	124	128	5470
2089	CITY	75	82	FORSTER
2089	STATE	84	87	ACT
2089	ZIP	89	93	3795
2089	CITY	75	82	FORSTER
2089	DATE	119	128	29/3/2028	2028-03-29
2089	DATE	148	156	5/8/2064	2064-05-08
2089	DEPARTMENT	173	178	PaLMS
2089	DOCTOR	219	243	Marcelo DOUGLAS MOOBERRY
2089	DOCTOR	2341	2351	H Welshans
2089	IDNUM	14	24	23G938731I
2089	IDNUM	61	69	23G93873
2089	MEDICALRECORD	25	36	2329387.IDI
2089	ORGANIZATION	3413	3436	Energy East Corporation
2089	HOSPITAL	3438	3457	CHINCHILLA HOSPITAL
2089	PATIENT	38	50	HOVE, MICKEY
2089	PATIENT	70	74	Manx
2089	STATE	84	87	ACT
2089	ZIP	89	93	3795
2090	DATE	52	61	13/2/2065	2065-02-13
2090	DOCTOR	390	402	F. Aramboles
2090	IDNUM	1045	1053	27H47999
2090	IDNUM	28	36	27H47999
2090	MEDICALRECORD	1	12	2734799.XYO
2090	PATIENT	13	27	LORENTZ, Rhett
2091	CITY	84	92	MARCOOLA
2091	STATE	94	96	NT
2091	ZIP	98	102	6754
2091	DATE	128	138	16/11/1975	1975-11-16
2091	DATE	158	168	15/12/2064	2064-12-15
2091	DATE	2470	2478	16.12.64	2064-12-16
2091	DEPARTMENT	185	203	105 HAMRUN CIRCUIT
2091	HOSPITAL	204	222	ESPERANCE HOSPITAL
2091	DOCTOR	226	254	RAYMUNDO Benedict Arnsberger
2091	DOCTOR	2510	2519	P Dufrane
2091	DOCTOR	4892	4901	P Ushioda
2091	IDNUM	14	24	59Q670706L
2091	IDNUM	4195	4203	59Q67070
2091	IDNUM	60	68	59Q67070
2091	MEDICALRECORD	25	36	5966707.APL
2091	PATIENT	38	49	BRISTO, ZAC
2091	PATIENT	69	83	Palmetto Dunes
2091	STATE	94	96	NT
2091	ZIP	98	102	6754
2092	DATE	50	60	30/12/2063	2063-12-30
2092	DOCTOR	580	582	KM
2092	DATE	586	594	26.12.63	2063-12-26
2092	DOCTOR	629	638	N Mackney
2092	IDNUM	26	34	54R11196
2092	MEDICALRECORD	1	11	546111.ZQK
2092	PATIENT	12	25	Brach, Erin N
2093	CITY	89	99	BEAUDESERT
2093	STATE	101	103	SA
2093	ZIP	105	109	3736
2093	DATE	135	143	1/5/2033	2033-01-01
2093	DATE	163	173	10/10/2064	2064-10-10
2093	DATE	2514	2522	13.10.64	2064-10-13
2093	DEPARTMENT	194	207	EAST SURGICAL
2093	HOSPITAL	208	260	PORT BROUGHTON DISTRICT HOSPITAL AND HEALTH SERVICES
2093	DOCTOR	2554	2563	X Slinger
2093	DOCTOR	264	288	DOMINIQUE CLEMENTE Rudge
2093	IDNUM	13	23	86A313770N
2093	IDNUM	71	79	86A31377
2093	MEDICALRECORD	24	35	8603137.TBN
2093	PATIENT	37	60	Marello, Norbert KELVIN
2093	PATIENT	80	88	Alelanto
2093	STATE	101	103	SA
2093	ZIP	105	109	3736
2094	DATE	52	61	6/11/2065	2065-06-11
2094	DOCTOR	519	527	Q Steube
2094	IDNUM	28	36	81B86393
2094	MEDICALRECORD	2	12	810863.ZIW
2094	PATIENT	13	27	MURLEY, Shiori
2096	CITY	80	86	TATHRA
2096	STATE	88	98	Queensland
2096	ZIP	100	104	2817
2096	DATE	1219	1226	18.5.65	2065-05-18
2096	DATE	130	139	2/11/1997	1997-11-02
2096	DATE	159	169	15/05/2065	2065-05-15
2096	DEPARTMENT	190	200	Immunology
2096	HOSPITAL	201	222	MOUNT DRUITT HOSPITAL
2096	DOCTOR	1258	1267	F Pacquin
2096	DOCTOR	226	247	EUGENIO Sherwood Lain
2096	DOCTOR	266	279	Donald Zenner
2096	IDNUM	13	23	13K065745Q
2096	IDNUM	64	72	13K06574
2096	MEDICALRECORD	24	35	1330657.LNQ
2096	PATIENT	37	53	OCKMOND, Stanton
2096	PATIENT	73	79	Giusti
2096	STATE	88	98	Queensland
2096	ZIP	100	104	2817
2097	CITY	92	103	TWEED HEADS
2097	STATE	105	113	Victoria
2097	ZIP	115	119	1481
2097	CITY	92	103	TWEED HEADS
2097	DATE	145	155	23/10/1994	1994-10-23
2097	DATE	1493	1500	22.4.65	2065-04-22
2097	DATE	175	185	21/04/2065	2065-04-21
2097	DEPARTMENT	206	211	Seals
2097	HOSPITAL	212	239	JOYCE PALMER HEALTH SERVICE
2097	DOCTOR	1530	1539	C Sitsler
2097	DOCTOR	243	262	Harlan VELLA Topete
2097	IDNUM	13	23	18K406903W
2097	IDNUM	69	77	18K40690
2097	MEDICALRECORD	24	35	1844069.BIW
2097	PATIENT	37	58	Balderrama, Guillermo
2097	STATE	105	113	Victoria
2097	STREET	78	91	Meeting House
2097	ZIP	115	119	1481
2098	CITY	84	89	PERTH
2098	STATE	91	94	ACT
2098	ZIP	96	100	6159
2098	CITY	84	89	PERTH
2098	DATE	126	135	19/2/1991	1991-02-19
2098	DATE	152	162	30/12/2064	2064-12-30
2098	DEPARTMENT	179	182	ACT
2098	HOSPITAL	185	212	MANSFIELD DISTRICT HOSPITAL
2098	DOCTOR	216	236	GIOVANNI Sam ASTORGA
2098	DOCTOR	2410	2414	Sink
2098	DOCTOR	2415	2419	Ruic
2098	TIME	2423	2430	13.1.64	2064-01-13
2098	DOCTOR	2464	2471	N Bogar
2098	DOCTOR	651	658	Theatre
2098	DOCTOR	665	676	N Benimadho
2098	TIME	680	699	10:00am on 30.12.64	2064-12-30T10:00
2098	IDNUM	14	24	50T707710S
2098	IDNUM	66	74	50T70771
2098	MEDICALRECORD	25	36	5077077.EAS
2098	PATIENT	38	55	Wegleitner, LOUIE
2098	STATE	179	182	ACT
2098	STATE	91	94	ACT
2098	STREET	75	83	McMillan
2098	ZIP	96	100	6159
2099	ZIP	104	108	2891
2099	DATE	134	142	8/9/1998	1998-08-09
2099	DATE	162	172	02/13/2064	2064-03-02
2099	DEPARTMENT	192	205	MACQUARIEWARD
2099	DOCTOR	224	247	Marlene Barton CHAMBLEY
2099	DOCTOR	2422	2433	B Tarangelo
2099	DOCTOR	764	774	B Osmanski
2099	IDNUM	13	23	08P728878B
2099	IDNUM	59	67	08P72887
2099	MEDICALRECORD	24	34	086728.VTV
2099	PATIENT	36	49	ARAB, Charlie
2099	PATIENT	68	79	David Scott
2099	ZIP	104	108	2891
2100	CITY	189	194	YOUNG
2100	CITY	83	92	RIVERVIEW
2100	STATE	94	97	VIC
2100	ZIP	99	103	3093
2100	CITY	83	92	RIVERVIEW
2100	DATE	129	137	3/1/2021	2021-01-03
2100	DATE	2410	2418	25/12/64	2064-12-25
2100	DEPARTMENT	185	188	DHM
2100	HOSPITAL	189	212	YOUNG DISTRICT HOSPITAL
2100	DOCTOR	1506	1517	Z Larranaga
2100	DOCTOR	217	238	IESHA Cristobal KOREN
2100	IDNUM	14	24	92Q179036H
2100	IDNUM	61	69	92Q17903
2100	MEDICALRECORD	25	36	9261790.IPH
2100	PATIENT	38	50	SABINE, Mary
2100	STATE	94	97	VIC
2100	STREET	70	82	Dawn Heather
2100	ZIP	99	103	3093
2101	CITY	104	110	WILTON
2101	STATE	112	140	Australian Capital Territory
2101	ZIP	142	146	6124
2101	CITY	104	110	WILTON
2101	DATE	178	187	20/5/2007	2007-05-20
2101	DATE	207	217	25/11/2064	2064-11-25
2101	DATE	3643	3651	26.11.64	2064-11-26
2101	DEPARTMENT	234	243	StVincent
2101	HOSPITAL	246	262	MODBURY HOSPITAL
2101	DOCTOR	266	285	LINWOOD Andy SLAGHT
2101	DOCTOR	3715	3721	Jasper
2101	DOCTOR	3728	3740	Elton Gugino
2101	TIME	3744	3763	1515h on 25/11/2064	2064-11-25T15:00
2101	DOCTOR	3820	3826	Kelvin
2101	DOCTOR	3833	3843	WILSON Pol
2101	TIME	3847	3866	1542h on 25/11/2064	2064-11-25T15:00
2101	DOCTOR	3904	3909	Anton
2101	DOCTOR	3916	3927	JAIME Kalka
2101	TIME	3931	3950	1542h on 25/11/2064	2064-11-25T15:00
2101	DOCTOR	3982	3990	J Modlin
2101	IDNUM	13	23	34Z471842D
2101	IDNUM	71	79	34Z47184
2101	IDNUM	80	88	34Z47184
2101	MEDICALRECORD	24	35	3494718.LHD
2101	PATIENT	37	60	Palilla, Newton Zachery
2101	STATE	112	140	Australian Capital Territory
2101	STREET	89	103	South Avondale
2101	ZIP	142	146	6124
2102	CITY	89	99	CRANBOURNE
2102	STATE	101	109	Tasmania
2102	ZIP	111	115	7330
2102	DATE	149	158	26/8/2014	2014-08-26
2102	DATE	2979	2986	17/2/65	2065-02-17
2102	DATE	3853	3860	24/2/65	2065-02-24
2102	DEPARTMENT	209	227	PERI-OPERATIVEUNIT
2102	HOSPITAL	228	265	LAKE CARGELLIGO MULTI PURPOSE SERVICE
2102	DOCTOR	2029	2037	H Weintz
2102	DOCTOR	269	284	Wilfredo Carchi
2102	IDNUM	13	23	29A811000J
2102	IDNUM	64	72	29A81100
2102	IDNUM	73	81	29A81100
2102	MEDICALRECORD	24	35	2908110.BBJ
2102	ORGANIZATION	3043	3111	The PNC Financial TRESILLIAN FAMILY CARE CENTRE - WOLLSTONECRAFT Lab
2102	PATIENT	37	53	BOEHLAR, Brandie
2102	PATIENT	82	88	Gulton
2102	STATE	101	109	Tasmania
2102	TIME	178	188	11/02/2065	2065-02-11T13:45
2102	ZIP	111	115	7330
2103	DATE	53	62	13/8/2064	2064-08-13
2103	DATE	904	911	13.3.64	2064-03-13
2103	DOCTOR	943	951	R Chiras
2103	IDNUM	29	37	61J11381
2103	MEDICALRECORD	2	13	6131138.ETG
2103	PATIENT	14	28	Kapaun, Tanner
2104	CITY	233	242	SINGLETON
2104	CITY	3602	3608	CAMDEN
2104	CITY	87	97	GOLD COAST
2104	STATE	99	116	Western Australia
2104	ZIP	118	122	5050
2104	DATE	148	158	28/12/1991	1991-12-28
2104	DATE	1636	1643	29.5.65	2065-05-29
2104	DATE	178	188	28/05/2065	2065-05-28
2104	DEPARTMENT	209	232	Molecular Oncology Unit
2104	DOCTOR	1755	1763	Brownlee
2104	DOCTOR	1781	1788	O Schor
2104	TIME	1792	1810	3:55pm on 28.05.65	65-05-28T15:55
2104	DOCTOR	1842	1848	O Leys
2104	DOCTOR	264	286	Andy JOSETTE Brancanto
2104	IDNUM	13	23	56K554075M
2104	IDNUM	68	76	56K55407
2104	MEDICALRECORD	24	35	5635540.TOM
2104	ORGANIZATION	3584	3600	General Dynamics
2104	HOSPITAL	3602	3617	CAMDEN HOSPITAL
2104	ORGANIZATION	4479	4487	SunTrust
2104	HOSPITAL	4489	4522	MONASH HEALTH WOMEN'S SANDRINGHAM
2104	PATIENT	37	57	HADSELL, ISIAH Clint
2104	STATE	99	116	Western Australia
2104	STREET	77	86	Gorsewood
2104	ZIP	118	122	5050
2105	DATE	54	63	22/6/2065	2065-06-22
2105	DATE	718	725	17.6.65	2065-06-17
2105	DOCTOR	756	768	Z Moorehouse
2105	DOCTOR	772	783	Z Schemonia
2105	IDNUM	30	38	98T75588
2105	MEDICALRECORD	1	11	987755.VWF
2105	PATIENT	12	29	Baranski, BREANNE
2106	CITY	89	101	DODGES FERRY
2106	STATE	103	106	ACT
2106	ZIP	108	112	6514
2106	CITY	89	101	DODGES FERRY
2106	DATE	138	146	4/3/1993	1993-03-04
2106	DATE	1523	1530	17.6.65	2065-06-17
2106	DATE	166	176	16/06/2065	2065-06-16
2106	DEPARTMENT	197	214	ACUTE STROKE UNIT
2106	DOCTOR	1560	1569	W Callais
2106	DOCTOR	1573	1584	W Krumvieda
2106	DOCTOR	218	236	INGER Eugenio Sour
2106	IDNUM	14	24	83T206040O
2106	IDNUM	71	79	83T20604
2106	MEDICALRECORD	25	36	8372060.MAO
2106	PATIENT	38	60	REARY, Johnathan Jimmy
2106	STATE	103	106	ACT
2106	STREET	80	88	Mortlake
2106	ZIP	108	112	6514
2108	DATE	341	348	14/2/64	2064-02-14
2108	DATE	52	61	15/2/2064	2064-02-15
2108	DOCTOR	380	388	H Mccool
2108	IDNUM	28	36	25C40885
2108	MEDICALRECORD	1	12	2514088.PRK
2108	PATIENT	13	27	FRACK, Richard
2109	CITY	224	230	BOWRAL
2109	CITY	79	89	WANGARATTA
2109	STATE	91	108	Western Australia
2109	ZIP	110	114	3488
2109	DATE	140	149	20/6/2033	2033-06-20
2109	DEPARTMENT	200	223	Molecular Oncology Unit
2109	HOSPITAL	224	239	BOWRAL HOSPITAL
2109	DOCTOR	2007	2009	XS
2109	DATE	2013	2019	3/5/64	2064-05-03
2109	DOCTOR	2050	2056	V Huch
2109	DOCTOR	243	262	HORACE MAXIMO Dolly
2109	IDNUM	13	23	83Y528914T
2109	IDNUM	63	71	83Y52891
2109	MEDICALRECORD	24	35	8395289.EMT
2109	PATIENT	37	52	Vittorini, Oren
2109	PATIENT	72	78	Royall
2109	STATE	91	108	Western Australia
2109	TIME	169	179	03/04/2064	2064-04-03
2109	ZIP	110	114	3488
2110	CITY	84	97	BACCHUS MARSH
2110	STATE	99	116	Western Australia
2110	ZIP	118	122	6072
2110	CITY	84	97	BACCHUS MARSH
2110	DATE	148	158	26/10/2013	2013-10-26
2110	DATE	178	186	6/2/2065	2065-06-02
2110	DATE	325	332	24.6.65	2065-06-24
2110	DATE	3405	3412	24.6.65	2065-06-24
2110	DATE	506	513	29/4/65	2065-04-29
2110	DEPARTMENT	203	219	DAY SURGERY UNIT
2110	DOCTOR	1153	1163	Z Guggamos
2110	DOCTOR	1245	1257	TOBY Neilsen
2110	TIME	1284	1304	3:35pm on 06.02.2065	2065-02-06T15:35
2110	DOCTOR	1358	1364	Z Abby
2110	DOCTOR	1368	1378	Z Dieckman
2110	DOCTOR	223	244	MATHEW Elke PITARRESI
2110	DOCTOR	3147	3153	Marett
2110	DOCTOR	3170	3181	Soft Tissue
2110	DOCTOR	3487	3498	MARCOS RONS
2110	DOCTOR	3562	3568	Ratley
2110	DOCTOR	412	423	SANDY Slife
2110	DOCTOR	5171	5176	Fritz
2110	DOCTOR	5560	5573	HORACE Kuzmin
2110	IDNUM	13	23	98O131213J
2110	IDNUM	64	72	98O13121
2110	MEDICALRECORD	24	34	985131.HCJ
2110	PATIENT	36	53	Hammerle, EUSEBIO
2110	STATE	99	116	Western Australia
2110	STREET	73	83	Creek Side
2110	ZIP	118	122	6072
2111	CITY	97	109	MURWILLUMBAH
2111	STATE	111	113	WA
2111	ZIP	115	119	1137
2111	CITY	97	109	MURWILLUMBAH
2111	DATE	151	161	30/11/1991	1991-11-30
2111	DATE	181	190	19/6/2065	2065-06-19
2111	DATE	1849	1856	22/6/65	2065-06-22
2111	DEPARTMENT	207	224	ACUTE STROKE UNIT
2111	DOCTOR	1887	1894	T Nayes
2111	DOCTOR	242	267	Toccara KARL MINZENBERGER
2111	IDNUM	13	23	77Z969172Z
2111	IDNUM	69	77	77Z96917
2111	IDNUM	78	86	77Z96917
2111	MEDICALRECORD	24	34	779969.DTH
2111	PATIENT	36	58	PRINZING, Shaynes Kory
2111	STATE	111	113	WA
2111	STREET	87	96	Torchwood
2111	ZIP	115	119	1137
2113	DATE	65	74	20/5/2064	2064-05-20
2113	DATE	822	831	20.5.2064	2064-05-20
2113	DOCTOR	193	200	D Leder
2113	DOCTOR	808	815	D Bajwa
2113	IDNUM	231	239	19I16198
2113	IDNUM	41	49	19I16198
2113	MEDICALRECORD	2	13	1931619.WYV
2113	PATIENT	14	40	Trucchi, LASHAUNDA Stephen
2114	CITY	232	245	BACCHUS MARSH
2114	CITY	83	88	WAGGA
2114	CITY	89	94	WAGGA
2114	STATE	96	114	Northern Territory
2114	ZIP	116	120	3143
2114	CITY	83	94	WAGGA WAGGA
2114	DATE	146	154	6/6/2000	2000-06-06
2114	DEPARTMENT	198	214	DAY SURGERY UNIT
2114	HOSPITAL	215	245	WESTERN HEALTH - BACCHUS MARSH
2114	DOCTOR	249	265	REX LEN ROMANDIA
2114	DOCTOR	3221	3223	GT
2114	DATE	3228	3235	13/2/63	2063-02-13
2114	DOCTOR	3268	3277	B Astafan
2114	HOSPITAL	5477	5495	LIVERPOOL HOSPITAL
2114	HOSPITAL	6157	6185	PORT MACQUARIE BASE HOSPITAL
2114	DOCTOR	6221	6231	B Esselink
2114	IDNUM	13	23	04J611147B
2114	IDNUM	64	72	04J61114
2114	MEDICALRECORD	24	35	0436111.MTB
2114	PATIENT	37	53	BRADEEN, Neville
2114	STATE	96	114	Northern Territory
2114	STREET	73	82	Manwaring
2114	ZIP	116	120	3143
2115	CITY	18766	18773	STAWELL
2115	CITY	214	227	TENNANT CREEK
2115	CITY	86	98	MOUNT EVELYN
2115	STATE	100	103	TAS
2115	ZIP	105	109	2025
2115	CITY	86	98	MOUNT EVELYN
2115	DATE	135	144	24/9/2007	2007-09-24
2115	DATE	164	174	13/11/2064	2064-11-13
2115	DATE	16497	16505	24.12.64	2064-12-24
2115	DATE	18744	18752	29.12.64	2064-12-29
2115	DATE	345	353	24.12.64	2064-12-24
2115	DATE	379	387	29.12.64	2064-12-29
2115	DEPARTMENT	195	213	PERI-OPERATIVEUNIT
2115	HOSPITAL	214	236	TENNANT CREEK HOSPITAL
2115	DOCTOR	16577	16583	L Merz
2115	DOCTOR	16696	16702	Julius
2115	DOCTOR	21003	21016	YONG MCPHERON
2115	DOCTOR	240	259	PEDRO ARDELL Datson
2115	DOCTOR	301	307	Darren
2115	DOCTOR	4206	4208	BR
2115	DOCTOR	4422	4424	WL
2115	DATE	4428	4436	19.11.64	2064-11-19
2115	DOCTOR	4467	4477	L Frilling
2115	DOCTOR	8939	8946	L Segar
2115	DOCTOR	8950	8966	WEST GYNAECOLOGY
2115	HOSPITAL	18822	18825	APA
2115	HOSPITAL	7096	7145	EASTERN EYRE HEALTH AND AGED CARE - COWELL CAMPUS
2115	IDNUM	13	23	46S803954Y
2115	IDNUM	60	68	46S80395
2115	IDNUM	69	77	46S80395
2115	MEDICALRECORD	24	35	4678039.PKY
2115	PATIENT	37	49	WAILES, Tony
2115	PATIENT	78	85	Delgada
2115	STATE	100	103	TAS
2115	STREET	12520	12535	Retroperitoneum
2115	ZIP	105	109	2025
2116	CITY	192	198	BOWRAL
2116	CITY	80	95	GREENWELL POINT
2116	STATE	97	100	TAS
2116	ZIP	102	106	2877
2116	CITY	80	95	GREENWELL POINT
2116	DATE	132	141	4/12/2018	2018-12-04
2116	DATE	4692	4699	13/2/65	2065-02-13
2116	DEPARTMENT	192	207	BOWRAL HOSPITAL
2116	DOCTOR	211	221	PEDRO Beyl
2116	DOCTOR	252	266	DEANDRE-Kussel
2116	DOCTOR	2536	2543	I Arlia
2116	DOCTOR	978	982	Pohl
2116	DOCTOR	1012	1021	I. Dahnke
2116	IDNUM	14	24	31T354112E
2116	IDNUM	61	69	31T35411
2116	MEDICALRECORD	25	35	317354.DEF
2116	PATIENT	37	50	Yahl, Trenton
2116	PATIENT	70	79	Rippenden
2116	STATE	97	100	TAS
2116	TIME	161	171	08/02/2065	2065-02-08T06:30
2116	ZIP	102	106	2877
2117	CITY	89	94	EUROA
2117	STATE	96	111	South Australia
2117	CITY	89	94	EUROA
2117	CITY	9439	9450	GASTROCOLIC
2117	STATE	9452	9460	LIGAMENT
2117	DATE	143	151	1/5/2010	2010-01-05
2117	DATE	168	178	04/08/2065	2065-08-04
2117	DATE	9686	9693	18/4/65	2065-04-18
2117	DEPARTMENT	199	217	105 HAMRUN CIRCUIT
2117	DOCTOR	221	237	Carlton Brierton
2117	DOCTOR	256	261	Graig
2117	DOCTOR	265	269	TODD
2117	DOCTOR	4499	4507	T. Bleak
2117	IDNUM	13	23	73C556928A
2117	IDNUM	67	75	73C55692
2117	MEDICALRECORD	24	35	7305569.HWA
2117	PATIENT	37	56	Bradly, FELECIA DON
2117	STATE	96	111	South Australia
2117	STREET	76	88	Borough High
2117	ZIP	113	117	3281
2118	CITY	87	96	WAHGUNYAH
2118	STATE	98	126	Australian Capital Territory
2118	ZIP	128	132	4008
2118	CITY	87	96	WAHGUNYAH
2118	DATE	167	176	21/3/2013	2013-03-21
2118	DATE	196	206	19/09/2064	2064-09-19
2118	DATE	5165	5172	24/9/64	2064-09-24
2118	DEPARTMENT	227	245	PERI-OPERATIVEUNIT
2118	DOCTOR	2350	2358	Burrough
2118	DOCTOR	249	261	Bryce MOSEBY
2118	DOCTOR	280	285	Cohen
2118	IDNUM	13	23	68C996186G
2118	IDNUM	62	70	68C99618
2118	IDNUM	71	79	68C99618
2118	MEDICALRECORD	24	34	681996.DXR
2118	PATIENT	36	51	Decent, FREEMAN
2118	PATIENT	80	86	Widger
2118	STATE	98	126	Australian Capital Territory
2118	ZIP	128	132	4008
2119	DATE	1313	1320	22.6.65	2065-06-22
2119	DATE	50	59	24/6/2065	2065-06-24
2119	DOCTOR	1350	1358	A Croson
2119	IDNUM	26	34	00L29899
2119	PATIENT	13	25	BRANTER, CHI
2120	CITY	220	226	SYDNEY
2120	CITY	80	88	KINGSTON
2120	STATE	90	105	New South Wales
2120	DATE	135	143	3/1/2022	2022-01-03
2120	DATE	1717	1724	22.6.65	2065-06-22
2120	DEPARTMENT	194	199	Seals
2120	HOSPITAL	200	230	CALVARY HEALTH CARE SYDNEY LTD
2120	DOCTOR	1754	1764	U Scouller
2120	DOCTOR	234	253	TERRANCE KRIS-Coron
2120	IDNUM	13	23	79Z810819X
2120	IDNUM	59	67	79Z81081
2120	MEDICALRECORD	24	34	799810.WDZ
2120	PATIENT	36	48	Krass, ARRON
2120	STREET	68	79	W Hampshire
2120	TIME	163	173	19/06/2065	2065-06-19T12:38
2122	CITY	210	221	LEIGH CREEK
2122	CITY	241	246	Young
2122	CITY	81	91	FRESHWATER
2122	STATE	93	101	Tasmania
2122	ZIP	103	107	6562
2122	CITY	81	91	FRESHWATER
2122	DATE	133	141	3/1/2022	2022-01-03
2122	DATE	1750	1757	22.6.65	2065-06-22
2122	DEPARTMENT	192	209	ACUTE STROKE UNIT
2122	HOSPITAL	210	237	LEIGH CREEK HEALTH SERVICES
2122	DOCTOR	1787	1795	S Votraw
2122	DOCTOR	241	264	Young THUKERI-Tinneberg
2122	IDNUM	14	24	63A360177D
2122	IDNUM	62	70	63A36017
2122	MEDICALRECORD	25	35	630360.CTU
2122	PATIENT	37	51	MACURA, Elwood
2122	STATE	93	101	Tasmania
2122	STREET	70	76	McCray
2122	TIME	161	171	19/06/2065	2065-06-19T12:38
2122	ZIP	103	107	6562
2123	CITY	81	89	MARCOOLA
2123	STATE	91	94	QLD
2123	ZIP	96	100	7290
2123	DATE	126	136	10/12/1994	1994-10-12
2123	DATE	1547	1554	22/6/65	2065-06-22
2123	DEPARTMENT	187	192	Seals
2123	HOSPITAL	193	235	CAMPBELL TOWN HEALTH AND COMMUNITY SERVICE
2123	DOCTOR	1587	1598	C Checketts
2123	DOCTOR	239	265	EDGARDO SPENCER THIELEMIER
2123	IDNUM	13	23	05J562884Z
2123	IDNUM	64	72	05J56288
2123	MEDICALRECORD	24	35	0535628.VMZ
2123	PATIENT	37	53	Schmith, Delinda
2123	STATE	1541	1543	NT
2123	STATE	91	94	QLD
2123	STREET	73	80	S Adams
2123	TIME	156	166	22/06/2065	2065-06-22T10:38
2123	ZIP	96	100	7290
2124	CITY	204	213	NEWCASTLE
2124	CITY	78	83	PERTH
2124	STATE	85	103	Northern Territory
2124	ZIP	105	109	3518
2124	CITY	78	83	PERTH
2124	DATE	135	144	11/3/2041	2041-11-03
2124	DATE	164	173	17/6/2065	2065-06-17
2124	DATE	498	507	20/3/2063	2063-03-20
2124	DATE	643	652	25/5/2065	2065-05-25
2124	DEPARTMENT	190	213	CALVARY MATER NEWCASTLE
2124	DATE	2054	2061	18.6.64	2064-06-18
2124	DOCTOR	2092	2100	A Schalk
2124	DOCTOR	2116	2126	A Hunzeker
2124	DOCTOR	217	242	Laurence LISBETH DAVIDIAN
2124	IDNUM	13	23	00J003142F
2124	IDNUM	3402	3410	00J00314
2124	IDNUM	62	70	00J00314
2124	PATIENT	36	51	Vickrey, Galang
2124	STATE	85	103	Northern Territory
2124	STREET	71	77	Unwick
2124	ZIP	105	109	3518
2248	CITY	100	105	COWRA
2248	CITY	100	105	COWRA
2248	STATE	107	110	TAS
2248	ZIP	112	116	6433
2248	DATE	151	161	14/10/2007	2007-10-14
2248	DATE	2480	2487	17.6.65	2065-06-17
2248	DATE	344	351	26.6.65	2065-06-26
2248	DATE	4027	4034	26.6.65	2065-06-26
2248	DEPARTMENT	212	228	WEST GYNAECOLOGY
2248	HOSPITAL	231	257	BASS COAST REGIONAL HEALTH
2248	DOCTOR	2518	2531	K Hirsbrunner
2248	DOCTOR	261	281	Kasey DWIGHT Mcgeary
2248	DOCTOR	3789	3797	K Reagen
2248	IDNUM	14	24	32S204859C
2248	IDNUM	71	79	32S20485
2248	IDNUM	80	88	32S20485
2248	MEDICALRECORD	25	36	3272048.OYC
2248	PATIENT	38	60	Hunger, Agustin ISAIAS
2248	STATE	107	110	TAS
2248	STREET	89	99	Springpath
2248	TIME	181	200	15/06/2065 at 11:58	2065-06-15T11:58
2248	ZIP	112	116	6433
2250	CITY	214	220	PARKES
2250	CITY	97	108	BROKEN HILL
2250	STATE	110	112	NT
2250	ZIP	114	118	4566
2250	CITY	97	108	BROKEN HILL
2250	DATE	153	163	14/10/2007	2007-10-14
2250	DATE	2475	2482	17.6.65	2065-06-17
2250	DATE	340	347	26.6.65	2065-06-26
2250	DATE	4025	4032	26.6.65	2065-06-26
2250	DEPARTMENT	214	227	PARKES 7 EAST
2250	HOSPITAL	229	248	GORDONVALE HOSPITAL
2250	DOCTOR	2513	2524	H Brundidge
2250	DOCTOR	252	277	Vladimir MICKEY MCGLASSON
2250	DOCTOR	3787	3795	H Techau
2250	IDNUM	13	23	37T655117I
2250	IDNUM	72	80	37T65511
2250	IDNUM	81	89	37T65511
2250	MEDICALRECORD	24	35	3776551.ESI
2250	PATIENT	37	61	Maccarter, Quinn Charles
2250	PATIENT	90	96	Babula
2250	STATE	110	112	NT
2250	STATE	326	328	NT
2250	STATE	4011	4013	NT
2250	TIME	183	202	15/06/2065 at 11:58	2065-06-15T11:58
2250	ZIP	114	118	4566
2251	CITY	223	228	COLAC
2251	CITY	92	97	EUROA
2251	STATE	99	114	South Australia
2251	ZIP	116	120	4676
2251	CITY	92	97	EUROA
2251	DATE	10343	10350	26/2/65	2065-02-26
2251	DATE	146	156	22/11/2036	2036-11-22
2251	DATE	553	563	29/12/2065	2065-12-29
2251	DEPARTMENT	207	222	ENVOI Pathology
2251	HOSPITAL	223	240	COLAC AREA HEALTH
2251	IDNUM	14	24	06H3770230
2251	IDNUM	68	76	06H37702
2251	MEDICALRECORD	25	36	0623770.HJB
2251	PATIENT	38	57	JULIET, MILAN Casey
2251	STATE	99	114	South Australia
2251	STREET	241	263	PRO Sally Sonny Riebow
2251	STREET	77	91	Apperson Ridge
2251	TIME	176	195	03/02/2065 at 10:00	2065-02-03T10:00
2251	ZIP	116	120	4676
2256	DATE	54	63	14/5/2064	2064-05-14
2256	DOCTOR	1589	1591	JH
2256	DOCTOR	1669	1675	P Posa
2256	DOCTOR	885	892	P Hedon
2256	TIME	912	931	12.05pm on 27.01.65	65-01-12
2256	IDNUM	30	38	64D39718
2256	MEDICALRECORD	1	12	6413971.WEK
2256	PATIENT	13	29	Boutte, JEFFEREY
2257	CITY	221	230	REDCLIFFE
2257	CITY	78	85	NAROOMA
2257	STATE	87	102	New South Wales
2257	ZIP	104	108	4214
2257	DATE	134	143	28/7/2004	2004-07-28
2257	DATE	163	173	12/03/2059	2059-12-03
2257	DATE	4663	4672	12.9.59lh	2059-12-09
2257	DEPARTMENT	194	220	BRIGHAM & WOMEN'S HOSPITAL
2257	HOSPITAL	221	239	REDCLIFFE HOSPITAL
2257	DOCTOR	3172	3179	Z Yocum
2257	IDNUM	13	23	96M599998G
2257	IDNUM	63	71	96M59999
2257	MEDICALRECORD	24	35	9645999.ZWG
2257	PATIENT	240	265	PRO Sherri Sarge Heinbach
2257	PATIENT	37	52	Clugston, PETRA
2257	PATIENT	72	77	Deyne
2257	STATE	87	102	New South Wales
2257	ZIP	104	108	4214
2258	CITY	80	85	NOWRA
2258	STATE	87	90	QLD
2258	ZIP	92	96	2765
2258	DATE	122	131	28/7/2004	2004-07-28
2258	DATE	151	161	21/09/2062	2062-09-21
2258	DATE	5957	5964	25/9/62	2062-09-25
2258	DEPARTMENT	182	193	UROLOGY OPD
2258	HOSPITAL	194	211	SUNSHINE HOSPITAL
2258	DOCTOR	216	238	LAILA Antonio DEBENHAM
2258	DOCTOR	3629	3636	X Klase
2258	IDNUM	14	24	90N030156M
2258	IDNUM	64	72	90N03015
2258	MEDICALRECORD	25	36	9050301.PQM
2258	PATIENT	38	53	Arturo, CHRISTI
2258	PATIENT	73	79	Hamlin
2258	STATE	87	90	QLD
2258	ZIP	92	96	2765
2259	CITY	84	91	MAREEBA
2259	STATE	93	95	NT
2259	ZIP	97	101	3610
2259	CITY	84	91	MAREEBA
2259	DATE	127	136	28/7/2004	2004-07-28
2259	DATE	156	166	30/01/2065	2065-01-30
2259	DATE	4294	4301	17/2/65	2065-02-17
2259	DEPARTMENT	187	208	DOMAIN AGED CARE RM 2
2259	HOSPITAL	209	258	KAROONDA AND DISTRICT SOLDIERS' MEMORIAL HOSPITAL
2259	DOCTOR	258	278	Mali BaughIE SCHNITZ
2259	DOCTOR	2724	2733	R Handley
2259	IDNUM	13	23	69A651073G
2259	IDNUM	66	74	69A65107
2259	MEDICALRECORD	24	35	6906510.SHG
2259	PATIENT	37	55	PARZYCH, Hortencia
2259	PATIENT	75	83	Rembrant
2259	STATE	4098	4100	NT
2259	STATE	4204	4206	NT
2259	STATE	449	451	NT
2259	STATE	812	814	NT
2259	STATE	93	95	NT
2259	ZIP	97	101	3610
2260	CITY	86	95	NURIOOTPA
2260	STATE	97	105	Tasmania
2260	ZIP	107	111	6849
2260	CITY	86	95	NURIOOTPA
2260	DATE	137	145	3/8/2020	2020-03-08
2260	DATE	165	175	13/02/2065	2065-02-13
2260	DATE	5472	5479	19/2/65	2065-02-19
2260	DEPARTMENT	196	217	DOMAIN AGED CARE RM 2
2260	HOSPITAL	218	234	WYALONG HOSPITAL
2260	DOCTOR	239	257	ROYCE Jimmie Cooks
2260	DOCTOR	3503	3511	B Panzer
2260	IDNUM	14	24	01J9538891
2260	IDNUM	68	76	01J95388
2260	MEDICALRECORD	25	36	0139538.VZD
2260	PATIENT	38	57	SIMPLOT, FLORENTINO
2260	PATIENT	77	85	Deernolm
2260	STATE	97	105	Tasmania
2260	ZIP	107	111	6849
2261	CITY	129	135	PARKES
2261	DATE	136	160	7 EAST Pathology 30.6.65	2065-06-30
2261	DATE	241	249	16/11/64	2064-11-16
2261	DATE	48	56	7/1/2065	2065-01-07
2261	DATE	6203	6211	16/11/64	2064-11-16
2261	DOCTOR	2472	2474	OG
2261	DOCTOR	2476	2477	V
2261	DATE	2482	2490	23.10.63	2063-10-23
2261	DOCTOR	2569	2578	Z Heffler
2261	DOCTOR	2590	2596	Z Gold
2261	TIME	2600	2618	4:58pm on 22.10.63	2063-10-22T16:58
2261	DOCTOR	2650	2658	Z Farkus
2261	IDNUM	24	32	96K30404
2261	MEDICALRECORD	0	10	963304.CKT
2261	PATIENT	11	23	OBAKER, IVAN
2262	CITY	47	52	Young
2262	CITY	83	100	KURRAJONG HEIGHTS
2262	STATE	102	105	VIC
2262	ZIP	107	111	2678
2262	CITY	83	100	KURRAJONG HEIGHTS
2262	DATE	137	145	5/6/1998	1998-06-05
2262	DATE	165	175	28/04/2065	2065-04-28
2262	DATE	1921	1928	15/5/65	2065-05-15
2262	DATE	2649	2657	11/05/65	2065-05-11
2262	DATE	2690	2697	21.5.65	2065-05-21
2262	DATE	313	320	21.5.65	2065-05-21
2262	DATE	838	845	29.4.65	2065-04-29
2262	DEPARTMENT	196	212	3 ARRIETTA CLOSE
2262	HOSPITAL	213	249	ST VINCENT'S HOSPITAL (DARLINGHURST)
2262	DEPARTMENT	2711	2723	SEALSCentral
2262	DOCTOR	253	264	JAN Sherell
2262	DOCTOR	2632	2642	J. Mohaupt
2262	DOCTOR	2774	2782	J Reeher
2262	DOCTOR	906	916	J Frondorf
2262	IDNUM	13	23	38T605854F
2262	IDNUM	2579	2589	38-7605854
2262	IDNUM	63	71	38T60585
2262	MEDICALRECORD	24	35	3876058.NLF
2262	STATE	102	105	VIC
2262	STREET	37	45	Corporan
2262	STREET	72	81	Hazeldean
2262	ZIP	107	111	2678
2263	CITY	88	94	MOONIE
2263	STATE	96	106	Queensland
2263	ZIP	108	112	1140
2263	CITY	88	94	MOONIE
2263	DATE	138	147	22/2/1992	1992-02-22
2263	DATE	167	177	25/06/2065	2065-06-25
2263	DATE	2020	2027	26.6.65	2065-06-26
2263	DEPARTMENT	198	216	PERI-OPERATIVEUNIT
2263	HOSPITAL	217	266	KAROONDA AND DISTRICT SOLDIERS' MEMORIAL HOSPITAL
2263	DOCTOR	2062	2072	L Heinsohn
2263	DOCTOR	270	288	Denver DESIRE TONE
2263	DOCTOR	3563	3571	L Albair
2263	DOCTOR	3907	3915	L Readus
2263	DATE	3917	3926	30/6/2065	2065-06-30
2263	IDNUM	14	24	44L647960W
2263	IDNUM	69	77	44L64796
2263	MEDICALRECORD	25	36	4446479.RBW
2263	PATIENT	38	58	MCCAWLEY, RYAN FELIX
2263	PATIENT	78	87	S Brennan
2263	STATE	96	106	Queensland
2263	ZIP	108	112	1140
2264	CITY	83	92	MELBOURNE
2264	STATE	94	97	VIC
2264	ZIP	99	103	3384
2264	CITY	83	92	MELBOURNE
2264	DATE	129	138	24/8/2010	2010-08-24
2264	DATE	158	166	6/1/2065	2065-01-06
2264	DEPARTMENT	183	188	SEALS
2264	HOSPITAL	191	233	CAMPBELL TOWN HEALTH AND COMMUNITY SERVICE
2264	DOCTOR	237	258	Nicolas CYRIL SERAPIO
2264	DOCTOR	4453	4463	J Belanger
2264	IDNUM	13	23	39M197228C
2264	IDNUM	62	70	39M19722
2264	MEDICALRECORD	24	35	3941972.HWC
2264	PATIENT	37	51	NETH, Sherwood
2264	STATE	229	232	VIC
2264	STATE	94	97	VIC
2264	STREET	71	82	Jack London
2264	ZIP	99	103	3384
2265	DATE	51	60	13/8/2064	2064-08-13
2265	DOCTOR	2653	2667	T Kaltenhauser
2265	IDNUM	27	35	71V38993
2265	MEDICALRECORD	1	12	7183899.KNZ
2265	PATIENT	13	26	Mons, LEANORA
2266	DATE	1413	1420	22.1.65	2065-01-22
2266	DATE	54	63	27/1/2065	2065-01-27
2266	DOCTOR	1455	1462	R Jover
2266	IDNUM	30	38	65W73020
2266	MEDICALRECORD	2	13	6587302.AIF
2266	PATIENT	14	29	Bufton, Patrick
2267	CITY	83	93	OODNADATTA
2267	STATE	95	103	Tasmania
2267	ZIP	105	109	2077
2267	CITY	83	93	OODNADATTA
2267	DATE	135	145	21/10/2003	2003-10-21
2267	DEPARTMENT	196	214	Molecular Oncology
2267	DOCTOR	1943	1953	B. Moutray
2267	IDNUM	13	23	07E032019B
2267	IDNUM	60	68	07E03201
2267	MEDICALRECORD	24	35	0710320.CZB
2267	PATIENT	254	277	PRO DARLEEN Rey Pullman
2267	PATIENT	37	49	Lacek, LYMAN
2267	STATE	95	103	Tasmania
2267	STREET	69	82	Hewlett Point
2267	TIME	165	175	03/06/2065	2065-06-03T12:20
2267	ZIP	105	109	2077
2267	ZIP	2462	2466	2062
2267	ZIP	2473	2477	2062
2268	CITY	209	222	BACCHUS MARSH
2268	CITY	79	89	CANNONVALE
2268	STATE	91	94	VIC
2268	ZIP	96	100	1107
2268	CITY	79	89	CANNONVALE
2268	DATE	126	135	30/6/2026	2026-06-30
2268	DATE	4502	4509	28/5/65	2065-05-28
2268	DEPARTMENT	186	191	Palms
2268	HOSPITAL	192	222	WESTERN HEALTH - BACCHUS MARSH
2268	DOCTOR	227	252	Christena GERMAN WIECHMAN
2268	DOCTOR	2653	2661	Z. Perri
2268	DOCTOR	642	646	Cruz
2268	DOCTOR	654	665	Z. Delariva
2268	TIME	669	688	10:05am on 26/05/65	65-05-26
2268	IDNUM	13	23	92F472277H
2268	IDNUM	63	71	92F47227
2268	MEDICALRECORD	24	35	9224722.SUH
2268	PATIENT	37	52	KENKEL, Sal VAL
2268	PATIENT	72	78	Timmus
2268	STATE	91	94	VIC
2268	TIME	155	174	26/05/2065 at 10:08	2065-05-26T10:08
2268	ZIP	96	100	1107
2269	CITY	87	97	BAIRNSDALE
2269	STATE	99	101	NT
2269	ZIP	103	107	6171
2269	CITY	87	97	BAIRNSDALE
2269	DATE	133	142	30/3/2004	2004-03-30
2269	DATE	162	172	15/02/2065	2065-02-15
2269	DATE	7394	7403	21/2/2065	2065-02-21
2269	DEPARTMENT	193	207	ANTENATAL WARD
2269	HOSPITAL	208	265	DELORAINE DISTRICT HOSPITAL AND COMMUNITY HEALTH SERVICES
2269	DOCTOR	270	295	Antonietta DIEGO Rochlitz
2269	DOCTOR	5110	5123	S. Hitzfelder
2269	IDNUM	14	24	71T1941840
2269	IDNUM	63	71	71T19418
2269	MEDICALRECORD	25	36	7171941.VLB
2269	PATIENT	38	52	Alaimo, TOMIKO
2269	STATE	194	196	NT
2269	STATE	586	588	NT
2269	STATE	7177	7179	NT
2269	STATE	7335	7337	NT
2269	STATE	7346	7348	NT
2269	STATE	99	101	NT
2269	ZIP	103	107	6171
2270	CITY	221	230	SINGLETON
2270	CITY	93	102	GLENBROOK
2270	STATE	104	106	NT
2270	ZIP	108	112	5109
2270	DATE	147	156	4/11/1980	1980-11-04
2270	DATE	176	186	25/05/2065	2065-05-25
2270	DATE	1968	1975	27.5.65	2065-05-27
2270	DEPARTMENT	207	218	ACT Genetic
2270	HOSPITAL	221	248	SINGLETON DISTRICT HOSPITAL
2270	DOCTOR	2008	2017	H Fielden
2270	DOCTOR	2021	2033	H Nierenberg
2270	DOCTOR	252	263	Erwin Konek
2270	DOCTOR	2601	2610	H Herzing
2270	DOCTOR	2711	2718	Caldera
2270	DOCTOR	282	287	JAIME
2270	DOCTOR	3664	3671	H Tuohy
2270	IDNUM	13	23	29P125242K
2270	IDNUM	66	74	29P12524
2270	IDNUM	75	83	29P12524
2270	MEDICALRECORD	24	34	295125.GKG
2270	PATIENT	36	55	Passini, Jarrah ROY
2270	STATE	104	106	NT
2270	STATE	207	210	ACT
2270	STREET	84	92	N Walkup
2270	ZIP	108	112	5109
2271	DATE	53	61	7/3/2065	2065-07-03
2271	DATE	984	991	18.6.65	2065-06-18
2271	DOCTOR	1021	1031	R Cluesman
2271	IDNUM	29	37	61Y31605
2271	MEDICALRECORD	2	12	619316.ANY
2271	PATIENT	13	28	Landwehr, Bryce
2272	DATE	53	61	7/3/2065	2065-07-03
2272	DOCTOR	1118	1129	P Kellerman
2272	IDNUM	29	37	56Z86721
2272	MEDICALRECORD	1	11	569867.GDS
2272	PATIENT	12	28	BABINSKI, HILTON
2273	CITY	102	108	ARARAT
2273	STATE	110	113	VIC
2273	ZIP	115	119	3610
2273	CITY	102	108	ARARAT
2273	DATE	154	164	26/12/1997	1997-12-26
2273	DATE	184	194	06/11/2065	2065-11-06
2273	DATE	6494	6501	17/6/65	2065-06-17
2273	DEPARTMENT	215	237	GOVE DISTRICT HOSPITAL
2273	DOCTOR	241	255	ANIBAL Swihart
2273	DOCTOR	274	281	COLEMAN
2273	DOCTOR	4677	4684	Z. Paik
2273	IDNUM	13	23	98H069023J
2273	IDNUM	73	81	98H06902
2273	IDNUM	82	90	98H06902
2273	MEDICALRECORD	24	34	983069.AGK
2273	PATIENT	36	62	Capriola, MARION THOMASENA
2273	STATE	110	113	VIC
2273	STATE	1176	1179	VIC
2273	STREET	91	101	Paul Poole
2273	ZIP	115	119	3610
2274	CITY	95	108	BACCHUS MARSH
2274	STATE	110	125	New South Wales
2274	ZIP	127	131	1790
2274	CITY	95	108	BACCHUS MARSH
2274	DATE	166	174	9/5/1983	1983-09-05
2274	DATE	4709	4716	18/6/65	2065-06-18
2274	DATE	4829	4836	23.6.65	2065-06-23
2274	DEPARTMENT	225	242	MERREDIN HOSPITAL
2274	DOCTOR	2448	2456	X. Billo
2274	DOCTOR	246	263	Ngarrindjeri Mumm
2274	DOCTOR	282	291	Demetrius
2274	DOCTOR	296	300	RADU
2274	DOCTOR	4793	4795	ZN
2274	DOCTOR	4819	4826	Grocott
2274	IDNUM	14	24	83I509281P
2274	IDNUM	67	75	83I50928
2274	IDNUM	76	84	83I50928
2274	MEDICALRECORD	25	35	833509.GVE
2274	PATIENT	37	56	WILCOX, Long Denese
2274	STATE	110	125	New South Wales
2274	STREET	85	94	Gracewood
2274	TIME	194	204	17/06/2065	2065-06-17T09:28
2274	ZIP	127	131	1790
2275	CITY	80	88	COCKATOO
2275	STATE	90	93	QLD
2275	ZIP	95	99	6569
2275	DATE	125	134	24/8/2013	2013-08-24
2275	DATE	154	164	03/02/2065	2065-02-03
2275	DEPARTMENT	185	215	BARADINE MULTI PURPOSE SERVICE
2275	DOCTOR	1987	1994	H Cichy
2275	DOCTOR	219	234	Rupert KOPERSKI
2275	DOCTOR	253	261	DEANGELO
2275	IDNUM	13	23	24R7010984
2275	IDNUM	61	69	24R70109
2275	MEDICALRECORD	24	34	246701.AYW
2275	PATIENT	36	50	ABILA, SAOIRSE
2275	STATE	90	93	QLD
2275	STREET	70	79	Nantasket
2275	ZIP	95	99	6569
2276	CITY	76	82	GAWLER
2276	STATE	84	87	TAS
2276	ZIP	89	93	5483
2276	CITY	76	82	GAWLER
2276	DATE	119	128	18/1/2013	2013-01-18
2276	DATE	148	158	22/01/2065	2065-01-22
2276	DATE	4734	4741	27/1/65	2065-01-27
2276	DEPARTMENT	179	198	PERI-OPERATIVE UNIT
2276	DOCTOR	202	218	Cristopher WENTE
2276	DOCTOR	248	254	Jospeh
2276	DOCTOR	2926	2933	F. Erle
2276	IDNUM	13	23	19S152256R
2276	IDNUM	59	67	19S15225
2276	MEDICALRECORD	24	34	197152.GOQ
2276	PATIENT	36	48	Karmo, ALENA
2276	PATIENT	68	74	Gazebo
2276	STATE	84	87	TAS
2276	ZIP	89	93	5483
2277	CITY	82	92	PORT PIRIE
2277	STATE	94	102	Victoria
2277	ZIP	104	108	5264
2277	DATE	134	142	4/4/1986	1986-04-04
2277	DATE	162	172	14/04/2065	2065-04-14
2277	DATE	3834	3841	20/4/65	2065-04-20
2277	DEPARTMENT	193	222	TRESILLIAN FAMILY CARE CENTRE
2277	HOSPITAL	225	239	WOLLSTONECRAFT
2277	DOCTOR	2343	2349	P Fune
2277	DOCTOR	243	256	Gail MULCAHEY
2277	DOCTOR	275	282	Ormonde
2277	DOCTOR	287	292	Cyril
2277	IDNUM	14	24	51B454063N
2277	IDNUM	62	70	51B45406
2277	MEDICALRECORD	25	35	510454.ARI
2277	PATIENT	37	51	ROJERO, Trudie
2277	STATE	94	102	Victoria
2277	STREET	71	81	Pines Lake
2277	ZIP	104	108	5264
2278	CITY	197	203	LEETON
2278	CITY	87	94	MAREEBA
2278	ZIP	98	102	0870
2278	CITY	87	94	MAREEBA
2278	DATE	137	146	16/7/2005	2005-07-16
2278	DATE	166	176	20/02/2065	2065-02-20
2278	DATE	3032	3039	26/2/65	2065-02-26
2278	DEPARTMENT	197	221	LEETON DISTRICT HOSPITAL
2278	DOCTOR	1696	1709	M. Jeanclaude
2278	DOCTOR	225	237	ABEL Cucuzza
2278	DOCTOR	256	262	Eugene
2278	IDNUM	13	23	46C894221T
2278	IDNUM	59	67	46C89422
2278	IDNUM	68	76	46C89422
2278	MEDICALRECORD	24	34	460894.GGC
2278	PATIENT	36	48	SHAAK, MARIA
2278	STREET	77	86	Leaycraft
2278	ZIP	98	102	0870
2279	CITY	90	105	GREENWELL POINT
2279	ZIP	109	113	1032
2279	CITY	90	105	GREENWELL POINT
2279	DATE	148	157	20/5/1979	1979-05-20
2279	DATE	177	187	02/06/2065	2065-06-02
2279	DATE	3573	3580	2/11/65	2065-11-02
2279	DEPARTMENT	208	242	ST MARGARETS REHABILITATION CENTRE
2279	DOCTOR	1541	1550	X Amelung
2279	DOCTOR	246	261	JOHNNIE MACVEAN
2279	DOCTOR	280	286	Israel
2279	IDNUM	13	23	88L1960376
2279	IDNUM	64	72	88L19603
2279	IDNUM	73	81	88L19603
2279	MEDICALRECORD	24	34	884196.BJU
2279	PATIENT	36	54	Vanausdal, GUNJULA
2279	PATIENT	82	89	VILLA 9
2279	ZIP	109	113	1032
2281	CITY	81	90	MELBOURNE
2281	STATE	92	109	Western Australia
2281	ZIP	111	115	4120
2281	CITY	81	90	MELBOURNE
2281	DATE	141	150	19/4/1999	1999-04-19
2281	DATE	170	180	26/11/2064	2064-11-26
2281	DEPARTMENT	201	212	UROLOGY OPD
2281	HOSPITAL	215	246	WERRIS CREEK COMMUNITY HOSPITAL
2281	DOCTOR	2493	2500	Sterger
2281	TIME	2513	2521	28.11.64	2064-11-28
2281	DOCTOR	250	269	Bert Markus CAMPANA
2281	DOCTOR	2624	2633	Q Salesky
2281	DOCTOR	2640	2650	Q Coniglio
2281	DOCTOR	2651	2669	Q Lonny-Overhulser
2281	TIME	2673	2692	11.20am on 26.11.64	2066-11-26T11:20
2281	DOCTOR	2724	2733	Q Follick
2281	DOCTOR	288	292	Wela
2281	IDNUM	13	23	67Y718954K
2281	IDNUM	64	72	67Y71895
2281	MEDICALRECORD	24	35	6797189.NLK
2281	PATIENT	37	53	Dross, HERIBERTO
2281	PATIENT	73	80	Frigate
2281	STATE	92	109	Western Australia
2281	ZIP	111	115	4120
2282	CITY	210	219	GLADSTONE
2282	CITY	4750	4758	PAKENHAM
2282	CITY	81	94	TENNANT CREEK
2282	STATE	96	104	Victoria
2282	ZIP	106	110	4855
2282	CITY	81	94	TENNANT CREEK
2282	DATE	136	146	15/10/2018	2018-10-15
2282	DATE	166	176	12/04/2065	2065-04-12
2282	DATE	2111	2118	12.4.65	2065-12-04
2282	DEPARTMENT	197	209	SEALSCentral
2282	HOSPITAL	210	228	GLADSTONE HOSPITAL
2282	DOCTOR	2149	2160	C Streicher
2282	DOCTOR	232	251	Tom Bobbie Lawnicki
2282	IDNUM	13	23	10V289260Y
2282	IDNUM	60	68	10V28926
2282	MEDICALRECORD	24	35	1082892.RBY
2282	ORGANIZATION	4742	4748	Becton
2282	HOSPITAL	4750	4772	PAKENHAM HEALTH CENTRE
2282	PATIENT	37	49	White, IRINA
2282	PATIENT	69	80	Shakespeare
2282	STATE	96	104	Victoria
2282	ZIP	106	110	4855
2284	CITY	90	98	WARRAGUL
2284	STATE	100	117	Western Australia
2284	ZIP	119	123	6470
2284	CITY	90	98	WARRAGUL
2284	DATE	158	167	29/9/1997	1997-09-29
2284	DATE	1844	1851	23.3.64	2064-03-23
2284	DATE	2924	2932	7.8.2065	2065-08-07
2284	DATE	382	390	7.8.2065	2065-08-07
2284	DEPARTMENT	218	223	Palms
2284	HOSPITAL	226	253	WALCHA MULTIPURPOSE SERVICE
2284	DOCTOR	1883	1891	W Pinney
2284	DOCTOR	257	279	Barney Elliott SKENDER
2284	DOCTOR	2690	2699	W Foxwell
2284	DOCTOR	2937	2942	W Fus
2284	DOCTOR	335	342	LACHLAN
2284	DOCTOR	395	403	W Harpel
2284	IDNUM	14	24	89J800286S
2284	IDNUM	63	71	89J80028
2284	IDNUM	72	80	89J80028
2284	MEDICALRECORD	25	36	8938002.VRS
2284	PATIENT	38	52	Schoebel, HUGH
2284	PATIENT	81	89	Bungowen
2284	STATE	100	117	Western Australia
2284	TIME	187	197	22/03/2064	2064-03-22T11:46
2284	ZIP	119	123	6470
2285	CITY	77	86	MERIMBULA
2285	STATE	88	91	TAS
2285	ZIP	93	97	3697
2285	CITY	77	86	MERIMBULA
2285	DATE	123	132	19/4/1999	1999-04-19
2285	DATE	152	160	7/8/2065	2065-08-07
2285	DEPARTMENT	177	188	UROLOGY OPD
2285	HOSPITAL	191	208	ATHERTON HOSPITAL
2285	DOCTOR	1934	1942	P Korbal
2285	DOCTOR	212	237	Robbie Johnathan Cantrell
2285	DOCTOR	256	261	CHONG
2285	DOCTOR	721	725	Ewan
2285	DOCTOR	732	742	P Crichlow
2285	TIME	746	767	10:22am on 07.08.2065	2065-08-06T10:22
2285	IDNUM	13	23	67W522193M
2285	IDNUM	62	70	67W52219
2285	MEDICALRECORD	24	35	6785221.YIM
2285	PATIENT	37	51	UMBRELL, Major
2285	PATIENT	71	76	Siren
2285	STATE	88	91	TAS
2285	ZIP	93	97	3697
2287	CITY	198	207	MILLICENT
2287	CITY	80	91	WARRNAMBOOL
2287	STATE	93	111	Northern Territory
2287	ZIP	113	117	4070
2287	CITY	80	91	WARRNAMBOOL
2287	DATE	143	152	11/3/2041	2041-11-03
2287	DATE	172	181	17/6/2065	2065-06-17
2287	DATE	4161	4168	13/7/65	2065-07-13
2287	DATE	529	538	20/3/2063	2063-03-20
2287	DATE	674	683	25/5/2065	2065-05-25
2287	DEPARTMENT	198	249	MILLICENT AND DISTRICT HOSPITAL AND HEALTH SERVICES
2287	DOCTOR	2078	2080	DT
2287	DATE	2084	2091	18.6.64	2064-06-18
2287	DOCTOR	2122	2131	J Armiger
2287	DOCTOR	2147	2156	J Mangram
2287	DOCTOR	253	274	Rupert FELECIA Blyden
2287	DOCTOR	4245	4256	J. Maysonet
2287	DOCTOR	4261	4271	J. Trodden
2287	HOSPITAL	4183	4219	PINNAROO SOLDIERS' MEMORIAL HOSPITAL
2287	IDNUM	13	23	36K144109G
2287	IDNUM	3430	3438	36K14410
2287	IDNUM	64	72	36K14410
2287	MEDICALRECORD	24	34	364144.DCZ
2287	PATIENT	36	53	Swackhamer, BRIAN
2287	PATIENT	73	79	Adolph
2287	STATE	93	111	Northern Territory
2287	ZIP	113	117	4070
2289	DATE	1303	1310	16.7.65	2065-07-16
2289	DATE	57	65	7/4/2066	2066-04-07
2289	DATE	97	104	16.7.65	2065-07-16
2289	DOCTOR	1149	1158	C Seledon
2289	DOCTOR	1372	1381	C Cabanas
2289	HOSPITAL	1383	1401	PERI-OPERATIVEUNIT
2289	DOCTOR	421	428	C Manly
2289	IDNUM	33	41	05X86502
2289	MEDICALRECORD	2	13	0598650.FQA
2289	PATIENT	14	32	Ehmen, AIDAN-MILAN
2291	CITY	5845	5854	GLADSTONE
2291	CITY	84	96	MOUNT EVELYN
2291	STATE	98	106	Victoria
2291	ZIP	106	110	6765
2291	CITY	84	96	MOUNT EVELYN
2291	DATE	136	145	15/5/1984	1984-05-15
2291	DATE	356	363	21.7.65	2065-07-21
2291	DATE	5771	5778	21.7.65	2065-07-21
2291	DEPARTMENT	196	215	PERI-OPERATIVE UNIT
2291	HOSPITAL	216	235	BRIDGETOWN HOSPITAL
2291	DEPARTMENT	5932	5949	DICKINSON 3 NORTH
2291	DOCTOR	239	261	John KATRINA BROCKBERG
2291	DOCTOR	280	284	Otis
2291	DOCTOR	326	333	SCOTTIE
2291	DOCTOR	2644	2652	W Cecere
2291	DOCTOR	5802	5820	W Andreadis tumour
2291	DOCTOR	5987	6006	Darby Benedict ZENT
2291	DOCTOR	6096	6103	W Annis
2291	IDNUM	13	23	00Y216384G
2291	IDNUM	64	72	00Y21638
2291	MEDICALRECORD	24	34	009216.HVL
2291	PATIENT	36	53	SWEETIN, Virgilia
2291	PATIENT	73	83	JANBORWILL
2291	TIME	165	184	02/06/2065 at 10:40	2065-06-02T10:40
2293	CITY	87	98	CHARLEVILLE
2293	STATE	100	102	WA
2293	ZIP	104	108	7025
2293	DATE	134	143	10/7/1992	1992-10-07
2293	DATE	163	172	26/4/2064	2064-04-26
2293	DATE	3335	3342	23/7/65	2065-07-23
2293	DATE	336	343	23/7/65	2065-07-23
2293	DEPARTMENT	189	211	POSTOPERATIVE RECOVERY
2293	HOSPITAL	214	243	PETER MACCALLUM CANCER CENTRE
2293	DOCTOR	1990	1992	VQ
2293	DOCTOR	1993	1995	HW
2293	DATE	1999	2006	27.4.64	2064-04-27
2293	DOCTOR	2037	2045	T Hernon
2293	DOCTOR	247	265	DWIGHT ELLIS HARIG
2293	DOCTOR	2958	2970	Shawn Hoseck
2293	DOCTOR	3386	3402	Leonel LECOULTRE
2293	IDNUM	14	24	79M938290Z
2293	IDNUM	69	77	79M93829
2293	MEDICALRECORD	25	36	7949382.YCZ
2293	PATIENT	38	58	Marple, MARSHA MASON
2293	PATIENT	78	86	Milstead
2293	STATE	100	102	WA
2293	ZIP	104	108	7025
2295	DATE	53	61	8/4/2065	2065-04-08
2295	DOCTOR	475	485	D Padovani
2295	IDNUM	29	37	11V13900
2295	MEDICALRECORD	1	11	118139.ABT
2295	PATIENT	12	28	Boehmer, Vincent
2297	CITY	87	97	BAIRNSDALE
2297	STATE	99	101	NT
2297	ZIP	103	107	4552
2297	CITY	87	97	BAIRNSDALE
2297	DATE	133	142	13/2/2002	2002-02-13
2297	DATE	162	171	23/9/2064	2064-09-23
2297	DEPARTMENT	188	201	MACQUARIEWARD
2297	HOSPITAL	202	216	OAKEY HOSPITAL
2297	DOCTOR	1482	1484	CG
2297	DOCTOR	1486	1488	GV
2297	DATE	1492	1499	24.9.64	2064-09-24
2297	DOCTOR	1535	1545	S Vorachek
2297	DOCTOR	220	243	JOHNNIE KERRI Sheingold
2297	IDNUM	13	23	79R150065E
2297	IDNUM	66	74	79R15006
2297	MEDICALRECORD	24	34	796150.CQO
2297	PATIENT	36	55	Hansbury, FREDERICA
2297	STATE	2468	2470	NT
2297	STATE	99	101	NT
2297	STREET	75	86	Wagon Wheel
2297	ZIP	103	107	4552
2299	CITY	89	98	KATANNING
2299	ZIP	102	106	3239
2299	DATE	141	150	20/5/1979	1979-05-20
2299	DATE	170	180	02/06/2065	2065-06-02
2299	DATE	3578	3585	2/11/65	2065-11-02
2299	DEPARTMENT	201	222	MOYNE HEALTH SERVICES
2299	DOCTOR	1545	1554	Q Bahadue
2299	DOCTOR	226	243	CHADWICK HANSTEIN
2299	DOCTOR	262	267	Anton
2299	IDNUM	14	24	64S6013234
2299	IDNUM	59	67	64S60132
2299	IDNUM	68	76	64S60132
2299	MEDICALRECORD	25	35	647601.IGJ
2299	ORGANIZATION	3644	3656	Phelps Dodge
2299	DEPARTMENT	3657	3706	KAROONDA AND DISTRICT SOLDIERS' MEMORIAL HOSPITAL
2299	STREET	77	88	Pilar Ridge
2299	ZIP	102	106	3239
2302	CITY	95	107	MURWILLUMBAH
2302	STATE	109	119	Queensland
2302	ZIP	121	125	6375
2302	CITY	95	107	MURWILLUMBAH
2302	DATE	157	166	22/3/2006	2006-03-22
2302	DATE	186	196	17/02/2065	2065-02-17
2302	DATE	2770	2777	14.2.65	2065-02-14
2302	DATE	354	363	11.8.2065	2065-11-08
2302	DATE	4213	4220	25/2/65	2065-02-25
2302	DATE	4567	4576	11.8.2065	2065-11-08
2302	DEPARTMENT	217	225	Southern
2302	HOSPITAL	226	251	MACLEAN DISTRICT HOSPITAL
2302	DEPARTMENT	4591	4609	105 HAMRUN CIRCUIT
2302	DOCTOR	1420	1429	A Vickroy
2302	DOCTOR	1436	1445	A Raffety
2302	TIME	1449	1466	11.50 on 17.02.65	65-02-17T11:50
2302	DOCTOR	255	274	Reyes Mohammed GOSA
2302	DOCTOR	2808	2819	A Commiskey
2302	DOCTOR	316	330	Rafael Critzer
2302	DOCTOR	4637	4648	DONNIE Yahl
2302	DOCTOR	4947	4955	A Marani
2302	DOCTOR	4977	4987	A Huisinga
2302	DOCTOR	5180	5190	A Shattuck
2302	TIME	5192	5198	4/8/65	2065-04-04
2302	IDNUM	13	23	05B893030H
2302	IDNUM	3882	3890	05B89303
2302	IDNUM	66	74	05B89303
2302	IDNUM	75	83	05B89303
2302	MEDICALRECORD	24	35	0508930.IAH
2302	PATIENT	37	55	KALLEY, Len JERAMY
2302	STATE	109	119	Queensland
2302	STREET	84	94	Sportsmans
2302	ZIP	121	125	6375
2311	CITY	77	92	CLIFTON SPRINGS
2311	STATE	94	97	QLD
2311	ZIP	99	103	5422
2311	DATE	129	138	16/8/2027	2027-08-16
2311	DATE	2584	2591	14.7.65	2065-07-14
2311	DATE	304	311	14.7.65	2065-07-14
2311	DEPARTMENT	189	201	SEALSCentral
2311	HOSPITAL	202	235	KOOWEERUP REGIONAL HEALTH SERVICE
2311	DOCTOR	1310	1318	X Ganley
2311	DOCTOR	239	259	RICO TIMIKA Leavelle
2311	DOCTOR	278	281	JON
2311	DOCTOR	2856	2864	X Lohman
2311	HOSPITAL	2421	2440	BODDINGTON HOSPITAL
2311	HOSPITAL	2644	2683	FINLEY HOSPITAL & COMMUNITY HEALTH CARE
2311	IDNUM	13	23	90C343398N
2311	IDNUM	60	68	90C34339
2311	MEDICALRECORD	24	35	9003433.YVN
2311	PATIENT	37	51	Thulin, VAUGHN
2311	PATIENT	69	76	Miggins
2311	STATE	94	97	QLD
2311	TIME	158	177	07/02/2065 at 13:57	2065-02-07T13:57
2311	ZIP	99	103	5422
2312	CITY	91	97	MOONIE
2312	STATE	99	101	NT
2312	ZIP	103	107	4230
2312	CITY	91	97	MOONIE
2312	DATE	133	142	27/2/2034	2034-02-27
2312	DATE	162	171	18/6/2065	2065-06-18
2312	DATE	3326	3333	18/6/65	2065-06-18
2312	DEPARTMENT	188	200	Cytogenetics
2312	HOSPITAL	203	220	THEODORE HOSPITAL
2312	DOCTOR	224	247	TJINGALI THUKERI Trentz
2312	DOCTOR	3364	3371	R Rorie
2312	IDNUM	13	23	69P965204H
2312	IDNUM	69	77	69P96520
2312	MEDICALRECORD	24	35	6959652.CMH
2312	PATIENT	37	58	VANICEK, ALBERT ONATA
2312	STATE	99	101	NT
2312	STREET	78	90	Beards Point
2312	ZIP	103	107	4230
2313	CITY	95	102	FORSTER
2313	STATE	104	119	New South Wales
2313	ZIP	121	125	3954
2313	CITY	95	102	FORSTER
2313	DATE	151	160	22/4/2004	2004-04-22
2313	DATE	180	189	18/6/2065	2065-06-18
2313	DATE	2264	2272	5/5/2065	2065-05-05
2313	DATE	2816	2823	19/6/65	2065-06-19
2313	DEPARTMENT	206	229	Molecular Oncology Unit
2313	HOSPITAL	232	258	THE ROYAL WOMEN'S HOSPITAL
2313	DOCTOR	1356	1375	B Christopher-Arauz
2313	DOCTOR	1382	1392	B Blystone
2313	TIME	1396	1413	16.45 on 18.06.65	65-06-18T16:45
2313	DOCTOR	1529	1547	B DOUGLAS-Spackman
2313	DOCTOR	1554	1563	B Simlick
2313	TIME	1567	1584	16.45 on 18.06.65	65-06-18T16:45
2313	DOCTOR	262	297	MARGARET Kathyrn Clifton-Nicolaides
2313	DOCTOR	2858	2866	B Baille
2313	DOCTOR	4445	4459	B Keliihoomalu
2313	DOCTOR	5424	5439	B DARRICK-Heare
2313	DOCTOR	5507	5518	B Gasperini
2313	DOCTOR	5583	5593	B Chollett
2313	DOCTOR	5649	5658	B Maynard
2313	TIME	5604	5613	13/7/2065	2065-07-13T13:00
2313	IDNUM	14	24	01Y267011D
2313	IDNUM	74	82	01Y26701
2313	MEDICALRECORD	25	36	0192670.EDD
2313	PATIENT	38	63	SPROWLS, DOMINIQUE Rupert
2313	PATIENT	83	94	Manningtree
2313	STATE	104	119	New South Wales
2313	ZIP	121	125	3954
2314	CITY	209	221	CAMPBELLTOWN
2314	CITY	78	88	HAZELBROOK
2314	STATE	90	105	South Australia
2314	ZIP	107	111	4051
2314	DATE	137	146	8/12/2032	2032-12-08
2314	DATE	1754	1761	17.7.65	2065-07-17
2314	DEPARTMENT	197	208	UROLOGY OPD
2314	HOSPITAL	209	230	CAMPBELLTOWN HOSPITAL
2314	DOCTOR	1795	1801	P Magg
2314	DOCTOR	234	253	BOOKER Reagan Compo
2314	DOCTOR	2667	2677	Phatdouang
2314	IDNUM	13	23	69U287179M
2314	IDNUM	62	70	69U28717
2314	MEDICALRECORD	24	35	6972871.TZM
2314	PATIENT	37	51	COSWELL, KRAIG
2314	PATIENT	71	77	Davane
2314	STATE	90	105	South Australia
2314	TIME	166	185	16/07/2065 at 10:05	2065-07-16T10:05
2314	ZIP	107	111	4051
2315	CITY	84	99	RAYMOND TERRACE
2315	STATE	101	119	Northern Territory
2315	ZIP	121	125	1499
2315	CITY	84	99	RAYMOND TERRACE
2315	DATE	151	161	27/11/2004	2004-11-27
2315	DATE	181	191	19/06/2065	2065-06-19
2315	DATE	2905	2912	22.6.65	2065-06-22
2315	DATE	3122	3129	24.6.65	2065-06-24
2315	DATE	3366	3373	26.6.65	2065-06-26
2315	DEPARTMENT	212	223	ACT Genetic
2315	HOSPITAL	224	241	SUNSHINE HOSPITAL
2315	DOCTOR	245	268	DEANGELO FELICITY CUKAJ
2315	DOCTOR	3404	3413	J Warnock
2315	DOCTOR	3419	3430	J Raczynski
2315	DOCTOR	3464	3471	Earnest
2315	DATE	3475	3484	29.6.2065	2065-06-29
2315	IDNUM	13	23	54V638337S
2315	IDNUM	5803	5811	38I80908
2315	IDNUM	64	72	54V63833
2315	MEDICALRECORD	24	35	5486383.JTS
2315	PATIENT	37	53	WAGANER, Wilburn
2315	STATE	101	119	Northern Territory
2315	STATE	212	215	ACT
2315	STREET	73	83	Stowecroft
2315	ZIP	121	125	1499
2316	CITY	185	196	MEEKATHARRA
2316	CITY	6293	6299	WILTON
2316	CITY	83	89	LEGANA
2316	STATE	91	93	SA
2316	ZIP	95	99	7253
2316	DATE	125	133	1/5/1999	1999-01-05
2316	DATE	153	162	30/7/2065	2065-07-30
2316	DEPARTMENT	179	184	PaLMS
2316	HOSPITAL	185	205	MEEKATHARRA HOSPITAL
2316	DOCTOR	1374	1382	X Heavin
2316	DOCTOR	209	224	Len ARLA Posada
2316	DOCTOR	6209	6223	JULIAN Lenberg
2316	IDNUM	14	24	96E920144O
2316	IDNUM	5888	5896	96E92014
2316	IDNUM	63	71	96E92014
2316	MEDICALRECORD	25	36	9619201.MLO
2316	PATIENT	38	52	Rexach, Porter
2316	STATE	91	93	SA
2316	STREET	72	82	Coggeshall
2316	ZIP	95	99	7253
2318	CITY	101	108	NAROOMA
2318	STATE	110	113	ACT
2318	ZIP	115	119	1484
2318	DATE	154	163	19/6/2002	2002-06-19
2318	DATE	183	193	06/03/2065	2065-03-06
2318	DEPARTMENT	214	217	DHM
2318	HOSPITAL	218	232	OAKEY HOSPITAL
2318	DOCTOR	1898	1910	V Bregantini
2318	DOCTOR	236	254	CHAS JAROD Bombino
2318	IDNUM	13	23	81F370302U
2318	IDNUM	2505	2514	81F37030F
2318	IDNUM	75	83	81F37030
2318	IDNUM	84	92	81F37030
2318	MEDICALRECORD	24	35	8113703.CFU
2318	PATIENT	37	64	JACOBELLIS, Roberto Laverne
2318	STATE	110	113	ACT
2318	STREET	93	100	Okeover
2318	ZIP	115	119	1484
2319	CITY	86	94	MAITLAND
2319	STATE	96	111	New South Wales
2319	ZIP	113	117	1173
2319	DATE	152	161	27/3/2032	2032-03-27
2319	DATE	181	191	08/07/2065	2065-07-08
2319	DEPARTMENT	212	225	EAST SURGICAL
2319	HOSPITAL	228	242	TULLY HOSPITAL
2319	DOCTOR	1215	1222	F Agans
2319	DOCTOR	1226	1235	F Murriel
2319	DOCTOR	246	265	Graig DESHAWN LAMBE
2319	DOCTOR	284	289	Lanny
2319	DOCTOR	3093	3102	F Baquero
2319	IDNUM	13	23	23N5721186
2319	IDNUM	57	65	23N57211
2319	IDNUM	66	74	23N57211
2319	MEDICALRECORD	24	35	2355721.EXR
2319	PATIENT	37	46	Taus, CHI
2319	STATE	96	111	New South Wales
2319	STREET	75	85	Dorchester
2319	ZIP	113	117	1173
2320	CITY	79	90	COOTAMUNDRA
2320	STATE	92	94	SA
2320	DATE	126	136	21/11/2004	2004-11-21
2320	DATE	156	165	18/3/2065	2065-03-18
2320	DATE	2493	2500	21/3/65	2065-03-21
2320	DEPARTMENT	182	194	SEALSCentral
2320	HOSPITAL	195	216	ONSLOW HEALTH SERVICE
2320	DOCTOR	220	242	Jonathon BOBBIE Kizzie
2320	DOCTOR	2536	2545	D Brittin
2320	IDNUM	13	23	17O013376X
2320	IDNUM	64	72	17O01337
2320	MEDICALRECORD	24	35	1750133.URX
2320	PATIENT	37	53	Labruzzo, INDIGO
2320	PATIENT	73	78	Habel
2320	STATE	92	94	SA
2320	ZIP	96	100	3239
2321	CITY	83	91	BALLARAT
2321	STATE	93	96	TAS
2321	ZIP	98	102	6244
2321	CITY	83	91	BALLARAT
2321	DATE	128	136	8/1/2002	2002-01-08
2321	DATE	156	165	18/2/2065	2065-02-18
2321	DATE	2295	2302	19/2/65	2065-02-19
2321	DEPARTMENT	182	194	SEALSCentral
2321	HOSPITAL	197	222	FAR NORTH HEALTH SERVICES
2321	DOCTOR	226	246	MATHEW RHYS KLITZNER
2321	DOCTOR	2337	2343	N Tena
2321	DOCTOR	3599	3607	N Shoaff
2321	DOCTOR	771	775	Sang
2321	DOCTOR	782	790	N Celius
2321	DOCTOR	795	804	N Joganic
2321	TIME	821	839	2:14pm on 18/02/65	2065-02-18T14:14
2321	IDNUM	13	23	59X214183T
2321	IDNUM	64	72	59X21418
2321	MEDICALRECORD	24	35	5992141.XJT
2321	PATIENT	37	53	JOHLL, Otis Hank
2321	STATE	93	96	TAS
2321	STREET	73	82	Swayfield
2321	ZIP	98	102	6244
2322	CITY	82	92	MARCOOLAWA
2322	STATE	90	92	WA
2322	ZIP	94	98	3544
2322	DATE	124	134	14/10/1996	1996-10-14
2322	DEPARTMENT	185	202	DICKINSON 3 NORTH
2322	HOSPITAL	203	240	KYOGLE MEMORIAL MULTI PURPOSE SERVICE
2322	DOCTOR	244	259	SAUL CLAY Minor
2322	DOCTOR	2990	2999	L Rabadan
2322	DOCTOR	3015	3024	L Murphey
2322	DOCTOR	792	808	Garfield Gilmore
2322	TIME	812	832	1:30pm on 04.03.2065	2065-03-04T11:30
2322	IDNUM	14	24	44Y7653519
2322	IDNUM	63	71	44Y76535
2322	MEDICALRECORD	25	36	4497653.NDZ
2322	ORGANIZATION	4125	4145	Continental Airlines
2322	HOSPITAL	4147	4184	WEST WIMMERA HEALTH SERVICE - JEPARIT
2322	PATIENT	38	52	BLOOMER, Dylan
2322	STREET	72	81	Greenways
2322	TIME	154	164	04/03/2065	2065-03-04T12:04
2322	ZIP	94	98	3544
2323	CITY	46	54	Adelaide
2323	CITY	98	105	GEELONG
2323	STATE	107	110	ACT
2323	ZIP	112	116	2805
2323	DATE	151	159	7/8/1990	1990-08-07
2323	DATE	179	187	2/6/2065	2065-06-02
2323	DATE	373	380	25.2.65	2065-02-25
2323	DATE	5201	5210	20/2/2065	2065-02-20
2323	DATE	5702	5709	25.2.65	2065-02-25
2323	DEPARTMENT	204	230	BRIGHAM & WOMEN'S HOSPITAL
2323	HOSPITAL	233	282	KAROONDA AND DISTRICT SOLDIERS' MEMORIAL HOSPITAL
2323	DOCTOR	286	302	EDWIN CAREY WICE
2323	DOCTOR	321	327	RENATO
2323	DOCTOR	335	350	CANCER-REGISTRY
2323	DOCTOR	3288	3294	V Madu
2323	IDNUM	13	23	86H967168W
2323	IDNUM	5773	5781	86H96716
2323	IDNUM	69	77	86H96716
2323	IDNUM	78	86	86H96716
2323	MEDICALRECORD	24	35	8629671.PVW
2323	PATIENT	37	58	BRAMHAM, Adelaide Ray
2323	PATIENT	87	97	Hauschildt
2323	STATE	107	110	ACT
2323	ZIP	112	116	2805
2324	DATE	57	65	8/6/2065	2065-06-08
2324	DOCTOR	331	343	T. Schrameck
2324	IDNUM	33	41	71I40732
2324	MEDICALRECORD	1	11	713407.JFQ
2324	PATIENT	12	32	LUDTKE, JACQUES FRED
2325	CITY	96	106	BEAUDESERT
2325	STATE	108	110	NT
2325	ZIP	112	116	5608
2325	DATE	142	151	5/12/2019	2019-05-12
2325	DATE	3222	3229	15/6/65	2065-06-15
2325	DEPARTMENT	202	218	3 ARRIETTA CLOSE
2325	DOCTOR	2060	2069	D Laroque
2325	DOCTOR	250	270	RHONA Roberto Lomboy
2325	DOCTOR	718	727	D. Triska
2325	DATE	731	738	10/6/65	2065-10-06
2325	IDNUM	14	24	13R609132Y
2325	IDNUM	71	79	13R60913
2325	MEDICALRECORD	25	36	1366091.IHY
2325	PATIENT	38	60	HAMMEL, ALEXIS RICHARD
2325	STATE	108	110	NT
2325	STATE	1657	1659	NT
2325	STATE	3038	3040	NT
2325	STATE	3048	3050	NT
2325	STATE	3176	3178	NT
2325	STATE	847	849	NT
2325	STATE	857	859	NT
2325	STREET	80	95	Wandering Trail
2325	TIME	171	181	10/06/2065	2065-06-10T10:24
2325	ZIP	112	116	5608
2327	CITY	227	238	CASTLEMAINE
2327	CITY	95	106	COOTAMUNDRA
2327	STATE	108	111	TAS
2327	ZIP	113	117	7211
2327	DATE	152	162	19/11/2029	2029-11-19
2327	DATE	182	191	15/6/2065	2065-06-15
2327	DATE	2110	2117	16.6.65	2065-06-16
2327	DEPARTMENT	208	224	3 ARRIETTA CLOSE
2327	HOSPITAL	227	245	CASTLEMAINE HEALTH
2327	DOCTOR	2147	2157	R Andelman
2327	DOCTOR	2173	2181	R Sidles
2327	DOCTOR	249	258	KARL Vito
2327	PATIENT	246	268	DR KARL Vito Singhania
2327	IDNUM	13	23	61N620281H
2327	IDNUM	68	76	61N62028
2327	IDNUM	77	85	61N62028
2327	MEDICALRECORD	24	35	6156202.XCH
2327	PATIENT	37	57	ENGDAHL, HOYT Andrew
2327	PATIENT	86	94	Felsberg
2327	STATE	108	111	TAS
2327	ZIP	113	117	7211
2328	CITY	87	98	BROKEN HILL
2328	ZIP	102	106	6528
2328	CITY	87	98	BROKEN HILL
2328	DATE	141	151	24/10/2008	2008-10-24
2328	DATE	171	181	15/08/2065	2065-08-15
2328	DATE	3903	3910	17.8.65	2065-08-17
2328	DEPARTMENT	202	228	BRIGHAM & WOMEN'S HOSPITAL
2328	HOSPITAL	229	258	CONCORD REPATRIATION HOSPITAL
2328	DOCTOR	262	281	Ramiro Cohen DEZELL
2328	DOCTOR	300	307	DEANDRE
2328	DOCTOR	322	328	Conrad
2328	DOCTOR	3941	3950	L Lecznar
2328	DOCTOR	3954	3961	L Sindt
2328	IDNUM	13	23	40A341107A
2328	IDNUM	62	70	40A34110
2328	IDNUM	71	79	40A34110
2328	MEDICALRECORD	24	34	400341.DAT
2328	PATIENT	36	51	PUGSLEY, Louise
2328	STREET	80	86	Orford
2328	ZIP	102	106	6528
2329	CITY	212	221	BALRANALD
2329	CITY	89	104	CHARTERS TOWERS
2329	STATE	106	109	VIC
2329	ZIP	111	115	6516
2329	CITY	89	104	CHARTERS TOWERS
2329	DATE	141	149	3/8/2015	2015-03-08
2329	DATE	169	178	15/7/2065	2065-07-15
2329	DATE	2374	2381	16/7/65	2065-07-16
2329	DEPARTMENT	195	211	MED/SURGERY WARD
2329	HOSPITAL	212	243	BALRANALD MULTI PURPOSE SERVICE
2329	DOCTOR	2412	2422	J Strevell
2329	DOCTOR	247	273	Demetrius SHARIE Lokhmatov
2329	HOSPITAL	401	428	WALCHA MULTIPURPOSE SERVICE
2329	IDNUM	14	24	34B792365G
2329	IDNUM	63	71	34B79236
2329	IDNUM	72	80	34B79236
2329	MEDICALRECORD	25	35	340792.JQO
2329	PATIENT	37	52	SCHMERGE, LONDA
2329	STATE	106	109	VIC
2329	STATE	239	242	VIC
2329	STATE	424	427	VIC
2329	STREET	81	88	Halborn
2329	ZIP	111	115	6516
2331	CITY	6703	6713	NARACOORTE
2331	CITY	83	93	CANOWINDRA
2331	STATE	95	97	NT
2331	ZIP	99	103	2790
2331	CITY	83	93	CANOWINDRA
2331	DATE	129	137	1/5/1999	1999-01-05
2331	DATE	157	166	30/7/2065	2065-07-30
2331	DATE	298	305	26.8.65	2065-08-26
2331	DATE	6636	6643	26.8.65	2065-08-26
2331	DEPARTMENT	183	204	DOMAIN AGED CARE RM 2
2331	HOSPITAL	205	233	SOUTH EAST REGIONAL HOSPITAL
2331	DOCTOR	1445	1457	T Grindeland
2331	DOCTOR	237	257	Arnold Sheree SLAGER
2331	DOCTOR	6284	6306	JONATHON Schwarzenberg
2331	HOSPITAL	6346	6352	MUDGEE
2331	DOCTOR	6655	6668	Augustus Tave
2331	HOSPITAL	6670	6690	ST JOSEPH'S HOSPITAL
2331	IDNUM	13	23	76K994172D
2331	IDNUM	5963	5971	76K99417
2331	IDNUM	64	72	76K99417
2331	MEDICALRECORD	24	35	7649941.TFD
2331	PATIENT	37	53	LEPEZ, Kamilaroi
2331	PATIENT	73	82	Finchmead
2331	STATE	282	284	NT
2331	STATE	4109	4111	NT
2331	STATE	6620	6622	NT
2331	STATE	95	97	NT
2331	ZIP	99	103	2790
2332	CITY	80	93	VICTOR HARBOR
2332	STATE	95	110	South Australia
2332	ZIP	110	114	5267
2332	DATE	140	149	17/7/1990	1990-07-17
2332	DATE	169	178	17/8/2065	2065-08-17
2332	DATE	2854	2861	18/8/65	2065-08-18
2332	DEPARTMENT	195	200	SEALS
2332	HOSPITAL	201	218	THEODORE HOSPITAL
2332	DOCTOR	222	241	Elmer CHAS SCHACHER
2332	DOCTOR	2902	2909	Q Piety
2332	DOCTOR	2917	2926	Q Blotsky
2332	IDNUM	14	24	61L434330J
2332	IDNUM	63	71	61L43433
2332	MEDICALRECORD	25	36	6144343.IAJ
2332	PATIENT	38	52	Kusky, Barrett
2332	STREET	72	79	Minchin
2333	CITY	202	208	PARKES
2333	CITY	87	98	TWEED HEADS
2333	STATE	100	110	Queensland
2333	ZIP	112	116	3922
2333	CITY	87	98	TWEED HEADS
2333	DATE	142	151	8/11/2008	2008-11-11
2333	DATE	171	181	23/10/2057	2057-10-23
2333	DATE	4981	4991	25.10.2057	2057-10-25
2333	DEPARTMENT	202	215	PARKES 7 EAST
2333	HOSPITAL	216	252	BATLOW/ADELONG MULTI PURPOSE SERVICE
2333	DOCTOR	257	270	ONITA LICHOTA
2333	DOCTOR	3221	3235	R. Chrostowski
2333	IDNUM	13	23	66P216947I
2333	IDNUM	64	72	66P21694
2333	MEDICALRECORD	24	35	6652169.KSI
2333	PATIENT	37	53	AMOSS, KRISTOFER
2333	STATE	100	110	Queensland
2333	STATE	78	86	Victoria
2333	STREET	73	86	East Victoria
2333	ZIP	112	116	3922
2334	CITY	84	92	CULBURRA
2334	STATE	94	102	Tasmania
2334	ZIP	104	108	2303
2334	CITY	84	92	CULBURRA
2334	DATE	134	143	13/5/2014	2014-05-13
2334	DATE	163	171	3/5/2065	2065-03-05
2334	DEPARTMENT	188	200	Cytogenetics
2334	HOSPITAL	203	220	ATHERTON HOSPITAL
2334	DOCTOR	224	238	SAMMIE Gihring
2334	DOCTOR	257	262	Kovac
2334	DOCTOR	3531	3538	P Tolly
2334	IDNUM	13	23	51Q757204O
2334	IDNUM	3845	3853	51Q75720
2334	IDNUM	63	71	51Q75720
2334	MEDICALRECORD	24	35	5167572.AMO
2334	PATIENT	37	52	Gausman, BENNIE
2334	STATE	94	102	Tasmania
2334	STREET	72	83	Calco Creek
2334	ZIP	104	108	2303
2335	CITY	203	211	GOULBURN
2335	CITY	228	238	SHEPPARTON
2335	CITY	90	96	LEGANA
2335	STATE	98	108	Queensland
2335	ZIP	110	114	4420
2335	DATE	140	148	4/1/2000	2000-01-04
2335	DATE	168	178	17/08/2065	2065-08-17
2335	DATE	2166	2173	18/8/65	2065-08-18
2335	DEPARTMENT	199	202	ACT
2335	HOSPITAL	203	245	GOULBURN VALLEY HEALTH - SHEPPARTON CAMPUS
2335	DOCTOR	2204	2210	I Relf
2335	DOCTOR	249	275	Ezekiel ENRIQUE LUCZKOWIAK
2335	DOCTOR	5173	5183	I Berntsen
2335	HOSPITAL	5204	5220	EMERALD HOSPITAL
2335	IDNUM	14	24	30D379111I
2335	IDNUM	4892	4896	btwn
2335	IDNUM	71	79	30D37911
2335	MEDICALRECORD	25	36	3013791.EDI
2335	PATIENT	38	60	KEANU, Garland Vincent
2335	STATE	199	202	ACT
2335	STATE	98	108	Queensland
2335	STREET	80	89	Wellswood
2335	ZIP	110	114	4420
2336	DATE	54	62	5/8/2064	2064-05-08
2336	DOCTOR	238	240	PJ
2336	DOCTOR	242	244	WL
2336	DATE	248	254	5.7.64	2064-07-05
2336	DOCTOR	284	292	X Lovitz
2336	DOCTOR	639	647	X. Salim
2336	TIME	651	661	05/08/2064	2064-08-05T17:00
2336	IDNUM	30	38	88A30927
2336	MEDICALRECORD	1	12	8803092.TYQ
2336	PATIENT	13	29	Daye, Cohen-HUNG
2337	CITY	91	100	MERIMBULA
2337	STATE	102	104	NT
2337	ZIP	106	110	6956
2337	CITY	91	100	MERIMBULA
2337	DATE	136	144	1/4/2028	2028-04-01
2337	DATE	1394	1401	18.4.65	2065-04-18
2337	DATE	164	174	15/04/2065	2065-04-15
2337	DEPARTMENT	195	199	HAPS
2337	HOSPITAL	200	236	BATLOW/ADELONG MULTI PURPOSE SERVICE
2337	DOCTOR	1433	1439	H Ruhn
2337	DOCTOR	240	258	Lee WILBURN Readus
2337	IDNUM	13	23	20I691086N
2337	IDNUM	70	78	20I69108
2337	MEDICALRECORD	24	35	2036910.VQN
2337	PATIENT	37	59	Wallick, WESLEY Horace
2337	STATE	102	104	NT
2337	STREET	79	90	Sheepcoates
2337	ZIP	106	110	6956
2338	CITY	96	107	COOTAMUNDRA
2338	STATE	109	127	Northern Territory
2338	ZIP	129	133	8069
2338	DATE	1171	1178	14.4.65	2065-04-14
2338	DATE	168	177	26/1/2017	2017-01-26
2338	DATE	197	206	13/4/2065	2065-04-13
2338	DEPARTMENT	223	242	PERI-OPERATIVE UNIT
2338	HOSPITAL	243	283	EAST WIMMERA HEALTH SERVICE - WYCHEPROOF
2338	DOCTOR	1122	1130	F Mcabee
2338	TIME	1134	1154	9:35am on 13.04.2065	2065-04-13T09:35
2338	DOCTOR	1208	1216	F Carlow
2338	DOCTOR	2374	2384	F. Jakubek
2338	TIME	2388	2405	14:00 on 15/04/65	2065-04-15T14:00
2338	DOCTOR	286	317	IRVING Ilyang Teodoro-MCDEARMON
2338	IDNUM	14	24	25J042244T
2338	IDNUM	64	72	25J04224
2338	IDNUM	73	81	25J04224
2338	MEDICALRECORD	25	36	2530422.LLT
2338	PATIENT	38	53	Hartz, MARVEL F
2338	STATE	109	127	Northern Territory
2338	STREET	82	95	Bellevue Hill
2338	ZIP	129	133	8069
2339	DATE	250	257	22.5.64	2064-05-22
2339	DATE	50	59	26/5/2064	2064-05-26
2339	DOCTOR	287	294	P Rodan
2339	IDNUM	26	34	57S34405
2339	MEDICALRECORD	1	11	577344.AOC
2339	PATIENT	12	25	Verrell, YONG
2340	CITY	103	111	CULBURRA
2340	STATE	113	115	WA
2340	ZIP	117	121	5720
2340	CITY	103	111	CULBURRA
2340	DATE	162	171	30/8/2022	2022-08-30
2340	DATE	191	200	26/8/2065	2065-08-26
2340	DATE	875	882	27.8.65	2065-08-27
2340	DEPARTMENT	217	235	105 HAMRUN CIRCUIT
2340	HOSPITAL	238	257	GORDONVALE HOSPITAL
2340	DOCTOR	2005	2013	N Dibari
2340	DOCTOR	261	275	Ramiro MACCINI
2340	DOCTOR	965	976	N Saltzberg
2340	IDNUM	14	24	51T784218V
2340	IDNUM	65	73	51T78421
2340	IDNUM	74	82	51T78421
2340	IDNUM	83	91	51T78421
2340	MEDICALRECORD	25	35	517784.GEX
2340	PATIENT	37	55	BELIN, Sharice JON
2340	STATE	113	115	WA
2340	STREET	92	102	Riverbirch
2340	ZIP	117	121	5720
2342	CITY	102	110	BRISBANE
2342	STATE	112	127	South Australia
2342	ZIP	129	133	7270
2342	CITY	102	110	BRISBANE
2342	DATE	174	183	30/8/2022	2022-08-30
2342	DATE	203	212	26/8/2065	2065-08-26
2342	DATE	888	895	27.8.65	2065-08-27
2342	DEPARTMENT	229	237	Southern
2342	HOSPITAL	240	257	MORANBAH HOSPITAL
2342	DOCTOR	2126	2134	X Miosky
2342	DOCTOR	261	277	JERRELL Braisted
2342	DOCTOR	319	326	Trenton
2342	DOCTOR	978	988	X Samantha
2342	IDNUM	13	23	83C986025S
2342	IDNUM	68	76	83C98602
2342	IDNUM	77	85	83C98602
2342	IDNUM	86	94	83C98602
2342	MEDICALRECORD	24	34	830986.AGO
2342	PATIENT	36	57	Burgoa, Lucy MANDUWAY
2342	STATE	112	127	South Australia
2342	STREET	95	101	Teague
2342	ZIP	129	133	7270
2344	CITY	105	113	BALLARAT
2344	STATE	115	130	New South Wales
2344	ZIP	132	136	1215
2344	CITY	105	113	BALLARAT
2344	DATE	177	186	30/8/2022	2022-08-30
2344	DATE	206	215	26/8/2065	2065-08-26
2344	DATE	899	906	27.8.65	2065-08-27
2344	DEPARTMENT	232	235	DHM
2344	HOSPITAL	238	279	BARWON HEALTH - NEWCOMB RENAL UNIT CAMPUS
2344	DOCTOR	2197	2204	E Swarb
2344	DOCTOR	283	295	Thanh Mathus
2344	DOCTOR	337	341	Ryan
2344	DOCTOR	989	997	E Hainds
2344	IDNUM	13	23	88D436283Y
2344	IDNUM	69	77	88D43628
2344	IDNUM	78	86	88D43628
2344	IDNUM	87	95	88D43628
2344	MEDICALRECORD	24	34	881436.GWJ
2344	PATIENT	36	58	Benett, LEAH GUADALUPE
2344	PATIENT	96	104	Allemand
2344	STATE	115	130	New South Wales
2344	ZIP	132	136	1215
2345	DATE	2194	2201	30.3.65	2065-03-30
2345	DATE	55	63	4/2/2065	2065-02-04
2345	DOCTOR	2231	2237	O Carr
2345	IDNUM	31	39	57Q05820
2345	MEDICALRECORD	2	13	5760582.AAS
2345	PATIENT	14	30	MELVILLE, Fausto
2346	CITY	78	88	PORT FAIRY
2346	STATE	90	92	WA
2346	ZIP	94	98	6639
2346	CITY	78	88	PORT FAIRY
2346	DATE	124	133	3/11/1991	1991-11-03
2346	DATE	153	162	29/3/2065	2065-03-29
2346	DATE	2341	2348	29.3.65	2065-03-29
2346	DEPARTMENT	179	197	PERI-OPERATIVEUNIT
2346	HOSPITAL	198	232	GOWER WILSON MULTI PURPOSE SERVICE
2346	DOCTOR	236	263	Rosario Bernardo DUCHNOWSKI
2346	DOCTOR	2380	2393	H Dechamplain
2346	IDNUM	13	23	36E770116L
2346	IDNUM	62	70	36E77011
2346	MEDICALRECORD	24	35	3617701.DQL
2346	PATIENT	37	51	MOBERLY, JAIME
2346	PATIENT	71	77	Bruell
2346	STATE	90	92	WA
2346	ZIP	94	98	6639
2347	CITY	203	214	HEALESVILLE
2347	CITY	2445	2452	SEYMOUR
2347	CITY	85	100	NORTH WONTHAGGI
2347	CITY	85	100	NORTH WONTHAGGI
2347	DATE	134	144	28/12/2019	2019-12-28
2347	DATE	1495	1502	18.8.65	2065-08-18
2347	DATE	164	173	17/8/2065	2065-08-17
2347	DEPARTMENT	190	202	Cytogenetics
2347	HOSPITAL	203	234	HEALESVILLE & DISTRICT HOSPITAL
2347	DOCTOR	1532	1541	U Sanghvi
2347	DOCTOR	238	261	YARRANJI YARA-MAY Bovio
2347	IDNUM	13	23	90S842380L
2347	IDNUM	69	77	84F01303
2347	MEDICALRECORD	24	34	907842.IWC
2347	ORGANIZATION	2430	2443	General Mills
2347	HOSPITAL	2445	2459	SEYMOUR HEALTH
2347	PATIENT	36	58	Bolden, Blair Dorethea
2347	STREET	78	84	Elmlea
2347	ZIP	104	108	6489
2348	DATE	50	59	24/7/2065	2065-07-24
2348	DATE	913	920	21.7.65	2065-07-21
2348	DOCTOR	953	964	J Milinazzo
2348	IDNUM	26	34	32B03419
2348	MEDICALRECORD	2	12	320034.CZT
2348	PATIENT	13	25	Riera, BLAKE
2349	CITY	5624	5630	TEMORA
2349	CITY	86	95	TOM PRICE
2349	STATE	97	100	VIC
2349	ZIP	102	106	5720
2349	CITY	86	95	TOM PRICE
2349	DATE	132	142	17/10/1987	1987-10-17
2349	DATE	162	171	13/8/2065	2065-08-13
2349	DATE	2345	2352	13.8.65	2065-08-13
2349	DEPARTMENT	188	204	DAY SURGERY UNIT
2349	HOSPITAL	205	234	PETER MACCALLUM CANCER CENTRE
2349	DOCTOR	238	255	DANE MARINE ELZEY
2349	DOCTOR	2432	2443	H Kittelson
2349	DOCTOR	2464	2473	H Tablada
2349	TIME	2477	2497	1:20pm on 13.08.2065	2065-08-13T13:20
2349	DOCTOR	2547	2553	H Wild
2349	DOCTOR	2580	2589	H Zachery
2349	TIME	2593	2614	13:31pm on 13.08.2065	2065-08-13T13:31
2349	DOCTOR	2646	2654	H Kopiak
2349	IDNUM	13	23	26C584355O
2349	IDNUM	68	76	26C58435
2349	MEDICALRECORD	24	35	2605843.POO
2349	ORGANIZATION	5602	5622	Coventry Health Care
2349	HOSPITAL	5624	5639	TEMORA HOSPITAL
2349	PATIENT	37	57	REGES, DANUTA HOWARD
2349	STATE	97	100	VIC
2349	STREET	77	85	Sawhorse
2349	ZIP	102	106	5720
2350	DATE	418	425	14.3.65	2065-03-14
2350	DATE	51	60	16/3/2065	2065-03-16
2350	DOCTOR	455	464	R Hartlep
2350	IDNUM	27	35	68L78616
2350	MEDICALRECORD	2	13	6847861.RGK
2350	PATIENT	14	26	Annas, LYMAN
2352	CITY	218	230	CAMPBELLTOWN
2352	CITY	93	108	CLIFTON SPRINGS
2352	STATE	110	113	TAS
2352	ZIP	115	119	5374
2352	DATE	145	154	13/7/2000	2000-07-13
2352	DATE	174	182	9/3/2065	2065-03-09
2352	DEPARTMENT	199	217	105 HAMRUN CIRCUIT
2352	HOSPITAL	218	239	CAMPBELLTOWN HOSPITAL
2352	DOCTOR	1092	1101	O Bartman
2352	DOCTOR	1108	1114	O Saab
2352	DOCTOR	1115	1127	O Taschereau
2352	TIME	1131	1148	11.20 on 09.03.65	2065-03-11Taschereau
2352	DOCTOR	1954	1961	O Hoeck
2352	DOCTOR	243	256	PEDRO PURKETT
2352	DOCTOR	3079	3092	Judith Ugalde
2352	DOCTOR	3094	3131	EAST WIMMERA HEALTH SERVICE - BIRCHIP
2352	IDNUM	13	23	53M127320Q
2352	IDNUM	71	79	53M12732
2352	MEDICALRECORD	24	34	534127.IHA
2352	PATIENT	36	60	BILLOPS, Augustine HYMAN
2352	STATE	110	113	TAS
2352	STREET	80	92	North Midway
2352	ZIP	115	119	5374
2357	CITY	88	97	DELORAINE
2357	STATE	99	114	New South Wales
2357	ZIP	116	120	1565
2357	DATE	146	156	26/12/2000	2000-12-26
2357	DATE	176	184	9/3/2065	2065-03-09
2357	DEPARTMENT	200	215	DAY SURGERYUNIT
2357	HOSPITAL	218	242	HAWKER MEMORIAL HOSPITAL
2357	DOCTOR	2213	2223	Z Goodland
2357	DOCTOR	246	276	Indigo GABRIEL Ramiro-Pilarski
2357	IDNUM	13	23	95U428136N
2357	IDNUM	64	72	95U42813
2357	MEDICALRECORD	24	35	9584281.KSN
2357	ORGANIZATION	4647	4658	Capital One
2357	HOSPITAL	4660	4677	ATHERTON HOSPITAL
2357	PATIENT	37	53	Rarden, FREDERIC
2357	STATE	99	114	New South Wales
2357	STREET	73	87	Gallows Branch
2357	ZIP	116	120	1565
2357	ZIP	552	556	2141
2358	CITY	87	94	NAMBOUR
2358	STATE	96	98	SA
2358	ZIP	100	104	4611
2358	CITY	87	94	NAMBOUR
2358	DATE	130	139	14/5/1999	1999-05-14
2358	DATE	159	168	4/12/2065	2065-12-04
2358	DATE	1801	1808	13.4.65	2065-04-13
2358	DEPARTMENT	184	201	ST GEORGE PRIVATE
2358	HOSPITAL	202	230	BINGARA MULTIPURPOSE SERVICE
2358	DOCTOR	1841	1849	W Kawata
2358	DOCTOR	234	253	Gus WERNER KIRKLAND
2358	DOCTOR	272	276	SAUL
2358	IDNUM	14	24	80V879304T
2358	IDNUM	66	74	80V87930
2358	MEDICALRECORD	25	36	8088793.AMT
2358	PATIENT	38	55	LENNINGTON, MALIK
2358	STATE	272	274	SA
2358	STATE	363	365	SA
2358	STATE	96	98	SA
2358	STREET	75	86	Clara Maass
2358	ZIP	100	104	4611
2359	CITY	79	86	MARGATE
2359	STATE	88	91	TAS
2359	CITY	79	86	MARGATE
2359	DATE	123	132	8/10/2023	2023-10-10
2359	DATE	152	162	16/12/2064	2064-12-16
2359	DEPARTMENT	183	206	Molecular Oncology Unit
2359	HOSPITAL	207	226	SPRINGSURE HOSPITAL
2359	DOCTOR	230	251	BENNIE MURIELE ODMARK
2359	DOCTOR	2631	2633	CP
2359	DATE	2637	2645	16.12.64	2064-12-16
2359	DOCTOR	2676	2682	G Peil
2359	IDNUM	13	23	22E071111P
2359	IDNUM	59	67	22E07111
2359	MEDICALRECORD	24	34	221071.DCE
2359	ORGANIZATION	3699	3716	Fluor Corporation
2359	HOSPITAL	3718	3735	SUNSHINE HOSPITAL
2359	PATIENT	36	48	AUKES, Tilly
2359	PATIENT	68	78	St Norbert
2359	STATE	88	91	TAS
2359	ZIP	93	97	3336
2360	CITY	218	229	MEEKATHARRA
2360	CITY	92	101	WAHGUNYAH
2360	STATE	103	106	VIC
2360	ZIP	108	112	2089
2360	CITY	92	101	WAHGUNYAH
2360	DATE	138	148	16/11/1985	1985-11-16
2360	DATE	168	178	26/01/2065	2065-01-26
2360	DATE	2409	2416	27.1.65	2065-01-27
2360	DEPARTMENT	199	215	DAY SURGERY UNIT
2360	HOSPITAL	218	238	MEEKATHARRA HOSPITAL
2360	DOCTOR	2447	2456	E Jageman
2360	DOCTOR	2460	2469	E Huisman
2360	DOCTOR	242	266	Hershel Fredrick SCULLIN
2360	DOCTOR	285	291	Hubert
2360	IDNUM	14	24	17F511379V
2360	IDNUM	72	80	17F51137
2360	MEDICALRECORD	25	36	1725113.SYV
2360	PATIENT	38	61	Breault, JANUARY Kenton
2360	PATIENT	81	91	Shackliffe
2360	STATE	103	106	VIC
2360	ZIP	108	112	2089
2361	CITY	245	254	NEWCASTLE
2361	CITY	88	97	DANDENONG
2361	STATE	99	107	Tasmania
2361	ZIP	109	113	1236
2361	CITY	88	97	DANDENONG
2361	DATE	145	154	17/8/2018	2018-08-17
2361	DATE	174	184	09/01/2065	2065-01-09
2361	DEPARTMENT	205	215	Immunology
2361	HOSPITAL	218	261	JOHN HUNTER HOSPITAL ROYAL NEWCASTLE CENTRE
2361	DOCTOR	1163	1169	O Real
2361	DOCTOR	265	283	Sal ABRAM Esselman
2361	DOCTOR	302	306	RADU
2361	IDNUM	13	23	59O713186R
2361	IDNUM	65	73	59O71318
2361	IDNUM	74	82	59O71318
2361	MEDICALRECORD	24	35	5957131.VQR
2361	PATIENT	37	54	LOT, Lashawna JOE
2361	PATIENT	83	87	Nook
2361	STATE	99	107	Tasmania
2361	ZIP	109	113	1236
2362	CITY	93	99	CAIRNS
2362	STATE	101	103	SA
2362	ZIP	101	103	SA
2362	ZIP	105	109	2018
2362	CITY	93	99	CAIRNS
2362	DATE	135	144	27/5/2026	2026-05-27
2362	DATE	162	172	13/01/2065	2065-01-13
2362	DATE	4439	4446	15/1/65	2065-01-15
2362	DEPARTMENT	193	210	ST GEORGE PRIVATE
2362	HOSPITAL	211	228	MORANBAH HOSPITAL
2362	DOCTOR	233	260	Madilynn Berry Ertzbischoff
2362	DOCTOR	772	779	I. Aloi
2362	TIME	783	801	3.10pm on 13.01.65	65-01-13T15:10
2362	IDNUM	13	23	37B435092L
2362	IDNUM	68	76	37B43509
2362	MEDICALRECORD	24	35	3704350.YHL
2362	PATIENT	37	57	Steinhauser, DENNY I
2362	STATE	101	103	SA
2362	STATE	4240	4242	SA
2362	STREET	76	89	Oak Brookdale
2362	ZIP	105	109	2018
2363	CITY	103	111	WERRIBEE
2363	STATE	113	116	QLD
2363	ZIP	118	122	6375
2363	CITY	103	111	WERRIBEE
2363	CITY	304	309	Dukes
2363	DATE	338	342	2062	2062
2363	DATE	154	162	5/3/1984	1984-03-05
2363	DATE	182	191	30/9/2064	2064-09-30
2363	DEPARTMENT	207	221	ANTENATAL WARD
2363	HOSPITAL	224	245	MOUNT DRUITT HOSPITAL
2363	DOCTOR	2186	2188	YG
2363	DOCTOR	2189	2191	UF
2363	DATE	2195	2202	10.1.64	2064-01-10
2363	DOCTOR	2233	2241	P Jergen
2363	DOCTOR	2247	2254	P Waite
2363	DOCTOR	249	271	Lyle Gilberto CASEMENT
2363	DOCTOR	991	1003	Bert Bristle
2363	DOCTOR	1027	1034	G Stemm
2363	TIME	1038	1058	1:56pm on 30.09.2064	2064-09-30T13:56
2363	IDNUM	14	24	22C875350R
2363	IDNUM	73	81	22C87535
2363	IDNUM	82	90	22C87535
2363	MEDICALRECORD	25	36	2218753.OBR
2363	PATIENT	38	62	WINNING, RIKKI Georgetta
2363	PATIENT	91	102	Wm Clifford
2363	STATE	113	116	QLD
2363	ZIP	118	122	6375
2364	DATE	49	58	22/7/2054	2054-07-22
2364	DOCTOR	1367	1369	ZV
2364	DOCTOR	1370	1372	GB
2364	DATE	1376	1383	18.7.64	2064-07-18
2364	DOCTOR	1414	1420	E Dedo
2364	IDNUM	25	33	38V92747
2364	MEDICALRECORD	1	12	3889274.SSI
2364	PATIENT	13	24	HAKES, HUNG
2365	CITY	85	91	URUNGA
2365	STATE	93	110	Western Australia
2365	ZIP	112	116	4506
2365	CITY	85	91	URUNGA
2365	DATE	148	157	30/7/2004	2004-07-30
2365	DATE	177	186	26/5/2065	2065-05-26
2365	DATE	2583	2590	27.5.65	2065-05-27
2365	DEPARTMENT	203	225	POSTOPERATIVE RECOVERY
2365	HOSPITAL	228	246	ESPERANCE HOSPITAL
2365	DOCTOR	1081	1091	S Tyminski
2365	DOCTOR	1092	1100	S Walzer
2365	TIME	1136	1144	26/05/65	2065-05-26T16:30
2365	DOCTOR	250	269	CLAUD Lonny Lehneis
2365	DOCTOR	2625	2635	C Quilling
2365	IDNUM	13	23	70E129283F
2365	IDNUM	60	68	70E12928
2365	IDNUM	69	77	70E12928
2365	MEDICALRECORD	24	35	7011292.VJF
2365	PATIENT	37	49	VARLEY, Ross
2365	PATIENT	78	84	Verdin
2365	STATE	93	110	Western Australia
2365	ZIP	112	116	4506
2366	CITY	88	98	PARRAMATTA
2366	STATE	100	108	Tasmania
2366	ZIP	110	114	1565
2366	CITY	88	98	PARRAMATTA
2366	DATE	140	149	26/1/2004	2004-01-26
2366	DATE	169	178	19/5/2065	2065-05-19
2366	DATE	3192	3199	20.5.65	2065-05-20
2366	DATE	839	849	19.05.2065	2065-05-19
2366	DEPARTMENT	195	235	Tissue Pathology and Diagnostic Oncology
2366	HOSPITAL	238	262	PEAK HILL HEALTH SERVICE
2366	DOCTOR	266	286	Andrea Rubin RAYSIDE
2366	DOCTOR	3232	3238	F Munk
2366	DOCTOR	814	824	F Zelenski
2366	IDNUM	14	24	13B680409U
2366	IDNUM	69	77	13B68040
2366	MEDICALRECORD	25	36	1306804.AZU
2366	PATIENT	38	58	Stanifer, Cheryll Ty
2366	STATE	100	108	Tasmania
2366	STREET	78	87	East East
2366	ZIP	110	114	1565
2367	DATE	1463	1470	14.5.65	2065-05-14
2367	DATE	73	82	15/5/2065	2065-05-15
2367	DOCTOR	1500	1512	P Liberatore
2367	IDNUM	40	48	55J88221
2367	IDNUM	49	57	55J88221
2367	MEDICALRECORD	1	12	5538822.CQQ
2367	PATIENT	13	39	ROBLOW, Anton Ngarrindjeri
2368	DATE	1379	1386	14.5.65	2065-05-14
2368	DATE	71	80	15/5/2065	2065-05-15
2368	DOCTOR	1419	1431	N Hoffmaster
2368	IDNUM	38	46	50K33247
2368	IDNUM	47	55	50K33247
2368	MEDICALRECORD	1	12	5043324.SLW
2368	PATIENT	13	37	Takahashi, COLE DOMINICA
2369	CITY	90	95	GRETA
2369	STATE	97	100	VIC
2369	ZIP	102	106	6429
2369	CITY	90	95	GRETA
2369	DATE	141	150	2/12/2008	2008-02-12
2369	DATE	170	179	19/5/2065	2065-05-19
2369	DATE	1807	1814	20/5/65	2065-05-20
2369	DEPARTMENT	196	214	Molecular Oncology
2369	HOSPITAL	216	252	FLINDERS ISLAND MULTI PURPOSE CENTRE
2369	DOCTOR	1849	1859	X Beninato
2369	DOCTOR	256	275	SHAD Leroy DESCHNER
2369	DOCTOR	294	302	Augustus
2369	IDNUM	14	24	82T5342817
2369	IDNUM	62	70	82T53428
2369	IDNUM	71	79	82T53428
2369	MEDICALRECORD	25	36	8275342.VCS
2369	PATIENT	38	51	HAYEK, MAXIMO
2369	STATE	97	100	VIC
2369	STREET	80	89	Buttfield
2369	ZIP	102	106	6429
2370	DATE	68	76	5/8/2065	2065-05-08
2370	DOCTOR	1451	1461	Q Horrigan
2370	IDNUM	35	43	86U07554
2370	IDNUM	44	52	86U07554
2370	MEDICALRECORD	1	12	8670755.KXY
2370	PATIENT	13	34	SHAMES, JUSTIN NOBUKO
2371	DATE	72	80	4/8/2065	2065-04-04
2371	DOCTOR	447	456	O Emenaha
2371	IDNUM	39	47	55I69645
2371	IDNUM	48	56	55I69645
2371	MEDICALRECORD	2	13	1812772.NPV
2371	PATIENT	14	38	SZYMANSKY, JULIAN Barton
2372	DATE	67	75	4/2/2065	2065-02-04
2372	DATE	818	825	30.3.65	2065-03-30
2372	DOCTOR	845	853	Y Bowron
2372	IDNUM	34	42	97Q89826
2372	IDNUM	43	51	97Q89826
2372	IDNUM	876	884	97Q89826
2372	MEDICALRECORD	1	12	9768982.RFP
2372	PATIENT	13	33	BENELL, DARIO Harold
2374	CITY	100	107	PENRITH
2374	CITY	100	107	PENRITH
2374	STATE	109	111	SA
2374	ZIP	113	117	0850
2374	DATE	152	160	5/9/1983	1983-05-09
2374	DATE	4684	4691	18/6/65	2065-06-18
2374	DATE	4805	4812	23.6.65	2065-06-23
2374	DATE	5663	5672	19.9.2065	2065-09-19
2374	DEPARTMENT	211	229	FAIRFIELD HOSPITAL
2374	DOCTOR	233	248	Bryon Willinsky
2374	DOCTOR	2426	2435	M. Tegner
2374	DOCTOR	267	270	JIM
2374	DOCTOR	275	282	Laverne
2374	DOCTOR	4769	4771	ZN
2374	DOCTOR	4795	4802	Grocott
2374	IDNUM	13	23	45N919220X
2374	IDNUM	72	80	45N91922
2374	IDNUM	81	89	45N91922
2374	MEDICALRECORD	24	34	455919.HGB
2374	ORGANIZATION	4867	4887	Liberty Media WONDAI
2374	DEPARTMENT	4875	4896	Media WONDAI HOSPITAL
2374	PATIENT	36	61	Jarvie, VALENTINE Heather
2374	STATE	109	111	SA
2374	STATE	4439	4441	SA
2374	STATE	4543	4545	SA
2374	STATE	4653	4655	SA
2374	STREET	90	99	Thurlgona
2374	TIME	180	190	17/06/2065	2065-06-17T09:28
2374	ZIP	113	117	0850
2376	CITY	237	246	BALRANALD
2376	CITY	90	99	WAHGUNYAH
2376	STATE	101	119	Northern Territory
2376	ZIP	121	125	4029
2376	CITY	90	99	WAHGUNYAH
2376	DATE	151	159	4/1/2000	2000-01-04
2376	DATE	179	189	17/08/2065	2065-08-17
2376	DATE	2222	2229	18/8/65	2065-08-18
2376	DATE	354	363	22.9.2065	2065-09-22
2376	DATE	6416	6425	22.9.2065	2065-09-22
2376	DATE	6897	6904	17/9/65	2065-09-17
2376	DEPARTMENT	210	236	BRIGHAM & WOMEN'S HOSPITAL
2376	HOSPITAL	237	268	BALRANALD MULTI PURPOSE SERVICE
2376	DEPARTMENT	6440	6461	Pathology ACT Genetic
2376	DOCTOR	2260	2269	K Brohawn
2376	DOCTOR	272	294	Marcelino MILAN STETKE
2376	DOCTOR	5236	5249	K Keomanivong
2376	HOSPITAL	5253	5266	MACQUARIEWARD
2376	DOCTOR	6481	6488	K Lopez
2376	DOCTOR	6652	6666	CRAIG CAPRIOLA
2376	TIME	6609	6616	17/8/65	2065-08-17T15:00
2376	IDNUM	14	24	40N369588D
2376	IDNUM	6543	6551	40N36958
2376	IDNUM	68	76	40N36958
2376	MEDICALRECORD	25	36	4053695.VVD
2376	PATIENT	38	57	Cione, DANNY RODNEY
2376	STATE	101	119	Northern Territory
2376	STATE	6450	6453	ACT
2376	STREET	77	89	S E Frontage
2376	ZIP	121	125	4029
2377	CITY	105	112	NAMBOUR
2377	STATE	114	116	NT
2377	ZIP	118	122	4678
2377	CITY	105	112	NAMBOUR
2377	DATE	148	158	17/10/2027	2027-10-17
2377	DATE	7626	7633	26/6/65	2065-06-26
2377	DEPARTMENT	209	227	105 HAMRUN CIRCUIT
2377	HOSPITAL	228	243	WARREN HOSPITAL
2377	DOCTOR	248	271	Evelina MANDUWAY Roelle
2377	IDNUM	13	23	82W661395A
2377	IDNUM	86	94	82W66139
2377	MEDICALRECORD	24	34	828661.HYN
2377	PATIENT	35	58	Jungwirth, MICHEL Nyin
2377	PATIENT	95	104	S Hermosa
2377	STATE	114	116	NT
2377	STATE	3803	3805	NT
2377	STATE	3960	3962	NT
2377	STATE	499	501	NT
2377	STATE	6858	6860	NT
2377	STATE	7016	7018	NT
2377	STATE	832	834	NT
2377	TIME	178	197	23/06/2065 at 12:46	2065-06-23T12:46
2377	ZIP	118	122	4678
2378	CITY	81	91	PENRITHACT
2378	STATE	88	91	ACT
2378	ZIP	93	97	3334
2378	DATE	123	132	24/3/2015	2015-03-24
2378	DATE	2350	2357	20.8.65	2065-08-20
2378	DEPARTMENT	183	188	Palms
2378	HOSPITAL	189	227	BOYUP BROOK SOLDIERS MEMORIAL HOSPITAL
2378	DOCTOR	231	253	Denver Angelina CHIZEK
2378	DOCTOR	2387	2400	X Bonaventure
2378	DOCTOR	2416	2424	X Nygren
2378	IDNUM	13	23	98P603411R
2378	IDNUM	65	73	98P60341
2378	MEDICALRECORD	24	35	9856034.CDR
2378	ORGANIZATION	3260	3279	International Paper
2378	HOSPITAL	3287	3302	MORGAN HOSPITAL
2378	PATIENT	37	54	HALGRIMSON, Peter
2378	PATIENT	74	80	Office
2378	TIME	152	171	19/08/2065 at 09:54	2065-08-19T09:54
2378	ZIP	93	97	3334
2379	CITY	102	118	SHOALHAVEN HEADS
2379	STATE	120	138	Northern Territory
2379	ZIP	140	144	7120
2379	CITY	102	118	SHOALHAVEN HEADS
2379	DATE	176	185	14/8/2009	2009-08-14
2379	DATE	205	213	5/5/2065	2065-05-05
2379	DEPARTMENT	230	248	PERI-OPERATIVEUNIT
2379	HOSPITAL	251	300	KAROONDA AND DISTRICT SOLDIERS' MEMORIAL HOSPITAL
2379	DOCTOR	1241	1249	R Molden
2379	DOCTOR	1256	1264	R Benesh
2379	DOCTOR	1265	1275	R Pagnozzi
2379	TIME	1279	1297	2.20pm on 05.05.65	2066-05-06T14:20
2379	DOCTOR	300	325	SARGE JULIAN FAUSNAUGHGIN
2379	DOCTOR	346	352	BUFORD
2379	DOCTOR	357	365	Marshall
2379	DOCTOR	4002	4015	R Zuehlsdorff
2379	IDNUM	14	24	67C324327L
2379	IDNUM	77	85	67C32432
2379	IDNUM	86	94	67C32432
2379	MEDICALRECORD	25	36	6703243.GUL
2379	PATIENT	38	66	SAKASEGAWA, Brittny Bernardo
2379	PATIENT	95	101	Vanden
2379	STATE	120	138	Northern Territory
2379	ZIP	140	144	7120
2380	DATE	248	255	24.8.65	2065-08-24
2380	DATE	52	61	25/8/2065	2065-08-25
2380	DOCTOR	286	297	B Dambrosia
2380	IDNUM	28	36	24Y35548
2380	MEDICALRECORD	1	11	249355.LVP
2380	PATIENT	12	27	HUNTER, KRISHNA
2381	DATE	54	62	9/8/2065	2065-08-08
2381	DOCTOR	286	298	P Drozdowski
2381	IDNUM	30	38	66H54729
2381	MEDICALRECORD	2	13	6625472.XHQ
2381	PATIENT	14	29	ENGELKEN, MIKEL
2382	CITY	85	100	CLIFTON SPRINGS
2382	STATE	102	130	Australian Capital Territory
2382	ZIP	132	136	1499
2382	DATE	162	170	4/1/1992	1992-01-04
2382	DATE	190	200	18/06/2065	2065-06-18
2382	DATE	2224	2231	19.6.65	2065-06-19
2382	DEPARTMENT	221	226	SEALS
2382	HOSPITAL	227	242	MALENY HOSPITAL
2382	DOCTOR	2261	2266	N Kry
2382	DOCTOR	246	267	Andy FATIMAH FUSILIER
2382	DOCTOR	4402	4409	N Kines
2382	IDNUM	13	23	51I098450W
2382	IDNUM	63	71	51I09845
2382	MEDICALRECORD	24	34	513098.LNB
2382	PATIENT	36	52	Linman, Theodora
2382	PATIENT	72	84	Walter Scott
2382	STATE	102	130	Australian Capital Territory
2382	ZIP	132	136	1499
2383	CITY	93	99	LEGANA
2383	STATE	101	129	Australian Capital Territory
2383	ZIP	131	135	6436
2383	DATE	160	169	23/5/2013	2013-05-23
2383	DATE	1849	1856	22.9.65	2065-09-22
2383	DEPARTMENT	220	242	POSTOPERATIVE RECOVERY
2383	DOCTOR	1887	1896	X Simerly
2383	DOCTOR	261	285	Shawn YARRANJI BERBEREIA
2383	IDNUM	13	23	93R299267S
2383	IDNUM	67	75	93R29926
2383	MEDICALRECORD	24	35	9362992.QTS
2383	PATIENT	37	56	Lisle, Pearlene Jed
2383	STATE	101	129	Australian Capital Territory
2383	STREET	76	92	Chinquapin Round
2383	TIME	189	208	19/09/2065 at 09:23	2065-09-19T09:23
2383	ZIP	131	135	6436
2384	CITY	89	98	CHURCHILL
2384	STATE	100	128	Australian Capital Territory
2384	ZIP	130	134	2016
2384	CITY	89	98	CHURCHILL
2384	DATE	160	169	24/3/1986	1986-03-24
2384	DATE	189	198	23/9/2065	2065-09-23
2384	DATE	1938	1945	23/9/65	2065-09-23
2384	DEPARTMENT	215	223	Southern
2384	HOSPITAL	226	255	CONDOBOLIN RETIREMENT VILLAGE
2384	DOCTOR	1982	1987	V Ary
2384	DOCTOR	259	281	Oliver LINDSEY Benthin
2384	IDNUM	14	24	88S730425Y
2384	IDNUM	68	76	88S73042
2384	MEDICALRECORD	25	36	8867304.GNY
2384	PATIENT	38	57	Riegel, Kristi COLE
2384	STATE	100	128	Australian Capital Territory
2384	STREET	77	88	Summer Duck
2384	ZIP	130	134	2016
2385	CITY	81	88	MAREEBA
2385	STATE	90	105	New South Wales
2385	ZIP	107	111	1192
2385	CITY	81	88	MAREEBA
2385	DATE	1051	1058	24.9.65	2065-09-24
2385	DATE	137	146	21/3/2038	2038-03-21
2385	DATE	166	176	23/09/2065	2065-09-23
2385	DEPARTMENT	197	210	EAST SURGICAL
2385	HOSPITAL	211	241	BARADINE MULTI PURPOSE SERVICE
2385	DOCTOR	1090	1100	F Veldkamp
2385	DOCTOR	245	270	Rolando Tanner-Lovellette
2385	IDNUM	13	23	20A932232V
2385	IDNUM	65	73	20A93223
2385	MEDICALRECORD	24	34	200932.FIF
2385	PATIENT	36	54	Davidsen, CHAUNCEY
2385	STATE	90	105	New South Wales
2385	ZIP	107	111	1192
2387	CITY	3677	3683	CAMDEN
2387	CITY	86	91	YAMBA
2387	STATE	93	110	Western Australia
2387	ZIP	112	116	3976
2387	DATE	142	151	13/7/2000	2000-07-13
2387	DATE	171	179	3/9/2065	2065-09-03
2387	DATE	308	315	26/9/65	2065-09-26
2387	DATE	3610	3617	26/9/65	2065-09-26
2387	DEPARTMENT	196	215	PERI-OPERATIVE UNIT
2387	DOCTOR	1117	1124	D Soder
2387	DOCTOR	1131	1139	D Liloia
2387	DOCTOR	1140	1150	D Crinklaw
2387	TIME	1154	1171	11.20 on 03.09.65	2063-09-03T11:20
2387	DOCTOR	1977	1985	D Dreier
2387	DOCTOR	241	251	WILL GARRE
2387	DOCTOR	3102	3117	TOCCARA FEARING
2387	HOSPITAL	3119	3136	NARROGIN HOSPITAL
2387	HOSPITAL	3677	3692	CAMDEN HOSPITAL
2387	IDNUM	13	23	15B382499B
2387	IDNUM	69	77	15B38249
2387	MEDICALRECORD	24	34	150382.LYZ
2387	PATIENT	36	60	GARRATT, GUADALUPE Erwin
2387	PATIENT	78	85	Durbach
2387	STATE	93	110	Western Australia
2387	ZIP	112	116	3976
2398	CITY	78	87	SWAN HILL
2398	STATE	89	106	Western Australia
2398	ZIP	108	112	4565
2398	CITY	78	87	SWAN HILL
2398	DATE	138	147	14/1/1978	1978-01-14
2398	DATE	164	174	20/09/2065	2065-09-20
2398	DATE	1954	1961	22.9.65	2065-09-22
2398	DEPARTMENT	195	208	MACQUARIEWARD
2398	HOSPITAL	209	258	EASTERN EYRE HEALTH AND AGED CARE - COWELL CAMPUS
2398	DOCTOR	1996	2003	NDewitt
2398	DOCTOR	262	281	COLLIN KARYN BARNET
2398	DOCTOR	300	304	Jose
2398	IDNUM	13	23	57K684206X
2398	IDNUM	60	68	57K68420
2398	MEDICALRECORD	24	34	574684.FBR
2398	PATIENT	36	49	BRISBOIS, JON
2398	STATE	89	106	Western Australia
2398	STREET	69	77	Honolulu
2398	ZIP	108	112	4565
2400	CITY	90	101	WARRNAMBOOL
2400	STATE	103	111	Victoria
2400	ZIP	113	117	6605
2400	CITY	90	101	WARRNAMBOOL
2400	DATE	152	160	9/1/2024	2024-01-09
2400	DATE	180	188	5/5/2065	2065-05-05
2400	DEPARTMENT	205	219	ANTENATAL WARD
2400	HOSPITAL	222	236	BULLI HOSPITAL
2400	DOCTOR	240	255	TORY Boyd Dyess
2400	DOCTOR	3406	3413	L Samit
2400	IDNUM	13	23	42L025464D
2400	IDNUM	65	73	42L02546
2400	IDNUM	74	82	42L02546
2400	MEDICALRECORD	24	35	4240254.RLD
2400	PATIENT	37	54	COLASAMTE, Andrew
2400	STATE	103	111	Victoria
2400	STREET	83	89	Ripona
2400	ZIP	113	117	6605
2402	CITY	91	100	INNISFAIL
2402	STATE	102	105	VIC
2402	ZIP	107	111	2137
2402	DATE	143	152	10/2/1991	1991-02-10
2402	DATE	172	180	9/9/2064	2064-09-09
2402	DATE	7565	7572	10/1/65	2065-01-10
2402	DEPARTMENT	197	219	St Vincent's Pathology
2402	HOSPITAL	222	236	BULLI HOSPITAL
2402	DOCTOR	240	258	Marco JERAMY Dohse
2402	DOCTOR	3403	3405	OV
2402	DOCTOR	3406	3408	CF
2402	DATE	3412	3419	9.12.64	2064-12-09
2402	DOCTOR	5825	5827	EI
2402	DOCTOR	5829	5831	GT
2402	DATE	5835	5842	9.11.64	2064-11-09
2402	DOCTOR	5872	5881	V Eichler
2402	DOCTOR	886	898	DANNY Hersey
2402	TIME	917	951	10:31am on the 09th of August 2064	2064-09-09T10:31
2402	IDNUM	13	23	83U326271A
2402	IDNUM	67	75	83U32627
2402	IDNUM	76	84	83U32627
2402	MEDICALRECORD	24	35	8373262.TDA
2402	PATIENT	37	56	Ruple, CRAIG Hollis
2402	PATIENT	85	90	Plass
2402	STATE	102	105	VIC
2402	ZIP	107	111	2137
2403	CITY	94	103	MOLLYMOOK
2403	STATE	105	107	NT
2403	ZIP	109	113	6473
2403	CITY	94	103	MOLLYMOOK
2403	DATE	148	157	21/1/1998	1998-01-21
2403	DATE	177	187	17/02/2065	2065-02-17
2403	DATE	2425	2432	19.2.65	2065-02-19
2403	DATE	354	363	25.2.2065	2065-02-25
2403	DATE	4488	4497	25.2.2065	2065-02-25
2403	DEPARTMENT	208	213	Seals
2403	HOSPITAL	216	262	TRESILLIAN FAMILY CARE CENTRE - WOLLSTONECRAFT
2403	DOCTOR	2465	2474	S Mitcham
2403	DOCTOR	266	278	MURRAY DULAC
2403	DOCTOR	368	376	S Fesler
2403	DOCTOR	3902	3910	S Sadlon
2403	DOCTOR	4502	4509	S Aydin
2403	IDNUM	14	24	78V767439G
2403	IDNUM	67	75	78V76743
2403	IDNUM	76	84	78V76743
2403	MEDICALRECORD	25	36	7887674.JYG
2403	PATIENT	38	56	Sayasane, Marshall
2403	PATIENT	85	93	Dumoulin
2403	STATE	105	107	NT
2403	STATE	241	243	NT
2403	STATE	327	329	NT
2403	STATE	4461	4463	NT
2403	ZIP	109	113	6473
2404	CITY	191	200	BALRANALD
2404	CITY	87	96	SINGLETON
2404	STATE	98	100	WA
2404	ZIP	102	106	4491
2404	CITY	87	96	SINGLETON
2404	DATE	131	140	13/7/2013	2013-07-13
2404	DATE	160	168	2/9/2065	2065-09-02
2404	DEPARTMENT	185	190	SWAPS
2404	HOSPITAL	191	222	BALRANALD MULTI PURPOSE SERVICE
2404	DOCTOR	226	248	CLEMENTE HYMAN Traczyk
2404	DOCTOR	2792	2799	D Dirth
2404	DOCTOR	2803	2814	D Chriswell
2404	IDNUM	13	23	10E969245C
2404	IDNUM	70	78	10E96924
2404	MEDICALRECORD	24	35	1019692.MPC
2404	PATIENT	37	59	DUROUSSEAU, JULES SAUL
2404	PATIENT	79	86	Dornoch
2404	STATE	186	188	WA
2404	STATE	98	100	WA
2404	ZIP	102	106	4491
2405	CITY	225	237	CAMPBELLTOWN
2405	CITY	98	104	GAWLER
2405	STATE	106	114	Victoria
2405	ZIP	116	120	4179
2405	CITY	98	104	GAWLER
2405	DATE	1518	1525	27.8.65	2065-08-27
2405	DATE	155	164	19/7/1994	1994-07-19
2405	DATE	184	193	26/8/2065	2065-08-26
2405	DEPARTMENT	210	222	SEALSCentral
2405	HOSPITAL	225	246	CAMPBELLTOWN HOSPITAL
2405	DOCTOR	1555	1567	A Kranwinkle
2405	DOCTOR	250	276	Trenton FERDINAND LOMINACK
2405	IDNUM	13	23	05F419403I
2405	IDNUM	71	79	05F41940
2405	IDNUM	80	88	05F41940
2405	MEDICALRECORD	24	35	0514194.CKI
2405	PATIENT	37	54	Novakovich, Titus
2405	STATE	106	114	Victoria
2405	STREET	89	97	Scratton
2405	ZIP	116	120	4179
2406	CITY	103	112	GLADSTONE
2406	STATE	114	117	TAS
2406	ZIP	119	123	8005
2406	CITY	103	112	GLADSTONE
2406	CITY	227	232	JUNEE
2406	DATE	158	167	13/9/2021	2021-09-13
2406	DATE	187	196	29/9/2065	2065-09-29
2406	DATE	2968	2975	30.9.65	2065-09-30
2406	DEPARTMENT	213	224	UROLOGY OPD
2406	HOSPITAL	227	254	JUNEE MULTI PURPOSE SERVICE
2406	DOCTOR	1496	1500	Joel
2406	DOCTOR	1507	1517	K Mclendon
2406	DOCTOR	1521	1530	K Stamnos
2406	TIME	1534	1555	11:15am on 29.09.2065	2065-09-29T11:15
2406	DOCTOR	258	281	EUSEBIO Michel Mcnaught
2406	DOCTOR	3005	3014	K Mincher
2406	DOCTOR	774	780	Karrak
2406	DOCTOR	787	797	K Bruender
2406	DOCTOR	801	807	K Para
2406	TIME	811	832	10:40am on 29.09.2065	2065-09-29T10:40
2406	IDNUM	14	24	47N611210E
2406	IDNUM	71	79	47N61121
2406	IDNUM	80	88	47N61121
2406	MEDICALRECORD	25	36	4756112.EBE
2406	PATIENT	38	60	MARZULLO, LESLEY HIRAM
2406	STATE	114	117	TAS
2406	STREET	89	102	Glen Hanleigh
2406	ZIP	119	123	8005
2408	CITY	81	87	KERANG
2408	STATE	89	99	Queensland
2408	ZIP	101	105	3904
2408	DATE	131	140	18/4/2001	2001-04-18
2408	DATE	324	331	1/10/65	2065-10-01
2408	DATE	4700	4707	13/9/64	2064-09-13
2408	DATE	5013	5020	3/10/65	2065-10-03
2408	DEPARTMENT	191	206	ENVOI Pathology
2408	HOSPITAL	207	225	MONA VALE HOSPITAL
2408	DOCTOR	230	252	Jeanna IRVING Kitchell
2408	DOCTOR	308	313	Lamar
2408	IDNUM	13	23	32O152478K
2408	IDNUM	61	69	32O15247
2408	MEDICALRECORD	24	34	325152.MUW
2408	PATIENT	36	50	Schloop, Genie
2408	STATE	89	99	Queensland
2408	STREET	70	80	Ridgehurst
2408	TIME	160	170	10/09/2064	2064-09-10T10:45
2408	ZIP	101	105	3904
2410	CITY	81	88	PENRITH
2410	ZIP	92	96	5046
2410	CITY	81	88	PENRITH
2410	DATE	122	130	8/7/1998	1998-07-08
2410	DATE	150	160	10/05/2065	2065-05-10
2410	DATE	1514	1521	10.5.65	2065-10-05
2410	DEPARTMENT	181	190	StVincent
2410	HOSPITAL	191	228	GOLF LINKS ROAD REHABILITATION CENTRE
2410	DOCTOR	1553	1561	S Bendis
2410	DOCTOR	232	250	Dylan JULIAN Volle
2410	IDNUM	14	24	74X354285H
2410	IDNUM	63	71	74X35428
2410	MEDICALRECORD	25	35	749354.GXN
2410	PATIENT	37	52	Emmel, Giovanni
2410	STREET	72	80	Gainford
2410	ZIP	92	96	5046
2411	CITY	76	86	CANNONVALE
2411	STATE	88	103	New South Wales
2411	ZIP	105	109	6639
2411	CITY	76	86	CANNONVALE
2411	DATE	135	144	22/9/1988	1988-09-22
2411	DATE	164	174	06/10/2065	2065-10-06
2411	DATE	1736	1743	7.10.65	2065-10-07
2411	DATE	452	461	July 2065	2065-04-18
2411	DEPARTMENT	195	214	PERI-OPERATIVE UNIT
2411	HOSPITAL	215	232	MERREDIN HOSPITAL
2411	DOCTOR	1773	1785	M Matuszeski
2411	DOCTOR	236	254	Tom Louella MEIGGS
2411	IDNUM	13	23	43L975201B
2411	IDNUM	60	68	43L97520
2411	MEDICALRECORD	24	34	434975.FAE
2411	PATIENT	36	49	ZANK, SCOTTIE
2411	PATIENT	69	75	Toluca
2411	STATE	88	103	New South Wales
2411	ZIP	105	109	6639
2412	CITY	86	91	GRETA
2412	STATE	93	96	ACT
2412	ZIP	98	102	6635
2412	CITY	86	91	GRETA
2412	DATE	128	137	23/6/2008	2008-06-23
2412	DATE	1316	1323	8.10.65	2065-10-08
2412	DATE	157	167	07/10/2065	2065-10-07
2412	DEPARTMENT	188	197	StVincent
2412	HOSPITAL	198	215	ANGASTON HOSPITAL
2412	DOCTOR	1354	1362	K Martin
2412	DOCTOR	219	243	Long MARCEL Santomassimo
2412	IDNUM	13	23	37L426469H
2412	IDNUM	69	77	37L42646
2412	MEDICALRECORD	24	35	3744264.QZH
2412	PATIENT	37	58	WESTMORELAND, Antonio
2412	STATE	93	96	ACT
2412	STREET	78	85	Westbay
2412	ZIP	98	102	6635
2414	CITY	100	115	GREENWELL POINT
2414	CITY	100	115	GREENWELL POINT
2414	STATE	117	145	Australian Capital Territory
2414	ZIP	147	151	1212
2414	DATE	186	196	30/12/2004	2004-12-30
2414	DATE	216	225	10/1/2065	2065-01-10
2414	DATE	3096	3103	10.2.65	2065-02-10
2414	DEPARTMENT	242	264	POSTOPERATIVE RECOVERY
2414	HOSPITAL	267	304	GLOUCESTER SOLDIERS MEMORIAL HOSPITAL
2414	DOCTOR	308	328	BIRRUNGA Jose COFONE
2414	DOCTOR	3133	3143	Y Sigworth
2414	DOCTOR	778	787	Y Shadler
2414	DOCTOR	794	801	Y Brint
2414	TIME	805	825	3:57pm on 10.01.2065	2065-01-10T15:57
2414	IDNUM	14	24	95I446427P
2414	IDNUM	67	75	95I44642
2414	IDNUM	76	84	95I44642
2414	MEDICALRECORD	25	36	9534464.FUP
2414	PATIENT	38	56	ARNHOLTZ, FLORENCE
2414	STATE	117	145	Australian Capital Territory
2414	STREET	85	99	East Sunnyoaks
2414	ZIP	147	151	1212
2415	DATE	61	70	13/2/2064	2064-02-13
2415	DATE	859	866	13.1.64	2064-01-13
2415	DOCTOR	1767	1775	W Rowels
2415	DOCTOR	900	910	W Crichlow
2415	IDNUM	37	45	85N76938
2415	MEDICALRECORD	1	12	8557693.XGU
2415	PATIENT	13	36	Buehlman, Dexter Justin
2416	CITY	86	96	WANGARATTA
2416	STATE	98	108	Queensland
2416	ZIP	110	114	2234
2416	DATE	140	150	25/10/2006	2006-10-25
2416	DATE	170	180	08/06/2065	2065-06-08
2416	DATE	5523	5532	8/12/2065	2065-12-08
2416	DATE	6404	6413	14.8.2065	2065-08-14
2416	DEPARTMENT	201	206	SWAPS
2416	HOSPITAL	207	226	BEAUDESERT HOSPITAL
2416	DOCTOR	231	248	Gaia IRVIN Selbig
2416	DOCTOR	3467	3476	Z. Haning
2416	DOCTOR	609	612	Bud
2416	DOCTOR	669	673	Eyer
2416	IDNUM	13	23	64A381209O
2416	IDNUM	68	76	64A38120
2416	MEDICALRECORD	24	35	6403812.AXO
2416	ORGANIZATION	5590	5599	Starbucks
2416	DEPARTMENT	5612	5640	PORT MACQUARIE BASE HOSPITAL
2416	DEPARTMENT	5653	5655	B8
2416	PATIENT	37	57	ERHOLM, Neville IVAN
2416	STATE	98	108	Queensland
2416	STREET	77	85	Shortway
2416	ZIP	110	114	2234
2417	CITY	88	96	BALLARAT
2417	STATE	98	100	WA
2417	ZIP	102	106	3520
2417	CITY	88	96	BALLARAT
2417	DATE	132	141	2/13/2025	2025-02-13
2417	DATE	1482	1489	10/9/65	2065-10-09
2417	DATE	159	167	9/9/2065	2065-09-09
2417	DATE	3124	3131	10.9.65	2065-10-09
2417	DATE	324	331	18.9.65	2065-09-18
2417	DATE	4896	4903	18.9.65	2065-09-18
2417	DATE	4968	4975	15.9.65	2065-09-15
2417	DEPARTMENT	184	199	DAY SURGERYUNIT
2417	HOSPITAL	202	228	THE ROYAL WOMEN'S HOSPITAL
2417	DOCTOR	232	255	ISAIAS ALEXANDER Fermin
2417	DOCTOR	274	278	COLE
2417	DOCTOR	3161	3171	J Spingola
2417	IDNUM	14	24	33O002215I
2417	IDNUM	72	80	33O00221
2417	MEDICALRECORD	25	36	3350022.EOI
2417	PATIENT	37	58	HUGHART, TAYL DOUGLAS
2417	PATIENT	81	87	Eggers
2417	STATE	3934	3936	WA
2417	STATE	5116	5119	ACT
2417	STATE	98	100	WA
2417	ZIP	102	106	3520
2418	DATE	1131	1138	2.10.65	2065-10-02
2418	DATE	56	65	6/10/2065	2065-10-06
2418	DOCTOR	1169	1179	H Trilling
2418	DOCTOR	1195	1202	H Ahmed
2418	DURATION	202	208	15 yrs	P15W
2418	IDNUM	32	40	28P45347
2418	MEDICALRECORD	1	12	2854534.TJO
2418	PATIENT	13	31	DEWOLF, ALLAN Kena
2419	CITY	83	122	WARRNAMBOOLAustralian Capital Territory
2419	STATE	94	122	Australian Capital Territory
2419	ZIP	124	128	2474
2419	DATE	154	163	19/5/2012	2012-05-19
2419	DATE	3830	3837	13/7/65	2065-07-13
2419	DEPARTMENT	214	231	ACUTE STROKE UNIT
2419	HOSPITAL	232	274	TEXAS HOSPITAL MULTIPURPOSE HEALTH SERVICE
2419	DOCTOR	2632	2640	W Damrow
2419	DOCTOR	279	301	Latesha Erwin VITTITOE
2419	IDNUM	13	23	86L5745318
2419	IDNUM	65	73	86L57453
2419	MEDICALRECORD	24	35	8645745.IEX
2419	ORGANIZATION	3895	3908	ONEOK BELMONT
2419	PATIENT	37	54	Finster, Yessenia
2419	STREET	74	82	Meadfoot
2419	TIME	183	202	07/09/2065 at 10:40	2065-09-07T10:40
2419	ZIP	124	128	2474
2420	DATE	1511	1518	12/6/65	2065-06-12
2420	DATE	63	72	12/6/2065	2065-12-06
2420	DOCTOR	353	360	G Eiben
2420	TIME	389	410	12.42 hrs on 09.06.64	2042-06-09T12:42
2420	DOCTOR	580	593	Bret PORCELLI
2420	IDNUM	30	38	28U77524
2420	IDNUM	39	47	28U77524
2420	MEDICALRECORD	1	11	287775.HLW
2420	PATIENT	12	29	Velez, Bud Lowell
2421	CITY	251	260	KATHERINE
2421	CITY	83	88	CLARE
2421	STATE	90	92	SA
2421	ZIP	94	98	6244
2421	CITY	83	88	CLARE
2421	DATE	124	134	14/12/2005	2005-12-14
2421	DATE	154	164	13/04/2065	2065-04-13
2421	DATE	3867	3874	14/4/65	2065-04-14
2421	DEPARTMENT	185	207	St Vincent's Pathology
2421	DOCTOR	251	274	KATHERINE Jamal AIRHART
2421	DOCTOR	2900	2907	Z Brott
2421	IDNUM	13	23	96H397254N
2421	IDNUM	63	71	96H39725
2421	MEDICALRECORD	24	35	9623972.PMN
2421	PATIENT	37	52	Laganga, STEVEN
2421	STATE	90	92	SA
2421	STREET	72	82	Woods Hole
2421	ZIP	94	98	6244
2422	CITY	223	234	KURRI KURRI
2422	CITY	95	104	NURIOOTPA
2422	STATE	106	116	Queensland
2422	ZIP	118	122	3965
2422	CITY	95	104	NURIOOTPA
2422	DATE	157	167	30/12/2004	2004-12-30
2422	DATE	3035	3042	2.10.65	2065-10-02
2422	DATE	3800	3808	15/10/65	2065-10-15
2422	DOCTOR	204	220	WEST GYNAECOLOGY
2422	DOCTOR	229	252	KURRI DISTRICT HOSPITAL
2422	DOCTOR	256	274	Dexter Caleb HYNUM
2422	DOCTOR	3072	3081	H Pravata
2422	DOCTOR	724	732	H Aburto
2422	TIME	752	772	3:57pm on 01.10.2065	2065-10-01T15:57
2422	IDNUM	14	24	23R039229P
2422	IDNUM	66	74	23R03922
2422	IDNUM	75	83	23R03922
2422	MEDICALRECORD	25	36	2360392.HYP
2422	PATIENT	38	55	Strachn, SCARLETT
2422	STATE	106	116	Queensland
2422	ZIP	118	122	3965
2423	DATE	1041	1048	10.5.65	2065-10-05
2423	DATE	55	65	14/10/2065	2065-10-14
2423	DOCTOR	1084	1095	O Bundschuh
2423	DOCTOR	1103	1111	O Sigler
2423	IDNUM	31	39	55X90069
2423	MEDICALRECORD	1	11	558900.QYT
2423	PATIENT	12	30	MENGE, Jarvis Andy
2424	CITY	81	90	KATHERINE
2424	STATE	92	107	South Australia
2424	ZIP	109	113	4678
2424	CITY	81	90	KATHERINE
2424	DATE	139	148	28/1/2029	2029-01-28
2424	DATE	2251	2258	10.8.65	2065-10-08
2424	DEPARTMENT	199	215	DAY SURGERY UNIT
2424	HOSPITAL	216	264	ROYAL REHABILITATION HOSPITAL - COORABEL/MOORONG
2424	DOCTOR	2292	2299	Y Janos
2424	DOCTOR	268	287	IVORY Kathlyn FIECK
2424	DOCTOR	306	310	GALE
2424	IDNUM	13	23	97F102404P
2424	IDNUM	61	69	97F10240
2424	MEDICALRECORD	24	34	972102.KAK
2424	PATIENT	36	50	MCAVOY, RUDOLF
2424	STATE	92	107	South Australia
2424	STREET	70	80	Frenchmans
2424	TIME	168	187	10/08/2065 at 09:07	2065-08-10T09:07
2424	ZIP	109	113	4678
2433	CITY	86	94	PAKENHAM
2433	STATE	96	104	Tasmania
2433	ZIP	106	110	4066
2433	CITY	86	94	PAKENHAM
2433	DATE	136	145	6/11/1992	1992-11-06
2433	DATE	165	174	26/9/2065	2065-09-26
2433	DATE	2715	2722	29/9/65	2065-09-29
2433	DATE	282	290	22.10.65	2065-10-22
2433	DATE	7315	7323	22.10.65	2065-10-22
2433	DEPARTMENT	191	204	EAST SURGICAL
2433	HOSPITAL	205	220	NEPEAN HOSPITAL
2433	DOCTOR	224	243	Gerardo FRED Nichol
2433	DOCTOR	2754	2764	S Ricklefs
2433	HOSPITAL	7364	7403	CULCAIRN MULTI PURPOSE SERVICE HOSPITAL
2433	IDNUM	13	23	76T823310J
2433	IDNUM	4219	4227	76T82331
2433	IDNUM	59	67	76T82331
2433	MEDICALRECORD	24	35	7678233.EBJ
2433	PATIENT	37	48	PANTE, Jose
2433	STATE	96	104	Tasmania
2433	STREET	68	85	Northeast Killian
2433	ZIP	106	110	4066
2434	CITY	91	101	BAIRNSDALE
2434	STATE	103	120	Western Australia
2434	ZIP	122	126	1030
2434	CITY	91	101	BAIRNSDALE
2434	DATE	152	160	3/6/2023	2023-06-03
2434	DATE	1631	1638	10.5.65	2065-10-05
2434	DEPARTMENT	211	228	ST GEORGE PRIVATE
2434	HOSPITAL	229	267	MONASH MEDICAL CENTRE - CLAYTON CAMPUS
2434	DOCTOR	1674	1683	Q Bercier
2434	DOCTOR	1691	1702	Q Cavendish
2434	DOCTOR	271	293	Sherwood Arnold RAYMAN
2434	IDNUM	13	23	61U264578P
2434	IDNUM	65	73	61U26457
2434	MEDICALRECORD	24	34	617264.PTW
2434	PATIENT	36	54	DEGOLLADO, DEANDRE
2434	STATE	103	120	Western Australia
2434	STREET	74	90	Promontory Point
2434	TIME	180	199	10/05/2065 at 08:54	2065-05-10T08:54
2434	ZIP	122	126	1030
2435	CITY	88	97	KATANNING
2435	STATE	99	114	South Australia
2435	ZIP	116	120	3133
2435	DATE	146	154	3/9/2011	2011-03-09
2435	DATE	2705	2712	9.10.65	2065-10-09
2435	DEPARTMENT	205	220	ENVOI Pathology
2435	HOSPITAL	221	243	IVANHOE HEALTH SERVICE
2435	DOCTOR	247	268	CASEY Leonor DEGESTON
2435	DOCTOR	2746	2757	A Clevenger
2435	DOCTOR	2765	2773	A Ryther
2435	DOCTOR	5154	5163	A Bragdon
2435	IDNUM	14	24	03D466385L
2435	IDNUM	64	72	03D46638
2435	MEDICALRECORD	25	36	0314663.WNL
2435	PATIENT	38	53	MIRALLES, ROBIN
2435	PATIENT	73	87	Michael Canlis
2435	STATE	99	114	South Australia
2435	TIME	174	193	08/10/2065 at 12:25	2065-10-08T12:25
2435	ZIP	116	120	3133
2436	CITY	78	95	KURRAJONG HEIGHTS
2436	STATE	97	115	Northern Territory
2436	ZIP	117	121	5355
2436	CITY	78	95	KURRAJONG HEIGHTS
2436	DATE	1362	1370	22.10.65	2065-10-22
2436	DATE	147	156	10/6/1991	1991-06-10
2436	DATE	176	186	21/10/2065	2065-10-21
2436	DEPARTMENT	207	229	St Vincent's Pathology
2436	HOSPITAL	230	247	THEODORE HOSPITAL
2436	DOCTOR	1400	1409	X Daymude
2436	DOCTOR	1415	1424	X Gravitz
2436	DOCTOR	251	271	Harlan CAMI HOLTKAMP
2436	IDNUM	13	23	97E916643S
2436	IDNUM	60	68	97E91664
2436	MEDICALRECORD	24	34	971916.PMI
2436	PATIENT	36	49	GLAWE, BOBBIE
2436	STATE	97	115	Northern Territory
2436	STREET	69	77	Danewood
2436	ZIP	117	121	5355
2437	CITY	88	93	GRETA
2437	STATE	95	98	ACT
2437	ZIP	100	104	3951
2437	CITY	88	93	GRETA
2437	DATE	130	138	7/5/1990	1990-05-07
2437	DATE	158	168	19/10/2065	2065-10-19
2437	DATE	596	604	20.10.65	2065-10-20
2437	DEPARTMENT	185	190	PaLMS
2437	HOSPITAL	191	219	ROYAL PRINCE ALFRED HOSPITAL
2437	DOCTOR	223	242	SANDY Kelvin Brians
2437	DOCTOR	2289	2302	I Whitecotton
2437	DOCTOR	635	641	I Noon
2437	DOCTOR	649	659	I Hollberg
2437	IDNUM	13	23	39M118359O
2437	IDNUM	69	77	39M11835
2437	MEDICALRECORD	24	35	3941183.PZO
2437	PATIENT	37	58	RODRIGRES, IRA HOWARD
2437	PATIENT	78	87	Rishworth
2437	STATE	95	98	ACT
2437	ZIP	100	104	3951
2438	DATE	1226	1233	1.10.65	2065-10-01
2438	DATE	69	78	2/10/2065	2065-10-02
2438	DOCTOR	1266	1275	F Rayborn
2438	IDNUM	36	44	24N65961
2438	IDNUM	45	53	24N65961
2438	MEDICALRECORD	2	13	2456596.EUU
2438	PATIENT	14	35	Habel, DARRIN Johnnie
2439	CITY	242	249	LITHGOW
2439	CITY	91	106	BRUNSWICK HEADS
2439	STATE	108	126	Northern Territory
2439	ZIP	128	132	7018
2439	CITY	91	106	BRUNSWICK HEADS
2439	DATE	167	176	16/5/2006	2006-05-16
2439	DATE	1826	1833	28.5.65	2065-05-28
2439	DATE	196	205	27/5/2065	2065-05-27
2439	DATE	3029	3037	6/3/2065	2065-06-03
2439	DEPARTMENT	222	239	ST GEORGE PRIVATE
2439	HOSPITAL	242	258	LITHGOW HOSPITAL
2439	DOCTOR	1863	1870	P Taves
2439	DOCTOR	262	287	Lowell Peter SWARTZMILLER
2439	IDNUM	13	23	66W850324Q
2439	IDNUM	66	74	66W85032
2439	IDNUM	75	83	66W85032
2439	MEDICALRECORD	24	35	6688503.HLQ
2439	PATIENT	37	55	Scarberry, ANTOINE
2439	PATIENT	84	90	Kelsey
2439	STATE	108	126	Northern Territory
2439	ZIP	128	132	7018
2440	CITY	99	108	TRARALGON
2440	STATE	110	127	Western Australia
2440	ZIP	129	133	4029
2440	CITY	99	108	TRARALGON
2440	DATE	168	178	11/10/1980	1980-10-11
2440	DATE	198	206	6/3/2065	2065-03-06
2440	DEPARTMENT	223	232	Anat Path
2440	HOSPITAL	235	283	ROYAL REHABILITATION HOSPITAL - COORABEL/MOORONG
2440	DOCTOR	2493	2502	N Burglin
2440	TIME	2506	2525	12:25pm on 06/03/65	2065-03-06T12:25
2440	DOCTOR	2557	2565	N Penado
2440	DOCTOR	283	297	BoydDonald Bal
2440	DOCTOR	5650	5657	N Monce
2440	IDNUM	14	24	51X301682W
2440	IDNUM	70	78	51X30168
2440	IDNUM	79	87	51X30168
2440	MEDICALRECORD	25	36	5193016.XGW
2440	PATIENT	38	59	AKLES, Talgarno Noura
2440	STATE	110	127	Western Australia
2440	STREET	88	98	Northshore
2440	ZIP	129	133	4029
2441	CITY	90	100	EMU PLAINS
2441	STATE	102	104	SA
2441	ZIP	106	110	6726
2441	CITY	90	100	EMU PLAINS
2441	DATE	145	154	26/5/1985	1985-05-26
2441	DATE	174	184	06/10/2065	2065-10-06
2441	DATE	1867	1874	6.12.65	2065-12-06
2441	DATE	2836	2843	6/11/65	2065-11-06
2441	DEPARTMENT	205	245	Tissue Pathology and Diagnostic Oncology
2441	HOSPITAL	248	265	MERREDIN HOSPITAL
2441	DOCTOR	269	289	ARTHUR GABRIEL Elahi
2441	DOCTOR	2877	2883	X Retz
2441	IDNUM	13	23	93G593309T
2441	IDNUM	2907	2915	93G59330
2441	IDNUM	61	69	93G59330
2441	IDNUM	70	78	93G59330
2441	MEDICALRECORD	24	35	9325933.AXT
2441	PATIENT	37	50	STEVICK, Lyle
2441	STATE	102	104	SA
2441	STREET	79	89	St Alphege
2441	ZIP	106	110	6726
2442	DATE	60	69	30/9/2065	2065-09-30
2442	DATE	609	616	25/9/65	2065-09-25
2442	DOCTOR	649	658	V Forberg
2442	IDNUM	36	44	41C52345
2442	MEDICALRECORD	1	12	4105234.PSB
2442	PATIENT	13	35	FLOERKE, EUGENIO ARRON
2444	CITY	210	216	CAMDEN
2444	CITY	87	97	WANGARATTA
2444	STATE	99	102	TAS
2444	ZIP	104	108	5455
2444	DATE	134	143	9/10/2020	2020-10-09
2444	DATE	163	173	15/10/2065	2065-10-15
2444	DATE	2537	2545	16.10.65	2065-10-16
2444	DEPARTMENT	190	209	PERI-OPERATIVE UNIT
2444	HOSPITAL	210	225	CAMDEN HOSPITAL
2444	DOCTOR	229	240	Newton Exie
2444	DOCTOR	2580	2589	J Mugnolo
2444	DOCTOR	2595	2604	J Simerly
2444	DOCTOR	4396	4406	J Gillette
2444	IDNUM	14	24	36D064615H
2444	IDNUM	69	77	36D06461
2444	MEDICALRECORD	25	36	3610646.ENH
2444	PATIENT	38	58	LUMBA, HILTON DARRIN
2444	PATIENT	78	86	Anacapri
2444	STATE	99	102	TAS
2444	ZIP	104	108	5455
2445	CITY	85	95	PARRAMATTA
2445	STATE	97	112	New South Wales
2445	ZIP	114	118	2830
2445	CITY	85	95	PARRAMATTA
2445	DATE	144	153	27/6/2036	2036-06-27
2445	DATE	173	183	22/10/2065	2065-10-22
2445	DATE	1886	1894	23/10/65	2065-10-23
2445	DEPARTMENT	200	216	MED/SURGERY WARD
2445	HOSPITAL	217	233	EMERALD HOSPITAL
2445	DOCTOR	1927	1934	D Gilio
2445	DOCTOR	237	261	Arnold Michele Marguardt
2445	IDNUM	13	23	15Q686631B
2445	IDNUM	67	75	15Q68663
2445	MEDICALRECORD	24	35	1566866.IEB
2445	PATIENT	37	56	Mezzinni, SEBASTIAN
2445	PATIENT	76	84	Pickerel
2445	STATE	97	112	New South Wales
2445	ZIP	114	118	2830
2446	CITY	87	104	KURRAJONG HEIGHTS
2446	STATE	106	114	Victoria
2446	ZIP	116	120	6218
2446	CITY	87	104	KURRAJONG HEIGHTS
2446	DATE	1356	1364	17.06.65	2065-06-17
2446	DATE	155	164	22/5/2022	2022-05-22
2446	DATE	184	194	17/06/2065	2065-06-17
2446	DATE	5761	5768	17.6.65	2065-06-17
2446	DEPARTMENT	215	220	Seals
2446	HOSPITAL	223	240	MERREDIN HOSPITAL
2446	DOCTOR	244	260	Sergio RHYS Kipp
2446	DOCTOR	611	623	R Lombardino
2446	TIME	627	643	9.51 on 17.06.65	65-06-17
2446	DOCTOR	5800	5812	N Counselman
2446	DOCTOR	904	913	R Wingard
2446	TIME	917	933	9.51 on 17.06.65	65-06-17
2446	IDNUM	13	23	62N606689K
2446	IDNUM	60	68	62N60668
2446	IDNUM	69	77	62N60668
2446	MEDICALRECORD	24	35	6256066.XZK
2446	PATIENT	37	49	Skibbe, ROSS
2446	PATIENT	78	86	Limetree
2446	STATE	106	114	Victoria
2446	ZIP	116	120	6218
2447	DATE	67	76	24/8/2065	2065-08-24
2447	DATE	788	795	20.8.65	2065-08-20
2447	DOCTOR	825	834	B Beckler
2447	IDNUM	34	42	04V90840
2447	IDNUM	43	51	04V90840
2447	MEDICALRECORD	2	13	0489084.ARG
2447	PATIENT	14	33	PINENA, Mary TRUMAN
2448	CITY	93	101	CHARTERS
2448	STATE	110	113	QLD
2448	ZIP	115	119	3561
2448	CITY	93	108	CHARTERS TOWERS
2448	DATE	145	154	25/9/2000	2000-09-25
2448	DATE	174	182	2/6/2065	2065-06-02
2448	DEPARTMENT	199	222	Molecular Oncology Unit
2448	HOSPITAL	223	237	BULLI HOSPITAL
2448	DOCTOR	1533	1540	Z Nunez
2448	DOCTOR	1556	1568	Z Vandygriff
2448	DOCTOR	241	260	Dustin Elke BORODEC
2448	IDNUM	13	23	99W359664M
2448	IDNUM	70	78	99W35966
2448	MEDICALRECORD	24	35	9983596.PLM
2448	ORGANIZATION	2405	2424	Smith International
2448	HOSPITAL	2426	2462	BATLOW/ADELONG MULTI PURPOSE SERVICE
2448	PATIENT	37	59	Hickenbottom, Patricia
2448	STATE	110	113	QLD
2448	STREET	79	92	Mount Kennedy
2448	ZIP	115	119	3561
2449	DATE	51	60	10/7/2065	2065-10-07
2449	DOCTOR	1148	1157	A. Surguy
2449	IDNUM	27	35	04A12136
2449	MEDICALRECORD	1	12	0401213.RDL
2449	PATIENT	13	26	DUTCH, Rupert
2450	CITY	85	91	KERANG
2450	STATE	93	121	Australian Capital Territory
2450	ZIP	123	127	6228
2450	DATE	153	162	15/2/2012	2012-02-15
2450	DATE	182	192	22/05/2065	2065-05-22
2450	DEPARTMENT	213	234	DOMAIN AGED CARE RM 2
2450	HOSPITAL	235	254	CHINCHILLA HOSPITAL
2450	DOCTOR	259	282	Earlean Cohen RESNIKOFF
2450	DOCTOR	3640	3649	Y Lazzari
2450	IDNUM	13	23	99B6715296
2450	IDNUM	65	73	99B67152
2450	MEDICALRECORD	24	35	9906715.HYR
2450	PATIENT	37	54	Easterly, CARROLL
2450	STATE	93	121	Australian Capital Territory
2450	STREET	74	84	Smoothleaf
2450	ZIP	123	127	6228
2451	DATE	53	62	18/3/2065	2065-03-18
2451	DATE	859	868	16/3/2065	2065-03-16
2451	DOCTOR	265	275	Mcglathery
2451	DOCTOR	299	306	M Camaj
2451	IDNUM	29	37	47X69258
2451	MEDICALRECORD	1	12	4796925.WTA
2451	PATIENT	13	28	KEARLEY, ADOLPH
2452	CITY	82	100	CARNARVON HOSPITAL
2452	STATE	102	105	TAS
2452	ZIP	107	111	4859
2452	DATE	137	146	30/9/2009	2009-09-30
2452	DATE	166	176	30/06/2065	2065-06-30
2452	DEPARTMENT	197	214	DICKINSON 3 NORTH
2452	HOSPITAL	215	253	MUNDUBBERA MULTIPURPOSE HEALTH SERVICE
2452	DOCTOR	2261	2272	W Schrawder
2452	DOCTOR	258	275	ALAINE BUD Wasmus
2452	IDNUM	14	24	89G994394W
2452	IDNUM	61	69	89G99439
2452	MEDICALRECORD	25	36	8929943.ZKW
2452	PATIENT	38	50	Beloff, RICO
2452	STATE	102	105	TAS
2452	ZIP	107	111	4859
2453	DATE	1096	1106	20/10/2065	2065-10-20
2453	DATE	154	163	June 2064	2064-04-28
2453	DATE	63	73	20/10/2065	2065-10-20
2453	DOCTOR	471	479	U Wearly
2453	IDNUM	39	47	74H33465
2453	MEDICALRECORD	1	12	7423346.PFC
2453	PATIENT	13	38	MANKOSKI, WADJARRI DARRYL
2453	ZIP	159	163	2064
2454	CITY	99	106	FORSTER
2454	STATE	108	110	SA
2454	ZIP	112	116	5172
2454	CITY	99	106	FORSTER
2454	DATE	148	157	10/8/2023	2023-10-08
2454	DATE	177	187	27/05/2065	2065-05-27
2454	DATE	2434	2441	28.5.65	2065-05-28
2454	DEPARTMENT	208	224	WEST GYNAECOLOGY
2454	HOSPITAL	227	268	BARWON HEALTH - NEWCOMB RENAL UNIT CAMPUS
2454	DOCTOR	2474	2487	E Ruckdeschel
2454	DOCTOR	272	296	Vladimir EDGARDO KILLMAN
2454	IDNUM	13	23	32D365610L
2454	IDNUM	71	79	32D36561
2454	IDNUM	80	88	32D36561
2454	MEDICALRECORD	24	35	3213656.EAL
2454	PATIENT	37	60	Diamant, COLEMAN CINDIE
2454	PATIENT	89	98	Osmundsen
2454	STATE	108	110	SA
2454	ZIP	112	116	5172
2455	CITY	86	95	Katherine
2455	CITY	96	105	SWAN HILL
2455	STATE	107	122	South Australia
2455	ZIP	124	128	1790
2455	CITY	96	105	SWAN HILL
2455	DATE	154	162	7/8/2002	2002-07-08
2455	DATE	182	191	10/5/2065	2065-10-05
2455	DATE	3082	3089	10/6/65	2065-10-06
2455	DEPARTMENT	208	211	DHM
2455	HOSPITAL	214	247	KOOWEERUP REGIONAL HEALTH SERVICE
2455	DOCTOR	251	273	Darryl DOMINGO STAGGER
2455	DOCTOR	3119	3124	T Cam
2455	DOCTOR	805	817	DYLAN Durney
2455	DOCTOR	824	836	T Henrichsen
2455	TIME	840	856	3:23 on 10/05/65	2065-05-10T15:23
2455	IDNUM	14	24	74M667427H
2455	IDNUM	71	79	74M66742
2455	MEDICALRECORD	25	36	7446674.GSH
2455	PATIENT	38	60	LAVOIE, Giuseppe Cyril
2455	STATE	107	122	South Australia
2455	STREET	80	95	Saint Katherine
2455	ZIP	124	128	1790
2456	CITY	87	91	SALE
2456	STATE	93	96	TAS
2456	ZIP	98	102	6489
2456	CITY	87	91	SALE
2456	DATE	137	146	18/7/1989	1989-07-18
2456	DATE	166	175	16/6/2065	2065-06-16
2456	DATE	2275	2282	17.6.65	2065-06-17
2456	DATE	2466	2473	17.6.65	2065-06-17
2456	DATE	803	810	17.6.65	2065-06-17
2456	DEPARTMENT	192	210	PERI-OPERATIVEUNIT
2456	HOSPITAL	213	232	GORDONVALE HOSPITAL
2456	DOCTOR	236	257	Odell DARRICK Owolabi
2456	DOCTOR	2506	2518	J Buchbinder
2456	DOCTOR	684	686	RG
2456	DATE	697	702	14.30	2065-30-14
2456	DOCTOR	932	939	J Sarff
2456	IDNUM	13	23	30X332020F
2456	IDNUM	348	351	IHD
2456	PATIENT	348	367	IHD, AMI, CAGB 2062
2456	IDNUM	60	68	30X33202
2456	IDNUM	69	77	30X33202
2456	MEDICALRECORD	24	34	309332.BFA
2456	PATIENT	36	49	GRAZA, Maggie
2456	STATE	2269	2271	NT
2456	STATE	93	96	TAS
2456	STREET	78	86	Whitlars
2456	ZIP	98	102	6489
2457	CITY	2809	2818	REDCLIFFE
2457	CITY	91	99	WERRIBEE
2457	STATE	101	111	Queensland
2457	ZIP	113	117	5356
2457	CITY	91	99	WERRIBEE
2457	DATE	143	152	12/9/2017	2017-12-09
2457	DATE	1697	1705	28/10/65	2065-10-28
2457	DATE	172	182	27/10/2065	2065-10-27
2457	DEPARTMENT	199	204	Seals
2457	HOSPITAL	207	225	PEMBERTON HOSPITAL
2457	DOCTOR	1736	1744	H Dellen
2457	DOCTOR	229	248	Albert CESAR STRUBE
2457	IDNUM	13	23	21I688485Q
2457	IDNUM	72	80	21I68848
2457	MEDICALRECORD	24	35	2136884.VNQ
2457	ORGANIZATION	2793	2807	Clorox Company
2457	HOSPITAL	2809	2827	REDCLIFFE HOSPITAL
2457	PATIENT	37	61	BUENVIAJE, Adrian-BOBBIE
2457	PATIENT	81	90	Harrishof
2457	STATE	101	111	Queensland
2457	ZIP	113	117	5356
2458	CITY	3302	3315	COFFS HARBOUR
2458	CITY	91	100	BUNDABERG
2458	STATE	102	105	QLD
2458	ZIP	107	111	4017
2458	CITY	91	100	BUNDABERG
2458	DATE	1002	1010	19.10.65	2065-10-19
2458	DATE	137	147	28/11/2039	2039-11-28
2458	DATE	167	177	16/10/2065	2065-10-16
2458	DATE	298	305	3.11.65	2065-11-03
2458	DATE	3240	3247	3.11.65	2065-11-03
2458	DEPARTMENT	198	214	3 ARRIETTA CLOSE
2458	HOSPITAL	215	233	MONA VALE HOSPITAL
2458	DEPARTMENT	3261	3290	Douglass Hanly Moir Pathology
2458	HOSPITAL	3302	3315	COFFS HARBOUR
2458	DOCTOR	1220	1230	F Sisemore
2458	DOCTOR	237	249	Sergio David
2458	DOCTOR	3147	3160	DELMER Kiesow
2458	DOCTOR	3494	3510	FIDEL Moorehouse
2458	DOCTOR	3494	3510	FIDEL Moorehouse
2458	DOCTOR	3494	3510	FIDEL Moorehouse
2458	IDNUM	14	24	26J128743W
2458	IDNUM	70	78	26J12874
2458	MEDICALRECORD	25	36	2631287.LIW
2458	PATIENT	38	59	Matacale, DEREK ONITA
2458	STATE	102	105	QLD
2458	STATE	3192	3195	ACT
2458	STREET	79	90	Falling Run
2458	ZIP	107	111	4017
2459	CITY	220	228	CESSNOCK
2459	CITY	90	95	WAGGA
2459	CITY	96	101	WAGGA
2459	STATE	103	111	Tasmania
2459	ZIP	113	117	2081
2459	CITY	90	101	WAGGA WAGGA
2459	DATE	143	152	12/5/2020	2020-12-05
2459	DATE	172	182	27/10/2065	2065-10-27
2459	DATE	3237	3245	30/10/65	2065-10-30
2459	DEPARTMENT	203	219	3 ARRIETTA CLOSE
2459	HOSPITAL	220	246	CESSNOCK DISTRICT HOSPITAL
2459	DOCTOR	2003	2012	G Terrell
2459	DOCTOR	251	271	Sandie Smokey ISIDRO
2459	IDNUM	13	23	21N900350V
2459	IDNUM	68	76	21N90035
2459	MEDICALRECORD	24	35	2159003.NAV
2459	PATIENT	37	57	PECKENPAUGH, LACHLAN
2459	STATE	103	111	Tasmania
2459	STREET	77	89	Fayetteville
2459	ZIP	113	117	2081
2460	DATE	540	547	30.6.65	2065-06-30
2460	DATE	71	79	2/7/2065	2065-02-07
2460	DOCTOR	579	588	D Oquenda
2460	IDNUM	38	46	16O34151
2460	IDNUM	47	55	16O34151
2460	MEDICALRECORD	2	13	1653415.DUB
2460	PATIENT	14	37	Schwingel, Ronna DANILO
2461	CITY	100	109	DELORAINE
2461	STATE	111	114	TAS
2461	ZIP	116	120	8069
2461	DATE	155	165	13/10/1994	1994-10-13
2461	DATE	185	195	24/06/2065	2065-06-24
2461	DATE	4672	4679	25/6/65	2065-06-25
2461	DEPARTMENT	216	232	MED/SURGERY WARD
2461	HOSPITAL	235	273	CLONCURRY MULTI-PURPOSE HEALTH SERVICE
2461	DOCTOR	1090	1095	Ollie
2461	DOCTOR	1102	1113	N Klussmann
2461	TIME	1117	1136	17:30pm on 26/06/65	2066-06-26T17:30
2461	DOCTOR	1685	1689	Erin
2461	DOCTOR	1696	1704	N Levins
2461	TIME	1708	1725	18:05 on 24/06/65	65-06-24T18:05
2461	DOCTOR	277	298	Benton Jarod Colaizzi
2461	DOCTOR	4076	4083	Eugenio
2461	DOCTOR	4244	4251	Aurelio
2461	DOCTOR	4258	4264	N Ueki
2461	TIME	4268	4285	19:20 on 24/06/65	2065-06-24T19:20
2461	DOCTOR	4713	4721	N Helley
2461	DOCTOR	6667	6676	N Bercher
2461	IDNUM	13	23	58X543324Y
2461	IDNUM	70	78	58X54332
2461	IDNUM	79	87	58X54332
2461	MEDICALRECORD	24	35	5885433.GMY
2461	PATIENT	37	59	HARPER, LOUIS SHERWOOD
2461	STATE	111	114	TAS
2461	STREET	88	99	White Barns
2461	ZIP	116	120	8069
2462	DATE	62	70	9/6/2065	2065-06-09
2462	DOCTOR	1168	1177	L Edelson
2462	DOCTOR	131	144	L Luchterhand
2462	DATE	146	154	9.6.2065	2065-06-09
2462	IDNUM	29	37	43Y09358
2462	IDNUM	38	46	43Y09358
2462	MEDICALRECORD	1	12	4390935.VGE
2462	PATIENT	13	28	Bagnaschi, Erin
2463	CITY	5094	5102	BALLARAT
2463	CITY	74	98	GLADSTONESouth Australia
2463	STATE	89	98	Australia
2463	ZIP	100	104	5340
2463	DATE	130	138	7/7/2000	2000-07-07
2463	DATE	158	168	27/05/2065	2065-05-27
2463	DATE	2075	2082	28.5.65	2065-05-28
2463	DATE	305	312	29.6.65	2065-06-29
2463	DATE	337	344	25.6.65	2065-06-25
2463	DATE	5043	5050	25.6.65	2065-06-25
2463	DATE	6473	6480	29.6.65	2065-06-29
2463	DEPARTMENT	189	201	Cytogenetics
2463	HOSPITAL	202	222	NORTHAMPTON HOSPITAL
2463	DOCTOR	2116	2131	V Slaughterbeck
2463	DOCTOR	226	242	BEN MIKE EVERITT
2463	DOCTOR	3947	3956	V Journey
2463	DOCTOR	4498	4504	V Lapa
2463	DOCTOR	4509	4518	V Withrow
2463	DOCTOR	5123	5131	Gus Mone
2463	DATE	5133	5140	19.6.65	2065-06-19
2463	DOCTOR	5365	5372	V Veles
2463	DOCTOR	6563	6576	Kulin V'Berti
2463	DATE	6578	6585	24/6/65	2065-06-24
2463	HOSPITAL	4615	4629	WEIPA HOSPITAL
2463	HOSPITAL	5064	5083	BEAUDESERT HOSPITAL
2463	HOSPITAL	5094	5102	BALLARAT
2463	HOSPITAL	6494	6536	TEXAS HOSPITAL MULTIPURPOSE HEALTH SERVICE
2463	IDNUM	14	24	85G295399A
2463	IDNUM	61	69	85G29539
2463	IDNUM	6627	6639	85G29539 A10
2463	MEDICALRECORD	25	36	8522953.YYA
2463	PATIENT	38	50	Annett, Neil
2463	PATIENT	70	73	Fir
2463	ZIP	100	104	5340
2464	DATE	1738	1745	3/11/65	2065-11-03
2464	DATE	61	70	3/11/2065	2065-11-03
2464	DOCTOR	1201	1207	K Skye
2464	IDNUM	37	45	33D31645
2464	MEDICALRECORD	1	11	331316.KNT
2464	PATIENT	12	36	Radar, RAYMUNDO'Reynaldo
2465	CITY	80	90	NARRANDERA
2465	STATE	92	102	Queensland
2465	CITY	80	90	NARRANDERA
2465	DATE	134	143	17/9/2008	2008-09-17
2465	DATE	163	173	27/10/2065	2065-10-27
2465	DATE	2631	2639	28.10.65	2065-10-28
2465	DEPARTMENT	194	212	Molecular Oncology
2465	HOSPITAL	213	227	TULLY HOSPITAL
2465	DOCTOR	231	255	Hank Yara-rose YSAGUIRRE
2465	DOCTOR	2670	2676	H Enos
2465	IDNUM	13	23	38E756615P
2465	IDNUM	59	67	38E75661
2465	MEDICALRECORD	24	34	381756.QDO
2465	ORGANIZATION	3530	3547	SCANA Corporation
2465	HOSPITAL	3549	3567	THE TWEED HOSPITAL
2465	PATIENT	36	48	DIMPFL, Neil
2465	STATE	92	102	Queensland
2465	ZIP	104	108	3236
2465	ZIP	75	79	1061
2466	CITY	82	86	SALE
2466	STATE	88	105	Western Australia
2466	ZIP	107	111	2426
2466	CITY	82	86	SALE
2466	DATE	137	146	27/6/1985	1985-06-27
2466	DEPARTMENT	197	201	HAPS
2466	HOSPITAL	202	232	BARADINE MULTI PURPOSE SERVICE
2466	DOCTOR	236	259	Modesta Rosaura BROOKIE
2466	DOCTOR	2741	2756	Justin COCKBURN
2466	DOCTOR	3729	3731	DR
2466	DOCTOR	3733	3735	QB
2466	DATE	3739	3745	7.8.65	2065-08-07
2466	DOCTOR	3777	3786	S Stinger
2466	IDNUM	13	23	60M958422L
2466	IDNUM	60	68	60M95842
2466	MEDICALRECORD	24	35	6049584.GFL
2466	PATIENT	37	49	Mobus, Tyree
2466	STATE	88	105	Western Australia
2466	STREET	69	81	Marstan Moor
2466	TIME	166	185	07/08/2065 at 09:23	2065-08-07T09:23
2466	ZIP	107	111	2426
2467	CITY	84	93	SWAN HILL
2467	STATE	95	110	New South Wales
2467	ZIP	112	116	7210
2467	CITY	84	93	SWAN HILL
2467	DATE	142	151	26/2/1997	1997-02-26
2467	DATE	3406	3413	28.8.65	2065-08-28
2467	DEPARTMENT	202	207	Palms
2467	HOSPITAL	208	224	MODBURY HOSPITAL
2467	DOCTOR	228	245	Morris JAN Wasmus
2467	DOCTOR	3444	3453	G Disalvi
2467	IDNUM	13	23	27J079480U
2467	IDNUM	68	76	27J07948
2467	MEDICALRECORD	24	35	2730794.VAU
2467	PATIENT	37	57	Bisbee, GENE GABRIEL
2467	STATE	95	110	New South Wales
2467	TIME	171	190	28/08/2065 at 09:56	2065-08-28T09:56
2467	ZIP	112	116	7210
2468	DATE	1340	1348	10/11/65	2065-11-10
2468	DATE	63	73	10/11/2065	2065-11-10
2468	DOCTOR	604	613	E Ananias
2468	IDNUM	39	47	12J42974
2468	MEDICALRECORD	1	12	1234297.LVA
2468	PATIENT	13	38	Skoglund, Lamar Guillermo
2469	CITY	96	102	GAWLER
2469	STATE	104	132	Australian Capital Territory
2469	ZIP	134	138	1570
2469	CITY	96	102	GAWLER
2469	DATE	164	173	30/9/2022	2022-09-30
2469	DATE	193	203	11/06/2065	2065-06-11
2469	DATE	6647	6655	11/11/65	2065-11-11
2469	DEPARTMENT	224	250	BRIGHAM & WOMEN'S HOSPITAL
2469	HOSPITAL	251	275	COHUNA DISTRICT HOSPITAL
2469	DOCTOR	280	297	KIZZIE JOSH Chris
2469	DOCTOR	4527	4534	O Sabat
2469	IDNUM	14	24	54S721454W
2469	IDNUM	79	87	54S72145
2469	MEDICALRECORD	25	36	5477214.NMW
2469	PATIENT	38	68	ZIOBRO, Markus Daron Johnathan
2469	PATIENT	6463	6495	HARTMANN'S, OMENTUM, RIGHT COLON
2469	STATE	104	132	Australian Capital Territory
2469	STREET	88	95	Northam
2469	ZIP	134	138	1570
2472	CITY	94	105	BROKEN HILL
2472	STATE	107	109	SA
2472	ZIP	111	115	3042
2472	CITY	94	105	BROKEN HILL
2472	DATE	141	150	30/9/2022	2022-09-30
2472	DATE	170	180	06/11/2065	2065-11-06
2472	DATE	6608	6616	11/11/65	2065-11-11
2472	DATE	7497	7507	18.11.2065	2065-11-18
2472	DEPARTMENT	201	206	Palms
2472	HOSPITAL	207	226	BEAUDESERT HOSPITAL
2472	DOCTOR	238	250	MARIA Durham
2472	DOCTOR	4446	4448	JM
2472	DOCTOR	4483	4491	C Naftel
2472	IDNUM	13	23	12O742513F
2472	IDNUM	76	84	12O74251
2472	MEDICALRECORD	24	35	1257425.CHF
2472	ORGANIZATION	6675	6693	Lennar Corporation
2472	DEPARTMENT	6694	6733	CULCAIRN MULTI PURPOSE SERVICE HOSPITAL
2472	PATIENT	37	65	Leewright, Nathanael Jed Gus
2472	PATIENT	6424	6456	HARTMANN'S, OMENTUM, RIGHT COLON
2472	STATE	107	109	SA
2472	STREET	85	93	N Morgan
2472	ZIP	111	115	3042
2473	CITY	74	82	BLAXLAND
2473	STATE	84	101	Western Australia
2473	ZIP	103	107	3379
2473	DATE	133	143	23/10/1997	1997-10-23
2473	DATE	163	173	13/11/2065	2065-11-13
2473	DATE	1753	1761	16.11.65	2065-11-16
2473	DOCTOR	1797	1807	A Grawburg
2473	DOCTOR	237	261	Mickey Hyacinth MASLOSKI
2473	DOCTOR	280	284	SUNG
2473	DOCTOR	289	293	Bert
2473	IDNUM	12	22	07P183770L
2473	IDNUM	58	66	07P18377
2473	MEDICALRECORD	23	33	076183.TSC
2473	PATIENT	35	47	TONNE, Caden
2473	PATIENT	67	73	Calyer
2473	STATE	84	101	Western Australia
2473	ZIP	103	107	3379
2474	CITY	212	218	FORBES
2474	CITY	87	95	WERRIBEE
2474	STATE	97	99	NT
2474	ZIP	101	105	3056
2474	CITY	87	95	WERRIBEE
2474	DATE	137	146	22/4/1991	1991-04-22
2474	DATE	166	175	12/2/2065	2065-12-02
2474	DATE	2698	2705	13/2/65	2065-02-13
2474	DEPARTMENT	192	209	DICKINSON 3 NORTH
2474	HOSPITAL	212	236	FORBES DISTRICT HOSPITAL
2474	DOCTOR	240	262	Leandro SPENCER Mannan
2474	DOCTOR	2846	2860	K Fritzpatrick
2474	TIME	2864	2882	9:45am on 12/02/65	2065-02-12T09:45
2474	DOCTOR	2914	2920	K Genz
2474	DOCTOR	345	349	T3N2
2474	IDNUM	13	23	02T065377K
2474	IDNUM	61	69	02T06537
2474	IDNUM	70	78	02T06537
2474	MEDICALRECORD	24	35	0270653.UUK
2474	PATIENT	37	50	Acuff, LAUREN
2474	STATE	3939	3941	NT
2474	STATE	97	99	NT
2474	STREET	79	86	Marieba
2474	ZIP	101	105	3056
2475	DATE	62	72	25/11/2065	2065-11-25
2475	DATE	783	791	20.11.65	2065-11-20
2475	DOCTOR	822	830	Z Roundy
2475	IDNUM	1007	1015	97U40563
2475	IDNUM	38	46	97U40563
2475	MEDICALRECORD	1	12	9774056.KPQ
2475	PATIENT	13	37	KOWALSKE, Toby Dannielle
2476	CITY	10468	10474	PARKES
2476	CITY	79	87	CULBURRA
2476	STATE	89	92	QLD
2476	ZIP	94	98	3938
2476	CITY	79	87	CULBURRA
2476	DATE	124	132	5/3/2027	2027-03-05
2476	DATE	3145	3152	9/11/65	2065-11-09
2476	DEPARTMENT	183	201	PERI-OPERATIVEUNIT
2476	DOCTOR	10456	10464	J Notter
2476	DOCTOR	10456	10464	J Notter
2476	DOCTOR	223	248	Randolph Benito Pemberton
2476	DOCTOR	3183	3194	J Petterson
2476	DOCTOR	462	473	J Chanofsky
2476	DOCTOR	480	488	J Bitzer
2476	IDNUM	14	24	39D607352M
2476	IDNUM	63	71	39D60735
2476	MEDICALRECORD	25	36	3916073.NGM
2476	PATIENT	38	52	Birks, Baladji
2476	STATE	89	92	QLD
2476	STREET	72	78	Falcon
2476	TIME	152	162	06/11/2065	2065-11-06T15:26
2476	ZIP	94	98	3938
2477	CITY	85	97	PORT AUGUSTA
2477	STATE	99	102	QLD
2477	ZIP	104	108	3570
2477	CITY	85	97	PORT AUGUSTA
2477	DATE	134	142	7/9/1996	1996-07-09
2477	DATE	1515	1523	23.11.65	2065-11-23
2477	DATE	162	172	23/11/2065	2065-11-23
2477	DEPARTMENT	193	211	PERI-OPERATIVEUNIT
2477	HOSPITAL	212	247	BARWON HEALTH - ASHLEY MANOR CAMPUS
2477	DOCTOR	1554	1564	G Lamoreau
2477	DOCTOR	1582	1590	G Freund
2477	DOCTOR	251	269	Devin DEE MACARAEG
2477	DOCTOR	288	297	Kamilaroi
2477	IDNUM	13	23	24E157610S
2477	IDNUM	68	76	24E15761
2477	MEDICALRECORD	24	34	241157.PCB
2477	PATIENT	36	57	PROSSER, RODNEY SCOTT
2477	PATIENT	77	84	Dursley
2477	STATE	99	102	QLD
2477	ZIP	104	108	3570
2478	CITY	83	93	DENILIQUIN
2478	STATE	95	112	Western Australia
2478	ZIP	114	118	1020
2478	CITY	83	93	DENILIQUIN
2478	DATE	1435	1443	24/11/65	2065-11-24
2478	DATE	144	153	29/7/2003	2003-07-29
2478	DATE	173	183	23/11/2065	2065-11-23
2478	DEPARTMENT	204	221	DICKINSON 3 NORTH
2478	DOCTOR	1474	1481	R Reger
2478	DOCTOR	225	242	HANS MARGE MAUSEY
2478	IDNUM	13	23	66N359327P
2478	IDNUM	62	70	66N35932
2478	MEDICALRECORD	24	35	6653593.FSP
2478	PATIENT	37	51	Gaither, WALDO
2478	STATE	95	112	Western Australia
2478	STREET	71	82	W Lyon Farm
2478	ZIP	114	118	1020
2481	CITY	80	88	WARRAGUL
2481	STATE	90	108	Northern Territory
2481	ZIP	110	114	7190
2481	CITY	80	88	WARRAGUL
2481	DATE	1152	1160	26.11.65	2065-11-26
2481	DATE	140	149	29/7/2003	2003-07-29
2481	DATE	1540	1548	24/11/65	2065-11-24
2481	DATE	169	179	23/11/2065	2065-11-23
2481	DATE	283	291	27.11.65	2065-11-27
2481	DATE	3477	3485	27.11.65	2065-11-27
2481	DEPARTMENT	200	215	ENVOI Pathology
2481	DOCTOR	1579	1588	F Berrios
2481	DOCTOR	219	244	KRISTOFER Chrystal STUCKE
2481	IDNUM	13	23	23J370475X
2481	IDNUM	59	67	23J37047
2481	MEDICALRECORD	24	35	2333704.UNX
2481	PATIENT	37	48	CAM, Dwayne
2481	STATE	90	108	Northern Territory
2481	STREET	68	79	New Peachey
2481	ZIP	110	114	7190
2483	CITY	6342	6352	CANOWINDRA
2483	CITY	89	97	COCKATOO
2483	STATE	99	102	QLD
2483	ZIP	104	108	7264
2483	DATE	134	142	7/8/1997	1997-07-08
2483	DATE	162	170	7/4/2065	2065-04-07
2483	DATE	313	322	1.12.2065	2065-12-01
2483	DATE	8169	8178	1.12.2065	2065-12-01
2483	DEPARTMENT	187	196	StVincent
2483	HOSPITAL	197	211	LOGAN HOSPITAL
2483	DEPARTMENT	8775	8787	ArvinMeritor
2483	DOCTOR	11874	11883	KRAS G13D
2483	DOCTOR	11884	11903	N MUTATION DETECTED
2483	DOCTOR	215	240	GARLAND DOMINIQUE Vencill
2483	DOCTOR	282	290	TERRANCE
2483	DOCTOR	3975	3982	D Tomka
2483	DOCTOR	7922	7929	D Lubin
2483	DOCTOR	7987	7997	D Kalathas
2483	DOCTOR	8254	8274	Laweication D'Trunzo
2483	DOCTOR	933	942	Christian
2483	DOCTOR	949	959	D Bockhorn
2483	DOCTOR	963	972	D Meenach
2483	TIME	976	991	4pm on 07.04.65	2065-04-07T16:00
2483	DOCTOR	9539	9547	Bardelli
2483	DOCTOR	9557	9569	J Clin Oncol
2483	HOSPITAL	6329	6337	18K81163
2483	HOSPITAL	6362	6379	MEMORIAL HOSPITAL
2483	HOSPITAL	6430	6448	MONA VALE HOSPITAL
2483	HOSPITAL	8193	8245	PORT BROUGHTON DISTRICT HOSPITAL AND HEALTH SERVICES
2483	HOSPITAL	8517	8536	GOOMALLING HOSPITAL
2483	IDNUM	13	23	18K811633D
2483	IDNUM	70	78	18K81163
2483	IDNUM	8806	8814	18K81163
2483	MEDICALRECORD	24	35	1838116.KID
2483	PATIENT	37	59	MCCUNN, YOORALLA Fritz
2483	PATIENT	79	88	Good Hope
2483	STATE	99	102	QLD
2483	ZIP	104	108	7264
2484	CITY	81	89	YAROOMBA
2484	STATE	91	99	Victoria
2484	CITY	81	89	YAROOMBA
2484	DATE	130	139	25/7/1983	1983-07-25
2484	DATE	1489	1497	27/11/65	2065-11-27
2484	DATE	159	169	26/11/2065	2065-11-26
2484	DEPARTMENT	190	195	Palms
2484	HOSPITAL	196	232	FLINDERS ISLAND MULTI PURPOSE CENTRE
2484	DOCTOR	1534	1546	N Turbacuski
2484	DOCTOR	236	249	BRENDAN Tilus
2484	IDNUM	14	24	50T012459A
2484	IDNUM	60	68	50T01245
2484	MEDICALRECORD	25	36	5070124.NZA
2484	PATIENT	38	49	DARSI, HOYT
2484	STATE	91	99	Victoria
2484	STREET	69	80	Blegborough
2484	ZIP	101	105	1007
2485	CITY	237	244	KYNETON
2485	CITY	80	88	WARRAGUL
2485	STATE	90	100	Queensland
2485	CITY	80	88	WARRAGUL
2485	DATE	132	141	17/6/2004	2004-06-17
2485	DATE	1592	1600	26/11/65	2065-11-26
2485	DATE	161	171	26/11/2065	2065-11-26
2485	DATE	938	946	26.11.65	2065-11-26
2485	DEPARTMENT	188	203	DAY SURGERYUNIT
2485	HOSPITAL	204	244	CENTRAL HIGHLANDS RURAL HEALTH - KYNETON
2485	DOCTOR	1631	1643	L Kuczkowski
2485	DOCTOR	1649	1657	L Weldin
2485	DOCTOR	248	267	MOISES YONG CORTNER
2485	IDNUM	13	23	45U563617G
2485	IDNUM	63	71	45U56361
2485	MEDICALRECORD	24	35	4575636.CUG
2485	PATIENT	37	52	HENNES, Wilburn
2485	PATIENT	72	79	Marnham
2485	STATE	90	100	Queensland
2485	ZIP	102	106	3278
2486	CITY	73	79	LEETON
2486	STATE	81	83	SA
2486	ZIP	85	89	1222
2486	CITY	73	79	LEETON
2486	DATE	115	125	10/11/2001	2001-11-10
2486	DATE	145	155	17/11/2065	2065-11-17
2486	DATE	2021	2029	18.11.65	2065-11-18
2486	DEPARTMENT	172	185	MACQUARIEWARD
2486	HOSPITAL	188	207	DONNYBROOK HOSPITAL
2486	DOCTOR	2059	2067	V Briehl
2486	DOCTOR	211	232	HILARIO JULES Deponte
2486	DOCTOR	451	458	Maynard
2486	DOCTOR	862	874	BOBBIE Ariel
2486	DOCTOR	881	891	V Fischman
2486	TIME	895	914	09:15am on 17.11.65	2065-11-17T09:15
2486	IDNUM	13	23	87C765424C
2486	IDNUM	60	68	87C76542
2486	MEDICALRECORD	24	35	8717654.FLC
2486	PATIENT	37	49	Rennick, Coy
2486	PATIENT	69	72	Ila
2486	STATE	81	83	SA
2486	ZIP	85	89	1222
2487	CITY	95	103	GRENFELL
2487	STATE	105	113	Tasmania
2487	ZIP	115	119	0811
2487	DATE	154	164	12/12/2035	2035-12-12
2487	DATE	184	194	27/10/2065	2065-10-27
2487	DATE	2137	2145	28/10/65	2065-10-28
2487	DEPARTMENT	211	220	Anat Path
2487	HOSPITAL	223	264	CENTRAL HIGHLANDS RURAL HEALTH - CRESWICK
2487	DOCTOR	2179	2186	J Spuck
2487	DOCTOR	3732	3739	J Flowe
2487	IDNUM	14	24	35Z785572L
2487	IDNUM	69	77	35Z78557
2487	IDNUM	78	86	35Z78557
2487	MEDICALRECORD	25	36	3597855.UHL
2487	PATIENT	38	58	POLITZ, ABRAM NEISHA
2487	STATE	105	113	Tasmania
2487	ZIP	115	119	0811
2488	CITY	235	244	MILLICENT
2488	CITY	86	94	WAIKERIE
2488	STATE	96	114	Northern Territory
2488	ZIP	116	120	5582
2488	CITY	86	94	WAIKERIE
2488	DATE	155	164	21/2/1995	1995-02-21
2488	DATE	184	193	27/4/2065	2065-04-27
2488	DATE	2973	2980	28.4.65	2065-04-28
2488	DATE	377	384	14.5.65	2065-05-14
2488	DATE	5476	5483	14.5.65	2065-05-14
2488	DEPARTMENT	210	232	POSTOPERATIVE RECOVERY
2488	HOSPITAL	235	286	MILLICENT AND DISTRICT HOSPITAL AND HEALTH SERVICES
2488	DOCTOR	1577	1584	Preston
2488	DOCTOR	1591	1599	H Gallet
2488	TIME	1603	1622	10:26am on 27.04.65	2065-04-27T10:26
2488	DOCTOR	290	306	VAL Cyril Cobham
2488	DOCTOR	3011	3019	H Marier
2488	DOCTOR	325	331	BARTON
2488	IDNUM	13	23	20Z226730R
2488	IDNUM	60	68	20Z22673
2488	IDNUM	69	77	20Z22673
2488	MEDICALRECORD	24	35	2092267.KBR
2488	PATIENT	37	49	Canedy, HOYT
2488	PATIENT	78	85	Wabasha
2488	STATE	96	114	Northern Territory
2488	ZIP	116	120	5582
2489	CITY	217	222	YOUNG
2489	CITY	86	96	TURA BEACH
2489	STATE	98	113	South Australia
2489	ZIP	115	119	5047
2489	DATE	154	163	11/1/2018	2018-01-11
2489	DATE	183	192	19/4/2065	2065-04-19
2489	DATE	2389	2396	20.4.65	2065-04-20
2489	DEPARTMENT	209	214	Seals
2489	HOSPITAL	217	240	YOUNG DISTRICT HOSPITAL
2489	DOCTOR	1215	1220	Titus
2489	DOCTOR	1226	1236	Jame REGAL
2489	TIME	1240	1258	11am on 19.04.2065	2065-04-19T11:00
2489	DOCTOR	2426	2435	R Fattore
2489	DOCTOR	244	266	Leland Wilber SHARPLEY
2489	IDNUM	13	23	62I428557N
2489	IDNUM	60	68	62I42855
2489	IDNUM	69	77	62I42855
2489	MEDICALRECORD	24	35	6234285.NTN
2489	PATIENT	37	49	Ide, TRISTAN
2489	PATIENT	78	85	Cassins
2489	STATE	98	113	South Australia
2489	ZIP	115	119	5047
2490	CITY	209	217	BATHURST
2490	CITY	85	95	CRANBOURNE
2490	STATE	97	105	Tasmania
2490	ZIP	107	111	3141
2490	DATE	137	146	14/6/1984	1984-06-14
2490	DATE	164	174	20/11/2065	2065-11-20
2490	DATE	2984	2992	23.11.65	2065-11-23
2490	DATE	823	833	12.10.2065	2065-10-12
2490	DEPARTMENT	195	208	EAST SURGICAL
2490	HOSPITAL	209	231	BATHURST BASE HOSPITAL
2490	DOCTOR	235	255	Aiden Jarvis STENDAL
2490	DOCTOR	3023	3033	F Bernosky
2490	DOCTOR	608	616	Keinonen
2490	IDNUM	13	23	20E449505W
2490	IDNUM	68	76	20E44950
2490	MEDICALRECORD	24	35	2014495.COW
2490	PATIENT	37	57	Reichhardt, Mohammad
2490	PATIENT	77	84	Lindore
2490	STATE	97	105	Tasmania
2490	ZIP	107	111	3141
2493	CITY	80	92	MURWILLUMBAH
2493	STATE	94	109	South Australia
2493	ZIP	111	115	6285
2493	CITY	80	92	MURWILLUMBAH
2493	DATE	140	149	11/7/1996	1996-11-07
2493	DATE	169	179	13/10/2065	2065-10-13
2493	DATE	2621	2629	14.10.65	2065-10-14
2493	DEPARTMENT	196	211	DAY SURGERYUNIT
2493	HOSPITAL	212	226	BULLI HOSPITAL
2493	DOCTOR	230	253	SIDNEY ROSARIO Fogelman
2493	DOCTOR	2662	2669	D Doung
2493	IDNUM	13	23	14F999863C
2493	IDNUM	63	71	14F99986
2493	MEDICALRECORD	24	35	1429998.RJC
2493	PATIENT	37	52	Molinelli, Aldo
2493	PATIENT	72	79	Phantom
2493	STATE	94	109	South Australia
2493	ZIP	111	115	6285
2494	CITY	82	88	SYDNEY
2494	STATE	90	93	QLD
2494	ZIP	95	99	3860
2494	CITY	82	88	SYDNEY
2494	DATE	125	134	4/12/1983	1983-12-04
2494	DATE	1311	1319	30.10.65	2065-10-30
2494	DATE	154	164	29/10/2065	2065-10-29
2494	DEPARTMENT	181	186	Palms
2494	HOSPITAL	187	208	MOUNT DRUITT HOSPITAL
2494	DOCTOR	1350	1359	N Beidler
2494	DOCTOR	1375	1382	N Zilka
2494	DOCTOR	212	237	Lamont CHADWICK Przygocki
2494	IDNUM	14	24	56O191570Y
2494	IDNUM	61	69	56O19157
2494	MEDICALRECORD	25	35	565191.PUA
2494	PATIENT	37	52	EALY, Johnathan
2494	STATE	90	93	QLD
2494	STREET	70	81	West Thomas
2494	ZIP	95	99	3860
2495	CITY	88	94	CAIRNS
2495	STATE	96	98	WA
2495	ZIP	100	104	5720
2495	CITY	88	94	CAIRNS
2495	DATE	130	139	18/1/1999	1999-01-18
2495	DATE	3155	3163	30/11/65	2065-11-30
2495	DATE	4005	4014	8/12/2065	2065-12-08
2495	DEPARTMENT	190	199	Anat Path
2495	HOSPITAL	200	225	FAR NORTH HEALTH SERVICES
2495	DOCTOR	1836	1844	C Pinard
2495	DOCTOR	230	258	Nelia Mauricio Grossenbacher
2495	IDNUM	13	23	04K212638H
2495	IDNUM	69	77	04K21263
2495	MEDICALRECORD	24	34	044212.RJV
2495	PATIENT	36	58	Steward, Walton Hubert
2495	PATIENT	78	87	Dorncliff
2495	STATE	3232	3235	ACT
2495	STATE	96	98	WA
2495	TIME	159	178	26/11/2065 at 10:45	2065-11-26T10:45
2495	ZIP	100	104	5720
2500	DATE	1244	1251	2/13/64	2064-02-13
2500	DATE	56	64	5/1/2065	2065-01-05
2500	DOCTOR	1286	1295	M Timmins
2500	IDNUM	32	40	46T41344
2500	MEDICALRECORD	2	13	4674134.MND
2500	PATIENT	14	31	Vancleave, Harlan
2501	CITY	85	94	CHURCHILL
2501	STATE	96	98	NT
2501	ZIP	100	104	5113
2501	CITY	85	94	CHURCHILL
2501	DATE	130	138	2/3/1979	1979-03-02
2501	DATE	158	168	14/12/2065	2065-12-14
2501	DATE	1909	1917	14.12.65	2065-12-14
2501	DEPARTMENT	189	204	ENVOI Pathology
2501	HOSPITAL	205	222	NARROGIN HOSPITAL
2501	DOCTOR	1948	1955	A Recla
2501	DOCTOR	231	242	HYMAN Etkin
2501	IDNUM	13	23	04P434403M
2501	IDNUM	65	73	04P43440
2501	MEDICALRECORD	24	34	046434.MBI
2501	PATIENT	36	54	MCCAHAN, Guillermo
2501	STATE	96	98	NT
2501	STREET	74	84	Beach Hill
2501	ZIP	100	104	5113
2504	CITY	79	85	KERANG
2504	STATE	87	95	Victoria
2504	ZIP	97	101	1181
2504	DATE	11569	11577	18/12/65	2065-12-18
2504	DATE	127	135	3/5/2027	2027-03-05
2504	DATE	155	165	11/06/2065	2065-06-11
2504	DATE	306	314	18/12/65	2065-12-18
2504	DATE	3179	3186	11/9/65	2065-11-09
2504	DEPARTMENT	186	201	DAY SURGERYUNIT
2504	HOSPITAL	202	221	BEAUDESERT HOSPITAL
2504	DOCTOR	10488	10495	Y Cilva
2504	DOCTOR	11617	11630	KARL NAZELROD
2504	DOCTOR	11671	11681	HANS JUNES
2504	DOCTOR	11683	11696	ACT Reference
2504	DOCTOR	11763	11767	Toby
2504	DOCTOR	12644	12657	Bert REDDICKS
2504	DOCTOR	225	244	Lanny OCTAVIO DELON
2504	DOCTOR	3217	3224	Y Lacau
2504	DOCTOR	493	504	Y Fritchman
2504	DOCTOR	511	522	Y Attanasio
2504	IDNUM	13	23	99Q985761S
2504	IDNUM	63	71	99Q98576
2504	MEDICALRECORD	24	35	9969857.RCS
2504	PATIENT	37	52	Tegtmeier, Andy
2504	STATE	11683	11686	ACT
2504	STATE	87	95	Victoria
2504	STREET	72	78	Oreste
2504	ZIP	97	101	1181
2505	DATE	1272	1280	14.12.65	2065-12-14
2505	DATE	64	74	21/12/2065	2065-12-21
2505	DOCTOR	1314	1323	I Wetklow
2505	DOCTOR	3226	3239	KENETH Yattaw
2505	IDNUM	40	48	31Z17757
2505	MEDICALRECORD	2	13	3191775.TUO
2505	PATIENT	14	39	Borkoski, CLINTON Louella
2506	CITY	88	95	BUCASIA
2506	STATE	97	99	SA
2506	ZIP	101	105	2406
2506	CITY	88	95	BUCASIA
2506	DATE	131	140	20/9/2028	2028-09-20
2506	DATE	160	170	17/12/2065	2065-12-17
2506	DATE	1753	1761	18.12.65	2065-12-18
2506	DEPARTMENT	187	213	BRIGHAM & WOMEN'S HOSPITAL
2506	HOSPITAL	214	244	BARADINE MULTI PURPOSE SERVICE
2506	DOCTOR	1791	1799	X Farish
2506	DOCTOR	248	261	WILLIE Resenz
2506	IDNUM	13	23	89V107535X
2506	IDNUM	67	75	89V10753
2506	MEDICALRECORD	24	35	8981075.IPX
2506	PATIENT	37	56	Whitcher, RAYMOND X
2506	PATIENT	76	87	Jack Rogers
2506	STATE	97	99	SA
2506	ZIP	101	105	2406
2507	CITY	76	84	PAKENHAM
2507	STATE	86	96	Queensland
2507	ZIP	98	102	2429
2507	CITY	76	84	PAKENHAM
2507	DATE	128	137	23/5/1986	1986-05-23
2507	DATE	157	167	16/12/2065	2065-12-16
2507	DATE	1847	1855	17/12/65	2065-12-17
2507	DEPARTMENT	186	203	ACUTE STROKE UNIT
2507	HOSPITAL	204	236	ST MARYS COMMUNITY HEALTH CENTRE
2507	DOCTOR	1891	1899	U Griggs
2507	DOCTOR	240	255	Leland IRA Saam
2507	IDNUM	13	23	84W6487931
2507	IDNUM	2024	2032	84W64879
2507	IDNUM	60	68	84W64879
2507	MEDICALRECORD	24	34	848648.UYK
2507	PATIENT	36	49	DAYLEY, CLINT
2507	PATIENT	69	75	Kimdee
2507	STATE	86	96	Queensland
2507	ZIP	98	102	2429
2508	DATE	51	61	26/11/2065	2065-11-26
2508	DATE	597	607	26/11/2065	2065-11-26
2508	DOCTOR	290	304	E. Sutterfield
2508	IDNUM	27	35	16F84050
2508	MEDICALRECORD	2	12	162840.OBB
2508	PATIENT	13	26	Talas, Herman
2509	CITY	85	95	WOLLONGONG
2509	ZIP	99	103	2406
2509	CITY	85	95	WOLLONGONG
2509	DATE	129	138	18/7/1986	1986-07-18
2509	DATE	158	168	16/12/2065	2065-12-16
2509	DATE	1663	1671	16/12/65	2065-12-16
2509	DEPARTMENT	185	190	Palms
2509	HOSPITAL	191	218	JOYCE PALMER HEALTH SERVICE
2509	DOCTOR	1704	1712	T Oliger
2509	DOCTOR	222	242	EDDY LORNA STACKPOLE
2509	IDNUM	13	23	73B960668I
2509	IDNUM	65	73	73B96066
2509	MEDICALRECORD	24	34	730960.QQW
2509	PATIENT	36	54	KELLETT, OWEN ELIZ
2509	PATIENT	74	84	Kingsholme
2509	ZIP	99	103	2406
2510	DATE	221	229	16.10.65	2065-10-16
2510	DATE	57	67	23/10/2065	2065-10-23
2510	DATE	735	743	16.10.65	2065-10-16
2510	DOCTOR	780	786	R Cain
2510	DOCTOR	794	805	R Cianfrani
2510	IDNUM	34	42	68C31182
2510	MEDICALRECORD	2	13	6803118.GRO
2510	PATIENT	14	33	Kjellsen, Marcelino
2511	CITY	83	89	URUNGA
2511	STATE	91	93	WA
2511	ZIP	95	99	2609
2511	CITY	83	89	URUNGA
2511	DATE	125	133	9/5/1986	1986-09-05
2511	DATE	153	163	30/11/2065	2065-11-30
2511	DATE	2245	2253	30.11.65	2065-11-30
2511	DEPARTMENT	184	189	SEALS
2511	HOSPITAL	190	211	MOYNE HEALTH SERVICES
2511	DOCTOR	215	236	Vito FREDERICH DOWNIE
2511	DOCTOR	2284	2291	B Janes
2511	IDNUM	13	23	00L513633K
2511	IDNUM	63	71	00L51363
2511	MEDICALRECORD	24	35	0045136.IIK
2511	PATIENT	37	52	IKZDA, Vladimir
2511	STATE	91	93	WA
2511	STREET	72	82	Georgetown
2511	ZIP	95	99	2609
2512	CITY	77	83	LEETON
2512	STATE	85	87	WA
2512	ZIP	89	93	3922
2512	CITY	77	83	LEETON
2512	DATE	119	128	15/6/1983	1983-06-15
2512	DATE	148	158	27/11/2065	2065-11-27
2512	DATE	2617	2625	30.11.65	2065-11-30
2512	DEPARTMENT	175	178	ACT
2512	HOSPITAL	179	206	WALCHA MULTIPURPOSE SERVICE
2512	DOCTOR	210	228	SONNY TROY Sibgert
2512	DOCTOR	2655	2667	P Manrriquez
2512	DOCTOR	644	651	P Isacs
2512	DOCTOR	658	665	P Visco
2512	TIME	669	687	2.20pm on 27.11.65	2066-11-27T14:20
2512	IDNUM	13	23	68H634691T
2512	IDNUM	63	71	68H63469
2512	MEDICALRECORD	24	35	6826346.YET
2512	PATIENT	37	44	Ballena
2512	PATIENT	72	76	Hoff
2512	STATE	175	178	ACT
2512	STATE	179	181	WA
2512	STATE	85	87	WA
2512	ZIP	89	93	3922
2518	CITY	3659	3667	CANBERRA
2518	CITY	4655	4668	BACCHUS MARSH
2518	CITY	91	97	LEETON
2518	STATE	99	101	WA
2518	ZIP	103	107	6426
2518	CITY	91	97	LEETON
2518	DATE	133	142	11/9/1996	1996-11-09
2518	DATE	162	172	08/04/2065	2065-04-08
2518	DEPARTMENT	193	216	Molecular Oncology Unit
2518	HOSPITAL	217	240	SWAN DISTRICTS HOSPITAL
2518	DOCTOR	2021	2029	Z Krason
2518	DOCTOR	244	269	MODESTO Dorthy Federgreen
2518	DOCTOR	288	293	ABRAM
2518	DOCTOR	3707	3721	Tyson Z'Notter
2518	HOSPITAL	3655	3676	THE CANBERRA HOSPITAL
2518	HOSPITAL	4638	4668	WESTERN HEALTH - BACCHUS MARSH
2518	IDNUM	14	24	90Q835408P
2518	IDNUM	70	78	90Q83540
2518	MEDICALRECORD	25	36	9068354.AVP
2518	PATIENT	38	59	Enamorado, WENDY-ANNE
2518	STATE	218	220	WA
2518	STATE	99	101	WA
2518	ZIP	103	107	6426
5029	CITY	3573	3581	YAROOMBA
5029	CITY	82	91	RIVERVIEW
5029	STATE	93	95	WA
5029	ZIP	97	101	2824
5029	CITY	82	91	RIVERVIEW
5029	DATE	127	136	3/11/1997	1997-03-11
5029	DATE	156	165	18/2/2064	2064-02-18
5029	DATE	291	298	18.1.66	2066-01-18
5029	DATE	3515	3522	18.1.66	2066-01-18
5029	DEPARTMENT	182	194	SEALSCentral
5029	HOSPITAL	195	213	KATANNING HOSPITAL
5029	DEPARTMENT	3536	3557	ORANGE HEALTH SERVICE
5029	DOCTOR	1587	1589	EB
5029	DATE	1593	1600	18/2/64	2064-02-18
5029	DOCTOR	1633	1641	O Dobias
5029	DOCTOR	217	237	Kenny SHAD Rajaniemi
5029	DOCTOR	3597	3612	WADJARRI Rudolf
5029	DOCTOR	3631	3639	Patricia
5029	DOCTOR	5795	5804	Douillard
5029	DOCTOR	5805	5808	J-Y
5029	IDNUM	13	23	58M856566Y
5029	IDNUM	5655	5659	1474
5029	IDNUM	60	68	58M85656
5029	MEDICALRECORD	24	35	5848565.PQY
5029	PATIENT	37	49	KAMPFER, Boy
5029	STATE	3597	3599	WA
5029	STATE	93	95	WA
5029	STREET	69	81	North Bronte
5029	ZIP	97	101	2824
5031	CITY	95	100	PERTH
5031	STATE	102	104	SA
5031	ZIP	106	110	7025
5031	CITY	95	100	PERTH
5031	DATE	145	154	28/9/1991	1991-09-28
5031	DATE	174	183	29/7/2065	2065-07-29
5031	DATE	3616	3623	30/7/65	2065-07-30
5031	DEPARTMENT	200	226	BRIGHAM & WOMEN'S HOSPITAL
5031	HOSPITAL	229	243	LOGAN HOSPITAL
5031	DOCTOR	247	275	ELWOOD Ashtonjack WALDENBERG
5031	DOCTOR	3656	3666	L Iadarola
5031	IDNUM	14	24	43N397724E
5031	IDNUM	70	78	43N39772
5031	IDNUM	79	87	43N39772
5031	MEDICALRECORD	25	36	4353977.FLE
5031	PATIENT	38	59	ATHANS, Manuel Werner
5031	PATIENT	88	94	Guinda
5031	STATE	102	104	SA
5031	ZIP	106	110	7025
5032	DATE	355	362	29.5.65	2065-05-29
5032	DATE	58	66	6/3/2065	2065-03-06
5032	DOCTOR	1094	1114	Ngarrindjeri Brumett
5032	DOCTOR	392	402	W Balzotti
5032	IDNUM	34	42	85V59853
5032	MEDICALRECORD	1	12	8585985.ICB
5032	PATIENT	13	33	ARNET, RUBEN Alberto
5034	CITY	97	106	MITTAGONG
5034	STATE	108	116	Victoria
5034	ZIP	118	122	7256
5034	CITY	97	106	MITTAGONG
5034	DATE	157	167	18/10/2011	2011-10-18
5034	DATE	187	197	06/02/2065	2065-02-06
5034	DATE	345	352	15.6.65	2065-06-15
5034	DEPARTMENT	218	233	ENVOI Pathology
5034	HOSPITAL	234	259	BEECHWORTH HEALTH SERVICE
5034	DOCTOR	2298	2307	T Deakins
5034	DOCTOR	263	283	Carlos HORACE WIGREN
5034	DOCTOR	462	468	Ramiro
5034	DOCTOR	475	483	T Jetton
5034	DOCTOR	6736	6744	T Branan
5034	DOCTOR	7340	7348	TEdgardo
5034	DATE	7352	7359	6.12.65	2065-12-06
5034	DOCTOR	7399	7410	T Partridge
5034	DATE	7412	7419	15.6.65	2065-06-15
5034	HOSPITAL	7464	7481	ATHERTON HOSPITAL
5034	IDNUM	13	23	70W049799H
5034	IDNUM	66	74	70W04979
5034	IDNUM	75	83	70W04979
5034	MEDICALRECORD	24	35	7080497.YXH
5034	PATIENT	37	55	CASILLO, Jacquetta
5034	STATE	108	116	Victoria
5034	STREET	84	96	Featherstall
5034	ZIP	118	122	7256
5035	CITY	85	91	LAWSON
5035	STATE	93	96	TAS
5035	ZIP	98	102	6316
5035	CITY	85	91	LAWSON
5035	DATE	128	137	27/6/1988	1988-06-27
5035	DATE	157	167	14/12/2065	2065-12-14
5035	DEPARTMENT	188	201	EAST SURGICAL
5035	HOSPITAL	202	221	BEAUDESERT HOSPITAL
5035	DOCTOR	225	247	Melissia MARINA Camors
5035	DATE	3074	3082	15/12/65	2065-12-15
5035	DOCTOR	3117	3125	I Chabez
5035	IDNUM	14	24	37T060857P
5035	IDNUM	68	76	37T06085
5035	MEDICALRECORD	25	36	3770608.NSP
5035	PATIENT	38	57	GROSKREUTZ, Sebrina
5035	PATIENT	4173	4178	Donut
5035	PATIENT	77	84	Bagwell
5035	STATE	93	96	TAS
5035	STREET	3707	3714	Pleural
5035	STREET	4371	4385	0 of 6 Coeliac
5035	STREET	4386	4407	5 of 8 Paraoesophgeal
5035	ZIP	98	102	6316
5049	CITY	235	241	SYDNEY
5049	CITY	95	103	TAMWORTH
5049	STATE	105	107	NT
5049	ZIP	109	113	2080
5049	CITY	95	103	TAMWORTH
5049	DATE	145	154	15/2/1983	1983-02-15
5049	DATE	174	183	12/1/2065	2065-12-01
5049	DATE	2834	2841	12.3.65	2065-12-03
5049	DATE	345	352	12/1/65	2065-12-01
5049	DATE	4959	4966	12/2/65	2065-12-02
5049	DEPARTMENT	200	214	ANTENATAL WARD
5049	HOSPITAL	215	245	CALVARY HEALTH CARE SYDNEY LTD
5049	DOCTOR	249	268	JAMAAL ARTHUR Lacek
5049	DOCTOR	2753	2756	JAN
5049	DOCTOR	2757	2762	MASON
5049	DATE	2766	2773	12/2/65	2065-12-02
5049	DOCTOR	4997	5005	S Hodgen
5049	IDNUM	13	23	79B262663M
5049	IDNUM	69	77	79B26266
5049	IDNUM	78	86	79B26266
5049	MEDICALRECORD	24	35	7902626.PKM
5049	PATIENT	37	58	FALDYN, COLLEEN Aiden
5049	PATIENT	87	94	Rogerio
5049	STATE	105	107	NT
5049	STATE	201	203	NT
5049	ZIP	109	113	2080
5050	DATE	1673	1680	17.6.65	2065-06-17
5050	DATE	63	72	19/6/2065	2065-06-19
5050	DOCTOR	199	207	G Penman
5050	TIME	212	229	11.15am, 17/06/65	2066-06-11T11:15
5050	DOCTOR	1713	1723	Q Dimattia
5050	IDNUM	39	47	27X38261
5050	MEDICALRECORD	1	12	2793826.EFU
5050	PATIENT	13	38	PRUYNE, Marcellus Baladji
5051	CITY	85	91	MUDGEE
5051	STATE	88	91	GEE
5051	ZIP	95	99	7330
5051	DATE	125	134	21/8/2008	2008-08-21
5051	DATE	154	163	19/1/2066	2066-01-19
5051	DATE	2048	2055	18/1/66	2066-01-18
5051	DEPARTMENT	180	202	Southern IML Pathology
5051	HOSPITAL	203	252	KAROONDA AND DISTRICT SOLDIERS' MEMORIAL HOSPITAL
5051	DOCTOR	2088	2099	A Neighbors
5051	DOCTOR	256	288	NORMAN DOMINICA Cristobal-Telles
5051	DOCTOR	799	808	A Mandril
5051	DOCTOR	815	825	A Vigueras
5051	TIME	829	847	7:47pm on 19/01/66	2066-01-19T13:47
5051	IDNUM	13	23	06L904638O
5051	IDNUM	65	73	06L90463
5051	MEDICALRECORD	24	34	064904.PIW
5051	ORGANIZATION	3162	3169	Western
5051	HOSPITAL	3192	3211	BODDINGTON HOSPITAL
5051	PATIENT	36	54	GREENLEES, Wilfred
5051	STREET	74	84	Wooleytown
5051	ZIP	95	99	7330
5064	CITY	12782	12788	LAWSON
5064	CITY	79	85	WILTON
5064	STATE	87	95	Tasmania
5064	ZIP	97	101	2115
5064	CITY	79	85	WILTON
5064	DATE	11605	11613	18.12.65	2065-12-18
5064	DATE	127	135	3/5/2027	2027-03-05
5064	DATE	155	165	11/06/2065	2065-06-11
5064	DATE	312	320	18.12.65	2065-12-18
5064	DATE	3214	3221	11/9/65	2065-11-09
5064	DEPARTMENT	12754	12770	MED/SURGERY WARD
5064	DOCTOR	12790	12792	NT
5064	HOSPITAL	12790	12792	NT
5064	DEPARTMENT	186	205	PERI-OPERATIVE UNIT
5064	HOSPITAL	206	225	PARABURDOO HOSPITAL
5064	DOCTOR	10522	10533	O Pinkowski
5064	DOCTOR	11656	11668	Rocky Harmen
5064	DOCTOR	11709	11720	IRA Cormack
5064	DOCTOR	11722	11737	Seals Reference
5064	DOCTOR	11804	11808	Reid
5064	DOCTOR	12689	12703	Rupert Draggoo
5064	DOCTOR	12809	12825	Dominick Sweazey
5064	DOCTOR	229	247	Abe MORGAN Deromer
5064	DOCTOR	3252	3262	O Goffinet
5064	DOCTOR	535	543	O Venzor
5064	DOCTOR	550	558	O Lagana
5064	IDNUM	13	23	54H925686X
5064	IDNUM	63	71	54H92568
5064	MEDICALRECORD	24	35	5429256.XRX
5064	PATIENT	37	52	ROTNER, TRISTAN
5064	STATE	11590	11592	NT
5064	STATE	12716	12718	NT
5064	STATE	12790	12792	NT
5064	STATE	296	298	NT
5064	STATE	333	335	NT
5064	STATE	8628	8630	NT
5064	STATE	87	95	Tasmania
5064	STREET	72	78	Bronti
5064	ZIP	97	101	2115
5082	CITY	76	85	DELORAINE
5082	STATE	87	97	Queensland
5082	ZIP	99	103	6109
5082	DATE	129	137	6/6/2004	2004-06-06
5082	DATE	157	165	2/2/2066	2066-02-02
5082	DEPARTMENT	182	204	POSTOPERATIVE RECOVERY
5082	HOSPITAL	205	232	HENTY MULTI PURPOSE SERVICE
5082	DOCTOR	236	267	Marlyn STEVEN Norman-PILKINGTON
5082	DOCTOR	2407	2420	M Rounsaville
5082	DOCTOR	805	814	M Proksch
5082	TIME	818	839	16:45pm on 02.02.2066	2066-02-02
5082	IDNUM	13	23	49I475854D
5082	IDNUM	62	70	49I47585
5082	MEDICALRECORD	24	34	493475.XNL
5082	ORGANIZATION	3511	3542	United Technologies Corporation
5082	HOSPITAL	3544	3563	GOOMALLING HOSPITAL
5082	PATIENT	36	51	Harbough, Retta
5082	PATIENT	71	75	Baio
5082	STATE	87	97	Queensland
5082	ZIP	99	103	6109
5083	CITY	79	89	EMU PLAINS
5083	STATE	91	99	Tasmania
5083	ZIP	101	105	3024
5083	CITY	79	89	EMU PLAINS
5083	DATE	131	140	12/4/1997	1997-12-04
5083	DATE	160	169	26/1/2066	2066-01-26
5083	DATE	2471	2478	27.1.66	2066-01-27
5083	DATE	4007	4014	27/1/66	2066-01-27
5083	DEPARTMENT	184	224	Tissue Pathology and Diagnostic Oncology
5083	HOSPITAL	227	246	BRIDGETOWN HOSPITAL
5083	DOCTOR	250	276	Kamilaroi Clifford Stinton
5083	DOCTOR	4045	4052	W Trail
5083	DOCTOR	884	892	Frederic
5083	DOCTOR	899	907	W Cellar
5083	DOCTOR	915	922	W Gaden
5083	TIME	926	944	5:45pm on 26/01/66	2066-01-26
5083	IDNUM	13	23	81R677661Z
5083	IDNUM	4839	4847	81R67766
5083	IDNUM	63	71	81R67766
5083	MEDICALRECORD	24	35	8166776.PDZ
5083	PATIENT	37	52	Lansdale, WALDO
5083	PATIENT	72	78	Chiles
5083	STATE	91	99	Tasmania
5083	ZIP	101	105	3024
5085	CITY	6216	6223	TANUNDA
5085	CITY	81	91	GOLD COAST
5085	STATE	93	96	ACT
5085	ZIP	98	102	6841
5085	DATE	128	136	4/2/1989	1989-02-04
5085	DATE	156	165	13/1/2065	2065-01-13
5085	DATE	1639	1646	13.1.65	2065-01-13
5085	DATE	6205	6213	2.9.2066	2066-09-02
5085	DEPARTMENT	182	195	MACQUARIEWARD
5085	HOSPITAL	196	245	KAROONDA AND DISTRICT SOLDIERS' MEMORIAL HOSPITAL
5085	DOCTOR	1680	1690	U Deblieck
5085	DOCTOR	249	269	Erik Randolph Muther
5085	DOCTOR	5552	5566	U U'Matulewicz
5085	DOCTOR	5576	5586	U Calamari
5085	HOSPITAL	5590	5630	STRATHALBYN AND DISTRICT HEALTH SERVICES
5085	DOCTOR	5699	5707	U Eggink
5085	DOCTOR	6259	6276	EZRA U'Covarrubia
5085	DATE	6278	6286	2.6.2066	2066-06-02
5085	DOCTOR	7715	7726	LUBA ASANTE
5085	DOCTOR	7734	7753	RAYMUNDO LUANGAMATH
5085	DOCTOR	7982	7992	U Groshong
5085	HOSPITAL	6216	6232	TANUNDA HOSPITAL
5085	IDNUM	14	24	76S118929F
5085	IDNUM	64	72	76S11892
5085	MEDICALRECORD	25	35	767118.XFY
5085	PATIENT	37	53	Duntley, CLAUDIO
5085	PATIENT	73	80	Agatite
5085	STATE	93	96	ACT
5085	ZIP	98	102	6841
5086	CITY	191	203	CAMPBELLTOWN
5086	CITY	7437	7448	HEALESVILLE
5086	CITY	87	96	CHURCHILL
5086	ZIP	100	104	5680
5086	CITY	87	96	CHURCHILL
5086	DATE	130	140	25/12/1998	1998-12-25
5086	DATE	160	168	2/2/2066	2066-02-02
5086	DEPARTMENT	185	190	SWAPS
5086	HOSPITAL	191	212	CAMPBELLTOWN HOSPITAL
5086	DOCTOR	216	237	BRIGETTE Bryan-Rogado
5086	DOCTOR	2854	2866	E Castillejo
5086	DOCTOR	864	869	Merle
5086	DOCTOR	876	889	E Reatherford
5086	TIME	893	914	06:33pm on 02.02.2066	2066-02-06T06:33
5086	IDNUM	-1	9	18B3196450
5086	IDNUM	65	73	18B31963
5086	MEDICALRECORD	24	34	180319.RIP
5086	ORGANIZATION	6955	6971	Eastman Chemical
5086	HOSPITAL	6973	6987	BURRA HOSPITAL
5086	ORGANIZATION	7414	7421	Lexmark
5086	HOSPITAL	7437	7468	HEALESVILLE & DISTRICT HOSPITAL
5086	PATIENT	36	43	Mitcham
5086	DOCTOR	45	54	BRODERICK
5086	STREET	74	85	Old Seacoal
5086	ZIP	100	104	5680
5087	DATE	318	325	13.1.66	2066-01-13
5087	DATE	58	67	15/1/2066	2066-01-15
5087	DOCTOR	356	364	S Farrel
5087	IDNUM	34	42	76X33078
5087	MEDICALRECORD	1	12	7683307.XKK
5087	PATIENT	13	33	Peightal, DOUG Devin
5088	DATE	1533	1540	14.1.66	2066-01-14
5088	DATE	52	61	18/1/2066	2066-01-18
5088	DOCTOR	1570	1578	D Mulkey
5088	IDNUM	28	36	17G63250
5088	MEDICALRECORD	2	13	1726325.ACH
5088	PATIENT	14	27	Helde, ISRAEL
5090	CITY	95	102	FORSTER
5090	STATE	104	107	ACT
5090	ZIP	109	113	6409
5090	CITY	95	102	FORSTER
5090	DATE	148	158	16/10/2009	2009-10-16
5090	DATE	178	188	28/12/2065	2065-12-28
5090	DEPARTMENT	205	208	DHM
5090	HOSPITAL	211	239	PORT MACQUARIE BASE HOSPITAL
5090	DOCTOR	2220	2222	FH
5090	DATE	2226	2234	29.12.65	2065-12-29
5090	DOCTOR	2265	2272	A Guion
5090	DOCTOR	243	267	Sherwood ORVAL SUCHARSKI
5090	DOCTOR	990	1002	Stevie VERNI
5090	DOCTOR	1009	1017	A Chahal
5090	TIME	1021	1038	11.15 on 28.12.65	2065-12-28T11:15
5090	IDNUM	13	23	02G0837685
5090	IDNUM	69	77	02G08376
5090	IDNUM	78	86	02G08376
5090	MEDICALRECORD	24	35	0220837.PWN
5090	PATIENT	37	58	Jackosn, Ellyn Hubert
5090	PATIENT	87	94	Conners
5090	STATE	104	107	ACT
5090	ZIP	109	113	6409
5091	CITY	78	86	CULBURRA
5091	STATE	88	91	QLD
5091	ZIP	93	97	2649
5091	CITY	78	86	CULBURRA
5091	DATE	123	131	7/2/2018	2018-02-07
5091	DATE	151	160	9/11/2065	2065-11-09
5091	DATE	2597	2604	9.12.65	2065-09-12
5091	DEPARTMENT	177	193	MED/SURGERY WARD
5091	HOSPITAL	194	240	TRESILLIAN FAMILY CARE CENTRE - WOLLSTONECRAFT
5091	DOCTOR	244	265	TROY Lanita BERENDZEN
5091	DOCTOR	2636	2648	P Bellefleur
5091	DOCTOR	595	608	P Worthington
5091	DOCTOR	615	627	P Birmingham
5091	TIME	631	650	11:08am on 09.11.65	2065-11-09T11:08
5091	IDNUM	14	24	50D003816V
5091	IDNUM	61	69	50D00381
5091	MEDICALRECORD	25	36	5010038.ERV
5091	PATIENT	38	50	RINNERT, Sal
5091	STATE	88	91	QLD
5091	STREET	70	77	Berteau
5091	ZIP	93	97	2649
5092	CITY	207	216	MILLICENT
5092	CITY	85	98	TENNANT CREEK
5092	STATE	100	103	TAS
5092	ZIP	105	109	5233
5092	CITY	85	98	TENNANT CREEK
5092	DATE	135	143	1/5/2011	2011-01-01
5092	DATE	1847	1854	18.8.65	2065-08-18
5092	DATE	375	384	25.9.2065	2065-09-25
5092	DEPARTMENT	187	204	ST GEORGE PRIVATE
5092	HOSPITAL	207	258	MILLICENT AND DISTRICT HOSPITAL AND HEALTH SERVICES
5092	DOCTOR	1886	1893	Z Layel
5092	DOCTOR	1897	1911	Z Antonopoulos
5092	DOCTOR	262	284	Alvin Maurice YASUTOMI
5092	DOCTOR	3359	3372	Fabian Spiwak
5092	DOCTOR	389	399	Z Zukowsky
5092	IDNUM	13	23	92L305523S
5092	IDNUM	61	69	92L30552
5092	MEDICALRECORD	24	35	9243055.HJS
5092	PATIENT	37	50	Traber, Jaime
5092	STATE	100	103	TAS
5092	STREET	70	84	South Bradford
5092	ZIP	105	109	5233
5123	CITY	86	91	GRETA
5123	STATE	93	96	ACT
5123	ZIP	98	102	3151
5123	CITY	86	91	GRETA
5123	DATE	128	138	27/12/1992	1992-12-27
5123	DATE	158	168	30/07/2065	2065-07-30
5123	DATE	2799	2806	8.11.65	2065-11-08
5123	DATE	3154	3161	8.11.65	2065-11-08
5123	DATE	340	347	20.8.65	2065-08-20
5123	DATE	375	382	24.8.65	2065-08-24
5123	DEPARTMENT	189	198	Anat Path
5123	HOSPITAL	201	238	CLERMONT MULTI-PURPOSE HEALTH SERVICE
5123	DOCTOR	10821	10830	X Quattro
5123	DOCTOR	11210	11219	X Bartnik
5123	DOCTOR	242	267	Isidra TRAN BRYANT-RACINE
5123	DOCTOR	3193	3203	X Penaflor
5123	IDNUM	14	24	50I326681A
5123	IDNUM	4956	4964	87M74688
5123	IDNUM	65	73	50I32668
5123	IDNUM	7833	7841	87M74688
5123	MEDICALRECORD	25	36	5033266.WEA
5123	ORGANIZATION	9380	9397	The TJX Companies
5123	HOSPITAL	9399	9414	NEPEAN HOSPITAL
5123	PATIENT	38	54	PINEAULT, Darcel
5123	STATE	93	96	ACT
5123	STREET	74	85	Shortcrofts
5123	STREET	7706	7742	Miller Payne Grading System post NAT
5123	ZIP	98	102	3151
5124	CITY	81	87	LAWSON
5124	STATE	89	104	South Australia
5124	ZIP	106	110	4388
5124	CITY	81	87	LAWSON
5124	DATE	136	145	10/4/2015	2015-04-10
5124	DATE	165	175	05/08/2065	2065-08-05
5124	DEPARTMENT	196	218	POSTOPERATIVE RECOVERY
5124	HOSPITAL	219	261	TEXAS HOSPITAL MULTIPURPOSE HEALTH SERVICE
5124	DOCTOR	2302	2309	L Losey
5124	DOCTOR	265	289	Benedict Marcelino Josic
5124	DOCTOR	308	312	Deon
5124	IDNUM	13	23	45J766849G
5124	IDNUM	2969	2977	45J76684
5124	IDNUM	60	68	45J76684
5124	MEDICALRECORD	24	35	4537668.MZG
5124	PATIENT	37	49	Dusel, Kathi
5124	STATE	89	104	South Australia
5124	STREET	69	80	Brandy Hill
5124	ZIP	106	110	4388
5125	CITY	217	226	MILLICENT
5125	CITY	80	93	TENNANT CREEK
5125	STATE	95	110	South Australia
5125	ZIP	112	116	3835
5125	CITY	80	93	TENNANT CREEK
5125	DATE	142	152	12/10/1992	1992-10-12
5125	DATE	2058	2065	13.2.65	2065-02-13
5125	DEPARTMENT	203	216	EAST SURGICAL
5125	HOSPITAL	217	268	MILLICENT AND DISTRICT HOSPITAL AND HEALTH SERVICES
5125	DOCTOR	2096	2105	V Liscano
5125	DOCTOR	272	290	Berry JACALYN YUEN
5125	DOCTOR	696	709	LINWOOD Finto
5125	IDNUM	13	23	87R068656D
5125	IDNUM	60	68	87R06865
5125	MEDICALRECORD	24	34	876068.QPQ
5125	PATIENT	36	49	LENHERR, ELOY
5125	STATE	95	110	South Australia
5125	STREET	69	79	Farmingham
5125	TIME	172	191	13/02/2065 at 09:36	2065-02-13T09:36
5125	ZIP	112	116	3835
5126	CITY	93	101	YAROOMBA
5126	STATE	103	106	ACT
5126	ZIP	108	112	5001
5126	CITY	93	101	YAROOMBA
5126	DATE	1242	1250	22.10.65	2065-10-22
5126	DATE	138	148	17/12/1990	1990-12-17
5126	DATE	168	178	21/10/2065	2065-10-21
5126	DEPARTMENT	195	217	Southern IML Pathology
5126	HOSPITAL	220	248	ROYAL PRINCE ALFRED HOSPITAL
5126	DOCTOR	1281	1287	T Luga
5126	DOCTOR	252	263	LYMAN Spurr
5126	IDNUM	14	24	72S419814J
5126	IDNUM	75	83	72S41981
5126	MEDICALRECORD	25	36	7274198.ELJ
5126	PATIENT	38	64	Phatdouang, Sergio Rolando
5126	STATE	103	106	ACT
5126	STREET	84	92	Bromhall
5126	ZIP	108	112	5001
5128	CITY	201	207	LEETON
5128	CITY	91	99	GRENFELL
5128	ZIP	103	107	2479
5128	DATE	142	150	6/6/2008	2008-06-06
5128	DATE	3265	3275	12/12/2064	2064-12-12
5128	DEPARTMENT	201	225	LEETON DISTRICT HOSPITAL
5128	DOCTOR	2093	2095	AE
5128	DOCTOR	2128	2137	H. Kusner
5128	DOCTOR	229	244	Terence MCSWEEN
5128	DOCTOR	263	268	Fritz
5128	IDNUM	13	23	20O539972R
5128	IDNUM	60	68	20O53997
5128	IDNUM	69	77	20O53997
5128	MEDICALRECORD	24	34	205539.YTG
5128	ORGANIZATION	3333	3373	The Kroger Douglass Hanly Moir Pathology
5128	PATIENT	36	43	Placzek
5128	STREET	78	90	Golden Arrow
5128	TIME	170	180	10/12/2064	2064-12-10T09:28
5128	ZIP	103	107	2479
5129	DATE	54	62	9/9/2065	2065-09-09
5129	DOCTOR	1176	1186	R Aredondo
5129	IDNUM	30	38	61X73178
5129	MEDICALRECORD	1	11	619731.SWX
5129	PATIENT	12	29	STELLMAN, DANIELA
5131	CITY	90	102	MOUNT EVELYN
5131	STATE	104	122	Northern Territory
5131	ZIP	124	128	2315
5131	CITY	90	102	MOUNT EVELYN
5131	DATE	163	171	5/1/1993	1993-01-05
5131	DATE	191	201	09/07/2065	2065-07-09
5131	DATE	6255	6262	14/7/65	2065-07-14
5131	DEPARTMENT	210	406	COPPERPERPERPERPERPERPERPERPERPERPERPERPERPERPERPERPERPERPERPERPERPERPERIANSANSANSANSANSANSANSANSANSANSANSANSANSANSANSANSANSANSANSANSANSANSANSANSANSANSANSANSANSANSANSANSANSANSANSANSANSANSANSANSANS
5131	DOCTOR	254	260	Maione
5131	DOCTOR	2691	2701	P. Gerdsen
5131	DOCTOR	279	285	Roesch
5131	IDNUM	13	23	29T752747W
5131	IDNUM	64	72	29T75274
5131	IDNUM	73	81	29T75274
5131	MEDICALRECORD	24	34	297752.ULT
5131	ORGANIZATION	6321	6354	Murphy Oil POSTOPERATIVE RECOVERY
5131	PATIENT	36	53	OSAYANDE, Tabetha
5131	PATIENT	82	89	Rowarth
5131	STATE	104	122	Northern Territory
5131	ZIP	124	128	2315
5133	CITY	88	103	CHARTERS TOWERS
5133	STATE	105	108	QLD
5133	CITY	88	103	CHARTERS TOWERS
5133	DATE	149	158	18/1/1997	1997-01-18
5133	DATE	4479	4486	14/7/65	2065-07-14
5133	DATE	5277	5286	20/7/2065	2065-07-20
5133	DEPARTMENT	208	246	CLONCURRY MULTI-PURPOSE HEALTH SERVICE
5133	DOCTOR	2476	2486	Q Bhardwaj
5133	DOCTOR	250	265	TRACEY Crayford
5133	DOCTOR	284	288	KORY
5133	IDNUM	13	23	61C0545547
5133	IDNUM	61	69	61C05455
5133	IDNUM	70	78	61C05455
5133	MEDICALRECORD	24	34	611054.OOK
5133	ORGANIZATION	4544	4584	The PNC Financial KATANNING HOSPITAL Lab
5133	PATIENT	36	50	Hildago, Cohen
5133	PATIENT	79	87	Bindaree
5133	STATE	105	108	QLD
5133	TIME	177	196	07/10/2065 at 12:11	2065-10-07T12:11
5133	ZIP	110	114	2322
5135	CITY	90	100	EMU PLAINS
5135	CITY	90	100	EMU PLAINS
5135	CITY	9292	9297	Young
5135	DATE	10020	10027	6/10/65	2065-10-06
5135	DATE	10677	10684	7/10/65	2065-10-07
5135	DATE	10702	10709	7/10/65	2065-10-07
5135	DATE	143	151	3/7/2007	2007-03-07
5135	DATE	171	181	23/09/2065	2065-09-23
5135	DATE	6694	6701	30/9/65	2065-09-30
5135	DEPARTMENT	202	221	BEAUDESERT HOSPITAL
5135	DOCTOR	225	237	KELVIN MONTY
5135	DOCTOR	267	273	Stuart
5135	DOCTOR	3380	3387	Willits
5135	DOCTOR	9262	9267	Wu RI
5135	DOCTOR	9269	9279	Schorge HO
5135	DOCTOR	9950	9963	VAUGHN Kohnke
5135	DATE	9965	9972	5/10/65	2065-10-05
5135	HOSPITAL	10105	10124	BEAUDESERT HOSPITAL
5135	HOSPITAL	6743	6766	SWAN DISTRICTS HOSPITAL
5135	IDNUM	14	24	98T363178O
5135	IDNUM	60	68	98T36317
5135	IDNUM	69	77	98T36317
5135	MEDICALRECORD	25	35	987363.CUV
5135	PATIENT	37	49	Junk, THERON
5135	PATIENT	6849	6860	Dear Rudolf
5135	STREET	78	89	Armley Park
5135	ZIP	104	108	3805
5135	ZIP	8852	8856	2009
5135	ZIP	9540	9544	2014
5137	CITY	4500	4509	BALRANALD
5137	CITY	85	92	EMERALD
5137	ZIP	96	100	3558
5137	DATE	135	144	23/9/1976	1976-09-23
5137	DATE	164	174	19/08/2065	2065-08-19
5137	DATE	324	331	27/8/65	2065-08-27
5137	DATE	4418	4426	24/06/15	2063-06-24
5137	DATE	5067	5074	25/6/15	2030-06-25
5137	DEPARTMENT	195	216	MOUNT DRUITT HOSPITAL
5137	DOCTOR	220	233	Smokey BAXTER
5137	DOCTOR	2295	2307	O. Magelssen
5137	DOCTOR	252	259	Charles
5137	IDNUM	13	23	56D494711Z
5137	IDNUM	60	68	56D49471
5137	IDNUM	69	77	56D49471
5137	MEDICALRECORD	24	34	561494.UEF
5137	ORGANIZATION	4485	4499	TRW Automotive
5137	DEPARTMENT	4471	4474	MSI
5137	PATIENT	36	49	HUMPREY, Neil
5137	PATIENT	78	84	Gagnon
5137	ZIP	96	100	3558
5139	CITY	88	95	KEMPSEY
5139	STATE	97	99	SA
5139	ZIP	101	105	6053
5139	DATE	140	150	20/11/2009	2009-11-20
5139	DATE	170	180	30/12/2064	2064-12-30
5139	DATE	5662	5669	13/2/64	2064-02-13
5139	DATE	6417	6424	16/1/65	2065-01-16
5139	DEPARTMENT	201	217	WEST GYNAECOLOGY
5139	DOCTOR	221	238	FREDERICH DYRSTAD
5139	DOCTOR	257	263	RUDOLF
5139	DOCTOR	268	274	Travis
5139	IDNUM	13	23	04Z425870H
5139	IDNUM	4546	4554	98M69652
5139	IDNUM	62	70	04Z42587
5139	IDNUM	71	79	04Z42587
5139	MEDICALRECORD	24	34	049425.VTA
5139	PATIENT	36	51	BRIGNAC, Jarvis
5139	PATIENT	80	87	Bancker
5139	STATE	97	99	SA
5139	ZIP	101	105	6053
5140	CITY	83	92	GLENBROOK
5140	STATE	94	97	QLD
5140	DATE	129	138	18/2/1994	1994-02-18
5140	DATE	158	168	19/08/2065	2065-08-19
5140	DATE	3676	3683	20.8.65	2065-08-20
5140	DEPARTMENT	189	198	StVincent
5140	DOCTOR	224	243	Bud Giuseppe Winter
5140	DOCTOR	3713	3720	M Hesch
5140	IDNUM	13	23	46I727686E
5140	IDNUM	65	73	46I72768
5140	MEDICALRECORD	24	35	4637276.VRE
5140	PATIENT	37	54	KERNODLE, Terrell
5140	PATIENT	74	82	Chidwall
5140	STATE	94	97	QLD
5140	ZIP	99	103	2321
5141	CITY	102	109	BENDIGO
5141	STATE	111	114	VIC
5141	ZIP	116	120	5232
5141	CITY	102	109	BENDIGO
5141	DATE	146	154	7/1/2014	2014-01-07
5141	DATE	1526	1534	18/12/65	2065-12-18
5141	DATE	174	184	16/12/2065	2065-12-16
5141	DEPARTMENT	201	206	SEALS
5141	HOSPITAL	207	221	WEIPA HOSPITAL
5141	DEPARTMENT	2653	2671	Molecular Oncology
5141	IDNUM	2693	2703	41316-78LM
5141	DOCTOR	1568	1577	K Skibski
5141	DOCTOR	225	244	CAREY Dawne POMMIER
5141	IDNUM	13	23	41J167844K
5141	IDNUM	72	80	41J16784
5141	MEDICALRECORD	24	35	4131678.LMK
5141	PATIENT	37	61	OVERKAMP, Fabian Maurice
5141	STATE	111	114	VIC
5141	STREET	83	101	Naperville Wheaton
5141	ZIP	116	120	5232
5143	CITY	458	468	NARACOORTE
5143	CITY	78	84	SYDNEY
5143	STATE	86	103	Western Australia
5143	ZIP	105	109	3506
5143	CITY	78	84	SYDNEY
5143	DATE	135	144	15/1/2006	2006-01-15
5143	DATE	164	172	2/5/2066	2066-02-05
5143	DATE	5001	5010	18/2/2066	2066-02-18
5143	DEPARTMENT	189	207	PERI-OPERATIVEUNIT
5143	HOSPITAL	208	246	BOOROWA MULTI PURPOSE SERVICE HOSPITAL
5143	DEPARTMENT	458	468	NARACOORTE
5143	DOCTOR	250	273	Maurice JONELLE Subasic
5143	DOCTOR	3256	3263	U Popov
5143	DOCTOR	390	403	BAILEY Bacayo
5143	TIME	423	434	forty years	2066-10-26
5143	DOCTOR	938	944	Birdow
5143	DOCTOR	951	959	U Polite
5143	TIME	987	1002	3:40pm 02.05.66	2066-05-02T15:40
5143	IDNUM	14	24	73S469651G
5143	IDNUM	62	70	73S46965
5143	MEDICALRECORD	25	36	7364696.ODG
5143	PATIENT	38	51	Flamand, Hoyt
5143	PATIENT	71	77	Euroka
5143	STATE	86	103	Western Australia
5143	ZIP	105	109	3506
5144	CITY	191	197	BOWRAL
5144	CITY	85	91	SYDNEY
5144	STATE	93	96	TAS
5144	ZIP	98	102	4224
5144	CITY	85	91	SYDNEY
5144	DATE	128	138	11/12/1990	1990-11-12
5144	DATE	158	168	20/11/2064	2064-11-20
5144	DATE	1738	1746	21.11.64	2064-11-21
5144	DEPARTMENT	185	190	Seals
5144	HOSPITAL	191	206	BOWRAL HOSPITAL
5144	DOCTOR	1783	1788	I Haq
5144	DOCTOR	1794	1802	IJerrell
5144	DOCTOR	210	227	SCOTT Rowan KOSKI
5144	IDNUM	13	23	31O480619P
5144	IDNUM	62	70	31O48061
5144	MEDICALRECORD	24	34	315480.RDY
5144	PATIENT	36	51	Aspen, LATRISHA
5144	STATE	93	96	TAS
5144	STREET	71	84	Cemmaes Court
5144	ZIP	98	102	4224
5145	DATE	1697	1706	17 2.2066	2066-02-17
5145	DATE	64	73	19/2/2066	2066-02-19
5145	DOCTOR	1739	1746	G Ordal
5145	IDNUM	40	48	26P83197
5145	MEDICALRECORD	1	11	265831.XTT
5145	PATIENT	12	39	Statton, VEDA Dustin Gerard
5146	CITY	87	96	ESPERANCE
5146	STATE	98	113	South Australia
5146	ZIP	115	119	1190
5146	DATE	145	155	14/10/2012	2012-10-14
5146	DATE	1845	1852	16.2.66	2066-02-16
5146	DEPARTMENT	206	217	UROLOGY OPD
5146	HOSPITAL	218	234	BALMAIN HOSPITAL
5146	DOCTOR	1887	1896	Q Jarreau
5146	DOCTOR	1904	1914	Q Diestler
5146	DOCTOR	238	261	Caden DALIA CONTOPOULOS
5146	DOCTOR	294	297	DON
5146	DOCTOR	4007	4018	Q. Fillhart
5146	DOCTOR	4090	4098	Q Rabine
5146	DOCTOR	4106	4115	Q Levitre
5146	DOCTOR	4117	4128	Haematology
5146	DOCTOR	4133	4142	Q Lechlak
5146	IDNUM	14	24	67Y122684R
5146	IDNUM	63	71	67Y12268
5146	MEDICALRECORD	25	35	679122.SVL
5146	PATIENT	37	52	BEDWARD, Fermin
5146	STATE	98	113	South Australia
5146	STREET	72	86	Anglesey Court
5146	TIME	175	185	16/02/2066	2066-02-16T10:31
5146	ZIP	115	119	1190
5147	CITY	90	96	GYMPIE
5147	ZIP	100	104	2093
5147	DATE	130	138	7/4/2000	2000-07-04
5147	DATE	158	167	16/2/2066	2066-02-16
5147	DATE	1908	1917	17 2.2066	2066-02-17
5147	DEPARTMENT	184	206	Southern IML Pathology
5147	HOSPITAL	207	244	GOLF LINKS ROAD REHABILITATION CENTRE
5147	DOCTOR	1950	1960	F Piacente
5147	DOCTOR	248	273	Raya MAKENNA Elmer-Glover
5147	IDNUM	13	23	25U153742A
5147	IDNUM	72	80	25U15374
5147	MEDICALRECORD	24	34	257153.TLG
5147	PATIENT	36	61	EMMER, Juana Gilberto REX
5147	STREET	81	89	Kerrwood
5147	ZIP	100	104	2093
5149	CITY	79	87	BALLARAT
5149	STATE	89	91	NT
5149	ZIP	93	97	3682
5149	CITY	79	87	BALLARAT
5149	DATE	123	132	5/12/1986	1986-12-05
5149	DATE	152	161	10/2/2066	2066-02-10
5149	DATE	1548	1555	11.2.66	2066-11-02
5149	DATE	309	316	24.2.66	2066-02-24
5149	DATE	3491	3498	24.2.66	2066-02-24
5149	DEPARTMENT	178	189	UROLOGY OPD
5149	HOSPITAL	190	231	BARWON HEALTH - NEWCOMB RENAL UNIT CAMPUS
5149	DEPARTMENT	3182	3211	PETER MACCALLUM CANCER CENTRE
5149	DOCTOR	1586	1593	D Zella
5149	DOCTOR	235	258	Alexander Cecila Laffer
5149	DOCTOR	277	286	Frederick
5149	IDNUM	13	23	10V594900G
5149	IDNUM	63	71	10V59490
5149	MEDICALRECORD	24	35	1085949.AAG
5149	PATIENT	37	52	BRUSCINO, Naoma
5149	PATIENT	72	78	Seelye
5149	STATE	295	297	NT
5149	STATE	3207	3209	NT
5149	STATE	3478	3480	NT
5149	STATE	89	91	NT
5149	ZIP	93	97	3682
5151	CITY	93	99	LAWSON
5151	ZIP	103	107	2566
5151	CITY	93	99	LAWSON
5151	DATE	139	148	26/4/2016	2016-04-26
5151	DATE	4363	4370	23.2.66	2066-02-23
5151	DEPARTMENT	199	204	SWAPS
5151	HOSPITAL	205	227	IVANHOE HEALTH SERVICE
5151	DOCTOR	1205	1210	Sonny
5151	DOCTOR	1221	1229	N Blyden
5151	TIME	1233	1252	11:30am on 21.02.66	66-02-21
5151	DOCTOR	2116	2120	Hugh
5151	DOCTOR	2125	2126	A
5151	TIME	2143	2162	12:00pm on 21.02.66	2066-02-21
5151	DOCTOR	231	250	Hollis HUNG Ospital
5151	DOCTOR	4402	4409	N Hilby
5151	IDNUM	13	23	52D895717C
5151	IDNUM	65	73	52D89571
5151	IDNUM	74	82	52D89571
5151	MEDICALRECORD	24	34	521895.TDS
5151	PATIENT	36	54	WETHINGTON, JUSTIN
5151	STREET	83	92	Bon Haven
5151	TIME	168	178	21/02/2066	2066-02-21
5151	ZIP	103	107	2566
5156	CITY	238	251	MOUNT GAMBIER
5156	CITY	93	103	GOLD COAST
5156	STATE	105	133	Australian Capital Territory
5156	ZIP	135	139	7290
5156	DATE	165	174	25/8/1993	1993-08-25
5156	DATE	194	204	18/02/2066	2066-02-18
5156	DATE	3645	3652	20.2.66	2066-02-20
5156	DEPARTMENT	225	235	Immunology
5156	HOSPITAL	238	280	MOUNT GAMBIER AND DISTRICTS HEALTH SERVICE
5156	DOCTOR	1251	1256	Brice
5156	DOCTOR	1293	1301	K Mcbeth
5156	TIME	1305	1322	1745H on 18.02.66	2066-02-18
5156	DOCTOR	1593	1599	Andrea
5156	DOCTOR	1626	1636	K Bruender
5156	TIME	1640	1657	1745H on 18.02.66	2066-02-18T17:45
5156	DOCTOR	284	297	MURRAY Barney
5156	DOCTOR	3682	3689	K Devol
5156	DOCTOR	758	771	Edythe KAISER
5156	DOCTOR	778	785	Barrett
5156	TIME	789	806	1510H on 18.02.66	2066-02-18T15:10
5156	IDNUM	13	23	47E236974I
5156	IDNUM	72	80	47E23697
5156	MEDICALRECORD	24	35	4712369.TMI
5156	PATIENT	37	61	CASARELLA, LATRINA MISTY
5156	STATE	105	133	Australian Capital Territory
5156	STREET	81	92	Steer Ridge
5156	ZIP	135	139	7290
5157	DATE	56	64	2/3/2066	2066-03-02
5157	DOCTOR	842	854	V Vegetabile
5157	IDNUM	32	40	89N53878
5157	MEDICALRECORD	2	13	8955387.VEF
5157	PATIENT	14	31	OSTERSTUCK, SONNY
5158	CITY	100	113	TENNANT CREEK
5158	CITY	242	255	BACCHUS MARSH
5158	CITY	100	113	TENNANT CREEK
5158	STATE	115	123	Tasmania
5158	ZIP	125	129	7008
5158	DATE	155	164	11/5/1997	1997-11-05
5158	DATE	184	194	29/01/2066	2066-01-29
5158	DEPARTMENT	215	224	Anat Path
5158	HOSPITAL	225	255	WESTERN HEALTH - BACCHUS MARSH
5158	DOCTOR	1101	1114	J. Schlachter
5158	DATE	1118	1125	29.1.66	2066-01-29
5158	DOCTOR	1243	1246	Ben
5158	DOCTOR	1275	1282	J. Mota
5158	TIME	1286	1293	29.1.66	2066-01-29
5158	DOCTOR	260	284	FLORENTINA MILAN Shockey
5158	DOCTOR	2818	2827	J Calvano
5158	DOCTOR	772	781	J. Mellom
5158	DATE	785	792	29.1.66	2066-01-29
5158	DOCTOR	950	966	J. Kahoohalphala
5158	DATE	970	977	29.1.66	2066-01-29
5158	IDNUM	13	23	37J5698495
5158	IDNUM	82	90	37J56984
5158	MEDICALRECORD	24	35	3735698.LZN
5158	PATIENT	37	71	Mainello, HORACE GERARDO MARQUITTA
5158	PATIENT	91	99	Knapsack
5158	STATE	115	123	Tasmania
5158	ZIP	125	129	7008
5159	CITY	82	87	COWRA
5159	STATE	89	97	Victoria
5159	ZIP	99	103	1020
5159	CITY	82	87	COWRA
5159	DATE	129	138	18/1/2011	2011-01-18
5159	DATE	158	168	02/03/2066	2066-03-02
5159	DEPARTMENT	189	194	Palms
5159	HOSPITAL	195	211	BALMAIN HOSPITAL
5159	DOCTOR	216	236	Jacqueline Abe Pitta
5159	DOCTOR	2250	2261	T. Halburnt
5159	IDNUM	13	23	79S750656K
5159	IDNUM	68	76	79S75065
5159	MEDICALRECORD	24	35	7977506.NRK
5159	PATIENT	37	57	SALLIES, Riley CLAUD
5159	PATIENT	77	81	Poko
5159	STATE	89	97	Victoria
5159	ZIP	99	103	1020
5160	CITY	92	99	MILDURA
5160	STATE	101	104	QLD
5160	ZIP	106	110	1230
5160	CITY	92	99	MILDURA
5160	DATE	136	145	24/8/2017	2017-08-24
5160	DATE	5044	5051	29/1/66	2066-01-29
5160	DEPARTMENT	196	211	ENVOI Pathology
5160	HOSPITAL	212	228	KOJONUP HOSPITAL
5160	DOCTOR	233	251	HALLIE DON BURRISS
5160	DOCTOR	3618	3625	H Jurek
5160	DOCTOR	760	764	Vito
5160	DOCTOR	772	784	REESE PROUSE
5160	TIME	788	807	1010Hrs on 26.01.66	2066-01-26
5160	IDNUM	13	23	37O8816147
5160	IDNUM	70	78	37O88161
5160	MEDICALRECORD	24	35	3758816.CMS
5160	PATIENT	37	59	Piwowar, Jimmie Werner
5160	STATE	101	104	QLD
5160	STREET	79	91	South Oraton
5160	TIME	165	175	26/01/2066	2066-01-26
5160	ZIP	106	110	1230
5162	DATE	125	133	8.3.2066	2066-08-03
5162	DATE	2156	2164	30.12.65	2065-12-30
5162	DATE	4688	4696	8.3.2066	2066-08-03
5162	DATE	54	62	8/3/2066	2066-08-03
5162	DOCTOR	138	145	F Yeddo
5162	DOCTOR	2199	2210	F Bobrowski
5162	DOCTOR	4701	4710	F Survant
5162	DOCTOR	4738	4746	Garfield
5162	IDNUM	30	38	21P22287
5162	MEDICALRECORD	1	12	2162228.SGZ
5162	PATIENT	13	29	Ochiai, LAURALEE
5163	CITY	81	88	PENRITH
5163	STATE	90	92	NT
5163	ZIP	94	98	3321
5163	CITY	81	88	PENRITH
5163	DATE	124	134	16/10/2012	2012-10-16
5163	DATE	154	164	13/01/2065	2065-01-13
5163	DATE	7633	7642	1/11/2066	2066-11-01
5163	DEPARTMENT	185	201	DAY SURGERY UNIT
5163	DOCTOR	231	252	Toshiko Peter Bertran
5163	DOCTOR	3264	3271	P Passi
5163	IDNUM	14	24	63Y424689V
5163	IDNUM	63	71	63Y42468
5163	MEDICALRECORD	25	36	6394246.VYV
5163	ORGANIZATION	6788	6817	Citigroup ROYAL PRINCE ALFRED
5163	PATIENT	38	52	HOBEN, RAYMOND
5163	PATIENT	72	80	Wellbank
5163	STATE	2832	2834	NT
5163	STATE	314	316	NT
5163	STATE	469	471	NT
5163	STATE	6195	6197	NT
5163	STATE	6275	6277	NT
5163	STATE	6340	6342	NT
5163	STATE	6549	6551	NT
5163	STATE	6743	6745	NT
5163	STATE	90	92	NT
5163	ZIP	94	98	3321
5164	DATE	1561	1568	23.9.65	2065-09-23
5164	DATE	81	90	24/9/2065	2065-09-24
5164	DOCTOR	1598	1609	E Harradine
5164	IDNUM	48	56	11U54473
5164	IDNUM	57	65	11U54473
5164	MEDICALRECORD	1	12	1175447.KTE
5164	PATIENT	13	47	Guastella, Antonio ALFONZO Herbert
5165	CITY	94	100	LEETON
5165	STATE	102	120	Northern Territory
5165	ZIP	122	126	1212
5165	CITY	94	100	LEETON
5165	DATE	152	161	11/2/2029	2029-11-02
5165	DATE	6272	6279	18/9/65	2065-09-18
5165	DEPARTMENT	212	227	DAY SURGERYUNIT
5165	HOSPITAL	228	247	AUGATHELLA HOSPITAL
5165	DOCTOR	1027	1034	H Heade
5165	TIME	1063	1069	9.9.65	2065-09-09T65:00
5165	DOCTOR	259	273	JACQUES FEIGHT
5165	DOCTOR	744	754	H Kenebrew
5165	TIME	782	788	9.9.65	2065-09-09T16:09
5165	DOCTOR	806	815	Professor
5165	IDNUM	13	23	27M596853V
5165	IDNUM	75	83	27M59685
5165	MEDICALRECORD	24	35	2745968.OJV
5165	PATIENT	37	64	ANDROLEWICZ, MARGRETT MALIK
5165	STATE	102	120	Northern Territory
5165	STREET	84	93	Windshire
5165	TIME	181	200	09/09/2065 at 12:37	2065-09-09T12:37
5165	ZIP	122	126	1212
5166	DATE	629	636	18.9.65	2065-09-18
5166	DATE	68	77	22/9/2065	2065-09-22
5166	DOCTOR	666	671	R Edu
5166	IDNUM	35	43	69V89866
5166	IDNUM	44	52	69V89866
5166	MEDICALRECORD	2	13	6988986.RBR
5166	PATIENT	14	34	Ferrarotti, NICHELLE
5167	CITY	81	88	MAREEBA
5167	STATE	90	105	New South Wales
5167	ZIP	107	111	2876
5167	CITY	81	88	MAREEBA
5167	DATE	137	147	25/10/2019	2019-10-25
5167	DATE	4407	4416	17/9/2065	2065-09-17
5167	DEPARTMENT	198	209	UROLOGY OPD
5167	HOSPITAL	210	259	EASTERN EYRE HEALTH AND AGED CARE - COWELL CAMPUS
5167	DOCTOR	264	279	DONG Reyes Zens
5167	DOCTOR	2779	2789	Y Jacinthe
5167	IDNUM	13	23	91B658028V
5167	IDNUM	61	69	91B65802
5167	MEDICALRECORD	24	35	9106580.HVV
5167	PATIENT	37	50	VISKER, MANSI
5167	STATE	90	105	New South Wales
5167	STREET	70	80	Mc Cracken
5167	TIME	167	186	09/12/2065 at 11:50	2065-12-09T11:50
5167	ZIP	107	111	2876
5168	DATE	50	58	5/8/2065	2065-05-08
5168	DOCTOR	1216	1227	I. Bertucci
5168	IDNUM	26	34	33K95083
5168	MEDICALRECORD	1	12	3339508.KMR
5168	PATIENT	13	25	Struss, Aron
5169	CITY	84	89	DALBY
5169	STATE	91	93	NT
5169	ZIP	95	99	5233
5169	CITY	84	89	DALBY
5169	DATE	125	134	26/1/2010	2010-01-26
5169	DATE	4552	4561	14/7/2065	2065-07-14
5169	DEPARTMENT	185	202	DICKINSON 3 NORTH
5169	HOSPITAL	203	241	MUNDUBBERA MULTIPURPOSE HEALTH SERVICE
5169	DOCTOR	246	264	LYDIA ARRON Maroun
5169	DOCTOR	2920	2930	B. Kirsten
5169	IDNUM	14	24	28L3000029
5169	IDNUM	64	72	28L30000
5169	MEDICALRECORD	25	36	2843000.AHX
5169	PATIENT	38	53	Kawaiaea, EMELY
5169	STATE	4423	4425	NT
5169	STATE	4535	4537	NT
5169	STATE	546	548	NT
5169	STATE	692	694	NT
5169	STATE	764	766	NT
5169	STATE	91	93	NT
5169	STREET	73	83	Campagnoli
5169	TIME	154	173	08/07/2065 at 13:55	2065-07-08T13:55
5169	ZIP	95	99	5233
5170	DATE	101	108	20/4/65	2065-04-20
5170	DATE	1016	1023	18/4/65	2065-04-18
5170	DATE	1049	1056	20/4/65	2065-04-20
5170	DATE	1256	1263	20/4/64	2064-04-20
5170	DATE	61	70	20/4/2065	2065-04-20
5170	DOCTOR	410	419	Q. Collie
5170	IDNUM	37	45	60T50281
5170	MEDICALRECORD	1	12	6075028.CYT
5170	PATIENT	13	36	ZAVALETA, BUSTER DELMER
5171	DATE	1071	1078	26/2/65	2065-02-26
5171	DATE	52	61	26/2/2065	2065-02-26
5171	DOCTOR	159	163	Joel
5171	DOCTOR	575	582	O Sarni
5171	IDNUM	29	37	54U04307
5171	MEDICALRECORD	2	13	5480430.STZ
5171	PATIENT	14	28	HELINE, HERMAN
5173	CITY	7118	7124	PARKES
5173	DATE	109	116	16/7/65	2065-07-16
5173	DATE	138	145	27/7/65	2065-07-27
5173	DATE	6774	6781	13/7/65	2065-07-13
5173	DATE	6807	6814	16/7/65	2065-07-16
5173	DATE	69	78	27/7/2065	2065-07-27
5173	DATE	7033	7040	16/7/65	2065-07-16
5173	DATE	7662	7669	27/7/65	2065-07-27
5173	DOCTOR	3997	4005	Y. Devit
5173	IDNUM	36	44	96D24488
5173	IDNUM	45	53	96D24488
5173	MEDICALRECORD	1	12	9612448.VKW
5173	ORGANIZATION	7098	7109	Cablevision
5173	DEPARTMENT	7118	7124	PARKES
5173	PATIENT	7118	7131	PARKES 7 EAST
5173	PATIENT	13	35	HEMMIG, Maxwell Lamont
5174	CITY	211	216	CLARE
5174	CITY	85	95	WANGARATTA
5174	STATE	97	100	ACT
5174	ZIP	102	106	2653
5174	DATE	132	141	22/2/1992	1992-02-22
5174	DATE	161	171	21/05/2065	2065-05-21
5174	DATE	2637	2644	25/5/65	2065-05-25
5174	DATE	2708	2715	27.5.65	2065-05-27
5174	DEPARTMENT	192	210	Molecular Oncology
5174	HOSPITAL	211	225	CLARE HOSPITAL
5174	DOCTOR	229	252	FRANCISCO REGINIA PORTH
5174	DOCTOR	2755	2763	M Gravat
5174	IDNUM	13	23	44Z365832F
5174	IDNUM	69	77	44Z36583
5174	MEDICALRECORD	24	35	4493658.KGF
5174	PATIENT	37	58	Chkouri, KORY Wilfred
5174	STATE	97	100	ACT
5174	ZIP	102	106	2653
5175	DATE	359	366	17/2/66	2066-02-17
5175	DATE	61	70	19/2/2066	2066-02-19
5175	DOCTOR	400	407	W Sails
5175	IDNUM	37	45	86I56765
5175	MEDICALRECORD	2	13	8635676.NXB
5175	PATIENT	14	36	STUCKEL, MORGAN SIDNEY
5177	DATE	1605	1612	27/1/66	2066-01-27
5177	DATE	68	77	28/1/2066	2066-01-28
5177	DOCTOR	1188	1202	Michale Packer
5177	DOCTOR	1209	1218	U Browers
5177	DOCTOR	1226	1235	U Dhillon
5177	TIME	1239	1258	11:10am on 26/01/66	2066-01-26T11:10
5177	DOCTOR	1646	1656	U Countess
5177	IDNUM	35	43	71J90881
5177	IDNUM	44	52	71J90881
5177	MEDICALRECORD	1	12	7139088.CSH
5177	PATIENT	13	34	Chaulklin, Alvin Lang
5178	DATE	2349	2356	25/1/66	2066-01-25
5178	DATE	55	64	25/1/2066	2066-01-25
5178	DOCTOR	1357	1366	E Molenda
5178	IDNUM	31	39	13S20962
5178	MEDICALRECORD	1	12	1372096.FJD
5178	PATIENT	13	30	ELLERSON, ZENOBIA
5179	CITY	79	85	ARARAT
5179	STATE	87	90	ACT
5179	ZIP	92	96	3570
5179	CITY	79	85	ARARAT
5179	DATE	122	131	16/6/1984	1984-06-16
5179	DATE	151	161	13/02/2064	2064-02-13
5179	DEPARTMENT	182	200	PERI-OPERATIVEUNIT
5179	HOSPITAL	201	230	CONCORD REPATRIATION HOSPITAL
5179	DOCTOR	234	253	IRVIN Otis Whitelow
5179	DOCTOR	2895	2901	T Cork
5179	DOCTOR	4816	4823	T Myron
5179	HOSPITAL	4846	4872	THE ROYAL WOMEN'S HOSPITAL
5179	IDNUM	14	24	71O230771M
5179	IDNUM	63	71	71O23077
5179	MEDICALRECORD	25	36	7152307.UEM
5179	PATIENT	38	52	Nobles, Jospeh
5179	PATIENT	72	78	Fibich
5179	STATE	87	90	ACT
5179	ZIP	92	96	3570
5180	CITY	87	96	MERIMBULA
5180	STATE	98	113	New South Wales
5180	ZIP	115	119	5204
5180	CITY	87	96	MERIMBULA
5180	DATE	145	154	10/6/2028	2028-10-06
5180	DATE	174	184	15/10/2065	2065-10-15
5180	DATE	6347	6355	16/10/65	2065-10-16
5180	DEPARTMENT	205	242	CLERMONT MULTI-PURPOSE HEALTH SERVICE
5180	DOCTOR	1710	1725	WADJARRI ZINTER
5180	TIME	1727	1733	2.35pm	2065-10-02T15:35
5180	DOCTOR	246	260	LINDSEY Soland
5180	IDNUM	13	23	66P671939S
5180	IDNUM	65	73	66P67193
5180	MEDICALRECORD	24	34	665671.YKZ
5180	PATIENT	36	54	TENA, EDWIN Lucius
5180	STATE	98	113	New South Wales
5180	STREET	74	86	Bracken Hill
5180	ZIP	115	119	5204
5181	CITY	108	115	KYNETON
5181	STATE	117	120	TAS
5181	ZIP	122	126	4229
5181	CITY	108	115	KYNETON
5181	CITY	220	231	LEIGH CREEK
5181	CITY	3935	3941	LEETON
5181	DATE	161	169	6/5/2008	2008-06-05
5181	DATE	189	199	20/10/2065	2065-10-20
5181	DATE	3856	3864	23/10/65	2065-10-23
5181	DATE	4669	4676	3.11.65	2065-11-03
5181	DEPARTMENT	220	247	LEIGH CREEK HEALTH SERVICES
5181	DOCTOR	1984	1986	JN
5181	DOCTOR	251	266	Jody ROMANISZYN
5181	DOCTOR	2539	2548	A Mcallen
5181	DOCTOR	285	290	ANTON
5181	IDNUM	14	24	08Y972756O
5181	IDNUM	75	83	08Y97275
5181	IDNUM	84	92	08Y97275
5181	MEDICALRECORD	25	35	089972.SNQ
5181	ORGANIZATION	3923	3934	Xcel Energy
5181	DEPARTMENT	3971	3974	A13
5181	PATIENT	37	64	SCHATZBERG, Buster-KATHERIN
5181	STATE	117	120	TAS
5181	STREET	93	107	Kempnough Hall
5181	ZIP	122	126	4229
5182	CITY	227	232	JUNEE
5182	CITY	87	93	BURNIE
5182	STATE	95	113	Northern Territory
5182	ZIP	115	119	6954
5182	CITY	87	93	BURNIE
5182	DATE	145	153	5/7/1990	1990-07-05
5182	DATE	173	183	11/03/2065	2065-03-11
5182	DATE	3182	3189	11.3.65	2065-11-03
5182	DEPARTMENT	204	226	St Vincent's Pathology
5182	HOSPITAL	227	254	JUNEE MULTI PURPOSE SERVICE
5182	DOCTOR	258	278	GIL KRAIG Sweatfield
5182	DOCTOR	297	302	Lanny
5182	DOCTOR	3220	3229	P Sandahl
5182	IDNUM	13	23	55U993704X
5182	IDNUM	3676	3684	55U99370
5182	IDNUM	71	79	55U99370
5182	MEDICALRECORD	24	35	5579937.CMX
5182	PATIENT	37	60	Jeoffroy, DOMINGO Reyes
5182	STATE	95	113	Northern Territory
5182	STREET	80	86	Umbria
5182	ZIP	115	119	6954
5183	CITY	80	87	GEELONG
5183	STATE	89	106	Western Australia
5183	ZIP	108	112	2661
5183	DATE	138	146	1/6/2002	2002-06-01
5183	DATE	166	176	20/10/2065	2065-10-20
5183	DATE	5169	5177	23/10/65	2065-10-23
5183	DEPARTMENT	197	213	DAY SURGERY UNIT
5183	HOSPITAL	214	229	MALDON HOSPITAL
5183	DOCTOR	234	253	VIANNA Rey VANZANDT
5183	IDNUM	13	23	50V4440621
5183	IDNUM	60	68	50V44406
5183	MEDICALRECORD	24	35	5084440.RGD
5183	PATIENT	37	49	POGAR, JERRY
5183	STATE	89	106	Western Australia
5183	STREET	69	79	Gore Green
5183	ZIP	108	112	2661
5184	CITY	4229	4238	BALRANALD
5184	CITY	88	95	PENRITH
5184	STATE	97	100	QLD
5184	ZIP	102	106	7264
5184	CITY	88	95	PENRITH
5184	DATE	141	150	27/1/2000	2000-01-27
5184	DATE	170	180	26/12/2065	2065-12-26
5184	DATE	4078	4086	29/12/65	2065-12-29
5184	DATE	4216	4225	13/1/2065	2065-01-13
5184	DATE	4305	4313	82E63677	2065-01-82
5184	DEPARTMENT	201	216	WONDAI HOSPITAL
5184	DOCTOR	220	233	ARTHUR STABER
5184	DOCTOR	2218	2226	X Landro
5184	DOCTOR	266	271	TOMEK
5184	IDNUM	14	24	82E636779A
5184	IDNUM	62	70	82E63677
5184	IDNUM	71	79	82E63677
5184	IDNUM	5833	5841	82E63677
5184	MEDICALRECORD	25	35	821636.UUY
5184	DEPARTMENT	6214	6244	CULCAIRN MULTI PURPOSE SERVICE
5184	PATIENT	37	51	Gittings, LUIS
5184	STATE	97	100	QLD
5184	ZIP	102	106	7264
5185	CITY	88	93	COWRA
5185	STATE	95	98	ACT
5185	ZIP	100	104	3082
5185	CITY	88	93	COWRA
5185	DATE	130	140	26/11/2002	2002-11-26
5185	DATE	160	170	01/13/2065	2065-11-01
5185	DATE	1710	1717	2.13.65	2065-02-02
5185	DEPARTMENT	191	231	Tissue Pathology and Diagnostic Oncology
5185	HOSPITAL	232	272	THE ROYAL VICTORIAN EYE AND EAR HOSPITAL
5185	DOCTOR	1747	1756	L Zwiefel
5185	DOCTOR	276	302	EMERSON Zaniyah GRANDERSON
5185	IDNUM	13	23	40A666837I
5185	IDNUM	71	79	40A66683
5185	MEDICALRECORD	24	35	4006668.JTI
5185	ORGANIZATION	3245	3256	Xcel Energy
5185	HOSPITAL	3258	3274	MODBURY HOSPITAL
5185	PATIENT	37	60	Hellings, Kenton Billie
5185	STATE	95	98	ACT
5185	ZIP	100	104	3082
5186	CITY	77	94	CRANBOURNEWestern
5186	ZIP	106	110	5839
5186	DATE	136	144	4/2/2001	2001-02-04
5186	DATE	164	174	25/12/2065	2065-12-25
5186	DATE	2094	2102	25.12.65	2065-12-25
5186	DEPARTMENT	195	218	Molecular Oncology Unit
5186	HOSPITAL	219	252	MONASH HEALTH WOMEN'S SANDRINGHAM
5186	DOCTOR	2132	2145	J Satterfield
5186	DOCTOR	256	279	JASPER Toccara ROSCIGNO
5186	IDNUM	13	23	35B107095O
5186	IDNUM	61	69	35B10709
5186	MEDICALRECORD	24	34	350107.CZO
5186	ORGANIZATION	3303	3334	WESTERN HEALTH - BACCHUS MARSHH
5186	PATIENT	36	50	KITCHELL, Erik
5186	PATIENT	70	76	Goroka
5186	ZIP	106	110	5839
5187	CITY	88	99	BROKEN HILL
5187	STATE	101	103	SA
5187	ZIP	105	109	5432
5187	CITY	88	99	BROKEN HILL
5187	DATE	135	144	26/7/2015	2015-07-26
5187	DATE	1557	1565	25.12.65	2065-12-25
5187	DATE	164	174	24/12/2065	2065-12-24
5187	DATE	1671	1679	28/12/65	2065-12-28
5187	HOSPITAL	222	258	PINNAROO SOLDIERS' MEMORIAL HOSPITAL
5187	DOCTOR	1710	1717	T Yorck
5187	DOCTOR	262	283	Courtney Olethea Pigg
5187	IDNUM	14	24	77J309802L
5187	IDNUM	74	82	77J30980
5187	MEDICALRECORD	25	36	7733098.CFL
5187	ORGANIZATION	4456	4478	Southern IML Pathology
5187	HOSPITAL	4480	4517	GLOUCESTER SOLDIERS MEMORIAL HOSPITAL
5187	PATIENT	38	63	BRITTINGHAM, NELLY Garret
5187	PATIENT	83	87	Behr
5187	STATE	101	103	SA
5187	STATE	191	201	QUEENSLAND
5187	ZIP	105	109	5432
5188	DATE	50	59	5/10/2061	2061-10-05
5188	DOCTOR	509	913	VVVVVVVVVVVVVVVVVVVVVVVVVVVVVVVVVVVVVVVVVVVVVVVVVVVVVVVVVVVVVVVVVVVVVVVVVVVVVVVVVVVVVVVVVVVVVVVVVVVVVVVVVVVVVVVVVVVVVVVVVVVVVVVVVVVVVVVVVVVVVVVVVVVVVVVVVVVVVVVVVVVVVVVVVVVVVVVVVVVVVVVVVVVVVVVVVVVVVVVVVVVVVVVVVVVVVVVVVVVVVVVVVVVVVVVVVVVVVVVVVVVVVVVVVVVVVVVVVVVVVVVVVVVVVVVVVVVVVVVVVVVVVVVVVVVVVVVVVVVVVVVVVVVVVVVVVVVVVVVVVVVVVVVVVVVVVVVVVVV VVVVV VVVV VVVV VVVVV VVVVVV VVVV VVVVVVVVVVVVVVVVVVVVVVVVVVVVVV
5188	DOCTOR	555	564	H Stayter
5188	IDNUM	26	34	35G32996
5188	MEDICALRECORD	1	12	3523299.RAT
5188	PATIENT	13	25	VAGAS, TOMAS
5189	CITY	3568	3574	LOXTON
5189	CITY	81	87	CAIRNS
5189	STATE	89	92	TAS
5189	ZIP	94	98	3687
5189	CITY	81	87	CAIRNS
5189	DATE	124	133	20/3/1989	1989-03-20
5189	DATE	153	161	2/2/2066	2066-02-02
5189	DATE	304	313	3.10.2066	2066-10-03
5189	DATE	5686	5695	3.10.2066	2066-10-03
5189	DATE	6812	6822	03/10/2066	2066-10-03
5189	DATE	6894	6904	03/10/2066	2066-10-03
5189	DEPARTMENT	178	183	PaLMS
5189	HOSPITAL	184	203	GOOMALLING HOSPITAL
5189	DOCTOR	207	233	Bess MURIELE Tony-AGUINAGA
5189	DOCTOR	275	280	ROYCE
5189	DOCTOR	2887	2896	S Abramov
5189	DOCTOR	6276	6286	S Boylston
5189	DOCTOR	6759	6787	Taylor GERARDO VONGKHAMPHANH
5189	DOCTOR	6848	6869	LOYCE CRISTOBAL OCAMB
5189	DOCTOR	873	885	Ngarrindjeri
5189	DOCTOR	892	902	S Ernstrom
5189	TIME	906	924	8:19pm on 02/02/66	2066-02-02T08:19
5189	HOSPITAL	5827	5855	ALPINE HEALTH (MOUNT BEAUTY)
5189	HOSPITAL	6091	6116	BEECHWORTH HEALTH SERVICE
5189	IDNUM	13	23	67O621676Q
5189	IDNUM	5885	5898	67O62167 B.14
5189	IDNUM	67	75	67O62167
5189	MEDICALRECORD	24	34	675621.STS
5189	ORGANIZATION	3553	3566	General Mills
5189	HOSPITAL	3568	3583	LOXTON HOSPITAL
5189	ORGANIZATION	4446	4477	United Technologies Corporation
5189	HOSPITAL	4479	4497	KATANNING HOSPITAL
5189	PATIENT	36	56	GUIDROZ, JIMMY Jonas
5189	PATIENT	76	80	Kuck
5189	STATE	89	92	TAS
5189	ZIP	94	98	3687
5190	DATE	338	345	3/10/65	2065-10-03
5190	DATE	59	69	21/10/2065	2065-10-21
5190	DOCTOR	1210	1217	G Newey
5190	DATE	1219	1229	21.10.2065	2065-10-21
5190	DOCTOR	137	143	G Riff
5190	DATE	145	155	21.10.2065	2065-10-21
5190	DOCTOR	378	385	G Egner
5190	IDNUM	35	43	25K64273
5190	MEDICALRECORD	1	12	2546427.INY
5190	PATIENT	13	34	Leduc, Denver EDGARDO
5191	CITY	81	90	BATEHAVEN
5191	STATE	92	94	WA
5191	ZIP	96	100	7005
5191	CITY	81	90	BATEHAVEN
5191	DATE	126	134	1/4/1992	1992-01-04
5191	DATE	2437	2444	3/10/65	2065-10-03
5191	DATE	2585	2592	6/10/65	2065-10-06
5191	DEPARTMENT	185	190	PaLMS
5191	HOSPITAL	191	227	FLINDERS ISLAND MULTI PURPOSE CENTRE
5191	DOCTOR	231	253	JARROD TIMOTHY Wheelen
5191	DOCTOR	2627	2637	E Dillehay
5191	DOCTOR	414	428	Denver Dorosan
5191	DOCTOR	4497	4511	E Gillenwaters
5191	IDNUM	13	23	10L093993E
5191	IDNUM	63	71	10L09399
5191	MEDICALRECORD	24	34	104093.ZYH
5191	PATIENT	36	52	BUCHELI, Sharita
5191	STATE	92	94	WA
5191	TIME	154	173	03/10/2065 at 09:38	2065-10-03T09:38
5191	ZIP	96	100	7005
5192	DATE	640	648	14.12.65	2065-12-14
5192	DATE	67	77	16/12/2065	2065-12-16
5192	DOCTOR	678	688	O Plotzker
5192	IDNUM	43	51	51U39470
5192	MEDICALRECORD	2	13	5173947.BZB
5192	PATIENT	14	42	CLAUCHERTY, Cristopher'Donte
5193	CITY	3352	3361	REDCLIFFE
5193	CITY	91	98	NAMBOUR
5193	STATE	100	115	South Australia
5193	ZIP	117	121	6410
5193	CITY	91	98	NAMBOUR
5193	DATE	1369	1376	12.9.65	2065-12-09
5193	DATE	147	156	16/4/1996	1996-04-16
5193	DATE	176	186	12/09/2065	2065-12-09
5193	DATE	2274	2281	12.9.65	2065-12-09
5193	DATE	316	323	26.9.65	2065-09-26
5193	DATE	4301	4308	26.9.65	2065-09-26
5193	DEPARTMENT	207	212	PaLMS
5193	HOSPITAL	213	232	DONNYBROOK HOSPITAL
5193	DOCTOR	2312	2323	M Bensinger
5193	DOCTOR	236	256	TOMEK GINGER DOLENCE
5193	DOCTOR	4558	4568	M Toleston
5193	HOSPITAL	3352	3370	REDCLIFFE HOSPITAL
5193	HOSPITAL	4334	4350	EUDUNDA HOSPITAL
5193	IDNUM	13	23	19Q315867J
5193	IDNUM	61	69	19Q31586
5193	MEDICALRECORD	24	35	1963158.QUJ
5193	PATIENT	37	50	BADGET, Caleb
5193	STATE	100	115	South Australia
5193	STREET	70	90	El Dorado Beach Club
5193	ZIP	117	121	6410
5194	DATE	51	61	17/12/2065	2065-12-17
5194	DATE	519	527	16.12.65	2065-12-16
5194	DOCTOR	559	567	A Suitor
5194	IDNUM	27	35	04R85602
5194	MEDICALRECORD	1	12	0468560.GPP
5194	PATIENT	13	26	GUNST, Felton
5195	CITY	87	101	YALLOURN NORTH
5195	STATE	103	118	New South Wales
5195	ZIP	120	124	6433
5195	CITY	87	101	YALLOURN NORTH
5195	DATE	156	165	3/10/2014	2014-03-10
5195	DATE	185	195	02/09/2065	2065-09-02
5195	DATE	3218	3227	26.9.2065	2065-09-26
5195	DATE	351	360	26.9.2065	2065-09-26
5195	DEPARTMENT	216	221	PaLMS
5195	HOSPITAL	224	240	KOJONUP HOSPITAL
5195	DOCTOR	1978	1987	K Killary
5195	DOCTOR	244	262	Jamal VON LAMBIASE
5195	DOCTOR	3232	3244	K Hackathorn
5195	DOCTOR	365	373	K Maisch
5195	IDNUM	14	24	46A057832M
5195	IDNUM	60	68	46A05783
5195	IDNUM	69	77	46A05783
5195	MEDICALRECORD	25	36	4600578.IGM
5195	PATIENT	38	49	WOGE, Kulin
5195	STATE	103	118	New South Wales
5195	STREET	78	86	E Jersey
5195	ZIP	120	124	6433
5196	CITY	79	89	FRESHWATER
5196	STATE	91	106	New South Wales
5196	ZIP	108	112	3483
5196	CITY	79	89	FRESHWATER
5196	DATE	138	146	6/5/2021	2021-06-05
5196	DATE	2563	2570	22.7.65	2065-07-22
5196	DEPARTMENT	197	237	Tissue Pathology and Diagnostic Oncology
5196	HOSPITAL	238	271	MONASH HEALTH WOMEN'S SANDRINGHAM
5196	DOCTOR	2602	2613	Z Villandry
5196	DOCTOR	275	298	DUSTY Ysabella KRASNICI
5196	IDNUM	13	23	94W078890U
5196	IDNUM	60	68	94W07889
5196	MEDICALRECORD	24	34	948078.XYB
5196	ORGANIZATION	4790	4803	Liberty Media
5196	HOSPITAL	4805	4819	BULLI HOSPITAL
5196	PATIENT	36	49	Lavatch, RONA
5196	STATE	91	106	New South Wales
5196	STREET	69	78	Falklands
5196	TIME	166	185	21/07/2065 at 10:05	2065-07-21T10:05
5196	ZIP	108	112	3483
5197	CITY	95	101	LEETON
5197	STATE	103	131	Australian Capital Territory
5197	ZIP	133	137	2351
5197	CITY	95	101	LEETON
5197	DATE	163	172	19/5/2012	2012-05-19
5197	DATE	192	202	20/01/2066	2066-01-20
5197	DATE	3214	3221	26/1/66	2066-01-26
5197	DEPARTMENT	223	227	HAPS
5197	DOCTOR	1811	1821	W Goudreau
5197	DOCTOR	232	251	GALA MALIK Flaugher
5197	IDNUM	13	23	89X529158A
5197	IDNUM	73	81	89X52915
5197	MEDICALRECORD	24	35	8995291.NWA
5197	PATIENT	37	62	HAZELBUSH, Teressa Samual
5197	STATE	103	131	Australian Capital Territory
5197	STREET	82	94	Barrow Green
5197	ZIP	133	137	2351
5198	CITY	73	79	PARKES
5198	STATE	81	83	SA
5198	ZIP	85	89	6516
5198	CITY	73	79	PARKES
5198	DATE	115	125	25/11/2036	2036-11-25
5198	DATE	145	155	08/05/2065	2065-05-08
5198	DATE	2849	2856	12/5/65	2065-12-05
5198	DEPARTMENT	176	185	Anat Path
5198	HOSPITAL	186	205	DONNYBROOK HOSPITAL
5198	DOCTOR	210	235	DIONE Maximo Vanamerongen
5198	DOCTOR	2216	2226	G Gannaway
5198	IDNUM	14	24	21G721865X
5198	IDNUM	60	68	21G72186
5198	MEDICALRECORD	25	36	2127218.QNX
5198	PATIENT	38	49	DORCHY, Sal
5198	PATIENT	69	72	Eba
5198	STATE	81	83	SA
5198	ZIP	85	89	6516
5199	DATE	1283	1290	21/8/65	2065-08-21
5199	DATE	51	60	21/8/2065	2065-08-21
5199	DOCTOR	584	593	A. Janusz
5199	TIME	597	604	18.8.65	2065-08-18T18:08
5199	DOCTOR	674	682	A. Nunno
5199	IDNUM	27	35	00T44287
5199	MEDICALRECORD	1	12	0074428.TER
5199	PATIENT	13	26	HYATTE, HYMAN
5200	DATE	1110	1117	21.4.65	2065-04-21
5200	DATE	1177	1184	25.4.65	2065-04-25
5200	DATE	70	79	27/4/2065	2065-04-27
5200	DOCTOR	1214	1226	Y Brucculeri
5200	DOCTOR	2098	2106	Y Peyton
5200	IDNUM	37	45	95U88303
5200	IDNUM	46	54	95U88303
5200	MEDICALRECORD	1	12	9588830.JZX
5200	PATIENT	13	36	Reinhart, WILL Terrance
5202	DATE	63	71	1/6/2066	2066-06-01
5202	DOCTOR	667	669	ZG
5202	DOCTOR	693	701	R Kurylo
5202	IDNUM	39	47	63I41405
5202	MEDICALRECORD	1	11	633414.ANQ
5202	PATIENT	12	38	Maupin, BIRRUNGA Alexander
5203	DATE	1699	1706	20/1/66	2066-01-20
5203	DATE	63	72	20/1/2066	2066-01-20
5203	DOCTOR	1066	1072	Q Cima
5203	IDNUM	40	48	63N73781
5203	MEDICALRECORD	2	13	6357378.ECV
5203	PATIENT	14	39	Gubin, STEFAN Barney Odis
5204	CITY	78	85	KYNETON
5204	STATE	87	90	VIC
5204	ZIP	92	96	3847
5204	CITY	78	85	KYNETON
5204	DATE	122	131	6/12/1995	1995-06-12
5204	DATE	151	161	17/08/2062	2062-08-17
5204	DEPARTMENT	182	199	ACUTE STROKE UNIT
5204	HOSPITAL	200	223	MAITLAND HOSPITAL (NSW)
5204	DOCTOR	1659	1661	EE
5204	DATE	1665	1672	17/8/62	2062-08-17
5204	DOCTOR	1702	1710	N Majano
5204	DOCTOR	227	246	Oliver Zahra Franey
5204	IDNUM	13	23	58O278079C
5204	IDNUM	62	70	58O27807
5204	MEDICALRECORD	24	35	5852780.UXC
5204	PATIENT	37	51	Naputi, BLAINE
5204	PATIENT	71	77	Fuyatt
5204	STATE	87	90	VIC
5204	ZIP	92	96	3847
5207	DATE	123	130	21/3/66	2066-03-21
5207	DATE	1738	1747	17 2.2066	2066-02-17
5207	DATE	2954	2961	21/3/66	2066-03-21
5207	DATE	66	75	21/3/2066	2066-03-21
5207	DOCTOR	1780	1786	Y Daum
5207	IDNUM	43	51	90X47988
5207	MEDICALRECORD	1	11	908479.WXO
5207	PATIENT	12	42	HJORT, JANENE Hershel Williams
5210	CITY	80	95	NORTH WONTHAGGI
5210	STATE	97	105	Victoria
5210	ZIP	107	111	2680
5210	CITY	80	95	NORTH WONTHAGGI
5210	DATE	137	146	26/1/2001	2001-01-26
5210	DATE	5287	5294	23/7/65	2065-07-23
5210	DEPARTMENT	197	220	Molecular Oncology Unit
5210	DOCTOR	1066	1074	V. Dudek
5210	TIME	1078	1097	1035Hrs on 20.07.65	2065-07-20T10:35
5210	DOCTOR	247	271	ILUMINADA BEN WEHRENBERG
5210	DOCTOR	3083	3096	V. Hillsgrove
5210	DOCTOR	789	791	V.
5210	DOCTOR	789	800	V. Perretta
5210	DATE	804	811	20.7.65	2065-07-20
5210	IDNUM	13	23	85Y810053E
5210	IDNUM	61	69	85Y81005
5210	MEDICALRECORD	24	35	8598100.NJE
5210	PATIENT	37	50	LANPHER, Ness
5210	STATE	97	105	Victoria
5210	STREET	70	79	Shayfield
5210	TIME	166	185	20/07/2065 at 10:25	2065-07-20T10:25
5210	ZIP	107	111	2680
5211	CITY	267	274	DAMPIER
5211	CITY	84	92	GUNDAGAI
5211	STATE	94	109	New South Wales
5211	CITY	84	92	GUNDAGAI
5211	DATE	141	151	14/11/1988	1988-11-14
5211	DATE	171	181	11/12/2065	2065-12-11
5211	DATE	2964	2972	11.12.65	2065-12-11
5211	DEPARTMENT	198	220	POSTOPERATIVE RECOVERY
5211	HOSPITAL	221	249	ROYAL PRINCE ALFRED HOSPITAL
5211	DOCTOR	253	274	Toby Stanford DAMPIER
5211	DOCTOR	3004	3011	K Hills
5211	DOCTOR	3027	3039	K Schmeeckle
5211	DOCTOR	347	354	Ignacio
5211	IDNUM	13	23	33U941101N
5211	IDNUM	67	75	33U94110
5211	MEDICALRECORD	24	35	3379411.CEN
5211	PATIENT	37	56	PLUTA, YSABEL REESE
5211	PATIENT	76	83	Taubman
5211	STATE	94	109	New South Wales
5211	STREET	3462	3479	Sphincter of Oddi
5211	ZIP	111	115	3235
5212	DATE	1672	1679	13/1/65	2065-01-13
5212	DATE	58	67	13/2/2065	2065-02-13
5212	IDNUM	34	42	75D14291
5212	MEDICALRECORD	2	12	751142.YEW
5212	PATIENT	13	33	Surguy, Ramiro KEVEN
5213	CITY	88	97	IRON KNOB
5213	STATE	99	102	ACT
5213	ZIP	104	108	4111
5213	CITY	88	97	IRON KNOB
5213	DATE	143	152	13/3/2003	2003-03-13
5213	DATE	172	180	2/3/2066	2066-03-02
5213	DATE	299	308	2.10.2066	2066-10-02
5213	DEPARTMENT	197	200	ACT
5213	HOSPITAL	203	220	ANGASTON HOSPITAL
5213	DOCTOR	224	241	WM ANTOINE Obryon
5213	DOCTOR	2413	2423	S Saltness
5213	DOCTOR	3494	3502	S Baucum
5213	DOCTOR	487	499	S Landvatter
5213	IDNUM	13	23	60D683176P
5213	IDNUM	65	73	60D68317
5213	IDNUM	74	82	60D68317
5213	MEDICALRECORD	24	35	6016831.UQP
5213	PATIENT	37	54	DIKKERS, WILFREDO
5213	PATIENT	83	87	Mika
5213	STATE	197	200	ACT
5213	STATE	99	102	ACT
5213	ZIP	104	108	4111
5214	CITY	89	96	BENDIGO
5214	STATE	98	101	VIC
5214	ZIP	103	107	3682
5214	CITY	89	96	BENDIGO
5214	DATE	142	151	12/3/2007	2007-12-03
5214	DATE	171	181	07/01/2066	2066-01-07
5214	DATE	2921	2930	12/1/2066	2066-12-01
5214	DEPARTMENT	202	233	WERRIS CREEK COMMUNITY HOSPITAL
5214	DOCTOR	1859	1869	L Dinunzio
5214	DOCTOR	237	253	Titus Radakovich
5214	DOCTOR	272	276	Kory
5214	IDNUM	13	23	48R205192J
5214	IDNUM	64	72	48R20519
5214	IDNUM	73	81	48R20519
5214	MEDICALRECORD	24	34	486205.CYH
5214	ORGANIZATION	2988	3005	Fluor Corporation
5214	DEPARTMENT	3042	3055	COWELL CAMPUS
5214	PATIENT	36	53	Malaspina, VAUGHN
5214	PATIENT	82	88	Toller
5214	STATE	98	101	VIC
5214	ZIP	103	107	3682
5215	CITY	104	115	CHARLEVILLE
5215	STATE	117	120	QLD
5215	ZIP	122	126	4014
5215	DATE	161	170	21/8/1982	1982-08-21
5215	DATE	187	197	10/06/2065	2065-06-10
5215	DATE	3135	3142	9/10/65	2065-10-09
5215	DATE	3982	3990	14/10/65	2065-10-14
5215	DEPARTMENT	218	255	GLOUCESTER SOLDIERS MEMORIAL HOSPITAL
5215	DOCTOR	2074	2085	F Prudhomme
5215	DOCTOR	259	274	CRUZ Wrzesinski
5215	DOCTOR	292	297	WALDO
5215	IDNUM	14	24	80A406809F
5215	IDNUM	73	81	80A40680
5215	IDNUM	82	90	80A40680
5215	MEDICALRECORD	25	35	800406.XAZ
5215	ORGANIZATION	3200	3217	Dell ST MARGARETS
5215	DEPARTMENT	3233	3243	CENTRE Lab
5215	PATIENT	37	62	SCHAFFERT, TOMEK RAYMUNDO
5215	STATE	117	120	QLD
5215	STREET	91	103	Cringle Hall
5215	ZIP	122	126	4014
5216	CITY	88	94	WILTON
5216	STATE	96	113	Western Australia
5216	ZIP	115	119	6392
5216	CITY	88	94	WILTON
5216	DATE	154	162	1/8/2001	2001-08-01
5216	DATE	182	192	21/01/2066	2066-01-21
5216	DATE	7135	7142	27/1/66	2066-01-27
5216	DEPARTMENT	213	237	WILCANNIA HEALTH SERVICE
5216	DOCTOR	241	251	Ira Sulley
5216	DOCTOR	270	274	GALE
5216	DOCTOR	3451	3463	P Tunnicliff
5216	IDNUM	13	23	75B957167L
5216	IDNUM	61	69	75B95716
5216	IDNUM	70	78	75B95716
5216	MEDICALRECORD	24	34	750957.CQT
5216	ORGANIZATION	7232	7238	Baxter
5216	DEPARTMENT	7253	7265	SEALSCentral
5216	PATIENT	36	50	Yanik, Katrina
5216	STATE	96	113	Western Australia
5216	STREET	79	87	Longdown
5216	ZIP	115	119	6392
5217	CITY	102	111	RIVERVIEW
5217	STATE	113	115	NT
5217	ZIP	117	121	3236
5217	CITY	102	111	RIVERVIEW
5217	DATE	156	166	18/12/1995	1995-12-18
5217	DATE	186	196	07/01/2066	2066-01-07
5217	DATE	4356	4363	12/1/66	2066-12-01
5217	DATE	5161	5170	22/1/2066	2066-01-22
5217	DEPARTMENT	217	241	COHUNA DISTRICT HOSPITAL
5217	DOCTOR	245	258	Marco DINNEEN
5217	DOCTOR	277	282	CHUCK
5217	DOCTOR	301	308	RAPHAEL
5217	DOCTOR	3169	3177	D Tipple
5217	IDNUM	13	23	17J149874I
5217	IDNUM	71	79	17J14987
5217	IDNUM	80	88	17J14987
5217	MEDICALRECORD	24	34	173149.XTL
5217	PATIENT	36	60	Rigerman, ASHTON Alfonso
5217	STATE	113	115	NT
5217	STATE	2982	2984	NT
5217	STATE	340	342	NT
5217	STATE	4323	4325	NT
5217	STREET	89	101	Clara Barton
5217	ZIP	117	121	3236
5218	DATE	1109	1116	23.3.66	2066-03-23
5218	DATE	65	74	24/3/2066	2066-03-24
5218	DOCTOR	1146	1154	B Baxter
5218	IDNUM	32	40	02K69913
5218	IDNUM	41	49	02K69913
5218	MEDICALRECORD	2	13	0246991.JFO
5218	PATIENT	14	31	Corkery, JOE Cleo
5219	CITY	97	103	ARARAT
5219	STATE	105	108	ACT
5219	ZIP	110	114	6422
5219	CITY	97	103	ARARAT
5219	DATE	149	157	7/5/1997	1997-07-05
5219	DATE	177	186	21/3/2066	2066-03-21
5219	DEPARTMENT	203	212	StVincent
5219	DOCTOR	248	264	Sergio Harlan DY
5219	DOCTOR	3398	3410	L Procaccini
5219	DOCTOR	4451	4460	L Linberg
5219	DOCTOR	972	993	Anaesthetic Registrar
5219	DOCTOR	1000	1008	L Becena
5219	TIME	1012	1030	1635pm on 21.03.66	66-03-21
5219	IDNUM	13	23	44T891948K
5219	IDNUM	67	75	44T89194
5219	IDNUM	76	84	44T89194
5219	MEDICALRECORD	24	35	4478919.LXK
5219	PATIENT	37	56	SCHIEBER, Mary Dell
5219	PATIENT	85	96	Hithercroft
5219	STATE	105	108	ACT
5219	ZIP	110	114	6422
5220	DATE	323	330	20.3.66	2066-03-20
5220	DATE	52	61	21/3/2066	2066-03-21
5220	DOCTOR	360	369	Z Ofallon
5220	IDNUM	28	36	92P81290
5220	MEDICALRECORD	2	12	926812.YAS
5220	PATIENT	13	27	RANSOM, RESSIE
5221	DATE	1281	1290	17/3/2066	2066-03-17
5221	DATE	58	67	17/3/2066	2066-03-17
5221	DOCTOR	810	821	X. Fragnoli
5221	IDNUM	34	42	97Q35216
5221	MEDICALRECORD	1	12	9763521.QNZ
5221	PATIENT	13	33	STIFTER, RUBEN Ollie
5222	CITY	93	103	FRESHWATER
5222	ZIP	107	111	2192
5222	CITY	93	103	FRESHWATER
5222	DATE	146	155	25/8/1991	1991-08-25
5222	DATE	4903	4910	25/2/65	2065-02-25
5222	DEPARTMENT	206	221	DYSART HOSPITAL
5222	DOCTOR	1790	1797	H Dubas
5222	DOCTOR	225	237	Emil GALBISO
5222	DOCTOR	611	619	H Burdex
5222	DATE	623	630	20.2.65	2065-02-20
5222	IDNUM	13	23	29Z5549718
5222	IDNUM	4183	4191	29Z55497
5222	IDNUM	4222	4230	29Z55497
5222	IDNUM	61	69	29Z55497
5222	IDNUM	70	78	29Z55497
5222	MEDICALRECORD	24	34	299554.ZTE
5222	PATIENT	36	50	Eichstedt, Gay
5222	STREET	79	92	Broadway Wood
5222	TIME	175	185	20/02/2065	2065-02-20T11:54
5222	ZIP	107	111	2192
5223	CITY	86	92	GAWLER
5223	STATE	94	112	Northern Territory
5223	ZIP	114	118	5047
5223	CITY	86	92	GAWLER
5223	DATE	144	154	20/12/1993	1993-12-20
5223	DATE	174	184	21/01/2066	2066-01-21
5223	DATE	7036	7043	27/1/66	2066-01-27
5223	DEPARTMENT	205	243	CLONCURRY MULTI-PURPOSE HEALTH SERVICE
5223	DOCTOR	247	263	FERNANDO Gischer
5223	DOCTOR	282	289	Piggott
5223	DOCTOR	3950	3960	B. Seebold
5223	IDNUM	14	24	07N286988P
5223	IDNUM	69	77	07N28698
5223	MEDICALRECORD	25	35	075286.XWV
5223	PATIENT	37	58	ARDUINI, DAISY DARRIN
5223	STATE	94	112	Northern Territory
5223	ZIP	114	118	5047
5225	CITY	94	102	WAIKERIE
5225	STATE	104	121	Western Australia
5225	ZIP	123	127	3151
5225	CITY	94	102	WAIKERIE
5225	DATE	162	172	19/10/2016	2016-10-19
5225	DATE	192	201	24/2/2066	2066-02-24
5225	DATE	3833	3840	25.2.66	2066-02-25
5225	DEPARTMENT	218	235	ST GEORGE PRIVATE
5225	HOSPITAL	237	279	CAMPBELL TOWN HEALTH AND COMMUNITY SERVICE
5225	DOCTOR	283	301	MURRAY Neil COWPER
5225	DOCTOR	3869	3878	Y Brannum
5225	DOCTOR	5115	5120	Y Kin
5225	DATE	5122	5128	3.7.66	2066-07-03
5225	DOCTOR	851	856	Shaun
5225	DOCTOR	863	870	Y Hoitt
5225	TIME	874	889	3pm on 24.02.66	2066-02-24T15:00
5225	IDNUM	13	23	65J207946Y
5225	IDNUM	66	74	65J20794
5225	IDNUM	75	83	65J20794
5225	MEDICALRECORD	24	35	6532079.LQY
5225	PATIENT	37	55	Goga, SAMMY Jarrah
5225	PATIENT	84	93	S Pickens
5225	STATE	104	121	Western Australia
5225	ZIP	123	127	3151
5226	DATE	57	65	5/8/2064	2064-05-08
5226	DOCTOR	567	575	N Zoutte
5226	IDNUM	33	41	50K64720
5226	MEDICALRECORD	1	11	503647.FBL
5226	PATIENT	12	32	SIRMONS, OLETA Sammy
5227	DATE	2269	2276	17.2.66	2066-02-17
5227	DATE	61	70	19/2/2066	2066-02-19
5227	DOCTOR	2306	2313	X Modic
5227	IDNUM	28	36	92S94991
5227	IDNUM	37	45	92S94991
5227	MEDICALRECORD	2	13	9279499.ECA
5227	PATIENT	14	27	CARRETTA, Ria
5228	CITY	98	104	KERANG
5228	STATE	106	124	Northern Territory
5228	ZIP	126	130	3070
5228	DATE	165	174	27/3/1993	1993-03-27
5228	DATE	194	203	18/2/2066	2066-02-18
5228	DATE	2892	2899	18.2.66	2066-02-18
5228	DEPARTMENT	220	242	POSTOPERATIVE RECOVERY
5228	HOSPITAL	245	267	PINGELLY HEALTH CENTRE
5228	DOCTOR	271	290	FIDEL Thurman SABAT
5228	DOCTOR	2929	2939	L Larrivee
5228	DOCTOR	3956	3965	L Windley
5228	IDNUM	13	23	40P960079J
5228	IDNUM	71	79	40P96007
5228	IDNUM	80	88	40P96007
5228	MEDICALRECORD	24	35	4059600.TXJ
5228	PATIENT	37	60	Caltabiano, Gilma EMELY
5228	PATIENT	89	97	Borsdane
5228	STATE	106	124	Northern Territory
5228	ZIP	126	130	3070
5229	CITY	79	87	EVANDALE
5229	STATE	89	104	South Australia
5229	ZIP	106	110	3153
5229	DATE	136	145	10/3/2036	2036-10-03
5229	DATE	1515	1522	18/2/66	2066-02-18
5229	DATE	165	174	17/2/2066	2066-02-17
5229	DEPARTMENT	191	209	105 HAMRUN CIRCUIT
5229	HOSPITAL	212	261	KAROONDA AND DISTRICT SOLDIERS' MEMORIAL HOSPITAL
5229	DOCTOR	1557	1567	W Sagayaga
5229	DOCTOR	265	290	Augustine Frederick MITCH
5229	DOCTOR	3309	3323	KRAIG W'Munyon
5229	IDNUM	13	23	82X162885F
5229	IDNUM	64	72	82X16288
5229	MEDICALRECORD	24	35	8291628.VPF
5229	PATIENT	37	53	LEVIER, LEN Otis
5229	STATE	89	104	South Australia
5229	STREET	73	78	Saran
5229	ZIP	106	110	3153
5230	CITY	222	227	CLARE
5230	CITY	97	107	NARACOORTE
5230	STATE	109	124	New South Wales
5230	ZIP	126	130	2344
5230	CITY	97	107	NARACOORTE
5230	DATE	162	171	25/8/2005	2005-08-25
5230	DATE	191	199	3/6/2066	2066-06-03
5230	DEPARTMENT	216	219	ACT
5230	HOSPITAL	222	236	CLARE HOSPITAL
5230	DOCTOR	240	262	EVERETT DARIO SWEADNER
5230	DOCTOR	5016	5028	T Dellarocco
5230	DOCTOR	867	880	Johnny Hudlin
5230	DOCTOR	887	896	T Falwell
5230	TIME	908	927	10.04am on 03.06.66	2066-06-03
5230	IDNUM	13	23	77Y612043L
5230	IDNUM	71	79	77Y61204
5230	IDNUM	80	88	77Y61204
5230	MEDICALRECORD	24	36	77961204.KLP
5230	PATIENT	38	60	SIPPIAL, BRENDAN Macey
5230	PATIENT	89	96	Larstan
5230	STATE	109	124	New South Wales
5230	STATE	216	219	ACT
5230	ZIP	126	130	2344
5231	CITY	90	100	WOLLONGONG
5231	STATE	102	117	New South Wales
5231	ZIP	119	123	2900
5231	CITY	90	100	WOLLONGONG
5231	DATE	149	158	29/9/2013	2013-09-29
5231	DATE	178	188	13/03/2066	2066-03-13
5231	DEPARTMENT	209	214	SEALS
5231	HOSPITAL	217	230	RYDE HOSPITAL
5231	DOCTOR	1542	1553	N Hornbaker
5231	TIME	1557	1574	16:55 on 13/03/66	2066-03-13
5231	DOCTOR	234	252	ELLIS DINO Dacanay
5231	DOCTOR	4220	4227	N Fross
5231	DOCTOR	5855	5864	N Ostwald
5231	IDNUM	13	23	56M234950F
5231	IDNUM	71	79	56M23495
5231	MEDICALRECORD	24	36	56423495.AFB
5231	PATIENT	38	60	LUDGATE, Israel DARRYL
5231	STATE	102	117	New South Wales
5231	STREET	80	89	Bon Haven
5231	ZIP	119	123	2900
5232	CITY	92	99	MANILLA
5232	STATE	101	109	Tasmania
5232	ZIP	111	115	6156
5232	DATE	150	159	28/4/1982	1982-04-28
5232	DATE	179	188	18/2/2066	2066-02-18
5232	DATE	2147	2154	19/2/66	2066-02-19
5232	DEPARTMENT	205	210	SWAPS
5232	HOSPITAL	213	226	RYDE HOSPITAL
5232	DOCTOR	2189	2197	L Masten
5232	DOCTOR	230	250	Kulin Buster Manheim
5232	DOCTOR	710	722	Krysta FALHA
5232	DOCTOR	750	761	L Tadgerson
5232	TIME	765	784	18/02/2066 at 12:35	2066-02-18T12:35
5232	IDNUM	14	24	40N774218L
5232	IDNUM	60	68	40N77421
5232	IDNUM	69	77	40N77421
5232	MEDICALRECORD	25	36	4057742.EVL
5232	PATIENT	38	49	LAVZON, NED
5232	STATE	101	109	Tasmania
5232	STREET	78	91	Milton I Ross
5232	ZIP	111	115	6156
5233	CITY	215	221	PARKES
5233	CITY	91	99	BLAXLAND
5233	STATE	101	129	Australian Capital Territory
5233	ZIP	131	135	4129
5233	DATE	161	170	2/12/1995	1995-02-12
5233	DATE	190	198	3/8/2066	2066-08-03
5233	DEPARTMENT	215	228	PARKES 7 EAST
5233	HOSPITAL	229	244	MALENY HOSPITAL
5233	DOCTOR	248	270	ISRAEL Eugenio Brunett
5233	DOCTOR	3653	3658	V Zak
5233	DOCTOR	687	699	Marquis Lozo
5233	DOCTOR	737	745	V Reesor
5233	TIME	749	767	5:20pm on 03/08/66	2066-08-03T05:20
5233	IDNUM	13	23	82W9760253
5233	IDNUM	68	76	82W97602
5233	MEDICALRECORD	24	35	8289760.HNH
5233	PATIENT	37	57	KNEE, JOHNNIE Samual
5233	STATE	101	129	Australian Capital Territory
5233	STREET	77	90	Marble Canyon
5233	ZIP	131	135	4129
5234	CITY	101	111	NARRANDERA
5234	STATE	113	123	Queensland
5234	ZIP	125	129	4115
5234	CITY	101	111	NARRANDERA
5234	DATE	164	172	8/4/2002	2002-08-04
5234	DATE	192	200	4/4/2066	2066-04-04
5234	DEPARTMENT	217	239	St Vincent's Pathology
5234	HOSPITAL	242	270	OBERON MULTI PURPOSE SERVICE
5234	DOCTOR	274	303	Marcelino JEFFEREY TEPPERBERG
5234	DOCTOR	3049	3057	S Kesley
5234	DOCTOR	5954	5962	S Streat
5234	DOCTOR	705	711	S Mans
5234	DOCTOR	718	727	S Caminos
5234	DOCTOR	731	742	S Kittinger
5234	TIME	746	764	2:55pm on 04.04.66	2066-04-04T14:55
5234	IDNUM	13	23	77X427282N
5234	IDNUM	70	78	77X42728
5234	IDNUM	79	87	77X42728
5234	MEDICALRECORD	24	34	778427.FXH
5234	PATIENT	36	59	BENDIT, CHAUNCEY LOREEN
5234	STATE	113	123	Queensland
5234	STREET	88	100	North Summit
5234	ZIP	125	129	4115
5236	CITY	91	99	EVANDALE
5236	ZIP	103	107	2059
5236	DATE	139	148	26/4/2016	2016-04-26
5236	DATE	312	319	19.4.66	2066-04-19
5236	DATE	4404	4411	23.2.66	2066-02-23
5236	DATE	7598	7605	19.4.66	2066-04-19
5236	DEPARTMENT	199	212	MACQUARIEWARD
5236	HOSPITAL	213	232	PARABURDOO HOSPITAL
5236	DOCTOR	1238	1242	Abel
5236	DOCTOR	1253	1262	T Harmann
5236	TIME	1266	1285	11:30am on 21.02.66	2066-02-21T11:30
5236	DOCTOR	2153	2159	Smokey
5236	TIME	2185	2204	12:00pm on 21.02.66	2066-02-21
5236	DOCTOR	236	254	Stephen TROY Tress
5236	DOCTOR	4443	4450	T Slife
5236	IDNUM	14	24	72B299899M
5236	IDNUM	65	73	72B29989
5236	IDNUM	74	82	72B29989
5236	MEDICALRECORD	25	35	720299.VZZ
5236	PATIENT	37	54	NEMETS, FREDERICH
5236	PATIENT	83	90	Vicente
5236	TIME	168	178	21/02/2066	2066-02-21
5236	ZIP	103	107	2059
5241	CITY	84	92	BALLARAT
5241	STATE	94	97	TAS
5241	ZIP	99	103	3131
5241	CITY	84	92	BALLARAT
5241	DATE	129	137	6/3/2006	2006-03-06
5241	DATE	157	167	20/04/2066	2066-04-20
5241	DATE	2575	2582	21/4/66	2066-04-21
5241	DEPARTMENT	188	201	EAST SURGICAL
5241	HOSPITAL	202	220	PEMBERTON HOSPITAL
5241	DOCTOR	224	245	CARY Louvenia Charsky
5241	DOCTOR	2613	2621	R Collar
5241	DOCTOR	5479	5488	R Vaughen
5241	IDNUM	13	23	67B649057S
5241	IDNUM	63	71	67B64905
5241	MEDICALRECORD	24	35	6706490.PUS
5241	ORGANIZATION	4381	4395	Barnes & Noble
5241	HOSPITAL	4397	4416	SPRINGSURE HOSPITAL
5241	PATIENT	37	52	Lobaton, Foster
5241	STATE	94	97	TAS
5241	STREET	72	83	South Reeve
5241	ZIP	99	103	3131
5242	DATE	338	345	17.4.66	2066-04-17
5242	DATE	70	79	20/4/2066	2066-04-20
5242	DOCTOR	1329	1338	B Mascolo
5242	DOCTOR	375	384	B Haeckel
5242	IDNUM	38	46	09K94186
5242	IDNUM	47	55	09K94186
5242	MEDICALRECORD	2	14	09494186.LPN
5242	PATIENT	15	37	Topalian, Maxwell HUGH
5243	CITY	226	232	BOWRAL
5243	CITY	514	523	IRON KNOB
5243	CITY	547	555	CULBURRA
5243	CITY	94	103	SINGLETON
5243	STATE	105	122	Western Australia
5243	ZIP	124	128	7330
5243	CITY	94	103	SINGLETON
5243	DATE	160	170	24/11/2011	2011-11-24
5243	DATE	189	199	03/04/2066	2066-04-03
5243	DEPARTMENT	220	223	ACT
5243	HOSPITAL	226	241	BOWRAL HOSPITAL
5243	DOCTOR	245	257	ISAIAS Sopko
5243	DOCTOR	276	283	Gramacy
5243	DOCTOR	3273	3283	I Lairmore
5243	DOCTOR	453	464	SIA Perches
5243	DOCTOR	547	555	CULBURRA
5243	DOCTOR	547	558	CULBURRA GP
5243	DOCTOR	4251	4261	I Armagost
5243	IDNUM	13	23	94L382022V
5243	IDNUM	66	74	94L38202
5243	IDNUM	75	83	94L38202
5243	MEDICALRECORD	24	36	94438202.GVY
5243	PATIENT	38	55	Daughton, EARNEST
5243	STATE	105	122	Western Australia
5243	STATE	220	223	ACT
5243	STREET	84	93	Brookings
5243	ZIP	124	128	7330
5243	ZIP	509	513	1013
5243	ZIP	524	528	2870
5244	CITY	224	229	JUNEE
5244	CITY	88	94	LEETON
5244	STATE	96	99	QLD
5244	ZIP	101	105	4161
5244	CITY	88	94	LEETON
5244	DATE	131	141	16/11/2013	2013-11-16
5244	DATE	161	171	19/04/2066	2066-04-19
5244	DATE	2259	2266	20.4.66	2066-04-20
5244	DATE	2969	2976	27/4/66	2066-04-27
5244	DEPARTMENT	192	221	Douglass Hanly Moir Pathology
5244	HOSPITAL	224	251	JUNEE MULTI PURPOSE SERVICE
5244	DOCTOR	2295	2302	S Close
5244	DOCTOR	255	277	MIQUEL Williams Arnell
5244	IDNUM	13	23	73Z003048P
5244	IDNUM	65	73	73Z00304
5244	MEDICALRECORD	24	35	7390030.LXP
5244	PATIENT	37	54	BREIT, BROOKS ART
5244	STATE	96	99	QLD
5244	STREET	74	87	Belmont Place
5244	ZIP	101	105	4161
5245	CITY	85	97	MOUNT EVELYN
5245	STATE	99	102	QLD
5245	ZIP	104	108	6954
5245	CITY	85	97	MOUNT EVELYN
5245	DATE	134	143	11/8/2004	2004-11-08
5245	DATE	163	173	12/04/2065	2065-04-12
5245	DATE	1689	1696	12.8.65	2065-12-08
5245	DEPARTMENT	194	202	Southern
5245	HOSPITAL	203	232	CONCORD REPATRIATION HOSPITAL
5245	DOCTOR	1756	1764	Q Crilly
5245	DOCTOR	236	254	CARROLL Jed SELBIG
5245	DOCTOR	367	412	Goodly differentiated squamous cell carcinoma
5245	IDNUM	14	24	68A454206V
5245	IDNUM	70	78	68A45420
5245	MEDICALRECORD	25	36	6804542.ARV
5245	PATIENT	38	59	Christoffer, Nancylee
5245	STATE	99	102	QLD
5245	STREET	79	84	Scout
5245	ZIP	104	108	6954
5246	CITY	108	123	BRUNSWICK HEADS
5246	STATE	125	127	SA
5246	ZIP	129	133	3635
5246	CITY	108	123	BRUNSWICK HEADS
5246	DATE	168	177	17/2/2006	2006-02-17
5246	DATE	1691	1700	18 2.2066	2066-20-18
5246	DATE	197	207	17/02/2066	2066-02-17
5246	DATE	2496	2503	24/2/66	2066-02-24
5246	DATE	334	341	24/2/66	2066-02-24
5246	DEPARTMENT	228	240	Cytogenetics
5246	HOSPITAL	241	255	TULLY HOSPITAL
5246	DOCTOR	1732	1742	A Magathan
5246	DOCTOR	259	277	Noel DYLAN KIERNAN
5246	IDNUM	13	23	09I656013R
5246	IDNUM	79	87	09I65601
5246	IDNUM	88	96	09I65601
5246	MEDICALRECORD	24	35	0936560.DJR
5246	PATIENT	37	68	Lamparski, STEPHEN, MARCEL'Otis
5246	STATE	125	127	SA
5246	STREET	97	107	Star Lilly
5246	ZIP	129	133	3635
5247	CITY	85	91	BURNIE
5247	STATE	93	95	SA
5247	ZIP	97	101	2794
5247	CITY	85	91	BURNIE
5247	DATE	127	136	25/3/1985	1985-03-25
5247	DATE	2912	2919	4.10.66	2066-10-04
5247	DEPARTMENT	187	204	ST GEORGE PRIVATE
5247	HOSPITAL	205	238	KOOWEERUP REGIONAL HEALTH SERVICE
5247	DOCTOR	242	258	COLUMBUS Chatmon
5247	DOCTOR	3336	3343	Y Corne
5247	IDNUM	13	23	57F776071A
5247	IDNUM	68	76	57F77607
5247	MEDICALRECORD	24	34	571776.CSE
5247	PATIENT	36	57	GERFIN, BRENDAN Malia
5247	STATE	93	95	SA
5247	STREET	77	84	Mulgray
5247	TIME	156	166	04/03/2066	2066-03-04T10:09
5247	ZIP	97	101	2794
5249	CITY	204	212	GOULBURN
5249	CITY	229	235	TATURA
5249	CITY	81	87	ARARAT
5249	STATE	89	91	WA
5249	ZIP	93	97	5540
5249	CITY	81	87	ARARAT
5249	DATE	123	133	28/11/1998	1998-11-28
5249	DATE	2307	2314	4.10.66	2066-10-04
5249	DEPARTMENT	184	203	PERI-OPERATIVE UNIT
5249	HOSPITAL	204	242	GOULBURN VALLEY HEALTH - TATURA CAMPUS
5249	DOCTOR	2348	2356	Z Sosbee
5249	DOCTOR	246	265	GILBERTO Peter HIRD
5249	IDNUM	13	23	99N978888W
5249	IDNUM	60	68	99N97888
5249	MEDICALRECORD	24	35	9959788.VVW
5249	PATIENT	37	49	AJOSE, Elane
5249	PATIENT	69	80	Ravnescroft
5249	STATE	89	91	WA
5249	TIME	153	163	04/07/2066	2066-07-04T15:48
5249	ZIP	93	97	5540
5250	CITY	83	92	DANDENONG
5250	STATE	94	97	TAS
5250	ZIP	99	103	1805
5250	CITY	83	92	DANDENONG
5250	DATE	129	138	14/9/2002	2002-09-14
5250	DATE	158	167	24/4/2066	2066-04-24
5250	DATE	1694	1701	25.4.66	2066-04-25
5250	DATE	434	441	24.4.66	2066-04-24
5250	DEPARTMENT	184	192	Southern
5250	HOSPITAL	193	211	ST GEORGE HOSPITAL
5250	DOCTOR	1731	1741	W Openshaw
5250	DOCTOR	215	228	ISAIAS HILTON
5250	IDNUM	13	23	84O319046C
5250	IDNUM	67	75	84O31904
5250	MEDICALRECORD	24	34	845319.CLQ
5250	PATIENT	36	56	WINTERMANTEL, Aubrey
5250	PATIENT	76	82	Loomes
5250	STATE	94	97	TAS
5250	ZIP	99	103	1805
5251	DATE	1500	1507	28.4.66	2066-04-28
5251	DATE	57	65	5/5/2066	2066-05-05
5251	DOCTOR	1541	1553	H Bookmiller
5251	IDNUM	33	41	26X61185
5251	MEDICALRECORD	2	12	269611.WNI
5251	PATIENT	13	32	Rohloff, Cristine H
5253	CITY	91	98	BENDIGO
5253	STATE	100	118	Northern Territory
5253	ZIP	120	124	4008
5253	CITY	91	98	BENDIGO
5253	DATE	150	159	18/8/2004	2004-08-18
5253	DATE	4904	4913	13/4/2066	2066-04-13
5253	DEPARTMENT	210	227	ST GEORGE PRIVATE
5253	HOSPITAL	228	252	HAWKER MEMORIAL HOSPITAL
5253	DOCTOR	263	277	TREVOR Maglott
5253	DOCTOR	3839	3849	E Woodhead
5253	IDNUM	13	23	11Y0511111
5253	IDNUM	73	81	11Y05111
5253	MEDICALRECORD	24	36	11905111.CFI
5253	PATIENT	38	62	FOSHER, MATTHEW-CRISTINA
5253	STATE	100	118	Northern Territory
5253	STREET	82	90	W Hudson
5253	TIME	179	189	11/04/2066	2066-04-11
5253	ZIP	120	124	4008
5255	CITY	89	95	ARARAT
5255	STATE	97	100	VIC
5255	ZIP	102	106	4471
5255	CITY	89	95	ARARAT
5255	DATE	132	141	17/6/2008	2008-06-17
5255	DATE	161	171	04/06/2066	2066-06-04
5255	DATE	4284	4293	4/12/2066	2066-12-04
5255	DEPARTMENT	192	208	WEST GYNAECOLOGY
5255	HOSPITAL	209	239	PORTLAND TABULAM HEALTH CENTRE
5255	DOCTOR	244	263	ETTIE Elliott Niven
5255	DOCTOR	2532	2540	Y Yatsko
5255	IDNUM	13	23	90M783027Y
5255	IDNUM	70	78	90M78302
5255	MEDICALRECORD	24	34	904783.BGT
5255	PATIENT	36	59	FRABIZZIO, RONNIE IVORY
5255	STATE	97	100	VIC
5255	STREET	79	88	Lee Green
5255	ZIP	102	106	4471
5257	CITY	88	93	EUROA
5257	STATE	95	97	NT
5257	ZIP	99	103	6029
5257	CITY	88	93	EUROA
5257	DATE	129	139	28/11/1998	1998-11-28
5257	DATE	2362	2369	4.10.66	2066-10-04
5257	DATE	327	334	5.10.66	2066-10-05
5257	DATE	6295	6302	5.10.66	2066-10-05
5257	DEPARTMENT	190	203	MACQUARIEWARD
5257	HOSPITAL	204	244	EAST WIMMERA HEALTH SERVICE - WYCHEPROOF
5257	DEPARTMENT	6444	6471	Pathology DICKINSON 3 NORTH
5257	DOCTOR	2403	2409	W Tyus
5257	DOCTOR	248	267	Ross Jed Weisgerber
5257	DOCTOR	6489	6497	W Stores
5257	DOCTOR	6621	6638	EUGENIO ISIMINGER
5257	HOSPITAL	6689	6725	PINNAROO SOLDIERS' MEMORIAL HOSPITAL
5257	HOSPITAL	6689	6711	PINNAROO SOLDIERS' MEM
5257	DOCTOR	7996	8004	W Kibler
5257	DATE	8008	8017	5/10/2066	2066-10-05
5257	HOSPITAL	6392	6433	BARWON HEALTH - NEWCOMB RENAL UNIT CAMPUS
5257	IDNUM	14	24	85N123285E
5257	IDNUM	63	71	85N12328
5257	IDNUM	6359	6367	85N12328
5257	IDNUM	6380	6390	WNN12J2851
5257	MEDICALRECORD	25	36	8551232.WOE
5257	PATIENT	38	52	Umholtz, Tania
5257	PATIENT	6932	6945	Dear Maxwell,
5257	PATIENT	7927	7932	Sw/AG
5257	STATE	313	315	NT
5257	STATE	6250	6252	NT
5257	STATE	6281	6283	NT
5257	STATE	7258	7260	NT
5257	STATE	95	97	NT
5257	STREET	72	87	Water Oak Point
5257	TIME	159	169	04/07/2066	2066-07-04T15:48
5257	ZIP	99	103	6029
5261	CITY	85	94	BATEHAVEN
5261	STATE	96	99	VIC
5261	ZIP	101	105	5733
5261	CITY	85	94	BATEHAVEN
5261	DATE	131	139	6/1/2006	2006-01-06
5261	DATE	159	169	06/05/2066	2066-05-06
5261	DEPARTMENT	190	202	SEALSCentral
5261	DOCTOR	1738	1745	G Ralon
5261	DOCTOR	229	249	DYLAN JARRAH Rangnow
5261	DOCTOR	268	284	Nathanael ALGIRE
5261	IDNUM	13	23	27V425092B
5261	IDNUM	68	76	27V42509
5261	MEDICALRECORD	24	35	2784250.ZFB
5261	PATIENT	37	57	ARIZAGA, Lyle Hubert
5261	PATIENT	77	84	Rehbaum
5261	STATE	96	99	VIC
5261	ZIP	101	105	5733
5262	CITY	81	90	IRON KNOB
5262	STATE	92	95	ACT
5262	ZIP	97	101	5163
5262	CITY	81	90	IRON KNOB
5262	DATE	127	136	21/2/2023	2023-02-21
5262	DATE	156	166	27/04/2066	2066-04-27
5262	DATE	5806	5814	5/9/2066	2066-09-05
5262	DEPARTMENT	187	192	SEALS
5262	HOSPITAL	193	210	BEVERLEY HOSPITAL
5262	DOCTOR	215	237	Lashawna MONTY Kamerad
5262	DOCTOR	2862	2872	U Hubbartt
5262	IDNUM	14	24	74R446150K
5262	IDNUM	63	71	74R44615
5262	MEDICALRECORD	25	36	7464461.OAK
5262	ORGANIZATION	4927	4935	American
5262	HOSPITAL	4956	4970	TULLY HOSPITAL
5262	PATIENT	38	52	Stenger, JERRY
5262	PATIENT	72	80	Nottoway
5262	STATE	4646	4649	ACT
5262	STATE	4809	4812	ACT
5262	STATE	92	95	ACT
5262	ZIP	97	101	5163
5268	DATE	1197	1204	10.5.66	2066-10-05
5268	DATE	60	69	16/5/2066	2066-05-16
5268	DOCTOR	1234	1242	E Perrin
5268	DOCTOR	1258	1269	E Zimbelman
5268	IDNUM	36	44	16A64886
5268	MEDICALRECORD	1	13	16064886.SGE
5268	PATIENT	14	35	VANDERZANDEN, LACHLAN
5269	CITY	222	231	NEWCASTLE
5269	CITY	86	94	MAITLAND
5269	STATE	96	99	VIC
5269	ZIP	101	105	6487
5269	DATE	131	139	7/9/2005	2005-09-07
5269	DATE	159	169	25/04/2066	2066-04-25
5269	DATE	5111	5118	11/5/66	2066-11-05
5269	DATE	7668	7676	1/5/2066	2066-01-05
5269	DEPARTMENT	190	207	DICKINSON 3 NORTH
5269	HOSPITAL	208	231	CALVARY MATER NEWCASTLE
5269	DOCTOR	236	259	Madilynn EARNEST NOWLEN
5269	DOCTOR	5316	5326	C. Paleaae
5269	IDNUM	13	23	01B198124M
5269	IDNUM	68	76	01B19812
5269	MEDICALRECORD	24	35	0101981.GMM
5269	PATIENT	37	57	CATHOLIC, Darrin Rey
5269	STATE	96	99	VIC
5269	STREET	77	85	Bay Reef
5269	ZIP	101	105	6487
5270	DATE	1770	1777	19/4/66	2066-04-19
5270	DATE	57	66	19/4/2066	2066-04-19
5270	DOCTOR	942	951	Q Lensing
5270	IDNUM	33	41	69X11918
5270	MEDICALRECORD	1	12	6991191.WIV
5270	PATIENT	13	32	Imfeld, Forest Ryan
5271	CITY	86	92	LEETON
5271	STATE	94	109	New South Wales
5271	ZIP	111	115	2529
5271	CITY	86	92	LEETON
5271	DATE	141	150	1/12/2006	2006-12-01
5271	DATE	343	352	22/4/2066	2066-04-22
5271	DATE	9140	9149	14/4/2066	2066-04-14
5271	DATE	9183	9192	22/4/2066	2066-04-22
5271	DEPARTMENT	201	212	ACT Genetic
5271	IDNUM	13	23	01G311999R
5271	IDNUM	70	78	01G31199
5271	MEDICALRECORD	24	35	0123119.YZR
5271	PATIENT	250	273	PRO Debroah UWE Swantek
5271	PATIENT	37	59	TRADUP, ZORAIDA Jemima
5271	PATIENT	79	85	Flurry
5271	PHONE	9129	9138	9113 3412
5271	STATE	201	204	ACT
5271	STATE	94	109	New South Wales
5271	TIME	170	180	12/04/2066	2066-04-12T11:00
5271	ZIP	111	115	2529
5272	CITY	212	221	SINGLETON
5272	CITY	87	97	FRESHWATER
5272	STATE	99	102	ACT
5272	ZIP	104	108	6365
5272	CITY	87	97	FRESHWATER
5272	DATE	134	143	24/5/1998	1998-05-24
5272	DATE	3962	3969	30/3/66	2066-03-30
5272	DEPARTMENT	194	211	ST GEORGE PRIVATE
5272	DOCTOR	244	267	Augustina MARION COSICO
5272	DOCTOR	2881	2892	Y. Zambotti
5272	DOCTOR	697	708	JULES Sabat
5272	TIME	712	720	11:02hrs	2066-03-11T11:02
5272	IDNUM	14	24	96H851157X
5272	IDNUM	66	74	96H85115
5272	MEDICALRECORD	25	36	9628511.OUX
5272	PATIENT	38	55	Merila, CHUCK CHI
5272	STATE	99	102	ACT
5272	STREET	75	86	Leatherhead
5272	TIME	163	173	24/03/2066	2066-03-24T11:04
5272	ZIP	104	108	6365
5274	DATE	2422	2429	17/5/66	2066-05-17
5274	DATE	50	59	17/5/2066	2066-05-17
5274	DATE	85	92	17/5/66	2066-05-17
5274	DOCTOR	2484	2498	Agustin GOSSON
5274	HOSPITAL	2500	2527	JOYCE PALMER HEALTH SERVICE
5274	DOCTOR	857	859	IW
5274	DATE	864	871	17.4.63	2063-04-17
5274	DOCTOR	904	910	N Poro
5274	DOCTOR	918	928	N Stanczak
5274	IDNUM	26	34	54D87221
5274	MEDICALRECORD	1	12	5418722.DPG
5274	PATIENT	13	25	Leamy, Caleb
5276	CITY	90	97	YANCHEP
5276	STATE	99	107	Tasmania
5276	ZIP	109	113	5154
5276	DATE	148	157	10/6/1978	1978-10-06
5276	DATE	177	187	18/03/2066	2066-03-18
5276	DATE	6020	6029	24/3/2066	2066-03-24
5276	DEPARTMENT	208	227	DONNYBROOK HOSPITAL
5276	DOCTOR	231	246	DARRELL CARUANA
5276	DOCTOR	265	270	Kenny
5276	IDNUM	13	23	86M074022C
5276	IDNUM	61	69	86M07402
5276	IDNUM	70	78	86M07402
5276	MEDICALRECORD	24	34	864074.AGG
5276	PATIENT	36	50	Liggins, ELDEN
5276	STATE	99	107	Tasmania
5276	STREET	79	89	Valley Oak
5276	ZIP	109	113	5154
5277	CITY	101	108	MANILLA
5277	STATE	110	112	NT
5277	ZIP	114	118	4565
5277	DATE	153	163	28/11/2000	2000-11-28
5277	DATE	183	193	12/04/2066	2066-04-12
5277	DATE	4789	4796	14/4/66	2066-04-14
5277	DATE	5680	5687	24/4/66	2066-04-24
5277	DEPARTMENT	214	256	CAMPBELL TOWN HEALTH AND COMMUNITY SERVICE
5277	DOCTOR	260	275	Williams SICKEL
5277	DOCTOR	308	314	ANIBAL
5277	DOCTOR	3306	3318	L Blechinger
5277	IDNUM	14	24	44I195080L
5277	IDNUM	74	82	44I19508
5277	IDNUM	83	91	44I19508
5277	MEDICALRECORD	25	35	443195.CVB
5277	ORGANIZATION	4856	4879	Allied Waste Industries
5277	DEPARTMENT	4880	4918	CLONCURRY MULTI-PURPOSE HEALTH SERVICE
5277	PATIENT	37	63	THIELGES, KRISTOFER BRYANT
5277	STATE	110	112	NT
5277	STATE	2484	2486	NT
5277	STATE	346	348	NT
5277	STATE	4664	4666	NT
5277	STATE	4809	4811	NT
5277	STATE	61	63	NT
5277	STREET	92	100	S Claire
5277	ZIP	114	118	4565
5278	CITY	193	199	FORBES
5278	CITY	80	90	FRESHWATER
5278	STATE	92	95	VIC
5278	ZIP	97	101	3825
5278	CITY	80	90	FRESHWATER
5278	DATE	127	135	3/7/2023	2023-03-07
5278	DATE	155	163	9/5/2066	2066-05-09
5278	DATE	2010	2017	10.5.66	2066-10-05
5278	DEPARTMENT	180	192	SEALSCentral
5278	HOSPITAL	193	217	FORBES DISTRICT HOSPITAL
5278	DOCTOR	2049	2057	F Stobbs
5278	DOCTOR	217	232	VALBRYON Elrick
5278	DOCTOR	3972	3980	F Lambka
5278	IDNUM	13	23	39J545348R
5278	IDNUM	65	73	39J54534
5278	MEDICALRECORD	24	35	3935453.LWR
5278	ORGANIZATION	3070	3088	Nash-Finch Company
5278	HOSPITAL	3090	3107	NARROGIN HOSPITAL
5278	PATIENT	37	54	DUDLESON, EUSEBIO
5278	PATIENT	74	79	Aldie
5278	STATE	92	95	VIC
5278	ZIP	97	101	3825
5279	CITY	227	234	LITHGOW
5279	CITY	90	100	FRESHWATER
5279	STATE	102	110	Tasmania
5279	ZIP	112	116	6635
5279	CITY	90	100	FRESHWATER
5279	DATE	151	159	5/6/1994	1994-05-06
5279	DATE	179	189	11/04/2066	2066-04-11
5279	DATE	1986	1993	12.4.66	2066-12-04
5279	DEPARTMENT	210	226	WEST GYNAECOLOGY
5279	HOSPITAL	227	243	LITHGOW HOSPITAL
5279	DOCTOR	2024	2034	I Molinaro
5279	DOCTOR	247	266	Morgan TRACEY JOANS
5279	DOCTOR	3405	3414	I Herzing
5279	IDNUM	13	23	38O868113W
5279	IDNUM	64	72	38O86811
5279	IDNUM	73	81	38O86811
5279	MEDICALRECORD	24	35	3858681.CJW
5279	PATIENT	37	53	Osisek, Harrison
5279	PATIENT	82	89	Miramar
5279	STATE	102	110	Tasmania
5279	ZIP	112	116	6635
5280	CITY	215	226	CASTLEMAINE
5280	CITY	87	97	NARACOORTE
5280	STATE	99	109	E Anderson
5280	CITY	87	97	NARACOORTE
5280	DATE	141	150	18/8/2017	2017-08-18
5280	DATE	170	179	11/4/2065	2065-11-04
5280	DATE	3265	3283	4 to 6:  11/9/2065	2065-04-04
5280	DATE	3864	3871	11.5.65	2065-11-05
5280	DATE	531	538	11.5.65	2065-11-05
5280	DEPARTMENT	196	212	3 ARRIETTA CLOSE
5280	HOSPITAL	215	233	CASTLEMAINE HEALTH
5280	DOCTOR	237	252	HILTON Mullally
5280	DOCTOR	271	276	Strub
5280	DOCTOR	3904	3915	S Elderidge
5280	DOCTOR	443	449	Darryl
5280	DOCTOR	5412	5419	S Desak
5280	IDNUM	13	23	60X060920S
5280	IDNUM	67	75	60X06092
5280	MEDICALRECORD	24	35	6080609.FAS
5280	PATIENT	37	56	Stanifer, Ray Aiden
5280	PATIENT	76	86	Micklejohn
5280	ZIP	111	115	5555
5281	CITY	100	107	MARGATE
5281	CITY	270	279	NEWCASTLE
5281	CITY	100	107	MARGATE
5281	STATE	109	124	South Australia
5281	ZIP	126	130	2406
5281	DATE	164	172	2/2/2018	2018-02-02
5281	DATE	192	202	11/11/2065	2065-11-11
5281	DATE	3537	3545	11.12.65	2065-11-12
5281	DATE	4682	4690	20/11/65	2065-11-20
5281	DEPARTMENT	219	286	DOMAIN AGED CARE RM 2 - JOHN HUNTER HOSPITAL ROYAL NEWCASTLE CENTRE
5281	DOCTOR	290	309	ANTOINE Tyson CRITZ
5281	DOCTOR	3575	3583	P Toepel
5281	DOCTOR	901	908	Orville
5281	DOCTOR	915	921	P Haaz
5281	TIME	925	946	10:45am on 11.11.2065	2065-11-11T10:45
5281	IDNUM	13	23	65Y500188Y
5281	IDNUM	70	78	65Y50018
5281	IDNUM	79	87	65Y50018
5281	MEDICALRECORD	24	35	6595001.VVY
5281	PATIENT	37	59	DOWLING, Henry Cheryll
5281	STATE	109	124	South Australia
5281	STREET	88	99	Oyster Pond
5281	ZIP	126	130	2406
5282	CITY	86	94	BRISBANE
5282	STATE	96	114	Northern Territory
5282	ZIP	116	120	2766
5282	CITY	86	94	BRISBANE
5282	DATE	1179	1187	12/11/65	2065-11-12
5282	DATE	1312	1320	12.11.65	2065-12-11
5282	DATE	146	155	24/6/2023	2023-06-24
5282	DATE	175	185	10/11/2065	2065-11-10
5282	DATE	2224	2232	13/11/65	2065-11-13
5282	DATE	2375	2383	12.11.65	2065-12-11
5282	DEPARTMENT	202	224	St Vincent's Pathology
5282	HOSPITAL	227	276	EASTERN EYRE HEALTH AND AGED CARE - COWELL CAMPUS
5282	DOCTOR	2415	2422	A Holle
5282	DOCTOR	280	301	Millard HANS WINEBERG
5282	DOCTOR	320	327	WILBERT
5282	IDNUM	14	24	07G702994V
5282	IDNUM	70	78	07G70299
5282	MEDICALRECORD	25	36	0727029.YMV
5282	PATIENT	38	59	Domenech, Felton GALE
5282	PATIENT	79	85	Dorlon
5282	STATE	96	114	Northern Territory
5282	ZIP	116	120	2766
5283	DATE	1810	1818	29.10.65	2065-10-29
5283	DATE	1974	1982	30.10.65	2065-10-30
5283	DATE	60	69	11/3/2065	2065-11-03
5283	DOCTOR	2013	2019	X Bora
5283	IDNUM	144	152	55D72395
5283	IDNUM	144	202	55D72395 Cervical biopsy at 2 and 10 o'clock: HPV and CIN3
5283	IDNUM	27	35	55D72395
5283	IDNUM	36	44	55D72395
5283	MEDICALRECORD	1	12	5517239.NHD
5283	PATIENT	13	26	CASTRO, SELMA
5284	CITY	91	100	GLENBROOK
5284	STATE	102	105	QLD
5284	ZIP	107	111	6228
5284	DATE	146	155	30/8/2002	2002-08-30
5284	DATE	175	185	21/10/2065	2065-10-21
5284	DATE	2715	2723	22.10.65	2065-10-22
5284	DEPARTMENT	202	228	BRIGHAM & WOMEN'S HOSPITAL
5284	HOSPITAL	231	248	MITCHELL HOSPITAL
5284	DOCTOR	1526	1532	Israel
5284	DOCTOR	1539	1548	M Senters
5284	DOCTOR	1552	1561	M Herriot
5284	TIME	1564	1585	10:45am on 21.10.2065	2065-10-21T10:45
5284	DOCTOR	2033	2040	Earnest
5284	DOCTOR	2059	2069	M Zazozdor
5284	TIME	2073	2094	10:45am on 21.10.2065	2065-10-21T10:45
5284	DOCTOR	252	273	DANILO IRVING YOUNKER
5284	DOCTOR	2753	2760	M Arras
5284	DOCTOR	878	881	Bud
5284	DOCTOR	888	898	M Savitsky
5284	DOCTOR	902	907	M Lem
5284	TIME	911	932	10:45am on 21.10.2065	2065-10-21T10:45
5284	IDNUM	13	23	40E273210J
5284	IDNUM	65	73	40E27321
5284	IDNUM	74	82	40E27321
5284	MEDICALRECORD	24	35	4012732.CCJ
5284	PATIENT	37	54	LARIVIERE, TRACEY
5284	STATE	102	105	QLD
5284	STREET	83	90	Pettits
5284	ZIP	107	111	6228
5286	DATE	1331	1338	24.7.65	2065-07-24
5286	DATE	54	63	28/7/2065	2065-07-28
5286	DOCTOR	1369	1378	W Gendron
5286	IDNUM	2122	2130	82M47502
5286	IDNUM	30	38	82M47502
5286	MEDICALRECORD	2	13	8244750.FUG
5286	PATIENT	14	29	ALLBEE, ANTONIO
5287	CITY	85	94	INNISFAIL
5287	STATE	96	99	VIC
5287	ZIP	101	105	7140
5287	DATE	131	141	30/10/2037	2037-10-30
5287	DATE	161	171	12/12/2064	2064-12-12
5287	DEPARTMENT	192	210	105 HAMRUN CIRCUIT
5287	HOSPITAL	211	227	EUDUNDA HOSPITAL
5287	DOCTOR	1557	1559	YG
5287	DOCTOR	1560	1562	HT
5287	DATE	1566	1574	15.12.64	2064-12-15
5287	DOCTOR	1605	1612	U Bisel
5287	DOCTOR	231	255	Yindjibarndi REYES RODER
5287	IDNUM	13	23	77N916285M
5287	IDNUM	2064	2072	77N91628
5287	IDNUM	68	76	77N91628
5287	MEDICALRECORD	24	35	7759162.VOM
5287	PATIENT	37	57	WHETHAM, Rhett-KARRI
5287	PATIENT	77	84	Larstan
5287	STATE	96	99	VIC
5287	ZIP	101	105	7140
5288	DATE	282	289	12.4.66	2066-12-04
5288	DATE	61	70	17/4/2066	2066-04-17
5288	DOCTOR	322	333	E Showalter
5288	IDNUM	37	45	19W11709
5288	MEDICALRECORD	1	11	198117.AYG
5288	PATIENT	12	36	Degolyer, WINSTON Vienna
5289	CITY	211	216	Perth
5289	CITY	95	106	COOTAMUNDRA
5289	STATE	108	111	VIC
5289	ZIP	113	117	1231
5289	DATE	152	160	2/7/1996	1996-02-07
5289	DATE	180	190	30/03/2066	2066-03-30
5289	DATE	4534	4542	4/4/2066	2066-04-04
5289	DOCTOR	1469	1482	Elliott KEVER
5289	DOCTOR	1512	1523	X. Mcnelley
5289	DOCTOR	241	251	Bob Barden
5289	DOCTOR	2929	2939	X Tyburski
5289	IDNUM	14	24	97K7399080
5289	IDNUM	69	77	97K73990
5289	IDNUM	78	86	97K73990
5289	MEDICALRECORD	25	35	973739.YBW
5289	PATIENT	37	58	BRUNKOW, Erwin QUAMBI
5289	STATE	108	111	VIC
5289	STATE	2515	2518	VIC
5289	STATE	2755	2758	VIC
5289	STATE	4421	4424	VIC
5289	STATE	4482	4485	VIC
5289	STREET	87	94	Fondant
5289	ZIP	113	117	1231
5290	CITY	87	95	TAMWORTH
5290	STATE	97	100	QLD
5290	ZIP	102	106	7109
5290	CITY	87	95	TAMWORTH
5290	DATE	141	150	24/2/2007	2007-02-24
5290	DATE	170	180	27/04/2066	2066-04-27
5290	DATE	5480	5488	5/5/2066	2066-05-05
5290	DEPARTMENT	201	228	MANSFIELD DISTRICT HOSPITAL
5290	DOCTOR	232	247	THERON CAMINERO
5290	DOCTOR	266	271	Jimmy
5290	DOCTOR	276	280	ABEL
5290	DOCTOR	3450	3457	M Tores
5290	IDNUM	13	23	45G860066L
5290	IDNUM	57	65	45G86006
5290	IDNUM	66	74	45G86006
5290	MEDICALRECORD	24	34	452860.AQS
5290	PATIENT	36	46	Smeal, Ira
5290	STATE	97	100	QLD
5290	STREET	75	86	Poppy House
5290	ZIP	102	106	7109
5291	CITY	85	92	MILDURA
5291	STATE	94	97	ACT
5291	ZIP	99	103	4570
5291	CITY	85	92	MILDURA
5291	DATE	10071	10079	9/5/2066	2066-05-09
5291	DATE	138	146	3/4/1982	1982-03-04
5291	DATE	166	176	27/04/2066	2066-04-27
5291	DEPARTMENT	197	224	BROADMEADOWS HEALTH SERVICE
5291	DOCTOR	228	241	Marcelo Sarra
5291	DOCTOR	260	268	Jonathon
5291	DOCTOR	3976	3984	J Rickey
5291	HOSPITAL	8889	8901	MSI proteins
5291	IDNUM	14	24	30H200224R
5291	IDNUM	61	69	30H20022
5291	IDNUM	70	78	30H20022
5291	MEDICALRECORD	25	35	302200.GGM
5291	PATIENT	37	50	CUTRI, DECLAN
5291	PATIENT	79	84	Arley
5291	STATE	8708	8711	ACT
5291	STATE	8787	8790	ACT
5291	STATE	94	97	ACT
5291	ZIP	99	103	4570
5292	DATE	131	138	23/2/66	2066-02-23
5292	DATE	3739	3746	16/2/66	2066-02-16
5292	DATE	4650	4657	23/2/66	2066-02-23
5292	DATE	65	74	23/2/2066	2066-02-23
5292	DOCTOR	1811	1823	T. Granfield
5292	IDNUM	32	40	72Q50203
5292	IDNUM	41	49	72Q50203
5292	MEDICALRECORD	1	11	726502.AIE
5292	ORGANIZATION	3802	3827	Cisco DOMAIN AGED CARE RM
5292	PATIENT	12	31	CECCHINATO, DOMINGO
5295	CITY	85	94	IRON KNOB
5295	STATE	96	124	Australian Capital Territory
5295	ZIP	126	130	5333
5295	CITY	85	94	IRON KNOB
5295	DATE	165	174	16/5/2002	2002-05-16
5295	DATE	193	203	03/03/2066	2066-03-03
5295	DEPARTMENT	224	259	BARWON HEALTH - ASHLEY MANOR CAMPUS
5295	DOCTOR	263	276	TAYLOR Telgen
5295	DOCTOR	2741	2750	R Stoffle
5295	DOCTOR	295	301	KENETH
5295	DOCTOR	306	317	JARROD-Merl
5295	IDNUM	13	23	67Q943299T
5295	IDNUM	60	68	67Q94329
5295	IDNUM	69	77	67Q94329
5295	MEDICALRECORD	24	34	676943.GYY
5295	PATIENT	36	49	Mathre, Quinn
5295	STATE	96	124	Australian Capital Territory
5295	STREET	78	84	Hilsea
5295	ZIP	126	130	5333
5296	CITY	91	96	NOWRA
5296	STATE	98	101	TAS
5296	ZIP	103	107	4179
5296	DATE	142	151	26/3/2006	2006-03-26
5296	DATE	171	181	20/03/2066	2066-03-20
5296	DATE	4584	4591	22/3/66	2066-03-22
5296	DEPARTMENT	202	228	CRAIGIEBURN HEALTH SERVICE
5296	DOCTOR	232	247	DONOVAN Valotta
5296	DOCTOR	266	271	Leroy
5296	DOCTOR	3311	3322	G Chernesky
5296	IDNUM	14	24	25N9733570
5296	IDNUM	63	71	25N97335
5296	IDNUM	72	80	25N97335
5296	MEDICALRECORD	25	35	255973.INU
5296	PATIENT	37	53	Wheelock, Joanne
5296	PATIENT	81	90	Wadsworth
5296	STATE	98	101	TAS
5296	ZIP	103	107	4179
5297	DATE	52	61	27/1/2066	2066-01-27
5297	DOCTOR	685	693	RGerardo
5297	IDNUM	1676	1680	2055
5297	IDNUM	28	36	66H08509
5297	MEDICALRECORD	1	11	662085.BYM
5297	PATIENT	12	27	LEPPER, Alfonso
5297	ZIP	1676	1680	2055
5298	CITY	96	104	MAITLAND
5298	STATE	106	121	New South Wales
5298	ZIP	123	127	2030
5298	DATE	153	162	13/5/1996	1996-05-13
5298	DATE	182	192	02/07/2062	2062-07-02
5298	DATE	3028	3036	2/9/2062	2062-09-02
5298	DEPARTMENT	213	229	WEST GYNAECOLOGY
5298	DOCTOR	1898	1906	Q. Majid
5298	DOCTOR	233	251	YONG GALE Gallegoz
5298	DOCTOR	5157	5172	DANNY LASTRAPES
5298	TIME	5176	5202	10:52AM on the 22-Mar-2064	2064-04-22T10:52
5298	HOSPITAL	3889	3921	Pepco Holdings ATHERTON HOSPITAL
5298	IDNUM	13	23	67V2650649
5298	IDNUM	77	85	67V26506
5298	MEDICALRECORD	24	35	6782650.QLY
5298	ORGANIZATION	3148	3150	A3
5298	PATIENT	37	53	MCKINNIS, Herman
5298	PATIENT	86	95	Greenbush
5298	STATE	106	121	New South Wales
5298	ZIP	123	127	2030
5300	CITY	3503	3510	KYNETON
5300	CITY	82	88	BURNIE
5300	STATE	90	98	Tasmania
5300	ZIP	100	104	2661
5300	CITY	82	88	BURNIE
5300	DATE	130	138	9/4/1997	1997-09-04
5300	DATE	158	168	23/03/2066	2066-03-23
5300	DATE	2087	2094	23.3.66	2066-03-23
5300	DATE	321	328	29.3.66	2066-03-29
5300	DATE	5031	5038	29.3.66	2066-03-29
5300	DEPARTMENT	189	210	DOMAIN AGED CARE RM 2
5300	HOSPITAL	211	231	GNOWANGERUP HOSPITAL
5300	DOCTOR	2125	2134	O Sealock
5300	DOCTOR	235	253	Odis ESTELLE SYSYN
5300	IDNUM	13	23	52W616322E
5300	IDNUM	64	72	52W61632
5300	MEDICALRECORD	24	34	528616.IGG
5300	ORGANIZATION	3461	3468	Du Pont
5300	HOSPITAL	3470	3510	CENTRAL HIGHLANDS RURAL HEALTH - KYNETON
5300	PATIENT	36	54	Bittman, ROOSEVELT
5300	STATE	90	98	Tasmania
5300	STREET	73	81	N Centre
5300	ZIP	100	104	2661
5301	CITY	84	89	PERTH
5301	STATE	91	93	NT
5301	ZIP	95	99	4404
5301	CITY	84	89	PERTH
5301	DATE	125	134	22/9/2000	2000-09-22
5301	DATE	154	163	2/12/2065	2065-12-02
5301	DATE	3311	3318	3.12.65	2065-03-12
5301	DEPARTMENT	180	206	BRIGHAM & WOMEN'S HOSPITAL
5301	HOSPITAL	209	227	LIVERPOOL HOSPITAL
5301	DOCTOR	231	250	ARTHUR Ray Ehrhardt
5301	DOCTOR	3353	3361	C Atwood
5301	IDNUM	14	24	09S637380N
5301	IDNUM	67	75	09S63738
5301	MEDICALRECORD	25	36	0976373.VBN
5301	PATIENT	38	56	Aponte, CARA WALDO
5301	PATIENT	76	83	Golding
5301	STATE	91	93	NT
5301	ZIP	95	99	4404
5303	CITY	179	189	DENILIQUIN
5303	CITY	79	87	HAHNDORF
5303	ZIP	91	95	3049
5303	CITY	79	87	HAHNDORF
5303	DATE	121	129	3/6/1990	1990-03-06
5303	DATE	149	158	14/3/2065	2065-03-14
5303	DATE	1920	1927	15.3.65	2065-03-15
5303	DATE	295	303	2.6.2066	2066-06-02
5303	DEPARTMENT	173	178	Seals
5303	HOSPITAL	179	198	DENILIQUIN HOSPITAL
5303	DOCTOR	1958	1965	M Bodle
5303	DOCTOR	202	221	JOLANDA JULES TAKER
5303	IDNUM	13	23	41B938197J
5303	IDNUM	62	70	41B93819
5303	MEDICALRECORD	24	34	410938.EYS
5303	PATIENT	36	51	PAETZ, REYNALDO
5303	STREET	71	78	Mineral
5303	ZIP	91	95	3049
5304	CITY	87	95	BALLARAT
5304	STATE	97	115	Northern Territory
5304	ZIP	117	121	3878
5304	CITY	87	95	BALLARAT
5304	DATE	147	156	9/12/1999	1999-09-12
5304	DATE	176	185	12/5/2066	2066-12-05
5304	DATE	2409	2416	17/5/66	2066-05-17
5304	DATE	2594	2601	13.5.66	2066-05-13
5304	DATE	2665	2672	16.5.66	2066-05-16
5304	DATE	3610	3617	13.5.66	2066-05-13
5304	DEPARTMENT	202	212	Immunology
5304	HOSPITAL	213	237	PEAK HILL HEALTH SERVICE
5304	DOCTOR	241	261	ANIBAL Briar HETTWER
5304	DOCTOR	3655	3665	A Montanye
5304	DOCTOR	3675	3685	A Castagna
5304	DOCTOR	571	579	A Ghazal
5304	DOCTOR	586	594	A Correl
5304	TIME	598	615	16:00 on 12.05.66	2066-05-12
5304	IDNUM	13	23	09X959255S
5304	IDNUM	70	78	09X95925
5304	MEDICALRECORD	24	35	0999592.NNS
5304	PATIENT	37	59	SALMINEN, Maynard Hank
5304	PATIENT	79	86	Shoults
5304	STATE	97	115	Northern Territory
5304	ZIP	117	121	3878
5307	DOCTOR	1713	1721	L Panzer
5307	ORGANIZATION	2474	2491	Lyondell Chemical
5307	HOSPITAL	2493	2509	QUILPIE HOSPITAL
5309	DATE	263	270	13.6.66	2066-06-13
5309	DATE	2667	2674	14.6.66	2066-06-14
5309	DATE	593	605	15:10H 13.06	2066-10-15
5309	DOCTOR	137	151	Buster HENRITH
5309	DOCTOR	2705	2713	I Mauney
5309	DOCTOR	784	788	Doug
5309	DOCTOR	795	804	I Ruleman
5309	TIME	808	826	15:35H on 13/06/66	2066-06-13
5309	ORGANIZATION	3364	3378	Pacific Mutual
5309	HOSPITAL	3380	3398	LIVERPOOL HOSPITAL
5322	CITY	202	207	CLARE
5322	CITY	86	92	ORANGE
5322	STATE	94	97	ACT
5322	ZIP	99	103	6513
5322	DATE	129	138	13/2/2025	2025-02-13
5322	DATE	1504	1511	9/10/65	2065-10-09
5322	DATE	158	166	9/9/2065	2065-09-09
5322	DATE	3144	3151	9.10.65	2065-10-09
5322	DATE	344	351	18.9.65	2065-09-18
5322	DATE	4914	4921	18.9.65	2065-09-18
5322	DATE	4986	4993	15.9.65	2065-09-15
5322	DEPARTMENT	183	199	WEST GYNAECOLOGY
5322	HOSPITAL	202	216	CLARE HOSPITAL
5322	DOCTOR	220	241	KEVEN CLAUDIO TRAMMEL
5322	DOCTOR	260	266	MICKEY
5322	DOCTOR	3181	3191	T Ramseyer
5322	IDNUM	13	23	84D622278D
5322	IDNUM	3957	3966	78QW93036
5322	IDNUM	68	76	84D62227
5322	MEDICALRECORD	24	35	8416222.UVD
5322	PATIENT	37	57	Chuong, Wilfred Jere
5322	PATIENT	77	85	Starodub
5322	STATE	94	97	ACT
5322	ZIP	99	103	6513
5335	CITY	83	96	VICTOR HARBOR
5335	STATE	98	101	TAS
5335	ZIP	103	107	2578
5335	DATE	133	142	15/2/2016	2016-02-15
5335	DATE	319	326	14/7/66	2066-07-14
5335	DATE	5152	5159	21/8/64	2064-08-21
5335	DATE	5186	5193	14/7/66	2066-07-14
5335	DATE	5438	5445	14/7/66	2066-07-14
5335	DEPARTMENT	193	203	Immunology
5335	DOCTOR	207	224	DECLAN Petropulos
5335	DOCTOR	257	262	Leroy
5335	DOCTOR	2771	2781	H. Willits
5335	DOCTOR	5255	5269	Sarge Bellaire
5335	DOCTOR	5261	5269	Bellaire
5335	TIME	5271	5278	12/7/66	2066-12-07
5335	DOCTOR	581	593	H. Villatora
5335	IDNUM	14	24	26M9240849
5335	IDNUM	67	75	26M92408
5335	MEDICALRECORD	25	36	2649240.XMZ
5335	PATIENT	38	56	Dandridge, OCTAVIO
5335	PATIENT	76	82	Mcendy
5335	STATE	98	101	TAS
5335	TIME	162	172	19/08/2064	2064-08-19T10:30
5335	ZIP	103	107	2578
5338	DATE	5854	5863	28/6/2066	2066-06-28
5338	DATE	6481	6489	4/7/2066	2066-07-04
5338	DOCTOR	1032	1042	F Strotman
5338	DOCTOR	1046	1061	TYRONE LINDWALL
5338	TIME	1065	1085	10.45hrs on 23.06.66	2066-06-23
5338	DOCTOR	2768	2779	F Burzynski
5338	IDNUM	18	28	11N3652522
5338	IDNUM	49	57	11N36525
5338	IDNUM	58	66	11N36525
5341	CITY	203	208	Perth
5341	CITY	88	95	KEMPSEY
5341	STATE	97	100	VIC
5341	ZIP	102	106	3870
5341	DATE	132	140	8/5/2000	2000-08-05
5341	DATE	160	170	11/11/2064	2064-11-11
5341	DATE	2356	2364	11.12.64	2064-11-12
5341	DOCTOR	233	252	SHAD ISIAH Sperduti
5341	DOCTOR	2399	2410	T Dirickson
5341	DOCTOR	3639	3645	Waylon
5341	TIME	3649	3657	18/11/64	2064-11-18T18:00
5341	IDNUM	14	24	79J385300O
5341	IDNUM	64	72	79J38530
5341	MEDICALRECORD	25	36	7933853.CCO
5341	PATIENT	38	53	FUGLSANG, LOGAN
5341	STATE	191	194	ACT
5341	STATE	97	100	VIC
5341	STREET	73	87	South Railroad
5341	ZIP	102	106	3870
5342	CITY	225	230	Young
5342	CITY	80	88	BALLARAT
5342	STATE	90	92	WA
5342	ZIP	94	98	4472
5342	CITY	80	88	BALLARAT
5342	DATE	124	133	21/2/1996	1996-02-21
5342	DATE	153	163	26/12/2064	2064-12-26
5342	DEPARTMENT	184	194	Immunology
5342	HOSPITAL	195	213	KATANNING HOSPITAL
5342	DOCTOR	1887	1889	ML
5342	DATE	1897	1905	29.12.64	2064-12-29
5342	DOCTOR	1938	1946	D Toepke
5342	DOCTOR	217	237	Darrick Young NEYMAN
5342	IDNUM	13	23	11S687117K
5342	IDNUM	63	71	11S68711
5342	MEDICALRECORD	24	35	1176871.ETK
5342	PATIENT	37	52	Carnalla, Zelie
5342	PATIENT	72	79	Eldrige
5342	STATE	90	92	WA
5342	ZIP	94	98	4472
5343	DATE	115	124	30.3.2066	2066-03-30
5343	DATE	2687	2694	19.1.66	2066-01-19
5343	DATE	48	57	30/3/2066	2066-03-30
5343	DATE	7251	7260	30.3.2066	2066-03-30
5343	DOCTOR	2724	2732	B Algien
5343	DOCTOR	7178	7189	B Clayborne
5343	DATE	7193	7200	22.1.66	2066-01-22
5343	DOCTOR	7265	7273	B Jedrey
5343	IDNUM	24	32	05T03837
5343	MEDICALRECORD	1	12	0570383.UOQ
5343	PATIENT	13	23	Laos, Raya
5344	CITY	224	233	NEWCASTLE
5344	CITY	88	95	NAROOMA
5344	STATE	97	100	TAS
5344	ZIP	102	106	6558
5344	DATE	132	141	2/11/1992	1992-11-02
5344	DATE	160	168	2/6/2066	2066-06-02
5344	DATE	3225	3233	2 9.2066	2066-02-09
5344	DEPARTMENT	185	196	ACT Genetic
5344	DOCTOR	244	268	Zachery CLAY LUECKENOTTE
5344	DOCTOR	287	302	FERNANDO RESPES
5344	DOCTOR	3268	3279	P Buczynski
5344	DOCTOR	3285	3295	P Brasseux
5344	DOCTOR	7415	7421	Bennie
5344	DOCTOR	822	832	P Yurkanin
5344	DOCTOR	839	851	P Currington
5344	TIME	855	875	1350pm on 02/06/2066	2066-06-02T13:50
5344	IDNUM	14	24	63P058433Z
5344	IDNUM	68	76	63P05843
5344	MEDICALRECORD	25	36	6350584.JJZ
5344	PATIENT	38	59	SCHOMAS, Maximo-BRENT
5344	PATIENT	4918	4928	Suspicious
5344	STATE	185	188	ACT
5344	STATE	97	100	TAS
5344	STREET	77	87	Crowe Farm
5344	ZIP	102	106	6558
5345	CITY	207	216	MILLICENT
5345	CITY	83	96	COFFS HARBOUR
5345	STATE	98	101	TAS
5345	ZIP	103	107	2144
5345	CITY	83	96	COFFS HARBOUR
5345	DATE	133	142	9/11/2012	2012-11-09
5345	DATE	1600	1607	16.5.66	2066-05-16
5345	DATE	162	172	13/05/2066	2066-05-13
5345	DEPARTMENT	193	206	MACQUARIEWARD
5345	HOSPITAL	193	206	MACQUARIEWARD
5345	DOCTOR	1637	1645	Z Harber
5345	DOCTOR	262	288	BAILEY DWIGHT Keliipaakaua
5345	DOCTOR	307	313	NATHAN
5345	DOCTOR	4072	4080	Z Rusche
5345	IDNUM	13	23	95Y350140V
5345	IDNUM	63	71	95Y35014
5345	MEDICALRECORD	24	34	959350.FMB
5345	PATIENT	36	42	Morein
5345	STATE	98	101	TAS
5345	STREET	72	82	Back Broom
5345	ZIP	103	107	2144
5346	CITY	77	89	MURWILLUMBAH
5346	STATE	91	94	TAS
5346	CITY	77	89	MURWILLUMBAH
5346	DATE	126	136	13/11/1997	1997-11-13
5346	DATE	1889	1896	16.5.66	2066-05-16
5346	DATE	897	904	16.5.66	2066-05-16
5346	DEPARTMENT	187	216	Douglass Hanly Moir Pathology
5346	HOSPITAL	217	258	MALLEE TRACK HEALTH AND COMMUNITY SERVICE
5346	DOCTOR	1930	1943	X Southerland
5346	DOCTOR	1951	1963	X Kuczkowski
5346	DOCTOR	262	278	TROY Kory GIGNAC
5346	DOCTOR	297	313	MARGARITO BURELL
5346	DOCTOR	3533	3544	X Pamintuan
5346	IDNUM	13	23	90Z791408B
5346	IDNUM	62	70	90Z79140
5346	MEDICALRECORD	24	35	9097914.CVB
5346	PATIENT	37	51	Looney, LATINA
5346	PATIENT	71	76	Ceder
5346	STATE	91	94	TAS
5346	TIME	156	175	13/05/2066 at 12:22	2066-05-13T12:22
5346	ZIP	96	100	2321
5347	CITY	77	86	BUNDABERG
5347	STATE	88	96	Victoria
5347	ZIP	98	102	7008
5347	CITY	77	86	BUNDABERG
5347	DATE	128	137	21/2/1994	1994-02-21
5347	DATE	157	167	20/05/2066	2066-05-20
5347	DATE	2964	2971	23/5/66	2066-05-23
5347	DEPARTMENT	188	196	Southern
5347	HOSPITAL	197	218	WONGAN HILLS HOSPITAL
5347	DOCTOR	222	243	ASA DARCY Braithwaite
5347	DOCTOR	262	277	JOSH FREIERMUTH
5347	DOCTOR	3125	3132	Y Benny
5347	DOCTOR	3140	3151	Y Langfield
5347	IDNUM	13	23	95D5730150
5347	IDNUM	61	69	95D57301
5347	MEDICALRECORD	24	35	9515730.ENA
5347	PATIENT	37	50	SABEAN, Bryan
5347	STATE	88	96	Victoria
5347	STREET	70	76	Keymar
5347	ZIP	98	102	7008
5348	DATE	53	61	6/9/2066	2066-06-09
5348	DOCTOR	955	964	W Fortino
5348	IDNUM	29	37	80E01327
5348	MEDICALRECORD	1	12	8010132.TIG
5348	PATIENT	13	28	Adelson, MARCOS
5348	TIME	251	261	06.03.2066	2066-03-06T11:00
5349	CITY	89	97	WARRAGUL
5349	STATE	99	101	NT
5349	ZIP	103	107	3487
5349	CITY	89	97	WARRAGUL
5349	DATE	133	141	9/7/2009	2009-07-09
5349	DATE	161	171	19/12/2061	2061-12-19
5349	DATE	801	809	20.12.61	2061-12-20
5349	DEPARTMENT	192	195	ACT
5349	HOSPITAL	198	213	MALDON HOSPITAL
5349	DOCTOR	217	237	MONTY Booker Hassell
5349	DOCTOR	2957	2965	ELECTRON
5349	DATE	2990	2997	10/1/62	2062-10-01
5349	DOCTOR	839	849	G Lagerman
5349	DURATION	496	508	New onset HT	2063-01-04
5349	HOSPITAL	496	508	New onset HT
5349	TIME	496	513	New onset HT 1 wk	2063-01-04
5349	IDNUM	13	23	22M215089D
5349	IDNUM	62	70	22M21508
5349	IDNUM	71	79	22M21508
5349	MEDICALRECORD	24	35	2242150.WZD
5349	PATIENT	37	51	GARGUILO, Aldo
5349	STATE	192	195	ACT
5349	STATE	219	221	NT
5349	STATE	2347	2349	NT
5349	STATE	99	101	NT
5349	STREET	80	88	Trawalla
5349	ZIP	103	107	3487
5351	CITY	84	93	TRARALGON
5351	STATE	95	98	VIC
5351	ZIP	100	104	2901
5351	CITY	84	93	TRARALGON
5351	DATE	139	148	16/5/2002	2002-05-16
5351	DATE	375	386	19-Jul-2066	2066-Jul-2066
5351	DATE	4821	4832	19-Jul-2066	2066-Jul-2066
5351	DEPARTMENT	199	237	CLONCURRY MULTI-PURPOSE HEALTH SERVICE
5351	DOCTOR	241	257	Wilber MCCLEAREN
5351	DOCTOR	276	283	Agustin
5351	DOCTOR	2763	2769	U Tuia
5351	IDNUM	13	23	80J336048L
5351	IDNUM	60	68	80J33604
5351	IDNUM	69	77	80J33604
5351	MEDICALRECORD	24	34	803336.CLV
5351	PATIENT	36	49	DAMIAN, Romeo
5351	STATE	233	236	VIC
5351	STATE	95	98	VIC
5351	STREET	78	83	Voltz
5351	TIME	168	178	03/03/2066	2066-03-03
5351	ZIP	100	104	2901
5352	DATE	4649	4656	30/6/66	2066-06-30
5352	DOCTOR	1056	1062	Archie
5352	DOCTOR	1069	1076	S Krach
5352	TIME	1080	1098	4:42pm on 28/06/66	66-06-28
5352	DOCTOR	4689	4697	S Bierod
5352	DOCTOR	592	605	S Bartholemew
5352	DOCTOR	623	638	HOWARD Adkisson
5352	DOCTOR	649	661	S Villarrvel
5352	TIME	665	683	2:30pm on 28/06/66	2066-06-28
5353	DATE	5721	5730	25/7/2066	2066-07-25
5353	DOCTOR	3888	3896	C Fricke
5353	IDNUM	1	9	17S98811
5353	IDNUM	11	19	17S98811
5353	IDNUM	11	21	17S988112O
5353	PATIENT	23	36	KISTO, Barney
5357	DATE	48	57	27/1/2065	2065-01-27
5357	DATE	964	971	23.1.65	2065-01-23
5357	DOCTOR	1001	1010	R Koizumi
5357	IDNUM	24	32	64O00917
5357	MEDICALRECORD	1	12	6450091.TCW
5357	PATIENT	13	23	Dural, Ira
5358	CITY	100	109	GERALDTON
5358	STATE	111	113	NT
5358	ZIP	113	117	7182
5358	DATE	152	162	30/11/2026	2026-11-30
5358	DATE	1638	1645	15.7.65	2065-07-15
5358	DATE	181	190	14/7/2065	2065-07-14
5358	DEPARTMENT	207	218	ACT Genetic
5358	HOSPITAL	219	235	BELMONT HOSPITAL
5358	DOCTOR	1678	1689	O Montpetit
5358	DOCTOR	239	259	ANTOINE MILLARD DAGG
5358	DOCTOR	1018	1028	O Swanigan
5358	DOCTOR	1035	1045	O Howerter
5358	DOCTOR	1046	1055	O Hunstad
5358	TIME	1059	1077	2.25pm on 14.07.65	2066-07-14T14:25
5358	IDNUM	13	23	59P440338C
5358	IDNUM	69	77	59P44033
5358	IDNUM	78	86	59P44033
5358	MEDICALRECORD	24	35	5964403.JWC
5358	PATIENT	37	58	Vieweg, MATTHEW Edwin
5358	STATE	207	210	ACT
5358	STREET	87	99	Pingree Farm
5359	CITY	201	206	YOUNG
5359	CITY	79	86	YANCHEP
5359	STATE	88	96	Tasmania
5359	ZIP	98	102	1490
5359	DATE	128	136	7/8/2018	2018-08-07
5359	DATE	156	165	22/7/2065	2065-07-22
5359	DATE	1577	1584	23.7.65	2065-07-23
5359	DEPARTMENT	182	199	ST GEORGE PRIVATE
5359	HOSPITAL	201	224	YOUNG DISTRICT HOSPITAL
5359	DOCTOR	1613	1622	Y Shumsky
5359	DOCTOR	228	245	Ross BUFORD Dancy
5359	DOCTOR	264	271	Aurelio
5359	IDNUM	14	24	17M470496L
5359	IDNUM	62	70	17M47049
5359	MEDICALRECORD	25	36	1744704.YSL
5359	PATIENT	38	51	KRULIK, Andre
5359	PATIENT	71	78	N Allen
5359	STATE	88	96	Tasmania
5359	ZIP	98	102	1490
5360	DATE	59	69	23/10/2065	2065-10-23
5360	DATE	835	843	21.10.65	2065-10-21
5360	DOCTOR	1524	1532	N. Leona
5360	TIME	1536	1553	15:15 on 23/10/65	2065-10-23
5360	DOCTOR	873	880	N Armel
5360	IDNUM	35	43	59U77220
5360	MEDICALRECORD	1	12	5987722.AJI
5360	PATIENT	13	34	CERMAK, EARNEST Devin
5361	CITY	101	109	HAHNDORF
5361	STATE	111	114	VIC
5361	ZIP	116	120	6007
5361	CITY	101	109	HAHNDORF
5361	CITY	87	94	Oakdale
5361	DATE	155	164	20/8/1981	1981-08-20
5361	DATE	184	194	28/10/2065	2065-10-28
5361	DATE	2618	2626	29/10/65	2065-10-29
5361	DATE	2979	2987	30.10.65	2065-10-30
5361	DATE	3323	3331	29.10.65	2065-10-29
5361	DEPARTMENT	211	224	EAST SURGICAL
5361	HOSPITAL	227	245	PEMBERTON HOSPITAL
5361	DOCTOR	249	272	ELLSWORTH HAYDEN KLEBES
5361	DOCTOR	3361	3369	L Chioma
5361	IDNUM	14	24	44V113461O
5361	IDNUM	69	77	44V11346
5361	IDNUM	78	86	44V11346
5361	MEDICALRECORD	25	36	4481134.QEO
5361	PATIENT	38	58	CAROLIN, Belkis Lucy
5361	STATE	111	114	VIC
5361	STREET	87	100	Oakdale Ranch
5361	ZIP	116	120	6007
5362	CITY	240	247	STAWELL
5362	CITY	89	106	KURRAJONG HEIGHTS
5362	STATE	108	126	Northern Territory
5362	ZIP	128	132	4858
5362	CITY	89	106	KURRAJONG HEIGHTS
5362	DATE	167	176	21/1/1998	1998-01-21
5362	DATE	196	206	24/11/2065	2065-11-24
5362	DATE	3121	3129	25/11/65	2065-11-25
5362	DEPARTMENT	227	237	Immunology
5362	HOSPITAL	240	263	STAWELL REGIONAL HEALTH
5362	DOCTOR	267	287	Jimmy Booker Logarbo
5362	DOCTOR	3166	3175	L Bierner
5362	IDNUM	13	23	49Z995078N
5362	IDNUM	60	68	49Z99507
5362	IDNUM	69	77	49Z99507
5362	MEDICALRECORD	24	35	4999950.SWN
5362	PATIENT	37	49	Snaer, Tyson
5362	STATE	108	126	Northern Territory
5362	STREET	78	88	Longcommon
5362	ZIP	128	132	4858
5363	CITY	98	105	YANCHEP
5363	STATE	107	117	Queensland
5363	ZIP	119	123	4610
5363	DATE	155	164	19/4/2009	2009-04-19
5363	DATE	184	194	02/12/2065	2065-12-02
5363	DATE	2283	2290	3.12.65	2065-03-12
5363	DATE	3001	3008	8/12/65	2065-12-08
5363	DEPARTMENT	215	233	105 HAMRUN CIRCUIT
5363	HOSPITAL	236	273	WEST WIMMERA HEALTH SERVICE - JEPARIT
5363	DOCTOR	2320	2330	J. Vallone
5363	DOCTOR	277	295	Kenny ARLEN GEMMER
5363	IDNUM	13	23	34A435236T
5363	IDNUM	72	80	34A43523
5363	IDNUM	81	89	34A43523
5363	MEDICALRECORD	24	35	3404352.IQT
5363	PATIENT	37	61	Everet, Stanford JACELYN
5363	STATE	107	117	Queensland
5363	STREET	90	97	S Kings
5363	ZIP	119	123	4610
5364	CITY	96	107	WARRNAMBOOL
5364	STATE	109	112	TAS
5364	ZIP	114	118	4388
5364	CITY	96	107	WARRNAMBOOL
5364	DATE	156	165	18/2/2007	2007-02-18
5364	DATE	185	195	14/12/2065	2065-12-14
5364	DATE	1878	1886	15.12.65	2065-12-15
5364	DEPARTMENT	212	235	Molecular Oncology Unit
5364	HOSPITAL	238	253	WONDAI HOSPITAL
5364	DOCTOR	1973	1987	Lamar RACIOPPI
5364	DOCTOR	1994	2003	T Mahabir
5364	TIME	2007	2027	1:48pm on 14.12.2065	2065-12-14T11:48
5364	DOCTOR	2057	2066	T Beerman
5364	DOCTOR	2074	2085	T Sinibaldi
5364	DOCTOR	257	277	MORRIS STACY Toliver
5364	DOCTOR	421	434	T Springfield
5364	IDNUM	14	24	76J637043P
5364	IDNUM	71	79	76J63704
5364	IDNUM	80	88	76J63704
5364	MEDICALRECORD	25	36	7636370.LIP
5364	PATIENT	38	60	Spillers, JULES Joeann
5364	PATIENT	89	95	Bourke
5364	STATE	109	112	TAS
5364	ZIP	114	118	4388
5364	ZIP	472	476	2062
5365	DATE	1576	1584	6/9/2066	2066-06-06
5365	DATE	59	68	6/10/2066	2066-10-06
5365	DOCTOR	959	967	R Keegan
5365	IDNUM	35	43	61K17830
5365	MEDICALRECORD	1	12	6141783.ACV
5365	PATIENT	13	34	GIL, TRISTAN GARFIELD
5366	DATE	2950	2957	20/7/66	2066-07-20
5366	DOCTOR	2988	2995	F Verma
5368	CITY	236	241	Young
5368	CITY	88	97	MELBOURNE
5368	STATE	99	101	SA
5368	ZIP	103	107	2410
5368	CITY	88	97	MELBOURNE
5368	DATE	142	151	15/3/2020	2020-03-15
5368	DATE	171	181	27/04/2066	2066-04-27
5368	DEPARTMENT	202	232	BARADINE MULTI PURPOSE SERVICE
5368	DOCTOR	236	247	Young Brann
5368	DOCTOR	4298	4306	Q Buzzeo
5368	DOCTOR	780	789	Q Bethell
5368	DOCTOR	806	812	Marion
5368	TIME	816	826	27.04.2066	2066-04-27T15:42
5368	IDNUM	14	24	60P300175A
5368	IDNUM	61	69	60P30017
5368	IDNUM	70	78	60P30017
5368	MEDICALRECORD	25	35	605300.DSP
5368	PATIENT	37	50	MUNEY, MARION
5368	PATIENT	79	87	Oglander
5368	STATE	99	101	SA
5368	ZIP	103	107	2410
5369	CITY	91	100	TRARALGON
5369	STATE	102	105	QLD
5369	ZIP	107	111	2714
5369	CITY	91	100	TRARALGON
5369	DATE	143	152	21/4/2029	2029-04-21
5369	DEPARTMENT	203	217	ANTENATAL WARD
5369	HOSPITAL	218	238	GNOWANGERUP HOSPITAL
5369	DOCTOR	238	252	RON KISHA RUST
5369	DOCTOR	880	888	N Zajdel
5369	IDNUM	13	23	18L4211243
5369	IDNUM	61	69	18L42112
5369	IDNUM	70	78	18L42112
5369	MEDICALRECORD	24	35	1844211.HKJ
5369	PATIENT	37	50	CANAN, OLIVER
5369	STATE	102	105	QLD
5369	STREET	79	90	Blanchfield
5369	TIME	172	182	05/02/2066	2066-02-05T10:47
5369	ZIP	107	111	2714
5370	CITY	235	242	LITHGOW
5370	CITY	99	108	WAHGUNYAH
5370	STATE	110	112	SA
5370	ZIP	114	118	3701
5370	CITY	99	108	WAHGUNYAH
5370	DATE	153	162	30/4/2018	2018-04-30
5370	DATE	182	192	30/12/2065	2065-12-30
5370	DATE	2231	2238	1.13.65	2065-01-13
5370	DEPARTMENT	213	232	PERI-OPERATIVE UNIT
5370	HOSPITAL	235	251	LITHGOW HOSPITAL
5370	DOCTOR	2260	2268	C Sawney
5370	DOCTOR	255	267	Herman Hauge
5370	IDNUM	14	24	03M861482P
5370	IDNUM	74	82	03M86148
5370	IDNUM	83	91	03M86148
5370	MEDICALRECORD	25	36	0348614.XFP
5370	PATIENT	38	63	ALTRINGER, Jessie Charlie
5370	PATIENT	92	98	Kennet
5370	STATE	110	112	SA
5370	ZIP	114	118	3701
5371	CITY	2489	2495	CAMDEN
5371	DATE	1301	1309	25.12.65	2065-12-25
5371	DATE	53	62	19/2/2066	2066-02-19
5371	DATE	93	100	11/2/66	2066-11-02
5371	DOCTOR	1339	1348	M Liechti
5371	DOCTOR	2450	2463	LUCIO MERRION
5371	DOCTOR	4163	4170	Wilburn
5371	DOCTOR	4192	4204	Deon EVANICH
5371	DOCTOR	4240	4249	Orsa Myra
5371	TIME	4250	4265	15/01/66 4:33pm	2066-01-15
5371	DATE	4250	4258	15/01/66	2066-01-15
5371	HOSPITAL	2464	2486	Southern IML Pathology
5371	DATE	2518	2525	11/2/66	2066-11-11
5371	IDNUM	29	37	45V16320
5371	MEDICALRECORD	1	12	4581632.AWL
5371	PATIENT	23	28	Jarod
5371	STATE	2415	2417	NT
5371	STATE	260	262	NT
5371	STATE	80	82	NT
5372	CITY	214	223	BALRANALD
5372	CITY	84	100	SHOALHAVEN HEADS
5372	STATE	102	104	WA
5372	ZIP	106	110	5576
5372	CITY	84	100	SHOALHAVEN HEADS
5372	DATE	136	146	13/12/1974	1974-12-13
5372	DATE	166	174	5/2/2066	2066-02-05
5372	DEPARTMENT	191	213	POSTOPERATIVE RECOVERY
5372	HOSPITAL	214	245	BALRANALD MULTI PURPOSE SERVICE
5372	DOCTOR	2007	2016	K Convery
5372	DOCTOR	249	262	WILBERT Bryce
5372	IDNUM	13	23	30W514466R
5372	IDNUM	65	73	30W51446
5372	MEDICALRECORD	24	35	3085144.PRR
5372	PATIENT	37	54	Nyswonger, Israel
5372	STATE	102	104	WA
5372	STREET	74	83	East Port
5372	ZIP	106	110	5576
5373	CITY	89	99	CRANBOURNE
5373	STATE	101	116	New South Wales
5373	ZIP	118	122	4727
5373	DATE	154	163	11/5/1996	1996-11-05
5373	DATE	2110	2117	26.5.66	2066-05-26
5373	DATE	2184	2191	23.5.66	2066-05-23
5373	DATE	346	353	26.5.66	2066-05-26
5373	DATE	893	900	18.5.66	2066-05-18
5373	DEPARTMENT	214	225	ACT Genetic
5373	HOSPITAL	228	251	SCOTT MEMORIAL HOSPITAL
5373	DOCTOR	255	275	Maynard JAMAAL Jacka
5373	DOCTOR	997	1008	Y Lochotzki
5373	IDNUM	14	24	98S534414A
5373	IDNUM	63	71	98S53441
5373	IDNUM	72	80	98S53441
5373	MEDICALRECORD	25	36	9875344.EMA
5373	PATIENT	38	52	SOMAYOR, Jamal
5373	STATE	101	116	New South Wales
5373	STATE	214	217	ACT
5373	TIME	183	202	17/05/2066 at 12:38	2066-05-17T12:38
5373	ZIP	118	122	4727
5374	DATE	1425	1432	22/6/66	2066-06-22
5374	DOCTOR	1467	1475	I Aquero
5375	CITY	86	93	GEELONG
5375	STATE	95	97	SA
5375	ZIP	99	103	4067
5375	DATE	129	137	3/3/2010	2010-03-03
5375	DATE	157	166	18/2/2066	2066-02-18
5375	DATE	1960	1967	19.2.66	2066-02-19
5375	DEPARTMENT	183	205	POSTOPERATIVE RECOVERY
5375	HOSPITAL	206	224	MONA VALE HOSPITAL
5375	DOCTOR	1997	2006	G Kulesza
5375	DOCTOR	2022	2029	G Iller
5375	DOCTOR	228	244	Edwin LUCIO SEPE
5375	IDNUM	13	23	25C277499C
5375	IDNUM	64	72	25C27749
5375	MEDICALRECORD	24	35	2502774.XYC
5375	PATIENT	37	53	LEPERA, Guy Ross
5375	STATE	95	97	SA
5375	STREET	2565	2572	Pleural
5375	STREET	73	85	West Foxwood
5375	ZIP	99	103	4067
5376	DATE	1232	1239	16.3.66	2066-03-16
5376	DATE	72	81	21/3/2066	2066-03-21
5376	DOCTOR	1269	1277	H Rauelo
5376	IDNUM	39	47	20G05919
5376	IDNUM	48	56	20G05919
5376	MEDICALRECORD	2	12	202059.CZQ
5376	PATIENT	13	38	BROFFT, Ezra, Berry'MICAH
5377	DATE	1069	1076	20.3.66	2066-03-20
5377	DATE	60	69	22/3/2066	2066-03-22
5377	DOCTOR	1078	1087	E Wilting
5377	IDNUM	36	44	14H59935
5377	MEDICALRECORD	1	12	1425993.PLH
5377	PATIENT	13	35	Keppers, CAPRICE Kelly
5377	ZIP	1813	1817	2010
5378	CITY	79	92	VICTOR HARBOR
5378	STATE	94	102	Tasmania
5378	ZIP	104	108	2089
5378	DATE	134	142	9/5/2006	2006-09-05
5378	DATE	162	171	19/2/2066	2066-02-19
5378	DATE	1776	1783	20.2.66	2066-02-20
5378	DEPARTMENT	188	210	Southern IML Pathology
5378	HOSPITAL	211	233	GOVE DISTRICT HOSPITAL
5378	DOCTOR	1813	1824	T Schnelzer
5378	DOCTOR	237	259	JABANI TRUDIE Gladding
5378	DOCTOR	4115	4125	T Skilling
5378	DOCTOR	774	782	T Lerner
5378	DOCTOR	789	799	T Alatorre
5378	TIME	803	820	13:30 on 19.02.66	2066-02-19T13:30
5378	IDNUM	13	23	72D510312Q
5378	IDNUM	61	69	72D51031
5378	MEDICALRECORD	24	35	7215103.EGQ
5378	ORGANIZATION	3273	3277	Toys
5378	HOSPITAL	3286	3303	MORANBAH HOSPITAL
5378	PATIENT	37	50	Valerius, Tom
5378	STATE	94	102	Tasmania
5378	STREET	70	78	New Pond
5378	ZIP	104	108	2089
5380	DATE	1731	1738	20.7.66	2066-07-20
5380	DOCTOR	1771	1780	D Deiters
5380	ZIP	11	15	2063
5380	ZIP	85	89	2066
5381	DATE	24	31	25.7.66	2066-07-25
5381	DATE	4261	4268	19/7/66	2066-07-19
5381	DATE	51	58	25.7.66	2066-07-25
5381	DATE	7055	7062	25.7.66	2066-07-25
5381	DATE	7355	7362	25.7.66	2066-07-25
5381	DOCTOR	4300	4307	B Kempe
5381	DOCTOR	480	487	Aurelio
5381	DOCTOR	509	516	B Tools
5381	DOCTOR	524	531	B Talas
5381	TIME	535	552	12:05 on 18/07/66	2066-07-18T12:05
5383	CITY	80	95	NORTH WONTHAGGI
5383	STATE	97	100	QLD
5383	ZIP	102	106	6951
5383	CITY	80	95	NORTH WONTHAGGI
5383	DATE	132	140	6/6/2004	2004-06-06
5383	DATE	160	168	2/2/2066	2066-02-02
5383	DEPARTMENT	184	206	Southern IML Pathology
5383	HOSPITAL	207	228	WONGAN HILLS HOSPITAL
5383	DOCTOR	232	265	Aletha Tarsha Anton-Vonbraunsberg
5383	DOCTOR	2432	2441	L Wehling
5383	DOCTOR	4316	4322	Nathan
5383	DOCTOR	4961	4974	Edwin Skillan
5383	DOCTOR	831	840	L Abshear
5383	TIME	844	865	16:45pm on 02.02.2066	2066-02-02T16:45
5383	IDNUM	14	24	41V464193P
5383	IDNUM	63	71	41V46419
5383	MEDICALRECORD	25	35	418464.EZK
5383	ORGANIZATION	3531	3541	Yahoo! Inc
5383	HOSPITAL	3543	3567	WILCANNIA HEALTH SERVICE
5383	PATIENT	37	52	Mandigo, Shelly
5383	STATE	97	100	QLD
5383	STREET	72	79	Hopwood
5383	ZIP	102	106	6951
5384	CITY	92	102	TURA BEACH
5384	STATE	104	112	Victoria
5384	ZIP	114	118	6942
5384	DATE	150	158	3/7/2006	2006-03-07
5384	DATE	178	188	30/11/2065	2065-11-30
5384	DATE	2320	2327	12.1.65	2065-12-01
5384	DEPARTMENT	205	220	ENVOI Pathology
5384	HOSPITAL	223	272	EASTERN EYRE HEALTH AND AGED CARE - COWELL CAMPUS
5384	DOCTOR	2357	2364	Z Kesek
5384	DOCTOR	276	296	Stanford EZRA SPICER
5384	IDNUM	13	23	99R585251X
5384	IDNUM	59	67	99R58525
5384	IDNUM	68	76	99R58525
5384	MEDICALRECORD	24	35	9965852.OFX
5384	PATIENT	37	48	Foti, Cohen
5384	STATE	104	112	Victoria
5384	STREET	77	91	Samuel Marsden
5384	ZIP	114	118	6942
5385	DATE	344	351	12.8.65	2065-12-08
5385	DATE	67	77	12/10/2065	2065-10-12
5385	DOCTOR	382	390	X Treger
5385	IDNUM	34	42	94S92641
5385	IDNUM	43	51	94S92641
5385	MEDICALRECORD	1	12	9479264.EZD
5385	PATIENT	13	33	MCWHIRT, Ricky DAVID
5386	DATE	1235	1242	10.5.66	2066-10-05
5386	DATE	58	67	12/5/2066	2066-12-05
5386	DOCTOR	1272	1280	H Jacobs
5386	IDNUM	34	42	26B12722
5386	MEDICALRECORD	2	13	2601272.GRA
5386	PATIENT	14	33	Crain, JERAMY ELROY
5387	CITY	97	107	CANNONVALE
5387	STATE	109	111	WA
5387	ZIP	113	117	2025
5387	CITY	97	107	CANNONVALE
5387	DATE	149	157	8/3/2002	2002-08-03
5387	DATE	177	186	5/11/2066	2066-11-05
5387	DATE	2077	2084	5.12.66	2066-12-05
5387	DEPARTMENT	203	224	DOMAIN AGED CARE RM 2
5387	HOSPITAL	227	254	HENTY MULTI PURPOSE SERVICE
5387	DOCTOR	2114	2125	W Cavendish
5387	DOCTOR	258	282	Patricia MURRAY HERKLOTZ
5387	DOCTOR	846	855	W Trimmer
5387	DOCTOR	856	858	RO
5387	TIME	862	883	11:59am on 05.11.2066	2066-11-05T11:59
5387	IDNUM	13	23	84X258384I
5387	IDNUM	68	76	84X25838
5387	IDNUM	77	85	84X25838
5387	MEDICALRECORD	24	35	8492583.WMI
5387	PATIENT	37	57	MONSKE, Andy Millard
5387	STATE	109	111	WA
5387	STREET	86	96	Brook Park
5387	ZIP	113	117	2025
5389	CITY	76	82	BAXTER
5389	STATE	84	87	ACT
5389	ZIP	89	93	4029
5389	DATE	119	128	28/2/2031	2031-02-28
5389	DATE	148	158	18/08/2064	2064-08-18
5389	DATE	5775	5782	8/11/66	2066-11-08
5389	DEPARTMENT	179	196	DICKINSON 3 NORTH
5389	HOSPITAL	197	215	CHERBOURG HOSPITAL
5389	DOCTOR	219	244	FREDERICH Riley Wetherill
5389	DOCTOR	3394	3396	GN
5389	DATE	3401	3408	18.8.64	2064-08-18
5389	DOCTOR	3441	3449	T Miears
5389	DOCTOR	3465	3474	T Breznak
5389	DOCTOR	38	50	OZDA, Felton
5389	DOCTOR	6030	6048	BOOKER SCHICKEDANZ
5389	HOSPITAL	6062	6076	ARRIETTA CLOSE
5389	IDNUM	13	23	79Y699542O
5389	IDNUM	61	69	79Y69954
5389	MEDICALRECORD	24	34	799699.NLH
5389	PATIENT	70	75	Fonti
5389	STATE	84	87	ACT
5389	ZIP	89	93	4029
HSA0240	DATE	3400	3409	1/11/2063	2063-11-01
HSA0240	DOCTOR	1844	1846	FO
HSA0240	DATE	1850	1858	12/12/62	2062-12-12
HSA0240	DOCTOR	1892	1901	Q Sheltra
HSA0240	DOCTOR	760	770	ART Wheary
HSA0240	HOSPITAL	4380	4395	DYSART HOSPITAL
HSA0240	IDNUM	31	39	63Y80380
HSA0240	MEDICALRECORD	2	12	639803.VAH
HSA0240	PATIENT	14	29	Flegler, Beulah
HSA0246	CITY	4135	4143	COOKTOWN
HSA0246	DATE	4070	4077	3/13/62	2062-03-03
HSA0246	DATE	1728	1736	18/12/62	2062-12-18
HSA0246	DOCTOR	1769	1778	E Mccamey
HSA0246	DOCTOR	4103	4116	WANDJOO Keith
HSA0246	DOCTOR	4118	4133	Seals Pathology
HSA0246	HOSPITAL	3636	3652	MODBURY HOSPITAL
HSA0246	IDNUM	29	37	11V82496
HSA0246	MEDICALRECORD	1	11	118824.XPC
HSA0246	PATIENT	13	27	MENDEL, ASHLEY
HSA0258	DATE	2544	2553	11/9/2012	2012-09-11
HSA0258	DOCTOR	1392	1394	XK
HSA0258	DATE	1398	1406	25.12.62	2062-12-25
HSA0258	DOCTOR	1440	1447	P Swaim
HSA0258	IDNUM	27	35	53D12567
HSA0258	MEDICALRECORD	1	12	5311256.SUX
HSA0258	PATIENT	13	26	Dall, EDWARDO
HSA0259	DATE	2769	2778	11/1/2063	2063-11-11
HSA0259	DOCTOR	2213	2215	MF
HSA0259	DOCTOR	2217	2219	MA
HSA0259	DATE	2223	2231	24/12/62	2062-12-24
HSA0259	DOCTOR	2262	2269	D Butte
HSA0259	DOCTOR	3168	3179	D Cabriales
HSA0259	DOCTOR	4182	4192	D Gonzeles
HSA0259	DATE	4194	4203	3.13.2062	2062-03-13
HSA0259	DOCTOR	4352	4355	A12
HSA0259	DOCTOR	644	653	D Koerber
HSA0259	DOCTOR	660	668	D Monico
HSA0259	DOCTOR	672	679	D Robey
HSA0259	TIME	683	702	11.54am on 24/12/62	2062-12-24T11:54
HSA0259	IDNUM	2830	2838	11A14672
HSA0259	IDNUM	2839	2847	11A14672
HSA0259	IDNUM	37	45	11A14672
HSA0259	IDNUM	46	54	11A14672
HSA0259	MEDICALRECORD	1	12	1101467.HPG
HSA0259	MEDICALRECORD	2788	2799	1101467.HPG
HSA0259	PATIENT	13	36	MARENTES, RODNEY Jeneva
HSA0259	PATIENT	2800	2829	Koprowski, FLORENTINO ADELINE
HSA0289	DOCTOR	2309	2311	FE
HSA0289	DOCTOR	2313	2315	ZV
HSA0289	DATE	2319	2325	8.1.63	2063-01-08
HSA0289	DOCTOR	2358	2366	G Macura
HSA0289	IDNUM	29	37	27S29884
HSA0289	MEDICALRECORD	1	11	277298.WLF
HSA0289	PATIENT	12	28	SHENEMAN, Michel
HSA0590	CITY	4155	4163	COOKTOWN
HSA0590	DATE	54	62	7/4/2063	2063-04-07
HSA0590	DOCTOR	2707	2709	TP
HSA0590	DATE	2714	2721	27/3/63	2063-03-27
HSA0590	DOCTOR	2795	2807	E Broadwater
HSA0590	DOCTOR	4139	4153	HOWARD Edstrom
HSA0590	DOCTOR	4155	4172	COOKTOWN HOSPITAL
HSA0590	DOCTOR	6203	6215	MATHEW UPTON
HSA0590	DOCTOR	6223	6237	MIQUEL FOSDICK
HSA0590	DOCTOR	7059	7076	ELLSWORTH Vigario
HSA0590	IDNUM	29	37	12T63800
HSA0590	MEDICALRECORD	1	11	127638.CBA
HSA0590	PATIENT	13	27	Burwell, LYDIA
file18628	DATE	11389	11397	5/5/2068	2068-05-05
file18628	DEPARTMENT	11465	11469	2066
file18628	DOCTOR	1320	1325	Sonny
file18628	DOCTOR	1329	1331	EC
file18628	TIME	1335	1357	12:55hrs on 29/05/2068	2068-05-29T12:55
file18628	DOCTOR	5322	5324	MC
file18628	DOCTOR	5325	5327	EM
file18628	DOCTOR	6419	6428	U Cranmer
file18628	DOCTOR	793	794	U
file18628	DOCTOR	793	804	U. Moulinos
file18628	HOSPITAL	47	68	SHELLHARBOUR HOSPITAL
file18628	IDNUM	130	138	73C47115
file18628	IDNUM	140	148	73C47115
file18628	IDNUM	140	150	73C471159N
file18628	PATIENT	152	158	Isaiah
file18628	IDNUM	8	18	73C471159N
file18628	MEDICALRECORD	27	35	73147115
file18628	ZIP	11465	11469	2066
file18628	ZIP	782	786	2066
file22002	CITY	236	244	Longford
file22002	CITY	36	48	CAMPBELLTOWN
file22002	DATE	1006	1021	FR 1100 23/4/72	2072-04-23
file22002	DATE	12	20	20040318	2008-03-18
file22002	DATE	1588	1598	22.04.2072	2072-04-22
file22002	DATE	3879	3888	24/4/2072	2072-04-24
file22002	DATE	592	599	22/4/72	2072-04-22
file22002	DATE	6132	6141	28/4/2072	2072-04-28
file22002	DATE	863	870	24/4/72	2072-04-24
file22002	DOCTOR	1282	1292	S. Riddell
file22002	DOCTOR	3914	3923	S. Zonker
file22002	DOCTOR	626	629	Bud
file22002	DOCTOR	894	903	Guadalupe
file22002	HOSPITAL	275	312	CLERMONT MULTI-PURPOSE HEALTH SERVICE
file22002	HOSPITAL	36	57	CAMPBELLTOWN HOSPITAL
file22002	IDNUM	214	222	78D91131
file22002	IDNUM	224	232	78D91131
file22002	IDNUM	224	234	78D911317T
file22002	PATIENT	236	251	Longford, Graig
file22002	IDNUM	84	94	78D911317T
file22002	MEDICALRECORD	101	108	7819113
file22002	PATIENT	6202	6210	Williams
file22002	PATIENT	70	75	Jasko
file22002	TIME	6171	6190	2072-04-21 00:00:00	2072-04-21T00:00:00
file22002	ZIP	1009	1013	1100
file22002	ZIP	1602	1606	1720
file22002	ZIP	867	871	1005
file30867	DATE	1996	2004	29/10/68	2068-10-29
file30867	DATE	728	736	11/10/65	2065-11-11
file30867	DOCTOR	2036	2044	C Bonito
file30867	DOCTOR	4420	4430	C Humphers
file30867	HOSPITAL	47	86	CULCAIRN MULTI PURPOSE SERVICE HOSPITAL
file30867	IDNUM	8	18	00M113124Q
file30890	CITY	46	55	GLADSTONE
file30890	DATE	1146	1154	30/10/69	2069-10-30
file30890	DOCTOR	1187	1195	Q Nowlin
file30890	HOSPITAL	46	64	GLADSTONE HOSPITAL
file30890	IDNUM	8	18	68I134282Y
file30890	MEDICALRECORD	27	34	6831342
file30914	CITY	45	51	TEMORA
file30914	DATE	1342	1349	11/4/69	2069-11-04
file30914	DOCTOR	1381	1388	O Carls
file30914	HOSPITAL	45	60	TEMORA HOSPITAL
file30914	IDNUM	8	18	53J684440E
file30914	MEDICALRECORD	27	33	533684
file30951	DATE	2943	2950	11/1/66	2066-11-11
file30951	DOCTOR	2980	2988	Y Fernow
file30951	HOSPITAL	273	287	BULLI HOSPITAL
file30951	HOSPITAL	46	82	FLINDERS ISLAND MULTI PURPOSE CENTRE
file30951	IDNUM	3011	3019	95S88625
file30951	IDNUM	8	18	95S886257B
file30951	MEDICALRECORD	27	34	9568862
file30997	CITY	46	53	KYABRAM
file30997	DATE	161	169	10/10/69	2069-10-10
file30997	DATE	1795	1802	11/9/69	2069-11-09
file30997	DATE	2861	2869	11/10/69	2069-11-10
file30997	DOCTOR	1834	1842	N Gustis
file30997	HOSPITAL	46	80	KYABRAM & DISTRICT HEALTH SERVICES
file30997	IDNUM	8	18	53O907215K
file30997	MEDICALRECORD	27	34	5359072
file31047	DATE	179	189	17.11.2066	2066-11-17
file31047	DATE	1964	1971	9/11/69	2069-11-09
file31047	DATE	3384	3394	16.10.2065	2065-10-16
file31047	DOCTOR	2004	2016	K Bernadette
file31047	DOCTOR	3399	3410	K Rauhecker
file31047	HOSPITAL	46	79	KOOWEERUP REGIONAL HEALTH SERVICE
file31047	IDNUM	8	18	48P347573Q
file31047	MEDICALRECORD	27	34	4853475
file31088	DATE	956	963	11/9/69	2069-11-09
file31088	DOCTOR	996	1004	V Hamman
file31088	HOSPITAL	47	65	LIVERPOOL HOSPITAL
file31088	IDNUM	1464	1472	80Y54928
file31088	IDNUM	8	18	80Y549289M
file31088	MEDICALRECORD	27	35	80954928
file31154	DATE	155	164	11.1.2073	2073-01-11
file31154	DATE	3128	3136	10/11/66	2066-11-10
file31154	DOCTOR	3168	3179	J Vetterick
file31154	DOCTOR	4216	4225	J Bouvier
file31154	DATE	4226	4235	11.1.2071	2071-01-11
file31154	DOCTOR	4290	4299	J Tomsche
file31154	DOCTOR	991	996	Pargo
file31154	DOCTOR	1020	1030	J Braddock
file31154	TIME	1034	1055	10:00am on 07.10.2065	2065-10-07T10:00
file31154	HOSPITAL	46	70	SOUTH GIPPSLAND HOSPITAL
file31154	IDNUM	8	18	38U660338V
file31154	MEDICALRECORD	27	34	3876603
file31233	DATE	1796	1803	9/10/69	2069-10-09
file31233	DOCTOR	1835	1842	H Weder
file31233	HOSPITAL	46	80	GOWER WILSON MULTI PURPOSE SERVICE
file31233	IDNUM	8	18	22V011505B
file31233	MEDICALRECORD	27	34	2280115
file31261	DATE	795	803	14/10/68	2068-10-14
file31261	DOCTOR	835	844	I Norrick
file31261	HOSPITAL	47	80	KOOWEERUP REGIONAL HEALTH SERVICE
file31261	IDNUM	8	18	37Z883102A
file31261	MEDICALRECORD	27	35	37988310
file31319	DATE	2133	2141	16/10/68	2068-10-16
file31319	DOCTOR	195	203	F Kosier
file31319	DATE	205	215	18.10.2065	2065-10-18
file31319	DOCTOR	2174	2187	F Hollenshead
file31319	DOCTOR	4097	4106	F Atallah
file31319	DATE	4108	4118	19.10.2066	2066-10-19
file31319	HOSPITAL	46	82	ST VINCENT'S HOSPITAL (DARLINGHURST)
file31319	IDNUM	8	18	22A333460G
file31319	MEDICALRECORD	27	34	2203334
file31368	DATE	3337	3345	20/10/68	2068-10-20
file31368	DATE	602	612	19/11/2069	2069-11-19
file31368	DOCTOR	1080	1088	U Remsen
file31368	DOCTOR	1096	1109	U Raghunandan
file31368	TIME	1113	1131	2:50pm on 21/11/69	2069-11-21T14:50
file31368	DOCTOR	1490	1499	Holdbrook
file31368	DOCTOR	3377	3385	U Masell
file31368	DOCTOR	555	561	Outler
file31368	HOSPITAL	47	66	AUGATHELLA HOSPITAL
file31368	IDNUM	4312	4319	70W3544
file31368	IDNUM	8	18	70W354428O
file31368	MEDICALRECORD	27	35	70835442
file31397	DATE	1407	1415	25/11/66	2066-11-25
file31397	DOCTOR	1447	1453	E Rota
file31397	HOSPITAL	46	83	KYOGLE MEMORIAL MULTI PURPOSE SERVICE
file31397	IDNUM	2222	2230	12F55623
file31397	IDNUM	2235	2243	12F55623
file31397	IDNUM	8	18	12F556235L
file31397	MEDICALRECORD	27	34	1215562
file31429	DATE	2305	2313	28/10/68	2068-10-28
file31429	DOCTOR	2345	2353	S Hearin
file31429	HOSPITAL	46	67	MOYNE HEALTH SERVICES
file31429	IDNUM	8	18	70B6763937
file31429	MEDICALRECORD	27	34	7006763
file31516	DATE	1522	1529	11/1/68	2068-11-01
file31516	DOCTOR	1562	1571	Q Shenker
file31516	HOSPITAL	46	60	WAGIN HOSPITAL
file31516	IDNUM	8	18	65C0275519
file31516	MEDICALRECORD	27	34	6500275
file31516	ORGANIZATION	2647	2663	MED/SURGERY WARD
file31516	HOSPITAL	2665	2683	LIVERPOOL HOSPITAL
file31589	DATE	1595	1602	1/11/65	2065-11-01
file31589	DOCTOR	1634	1645	A Villicana
file31589	HOSPITAL	46	64	TUMBY BAY HOSPITAL
file31589	IDNUM	8	18	07K329368W
file31589	MEDICALRECORD	27	34	0743293
file31589	ORGANIZATION	2780	2790	Immunology
file31589	HOSPITAL	2792	2797	OAKEY
file31612	DATE	1413	1421	30/10/66	2066-10-30
file31612	DOCTOR	1451	1457	P Alim
file31612	HOSPITAL	46	75	CONCORD REPATRIATION HOSPITAL
file31612	IDNUM	8	18	55H340326E
file31612	MEDICALRECORD	27	34	5523403
file31612	ZIP	301	305	2055
file31634	DATE	1676	1684	30/10/68	2068-10-30
file31634	DOCTOR	1714	1722	M Rodell
file31634	HOSPITAL	46	76	BARADINE MULTI PURPOSE SERVICE
file31634	IDNUM	1745	1753	49I78058
file31634	IDNUM	8	18	49I780584K
file31634	MEDICALRECORD	27	34	4937805
file31696	DATE	173	180	14/2/67	2067-02-14
file31696	DATE	1869	1877	29/10/69	2069-10-29
file31696	DATE	4200	4207	15/1/69	2069-01-15
file31696	DOCTOR	1937	1945	P Gately
file31696	HOSPITAL	46	73	BROADMEADOWS HEALTH SERVICE
file31696	IDNUM	8	18	51I425252O
file31696	MEDICALRECORD	27	34	5134252
file31761	DATE	350	357	19/2/67	2067-02-19
file31761	DOCTOR	2551	2559	N Mccaie
file31761	HOSPITAL	46	73	BROADMEADOWS HEALTH SERVICE
file31761	IDNUM	8	18	54M662291J
file31761	MEDICALRECORD	27	34	5446622
file31793	DOCTOR	1431	1439	L Gaddie
file31793	DOCTOR	2233	2247	Saul Wekenmann
file31793	DOCTOR	2249	2266	ST GEORGE PRIVATE
file31793	HOSPITAL	46	71	MACLEAN DISTRICT HOSPITAL
file31793	IDNUM	2110	2118	49M00345
file31793	DATE	2098	2108	16/11/2069	2069-11-16
file31793	IDNUM	8	18	49M003459P
file31793	MEDICALRECORD	27	34	4940034
file31843	DATE	4273	4280	30/5/70	2070-05-30
file31843	DOCTOR	1033	1046	KIMIKO Fridal
file31843	DOCTOR	1062	1073	E Pettinger
file31843	TIME	1077	1084	5/12/67	2067-12-05
file31843	DOCTOR	3516	3522	C Emil
file31843	HOSPITAL	46	78	ST MARYS COMMUNITY HEALTH CENTRE
file31843	IDNUM	8	18	18A624365J
file31843	MEDICALRECORD	27	34	1806243
file31867	DOCTOR	1113	1123	T Maruscak
file31867	HOSPITAL	47	66	AUGATHELLA HOSPITAL
file31867	IDNUM	8	18	76W755424S
file31867	MEDICALRECORD	27	35	76875542
file31950	DATE	337	345	25/10/69	2069-10-25
file31950	DOCTOR	2479	2484	Tomas
file31950	DOCTOR	2506	2515	D Ferndez
file31950	TIME	2519	2536	11:10hrs 10/02/69	2066-02-11T11:10
file31950	DOCTOR	2568	2576	D Satava
file31950	HOSPITAL	46	84	BOOROWA MULTI PURPOSE SERVICE HOSPITAL
file31950	IDNUM	8	18	18F957230O
file31950	MEDICALRECORD	27	34	1829572
file32052	CITY	46	53	SEYMOUR
file32052	DATE	1985	1992	15/2/70	2070-02-15
file32052	DOCTOR	2069	2075	R Bali
file32052	DOCTOR	268	275	Thukeri
file32052	DOCTOR	836	842	Arthur
file32052	HOSPITAL	46	60	SEYMOUR HEALTH
file32052	IDNUM	8	18	66B978298X
file32052	MEDICALRECORD	27	34	6609782
file32132	CITY	79	86	KYNETON
file32132	DOCTOR	6045	6052	P Twigg
file32175	DATE	1266	1273	14/2/67	2067-02-14
file32175	DOCTOR	1305	1313	Z Hallum
file32175	HOSPITAL	46	63	MORANBAH HOSPITAL
file32175	IDNUM	8	18	93L610263Z
file32175	MEDICALRECORD	27	34	9346102
file32210	DATE	1772	1779	14/2/70	2070-02-14
file32210	DOCTOR	1811	1819	D Tenore
file32210	DOCTOR	314	327	VICTOR Lominy
file32210	HOSPITAL	46	61	MALDON HOSPITAL
file32210	IDNUM	8	18	19E546310W
file32210	MEDICALRECORD	27	34	1915463
file32231	DATE	2043	2050	16/2/67	2067-02-16
file32231	DOCTOR	2080	2090	X Lowthorp
file32231	HOSPITAL	47	62	WARREN HOSPITAL
file32231	IDNUM	8	18	88M160521F
file32231	MEDICALRECORD	27	35	88416052
file32372	DATE	2992	2999	17/2/67	2067-02-17
file32372	DOCTOR	3030	3039	L Lasalle
file32372	HOSPITAL	46	67	MOUNT DRUITT HOSPITAL
file32372	IDNUM	8	18	45I181589O
file32372	MEDICALRECORD	27	34	4531815
file32407	CITY	79	86	KYNETON
file32407	DATE	2228	2235	17/1/69	2069-01-17
file32407	DATE	449	458	27/9/2069	2069-09-27
file32407	DOCTOR	2267	2277	V Bengtson
file32407	DOCTOR	2301	2310	V Chaffer
file32407	DOCTOR	248	254	Anibal
file32407	HOSPITAL	46	86	CENTRAL HIGHLANDS RURAL HEALTH - KYNETON
file32407	IDNUM	8	18	87R383396K
file32407	MEDICALRECORD	27	34	8763833
file32460	DATE	2349	2356	18/2/70	2070-02-18
file32460	DOCTOR	2388	2396	K Locust
file32460	DOCTOR	787	794	K Dowey
file32460	DOCTOR	801	809	K Updyke
file32460	TIME	813	834	11:35am on 16.02.2070	2070-02-16T11:35
file32460	HOSPITAL	47	83	BATLOW/ADELONG MULTI PURPOSE SERVICE
file32460	IDNUM	8	18	35N404454T
file32460	MEDICALRECORD	27	35	35540445
file32480	CITY	78	84	ARARAT
file32480	DATE	1031	1038	23/1/67	2067-01-23
file32480	DOCTOR	1068	1075	I Blong
file32480	HOSPITAL	46	84	EAST GRAMPIANS HEALTH SERVICE - ARARAT
file32480	IDNUM	8	18	30O844612Z
file32480	MEDICALRECORD	27	34	3058446
file32525	DATE	1237	1244	18/2/66	2066-02-18
file32525	DOCTOR	1310	1320	S Wisinski
file32525	DOCTOR	1327	1337	S Tsiatsos
file32525	TIME	1341	1361	2:52pm on 17/02/2070	2070-02-17T14:52
file32525	DOCTOR	1394	1405	S Bertelsen
file32525	HOSPITAL	47	65	ESPERANCE HOSPITAL
file32525	IDNUM	8	18	72X146429V
file32525	MEDICALRECORD	27	35	72814642
file32561	DATE	1428	1435	22/2/66	2066-02-22
file32561	DOCTOR	1467	1479	G Weatherall
file32561	HOSPITAL	47	85	MONASH MEDICAL CENTRE - CLAYTON CAMPUS
file32561	IDNUM	8	18	20T1674771
file32561	MEDICALRECORD	27	35	20716747
file32598	CITY	46	54	CESSNOCK
file32598	DATE	2313	2320	23/2/67	2067-02-23
file32598	DATE	3307	3314	27/1/66	2066-01-27
file32598	DOCTOR	2350	2360	Q Glesener
file32598	HOSPITAL	46	72	CESSNOCK DISTRICT HOSPITAL
file32598	IDNUM	8	18	62B369283A
file32598	MEDICALRECORD	27	34	6203692
file32671	DATE	2745	2752	21/1/69	2069-01-21
file32671	DOCTOR	2782	2791	O Caneles
file32671	HOSPITAL	46	69	FLINDERS MEDICAL CENTRE
file32671	IDNUM	8	18	57C819451G
file32671	MEDICALRECORD	27	34	5718194
file32671	ORGANIZATION	3445	3456	UROLOGY OPD
file32671	HOSPITAL	3458	3482	WILCANNIA HEALTH SERVICE
file32722	DATE	1860	1867	29/1/70	2070-01-29
file32722	DOCTOR	1900	1910	C Camerena
file32722	HOSPITAL	47	64	BOX HILL HOSPITAL
file32722	IDNUM	8	18	15Z830500P
file32722	MEDICALRECORD	27	35	15983050
file32754	CITY	46	51	CLARE
file32754	DOCTOR	2368	2378	N Gilbreth
file32754	HOSPITAL	46	60	CLARE HOSPITAL
file32754	IDNUM	8	18	57H032316M
file32754	MEDICALRECORD	27	34	5730323
file32823	DATE	1889	1896	26/1/67	2067-01-26
file32823	DATE	4783	4790	7.12.69	2069-12-07
file32823	DOCTOR	2020	2025	Perry
file32823	DOCTOR	2032	2038	K Barz
file32823	TIME	2042	2060	5:19pm on 27/02/70	70-02-27T5:19
file32823	DOCTOR	2148	2157	Guadalupe
file32823	DOCTOR	2164	2173	K Morelos
file32823	TIME	2177	2195	5:49pm on 24/01/70	70-01-24T5:49
file32823	DOCTOR	2228	2236	K Sulcer
file32823	DOCTOR	4372	4377	Chong
file32823	HOSPITAL	46	69	SOUTHERN CROSS HOSPITAL
file32823	IDNUM	8	18	41I572574S
file32823	MEDICALRECORD	27	34	4135725
file32854	DATE	783	790	28/1/66	2066-01-28
file32854	DOCTOR	1388	1397	U Radwick
file32854	DOCTOR	823	833	U Isabelle
file32854	HOSPITAL	46	63	MITCHELL HOSPITAL
file32854	IDNUM	8	18	83R774381O
file32854	MEDICALRECORD	27	34	8367743
file32879	DOCTOR	1426	1433	S Tomka
file32879	HOSPITAL	46	62	QUILPIE HOSPITAL
file32879	IDNUM	8	18	78S225559U
file32879	MEDICALRECORD	27	34	7872255
file32986	CITY	45	53	PAKENHAM
file32986	DATE	150	157	5.12.69	2069-12-05
file32986	DATE	5494	5501	6.12.68	2068-12-06
file32986	DOCTOR	3337	3343	C Ucha
file32986	DOCTOR	634	648	C Easterbrooks
file32986	DOCTOR	655	665	C Montalgo
file32986	TIME	669	688	13:05hr on 27/02/70	2063-02-27T13:05
file32986	HOSPITAL	45	67	PAKENHAM HEALTH CENTRE
file32986	IDNUM	8	18	10B427366Q
file32986	MEDICALRECORD	27	33	100427
file33076	DATE	1891	1898	12/6/65	2065-06-12
file33076	DOCTOR	1930	1940	R Sandburg
file33076	HOSPITAL	46	69	SOUTHERN CROSS HOSPITAL
file33076	IDNUM	8	18	68X447314Z
file33076	MEDICALRECORD	27	34	6894473
file33112	CITY	47	54	LITHGOW
file33112	DOCTOR	1964	1974	O Hufnagel
file33112	HOSPITAL	47	63	LITHGOW HOSPITAL
file33112	IDNUM	8	18	53Y988672F
file33112	MEDICALRECORD	27	35	53998867
file33112	ZIP	237	241	3836
file33149	DATE	3862	3871	10/1/2070	2070-01-10
file33149	DOCTOR	2590	2596	D Wolf
file33149	DOCTOR	460	468	Mcclimon
file33149	HOSPITAL	46	73	BANKSTOWN-LIDCOMBE HOSPITAL
file33149	IDNUM	8	18	11U909630O
file33149	MEDICALRECORD	27	34	1179096
file33197	DATE	2241	2248	12/7/65	2065-07-12
file33197	DOCTOR	2280	2288	N Medich
file33197	HOSPITAL	47	79	ST MARYS COMMUNITY HEALTH CENTRE
file33197	IDNUM	8	18	53D100446K
file33197	MEDICALRECORD	27	35	53110044
file33269	DOCTOR	1818	1826	L Lasane
file33269	HOSPITAL	45	66	RAVENSTHORPE HOSPITAL
file33269	IDNUM	8	18	48E651604Q
file33269	MEDICALRECORD	27	33	481651
file33269	ORGANIZATION	2987	3001	ANTENATAL WARD
file33269	HOSPITAL	3003	3034	WERRIS CREEK COMMUNITY HOSPITAL
file33392	CITY	47	60	TENNANT CREEK
file33392	DOCTOR	2689	2696	M Zepka
file33392	DOCTOR	2714	2725	M Schlatter
file33392	HOSPITAL	47	69	TENNANT CREEK HOSPITAL
file33392	IDNUM	8	18	42I423311P
file33392	MEDICALRECORD	27	35	42342331
file33418	CITY	1124	1131	Blayney
file33418	CITY	47	56	SINGLETON
file33418	DATE	1082	1090	13/12/65	2065-12-13
file33418	DOCTOR	1122	1131	J Blayney
file33418	HOSPITAL	47	74	SINGLETON DISTRICT HOSPITAL
file33418	IDNUM	8	18	37J873579V
file33418	MEDICALRECORD	27	35	37387357
file33443	DATE	1912	1920	12/11/66	2066-11-12
file33443	DATE	3013	3021	26/12/66	2066-12-26
file33443	DOCTOR	1950	1958	T Ciervo
file33443	HOSPITAL	47	86	CULCAIRN MULTI PURPOSE SERVICE HOSPITAL
file33443	IDNUM	8	18	79R175386S
file33443	MEDICALRECORD	27	35	79617538
file33533	DATE	171	178	22.1.69	2069-01-22
file33533	DATE	2408	2415	19.1.66	2066-01-19
file33533	DATE	3748	3756	18/12/66	2066-12-18
file33533	DATE	6528	6536	21.12.66	2066-12-21
file33533	DOCTOR	2495	2501	Marion
file33533	DOCTOR	2525	2534	R Phildor
file33533	DOCTOR	2542	2549	R Marin
file33533	TIME	2553	2570	16:25 on 17/01/69	2069-01-17T16:25
file33533	DOCTOR	3788	3799	R Schweizer
file33533	DOCTOR	799	810	R Spoelstra
file33533	TIME	823	831	16/01/67	2067-01-16T16:00
file33533	HOSPITAL	46	87	BARWON HEALTH - NEWCOMB RENAL UNIT CAMPUS
file33533	IDNUM	8	18	64S516544Y
file33533	MEDICALRECORD	27	34	6475165
file33567	DATE	2305	2313	18/12/65	2065-12-18
file33567	DOCTOR	2345	2354	G Arnesen
file33567	HOSPITAL	46	77	WEST GIPPSLAND HEALTHCARE GROUP
file33567	IDNUM	8	18	22P637502G
file33567	MEDICALRECORD	27	34	2256375
file33648	CITY	45	53	COOKTOWN
file33648	DATE	1887	1894	15/1/66	2066-01-15
file33648	DOCTOR	1926	1936	Q Weiglein
file33648	HOSPITAL	45	62	COOKTOWN HOSPITAL
file33648	IDNUM	8	18	64X838319D
file33648	MEDICALRECORD	27	33	649838
file33648	ORGANIZATION	3164	3175	UROLOGY OPD
file33648	HOSPITAL	3177	3214	KYOGLE MEMORIAL MULTI PURPOSE SERVICE
file33695	CITY	46	59	MOUNT GAMBIER
file33695	DATE	2148	2155	17/1/68	2068-01-17
file33695	DOCTOR	2187	2197	E Knuckles
file33695	DOCTOR	881	889	E Alanko
file33695	TIME	893	912	11:15am on 17/01/68	2068-01-17T11:15
file33695	HOSPITAL	46	88	MOUNT GAMBIER AND DISTRICTS HEALTH SERVICE
file33695	IDNUM	8	18	12U869477L
file33695	MEDICALRECORD	27	34	1278694
file33763	DATE	5568	5576	26/12/65	2065-12-26
file33763	DATE	8224	8232	28/12/66	2066-12-28
file33763	DOCTOR	5608	5616	C Clizbe
file33763	HOSPITAL	47	82	BARWON HEALTH - ASHLEY MANOR CAMPUS
file33763	IDNUM	8	18	07U300635R
file33763	MEDICALRECORD	27	35	07830063
file33763	ZIP	243	247	2047
file33787	DATE	693	700	28/1/67	2067-01-28
file33787	DOCTOR	732	741	M Corning
file33787	HOSPITAL	45	66	WONGAN HILLS HOSPITAL
file33787	IDNUM	8	18	49D501442O
file33787	MEDICALRECORD	27	33	491501
file33831	DATE	2744	2752	22/12/69	2069-12-22
file33831	DOCTOR	2784	2793	A Grissom
file33831	HOSPITAL	47	79	ST MARYS COMMUNITY HEALTH CENTRE
file33831	IDNUM	8	18	07Z5224008
file33831	MEDICALRECORD	27	35	07952240
file33856	CITY	47	52	Perth
file33856	DATE	2137	2144	27/2/67	2067-02-27
file33856	DOCTOR	2176	2186	Y Starnold
file33856	DOCTOR	3024	3032	Y Murley
file33856	HOSPITAL	47	73	Perth Childrens Hospital
file33856	IDNUM	246	254	91A07376
file33856	IDNUM	8	18	91A073768C
file33856	MEDICALRECORD	27	35	10397248
file33928	CITY	2700	2711	LEIGH CREEK
file33928	CITY	46	55	BALRANALD
file33928	DATE	1440	1447	25/2/67	2067-02-25
file33928	DOCTOR	1479	1485	I Gruz
file33928	DOCTOR	1509	1517	I Moglia
file33928	HOSPITAL	46	77	BALRANALD MULTI PURPOSE SERVICE
file33928	IDNUM	8	18	33J275574Z
file33928	MEDICALRECORD	27	34	9844152
file33928	ORGANIZATION	2695	2698	ACT
file33928	HOSPITAL	2700	2727	LEIGH CREEK HEALTH SERVICES
file33928	STATE	2695	2698	ACT
file33948	DOCTOR	1948	1959	X Lundquist
file33948	HOSPITAL	47	99	BEAUFORT & SKIPTON HEALTH SERVICES - BEAUFORT CAMPUS
file33948	IDNUM	8	18	81F295533H
file33948	MEDICALRECORD	27	35	10432636
file33976	DATE	1973	1980	30/3/70	2070-03-30
file33976	DOCTOR	2074	2081	H Jelle
file33976	HOSPITAL	46	86	THE ROYAL VICTORIAN EYE AND EAR HOSPITAL
file33976	IDNUM	8	18	23O597349E
file33976	MEDICALRECORD	27	34	2525047
file34012	DOCTOR	965	975	V Anichini
file34012	HOSPITAL	47	71	SOUTH GIPPSLAND HOSPITAL
file34012	IDNUM	8	18	81K518407M
file34012	MEDICALRECORD	27	35	10448333
file34051	DOCTOR	2750	2757	P Stolp
file34051	DOCTOR	884	894	P Mccarter
file34051	TIME	898	915	16:40 on 01.06.67	2067-06-01
file34051	HOSPITAL	47	61	OAKEY HOSPITAL
file34051	IDNUM	8	18	50Y230314G
file34051	MEDICALRECORD	27	35	10458110
file34099	DATE	1217	1224	17/1/69	2069-01-17
file34099	DOCTOR	1256	1262	W July
file34099	HOSPITAL	46	64	PEMBERTON HOSPITAL
file34099	IDNUM	8	18	82D000772K
file34099	MEDICALRECORD	27	34	2108410
file34146	DATE	2034	2041	14/2/66	2066-02-14
file34146	DOCTOR	2073	2078	G Bay
file34146	HOSPITAL	46	62	EUDUNDA HOSPITAL
file34146	IDNUM	8	18	24M302588G
file34146	MEDICALRECORD	27	34	1008884
file34182	DATE	2106	2113	17/1/67	2067-01-17
file34182	DOCTOR	1123	1130	E Roese
file34182	DOCTOR	1137	1145	E Mccoun
file34182	TIME	1149	1169	4:48pm on 17.02.2066	2066-02-17
file34182	DOCTOR	2145	2153	E Siglar
file34182	HOSPITAL	46	98	PORT BROUGHTON DISTRICT HOSPITAL AND HEALTH SERVICES
file34182	IDNUM	8	18	18N742746M
file34182	MEDICALRECORD	27	34	2100445
file34217	CITY	46	54	GOULBURN
file34217	CITY	71	77	TATURA
file34217	DATE	3670	3677	19/2/70	2070-02-19
file34217	DOCTOR	3708	3714	E Mora
file34217	DOCTOR	6639	6647	E Stania
file34217	DOCTOR	6867	6875	E Ezzell
file34217	HOSPITAL	46	84	GOULBURN VALLEY HEALTH - TATURA CAMPUS
file34217	IDNUM	8	18	13R524353L
file34217	MEDICALRECORD	27	34	4858414
file34295	CITY	46	54	CESSNOCK
file34295	DATE	2070	2077	18/2/70	2070-02-18
file34295	DOCTOR	2109	2118	C Zawasky
file34295	HOSPITAL	46	72	CESSNOCK DISTRICT HOSPITAL
file34295	IDNUM	8	18	18S065511R
file34295	MEDICALRECORD	27	34	0955746
file34337	DATE	1936	1943	23/2/66	2066-02-23
file34337	DOCTOR	1975	1984	R Mugrage
file34337	HOSPITAL	46	73	HENTY MULTI PURPOSE SERVICE
file34337	IDNUM	8	18	66O086679A
file34337	MEDICALRECORD	27	34	2365722
file34398	CITY	47	58	CASTLEMAINE
file34398	DATE	4059	4066	22/2/66	2066-02-22
file34398	DOCTOR	1229	1237	B Wynter
file34398	TIME	1241	1262	10:10am on 20/01/2066	2066-01-20T10:10
file34398	DOCTOR	4098	4111	B Westerfield
file34398	HOSPITAL	47	65	CASTLEMAINE HEALTH
file34398	IDNUM	209	217	08X28748
file34398	IDNUM	8	18	08X287486W
file34398	MEDICALRECORD	27	35	10465632
file34434	DATE	1619	1626	22/2/70	2070-02-22
file34434	DOCTOR	1658	1665	Z Blaze
file34434	DOCTOR	1683	1689	Z Borg
file34434	HOSPITAL	46	77	WEST GIPPSLAND HEALTHCARE GROUP
file34434	IDNUM	8	18	93Y738644C
file34434	MEDICALRECORD	27	34	2245500
file34471	CITY	47	53	BOWRAL
file34471	DATE	1516	1523	22/2/70	2070-02-22
file34471	DOCTOR	1555	1562	N Chaix
file34471	HOSPITAL	47	62	BOWRAL HOSPITAL
file34471	IDNUM	8	18	51U759702L
file34471	MEDICALRECORD	27	35	10451454
file34497	DATE	1969	1976	28/1/69	2069-01-28
file34497	DOCTOR	1943	1949	X Pall
file34497	DOCTOR	2009	2013	X Ng
file34497	DOCTOR	2425	2436	X Gillispie
file34497	HOSPITAL	47	66	AUGATHELLA HOSPITAL
file34497	IDNUM	8	18	93D950419H
file34497	MEDICALRECORD	27	35	10344512
file34611	DATE	1967	1977	24/10/2066	2066-10-24
file34611	DATE	2240	2249	26/9/2065	2065-09-26
file34611	DATE	4650	4660	23/10/2065	2065-10-23
file34611	DOCTOR	2328	2338	V Gardener
file34611	HOSPITAL	47	71	SOUTH GIPPSLAND HOSPITAL
file34611	IDNUM	133	141	88E49177
file34611	IDNUM	143	151	88E49177
file34611	IDNUM	143	153	88E491777N
file34611	PATIENT	155	171	Straseskie, HOYT
file34611	IDNUM	8	18	88E491777N
file34611	MEDICALRECORD	27	35	10358014
file34611	ORGANIZATION	4722	4748	BRIGHAM & WOMEN'S HOSPITAL
file34760	DATE	2958	2966	8/5/2069	2069-08-05
file34760	DOCTOR	2992	3002	J Chockley
file34760	IDNUM	8	18	36A4127358
file34760	IDNUM	109	117	36A41273
file34760	IDNUM	118	126	36A41273
file34760	IDNUM	128	136	36A41273
file34760	IDNUM	128	138	36A4127358
file34760	PATIENT	140	155	SOTTILE, ADELLE
file34760	MEDICALRECORD	27	33	358767
file34818	DATE	3459	3468	15/4/2066	2066-04-15
file34818	DATE	7089	7098	18/4/2070	2070-04-18
file34818	DOCTOR	3495	3502	T Autin
file34818	HOSPITAL	181	233	WEST WIMMERA HEALTH SERVICE - JEPARIT AND SUTHERLAND
file34818	HOSPITAL	46	60	OAKEY HOSPITAL
file34818	IDNUM	122	130	77J71454
file34818	IDNUM	132	140	77J71454
file34818	IDNUM	132	142	77J7145427
file34818	PATIENT	144	158	Maco, Rey Aron
file34818	IDNUM	8	18	77J7145427
file34818	MEDICALRECORD	27	34	1368320
file34880	CITY	187	194	LITHGOW
file34880	CITY	46	51	COLAC
file34880	DATE	3444	3453	26/5/2067	2067-05-26
file34880	DATE	6611	6620	28/4/2069	2069-04-28
file34880	DOCTOR	3478	3483	I Lou
file34880	HOSPITAL	187	227	LITHGOW HOSPITAL AND SUTHERLAND HOSPITAL
file34880	HOSPITAL	46	63	COLAC AREA HEALTH
file34880	IDNUM	125	133	35F74460
file34880	IDNUM	135	143	35F74460
file34880	IDNUM	135	145	35F744600B
file34880	PATIENT	147	164	MAO, Noel Wilburn
file34880	IDNUM	8	18	35F744600B
file34880	MEDICALRECORD	27	34	0736113
file34944	CITY	198	206	BATHURST
file34944	DATE	2892	2901	23/6/2067	2067-06-23
file34944	DATE	5280	5289	24/3/2068	2068-03-24
file34944	DOCTOR	2926	2936	S Spradlin
file34944	DOCTOR	708	718	S. Wiliams
file34944	HOSPITAL	198	220	BATHURST BASE HOSPITAL
file34944	HOSPITAL	47	64	NARROGIN HOSPITAL
file34944	IDNUM	126	134	18H00564
file34944	IDNUM	136	146	18K018129E
file34944	PATIENT	148	175	STEINMULLER, MAMMIE Terence
file34944	IDNUM	8	18	18K018129E
file34944	MEDICALRECORD	27	35	10260280
file34985	DATE	1176	1185	25/4/2066	2066-04-25
file34985	DATE	191	199	6.6.2066	2066-06-06
file34985	DATE	2582	2591	29/5/2066	2066-05-29
file34985	DATE	2617	2625	6.6.2069	2069-06-06
file34985	DOCTOR	1209	1217	Q Lenske
file34985	HOSPITAL	262	312	THE ROYAL WOMEN'S HOSPITAL AND SUTHERLAND HOSPITAL
file34985	HOSPITAL	46	70	COHUNA DISTRICT HOSPITAL
file34985	IDNUM	132	140	62P48767
file34985	IDNUM	142	150	62P48767
file34985	IDNUM	142	152	62P487674D
file34985	PATIENT	154	168	CHALFANT, DANE
file34985	IDNUM	8	18	62P487674D
file34985	MEDICALRECORD	27	34	9507773
file35016	CITY	187	200	MOUNT GAMBIER
file35016	CITY	47	52	COLAC
file35016	DATE	1056	1065	29/4/2069	2069-04-29
file35016	DATE	2712	2721	29/4/2067	2067-04-29
file35016	DOCTOR	1089	1099	E Tuukanen
file35016	HOSPITAL	187	229	MOUNT GAMBIER AND DISTRICTS HEALTH SERVICE
file35016	HOSPITAL	47	64	COLAC AREA HEALTH
file35016	IDNUM	126	134	10L40762
file35016	IDNUM	136	144	10L40762
file35016	IDNUM	136	146	10L407622M
file35016	PATIENT	148	164	KREBS, ALEXANDER
file35016	IDNUM	8	18	10L407622M
file35016	MEDICALRECORD	27	35	10195149
file35093	DATE	2444	2453	30/5/2066	2066-05-30
file35093	DATE	4584	4593	23/4/2066	2066-04-23
file35093	DATE	6195	6203	6/1/2070	2070-01-06
file35093	DOCTOR	4618	4628	O. Veverka
file35093	DOCTOR	779	787	O. Deman
file35093	DATE	791	800	25.4.2066	2066-04-25
file35093	HOSPITAL	198	249	HENTY MULTI PURPOSE SERVICE AND SUTHERLAND HOSPITAL
file35093	HOSPITAL	46	70	PEAK HILL HEALTH SERVICE
file35093	IDNUM	132	140	52U60943
file35093	IDNUM	142	150	52U60943
file35093	IDNUM	142	152	52U609439I
file35093	PATIENT	154	175	Mulero, Jamal LARONDA
file35093	IDNUM	8	18	52U609439I
file35093	MEDICALRECORD	27	34	2627236
file35169	DATE	3661	3669	5/6/2067	2067-06-05
file35169	DATE	5809	5817	8/5/2066	2066-08-05
file35169	DOCTOR	1530	1539	M. Koussa
file35169	TIME	1543	1549	5.6.70	2070-06-05
file35169	DOCTOR	1592	1601	M. Goettl
file35169	TIME	1645	1664	10:25am on 05.06.69	2069-06-05T10:25
file35169	DOCTOR	3721	3729	M Raguay
file35169	DOCTOR	776	783	M. Ruta
file35169	HOSPITAL	187	237	THE ROYAL WOMEN'S HOSPITAL AND SUTHERLAND HOSPITAL
file35169	HOSPITAL	46	63	MORANBAH HOSPITAL
file35169	IDNUM	125	133	47V14060
file35169	IDNUM	135	143	47V14060
file35169	IDNUM	135	145	47V1406075
file35169	PATIENT	147	164	DETILLION, JASPER
file35169	IDNUM	8	18	47V1406075
file35169	MEDICALRECORD	27	34	8598350
file35241	DATE	2412	2420	6/9/2069	2069-09-06
file35241	DATE	4887	4896	13/6/2070	2070-06-13
file35241	DOCTOR	2446	2455	W Orabone
file35241	HOSPITAL	218	261	BEAUDESERT HOSPITAL AND SUTHERLAND HOSPITAL
file35241	HOSPITAL	47	89	TEXAS HOSPITAL MULTIPURPOSE HEALTH SERVICE
file35241	IDNUM	151	159	89D34241
file35241	IDNUM	161	169	89D34241
file35241	IDNUM	161	171	89D342414L
file35241	PATIENT	173	195	SHOREY, HERMAN Trenton
file35241	IDNUM	8	18	89D342414L
file35241	MEDICALRECORD	27	35	10393884
file35342	CITY	199	206	LATROBE
file35342	DATE	1702	1711	24/5/2066	2066-05-24
file35342	DATE	283	290	7/10/70	2070-10-07
file35342	DATE	3936	3945	19/5/2066	2066-05-19
file35342	DATE	7203	7212	24/6/2069	2069-06-24
file35342	DOCTOR	3970	3981	U Westerman
file35342	DOCTOR	963	978	Liver Registrar
file35342	TIME	982	1003	11:20am on 18.05.2069	2069-05-18T11:20
file35342	HOSPITAL	199	248	LATROBE REGIONAL HOSPITAL AND SUTHERLAND HOSPITAL
file35342	HOSPITAL	46	67	RAVENSTHORPE HOSPITAL
file35342	IDNUM	129	137	74E89277
file35342	IDNUM	138	146	74E89277
file35342	IDNUM	148	156	74E89277
file35342	IDNUM	148	158	74E892772R
file35342	PATIENT	160	176	Tabisola, Aubrey
file35342	IDNUM	8	18	74E892772R
file35342	MEDICALRECORD	27	34	8108999
file35375	CITY	66	72	SYDNEY
file35375	DATE	1256	1265	17/5/2069	2069-05-17
file35375	DOCTOR	1290	1299	N Mayorca
file35375	HOSPITAL	203	245	THE TWEED HOSPITAL AND SUTHERLAND HOSPITAL
file35375	HOSPITAL	46	76	CALVARY HEALTH CARE SYDNEY LTD
file35375	IDNUM	138	146	52S41468
file35375	IDNUM	148	156	52S41468
file35375	IDNUM	148	158	52S414688L
file35375	PATIENT	160	180	SPANISH, Trista KORY
file35375	IDNUM	8	18	52S414688L
file35375	MEDICALRECORD	27	34	1040200
file35490	CITY	5089	5098	MILLICENT
file35490	DATE	3164	3173	21/6/2070	2070-06-21
file35490	DATE	5008	5017	23/6/2067	2067-06-23
file35490	DATE	5981	5990	29/4/2068	2068-04-29
file35490	DOCTOR	3198	3208	C Allenson
file35490	HOSPITAL	229	252	SOUTHERN CROSS HOSPITAL
file35490	HOSPITAL	46	64	THE TWEED HOSPITAL
file35490	IDNUM	158	166	18H01807
file35490	IDNUM	168	178	18K044663G
file35490	PATIENT	180	206	Chegwidden, LATASHA Elwood
file35490	IDNUM	8	18	18K044663G
file35490	MEDICALRECORD	27	34	9008185
file35490	ORGANIZATION	5075	5088	EAST SURGICAL
file35490	DEPARTMENT	5149	5152	10)
file35609	DATE	2343	2352	26/6/2070	2070-06-26
file35609	DATE	3820	3829	29/6/2066	2066-06-29
file35609	DOCTOR	2376	2385	M Torrain
file35609	HOSPITAL	178	240	MONASH MEDICAL CENTRE - CLAYTON CAMPUS AND SUTHERLAND HOSPITAL
file35609	IDNUM	8	18	42X736453Q
file35609	IDNUM	109	117	42X73645
file35609	IDNUM	118	126	42X73645
file35609	IDNUM	128	136	42X73645
file35609	IDNUM	128	138	42X736453Q
file35609	PATIENT	140	155	PRATKA, EVERETT
file35609	MEDICALRECORD	27	33	359605
file35609	MEDICALRECORD	4650	4658	06.03.18
file35730	CITY	4767	4772	GRETA
file35730	DATE	2846	2855	26/5/2066	2066-05-26
file35730	DOCTOR	2878	2886	K Rutter
file35730	HOSPITAL	179	252	EASTERN EYRE HEALTH AND AGED CARE - COWELL CAMPUS AND SUTHERLAND HOSPITAL
file35730	IDNUM	5132	5140	37Y18771
file35730	IDNUM	8	18	37Y187711W
file35730	IDNUM	109	117	37Y18771
file35730	IDNUM	118	126	37Y18771
file35730	IDNUM	128	136	37Y18771
file35730	IDNUM	128	138	37Y187711W
file35730	MEDICALRECORD	27	33	360197
file35730	ZIP	4929	4933	2010
file35768	CITY	184	192	ADELAIDE
file35768	DATE	2025	2034	27/6/2070	2070-06-27
file35768	DATE	768	777	26/6/2069	2069-06-26
file35768	DOCTOR	802	809	Y Ikeda
file35768	HOSPITAL	174	201	THE ROYAL ADELAIDE HOSPITAL
file35768	IDNUM	8	18	95U208779E
file35768	IDNUM	109	117	95U20877
file35768	IDNUM	118	126	95U20877
file35768	IDNUM	128	136	95U20877
file35768	IDNUM	128	138	95U208779E
file35768	PATIENT	140	151	Roaf, SAMMY
file35768	MEDICALRECORD	27	33	273888
file35887	DATE	2307	2316	24/7/2067	2067-07-24
file35887	DATE	4256	4265	29/5/2068	2068-05-29
file35887	DATE	5136	5143	18.5.68	2068-05-18
file35887	DOCTOR	2339	2347	I Beerle
file35887	HOSPITAL	182	223	MALLEE TRACK HEALTH AND COMMUNITY SERVICE
file35887	IDNUM	8	18	18K050544B
file35887	IDNUM	109	117	18H02083
file35887	IDNUM	128	138	18K050544B
file35887	PATIENT	140	159	RALBOVSKY, Yarranji
file35887	MEDICALRECORD	27	33	292773
file35939	CITY	191	196	YOUNG
file35939	CITY	47	56	GLADSTONE
file35939	DATE	2308	2317	10/6/2067	2067-06-10
file35939	DATE	3387	3395	7/7/2067	2067-07-07
file35939	DOCTOR	2342	2351	G Rarogal
file35939	HOSPITAL	191	214	YOUNG DISTRICT HOSPITAL
file35939	HOSPITAL	47	65	GLADSTONE HOSPITAL
file35939	IDNUM	127	135	22E84074
file35939	IDNUM	137	145	22E84074
file35939	IDNUM	137	147	22E840744H
file35939	PATIENT	149	168	Komp, Lynette DIEGO
file35939	IDNUM	8	18	22E840744H
file35939	MEDICALRECORD	27	35	10131576
file36051	DATE	1975	1984	30/6/2069	2069-06-30
file36051	DATE	5060	5069	28/7/2070	2070-07-28
file36051	DOCTOR	2739	2746	U Taula
file36051	HOSPITAL	197	222	BEECHWORTH HEALTH SERVICE
file36051	HOSPITAL	47	77	PORTLAND TABULAM HEALTH CENTRE
file36051	IDNUM	139	147	70A96180
file36051	IDNUM	149	157	70A96180
file36051	IDNUM	149	159	70A961802P
file36051	PATIENT	161	174	ORLOW, Romona
file36051	IDNUM	8	18	70A961802P
file36051	MEDICALRECORD	27	35	10250093
file36051	ORGANIZATION	4162	4177	ENVOI Pathology
file36051	DEPARTMENT	4178	4192	BURRA HOSPITAL
file36118	DATE	2928	2936	5/8/2069	2069-08-05
file36118	DATE	6132	6140	9/5/2067	2067-05-09
file36118	DOCTOR	2960	2969	E Valenza
file36118	DOCTOR	646	654	Eagleton
file36118	DATE	658	665	30/7/70	2070-07-30
file36118	DOCTOR	976	985	E. Pouncy
file36118	DATE	989	995	1/7/69	2069-07-01
file36118	HOSPITAL	197	213	BELMONT HOSPITAL
file36118	HOSPITAL	47	70	SCOTT MEMORIAL HOSPITAL
file36118	IDNUM	132	140	12I16361
file36118	IDNUM	142	150	12I16361
file36118	IDNUM	142	152	12I163619M
file36118	PATIENT	154	161	Horwood
file36118	IDNUM	8	18	12I163619M
file36118	MEDICALRECORD	27	35	10512596
file36159	DATE	1646	1654	9/7/2066	2066-07-09
file36159	DATE	2906	2915	14/7/2067	2067-07-14
file36159	DOCTOR	1678	1686	T Bilder
file36159	HOSPITAL	187	230	BRIDGETOWN HOSPITAL AND SUTHERLAND HOSPITAL
file36159	HOSPITAL	46	65	SPRINGSURE HOSPITAL
file36159	IDNUM	127	135	70F18366
file36159	IDNUM	137	145	70F18366
file36159	IDNUM	137	147	70F183667U
file36159	PATIENT	149	164	Gaylord, LOWELL
file36159	IDNUM	2242	2250	70F18366
file36159	IDNUM	8	18	70F183667U
file36159	MEDICALRECORD	27	34	8293506
file36199	DATE	2700	2709	16/7/2066	2066-07-16
file36199	DATE	4682	4691	21/5/2070	2070-05-21
file36199	DOCTOR	2734	2742	D Asfour
file36199	HOSPITAL	191	229	MUNDUBBERA MULTIPURPOSE HEALTH SERVICE
file36199	HOSPITAL	47	63	EUDUNDA HOSPITAL
file36199	IDNUM	125	133	12N48547
file36199	IDNUM	135	143	12N48547
file36199	IDNUM	135	145	12N485474R
file36199	PATIENT	147	168	GALICIA, STEFAN CAREY
file36199	IDNUM	8	18	12N485474R
file36199	MEDICALRECORD	27	35	10516659
file36251	DATE	2279	2288	28/8/2067	2067-08-28
file36251	DATE	4536	4545	26/7/2067	2067-07-26
file36251	DOCTOR	2314	2319	B Awe
file36251	HOSPITAL	190	244	FINLEY HOSPITAL & COMMUNITY HEALTH CARE AND SUTHERLAND
file36251	HOSPITAL	47	61	LOGAN HOSPITAL
file36251	IDNUM	123	131	06O83664
file36251	IDNUM	133	141	06O83664
file36251	IDNUM	133	143	06O836641X
file36251	PATIENT	145	167	Expose, Anton REYNALDO
file36251	IDNUM	8	18	06O836641X
file36251	MEDICALRECORD	27	35	10547492
file36251	ORGANIZATION	3621	3629	Southern
file36251	DEPARTMENT	3636	3652	CENTRAL HOSPITAL
file36329	DATE	2262	2271	20/5/2070	2070-05-20
file36329	DATE	4331	4340	24/4/2069	2069-04-24
file36329	DOCTOR	2296	2305	L Federle
file36329	HOSPITAL	168	210	THE TWEED HOSPITAL AND SUTHERLAND HOSPITAL
file36329	IDNUM	8	18	48X037458T
file36329	IDNUM	109	117	48X03745
file36329	IDNUM	119	127	48X03745
file36329	IDNUM	119	129	48X037458T
file36329	PATIENT	131	145	Nocella, ARLEN
file36329	MEDICALRECORD	27	33	362236
file36394	CITY	46	52	TEMORA
file36394	DATE	3773	3781	6/5/2070	2070-06-06
file36394	DATE	5960	5968	8/8/2069	2069-08-08
file36394	DOCTOR	3806	3813	J Aholt
file36394	DOCTOR	826	835	J. Baymon
file36394	TIME	839	858	13:15Hrs on 30.8.66	2066-08-30
file36394	HOSPITAL	192	245	CONDOBOLIN RETIREMENT VILLAGE AND SUTHERLAND HOSPITAL
file36394	HOSPITAL	46	61	TEMORA HOSPITAL
file36394	IDNUM	123	131	33Y57861
file36394	IDNUM	133	141	33Y57861
file36394	IDNUM	133	143	33Y578616Z
file36394	PATIENT	145	169	Weisheit, Julius Alfonso
file36394	IDNUM	8	18	33Y578616Z
file36394	MEDICALRECORD	27	34	2437892
file36509	CITY	205	216	KURRI KURRI
file36509	DATE	2491	2499	8/7/2067	2067-07-08
file36509	DATE	4553	4561	6/9/2066	2066-06-06
file36509	DATE	4947	4957	11.05.2018	2018-05-11
file36509	DOCTOR	2522	2532	X Boeshore
file36509	HOSPITAL	205	234	KURRI KURRI DISTRICT HOSPITAL
file36509	IDNUM	138	146	91U59976
file36509	IDNUM	147	155	91U59976
file36509	IDNUM	157	165	91U59976
file36509	IDNUM	157	167	91U599764I
file36509	PATIENT	169	182	CALIN, Lianne
file36509	IDNUM	8	18	91U599764I
file36509	MEDICALRECORD	27	33	136105
file36582	DATE	2549	2558	11/6/2069	2069-06-11
file36582	DATE	5056	5065	15/6/2066	2066-06-15
file36582	DOCTOR	2610	2620	H Beightol
file36582	HOSPITAL	185	218	KOOWEERUP REGIONAL HEALTH SERVICE
file36582	IDNUM	8	18	23D891571E
file36582	IDNUM	109	117	23D89157
file36582	IDNUM	118	126	23D89157
file36582	IDNUM	128	136	23D89157
file36582	IDNUM	128	138	23D891571E
file36582	MEDICALRECORD	27	33	362838
file36664	CITY	300	305	YOUNG
file36664	CITY	47	52	CLARE
file36664	DATE	186	195	29.9.2067	2067-09-29
file36664	DATE	4181	4190	17/8/2067	2067-08-17
file36664	DATE	5774	5784	29.06.2018	2018-06-29
file36664	DOCTOR	4214	4222	F Varnes
file36664	HOSPITAL	300	323	YOUNG DISTRICT HOSPITAL
file36664	HOSPITAL	47	61	CLARE HOSPITAL
file36664	IDNUM	123	131	28E24174
file36664	IDNUM	133	141	28E24174
file36664	IDNUM	133	143	28E2417494
file36664	PATIENT	145	163	Benyamin, F-Bennie
file36664	IDNUM	8	18	28E2417494
file36664	MEDICALRECORD	27	35	10357655
file36664	ORGANIZATION	5900	5922	Southern IML Pathology
file36664	DEPARTMENT	5900	5963	Southern IML Pathology EAST WIMMERA HEALTH SERVICE - WYCHEPROOF
file36698	CITY	47	52	CLARE
file36698	DATE	1102	1111	18/6/2067	2067-06-18
file36698	DOCTOR	1136	1144	P Lukins
file36698	DOCTOR	639	645	Bialas
file36698	DOCTOR	668	675	P. Pech
file36698	TIME	679	697	10:15am on 21.9.67	67-09-21T10:15
file36698	HOSPITAL	185	237	SOUTH EAST REGIONAL HOSPITAL AND SUTHERLAND HOSPITAL
file36698	HOSPITAL	47	61	CLARE HOSPITAL
file36698	IDNUM	123	131	50N44355
file36698	IDNUM	133	141	50N44355
file36698	IDNUM	133	143	50N4435562
file36698	PATIENT	145	162	Helderman, Declan
file36698	IDNUM	8	18	50N4435562
file36698	MEDICALRECORD	27	35	10194837
file36807	CITY	174	183	BALRANALD
file36807	DATE	2162	2171	22/5/2067	2067-05-22
file36807	DATE	3515	3524	21/5/2069	2069-05-21
file36807	DOCTOR	2197	2206	D. Bachta
file36807	HOSPITAL	174	229	BALRANALD MULTI PURPOSE SERVICE AND SUTHERLAND HOSPITAL
file36807	IDNUM	8	18	18J5645046
file36807	IDNUM	109	117	18J56450
file36807	IDNUM	119	127	18J56450
file36807	IDNUM	119	129	18J5645046
file36807	PATIENT	131	151	BOLDWYN, Ruby LINSEY
file36807	MEDICALRECORD	27	33	233317
file36807	ORGANIZATION	3581	3599	Molecular Oncology
file36807	DEPARTMENT	3600	3609	LIVERPOOL
file36884	DATE	4603	4612	29/5/2067	2067-05-29
file36884	DATE	7693	7701	2/6/2069	2069-06-02
file36884	DOCTOR	4637	4647	B Lundblad
file36884	DOCTOR	586	595	B. Nagano
file36884	TIME	599	617	1.10pm on 25.06.69	2066-06-25
file36884	HOSPITAL	197	242	MOUNT DRUITT HOSPITAL AND SUTHERLAND HOSPITAL
file36884	HOSPITAL	47	64	SNOWTOWN HOSPITAL
file36884	IDNUM	126	134	02K90486
file36884	IDNUM	136	144	02K90486
file36884	IDNUM	136	146	02K904862V
file36884	PATIENT	148	174	Blevans, FRANCISCO Shaynes
file36884	IDNUM	8	18	02K904862V
file36884	MEDICALRECORD	27	35	10571477
file36942	CITY	47	58	HEALESVILLE
file36942	DATE	3595	3604	30/5/2069	2069-05-30
file36942	DATE	5604	5612	6/1/2070	2070-01-06
file36942	DOCTOR	3630	3637	Q. Mahn
file36942	HOSPITAL	205	250	MOUNT DRUITT HOSPITAL AND SUTHERLAND HOSPITAL
file36942	HOSPITAL	47	78	HEALESVILLE & DISTRICT HOSPITAL
file36942	IDNUM	140	148	60G02582
file36942	IDNUM	150	158	60G02582
file36942	PATIENT	162	182	RIBAR, Tyson WILBERT
file36942	IDNUM	8	18	60G025820E
file36942	MEDICALRECORD	27	35	10563609
file36987	DATE	2477	2486	30/5/2069	2069-05-30
file36987	DATE	3806	3814	5/7/2069	2069-07-05
file36987	DOCTOR	2511	2521	A Kakowski
file36987	HOSPITAL	194	241	YARRAM & DISTRICT HEALTH SERVICE AND SUTHERLAND
file36987	HOSPITAL	46	61	WARREN HOSPITAL
file36987	IDNUM	123	131	02P22763
file36987	IDNUM	132	140	02P22763
file36987	IDNUM	142	150	02P22763
file36987	IDNUM	142	152	02P227637A
file36987	PATIENT	154	163	Trenchard
file36987	PATIENT	154	155	T
file36987	IDNUM	8	18	02P227637A
file36987	MEDICALRECORD	27	34	2277566
file37127	CITY	177	190	MOUNT GAMBIER
file37127	DATE	2608	2616	6/1/2067	2067-01-06
file37127	DOCTOR	2641	2650	X Mcmurdo
file37127	HOSPITAL	177	219	MOUNT GAMBIER AND DISTRICTS HEALTH SERVICE
file37127	IDNUM	8	18	97Q677895G
file37127	IDNUM	109	117	97Q67789
file37127	IDNUM	118	126	97Q67789
file37127	IDNUM	128	136	97Q67789
file37127	IDNUM	128	138	97Q677895G
file37127	PATIENT	140	154	WALEGA, Felipe
file37127	MEDICALRECORD	27	33	363927
file37127	MEDICALRECORD	5990	5998	05.06.18
file37127	STREET	2779	2785	Opened
file37186	DATE	1994	2003	15/7/2070	2070-07-15
file37186	DATE	296	303	19/4/66	2066-04-19
file37186	DATE	3900	3910	23/10/2066	2066-10-23
file37186	DOCTOR	2027	2034	Y Lammi
file37186	DOCTOR	929	939	Y. Cocking
file37186	TIME	903	921	2:20pm on 16/10/70	70-10-16T14:20
file37186	HOSPITAL	198	227	CONCORD REPATRIATION HOSPITAL
file37186	HOSPITAL	47	66	GOOMALLING HOSPITAL
file37186	IDNUM	128	136	92U44940
file37186	IDNUM	138	146	92U44940
file37186	IDNUM	138	148	92U449401F
file37186	PATIENT	150	175	Cristaldi, Reynaldo Quinn
file37186	IDNUM	8	18	92U449401F
file37186	MEDICALRECORD	27	35	10547492
file37300	DATE	3048	3057	18/6/2066	2066-06-18
file37300	DOCTOR	3082	3090	W Rolley
file37300	HOSPITAL	177	230	CONDOBOLIN RETIREMENT VILLAGE AND SUTHERLAND HOSPITAL
file37300	HOSPITAL	4441	4459	Molecular Oncology
file37300	HOSPITAL	4460	4501	CENTRAL HIGHLANDS RURAL HEALTH - CRESWICK
file37300	IDNUM	4112	4120	87V99076
file37300	IDNUM	8	18	87V990769L
file37300	IDNUM	109	117	87V99076
file37300	IDNUM	118	126	87V99076
file37300	IDNUM	128	136	87V99076
file37300	IDNUM	128	138	87V990769L
file37300	PATIENT	140	154	BRALEY, ELWOOD
file37300	MEDICALRECORD	27	33	364845
file37388	DATE	4182	4191	24/8/2068	2068-08-24
file37388	DATE	6455	6464	28/8/2068	2068-08-28
file37388	DATE	6667	6677	26.10.2068	2068-10-26
file37388	DOCTOR	1247	1250	Tom
file37388	DOCTOR	1273	1279	Jabbie
file37388	TIME	1283	1302	2:10 pm on 20.09.68	68-09-20T14:10
file37388	DOCTOR	4216	4225	G Lahrman
file37388	DOCTOR	854	861	Terence
file37388	DOCTOR	863	868	Liver
file37388	DOCTOR	881	891	G. Hussian
file37388	HOSPITAL	222	244	GOVE DISTRICT HOSPITAL
file37388	HOSPITAL	46	65	BEAUDESERT HOSPITAL
file37388	IDNUM	156	164	29D19257
file37388	IDNUM	166	174	29D19257
file37388	IDNUM	166	176	29D192576I
file37388	PATIENT	178	199	CRICK, Damian Roberto
file37388	IDNUM	8	18	29D192576I
file37388	MEDICALRECORD	27	34	0232495
file37427	DATE	2425	2435	26/10/2069	2069-10-26
file37427	DATE	3885	3895	29/10/2069	2069-10-29
file37427	DOCTOR	2460	2470	E Petralia
file37427	DOCTOR	683	707	theater 10 on 22/10/2067
file37427	DOCTOR	715	726	E. Chapple.
file37427	HOSPITAL	187	229	TUMBY BAY HOSPITAL AND SUTHERLAND HOSPITAL
file37427	HOSPITAL	46	64	CARNARVON HOSPITAL
file37427	IDNUM	126	134	14E63273
file37427	IDNUM	136	144	14E63273
file37427	IDNUM	136	146	14E632734O
file37427	PATIENT	148	164	OFORI, LOYCE DON
file37427	IDNUM	8	18	14E632734O
file37427	MEDICALRECORD	27	34	9944328
file37471	CITY	46	57	MEEKATHARRA
file37471	DOCTOR	2204	2210	Jardon
file37471	HOSPITAL	187	225	WEIPA HOSPITAL AND SUTHERLAND HOSPITAL
file37471	HOSPITAL	46	66	MEEKATHARRA HOSPITAL
file37471	IDNUM	128	136	72A65379
file37471	IDNUM	138	146	72A65379
file37471	IDNUM	138	148	72A653792X
file37471	PATIENT	150	164	ROUZZO, Foster
file37471	IDNUM	2249	2257	72A65379
file37471	IDNUM	8	18	72A653792X
file37471	MEDICALRECORD	27	34	9785396
file37497	CITY	179	192	MOUNT GAMBIER
file37497	DATE	806	815	30/9/2066	2066-09-30
file37497	DOCTOR	838	846	C Mohead
file37497	HOSPITAL	179	221	MOUNT GAMBIER AND DISTRICTS HEALTH SERVICE
file37497	IDNUM	8	18	14J855509T
file37497	IDNUM	109	117	14J85550
file37497	IDNUM	118	126	14J85550
file37497	IDNUM	128	136	14J85550
file37497	IDNUM	128	138	14J855509T
file37497	PATIENT	140	156	DELPHIA, WILBURN
file37497	MEDICALRECORD	27	33	316547
file37583	DATE	166	174	8/8/2070	2070-08-08
file37583	DOCTOR	690	694	MMRP
file37583	DATE	5857	5866	11/9/2069	2069-11-09
file37583	DOCTOR	1007	1016	R Flanner
file37583	DOCTOR	3512	3519	R Mogle
file37583	DOCTOR	971	980	Caramella
file37583	TIME	996	1003	11:40am	2040-11-40
file37583	HOSPITAL	255	299	NORTHAMPTON HOSPITAL AND SUTHERLAND HOSPITAL
file37583	HOSPITAL	46	88	CAMPBELL TOWN HEALTH AND COMMUNITY SERVICE
file37583	IDNUM	194	202	67A57746
file37583	IDNUM	204	212	67A57746
file37583	PATIENT	216	232	Bethoney, Johnny
file37583	IDNUM	8	18	67A577469F
file37583	MEDICALRECORD	27	34	8124086
file37583	ZIP	5214	5218	2067
file37651	CITY	176	182	CAMDEN
file37651	DATE	2821	2830	30/7/2067	2067-07-30
file37651	DATE	5610	5618	8/8/2069	2069-08-08
file37651	DOCTOR	2856	2866	A Keithley
file37651	DOCTOR	841	848	Stephen
file37651	DOCTOR	871	880	A. Vannah
file37651	TIME	881	899	1.40pm on 29.07.70	2070-07-29T15:40
file37651	HOSPITAL	176	215	CAMDEN HOSPITAL AND SUTHERLAND HOSPITAL
file37651	IDNUM	8	18	08K305767Z
file37651	IDNUM	109	117	08K30576
file37651	IDNUM	118	126	08K30576
file37651	IDNUM	128	136	08K30576
file37651	IDNUM	128	138	08K305767Z
file37651	PATIENT	140	153	HAMBY, DEWITT
file37651	MEDICALRECORD	27	33	364706
file37696	CITY	192	199	LATROBE
file37696	DATE	395	403	08-14835	2056-11-148
file37696	PATIENT	431	459	Southern IML Pathology 40T50
file37696	DOCTOR	2394	2402	K Dinovi
file37696	HOSPITAL	192	241	LATROBE REGIONAL HOSPITAL AND SUTHERLAND HOSPITAL
file37696	HOSPITAL	46	63	MORANBAH HOSPITAL
file37696	IDNUM	125	133	40T50757
file37696	IDNUM	135	143	40T50757
file37696	IDNUM	135	145	40T507574V
file37696	PATIENT	147	169	Tyksinski, Walker RYAN
file37696	IDNUM	8	18	40T507574V
file37696	MEDICALRECORD	27	34	4941932
file37742	DATE	1787	1795	7/9/2067	2067-09-07
file37742	DATE	2809	2819	17/11/2069	2069-11-17
file37742	DOCTOR	1820	1829	Z Trickey
file37742	DOCTOR	758	765	Z. Nale
file37742	HOSPITAL	214	254	KOJONUP HOSPITAL AND SUTHERLAND HOSPITAL
file37742	HOSPITAL	46	84	MUNDUBBERA MULTIPURPOSE HEALTH SERVICE
file37742	IDNUM	146	154	98P62863
file37742	IDNUM	156	164	98P62863
file37742	IDNUM	156	166	98P628632E
file37742	PATIENT	168	191	LADESMA, Shawn Emmanuel
file37742	IDNUM	8	18	98P628632E
file37742	MEDICALRECORD	27	34	0736113
file37862	CITY	4451	4457	PARKES
file37862	DATE	2821	2830	15/7/2067	2067-07-15
file37862	DATE	4384	4393	16/7/2067	2067-07-16
file37862	DATE	5251	5261	20/11/2069	2069-11-20
file37862	DOCTOR	2855	2862	W Tortu
file37862	HOSPITAL	206	270	THE ROYAL VICTORIAN EYE AND EAR HOSPITAL AND SUTHERLAND HOSPITAL
file37862	IDNUM	141	149	83Q06889
file37862	IDNUM	150	158	83Q06889
file37862	IDNUM	160	168	83Q06889
file37862	IDNUM	160	170	83Q068890K
file37862	PATIENT	172	183	WEDNER, ROY
file37862	IDNUM	8	18	83Q068890K
file37862	MEDICALRECORD	27	33	053331
file37862	ORGANIZATION	4451	4485	PARKES 7 EAST ST JOSEPH'S HOSPITAL
file37972	DOCTOR	5471	5481	H. Sherles
file37972	HOSPITAL	257	300	GOOMALLING HOSPITAL AND SUTHERLAND HOSPITAL
file37972	HOSPITAL	47	83	BATLOW/ADELONG MULTI PURPOSE SERVICE
file37972	IDNUM	188	196	18H08439
file37972	PATIENT	210	234	BENTREM, LANCE Christian
file37972	IDNUM	6706	6716	10 or more
file37972	IDNUM	8	18	25Z260606G
file37972	MEDICALRECORD	27	35	10514223
file38027	DATE	2324	2333	23/8/2070	2070-08-23
file38027	DATE	2577	2587	26/10/2069	2069-10-26
file38027	DATE	4366	4375	29/8/2070	2070-08-29
file38027	DATE	4402	4409	10/6/70	2070-10-06
file38027	DATE	5245	5254	10/7/2069	2069-10-07
file38027	DOCTOR	2612	2618	V Acee
file38027	DOCTOR	730	750	Matt Research Centre
file38027	HOSPITAL	224	248	WILCANNIA HEALTH SERVICE
file38027	HOSPITAL	47	62	MALENY HOSPITAL
file38027	IDNUM	155	163	83V39176
file38027	IDNUM	165	173	83V39176
file38027	IDNUM	165	175	83V391764P
file38027	PATIENT	177	200	Bordes, SHERLENE KAREEN
file38027	IDNUM	8	18	83V391764P
file38027	MEDICALRECORD	27	35	10568483
file38027	ORGANIZATION	4442	4485	St Vincent's Pathology ST JOSEPH'S HOSPITAL
file38083	CITY	217	222	YOUNG
file38083	DATE	3218	3227	26/7/2067	2067-07-26
file38083	DATE	5159	5168	12/3/2069	2069-12-03
file38083	DOCTOR	3252	3260	T Lattus
file38083	HOSPITAL	217	240	YOUNG DISTRICT HOSPITAL
file38083	HOSPITAL	47	87	THE ROYAL VICTORIAN EYE AND EAR HOSPITAL
file38083	IDNUM	149	157	78W73292
file38083	IDNUM	159	167	78W73292
file38083	IDNUM	159	169	78W7329228
file38083	PATIENT	171	194	Scruton, Diamond Cythia
file38083	IDNUM	8	18	78W7329228
file38083	MEDICALRECORD	27	35	10609952
file38131	DATE	2231	2240	10/6/2069	2069-10-06
file38131	DATE	3156	3164	9/7/2066	2066-07-09
file38131	DOCTOR	2264	2272	U. Myung
file38131	HOSPITAL	201	237	QUORN HEALTH SERVICES AND SUTHERLAND
file38131	HOSPITAL	46	82	ST VINCENT'S HOSPITAL (DARLINGHURST)
file38131	IDNUM	144	152	73A51453
file38131	IDNUM	154	162	73A51453
file38131	IDNUM	154	164	73A5145397
file38131	PATIENT	166	178	Burcham, Sal
file38131	IDNUM	8	18	73A5145397
file38131	MEDICALRECORD	27	34	4935660
file38192	DATE	3537	3546	9/10/2069	2069-10-09
file38192	DATE	5660	5669	16/9/2069	2069-09-16
file38192	DOCTOR	3572	3579	R Frame
file38192	HOSPITAL	200	217	THEODORE HOSPITAL
file38192	HOSPITAL	47	63	BELMONT HOSPITAL
file38192	IDNUM	125	133	68B05479
file38192	IDNUM	135	143	68B05479
file38192	IDNUM	135	145	68B0547970
file38192	PATIENT	147	177	SHULTIS, IRVIN Harrison LOWELL
file38192	IDNUM	8	18	68B0547970
file38192	MEDICALRECORD	27	35	10544899
file38229	DATE	2124	2133	11/9/2070	2070-11-09
file38229	DATE	3385	3394	18/9/2066	2066-09-18
file38229	DOCTOR	2159	2166	B Bores
file38229	HOSPITAL	193	253	PINNAROO SOLDIERS' MEMORIAL HOSPITAL AND SUTHERLAND HOSPITAL
file38229	HOSPITAL	47	71	WILCANNIA HEALTH SERVICE
file38229	IDNUM	133	141	00K25650
file38229	IDNUM	143	151	00K25650
file38229	IDNUM	143	153	00K256504X
file38229	PATIENT	155	170	Longs, Stanford
file38229	IDNUM	8	18	00K256504X
file38229	MEDICALRECORD	27	35	10569997
file38287	DATE	1718	1728	14/10/2069	2069-10-14
file38287	DOCTOR	1751	1763	Q Pennacchio
file38287	HOSPITAL	208	270	MONASH MEDICAL CENTRE - CLAYTON CAMPUS AND SUTHERLAND HOSPITAL
file38287	HOSPITAL	46	79	KOOWEERUP REGIONAL HEALTH SERVICE
file38287	IDNUM	141	149	67G27766
file38287	IDNUM	151	159	67G27766
file38287	IDNUM	151	161	67G277662F
file38287	PATIENT	163	185	KLUKA, CANDICE SCOTTIE
file38287	IDNUM	8	18	67G277662F
file38287	MEDICALRECORD	27	34	9008185
file38352	CITY	47	54	KYABRAM
file38352	DATE	2875	2884	14/9/2070	2070-09-14
file38352	DATE	4727	4736	19/9/2070	2070-09-19
file38352	DOCTOR	2907	2918	O Humphries
file38352	HOSPITAL	206	245	MALDON HOSPITAL AND SUTHERLAND HOSPITAL
file38352	HOSPITAL	47	81	KYABRAM & DISTRICT HEALTH SERVICES
file38352	IDNUM	143	151	52H72782
file38352	IDNUM	153	161	52H72782
file38352	IDNUM	153	163	52H7278204
file38352	PATIENT	165	183	CURTSINGER, Morgan
file38352	IDNUM	8	18	52H7278204
file38352	MEDICALRECORD	27	35	10623001
file38434	CITY	232	241	NEWCASTLE
file38434	DATE	3540	3550	17/10/2069	2069-10-17
file38434	DATE	5132	5141	22/9/2066	2066-09-22
file38434	DOCTOR	1120	1130	Cristopher
file38434	DOCTOR	1163	1173	C. Sampsel
file38434	DOCTOR	1483	1487	Juan
file38434	DOCTOR	1520	1530	C. Skarupa
file38434	DOCTOR	3575	3589	C Colagiovanni
file38434	DOCTOR	758	764	Newton
file38434	DOCTOR	797	803	C. Lym
file38434	TIME	768	789	10:50am on 16/10/2070	2070-10-16T10:50
file38434	HOSPITAL	205	272	JOHN HUNTER HOSPITAL ROYAL NEWCASTLE CENTRE AND SUTHERLAND HOSPITAL
file38434	HOSPITAL	47	75	SOUTH EAST REGIONAL HOSPITAL
file38434	IDNUM	137	145	00D74887
file38434	IDNUM	147	155	00D74887
file38434	IDNUM	147	157	00D748878U
file38434	PATIENT	159	182	PALLETT, DANNY CHAUNCEY
file38434	IDNUM	8	18	00D748878U
file38434	MEDICALRECORD	27	35	10595787
file38489	CITY	219	228	REDCLIFFE
file38489	DATE	2652	2661	26/9/2069	2069-09-26
file38489	DATE	4188	4198	23/10/2069	2069-10-23
file38489	DOCTOR	2699	2708	V. Suozzo
file38489	HOSPITAL	219	237	REDCLIFFE HOSPITAL
file38489	HOSPITAL	47	85	BOYUP BROOK SOLDIERS MEMORIAL HOSPITAL
file38489	IDNUM	147	155	89Q46089
file38489	IDNUM	157	165	89Q46089
file38489	IDNUM	157	167	89Q4608955
file38489	PATIENT	169	196	KERCHEVAL, JEWEL Antionette
file38489	IDNUM	8	18	89Q4608955
file38489	MEDICALRECORD	27	35	10614285
file38583	DATE	2646	2656	23/10/2067	2067-10-23
file38583	DATE	4803	4811	26/10/70	2070-10-26
file38583	DOCTOR	2681	2690	P Bugtong
file38583	HOSPITAL	188	229	BASS COAST REGIONAL HEALTH AND SUTHERLAND
file38583	HOSPITAL	47	63	BALMAIN HOSPITAL
file38583	IDNUM	125	133	58E08170
file38583	IDNUM	135	143	58E08170
file38583	IDNUM	135	145	58E081701H
file38583	PATIENT	147	165	DUST, LOWELL JEWEL
file38583	IDNUM	8	18	58E081701H
file38583	MEDICALRECORD	27	35	10621183
file38583	STREET	3962	3968	Spleen
file38583	ZIP	2964	2968	2017
file38645	CITY	80	87	KYNETON
file38645	DATE	2606	2616	28/10/2067	2067-10-28
file38645	DATE	4215	4224	10/1/2067	2067-10-01
file38645	DOCTOR	2641	2653	Z Krahenbuhl
file38645	HOSPITAL	213	236	SOUTHERN CROSS HOSPITAL
file38645	HOSPITAL	47	87	CENTRAL HIGHLANDS RURAL HEALTH - KYNETON
file38645	IDNUM	149	157	90N38351
file38645	IDNUM	159	167	90N38351
file38645	IDNUM	159	169	90N383518E
file38645	PATIENT	171	190	SEAQUIST, GUADALUPE
file38645	IDNUM	8	18	90N383518E
file38645	MEDICALRECORD	27	35	10621437
file38769	CITY	4276	4287	KURRI KURRI
file38769	DATE	2151	2161	30/10/2067	2067-10-30
file38769	DATE	4184	4193	10/1/2066	2066-10-01
file38769	DATE	4221	4228	11/2/70	2070-11-02
file38769	DATE	5050	5059	11/3/2067	2067-11-03
file38769	DOCTOR	2186	2193	X Osley
file38769	HOSPITAL	210	248	WAGIN HOSPITAL AND SUTHERLAND HOSPITAL
file38769	IDNUM	8	18	85O724776K
file38769	IDNUM	109	117	85O72477
file38769	IDNUM	118	126	85O72477
file38769	IDNUM	128	136	85O72477
file38769	IDNUM	128	138	85O724776K
file38769	PATIENT	140	155	Grandy, Antonio
file38769	MEDICALRECORD	27	33	366706
file38769	ORGANIZATION	4262	4275	EAST SURGICAL
file38769	PATIENT	2333	2345	Fundus, Body
file38835	DATE	3445	3454	7/10/2070	2070-10-07
file38835	DATE	5513	5522	5/10/2067	2067-10-05
file38835	DOCTOR	3481	3494	H. Wallentine
file38835	DOCTOR	702	710	H. Weihl
file38835	HOSPITAL	183	235	WEST WIMMERA HEALTH SERVICE - JEPARIT AND SUTHERLAND
file38835	HOSPITAL	46	60	OAKEY HOSPITAL
file38835	IDNUM	122	130	27W92558
file38835	IDNUM	132	140	27W92558
file38835	IDNUM	132	142	27W925583G
file38835	PATIENT	144	160	Caddigan, Jessie
file38835	IDNUM	8	18	27W925583G
file38835	MEDICALRECORD	27	34	9336960
file38862	DATE	1694	1703	8/11/2069	2069-11-08
file38862	DATE	463	472	8/10/2067	2067-10-10
file38862	DOCTOR	1575	1583	Clarence
file38862	DATE	1612	1621	4/10/2067	2067-10-04
file38862	DOCTOR	498	506	F Maciag
file38862	HOSPITAL	215	253	CLONCURRY MULTI-PURPOSE HEALTH SERVICE
file38862	HOSPITAL	47	93	TRESILLIAN FAMILY CARE CENTRE - WOLLSTONECRAFT
file38862	IDNUM	155	163	12X47684
file38862	IDNUM	165	173	12X47684
file38862	IDNUM	165	175	12X476840M
file38862	PATIENT	177	192	HORRIGAN, CLAUD
file38862	IDNUM	8	18	12X476840M
file38862	MEDICALRECORD	27	35	10218035
file38975	DATE	2716	2725	11/7/2070	2070-11-07
file38975	DATE	4733	4743	13/11/2069	2069-11-13
file38975	DOCTOR	2748	2755	P Poppo
file38975	HOSPITAL	178	222	NORTHAMPTON HOSPITAL AND SUTHERLAND HOSPITAL
file38975	IDNUM	8	18	53G678557J
file38975	IDNUM	109	117	53G67855
file38975	IDNUM	118	126	53G67855
file38975	IDNUM	128	136	53G67855
file38975	IDNUM	128	138	53G678557J
file38975	PATIENT	140	146	Krauel
file38975	MEDICALRECORD	27	33	367964
file39090	CITY	179	186	STAWELL
file39090	DATE	2470	2479	10/8/2069	2069-10-08
file39090	DATE	4878	4888	16/11/2070	2070-11-16
file39090	DOCTOR	2504	2514	N Vasiliou
file39090	HOSPITAL	179	217	STAWELL REGIONAL HEALTH AND SUTHERLAND
file39090	IDNUM	8	18	58H1188155
file39090	IDNUM	109	117	58H11881
file39090	IDNUM	118	126	58H11881
file39090	IDNUM	128	136	58H11881
file39090	IDNUM	128	138	58H1188155
file39090	PATIENT	140	156	Waisanen, IRVING
file39090	MEDICALRECORD	27	33	082858
file39313	DATE	4977	4987	18/11/2066	2066-11-18
file39313	DATE	8378	8388	23/11/2067	2067-11-23
file39313	DATE	8414	8422	29/11/69	2069-11-29
file39313	DATE	9262	9272	29/11/2069	2069-11-29
file39313	DOCTOR	1149	1163	Courtney Moots
file39313	DOCTOR	1593	1613	theatre 10 Registrar
file39313	DOCTOR	1656	1661	BRYLA
file39313	TIME	1617	1643	11:12am on the 16-Oct-2068	2068-04-16T11:12
file39313	DOCTOR	5010	5017	X Inoue
file39313	HOSPITAL	237	254	THEODORE HOSPITAL
file39313	HOSPITAL	46	70	HAWKER MEMORIAL HOSPITAL
file39313	HOSPITAL	8441	8453	MSI proteins
file39313	DOCTOR	8479	8496	NARROGIN HOSPITAL
file39313	IDNUM	163	171	80Q31052
file39313	IDNUM	173	181	80Q31052
file39313	IDNUM	173	183	80Q310522L
file39313	PATIENT	185	213	Filice, Sammy, ZAC-MARCELENE
file39313	IDNUM	8	18	80Q310522L
file39313	MEDICALRECORD	27	34	8887077
file39342	DATE	1188	1198	20/11/2067	2067-11-20
file39342	DOCTOR	1221	1231	L Pantaleo
file39342	HOSPITAL	186	227	MERREDIN HOSPITAL AND SUTHERLAND HOSPITAL
file39342	HOSPITAL	46	62	QUILPIE HOSPITAL
file39342	IDNUM	124	132	48M33168
file39342	IDNUM	134	142	48M33168
file39342	IDNUM	134	144	48M331680U
file39342	PATIENT	146	163	Florentine, Vinny
file39342	IDNUM	8	18	48M331680U
file39342	MEDICALRECORD	27	34	5878960
file39342	STREET	334	343	Old stoma
file39342	ZIP	268	272	2016
file39380	CITY	224	230	ARARAT
file39380	CITY	47	59	CAMPBELLTOWN
file39380	DATE	1667	1677	25/10/2069	2069-10-25
file39380	DATE	2984	2994	28/11/2067	2067-11-28
file39380	DOCTOR	1700	1709	J Druetta
file39380	DOCTOR	909	916	Mikovec
file39380	DOCTOR	966	975	J Mcnelis
file39380	HOSPITAL	192	245	EAST GRAMPIANS HEALTH SERVICE - ARARAT AND SUTHERLAND
file39380	HOSPITAL	47	68	CAMPBELLTOWN HOSPITAL
file39380	IDNUM	130	138	33N88184
file39380	IDNUM	140	148	33N88184
file39380	IDNUM	140	150	33N881848A
file39380	PATIENT	152	169	Pupa, JOSH Archer
file39380	IDNUM	8	18	33N881848A
file39380	MEDICALRECORD	27	35	10547492
file39472	CITY	206	215	NEWCASTLE
file39472	DATE	2381	2391	22/10/2070	2070-10-22
file39472	DATE	281	289	30/10/70	2070-10-30
file39472	DATE	4079	4087	29/11/69	2069-11-29
file39472	DATE	4112	4120	28/10/67	2067-10-28
file39472	DATE	4679	4687	30/10/66	2066-10-30
file39472	DOCTOR	2414	2423	T Spiotta
file39472	HOSPITAL	179	246	JOHN HUNTER HOSPITAL ROYAL NEWCASTLE CENTRE AND SUTHERLAND HOSPITAL
file39472	IDNUM	8	18	75W083655W
file39472	IDNUM	109	117	75W08365
file39472	IDNUM	118	126	75W08365
file39472	IDNUM	128	136	75W08365
file39472	IDNUM	128	138	75W083655W
file39472	PATIENT	140	156	OTTAWAY, Roberto
file39472	MEDICALRECORD	27	33	365060
file39472	ORGANIZATION	4152	4206	BRIGHAM & WOMEN'S HOSPITAL WALCHA MULTIPURPOSE SERVICE
file39539	DATE	3758	3766	5/2/2067	2067-02-05
file39539	DATE	5300	5308	9/1/2068	2068-01-09
file39539	DOCTOR	3791	3800	H Forshee
file39539	HOSPITAL	194	234	FAR NORTH HEALTH SERVICES AND SUTHERLAND
file39539	HOSPITAL	47	76	CALVARY HEALTH CARE BETHLEHEM
file39539	IDNUM	138	146	33S00471
file39539	IDNUM	148	156	33S00471
file39539	IDNUM	148	158	33S004713F
file39539	PATIENT	160	165	Babey
file39539	IDNUM	8	18	33S004713F
file39539	MEDICALRECORD	27	35	10250093
file39602	DATE	3704	3712	7/1/2071	2071-01-07
file39602	DATE	5006	5015	11/2/2068	2068-11-02
file39602	DOCTOR	3737	3745	F Haring
file39602	HOSPITAL	210	254	NORTHAMPTON HOSPITAL AND SUTHERLAND HOSPITAL
file39602	HOSPITAL	46	79	KOOWEERUP REGIONAL HEALTH SERVICE
file39602	IDNUM	141	149	28T54597
file39602	IDNUM	151	159	28T54597
file39602	IDNUM	151	161	28T545971L
file39602	PATIENT	163	187	Wilshire, YARA-MAY Gavin
file39602	IDNUM	8	18	28T545971L
file39602	MEDICALRECORD	27	34	2391958
file39651	DATE	2994	3003	14/2/2070	2070-02-14
file39651	DOCTOR	3073	3078	U Dec
file39651	HOSPITAL	219	259	EUDUNDA HOSPITAL AND SUTHERLAND HOSPITAL
file39651	HOSPITAL	47	86	FINLEY HOSPITAL & COMMUNITY HEALTH CARE
file39651	IDNUM	148	156	76P57503
file39651	IDNUM	158	166	76P57503
file39651	IDNUM	158	168	76P575039T
file39651	PATIENT	170	196	Colaizzo, BRODERICK ALEXIS
file39651	IDNUM	8	18	76P575039T
file39651	MEDICALRECORD	27	35	10616325
file39812	DATE	287	294	27/1/68	2068-01-27
file39812	DATE	3332	3341	20/1/2067	2067-01-20
file39812	DATE	6408	6415	28/1/68	2068-01-28
file39812	DATE	7162	7169	24/2/67	2067-02-24
file39812	DOCTOR	3364	3372	E. Aslam
file39812	DOCTOR	7146	7155	E Deckers
file39812	DOCTOR	937	944	E. Ginn
file39812	DATE	948	955	17/1/68	2068-01-17
file39812	HOSPITAL	202	252	THE ROYAL WOMEN'S HOSPITAL AND SUTHERLAND HOSPITAL
file39812	HOSPITAL	46	86	THE ROYAL VICTORIAN EYE AND EAR HOSPITAL
file39812	IDNUM	148	156	17Y76774
file39812	IDNUM	158	166	17Y76774
file39812	IDNUM	158	168	17Y767746Q
file39812	PATIENT	170	179	SO, Graig
file39812	IDNUM	8	18	17Y767746Q
file39812	MEDICALRECORD	27	34	0160558
file39951	DATE	2714	2723	22/2/2070	2070-02-22
file39951	DATE	6651	6658	26.2.70	2070-02-26
file39951	DOCTOR	2748	2758	S. Yorkman
file39951	DOCTOR	643	648	Jonas
file39951	DOCTOR	656	667	S. Bordenet
file39951	TIME	671	689	2.10pm on 23.01.70	70-01-23
file39951	DOCTOR	6635	6644	S. Godzik
file39951	HOSPITAL	172	244	ROYAL REHABILITATION HOSPITAL - COORABEL/MOORONG AND SUTHERLAND HOSPITAL
file39951	IDNUM	8	18	75U898804Z
file39951	IDNUM	109	117	75U89880
file39951	IDNUM	119	127	75U89880
file39951	IDNUM	119	129	75U898804Z
file39951	PATIENT	131	138	Berkich
file39951	PATIENT	131	149	Berkich, Frederick
file39951	MEDICALRECORD	27	33	020652
file40093	CITY	177	186	REDCLIFFE
file40093	DATE	2024	2033	28/2/2068	2068-02-28
file40093	DATE	4369	4378	26/2/2070	2070-02-26
file40093	DOCTOR	2056	2068	M. Derenthal
file40093	DOCTOR	5074	5082	M. Kutlu
file40093	DOCTOR	651	655	Sang
file40093	DOCTOR	673	680	M. Palk
file40093	HOSPITAL	177	195	REDCLIFFE HOSPITAL
file40093	IDNUM	8	18	44I419710S
file40093	IDNUM	109	117	44I41971
file40093	IDNUM	119	127	44I41971
file40093	IDNUM	119	129	44I419710S
file40093	PATIENT	131	154	FELICIA, AKILAH RODRIGO
file40093	MEDICALRECORD	27	33	071227
file40222	CITY	46	58	MUSWELLBROOK
file40222	DATE	1804	1813	25/2/2068	2068-02-25
file40222	DATE	3896	3904	1/2/2070	2070-02-01
file40222	DOCTOR	1838	1850	J. Streicher
file40222	DOCTOR	4602	4612	J. Collons
file40222	DOCTOR	654	660	Norman
file40222	DOCTOR	668	674	J. Adu
file40222	TIME	678	685	25.1.68	2068-01-25
file40222	HOSPITAL	192	234	CARNARVON HOSPITAL AND SUTHERLAND HOSPITAL
file40222	HOSPITAL	46	67	MUSWELLBROOK HOSPITAL
file40222	IDNUM	129	137	39I95007
file40222	IDNUM	139	147	39I95007
file40222	IDNUM	139	149	39I9500789
file40222	PATIENT	151	169	Haseman, ADALBERTO
file40222	IDNUM	8	18	39I9500789
file40222	MEDICALRECORD	27	34	4525303
file40292	DATE	1512	1521	28/2/2067	2067-02-28
file40292	DATE	2700	2709	26/1/2071	2071-01-26
file40292	DOCTOR	1543	1552	T Gatrell
file40292	HOSPITAL	176	218	CAMPBELL TOWN HEALTH AND COMMUNITY SERVICE
file40292	IDNUM	8	18	71R1527858
file40292	IDNUM	109	117	71R15278
file40292	IDNUM	119	127	71R15278
file40292	IDNUM	119	129	71R1527858
file40292	PATIENT	131	153	Wojtanik, Fausto Rubin
file40292	MEDICALRECORD	27	33	309872
file40374	CITY	210	218	GOULBURN
file40374	CITY	235	245	SHEPPARTON
file40374	DATE	1291	1300	27/1/2068	2068-01-27
file40374	DATE	1359	1367	2/1/2070	2070-01-02
file40374	DOCTOR	1392	1400	R Khalsa
file40374	HOSPITAL	210	267	GOULBURN VALLEY HEALTH - SHEPPARTON CAMPUS AND SUTHERLAND
file40374	HOSPITAL	47	68	SHELLHARBOUR HOSPITAL
file40374	IDNUM	130	138	66S60204
file40374	IDNUM	140	148	66S60204
file40374	IDNUM	140	150	66S602043B
file40374	IDNUM	8	18	66S602043B
file40374	MEDICALRECORD	27	35	10673738
file40521	CITY	242	250	ADELAIDE
file40521	DATE	191	199	2/9/2068	2068-09-02
file40521	DOCTOR	2600	2609	S Dillman
file40521	DOCTOR	6472	6478	S Addo
file40521	DATE	6479	6487	2/7/2071	2071-02-07
file40521	DOCTOR	935	943	S Legeyt
file40521	HOSPITAL	232	259	THE ROYAL ADELAIDE HOSPITAL
file40521	HOSPITAL	46	62	BELMONT HOSPITAL
file40521	IDNUM	124	132	71W47465
file40521	IDNUM	134	142	71W47465
file40521	IDNUM	134	144	71W474650A
file40521	PATIENT	146	162	HABERKAMP, DIANA
file40521	IDNUM	8	18	71W474650A
file40521	MEDICALRECORD	27	34	0259192
file40560	CITY	237	248	MARYBOROUGH
file40560	DATE	1252	1260	2/5/2068	2068-02-05
file40560	DATE	2211	2219	3/5/2068	2068-03-05
file40560	DOCTOR	1283	1289	Q Swab
file40560	DOCTOR	670	676	Oliver
file40560	HOSPITAL	237	257	MARYBOROUGH HOSPITAL
file40560	HOSPITAL	46	103	DELORAINE DISTRICT HOSPITAL AND COMMUNITY HEALTH SERVICES
file40560	IDNUM	165	173	66X82581
file40560	IDNUM	175	183	66X82581
file40560	IDNUM	175	185	66X825818G
file40560	PATIENT	187	214	CHARTIER, REID Garret MARIA
file40560	IDNUM	8	18	66X825818G
file40560	MEDICALRECORD	27	34	9851877
file40603	CITY	165	171	BOWRAL
file40603	DATE	1880	1888	4/2/2068	2068-02-04
file40603	DATE	2698	2706	6/2/2067	2067-06-06
file40603	DOCTOR	1912	1918	E Papa
file40603	HOSPITAL	165	180	BOWRAL HOSPITAL
file40603	IDNUM	8	18	14T946976O
file40603	IDNUM	109	117	14T94697
file40603	IDNUM	119	127	14T94697
file40603	IDNUM	119	129	14T946976O
file40603	PATIENT	131	142	VACA, Marco
file40603	MEDICALRECORD	27	33	020652
file40730	DATE	130	137	17/2/71	2071-02-17
file40730	DATE	2062	2070	2/6/2068	2068-06-02
file40730	DATE	4393	4400	17/3/71	2071-03-17
file40730	DATE	5143	5150	15/2/71	2071-02-15
file40730	DOCTOR	2092	2101	O Brokins
file40730	DOCTOR	5127	5136	O Scholer
file40730	HOSPITAL	199	237	WEIPA HOSPITAL AND SUTHERLAND HOSPITAL
file40730	IDNUM	139	147	56C14768
file40730	IDNUM	149	157	56C14768
file40730	IDNUM	149	159	56C1476824
file40730	PATIENT	161	167	Morand
file40730	IDNUM	8	18	56C1476824
file40730	MEDICALRECORD	27	33	020062
file40807	DATE	2352	2360	7/3/2071	2071-07-03
file40807	DATE	5618	5626	6/2/2070	2070-06-02
file40807	DOCTOR	2383	2393	M Matheney
file40807	HOSPITAL	167	208	NARROGIN HOSPITAL AND SUTHERLAND HOSPITAL
file40807	IDNUM	4125	4133	40D58894
file40807	IDNUM	8	18	40D5889406
file40807	IDNUM	109	117	40D58894
file40807	IDNUM	119	127	40D58894
file40807	IDNUM	119	129	40D5889406
file40807	PATIENT	131	144	Rado, DARRICK
file40807	MEDICALRECORD	27	33	366907
file40807	MEDICALRECORD	272	282	801588.YLC
file40879	CITY	180	191	KURRI KURRI
file40879	DATE	4291	4299	8/2/2071	2071-02-08
file40879	DATE	6498	6506	9/3/2071	2071-09-03
file40879	DOCTOR	4324	4334	A Verdusco
file40879	HOSPITAL	180	209	KURRI KURRI DISTRICT HOSPITAL
file40879	IDNUM	8	18	08Z609909A
file40879	IDNUM	109	117	08Z60990
file40879	IDNUM	118	126	08Z60990
file40879	IDNUM	128	136	08Z60990
file40879	IDNUM	128	138	08Z609909A
file40879	PATIENT	140	157	Jarema, Tony REID
file40879	MEDICALRECORD	27	33	369315
file41008	DOCTOR	2364	2371	L Dedon
file41008	DOCTOR	4430	4436	L Ezra
file41008	DOCTOR	685	692	Ignacio
file41008	HOSPITAL	176	215	WARREN HOSPITAL AND SUTHERLAND HOSPITAL
file41008	IDNUM	8	18	40I801715W
file41008	IDNUM	109	117	40I80171
file41008	IDNUM	119	127	40I80171
file41008	IDNUM	119	129	40I801715W
file41008	PATIENT	131	153	Newmark, Jessie Marlon
file41008	MEDICALRECORD	27	33	254137
file41072	DATE	4676	4685	14/3/2070	2070-03-14
file41072	DATE	7905	7914	17/3/2068	2068-03-17
file41072	DOCTOR	2476	2482	Tester
file41072	DOCTOR	2529	2537	I Panter
file41072	TIME	2501	2511	16/03/2068	2068-03-16T12:10
file41072	DOCTOR	4710	4717	I Kahan
file41072	DOCTOR	875	883	Mourning
file41072	DOCTOR	937	945	I Larman
file41072	DOCTOR	937	938	I
file41072	DOCTOR	954	955	I
file41072	TIME	909	919	15/02/2070	2070-02-15T12:10
file41072	HOSPITAL	181	221	EMERALD HOSPITAL AND SUTHERLAND HOSPITAL
file41072	HOSPITAL	46	63	MITCHELL HOSPITAL
file41072	IDNUM	125	133	35J25197
file41072	IDNUM	135	143	35J25197
file41072	IDNUM	135	145	35J251973C
file41072	PATIENT	147	158	Rayes, DEAN
file41072	IDNUM	8	18	35J251973C
file41072	MEDICALRECORD	27	34	5848337
file41194	DATE	150	157	21/2/67	2067-02-21
file41194	DATE	1876	1885	15/3/2068	2068-03-15
file41194	DATE	3750	3759	19/3/2067	2067-03-19
file41194	DATE	3937	3944	22/2/71	2071-02-22
file41194	DATE	4691	4698	25/2/68	2068-02-25
file41194	DOCTOR	1910	1920	X. Holzman
file41194	DOCTOR	4675	4684	X Granade
file41194	DOCTOR	713	721	X. Katie
file41194	DATE	725	732	16.3.67	2067-03-16
file41194	HOSPITAL	219	238	SPRINGSURE HOSPITAL
file41194	HOSPITAL	46	67	MOYNE HEALTH SERVICES
file41194	IDNUM	159	167	83F37203
file41194	IDNUM	169	177	83F37203
file41194	IDNUM	169	179	83F372031L
file41194	PATIENT	181	195	Wen, FRANCESCA
file41194	IDNUM	8	18	83F372031L
file41194	MEDICALRECORD	27	34	0330619
file41247	DATE	2737	2746	18/2/2071	2071-02-18
file41247	DATE	4705	4714	22/3/2071	2071-03-22
file41247	DOCTOR	2772	2782	H. Billing
file41247	HOSPITAL	171	222	HENTY MULTI PURPOSE SERVICE AND SUTHERLAND HOSPITAL
file41247	IDNUM	8	18	25O574848H
file41247	IDNUM	109	117	25O57484
file41247	IDNUM	119	127	25O57484
file41247	PATIENT	131	148	VIVIER, KEVEN Sam
file41247	MEDICALRECORD	27	33	370319
file41366	CITY	211	219	GOULBURN
file41366	CITY	236	242	TATURA
file41366	DATE	130	137	26/3/68	2068-03-26
file41366	DATE	2054	2063	25/3/2068	2068-03-25
file41366	DATE	3996	4003	22/2/67	2067-02-22
file41366	DATE	4029	4036	23/2/67	2067-02-23
file41366	DATE	4449	4457	24/12/68	2068-12-24
file41366	DOCTOR	2088	2099	V Tartaglia
file41366	HOSPITAL	211	264	GOULBURN VALLEY HEALTH - TATURA CAMPUS AND SUTHERLAND
file41366	IDNUM	139	147	18H14252
file41366	IDNUM	158	168	18K328837O
file41366	PATIENT	170	187	BOLVIN, ROOSEVELT
file41366	IDNUM	8	18	18K328837O
file41366	MEDICALRECORD	27	33	370784
file41366	ORGANIZATION	4115	4117	A8
file41429	DOCTOR	1273	1284	F Wnukowski
file41429	HOSPITAL	219	271	SOUTH EAST REGIONAL HOSPITAL AND SUTHERLAND HOSPITAL
file41429	HOSPITAL	46	84	BOOROWA MULTI PURPOSE SERVICE HOSPITAL
file41429	IDNUM	146	154	25T89661
file41429	IDNUM	156	164	25T89661
file41429	IDNUM	156	166	25T896613M
file41429	PATIENT	168	196	Abarca, Barton, Simon-ISRAEL
file41429	IDNUM	8	18	25T896613M
file41429	MEDICALRECORD	27	34	0692200
file41472	CITY	46	51	COLAC
file41472	DATE	2276	2285	27/2/2070	2070-02-27
file41472	DATE	3116	3125	30/3/2067	2067-03-30
file41472	DOCTOR	2309	2317	D Liburd
file41472	HOSPITAL	199	256	DELORAINE DISTRICT HOSPITAL AND COMMUNITY HEALTH SERVICES
file41472	HOSPITAL	46	63	COLAC AREA HEALTH
file41472	IDNUM	125	133	10U23787
file41472	IDNUM	135	143	10U23787
file41472	IDNUM	135	145	10U2378717
file41472	PATIENT	147	176	Knapper, ART ROOSEVELT Elwood
file41472	IDNUM	8	18	10U2378717
file41472	MEDICALRECORD	27	34	9916208
file41651	CITY	196	203	KYABRAM
file41651	DATE	2845	2853	3/1/2071	2071-01-03
file41651	DATE	6846	6855	30/3/2067	2067-03-30
file41651	DATE	7595	7603	05.12.18	2018-12-05
file41651	DOCTOR	2875	2887	N Strosnider
file41651	DOCTOR	7579	7588	N Wisenor
file41651	HOSPITAL	196	245	KYABRAM & DISTRICT HEALTH SERVICES AND SUTHERLAND
file41651	HOSPITAL	46	74	ROYAL PRINCE ALFRED HOSPITAL
file41651	IDNUM	136	144	51C53968
file41651	IDNUM	146	154	51C53968
file41651	IDNUM	146	156	51C539688O
file41651	PATIENT	158	173	Whipkey, Booker
file41651	IDNUM	8	18	51C539688O
file41651	MEDICALRECORD	27	34	8697781
file41694	DATE	2177	2186	29/3/2068	2068-03-29
file41694	DATE	3739	3747	1/8/2067	2067-08-01
file41694	DATE	795	806	10, 28/3/71	2071-03-28
file41694	DOCTOR	2210	2222	Q. Decoursey
file41694	HOSPITAL	192	247	EAST WIMMERA HEALTH SERVICE - WYCHEPROOF AND SUTHERLAND
file41694	HOSPITAL	47	73	CRAIGIEBURN HEALTH SERVICE
file41694	IDNUM	135	143	67V58079
file41694	IDNUM	145	153	67V58079
file41694	IDNUM	145	155	67V580794G
file41694	PATIENT	157	169	CONYER, Sang
file41694	IDNUM	8	18	67V580794G
file41694	MEDICALRECORD	27	35	10675386
file41834	DATE	1928	1936	3/2/2068	2068-03-02
file41834	DATE	4323	4331	1/8/2068	2068-08-01
file41834	DOCTOR	1958	1967	O Pringle
file41834	DOCTOR	5041	5047	O Galm
file41834	DOCTOR	550	560	O Dillavou
file41834	HOSPITAL	174	191	ANGASTON HOSPITAL
file41834	IDNUM	8	18	52W0210524
file41834	IDNUM	107	115	52W02105
file41834	IDNUM	117	125	52W02105
file41834	IDNUM	117	127	52W0210524
file41834	PATIENT	129	151	Krabill, Oren JEREMIAH
file41834	MEDICALRECORD	27	31	5024
file41834	ZIP	27	31	5024
file41984	DATE	130	137	13/2/68	2068-02-13
file41984	DATE	2887	2895	2/4/2070	2070-02-04
file41984	DATE	4879	4887	4/2/2071	2071-02-04
file41984	DATE	4913	4920	13/1/67	2067-01-13
file41984	DATE	5668	5675	14/2/71	2071-02-14
file41984	DOCTOR	2920	2928	H Hedges
file41984	DOCTOR	5651	5661	H Grisanti
file41984	DOCTOR	688	692	Doug
file41984	DOCTOR	700	709	H. Wilusz
file41984	TIME	713	731	5.00pm on 30.03.70	2070-03-30
file41984	HOSPITAL	200	214	TEXAS HOSPITAL
file41984	IDNUM	139	147	31J64297
file41984	IDNUM	149	157	31J64297
file41984	IDNUM	149	159	31J6429782
file41984	PATIENT	161	176	MORICE, Charlie
file41984	IDNUM	8	18	31J6429782
file41984	MEDICALRECORD	27	33	211359
file42032	DATE	1492	1501	10/2/2068	2068-10-02
file42032	DOCTOR	1525	1532	B Cordy
file42032	HOSPITAL	173	211	LOGAN HOSPITAL AND SUTHERLAND HOSPITAL
file42032	IDNUM	46	50	B083
file42032	IDNUM	8	18	00X374985Z
file42032	IDNUM	112	120	00X37498
file42032	IDNUM	122	130	00X37498
file42032	IDNUM	122	132	00X374985T
file42032	PATIENT	134	150	Fida, REX MIQUEL
file42032	MEDICALRECORD	27	34	0358673
file42064	DOCTOR	1183	1191	L Verdin
file42064	HOSPITAL	175	197	IVANHOE HEALTH SERVICE
file42064	IDNUM	8	18	42G566692W
file42064	IDNUM	109	117	42G56669
file42064	IDNUM	119	127	42G56669
file42064	IDNUM	119	129	42G566692W
file42064	PATIENT	131	152	ROBSON, JUDITH CAROLE
file42064	MEDICALRECORD	27	33	254137
file42213	DATE	3968	3977	11/2/2070	2070-11-11
file42213	DATE	6659	6668	14/1/2071	2071-01-14
file42213	DATE	7378	7386	13.12.18	2018-12-13
file42213	DOCTOR	4003	4017	J. Moodispaugh
file42213	DOCTOR	604	614	J. Gulling
file42213	DATE	588	596	7/2/2067	2067-02-07
file42213	DOCTOR	7363	7371	J. Swett
file42213	HOSPITAL	170	184	TEXAS HOSPITAL
file42213	IDNUM	8	18	37H916959C
file42213	IDNUM	109	117	37H91695
file42213	IDNUM	119	127	37H91695
file42213	IDNUM	119	129	37H916959F
file42213	PATIENT	131	147	DILCHAND, BUSTER
file42213	MEDICALRECORD	27	33	371608
file42423	CITY	206	213	SEYMOUR
file42423	DATE	130	137	17/1/67	2067-01-17
file42423	DATE	3271	3279	2/7/2070	2070-07-02
file42423	DATE	7377	7384	17/1/67	2067-01-17
file42423	DATE	7409	7416	17/1/70	2070-01-17
file42423	DATE	8549	8556	20/2/71	2071-02-20
file42423	DOCTOR	3303	3309	X Duda
file42423	DOCTOR	617	619	X.
file42423	DATE	600	609	2/10/2067	2067-10-02
file42423	DOCTOR	8529	8542	X Hochstedler
file42423	HOSPITAL	206	235	SEYMOUR HEALTH AND SUTHERLAND
file42423	IDNUM	139	147	95D03791
file42423	IDNUM	149	157	95D03791
file42423	IDNUM	149	159	95D037918M
file42423	PATIENT	161	182	KUBIS, Jed CLEMENTINA
file42423	IDNUM	8	18	95D037918K
file42423	MEDICALRECORD	27	33	185823
file42485	DATE	2413	2422	14/2/2069	2069-02-14
file42485	DATE	3745	3754	15/2/2069	2069-02-15
file42485	DOCTOR	2447	2457	H Compagna
file42485	DOCTOR	635	643	H. Torra
file42485	HOSPITAL	172	214	CAMPBELL TOWN HEALTH AND COMMUNITY SERVICE
file42485	IDNUM	8	18	26L239724H
file42485	IDNUM	113	121	26L23972
file42485	IDNUM	123	131	26L23972
file42485	IDNUM	123	133	26L239724F
file42485	PATIENT	135	149	DARGIS, ARCHIE
file42485	MEDICALRECORD	27	35	10605287
file42576	DATE	547	555	09J76917	2066-10-09
file42576	DOCTOR	3296	3305	C Robaina
file42576	DOCTOR	963	972	C. Stiern
file42576	TIME	976	984	12:10 pm	2066-10-12
file42576	HOSPITAL	188	240	SOUTH EAST REGIONAL HOSPITAL AND SUTHERLAND HOSPITAL
file42576	HOSPITAL	47	62	WONDAI HOSPITAL
file42576	IDNUM	124	132	09J76917
file42576	IDNUM	134	142	09J76917
file42576	IDNUM	134	144	09J769175B
file42576	PATIENT	146	165	ALLGIRE, NEB-Darren
file42576	IDNUM	8	18	09J769175B
file42576	MEDICALRECORD	27	35	10019150
file42576	ZIP	483	487	2066
file42576	ZIP	606	610	2066
file42642	DATE	2946	2955	19/2/2070	2070-02-19
file42642	DATE	4602	4611	27/2/2067	2067-02-27
file42642	DOCTOR	2978	2987	F Diruzzo
file42642	DOCTOR	769	770	F
file42642	TIME	745	761	12pm on 18/02/71	2071-02-18T12:00
file42642	HOSPITAL	181	223	CAMPBELL TOWN HEALTH AND COMMUNITY SERVICE
file42642	HOSPITAL	46	63	MITCHELL HOSPITAL
file42642	IDNUM	125	133	21M77998
file42642	IDNUM	135	143	21M77998
file42642	IDNUM	135	145	21M779982N
file42642	PATIENT	147	158	Datz, TAMMI
file42642	IDNUM	8	18	21M779982N
file42642	MEDICALRECORD	27	34	7745394
file42687	DATE	1922	1931	20/1/2071	2071-01-20
file42687	DATE	2800	2809	25/1/2071	2071-01-25
file42687	DOCTOR	1954	1962	P Sehorn
file42687	HOSPITAL	197	241	GNOWANGERUP HOSPITAL AND SUTHERLAND HOSPITAL
file42687	HOSPITAL	46	75	CONDOBOLIN RETIREMENT VILLAGE
file42687	IDNUM	137	145	63V97179
file42687	IDNUM	147	155	63V97179
file42687	IDNUM	147	157	63V971799J
file42687	PATIENT	159	174	Shirakawa, MIKE
file42687	IDNUM	8	18	63V971799J
file42687	MEDICALRECORD	27	34	8697781
file42758	DATE	4423	4432	24/2/2067	2067-02-24
file42758	DATE	5923	5932	28/2/2068	2068-02-28
file42758	DATE	743	753	23/01/2067	2067-01-23
file42758	DOCTOR	4458	4466	J. Sudol
file42758	HOSPITAL	189	239	BARWON HEALTH - ASHLEY MANOR CAMPUS AND SUTHERLAND
file42758	HOSPITAL	46	64	THE TWEED HOSPITAL
file42758	IDNUM	126	134	32J50370
file42758	IDNUM	136	144	32J50370
file42758	IDNUM	136	146	32J503705D
file42758	PATIENT	148	166	BALLESTER, EVERETT
file42758	IDNUM	8	18	32J503705D
file42758	MEDICALRECORD	27	34	0554197
file42783	CITY	46	59	MOUNT GAMBIER
file42783	DOCTOR	1663	1671	G Lesure
file42783	DOCTOR	2253	2258	G Guo
file42783	HOSPITAL	46	88	MOUNT GAMBIER AND DISTRICTS HEALTH SERVICE
file42783	IDNUM	8	18	27K043963J
file42783	MEDICALRECORD	27	34	2076986
file42826	DATE	3265	3272	15/5/69	2069-05-15
file42826	DOCTOR	2252	2261	Q Saunier
file42826	HOSPITAL	46	63	ATHERTON HOSPITAL
file42826	IDNUM	8	18	69S245770G
file42826	MEDICALRECORD	27	34	2755061
file42855	DOCTOR	1954	1962	F Maclay
file42855	HOSPITAL	47	88	BARWON HEALTH - NEWCOMB RENAL UNIT CAMPUS
file42855	IDNUM	8	18	27P366738O
file42855	MEDICALRECORD	27	35	10461205
file42972	DOCTOR	2634	2644	D Paravano
file42972	HOSPITAL	46	84	CLONCURRY MULTI-PURPOSE HEALTH SERVICE
file42972	IDNUM	8	18	12Q717096U
file42972	MEDICALRECORD	27	34	0334666
file43039	CITY	47	59	MUSWELLBROOK
file43039	DATE	2964	2971	16/4/70	2070-04-16
file43039	DATE	4845	4852	17/5/66	2066-05-17
file43039	DOCTOR	3003	3012	N Murriel
file43039	DOCTOR	785	789	Boyt
file43039	DOCTOR	809	816	N Curly
file43039	TIME	820	838	4:39pm on 14/05/66	2066-05-14T14:39
file43039	HOSPITAL	47	68	MUSWELLBROOK HOSPITAL
file43039	IDNUM	8	18	54Y908703R
file43039	MEDICALRECORD	27	35	10469217
file43065	DATE	1233	1240	16/5/67	2067-05-16
file43065	DOCTOR	1272	1279	B Lagos
file43065	DOCTOR	1297	1304	B Turck
file43065	HOSPITAL	46	72	THE ROYAL WOMEN'S HOSPITAL
file43065	IDNUM	8	18	01U039861Z
file43065	MEDICALRECORD	27	34	1500560
file43136	DATE	1746	1753	20/5/70	2070-05-20
file43136	DEPARTMENT	3114	3132	Molecular Oncology
file43136	HOSPITAL	3134	3172	MUNDUBBERA MULTIPURPOSE HEALTH SERVICE
file43136	DOCTOR	1785	1793	V Gauger
file43136	HOSPITAL	45	69	PEAK HILL HEALTH SERVICE
file43136	IDNUM	8	18	80I651778T
file43136	MEDICALRECORD	27	33	335132
file43192	DATE	2428	2435	17/5/66	2066-05-17
file43192	DOCTOR	1276	1281	Heigl
file43192	DOCTOR	1301	1310	O Dejongh
file43192	TIME	1331	1351	15:08hrs on 18/04/66	2066-04-18T15:08
file43192	DOCTOR	2467	2476	O Koinzan
file43192	DOCTOR	480	486	Kubicz
file43192	DOCTOR	493	505	O Policastro
file43192	DOCTOR	513	519	O Imig
file43192	TIME	523	543	14:40hrs on 18/05/69	2069-05-18T14:40
file43192	HOSPITAL	46	68	MAITLAND HOSPITAL (SA)
file43192	IDNUM	8	18	59W372794N
file43192	MEDICALRECORD	27	34	1147777
file43192	STATE	65	67	SA
file43336	DATE	3924	3931	20/5/66	2066-05-20
file43336	DATE	5172	5179	17/4/66	2066-04-17
file43336	DOCTOR	5211	5223	M Fahnestock
file43336	HOSPITAL	46	70	HAWKER MEMORIAL HOSPITAL
file43336	IDNUM	8	18	44W713952T
file43336	MEDICALRECORD	27	34	3376234
file43336	STREET	9951	9958	Pleural
file43359	DATE	2525	2532	19/5/67	2067-05-19
file43359	DOCTOR	2562	2569	W Louge
file43359	HOSPITAL	47	63	EMERALD HOSPITAL
file43359	IDNUM	2592	2600	86F91576
file43359	IDNUM	8	18	86F915769P
file43359	MEDICALRECORD	27	35	10371845
file43535	DATE	3945	3952	22/4/70	2070-04-22
file43535	DATE	7208	7215	24/7/66	2066-07-24
file43535	DOCTOR	1624	1630	Dedios
file43535	DOCTOR	3984	3992	K Arruda
file43535	DOCTOR	761	768	K Ziech
file43535	DOCTOR	769	778	K Charron
file43535	TIME	782	805	10:30 hours on 21/05/66	2066-05-21T10:30
file43535	HOSPITAL	47	75	PORT MACQUARIE BASE HOSPITAL
file43535	IDNUM	8	18	44B045827Y
file43535	MEDICALRECORD	27	35	10464448
file43559	DATE	3285	3292	18.5.70	2070-05-18
file43559	DATE	4604	4611	21/4/69	2069-04-21
file43559	DOCTOR	4641	4650	I Noguera
file43559	HOSPITAL	46	64	THE TWEED HOSPITAL
file43559	IDNUM	203	211	39C48608
file43559	IDNUM	8	18	39C486085E
file43559	MEDICALRECORD	27	34	1319741
file43608	DATE	1521	1528	25/4/66	2066-04-25
file43608	DATE	171	178	20.4.70	2070-04-20
file43608	DATE	3828	3835	30.5.69	2069-05-30
file43608	DOCTOR	1560	1570	X Ayersman
file43608	DOCTOR	4205	4211	X Buie
file43608	HOSPITAL	46	87	MALLEE TRACK HEALTH AND COMMUNITY SERVICE
file43608	IDNUM	8	18	87Z5070435
file43608	MEDICALRECORD	27	34	4761322
file43664	CITY	5256	5265	MILLICENT
file43664	CITY	5318	5327	CHURCHILL
file43664	DATE	2385	2392	22/5/67	2067-05-22
file43664	DATE	615	631	20 December 2068	2068-10-20
file43664	DOCTOR	2424	2434	H Zeltmann
file43664	DOCTOR	1004	1013	H Bronder
file43664	DOCTOR	1020	1030	H Jacobsen
file43664	TIME	1034	1055	11:05am on 23/05/2066	2066-05-23
file43664	HOSPITAL	47	61	OAKEY HOSPITAL
file43664	HOSPITAL	5256	5307	MILLICENT AND DISTRICT HOSPITAL AND HEALTH SERVICES
file43664	HOSPITAL	5318	5327	CHURCHILL
file43664	IDNUM	8	18	29H709850J
file43664	MEDICALRECORD	27	35	10477853
file43664	ZIP	627	631	2068
file43731	DATE	143	150	28/4/70	2070-04-28
file43731	DATE	1729	1736	27/4/70	2070-04-27
file43731	DATE	2759	2766	25/4/67	2067-04-25
file43731	DOCTOR	1768	1776	A Losado
file43731	HOSPITAL	46	62	BALMAIN HOSPITAL
file43731	IDNUM	8	18	07V320866D
file43731	MEDICALRECORD	27	34	1472214
file43731	ORGANIZATION	2183	2196	MACQUARIEWARD
file43731	HOSPITAL	2198	2224	THE ROYAL WOMEN'S HOSPITAL
file43731	ORGANIZATION	3021	3026	Seals
file43731	HOSPITAL	3028	3069	MALLEE TRACK HEALTH AND COMMUNITY SERVICE
file43791	DATE	150	157	27.3.68	2068-03-27
file43791	DATE	2919	2926	25/3/68	2068-03-25
file43791	DATE	4358	4365	27.3.68	2068-03-27
file43791	DOCTOR	2958	2966	U Mulero
file43791	DOCTOR	3958	3970	U Schlumaker
file43791	DOCTOR	960	969	Roosevelt
file43791	DOCTOR	976	985	Y Baucher
file43791	TIME	989	1010	11:15am on 24/03/2068	2068-03-24T11:15
file43791	HOSPITAL	46	66	DIRRANBANDI HOSPITAL
file43791	IDNUM	8	18	92W871024J
file43791	MEDICALRECORD	27	34	2620974
file43908	CITY	46	52	LEETON
file43908	DATE	1919	1926	23/5/66	2066-05-23
file43908	DOCTOR	1958	1968	I Brumwell
file43908	HOSPITAL	46	70	LEETON DISTRICT HOSPITAL
file43908	IDNUM	8	18	34F073831F
file43908	MEDICALRECORD	27	34	1416053
file43908	ORGANIZATION	3363	3382	Douglass Hanly Moir
file43908	ORGANIZATION	4992	5002	Immunology
file43908	HOSPITAL	5004	5022	CHERBOURG HOSPITAL
file44005	CITY	257	267	DENILIQUIN
file44005	CITY	46	55	BALRANALD
file44005	DATE	1679	1686	20/4/69	2069-04-20
file44005	DEPARTMENT	241	255	12 Humphrey St
file44005	HOSPITAL	269	287	Northern Territory
file44005	HOSPITAL	289	293	6433
file44005	DOCTOR	1718	1729	G Florencio
file44005	DOCTOR	293	303	B-Jul-1989
file44005	DOCTOR	329	346	Adam KIM Mcneilly
file44005	HOSPITAL	358	369	28-Mar-2068
file44005	HOSPITAL	46	77	BALRANALD MULTI PURPOSE SERVICE
file44005	IDNUM	150	160	29F513099L
file44005	IDNUM	8	18	29F513099L
file44005	MEDICALRECORD	184	206	29525887 (2925130.YXL)
file44005	MEDICALRECORD	27	34	1172177
file44005	PATIENT	213	221	Gabriele
file44005	STATE	269	287	Northern Territory
file44005	ZIP	289	293	6433
file44141	DOCTOR	2923	2931	U Chiera
file44141	HOSPITAL	46	79	KOOWEERUP REGIONAL HEALTH SERVICE
file44141	IDNUM	8	18	77C534157U
file44141	MEDICALRECORD	27	34	7705341
file44194	CITY	47	54	LATROBE
file44194	DATE	4772	4779	11/5/66	2066-11-05
file44194	DOCTOR	2559	2569	E Litterer
file44194	HOSPITAL	47	72	LATROBE REGIONAL HOSPITAL
file44194	IDNUM	8	18	19K736964Q
file44194	MEDICALRECORD	27	35	10487079
file44248	DATE	2646	2653	21/4/69	2069-04-21
file44248	DOCTOR	2685	2694	T Metelko
file44248	HOSPITAL	46	70	SOUTH GIPPSLAND HOSPITAL
file44248	IDNUM	8	18	77H856922Z
file44248	MEDICALRECORD	27	34	6512926
file44277	DOCTOR	1949	1961	GARLAND ELIO
file44277	DOCTOR	1968	1975	Q Kazar
file44277	TIME	1979	2000	15:35hr on 20/04/2070	2070-04-20T15:35
file44277	DOCTOR	2258	2267	Q Beckner
file44277	DOCTOR	954	972	COLUMBUS Champagne
file44277	DOCTOR	979	988	Q Nakatsu
file44277	TIME	1002	1023	15:00 hrs on 20/04/69	2063-04-20T15:00
file44277	HOSPITAL	46	68	MAITLAND HOSPITAL (SA)
file44277	IDNUM	8	18	62I207180F
file44277	MEDICALRECORD	27	34	2197640
file44277	STATE	65	67	SA
file44277	STREET	1909	1915	Benign
file44328	DOCTOR	2839	2852	R Cirrincione
file44328	HOSPITAL	46	69	MONASH HEALTH COMMUNITY
file44328	IDNUM	8	18	67M079797E
file44328	MEDICALRECORD	27	34	2488704
file44366	DATE	2582	2589	5.11.66	2066-11-05
file44366	DOCTOR	1820	1826	P Stoy
file44366	HOSPITAL	47	65	PEMBERTON HOSPITAL
file44366	IDNUM	8	18	51M520054K
file44366	MEDICALRECORD	27	35	10482279
file44437	DOCTOR	2092	2103	Z Wilkening
file44437	HOSPITAL	46	64	ST GEORGE HOSPITAL
file44437	IDNUM	8	18	93V721861G
file44437	MEDICALRECORD	27	34	9059309
file44437	ORGANIZATION	3026	3042	QUILPIE HOSPITAL
file44467	DEPARTMENT	335	343	Previous
file44467	DOCTOR	2065	2074	X Tentler
file44467	DOCTOR	2098	2106	X Oberly
file44467	HOSPITAL	46	64	ESPERANCE HOSPITAL
file44467	IDNUM	8	18	98W262029M
file44467	MEDICALRECORD	27	34	5902640
file44497	DOCTOR	1981	1988	L Jundt
file44497	HOSPITAL	47	62	KINGSTON CENTRE
file44497	IDNUM	8	18	46S283077V
file44497	MEDICALRECORD	27	35	10486288
file44522	DOCTOR	782	793	V Hayashida
file44522	HOSPITAL	46	65	YARRA RANGES HEALTH
file44522	IDNUM	8	18	88B484894R
file44522	MEDICALRECORD	27	34	2517899
file44603	DATE	2453	2460	15/6/70	2070-06-15
file44603	DOCTOR	161	170	K Gritsch
file44603	DATE	172	179	23.4.68	2068-04-23
file44603	DOCTOR	2492	2498	K Fret
file44603	DOCTOR	2516	2528	K Jaskiewicz
file44603	HOSPITAL	47	80	KOOWEERUP REGIONAL HEALTH SERVICE
file44603	IDNUM	8	18	36X415942A
file44603	MEDICALRECORD	27	35	10498954
file44648	CITY	46	59	TENNANT CREEK
file44648	DATE	1658	1665	10/5/70	2070-10-05
file44648	DOCTOR	1697	1704	I Hauge
file44648	HOSPITAL	46	68	TENNANT CREEK HOSPITAL
file44648	IDNUM	8	18	31Y956100G
file44648	MEDICALRECORD	27	34	2154178
file44700	DATE	2337	2344	14/6/69	2069-06-14
file44700	DOCTOR	2376	2387	S Foxworthy
file44700	HOSPITAL	46	73	MANSFIELD DISTRICT HOSPITAL
file44700	IDNUM	8	18	89U976268P
file44700	MEDICALRECORD	27	34	2363883
file44766	CITY	8268	8273	COLAC
file44766	DATE	3207	3214	14/6/66	2066-06-14
file44766	DATE	7616	7623	25.6.70	2070-06-25
file44766	DATE	7692	7699	19.5.66	2066-05-19
file44766	DATE	8158	8165	10.6.66	2066-10-06
file44766	DOCTOR	3246	3254	G Arimas
file44766	DOCTOR	7997	8012	Bennie RODRIUEZ
file44766	HOSPITAL	46	64	CARNARVON HOSPITAL
file44766	HOSPITAL	8219	8235	MODBURY HOSPITAL
file44766	IDNUM	8	18	21D278975L
file44766	MEDICALRECORD	27	34	9536577
file44803	DATE	2658	2665	27/4/68	2068-04-27
file44803	DOCTOR	2697	2707	E Ingersol
file44803	HOSPITAL	46	72	BASS COAST REGIONAL HEALTH
file44803	IDNUM	8	18	16E629233R
file44803	MEDICALRECORD	27	34	6512926
file44891	DATE	167	176	22.6.2066	2066-06-22
file44891	DATE	3503	3510	15/6/67	2067-06-15
file44891	DATE	8607	8616	21.6.2070	2070-06-21
file44891	DOCTOR	3542	3550	O Wahlen
file44891	DOCTOR	7858	7868	O Pomarico
file44891	DOCTOR	845	855	O Pehowich
file44891	DOCTOR	861	869	O Tamaro
file44891	TIME	873	891	9:20am on 15/05/66	2066-05-15T09:20
file44891	HOSPITAL	47	83	PINNAROO SOLDIERS' MEMORIAL HOSPITAL
file44891	IDNUM	8	18	57N821040O
file44891	MEDICALRECORD	27	35	10502823
file44945	DATE	161	169	5.7.2070	2070-07-05
file44945	DATE	2766	2773	25/6/66	2066-06-25
file44945	DATE	3976	3984	5.7.2066	2066-07-05
file44945	DOCTOR	2806	2814	C Coonse
file44945	DOCTOR	3989	4000	C Hallowich
file44945	HOSPITAL	47	61	LOGAN HOSPITAL
file44945	IDNUM	8	18	15J941008W
file44945	MEDICALRECORD	27	35	10502870
file44967	DATE	1544	1551	28/5/67	2067-05-28
file44967	DOCTOR	1584	1594	N Drumbore
file44967	HOSPITAL	46	70	SOUTH GIPPSLAND HOSPITAL
file44967	IDNUM	8	18	57S143814T
file44967	MEDICALRECORD	27	34	5664496
file45010	DOCTOR	2453	2462	K Janosko
file45010	HOSPITAL	47	95	ROYAL REHABILITATION HOSPITAL - COORABEL/MOORONG
file45010	IDNUM	8	18	18R093852R
file45010	MEDICALRECORD	27	35	10420955
file45106	CITY	78	84	ARARAT
file45106	DOCTOR	240	242	MK
file45106	DOCTOR	3095	3104	Z Shadley
file45106	HOSPITAL	46	84	EAST GRAMPIANS HEALTH SERVICE - ARARAT
file45106	IDNUM	8	18	90P604131H
file45106	MEDICALRECORD	27	34	1224050
file45146	DATE	3329	3336	10/6/69	2069-06-10
file45146	DOCTOR	3368	3377	J Schwanz
file45146	HOSPITAL	46	63	MORANBAH HOSPITAL
file45146	IDNUM	8	18	32Y806947E
file45146	MEDICALRECORD	27	34	4078034
file45177	DOCTOR	1740	1748	X Strohm
file45177	DOCTOR	682	691	X Venezia
file45177	DOCTOR	698	706	X Elliff
file45177	TIME	710	730	13:00hrs on 08/07/67	67-07-08T13:00
file45177	HOSPITAL	46	65	BODDINGTON HOSPITAL
file45177	IDNUM	8	18	90U927905M
file45177	MEDICALRECORD	27	34	1144453
file45212	CITY	2219	2227	GOULBURN
file45212	CITY	2244	2250	TATURA
file45212	DATE	953	960	6/11/66	2066-11-06
file45212	DOCTOR	992	1000	V Ruhoff
file45212	HOSPITAL	2219	2257	GOULBURN VALLEY HEALTH - TATURA CAMPUS
file45212	HOSPITAL	47	63	MODBURY HOSPITAL
file45212	IDNUM	8	18	85V378163S
file45212	MEDICALRECORD	27	35	10489127
file45283	CITY	47	58	KURRI KURRI
file45283	DOCTOR	4607	4614	F Voigt
file45283	DOCTOR	636	641	Denny
file45283	DOCTOR	648	656	F Tenpas
file45283	DOCTOR	659	670	F Creviston
file45283	TIME	674	692	2:15pm on 10/07/70	2066-07-10T14:15
file45283	HOSPITAL	47	76	KURRI KURRI DISTRICT HOSPITAL
file45283	IDNUM	8	18	27E579970P
file45283	MEDICALRECORD	27	35	10513542
file45348	CITY	4946	4956	EMU PLAINS
file45348	DATE	1923	1930	6/11/68	2068-11-06
file45348	DOCTOR	1962	1972	U Earheart
file45348	DOCTOR	4880	4890	U Goldfine
file45348	HOSPITAL	4946	4956	EMU PLAINS
file45348	DOCTOR	7574	7585	U Buchinski
file45348	HOSPITAL	47	69	PINGELLY HEALTH CENTRE
file45348	IDNUM	8	18	75A690038X
file45348	MEDICALRECORD	27	35	10461715
file45375	CITY	45	56	MEEKATHARRA
file45375	DATE	2163	2170	20/7/69	2069-07-20
file45375	DOCTOR	2202	2209	R Tervo
file45375	HOSPITAL	45	65	MEEKATHARRA HOSPITAL
file45375	IDNUM	8	18	69B031296D
file45375	MEDICALRECORD	27	33	337770
file45415	DATE	2224	2231	18/7/67	2067-07-18
file45415	DOCTOR	2263	2275	B Comissiong
file45415	DOCTOR	896	900	Juan
file45415	DOCTOR	907	913	B Pora
file45415	TIME	917	934	10:25 on 16/07/70	70-07-16T10:25
file45415	HOSPITAL	47	84	LAKE CARGELLIGO MULTI PURPOSE SERVICE
file45415	IDNUM	8	18	01J233003A
file45415	MEDICALRECORD	27	35	10513348
file45441	DATE	3222	3229	16/7/67	2067-07-16
file45441	DOCTOR	3259	3267	Q Qadeer
file45441	DOCTOR	969	981	Anaesthetist
file45441	DOCTOR	1002	1012	Q Khosravi
file45441	TIME	1016	1034	3:30pm on 18/06/70	70-06-18T15:30
file45441	HOSPITAL	47	64	THEODORE HOSPITAL
file45441	IDNUM	8	18	69G353061I
file45441	MEDICALRECORD	27	35	10518875
file45466	DATE	1107	1114	21/7/66	2066-07-21
file45466	DATE	721	729	23/06/70	2070-06-23
file45466	DOCTOR	1146	1154	A Kirgan
file45466	DOCTOR	542	544	WB
file45466	HOSPITAL	47	71	SOUTH GIPPSLAND HOSPITAL
file45466	IDNUM	8	18	01O555878F
file45466	MEDICALRECORD	27	35	10516354
file45498	CITY	46	51	JUNEE
file45498	DATE	1504	1511	21/6/70	2070-06-21
file45498	DOCTOR	1543	1553	Y Packwood
file45498	HOSPITAL	46	73	JUNEE MULTI PURPOSE SERVICE
file45498	IDNUM	8	18	59L586926N
file45498	MEDICALRECORD	27	34	1280455
file45549	CITY	61	70	NEWCASTLE
file45549	DATE	2108	2115	24/6/66	2066-06-24
file45549	DATE	4076	4083	27.7.69	2069-07-27
file45549	DATE	4144	4151	30.6.67	2067-06-30
file45549	DOCTOR	2147	2157	M Lopriore
file45549	HOSPITAL	47	70	CALVARY MATER NEWCASTLE
file45549	IDNUM	8	18	44L026194T
file45549	MEDICALRECORD	27	35	10487619
file45572	DATE	1854	1861	28/4/68	2068-04-28
file45572	DOCTOR	1893	1899	W Bock
file45572	DOCTOR	1917	1929	W Bostelmann
file45572	HOSPITAL	46	69	CARITAS CHRISTI HOSPICE
file45572	IDNUM	8	18	86U228900Q
file45572	MEDICALRECORD	27	34	8257608
file45616	DATE	1101	1108	29/6/70	2070-06-29
file45616	DATE	2607	2614	22/6/67	2067-06-22
file45616	DOCTOR	1170	1176	Howard
file45616	DOCTOR	1183	1192	U Ducayne
file45616	TIME	1196	1210	16:01 25/07/69	2066-07-25T16:01
file45616	DOCTOR	2646	2655	U Pollman
file45616	DOCTOR	709	715	Isaiah
file45616	DOCTOR	722	729	U Bried
file45616	TIME	733	747	14:07 21/07/66	2066-07-21T14:07
file45616	HOSPITAL	47	70	SWAN DISTRICTS HOSPITAL
file45616	IDNUM	8	18	71V7691688
file45616	MEDICALRECORD	27	35	10516243
file45635	DATE	692	699	24/4/68	2068-04-24
file45635	DOCTOR	729	737	I Dehler
file45635	HOSPITAL	46	64	MONA VALE HOSPITAL
file45635	IDNUM	8	18	39R7992171
file45635	MEDICALRECORD	27	34	2461464
file45666	CITY	46	54	CESSNOCK
file45666	DATE	2071	2078	30/7/70	2070-07-30
file45666	DOCTOR	2110	2119	T Kincade
file45666	HOSPITAL	46	72	CESSNOCK DISTRICT HOSPITAL
file45666	IDNUM	8	18	70A991023B
file45666	MEDICALRECORD	27	34	6185000
file45695	DATE	2622	2629	28/7/69	2069-07-28
file45695	DOCTOR	2735	2741	Taylor
file45695	DOCTOR	2748	2756	Q Youngs
file45695	TIME	2760	2781	12:55pm on 27/07/2070	2070-07-27T12:55
file45695	DOCTOR	3042	3052	Q Reimnitz
file45695	HOSPITAL	45	72	MANSFIELD DISTRICT HOSPITAL
file45695	IDNUM	8	18	28W012081K
file45695	MEDICALRECORD	27	33	224955
file45820	CITY	46	57	CASTLEMAINE
file45820	DATE	3285	3292	30/6/68	2068-06-30
file45820	DOCTOR	3324	3331	F Fifer
file45820	DOCTOR	528	545	Terence IACOVISSI
file45820	DOCTOR	552	560	F. Rumer
file45820	TIME	564	582	4:17pm on 30/07/67	67-07-30T16:17
file45820	HOSPITAL	46	64	CASTLEMAINE HEALTH
file45820	IDNUM	8	18	23X453249Q
file45820	MEDICALRECORD	27	34	0610980
file45872	DATE	169	177	8.9.2067	2067-09-08
file45872	DATE	2111	2118	29/7/66	2066-07-29
file45872	DATE	3633	3641	8.9.2069	2069-09-08
file45872	DOCTOR	182	190	P Valade
file45872	DOCTOR	2151	2159	P Fannon
file45872	DOCTOR	3023	3031	P Walden
file45872	DOCTOR	3646	3654	P Saurez
file45872	HOSPITAL	47	72	MACLEAN DISTRICT HOSPITAL
file45872	IDNUM	8	18	55G654056M
file45872	MEDICALRECORD	27	35	10527251
file45913	DOCTOR	2224	2236	D Lennington
file45913	DOCTOR	773	785	Anaesthetist
file45913	DOCTOR	789	799	D Tyminski
file45913	TIME	803	822	12:26pm on 01/07/66	2066-07-12T12:26
file45913	HOSPITAL	3238	3255	SUNSHINE HOSPITAL
file45913	HOSPITAL	46	73	BANKSTOWN-LIDCOMBE HOSPITAL
file45913	IDNUM	8	18	13C775114V
file45913	MEDICALRECORD	27	34	1419234
file45953	CITY	67	73	SYDNEY
file45953	DOCTOR	1999	2008	N Satmary
file45953	HOSPITAL	47	77	CALVARY HEALTH CARE SYDNEY LTD
file45953	IDNUM	8	18	55L977921R
file45953	MEDICALRECORD	27	35	10499198
file46013	CITY	47	58	KURRI KURRI
file46013	DATE	6450	6457	15.7.67	2067-07-15
file46013	DOCTOR	3835	3844	C Sumners
file46013	DOCTOR	775	784	C Dibrito
file46013	DOCTOR	791	800	C Mantele
file46013	TIME	804	822	4:56 on 08/04/2070	2070-04-08T16:56
file46013	HOSPITAL	47	76	KURRI KURRI DISTRICT HOSPITAL
file46013	IDNUM	8	18	03H998989A
file46013	MEDICALRECORD	27	35	10497033
file46054	CITY	46	53	STAWELL
file46054	DOCTOR	1739	1745	A Jons
file46054	TIME	1749	1766	17:10 on 05/04/66	2066-04-05T17:10
file46054	DOCTOR	1799	1809	A Mckelvey
file46054	DOCTOR	2459	2466	A Capas
file46054	HOSPITAL	46	69	STAWELL REGIONAL HEALTH
file46054	IDNUM	8	18	08I448147G
file46054	MEDICALRECORD	27	34	0744241
file46082	DATE	1045	1052	11/7/68	2068-11-11
file46082	DOCTOR	1085	1092	K Rocle
file46082	HOSPITAL	46	87	CENTRAL HIGHLANDS RURAL HEALTH - CRESWICK
file46082	IDNUM	8	18	30R640954C
file46082	MEDICALRECORD	27	34	9156937
file46127	DATE	198	205	11.2068	2068-11-11
file46127	DATE	2841	2848	13/5/70	2070-05-13
file46127	DATE	371	378	15/6/69	2069-06-15
file46127	DATE	640	647	26/6/69	2069-06-26
file46127	DOCTOR	1512	1517	Chong
file46127	DOCTOR	1521	1527	Horace
file46127	DOCTOR	1534	1542	D Kurter
file46127	DOCTOR	1546	1555	D Ecoffey
file46127	TIME	1559	1576	16:50 on 11/05/67	2067-05-11T16:50
file46127	DOCTOR	2880	2887	D Forch
file46127	DOCTOR	4025	4038	Saul Laughman
file46127	HOSPITAL	46	65	SPRINGSURE HOSPITAL
file46127	IDNUM	8	18	19E362960W
file46127	MEDICALRECORD	27	34	3735420
file46156	DATE	1176	1183	15/8/69	2069-08-15
file46156	DOCTOR	1215	1226	S Ifantides
file46156	DOCTOR	2214	2222	S Cotham
file46156	HOSPITAL	46	63	THEODORE HOSPITAL
file46156	IDNUM	2145	2153	66A38292
file46156	IDNUM	8	18	66A382928F
file46156	MEDICALRECORD	27	34	2361353
file46156	ZIP	2139	2143	2067
file46175	CITY	46	54	GOULBURN
file46175	CITY	71	77	TATURA
file46175	DATE	1113	1120	15/4/66	2066-04-15
file46175	DOCTOR	1150	1158	P Ortelt
file46175	HOSPITAL	46	84	GOULBURN VALLEY HEALTH - TATURA CAMPUS
file46175	IDNUM	1185	1193	61B73328
file46175	IDNUM	8	18	61B733286L
file46175	MEDICALRECORD	27	34	7666727
file46279	CITY	46	52	FORBES
file46279	DEPARTMENT	198	201	EMR
file46279	HOSPITAL	198	201	EMR
file46279	DOCTOR	1895	1897	OJ
file46279	DATE	1904	1911	17.5.70	2070-05-17
file46279	DOCTOR	2293	2302	Z Haessly
file46279	HOSPITAL	46	70	FORBES DISTRICT HOSPITAL
file46279	IDNUM	8	18	93K025993H
file46279	MEDICALRECORD	27	34	0692303
file46358	CITY	46	53	STAWELL
file46358	DATE	150	157	18/7/69	2069-07-18
file46358	DATE	1829	1836	16/4/69	2069-04-16
file46358	DATE	2940	2947	22/5/66	2066-05-22
file46358	DOCTOR	1868	1873	X Zam
file46358	HOSPITAL	46	69	STAWELL REGIONAL HEALTH
file46358	IDNUM	8	18	98L475251N
file46358	MEDICALRECORD	27	34	1235497
file46358	STREET	2846	2853	Pending
file46435	DATE	5558	5565	17/4/69	2069-04-17
file46435	DOCTOR	2104	2112	M Apuzzo
file46435	DOCTOR	2119	2126	M Gruse
file46435	TIME	2130	2149	10:50am on 20/07/67	67-07-20T10:50
file46435	DOCTOR	5597	5610	M Benzschawel
file46435	HOSPITAL	47	64	ATHERTON HOSPITAL
file46435	IDNUM	8	18	46H596219W
file46435	MEDICALRECORD	27	35	10535929
file46547	DATE	3470	3477	21/7/66	2066-07-21
file46547	DOCTOR	3509	3519	W Pietrzyk
file46547	HOSPITAL	46	79	KOOWEERUP REGIONAL HEALTH SERVICE
file46547	IDNUM	8	18	88Q798026S
file46547	MEDICALRECORD	27	34	0724809
file46572	DATE	2360	2367	19/8/70	2070-08-19
file46572	DATE	3049	3056	16/8/70	2070-08-16
file46572	DOCTOR	2397	2404	U Vajda
file46572	HOSPITAL	47	62	NEPEAN HOSPITAL
file46572	IDNUM	8	18	73R138284Y
file46572	MEDICALRECORD	27	35	10522707
file46603	CITY	46	51	CLARE
file46603	DATE	1853	1860	23/8/69	2069-08-23
file46603	DOCTOR	1892	1903	I Bludworth
file46603	HOSPITAL	46	60	CLARE HOSPITAL
file46603	IDNUM	8	18	31N269342H
file46603	MEDICALRECORD	27	34	8599088
file46641	DOCTOR	1406	1417	S Hjermstad
file46641	HOSPITAL	3042	3070	ALPINE HEALTH (MOUNT BEAUTY)
file46641	HOSPITAL	46	83	CLERMONT MULTI-PURPOSE HEALTH SERVICE
file46641	IDNUM	3085	3093	73W46115
file46641	IDNUM	8	18	73W461159D
file46641	MEDICALRECORD	27	34	2330777
file46641	STREET	2779	2788	Clonality
file46687	DOCTOR	3070	3076	Q Mack
file46687	HOSPITAL	46	65	BEAUDESERT HOSPITAL
file46687	IDNUM	8	18	20S482117M
file46687	MEDICALRECORD	27	34	2645703
file46768	DATE	5756	5764	28.10.67	2067-10-28
file46768	DOCTOR	3200	3209	R Perches
file46768	DOCTOR	5186	5195	R Hanahan
file46768	DOCTOR	5247	5253	R Back
file46768	DATE	5223	5229	6.8.70	2070-06-06
file46768	DOCTOR	6561	6572	R Langarica
file46768	HOSPITAL	46	74	SOUTH EAST REGIONAL HOSPITAL
file46768	IDNUM	8	18	62B784923I
file46768	MEDICALRECORD	27	34	2083596
file46805	DATE	2298	2305	27/7/69	2069-07-27
file46805	DOCTOR	2335	2344	O Solares
file46805	DOCTOR	488	497	Kohlmeyer
file46805	DOCTOR	504	515	O Belliston
file46805	TIME	516	535	18:40pm on 23.05.66	2066-05-23
file46805	HOSPITAL	47	62	WONDAI HOSPITAL
file46805	IDNUM	8	18	57C124181O
file46805	MEDICALRECORD	27	35	10549487
file46842	DATE	4077	4084	20/4/70	2070-04-20
file46842	DOCTOR	4116	4125	Y Cumpton
file46842	DOCTOR	646	653	D Beall
file46842	DOCTOR	661	668	D Trotz
file46842	TIME	672	692	24/04/2069 at 9:49am	2069-04-24T09:49
file46842	HOSPITAL	46	60	LOGAN HOSPITAL
file46842	IDNUM	8	18	15Y245240X
file46842	MEDICALRECORD	27	34	2252676
file46913	DATE	6103	6112	5.11.2069	2069-11-05
file46913	DOCTOR	2127	2138	N Pursifull
file46913	TIME	2142	2163	12:07pm on 06.04.2069	2069-04-06T12:07
file46913	DOCTOR	3671	3680	N Talamas
file46913	HOSPITAL	46	65	BRIDGETOWN HOSPITAL
file46913	IDNUM	8	18	57H447056T
file46913	MEDICALRECORD	27	34	3520927
file46949	CITY	45	51	LEETON
file46949	DATE	1683	1690	18/9/69	2069-09-18
file46949	DOCTOR	1722	1727	L Koc
file46949	HOSPITAL	45	69	LEETON DISTRICT HOSPITAL
file46949	IDNUM	8	18	42I897214Z
file46949	MEDICALRECORD	27	33	128312
file46975	DATE	2427	2434	8/11/67	2067-11-08
file46975	DOCTOR	2475	2489	Z Vanlaningham
file46975	DOCTOR	2497	2508	Z Gorenberg
file46975	HOSPITAL	46	60	WAGIN HOSPITAL
file46975	IDNUM	8	18	90E918372I
file46975	MEDICALRECORD	27	34	2077704
file47113	DATE	4301	4308	17/8/67	2067-08-17
file47113	DOCTOR	4340	4351	J Tomaselli
file47113	HOSPITAL	46	81	BARWON HEALTH - ASHLEY MANOR CAMPUS
file47113	IDNUM	8	18	32N110089E
file47113	MEDICALRECORD	27	34	3251100
file47113	ZIP	339	343	2046
file47153	DATE	2082	2089	21/9/67	2067-09-21
file47153	DOCTOR	2121	2131	H Urrabazo
file47153	HOSPITAL	46	72	CRAIGIEBURN HEALTH SERVICE
file47153	IDNUM	8	18	27O550347K
file47153	MEDICALRECORD	27	34	8474481
file47191	DATE	2251	2258	25/8/69	2069-08-25
file47191	DOCTOR	2290	2296	V Azua
file47191	HOSPITAL	45	66	WONGAN HILLS HOSPITAL
file47191	IDNUM	8	18	85K671305T
file47191	MEDICALRECORD	27	33	339877
file47256	CITY	46	51	YOUNG
file47256	DATE	3347	3354	22/5/66	2066-05-22
file47256	DOCTOR	1046	1054	F Knesek
file47256	DOCTOR	1061	1068	F Mccaw
file47256	DOCTOR	1076	1085	F Kielich
file47256	TIME	1089	1110	12:15pm on 22/09/2066	2066-09-22T12:15
file47256	DOCTOR	3386	3391	F Aro
file47256	DOCTOR	5780	5790	BONG Comer
file47256	HOSPITAL	46	69	YOUNG DISTRICT HOSPITAL
file47256	IDNUM	8	18	18R228805P
file47256	MEDICALRECORD	27	34	2300094
file47365	DATE	2644	2651	25/9/66	2066-09-25
file47365	DOCTOR	2683	2690	U Ewers
file47365	HOSPITAL	46	95	EASTERN EYRE HEALTH AND AGED CARE - COWELL CAMPUS
file47365	IDNUM	8	18	74P804260Y
file47365	MEDICALRECORD	27	34	0794477
file47365	PATIENT	5869	5884	JERRELL Browers
file47365	DOCTOR	5900	5906	Earl H
file47392	DATE	1740	1747	24/8/67	2067-08-24
file47392	DATE	2246	2254	24/10/71	2071-10-24
file47392	DOCTOR	1777	1786	E Reimold
file47392	DOCTOR	690	696	E Nhek
file47392	TIME	700	720	4:20pm on 23/09/2067	2067-09-23
file47392	HOSPITAL	46	70	PEAK HILL HEALTH SERVICE
file47392	IDNUM	8	18	16X195977U
file47392	MEDICALRECORD	27	34	1691959
file47436	DATE	1601	1608	29/9/67	2067-09-29
file47436	DOCTOR	1640	1649	C Gamelin
file47436	HOSPITAL	46	70	SOUTH GIPPSLAND HOSPITAL
file47436	IDNUM	8	18	01Y546245A
file47436	MEDICALRECORD	27	34	0195462
file47516	DATE	2054	2061	25/8/69	2069-08-25
file47516	DATE	4737	4745	5/8/2068	2068-05-08
file47516	DOCTOR	2093	2102	Q Zappile
file47516	HOSPITAL	46	71	MACLEAN DISTRICT HOSPITAL
file47516	IDNUM	8	18	67F899233K
file47516	MEDICALRECORD	27	34	6728992
file47516	ORGANIZATION	3966	3978	Cytogenetics
file47516	HOSPITAL	3980	4009	BOOROWA MULTI PURPOSE SERVICE
file47516	ZIP	295	299	2066
file47516	ZIP	4323	4327	2066
file47580	CITY	256	263	PENRITH
file47580	CITY	399	407	ADELAIDE
file47580	DOCTOR	310	322	RADU Rayford
file47580	DOCTOR	3834	3842	M Albany
file47580	HOSPITAL	345	356	03-Aug-2068	2068-09-03
file47580	HOSPITAL	46	69	MAITLAND HOSPITAL (NSW)
file47580	IDNUM	142	152	43H848051X
file47580	IDNUM	142	150	43H84805
file47580	IDNUM	162	170	43H84805
file47580	IDNUM	8	18	43H848051X
file47580	MEDICALRECORD	176	184	46132536
file47580	MEDICALRECORD	27	34	4328480
file47580	PATIENT	205	224	Stearnes, MARGARITO
file47580	STATE	265	268	VIC
file47580	ZIP	270	274	2000
file47644	DOCTOR	1284	1294	A Sedlacek
file47644	DOCTOR	1317	1328	A Weiszbrod
file47644	TIME	1332	1353	10:05am on 05/09/2067	2067-09-05T10:05
file47644	DOCTOR	3495	3506	A Seagroves
file47644	DOCTOR	4695	4705	Obstetrics
file47644	DOCTOR	4940	4953	MAYNARD ADAMO
file47644	HOSPITAL	47	85	CLONCURRY MULTI-PURPOSE HEALTH SERVICE
file47644	IDNUM	8	18	01D868009F
file47644	MEDICALRECORD	27	35	01186800
file47666	DATE	1399	1406	7/10/70	2070-10-07
file47666	DOCTOR	1436	1444	Y Alerte
file47666	DOCTOR	838	847	Y Linnear
file47666	DOCTOR	854	861	Y Orbin
file47666	TIME	865	886	1730hrs on 06/06/2069	2069-06-06T17:00
file47666	HOSPITAL	46	95	KAROONDA AND DISTRICT SOLDIERS' MEMORIAL HOSPITAL
file47666	IDNUM	8	18	96E209267L
file47666	MEDICALRECORD	27	34	9612092
file47765	CITY	46	57	KURRI KURRI
file47765	DATE	4040	4047	11/9/66	2066-11-09
file47765	DATE	6481	6489	22/10/70	2070-10-22
file47765	DOCTOR	1122	1130	I Gregor
file47765	DOCTOR	1155	1162	I Efird
file47765	TIME	1166	1185	10:15am on 09/07/70	70-07-09T10:15
file47765	DOCTOR	1452	1463	I Kimberley
file47765	DOCTOR	1470	1479	I Molgard
file47765	TIME	1499	1518	10:15am on 07/10/67	2067-10-07T10:15
file47765	DOCTOR	1774	1781	I Dorcy
file47765	DOCTOR	1788	1799	I Berhalter
file47765	TIME	1803	1822	11:08am on 07/10/69	2069-10-07T11:08
file47765	DOCTOR	2066	2073	I Votaw
file47765	DOCTOR	2080	2090	I Tresvant
file47765	TIME	2094	2113	11:40am on 10/10/70	70-10-10T11:40
file47765	DOCTOR	2396	2402	I Lair
file47765	TIME	2406	2425	12:28pm on 07/09/66	2066-09-07T12:28
file47765	DOCTOR	4079	4090	I Rychlicki
file47765	DOCTOR	4108	4118	I Scharmer
file47765	HOSPITAL	46	75	KURRI KURRI DISTRICT HOSPITAL
file47765	IDNUM	8	18	38N501074I
file47765	MEDICALRECORD	27	34	3855010
file47811	DATE	1354	1361	7/10/70	2070-10-07
file47811	DATE	146	155	29.7.2066	2066-07-29
file47811	DOCTOR	1393	1405	X Musigdilok
file47811	DOCTOR	2298	2311	QUINN KRAVITZ
file47811	DOCTOR	3163	3170	X Snith
file47811	DATE	3171	3181	25.10.2067	2067-10-25
file47811	DOCTOR	3214	3237	Gynaecological Oncology
file47811	DOCTOR	4009	4019	X Degeston
file47811	DOCTOR	733	741	Tjingali
file47811	DOCTOR	748	754	X Sear
file47811	TIME	758	776	3:15pm on 10/09/70	70-09-10T15:15
file47811	HOSPITAL	46	64	THE TWEED HOSPITAL
file47811	IDNUM	8	18	86J532132Q
file47811	MEDICALRECORD	27	34	8635321
file47923	DATE	2501	2508	7/11/69	2069-11-07
file47923	DATE	6139	6148	21/9/2067	2067-09-21
file47923	DOCTOR	2540	2553	U Schickedanz
file47923	HOSPITAL	46	59	YORK HOSPITAL
file47923	IDNUM	8	18	80K972390W
file47923	MEDICALRECORD	27	34	8049723
file47956	DATE	1318	1325	16/7/66	2066-07-16
file47956	DOCTOR	1357	1366	J Calzada
file47956	HOSPITAL	45	62	ANGASTON HOSPITAL
file47956	IDNUM	8	18	38G093458F
file47956	MEDICALRECORD	27	33	382093
file47979	DATE	1561	1568	6/10/66	2066-10-06
file47979	DOCTOR	1615	1623	T Mellom
file47979	DOCTOR	501	516	WILFREDO Cessna
file47979	TIME	520	524	2066	2066-10-2066
file47979	HOSPITAL	47	68	QUORN HEALTH SERVICES
file47979	IDNUM	8	18	70P295165B
file47979	MEDICALRECORD	27	35	70529516
file48015	DATE	2461	2468	17/6/67	2067-06-17
file48015	DOCTOR	2500	2511	R Trethewey
file48015	HOSPITAL	46	65	AUGATHELLA HOSPITAL
file48015	IDNUM	8	18	65Q745423I
file48015	MEDICALRECORD	27	34	6567454
file48069	DATE	1846	1853	18/9/70	2070-09-18
file48069	DATE	3097	3105	23/10/70	2070-10-23
file48069	DOCTOR	1885	1893	B Staino
file48069	HOSPITAL	46	69	SWAN DISTRICTS HOSPITAL
file48069	IDNUM	8	18	07Z947130E
file48069	MEDICALRECORD	27	34	0799471
file48100	DATE	1334	1341	16/6/69	2069-06-16
file48100	DOCTOR	1373	1387	P Ertzbischoff
file48100	DOCTOR	758	764	Lavern
file48100	DOCTOR	786	792	P Dinn
file48100	TIME	796	817	1325hrs on 18/07/2067	2067-07-18T13:25
file48100	HOSPITAL	47	66	DONNYBROOK HOSPITAL
file48100	IDNUM	8	18	65V968298N
file48100	MEDICALRECORD	27	35	65896829
file48119	CITY	57	65	ADELAIDE
file48119	DATE	1996	2003	25/9/66	2066-09-25
file48119	DATE	297	307	March 2068	2068-04-29
file48119	DOCTOR	2033	2043	Z Crickard
file48119	HOSPITAL	47	74	THE ROYAL ADELAIDE HOSPITAL
file48119	IDNUM	8	18	97E260005J
file48119	MEDICALRECORD	27	35	97126000
file48163	CITY	45	53	BATHURST
file48163	DATE	1179	1186	22/7/66	2066-07-22
file48163	DOCTOR	1218	1228	O Sumerall
file48163	HOSPITAL	45	67	BATHURST BASE HOSPITAL
file48163	IDNUM	8	18	55A280063S
file48163	MEDICALRECORD	27	33	550280
file48191	DATE	1837	1844	29/9/69	2069-09-29
file48191	DOCTOR	1876	1884	L Monsky
file48191	HOSPITAL	45	69	COHUNA DISTRICT HOSPITAL
file48191	IDNUM	8	18	40B6213219
file48191	MEDICALRECORD	27	33	400621
file48213	DATE	1439	1446	24/7/67	2067-07-24
file48213	DOCTOR	1478	1486	W Walson
file48213	HOSPITAL	46	69	SWAN DISTRICTS HOSPITAL
file48213	IDNUM	8	18	82K923137U
file48213	MEDICALRECORD	27	34	8239231
file48327	DATE	3719	3727	28/10/70	2070-10-28
file48327	DOCTOR	3759	3767	K Gammon
file48327	DOCTOR	6009	6015	K Marn
file48327	HOSPITAL	47	67	GNOWANGERUP HOSPITAL
file48327	IDNUM	8	18	49G943195D
file48327	MEDICALRECORD	27	35	49294319
file48353	CITY	47	54	SEYMOUR
file48353	DATE	2541	2548	28/9/70	2070-09-28
file48353	DOCTOR	2578	2589	I Neidhardt
file48353	HOSPITAL	47	61	SEYMOUR HEALTH
file48353	IDNUM	8	18	34H394353J
file48353	MEDICALRECORD	27	35	34239435
file48390	DATE	1353	1360	30/9/69	2069-09-30
file48390	DOCTOR	1392	1399	W Moffa
file48390	HOSPITAL	46	67	MOUNT DRUITT HOSPITAL
file48390	IDNUM	8	18	82D4154126
file48390	MEDICALRECORD	27	34	8214154
file48526	CITY	46	57	LEIGH CREEK
file48526	DATE	2284	2291	6/10/67	2067-10-06
file48526	DOCTOR	2323	2333	G Bruening
file48526	HOSPITAL	46	73	LEIGH CREEK HEALTH SERVICES
file48526	IDNUM	8	18	24M617228O
file48526	MEDICALRECORD	27	34	2446172
file48582	DATE	147	157	13.11.2067	2067-11-13
file48582	DATE	2671	2678	28/9/67	2067-09-28
file48582	DOCTOR	2710	2718	E Wojtas
file48582	DOCTOR	4509	4520	E Trevisone
file48582	DATE	4521	4531	14.10.2069	2069-10-14
file48582	DOCTOR	4614	4622	E Bonsee
file48582	DOCTOR	898	903	Waldo
file48582	DOCTOR	910	919	E Angerer
file48582	TIME	930	950	2:44pm on 27/10/2066	2066-10-27T14:44
file48582	HOSPITAL	46	63	SNOWTOWN HOSPITAL
file48582	IDNUM	8	18	19N157486U
file48582	MEDICALRECORD	27	34	1951574
file48626	DATE	2771	2781	21/10/2066	2066-10-21
file48626	DOCTOR	1469	1477	F Baurer
file48626	HOSPITAL	47	66	GORDONVALE HOSPITAL
file48626	IDNUM	8	18	24R939093T
file48626	MEDICALRECORD	27	35	24693909
file48653	CITY	46	53	KYABRAM
file48653	DATE	1594	1601	1/11/66	2066-11-01
file48653	DOCTOR	1633	1644	D Siebeneck
file48653	DOCTOR	1662	1671	D Mcnutty
file48653	HOSPITAL	46	80	KYABRAM & DISTRICT HEALTH SERVICES
file48653	IDNUM	8	18	19R370251Z
file48653	MEDICALRECORD	27	34	1963702
file48789	DATE	3090	3097	10/5/70	2070-10-05
file48789	DOCTOR	3127	3138	R Greenough
file48789	HOSPITAL	45	63	MONA VALE HOSPITAL
file48789	IDNUM	8	18	67O400309H
file48789	MEDICALRECORD	27	33	675400
file48789	STREET	4513	4523	Lympahatic
file48824	DOCTOR	1709	1721	B Salabarria
file48824	HOSPITAL	47	74	WALCHA MULTIPURPOSE SERVICE
file48824	IDNUM	8	18	09W602116E
file48824	MEDICALRECORD	27	35	09860211
file48850	DATE	1835	1843	15/11/69	2069-11-15
file48850	DOCTOR	1875	1882	Q. Lutz
file48850	DOCTOR	2809	2823	Marquis ROLOFF
file48850	DOCTOR	2831	2845	MARION Quesada
file48850	DOCTOR	442	450	Q Grabow
file48850	DOCTOR	495	500	Kalfa
file48850	HOSPITAL	46	65	PARABURDOO HOSPITAL
file48850	IDNUM	8	18	67T623174M
file48850	MEDICALRECORD	27	34	6776231
file48850	ZIP	153	157	2059
file48899	DATE	1742	1750	18/11/70	2070-11-18
file48899	DOCTOR	1782	1792	N Bassetti
file48899	DOCTOR	2927	2939	Les Caterina
file48899	HOSPITAL	47	63	EUDUNDA HOSPITAL
file48899	IDNUM	8	18	51U163432S
file48899	MEDICALRECORD	18	26	51816343
file48964	CITY	3266	3278	MURWILLUMBAH
file48964	CITY	3835	3843	WAIKERIE
file48964	CITY	79	85	ARARAT
file48964	DATE	166	173	27/9/69	2069-09-27
file48964	DATE	2205	2212	27/8/69	2069-08-27
file48964	DATE	3738	3746	23/10/69	2069-10-23
file48964	DATE	617	630	FY 27.11.2066	2066-11-27
file48964	DOCTOR	2244	2252	X Coache
file48964	DOCTOR	4325	4337	Charlie GIMM
file48964	DOCTOR	4339	4353	TULLY HOSPITAL
file48964	HOSPITAL	3207	3244	WEST WIMMERA HEALTH SERVICE - JEPARIT
file48964	HOSPITAL	3790	3813	CARITAS CHRISTI HOSPICE
file48964	HOSPITAL	47	85	EAST GRAMPIANS HEALTH SERVICE - ARARAT
file48964	IDNUM	8	18	93C3651495
file48964	MEDICALRECORD	27	35	93136514
file49008	DATE	2419	2426	14/9/69	2069-09-14
file49008	DOCTOR	2459	2468	M Parkers
file49008	DOCTOR	3298	3303	Donte
file49008	DOCTOR	3755	3778	M Petruzzelli 23.9.2070
file49008	HOSPITAL	46	74	ROYAL PRINCE ALFRED HOSPITAL
file49008	IDNUM	8	18	41Y386207X
file49008	MEDICALRECORD	27	34	4193862
file49038	DATE	1797	1805	24/10/67	2067-10-24
file49038	DOCTOR	1837	1843	K Leet
file49038	HOSPITAL	47	63	MODBURY HOSPITAL
file49038	IDNUM	8	18	36Z837465D
file49038	MEDICALRECORD	27	35	36983746
file49101	DATE	2372	2380	15/10/70	2070-10-15
file49101	DOCTOR	2410	2418	U Cowles
file49101	DOCTOR	2436	2444	U Curylo
file49101	HOSPITAL	45	62	SUNSHINE HOSPITAL
file49101	IDNUM	8	18	78I038271A
file49101	MEDICALRECORD	27	33	783038
file49137	DATE	1534	1542	21/10/70	2070-10-21
file49137	DATE	265	273	Previous	2065-04-20
file49137	DOCTOR	1574	1582	I Chukri
file49137	DOCTOR	2207	2214	I Monzo
file49137	HOSPITAL	45	84	CULCAIRN MULTI PURPOSE SERVICE HOSPITAL
file49137	IDNUM	8	18	36E059330J
file49137	MEDICALRECORD	27	33	361059
file49310	DATE	153	160	2/11/68	2068-11-02
file49310	DATE	3434	3442	17/11/66	2066-11-17
file49310	DATE	6583	6590	1/11/67	2067-11-01
file49310	DOCTOR	3474	3481	S Sodek
file49310	DOCTOR	6620	6636	Margret KIRKHART
file49310	HOSPITAL	47	72	BEECHWORTH HEALTH SERVICE
file49310	IDNUM	8	18	78N351146F
file49310	MEDICALRECORD	27	35	78535114
file49310	PATIENT	5144	5154	Suspicious
file49330	DATE	2122	2130	30/10/66	2066-10-30
file49330	DATE	254	263	16/7/2066	2066-07-16
file49330	DOCTOR	2163	2175	H Defenbaugh
file49330	HOSPITAL	46	68	BYRON CENTRAL HOSPITAL
file49330	IDNUM	8	18	26J372104O
file49330	MEDICALRECORD	27	34	2633721
file49369	DOCTOR	2745	2760	RUBEN VILLANEDA
file49369	DOCTOR	2778	2785	E Dulac
file49369	HOSPITAL	46	64	FAIRFIELD HOSPITAL
file49369	IDNUM	8	18	11K812362U
file49369	MEDICALRECORD	27	34	1148123
file49457	CITY	7815	7823	Brisbane
file49457	CITY	9349	9359	Wollongong
file49457	DATE	2999	3006	26/1/71	2071-01-26
file49457	DATE	408	415	16.9.71	2071-09-16
file49457	DATE	9263	9270	17.6.68	2068-06-17
file49457	DOCTOR	160	167	T Henby
file49457	DATE	168	175	16.2.68	2068-02-16
file49457	DOCTOR	3038	3050	T Jackiewicz
file49457	DOCTOR	622	629	T Adjei
file49457	DOCTOR	7778	7787	Ian Brown
file49457	DOCTOR	9230	9237	T Hulan
file49457	DOCTOR	9319	9325	T Sood
file49457	DOCTOR	9327	9367	DOMAIN AGED CARE RM 2 Wollongong Private
file49457	HOSPITAL	9339	9367	CARE RM 2 Wollongong Private
file49457	HOSPITAL	9339	9340	C
file49457	HOSPITAL	46	67	SHELLHARBOUR HOSPITAL
file49457	IDNUM	8	18	79G843421C
file49457	MEDICALRECORD	27	34	7928434
file49615	CITY	47	58	LEIGH CREEK
file49615	DATE	3471	3478	18/2/71	2071-02-18
file49615	DOCTOR	3510	3518	D Buddle
file49615	HOSPITAL	47	74	LEIGH CREEK HEALTH SERVICES
file49615	IDNUM	8	18	10P0452379
file49615	MEDICALRECORD	27	35	10604523
file49694	DATE	4493	4502	14/5/2068	2068-05-14
file49694	DATE	6999	7008	16/5/2068	2068-05-16
file49694	DOCTOR	4528	4539	B. Stachura
file49694	HOSPITAL	196	212	BALMAIN HOSPITAL
file49694	HOSPITAL	47	75	SOUTH EAST REGIONAL HOSPITAL
file49694	IDNUM	137	145	05Q58549
file49694	IDNUM	147	155	05Q58549
file49694	IDNUM	147	157	05Q585495F
file49694	PATIENT	159	173	Promise, KRAIG
file49694	IDNUM	8	18	05Q585495F
file49694	MEDICALRECORD	27	35	05658549
file49761	CITY	207	214	KYABRAM
file49761	DATE	4724	4733	14/5/2068	2068-05-14
file49761	DATE	7156	7165	21/4/2068	2068-04-21
file49761	DOCTOR	4756	4764	L Minerd
file49761	HOSPITAL	207	241	KYABRAM & DISTRICT HEALTH SERVICES
file49761	HOSPITAL	47	69	GOVE DISTRICT HOSPITAL
file49761	IDNUM	131	139	47Z78720
file49761	IDNUM	141	149	47Z78720
file49761	IDNUM	141	151	47Z7872020
file49761	PATIENT	153	184	STRAITON, MICKEY Mohammad Vinny
file49761	IDNUM	8	18	47Z7872020
file49761	MEDICALRECORD	27	35	47978720
file49878	DATE	1928	1937	15/4/2067	2067-04-15
file49878	DATE	4548	4557	28/4/2068	2068-04-28
file49878	DATE	5156	5163	28/4/68	2068-04-28
file49878	DATE	5164	5173	28/5/2070	2070-05-28
file49878	DOCTOR	1960	1968	Z. Tuzzo
file49878	DOCTOR	326	330	Troy
file49878	DATE	382	389	15/5/67	2067-05-15
file49878	DOCTOR	5137	5149	V Marjoniemi
file49878	HOSPITAL	210	227	MITCHELL HOSPITAL
file49878	HOSPITAL	45	59	OAKEY HOSPITAL
file49878	IDNUM	151	159	95V70826
file49878	IDNUM	161	169	95V70826
file49878	IDNUM	161	171	95V7082603
file49878	PATIENT	173	186	Kaub, Frankie
file49878	IDNUM	8	18	95V7082603
file49878	MEDICALRECORD	27	33	958708
file49878	TIME	5107	5120	36: 2105-2122	2066-02-36
file49878	ZIP	5088	5092	2018
file49878	ZIP	5102	5106	2018
file50015	DATE	3340	3349	16/5/2071	2071-05-16
file50015	DOCTOR	3417	3423	X Lawe
file50015	DOCTOR	593	601	X Badger
file50015	DATE	605	612	16/5/67	2067-05-16
file50015	HOSPITAL	192	220	ROYAL PRINCE ALFRED HOSPITAL
file50015	HOSPITAL	47	71	WILCANNIA HEALTH SERVICE
file50015	IDNUM	133	141	90W25852
file50015	IDNUM	143	151	90W25852
file50015	IDNUM	143	153	90W258528Q
file50015	PATIENT	155	169	TANT, JEREMIAH
file50015	IDNUM	8	18	90W258528Q
file50015	MEDICALRECORD	27	35	90825852
file50015	ZIP	4074	4078	2018
file50077	CITY	189	200	MARYBOROUGH
file50077	DOCTOR	2710	2719	Y Centner
file50077	HOSPITAL	189	209	MARYBOROUGH HOSPITAL
file50077	HOSPITAL	46	64	CHERBOURG HOSPITAL
file50077	IDNUM	126	134	95A02012
file50077	IDNUM	136	144	95A02012
file50077	IDNUM	136	146	95A020125P
file50077	PATIENT	148	166	Lutrick, ELLSWORTH
file50077	IDNUM	8	18	95A020125P
file50077	MEDICALRECORD	27	34	9500201
file50131	DATE	4727	4735	6/3/2067	2067-03-06
file50131	DATE	7534	7542	5/9/2067	2067-05-09
file50131	DOCTOR	4760	4767	W Adham
file50131	HOSPITAL	193	210	MITCHELL HOSPITAL
file50131	HOSPITAL	46	69	SWAN DISTRICTS HOSPITAL
file50131	IDNUM	131	139	80B47139
file50131	IDNUM	141	149	80B47139
file50131	IDNUM	141	151	80B471393F
file50131	PATIENT	153	170	Mcshane, TERRANCE
file50131	IDNUM	8	18	80B471393V
file50131	MEDICALRECORD	27	34	8004713
file50255	DATE	1798	1806	5/6/2068	2068-06-05
file50255	DATE	2566	2575	22/4/2070	2070-04-22
file50255	DATE	4618	4626	8/5/2071	2071-08-05
file50255	DATE	5085	5093	8.5.2071	2071-08-05
file50255	DOCTOR	2600	2607	G Armas
file50255	HOSPITAL	241	260	YARRA RANGES HEALTH
file50255	HOSPITAL	45	82	GLOUCESTER SOLDIERS MEMORIAL HOSPITAL
file50255	IDNUM	172	180	22K77310
file50255	IDNUM	181	189	22K77310
file50255	IDNUM	191	199	22K77310
file50255	PATIENT	203	218	SZOCKI, Rayford
file50255	IDNUM	8	18	48X5924411
file50255	MEDICALRECORD	27	33	223773
file50255	ORGANIZATION	4747	4750	A19
file50286	CITY	185	196	LEIGH CREEK
file50286	DATE	1901	1909	5/7/2070	2070-07-05
file50286	DATE	854	862	5/9/2068	2068-09-05
file50286	DOCTOR	887	895	U Gaitan
file50286	HOSPITAL	185	212	LEIGH CREEK HEALTH SERVICES
file50286	HOSPITAL	47	62	WARREN HOSPITAL
file50286	IDNUM	124	132	70G79415
file50286	IDNUM	134	142	70G79415
file50286	IDNUM	134	144	70G794158A
file50286	PATIENT	146	162	MASSER, Augustus
file50286	IDNUM	1445	1453	70G79415
file50286	IDNUM	1568	1576	70G79415
file50286	IDNUM	1677	1685	70G79415
file50286	DATE	1568	1576	70G79415	2066-02-70
file50286	DATE	1677	1685	70G79415	2066-02-70
file50286	IDNUM	8	18	70G794158A
file50286	MEDICALRECORD	27	35	70279415
file50286	ZIP	298	302	2016
file50401	DATE	2751	2759	6/8/2068	2068-08-06
file50401	DATE	5585	5594	17/6/2071	2071-06-17
file50401	DATE	5689	5698	17.6.2067	2067-06-17
file50401	DOCTOR	2784	2793	S Revelez
file50401	HOSPITAL	219	238	GOOMALLING HOSPITAL
file50401	HOSPITAL	45	62	MORANBAH HOSPITAL
file50401	IDNUM	151	159	74H23441
file50401	IDNUM	160	168	74H23441
file50401	IDNUM	170	178	74H23441
file50401	IDNUM	170	180	74H234416G
file50401	PATIENT	182	196	SCHONS, AKILAH
file50401	IDNUM	8	18	74H234416G
file50401	MEDICALRECORD	27	33	742234
file50467	DATE	3104	3113	10/5/2070	2070-10-05
file50467	DATE	4880	4889	17/5/2068	2068-05-17
file50467	DOCTOR	3138	3147	G Luhring
file50467	HOSPITAL	194	213	GOOMALLING HOSPITAL
file50467	HOSPITAL	47	64	SNOWTOWN HOSPITAL
file50467	IDNUM	126	134	22D25547
file50467	IDNUM	136	144	22D25547
file50467	IDNUM	136	146	22D255474O
file50467	PATIENT	148	171	Nunamaker, Odell Werner
file50467	IDNUM	8	18	22D255474O
file50467	MEDICALRECORD	27	35	22125547
file50586	DATE	2235	2243	6/9/2067	2067-06-06
file50586	DATE	4020	4029	16/6/2067	2067-06-16
file50586	DOCTOR	2274	2284	Q Cardenos
file50586	HOSPITAL	197	218	QUORN HEALTH SERVICES
file50586	HOSPITAL	45	66	WONGAN HILLS HOSPITAL
file50586	IDNUM	127	135	64M45728
file50586	IDNUM	136	144	64M45728
file50586	IDNUM	146	154	64M45728
file50586	IDNUM	146	156	64M457280L
file50586	PATIENT	158	174	FLANNERY, Conrad
file50586	IDNUM	8	18	64M457280L
file50586	MEDICALRECORD	27	33	644457
file50586	ORGANIZATION	4085	4097	DHM BEAUFORT
file50586	DEPARTMENT	4135	4141	CAMPUS
file50716	DATE	2291	2300	13/5/2071	2071-05-13
file50716	DATE	5558	5565	19/5/68	2068-05-19
file50716	DATE	743	752	17/5/2071	2071-05-17
file50716	DOCTOR	2324	2332	O Keeney
file50716	HOSPITAL	190	217	JOYCE PALMER HEALTH SERVICE
file50716	HOSPITAL	46	60	BULLI HOSPITAL
file50716	IDNUM	122	130	59N90744
file50716	IDNUM	132	140	59N90744
file50716	IDNUM	132	142	59N907448R
file50716	PATIENT	144	167	Trojak, DEWAYNE THUKERI
file50716	IDNUM	8	18	59N907448R
file50716	MEDICALRECORD	27	34	5959074
file50755	CITY	46	57	MEEKATHARRA
file50755	DATE	1354	1363	21/6/2067	2067-06-21
file50755	DOCTOR	1387	1401	C. Saysongkham
file50755	DOCTOR	663	668	Skyes
file50755	TIME	690	710	11:30hrs on 20/06/71	2071-06-20T11:30
file50755	HOSPITAL	189	206	MAITLAND HOSPITAL
file50755	HOSPITAL	46	66	MEEKATHARRA HOSPITAL
file50755	IDNUM	128	136	17J92850
file50755	IDNUM	138	146	17J92850
file50755	IDNUM	138	148	17J928507Z
file50755	PATIENT	150	166	NAUER, Simon BUD
file50755	IDNUM	8	18	17J928507Z
file50755	MEDICALRECORD	27	34	1739285
file50755	STATE	208	210	SA
file50755	STREET	309	320	Gallbladder
file50933	CITY	187	198	HEALESVILLE
file50933	DATE	3617	3626	21/5/2070	2070-05-21
file50933	DATE	6951	6960	22/6/2067	2067-06-22
file50933	DATE	7611	7618	28.6.70	2070-06-28
file50933	DOCTOR	3648	3656	N Morsey
file50933	DOCTOR	7594	7603	N Kienitz
file50933	DOCTOR	956	962	Eugene
file50933	TIME	984	1003	13:37pm on 20/06/67	67-06-20T13:37
file50933	HOSPITAL	187	218	HEALESVILLE & DISTRICT HOSPITAL
file50933	HOSPITAL	46	65	SPRINGSURE HOSPITAL
file50933	IDNUM	127	135	59S12031
file50933	IDNUM	137	145	59S12031
file50933	IDNUM	137	147	59S120313W
file50933	PATIENT	149	164	GANDHI, WINSTON
file50933	IDNUM	8	18	19K051433A
file50933	MEDICALRECORD	27	34	5961203
file50933	TIME	7561	7574	36: 2105-2122	2066-02-36
file50933	ZIP	7542	7546	2018
file50933	ZIP	7556	7560	2018
file51008	DATE	3247	3256	26/6/2067	2067-06-26
file51008	DATE	5636	5644	1/6/2068	2068-06-01
file51008	DOCTOR	3279	3288	B Albarez
file51008	HOSPITAL	209	244	BARWON HEALTH - ASHLEY MANOR CAMPUS
file51008	HOSPITAL	45	73	ALPINE HEALTH (MOUNT BEAUTY)
file51008	IDNUM	134	142	07O24037
file51008	IDNUM	144	152	07O24037
file51008	IDNUM	144	154	07O240371E
file51008	PATIENT	156	168	Souvannarith
file51008	IDNUM	8	18	07O240371E
file51008	MEDICALRECORD	27	33	075240
file51056	CITY	209	219	CANOWINDRA
file51056	DATE	1016	1023	26/5/71	2071-05-26
file51056	DATE	1535	1544	29/6/2068	2068-06-29
file51056	DATE	2253	2262	28/5/2067	2067-05-28
file51056	DOCTOR	1568	1575	L. Rall
file51056	DOCTOR	965	972	Theatre
file51056	TIME	994	999	10:52	2052-10-52
file51056	HOSPITAL	209	246	CANOWINDRA SOLDIERS MEMORIAL HOSPITAL
file51056	HOSPITAL	46	84	BOYUP BROOK SOLDIERS MEMORIAL HOSPITAL
file51056	IDNUM	146	154	49W44218
file51056	IDNUM	156	164	49W44218
file51056	IDNUM	156	166	49W442188B
file51056	PATIENT	168	186	SZALA, COLLIN MINH
file51056	IDNUM	8	18	49W442188B
file51056	MEDICALRECORD	27	34	4984421
file51190	CITY	191	199	PAKENHAM
file51190	DATE	2139	2148	11/6/2068	2068-06-11
file51190	DATE	5015	5023	9/7/2067	2067-07-09
file51190	DATE	5532	5539	14.6.70	2070-06-14
file51190	DOCTOR	2172	2181	J Jaminet
file51190	DOCTOR	5517	5525	J Wiberg
file51190	DOCTOR	762	768	Stuart
file51190	DOCTOR	776	786	J. Crandal
file51190	TIME	790	808	1:15pm on 07.06.67	67-06-07T15:15
file51190	HOSPITAL	191	213	PAKENHAM HEALTH CENTRE
file51190	HOSPITAL	45	72	BANKSTOWN-LIDCOMBE HOSPITAL
file51190	IDNUM	133	141	34X98334
file51190	IDNUM	143	151	34X98334
file51190	IDNUM	143	153	34X983346H
file51190	PATIENT	155	168	Salone, WALDO
file51190	IDNUM	8	18	34X983346H
file51190	MEDICALRECORD	27	33	349983
file51190	ZIP	5467	5471	2018
file51190	ZIP	5481	5485	2018
file51333	DATE	2404	2413	6/10/2068	2068-10-06
file51333	DOCTOR	2434	2443	X Yonkers
file51333	DOCTOR	760	768	Sherwood
file51333	DOCTOR	775	783	Wodarski
file51333	TIME	784	791	2.35 pm	2035-10-02T15:35
file51333	HOSPITAL	200	221	WONGAN HILLS HOSPITAL
file51333	HOSPITAL	33	1021	GREAT OCEAN ROAD HEALTH - OTWAY HEALTH - OTWAY HEALTH - OTWAY HEALTH - OTWAY HEALTH - OTWAY HEALTH - OTWAY HEALTH - OTWAY HEALTH - OTWAY HEALTH - OTWAY HEALTH - OTWAY HEALTH - OTWAY HEALTH - OTWAY HEALTH - OTWAY HEALTH - OTWAY HEALTH - OTWAY HEALTH - OTWAY HEALTH - OTWAY HEALTH - OTWAY HEALTH - OTWAY HEALTH - OTWAY HEALTH - OTWAY HEALTH - OTWAY HEALTH - OTWAY HEALTH - OTWAY HEALTH - OTWAY HEALTH - OTWAY HEALTH - OTWAY HEALTH - OTWAY HEALTH - OTWAY HEALTH - OTWAY HEALTH - OTWAY HEALTH - OTWAY HEALTH - OTWAY HEALTH - OTWAY HEALTH - OTWAY HEALTH - OTWAY HEALTH - OTWAY HEALTH - OTWAY HEALTH - OTWAY HEALTH - OTWAY HEALTH - OTWAY HEALTH - OTWAY HEALTH - OTWAY HEALTH - OTWAY HEALTH - OTWAY HEALTH - OTWAY HEALTH - OTWAY HEALTH - OTWAY HEALTH - OTWAY HEALTH - OTWAY HEALTH - OTWAY HEALTH - OTWAY HEALTH - OTWAY HEALTH - OTWAY HEALTH - OTWAY HEALTH - OTWAY HEALTH - OTWAY HEALTH - OTWAY HEALTH - OTWAY HEALTH - OTWAY HEALTH - OTWAY HEALTH - OTWAY HEALTH - OTWAY HEALTH - OTWAY HEALTH - OT
file51333	IDNUM	144	152	92U91440
file51333	IDNUM	154	162	92U91440
file51333	IDNUM	154	164	92U914404Q
file51333	PATIENT	166	177	TUY, NANCIE
file51333	IDNUM	8	18	92U914404Q
file51333	MEDICALRECORD	27	33	927914
file51454	DATE	2225	2233	8/7/2071	2071-07-08
file51454	DATE	4183	4192	16/7/2071	2071-07-16
file51454	DATE	4846	4855	17.6.2071	2071-06-17
file51454	DOCTOR	2255	2261	H Aina
file51454	HOSPITAL	226	255	BOOROWA MULTI PURPOSE SERVICE
file51454	HOSPITAL	45	67	BYRON CENTRAL HOSPITAL
file51454	IDNUM	156	164	34C11521
file51454	IDNUM	165	173	34C11521
file51454	IDNUM	175	183	34C11521
file51454	IDNUM	175	185	34C115211M
file51454	PATIENT	187	203	TAECKER, COLETTA
file51454	IDNUM	8	18	34C115211M
file51454	MEDICALRECORD	27	33	341115
file51454	ORGANIZATION	4290	4293	A16
file51574	CITY	201	208	LITHGOW
file51574	DATE	2304	2312	9/7/2067	2067-07-09
file51574	DATE	6238	6247	16/6/2071	2071-06-16
file51574	DOCTOR	2336	2346	F Dresbach
file51574	HOSPITAL	201	217	LITHGOW HOSPITAL
file51574	HOSPITAL	45	68	MONASH HEALTH COMMUNITY
file51574	IDNUM	129	137	28D65647
file51574	IDNUM	138	146	28D65647
file51574	IDNUM	148	156	28D65647
file51574	IDNUM	148	158	28D656479S
file51574	PATIENT	160	178	MURATALLA, Roberto
file51574	IDNUM	8	18	28D656479S
file51574	MEDICALRECORD	27	33	281656
file51617	DATE	1572	1581	18/6/2070	2070-06-18
file51617	DATE	2208	2217	15/7/2070	2070-07-15
file51617	DOCTOR	1605	1614	U Turlich
file51617	HOSPITAL	188	206	PEMBERTON HOSPITAL
file51617	HOSPITAL	46	59	YORK HOSPITAL
file51617	IDNUM	121	129	76Z67753
file51617	IDNUM	131	139	76Z67753
file51617	IDNUM	131	141	76Z677537B
file51617	PATIENT	143	165	Counselman, EDWARDO Jc
file51617	IDNUM	8	18	76Z677537B
file51617	MEDICALRECORD	27	34	7696775
file51754	CITY	46	51	JUNEE
file51754	DATE	3203	3212	13/7/2070	2070-07-13
file51754	DOCTOR	3237	3246	E. Vielma
file51754	DOCTOR	557	563	Fellow
file51754	DOCTOR	595	604	E. Pouche
file51754	HOSPITAL	194	215	ONSLOW HEALTH SERVICE
file51754	HOSPITAL	46	73	JUNEE MULTI PURPOSE SERVICE
file51754	IDNUM	135	143	18I87924
file51754	IDNUM	145	153	18I87924
file51754	IDNUM	145	155	18I879244X
file51754	PATIENT	157	171	Wildt, COLEMAN
file51754	IDNUM	2406	2413	65x21mm
file51754	IDNUM	8	18	18I879244X
file51754	MEDICALRECORD	27	34	1838792
file51872	CITY	196	204	NARRABRI
file51872	CITY	45	53	CESSNOCK
file51872	DATE	2044	2053	17/6/2071	2071-06-17
file51872	DATE	4071	4080	19/7/2068	2068-07-19
file51872	DOCTOR	2077	2085	B Loyola
file51872	DOCTOR	564	572	Mohammed
file51872	TIME	576	586	17.06.2070	2070-06-17T15:25
file51872	HOSPITAL	196	222	NARRABRI DISTRICT HOSPITAL
file51872	HOSPITAL	45	71	CESSNOCK DISTRICT HOSPITAL
file51872	IDNUM	132	140	03J32950
file51872	IDNUM	142	150	03J32950
file51872	IDNUM	142	152	03J329502D
file51872	PATIENT	154	173	SPYRAKOS, WM Forest
file51872	IDNUM	8	18	03J329502D
file51872	MEDICALRECORD	27	33	033329
file51968	DATE	2253	2262	18/7/2070	2070-07-18
file51968	DOCTOR	2313	2325	Q. Timperman
file51968	DOCTOR	643	649	phoned
file51968	DATE	653	662	14.6.2071	2071-06-14
file51968	HOSPITAL	190	207	SNOWTOWN HOSPITAL
file51968	HOSPITAL	45	63	LIVERPOOL HOSPITAL
file51968	IDNUM	124	132	61F34056
file51968	IDNUM	134	142	61F34056
file51968	IDNUM	134	144	61F340560M
file51968	PATIENT	146	167	Moudy, MELLIE Terence
file51968	IDNUM	8	18	61F340560M
file51968	MEDICALRECORD	27	33	612340
file52026	DATE	3001	3010	21/7/2070	2070-07-21
file52026	DATE	4536	4545	23/7/2068	2068-07-23
file52026	DOCTOR	3036	3046	A. Moulton
file52026	DOCTOR	658	665	Brommer
file52026	TIME	709	729	11:00 am on 16.07.67	67-07-16T11:00
file52026	HOSPITAL	184	208	KINGSTON CENTRE HOSPITAL
file52026	HOSPITAL	46	63	THEODORE HOSPITAL
file52026	IDNUM	125	133	03O54237
file52026	IDNUM	135	143	03O54237
file52026	IDNUM	135	145	03O542377I
file52026	PATIENT	147	161	BILLMAN, MONTY
file52026	IDNUM	8	18	19K077384N
file52026	MEDICALRECORD	27	34	0355423
file52068	CITY	237	248	CASTLEMAINE
file52068	DATE	1697	1706	20/6/2071	2071-06-20
file52068	DATE	3141	3150	26/7/2070	2070-07-26
file52068	DOCTOR	1731	1739	O Medure
file52068	DOCTOR	635	645	Theatre 10
file52068	DOCTOR	653	663	O. Otinger
file52068	TIME	667	685	1:12pm on 22.07.71	2066-07-22T11:12
file52068	HOSPITAL	237	255	CASTLEMAINE HEALTH
file52068	HOSPITAL	47	96	EASTERN EYRE HEALTH AND AGED CARE - COWELL CAMPUS
file52068	IDNUM	158	166	51K66242
file52068	IDNUM	168	176	51K66242
file52068	IDNUM	168	178	51K662425R
file52068	PATIENT	180	206	KOSSAKOWSKI, Aurelio Caleb
file52068	IDNUM	8	18	51K662425R
file52068	MEDICALRECORD	27	35	51466242
file52181	CITY	62	75	BACCHUS MARSH
file52181	DATE	2477	2486	29/6/2071	2071-06-29
file52181	DATE	6036	6045	26/6/2068	2068-06-26
file52181	DOCTOR	2515	2522	Z Ulich
file52181	HOSPITAL	196	228	ST MARYS COMMUNITY HEALTH CENTRE
file52181	HOSPITAL	45	75	WESTERN HEALTH - BACCHUS MARSH
file52181	IDNUM	136	144	93T86424
file52181	IDNUM	146	154	93T86424
file52181	IDNUM	146	156	93T864241N
file52181	IDNUM	8	18	93T864241N
file52181	MEDICALRECORD	27	33	937864
file52359	DATE	2167	2176	29/7/2068	2068-07-29
file52359	DATE	2316	2324	4/5/2068	2068-05-04
file52359	DATE	5955	5963	8/6/2067	2067-06-08
file52359	DOCTOR	2348	2361	N. Kasprowicz
file52359	DOCTOR	710	719	N. Kellis
file52359	TIME	723	741	5:25pm on 27/07/68	68-07-27T15:25
file52359	HOSPITAL	190	203	RYDE HOSPITAL
file52359	HOSPITAL	46	62	MODBURY HOSPITAL
file52359	IDNUM	124	132	51P88529
file52359	IDNUM	134	142	51P88529
file52359	IDNUM	134	144	51P885290W
file52359	PATIENT	146	167	BROWNFIELD, Michelina
file52359	IDNUM	8	18	51P885290W
file52359	MEDICALRECORD	27	34	5168852
file52359	STREET	4583	4592	Classical
file52423	DATE	2225	2233	5/4/2071	2071-04-05
file52423	DATE	3143	3151	7/8/2071	2071-08-07
file52423	DOCTOR	2257	2264	L Spade
file52423	HOSPITAL	201	227	THE ROYAL WOMEN'S HOSPITAL
file52423	HOSPITAL	45	82	EAST WIMMERA HEALTH SERVICE - BIRCHIP
file52423	IDNUM	143	151	45Q32545
file52423	IDNUM	153	161	45Q32545
file52423	IDNUM	153	163	45Q325457C
file52423	PATIENT	165	178	AURAND, MIKEL
file52423	IDNUM	8	18	45Q325457C
file52423	MEDICALRECORD	27	33	456325
file52542	CITY	46	52	CAMDEN
file52542	DATE	2034	2042	8/8/2067	2067-08-08
file52542	DOCTOR	2064	2074	V Gilliand
file52542	HOSPITAL	190	208	CHERBOURG HOSPITAL
file52542	HOSPITAL	46	61	CAMDEN HOSPITAL
file52542	IDNUM	123	131	87Z52726
file52542	IDNUM	133	141	87Z52726
file52542	IDNUM	133	143	87Z527264Y
file52542	PATIENT	145	152	Chumley
file52542	IDNUM	8	18	87Z527264Y
file52542	MEDICALRECORD	27	34	8795272
file52598	CITY	46	55	GLADSTONE
file52598	DATE	2317	2329	/MM 6/5/2068	2068-05-06
file52598	DATE	4131	4139	8/4/2068	2068-04-08
file52598	DOCTOR	2353	2363	J. Brokins
file52598	DOCTOR	3939	3956	NEWTON SCHOENROCK
file52598	HOSPITAL	185	211	THE ROYAL WOMEN'S HOSPITAL
file52598	HOSPITAL	46	64	GLADSTONE HOSPITAL
file52598	IDNUM	126	134	35V55832
file52598	IDNUM	136	144	35V55832
file52598	IDNUM	136	146	35V558322H
file52598	PATIENT	148	162	Yarrell, JULES
file52598	IDNUM	8	18	35V558322H
file52598	MEDICALRECORD	27	34	3585583
file52655	DATE	868	877	22/7/2070	2070-07-22
file52655	DOCTOR	1020	1035	Dexter PALINSKI
file52655	DOCTOR	3685	3691	O Kaan
file52655	HOSPITAL	212	231	BODDINGTON HOSPITAL
file52655	HOSPITAL	46	82	PINNAROO SOLDIERS' MEMORIAL HOSPITAL
file52655	IDNUM	4760	4764	2069
file52655	IDNUM	144	152	52G23049
file52655	IDNUM	154	162	52G23049
file52655	IDNUM	154	164	52G2304916
file52655	PATIENT	166	189	Imparato, Foster GROVER
file52655	IDNUM	8	18	52G2304916
file52655	MEDICALRECORD	27	34	5222304
file52655	ZIP	4760	4764	2069
file52778	DATE	2034	2043	18/4/2070	2070-04-18
file52778	DATE	4410	4419	26/8/2067	2067-08-26
file52778	DOCTOR	2068	2076	H. Dusza
file52778	DOCTOR	699	708	H. Roshak
file52778	TIME	712	730	3:12pm on 16/04/67	67-04-16T15:12
file52778	HOSPITAL	190	210	GNOWANGERUP HOSPITAL
file52778	HOSPITAL	46	63	BEVERLEY HOSPITAL
file52778	IDNUM	125	133	20W09958
file52778	IDNUM	135	143	20W09958
file52778	IDNUM	135	145	20W0995805
file52778	PATIENT	147	167	MIDY, KARRAK Charles
file52778	IDNUM	8	18	20W0995805
file52778	MEDICALRECORD	27	34	2080995
file52961	DATE	3057	3066	17/8/2071	2071-08-17
file52961	DATE	6339	6348	23/7/2067	2067-07-23
file52961	DATE	6876	6885	21.4.2070	2070-04-21
file52961	DOCTOR	3090	3099	R Glasper
file52961	DOCTOR	6857	6869	V Marjoniemi
file52961	DOCTOR	839	847	R. Ragno
file52961	TIME	851	869	5.09pm on 16.04.71	2009-04-16T5:09
file52961	HOSPITAL	219	255	PINNAROO SOLDIERS' MEMORIAL HOSPITAL
file52961	HOSPITAL	46	69	SOUTHERN CROSS HOSPITAL
file52961	IDNUM	158	166	62F29039
file52961	IDNUM	168	176	62F29039
file52961	IDNUM	168	178	62F290397J
file52961	PATIENT	180	196	Tartaglia, MARIA
file52961	IDNUM	8	18	62F290397J
file52961	MEDICALRECORD	27	34	6222903
file52961	TIME	6826	6839	36: 2105-2122	2066-02-36
file52961	ZIP	6807	6811	2018
file52961	ZIP	6821	6825	2018
file53022	DATE	1151	1160	21/4/2068	2068-04-21
file53022	DATE	2386	2395	24/7/2068	2068-07-24
file53022	DOCTOR	1184	1195	G Hutchkiss
file53022	HOSPITAL	204	221	SUNSHINE HOSPITAL
file53022	HOSPITAL	47	76	CALVARY HEALTH CARE BETHLEHEM
file53022	IDNUM	138	146	20B31135
file53022	IDNUM	148	156	20B31135
file53022	IDNUM	148	158	20B311355S
file53022	PATIENT	160	181	MEYSEMBOURG, Mohammad
file53022	IDNUM	8	18	20B311355S
file53022	MEDICALRECORD	27	35	20031135
file53102	DATE	3855	3864	24/5/2068	2068-05-24
file53102	DATE	6532	6540	1/8/2068	2068-08-01
file53102	DOCTOR	1167	1176	Registrar
file53102	DOCTOR	1188	1196	D. Neigh
file53102	TIME	1200	1207	19.5.70	2070-05-19
file53102	DOCTOR	3889	3897	D Burnap
file53102	HOSPITAL	200	218	TUMBY BAY HOSPITAL
file53102	HOSPITAL	46	66	DIRRANBANDI HOSPITAL
file53102	IDNUM	128	136	15C76261
file53102	IDNUM	138	146	15C76261
file53102	IDNUM	138	148	15C7626139
file53102	PATIENT	150	177	FLATHERS, Djarrun Cristobal
file53102	IDNUM	8	18	15C7626139
file53102	MEDICALRECORD	27	34	1507626
file53152	CITY	201	208	KYABRAM
file53152	DATE	1715	1723	4/8/2071	2071-04-04
file53152	DATE	2228	2236	6/6/2070	2070-06-06
file53152	DOCTOR	1748	1758	E. Magaldi
file53152	HOSPITAL	201	235	KYABRAM & DISTRICT HEALTH SERVICES
file53152	HOSPITAL	46	69	MAITLAND HOSPITAL (NSW)
file53152	IDNUM	131	139	10G53422
file53152	IDNUM	141	149	10G53422
file53152	IDNUM	141	151	10G534220X
file53152	PATIENT	153	178	Katzenbach, RHETT Wilfred
file53152	IDNUM	8	18	10G534220X
file53152	MEDICALRECORD	27	34	1025342
file53204	DATE	2018	2026	7/9/2067	2067-09-07
file53204	DATE	3959	3967	7/9/2067	2067-07-09
file53204	DOCTOR	2049	2056	C Luedi
file53204	HOSPITAL	192	218	BASS COAST REGIONAL HEALTH
file53204	HOSPITAL	47	64	BEVERLEY HOSPITAL
file53204	IDNUM	126	134	05H08448
file53204	IDNUM	136	144	05H08448
file53204	IDNUM	136	146	05H084488D
file53204	PATIENT	148	169	Detro, Markus MATTHEW
file53204	IDNUM	8	18	05H084488D
file53204	MEDICALRECORD	27	35	05208448
file53244	DATE	1629	1637	5/8/2068	2068-08-05
file53244	DATE	2912	2921	9/10/2071	2071-10-09
file53244	DOCTOR	1660	1670	Q Carbajal
file53244	HOSPITAL	216	249	KOOWEERUP REGIONAL HEALTH SERVICE
file53244	HOSPITAL	45	83	BOYUP BROOK SOLDIERS MEMORIAL HOSPITAL
file53244	IDNUM	144	152	63D00554
file53244	IDNUM	154	162	63D00554
file53244	IDNUM	154	164	63D005546B
file53244	PATIENT	166	193	MARTINDELCAMP, KELVIN Monte
file53244	IDNUM	8	18	63D005546M
file53244	MEDICALRECORD	27	33	631005
file53326	DATE	3063	3072	17/6/2070	2070-06-17
file53326	DATE	5421	5430	16/6/2067	2067-06-16
file53326	DATE	5580	5589	20/9/2068	2068-09-20
file53326	DATE	6166	6175	23/6/2068	2068-06-23
file53326	DOCTOR	3098	3111	A. Griesinger
file53326	HOSPITAL	227	250	SOUTHERN CROSS HOSPITAL
file53326	HOSPITAL	46	72	BASS COAST REGIONAL HEALTH
file53326	IDNUM	177	187	04M207253I
file53326	PATIENT	189	203	Waitman, Odell
file53326	IDNUM	8	18	04M207253I
file53326	MEDICALRECORD	27	34	0442072
file53469	DATE	5895	5904	21/9/2068	2068-09-21
file53469	DOCTOR	2092	2100	Y Othoud
file53469	DOCTOR	802	808	Palmer
file53469	DOCTOR	816	826	Heatherton
file53469	TIME	830	837	3.35 pm	2035-10-35
file53469	HOSPITAL	183	212	BOOROWA MULTI PURPOSE SERVICE
file53469	HOSPITAL	45	62	SUNSHINE HOSPITAL
file53469	IDNUM	123	131	99N74751
file53469	IDNUM	133	141	99N74751
file53469	IDNUM	133	143	99N747511O
file53469	PATIENT	145	159	YACKEREN, Nola
file53469	IDNUM	8	18	99N747511O
file53469	MEDICALRECORD	27	33	995747
file53632	DATE	2232	2241	15/9/2068	2068-09-15
file53632	DATE	2537	2546	23/9/2067	2067-09-23
file53632	DATE	3935	3944	21/5/2071	2071-05-21
file53632	DATE	4242	4251	22/9/2071	2071-09-22
file53632	DATE	7450	7460	22.05.2018	2018-05-22
file53632	DOCTOR	2570	2576	N Wehn
file53632	DOCTOR	663	669	Fellow
file53632	DOCTOR	701	711	N. Cotrone
file53632	HOSPITAL	213	270	DELORAINE DISTRICT HOSPITAL AND COMMUNITY HEALTH SERVICES
file53632	HOSPITAL	47	62	MALDON HOSPITAL
file53632	IDNUM	152	160	57J76857
file53632	IDNUM	162	170	57J76857
file53632	IDNUM	162	172	57J768579X
file53632	PATIENT	174	190	Grossett, TYRONE
file53632	IDNUM	8	18	57J768579X
file53632	MEDICALRECORD	27	35	57376857
file53632	MEDICALRECORD	7597	7607	24.05.2019
file53765	CITY	46	57	MARYBOROUGH
file53765	DATE	2204	2213	27/9/2068	2068-09-27
file53765	DATE	4746	4755	29/9/2068	2068-09-29
file53765	DATE	4853	4862	30.5.2068	2068-05-30
file53765	DOCTOR	2237	2246	X Mehtala
file53765	DOCTOR	759	768	Registrar
file53765	HOSPITAL	225	254	CONCORD REPATRIATION HOSPITAL
file53765	HOSPITAL	46	66	MARYBOROUGH HOSPITAL
file53765	IDNUM	156	164	89S06038
file53765	IDNUM	166	174	89S06038
file53765	IDNUM	166	176	89S060386T
file53765	PATIENT	178	202	ANDRION, Agustin Neville
file53765	IDNUM	8	18	89S060386T
file53765	MEDICALRECORD	27	34	8960603
file53879	DATE	1759	1768	28/6/2071	2071-06-28
file53879	DATE	3939	3947	6/1/2070	2070-01-06
file53879	DOCTOR	1793	1803	U. Hadsell
file53879	DOCTOR	594	597	Guy
file53879	DOCTOR	605	614	U. Kirlin
file53879	TIME	618	625	25.8.71	2071-08-25T23:00
file53879	HOSPITAL	195	220	FAR NORTH HEALTH SERVICES
file53879	HOSPITAL	45	74	CALVARY HEALTH CARE BETHLEHEM
file53879	IDNUM	135	143	84T41054
file53879	IDNUM	145	153	84T41054
file53879	IDNUM	145	155	84T410543Z
file53879	PATIENT	157	172	Mangel, DEWAYNE
file53879	IDNUM	8	18	47O091444C
file53879	MEDICALRECORD	27	33	475091
file53928	DATE	3759	3767	7/9/2071	2071-09-07
file53928	DOCTOR	2635	2644	J Weinger
file53928	HOSPITAL	173	210	EAST WIMMERA HEALTH SERVICE - BIRCHIP
file53928	IDNUM	47	51	J254
file53928	IDNUM	8	18	32P4316023
file53928	IDNUM	113	121	32P43160
file53928	IDNUM	123	131	32P43160
file53928	IDNUM	123	133	32P4316023
file53928	PATIENT	135	150	Fetrow, THUKERI
file53928	MEDICALRECORD	27	35	32543160
file53982	DATE	2696	2705	14/6/2067	2067-06-14
file53982	DATE	4115	4124	18/9/2068	2068-09-18
file53982	DOCTOR	2729	2739	T. Gravitz
file53982	HOSPITAL	180	218	CLONCURRY MULTI-PURPOSE HEALTH SERVICE
file53982	IDNUM	46	50	T497
file53982	IDNUM	8	18	74Y733418E
file53982	IDNUM	112	120	74Y73341
file53982	IDNUM	122	130	74Y73341
file53982	IDNUM	122	132	74Y733418E
file53982	PATIENT	134	157	Fondaw, AKILAH Christia
file53982	MEDICALRECORD	27	34	7497334
file54120	DATE	2623	2633	17/10/2068	2068-10-17
file54120	DATE	5484	5493	22/6/2067	2067-06-22
file54120	DOCTOR	2658	2667	H Carlock
file54120	DOCTOR	735	744	H Loukota
file54120	DOCTOR	752	762	H. Vacarro
file54120	TIME	763	770	13.7.71	2071-07-13
file54120	HOSPITAL	195	212	SUNSHINE HOSPITAL
file54120	HOSPITAL	45	64	PARABURDOO HOSPITAL
file54120	IDNUM	125	133	32U75446
file54120	IDNUM	135	143	32U75446
file54120	IDNUM	135	145	32U754466N
file54120	PATIENT	147	172	Thygerson, Terence Benito
file54120	IDNUM	8	18	32U754466N
file54120	MEDICALRECORD	27	33	327754
file54301	DOCTOR	3135	3146	S Glanville
file54301	DOCTOR	838	845	Gerardo
file54301	DOCTOR	861	866	S. Ka
file54301	HOSPITAL	192	210	KATANNING HOSPITAL
file54301	HOSPITAL	45	67	PINGELLY HEALTH CENTRE
file54301	IDNUM	128	136	64C95627
file54301	IDNUM	138	146	64C95627
file54301	IDNUM	138	148	64C956273J
file54301	PATIENT	150	169	Mangel, John Jordon
file54301	IDNUM	8	18	64C956273J
file54301	MEDICALRECORD	27	33	641956
file54378	DATE	2857	2866	22/9/2070	2070-09-22
file54378	DATE	5557	5566	30/7/2071	2071-07-30
file54378	DOCTOR	2889	2894	P Eck
file54378	HOSPITAL	177	214	EAST WIMMERA HEALTH SERVICE - BIRCHIP
file54378	IDNUM	46	50	P914
file54378	IDNUM	8	18	69D496441P
file54378	IDNUM	112	120	69D49644
file54378	IDNUM	122	130	69D49644
file54378	IDNUM	122	132	69D496441P
file54378	PATIENT	134	154	Leith, ISSAC-FRANCIS
file54378	MEDICALRECORD	27	34	6914964
file54428	DOCTOR	1671	1681	E Hoeflich
file54428	DOCTOR	2567	2583	SAMMIE Wendolski
file54428	DATE	2585	2596	16 04275999	2067-10-04
file54428	IDNUM	2585	2596	16 04275999
file54428	DOCTOR	734	742	E Boulch
file54428	HOSPITAL	193	209	BALMAIN HOSPITAL
file54428	HOSPITAL	47	65	FAIRFIELD HOSPITAL
file54428	IDNUM	127	135	16A42759
file54428	IDNUM	137	145	16A42759
file54428	IDNUM	137	147	16A427599Y
file54428	PATIENT	149	170	FRANCESCONE, FERNANDO
file54428	IDNUM	8	18	16A427599Y
file54428	MEDICALRECORD	27	35	16042759
file54534	DATE	2766	2774	8/6/2067	2067-06-08
file54534	DATE	3329	3338	30/7/2070	2070-07-30
file54534	DATE	3907	3916	10/6/2068	2068-10-06
file54534	DOCTOR	3362	3373	O. Gutieres
file54534	HOSPITAL	211	229	KATANNING HOSPITAL
file54534	HOSPITAL	45	73	ROYAL PRINCE ALFRED HOSPITAL
file54534	IDNUM	134	142	58I62930
file54534	IDNUM	143	151	58I62930
file54534	IDNUM	153	161	58I62930
file54534	PATIENT	165	188	Deglopper, Refugio Boyd
file54534	IDNUM	8	18	58I629306U
file54534	MEDICALRECORD	27	33	583629
file54605	CITY	207	215	BATHURST
file54605	DATE	3771	3779	6/8/2067	2067-06-08
file54605	DATE	6716	6725	15/8/2067	2067-08-15
file54605	HOSPITAL	207	229	BATHURST BASE HOSPITAL
file54605	HOSPITAL	47	77	BARADINE MULTI PURPOSE SERVICE
file54605	IDNUM	139	147	16E74936
file54605	IDNUM	149	157	16E74936
file54605	IDNUM	149	159	16E749364D
file54605	PATIENT	161	184	Mizrahi, Lisette RENATO
file54605	IDNUM	8	18	16E749364D
file54605	MEDICALRECORD	27	35	16174936
file54642	CITY	220	231	KURRI KURRI
file54642	DATE	1476	1484	4/7/2071	2071-07-04
file54642	DATE	2793	2801	8/8/2070	2070-08-08
file54642	DOCTOR	1509	1515	A. Dez
file54642	HOSPITAL	220	249	KURRI KURRI DISTRICT HOSPITAL
file54642	HOSPITAL	47	87	STRATHALBYN AND DISTRICT HEALTH SERVICES
file54642	IDNUM	149	157	01F18062
file54642	IDNUM	159	167	01F18062
file54642	IDNUM	159	169	01F180622J
file54642	PATIENT	171	197	Ferryman, CHIQUITA YEVETTE
file54642	IDNUM	8	18	01F180622J
file54642	MEDICALRECORD	27	35	01218062
file54801	CITY	206	213	TANUNDA
file54801	DATE	5221	5231	14/10/2067	2067-10-14
file54801	DOCTOR	5249	5259	K Thornock
file54801	DOCTOR	669	675	Declan
file54801	DOCTOR	683	696	K. Szaflarski
file54801	TIME	700	707	5.10.71	2071-10-05T15:10
file54801	HOSPITAL	206	222	TANUNDA HOSPITAL
file54801	HOSPITAL	47	84	WEST WIMMERA HEALTH SERVICE - JEPARIT
file54801	IDNUM	146	154	43O48233
file54801	IDNUM	156	164	43O48233
file54801	IDNUM	156	166	43O482339F
file54801	PATIENT	168	183	Beyser, Kendall
file54801	IDNUM	8	18	43O482339F
file54801	MEDICALRECORD	27	35	43548233
file54801	ZIP	6584	6588	2018
file54934	CITY	47	58	MARYBOROUGH
file54934	DATE	150	158	25/11/70	2070-11-25
file54934	DATE	3364	3373	7/11/2068	2068-11-07
file54934	DATE	7024	7033	16/8/2071	2071-08-16
file54934	DATE	7058	7066	22/11/67	2067-11-22
file54934	DATE	7355	7363	26/11/68	2068-11-26
file54934	DOCTOR	3398	3409	Z Bleiweiss
file54934	HOSPITAL	224	245	SHELLHARBOUR HOSPITAL
file54934	HOSPITAL	47	67	MARYBOROUGH HOSPITAL
file54934	IDNUM	160	168	91K40249
file54934	IDNUM	170	178	91K40249
file54934	IDNUM	170	180	91K402497O
file54934	PATIENT	182	200	Ibara, STACY TYREE
file54934	IDNUM	5339	5340	2
file54934	IDNUM	8	18	91K402497O
file54934	MEDICALRECORD	27	35	91440249
file54991	CITY	47	57	DENILIQUIN
file54991	DATE	2876	2886	17/11/2070	2070-11-17
file54991	DATE	352	364	October 2069	2069
file54991	DATE	5187	5196	20/7/2071	2071-07-20
file54991	DOCTOR	2911	2922	W Dannecker
file54991	HOSPITAL	188	207	YARRA RANGES HEALTH
file54991	HOSPITAL	47	66	DENILIQUIN HOSPITAL
file54991	IDNUM	128	136	86L85365
file54991	IDNUM	138	146	86L85365
file54991	IDNUM	138	148	86L853655U
file54991	PATIENT	150	165	MCKILLIPS, Wren
file54991	IDNUM	8	18	86L853655U
file54991	MEDICALRECORD	27	35	86485365
file55037	CITY	46	52	FORBES
file55037	DATE	2934	2943	19/7/2068	2068-07-19
file55037	DATE	4549	4559	21/11/2068	2068-11-21
file55037	DOCTOR	2968	2978	G Zumstein
file55037	HOSPITAL	200	217	MAITLAND HOSPITAL
file55037	HOSPITAL	46	70	FORBES DISTRICT HOSPITAL
file55037	IDNUM	132	140	28U15546
file55037	IDNUM	142	150	28U15546
file55037	IDNUM	142	152	28U155462Q
file55037	PATIENT	154	177	PREIST, Addison Thurman
file55037	IDNUM	8	18	28U155462Q
file55037	MEDICALRECORD	27	34	2871554
file55131	CITY	5575	5588	MOUNT GAMBIER
file55131	CITY	6560	6567	STAWELL
file55131	DATE	3142	3152	19/11/2070	2070-11-19
file55131	DATE	4632	4641	26/7/2067	2067-07-26
file55131	DATE	4817	4826	11.1.2071	2071-11-01
file55131	DATE	7161	7170	11.5.2067	2067-05-11
file55131	DOCTOR	3177	3185	V Somodi
file55131	DOCTOR	6457	6469	Rocky Curcio
file55131	DOCTOR	745	750	Arron
file55131	TIME	754	775	10:50am on 19.07.2067	2067-07-19T10:50
file55131	HOSPITAL	278	295	ANGASTON HOSPITAL
file55131	HOSPITAL	46	81	BARWON HEALTH - ASHLEY MANOR CAMPUS
file55131	HOSPITAL	4857	4893	PANNAROO SOLDIERS' MEMORIAL HOSPITAL
file55131	HOSPITAL	5152	5189	WEST WIMMERA HEALTH SERVICE - JEPARIT
file55131	HOSPITAL	5575	5617	MOUNT GAMBIER AND DISTRICTS HEALTH SERVICE
file55131	IDNUM	208	216	86Q17652
file55131	IDNUM	218	226	86Q17652
file55131	IDNUM	218	228	86Q176520Z
file55131	PATIENT	230	255	Rollins, DEANGELO Shaynes
file55131	IDNUM	8	18	86Q176520Z
file55131	MEDICALRECORD	27	34	8661765
file55131	MEDICALRECORD	6394	6404	16.08.2019
file55131	ORGANIZATION	6542	6559	ACUTE STROKE UNIT
file55165	DATE	1291	1301	23/11/2071	2071-11-23
file55165	DOCTOR	1327	1336	F. Scheel
file55165	HOSPITAL	46	67	SHELLHARBOUR HOSPITAL
file55165	IDNUM	129	137	28Z37733
file55165	IDNUM	139	147	28Z37733
file55165	IDNUM	139	149	28Z377336V
file55165	PATIENT	151	165	CRABBS, ANISHA
file55165	IDNUM	8	18	28Z377336V
file55165	MEDICALRECORD	27	34	2893773
file55261	DATE	3691	3700	29/8/2071	2071-08-29
file55261	DATE	5944	5952	3/9/2071	2071-09-03
file55261	DOCTOR	3726	3738	D. Cassmeyer
file55261	HOSPITAL	197	214	THEODORE HOSPITAL
file55261	HOSPITAL	45	70	FAR NORTH HEALTH SERVICES
file55261	IDNUM	131	139	12A81859
file55261	IDNUM	140	148	12A81859
file55261	IDNUM	150	158	12A81859
file55261	IDNUM	150	160	12A818594B
file55261	PATIENT	162	174	Moret, Karin
file55261	IDNUM	8	18	12A818594B
file55261	MEDICALRECORD	27	33	120818
file55403	CITY	45	54	GLADSTONE
file55403	DATE	1906	1914	9/2/2067	2067-02-09
file55403	DATE	4521	4531	07.08.2019	2019-08-07
file55403	DATE	4679	4689	15/10/2067	2067-10-15
file55403	DOCTOR	1937	1947	R. Carolla
file55403	DOCTOR	4502	4514	V Marjoniemi
file55403	DOCTOR	4784	4799	DESPINA Bartels
file55403	DOCTOR	4807	4809	B5
file55403	DOCTOR	674	677	Ray
file55403	DOCTOR	689	700	R. Kakowski
file55403	TIME	681	708	2:40pm, R. Kakowski 29/7/70	70
file55403	HOSPITAL	209	255	WEST WIMMERA HEALTH SERVICE - JEPARIT HOSPITAL
file55403	HOSPITAL	45	63	GLADSTONE HOSPITAL
file55403	IDNUM	152	160	60W83955
file55403	IDNUM	162	170	60W83955
file55403	PATIENT	174	186	Rosada, Eric
file55403	IDNUM	8	18	60W839553K
file55403	MEDICALRECORD	27	33	608839
file55403	TIME	4471	4484	36: 2105-2122	2066-02-36
file55403	ZIP	4452	4456	2018
file55403	ZIP	4466	4470	2018
file55437	DATE	1158	1168	11/10/2067	2067-10-11
file55437	DATE	1837	1845	8/9/2070	2070-09-08
file55437	DOCTOR	1194	1204	B. Neidert
file55437	HOSPITAL	192	223	WEST GIPPSLAND HEALTHCARE GROUP
file55437	HOSPITAL	46	61	MALDON HOSPITAL
file55437	IDNUM	123	131	02F03036
file55437	IDNUM	133	141	02F03036
file55437	IDNUM	133	143	02F030369G
file55437	PATIENT	145	169	Miville, GABRIELA Werner
file55437	IDNUM	8	18	02F030369G
file55437	MEDICALRECORD	27	34	0220303
file55437	TIME	620	639	11:55am on 10.09.67	67-09-10T11:55
file55464	CITY	47	54	SEYMOUR
file55464	DATE	1549	1558	10/9/2070	2070-10-09
file55464	DATE	770	778	9/8/2071	2071-08-09
file55464	DOCTOR	801	808	Z Motto
file55464	HOSPITAL	187	212	FAR NORTH HEALTH SERVICES
file55464	HOSPITAL	47	61	SEYMOUR HEALTH
file55464	IDNUM	123	131	97G58152
file55464	IDNUM	133	141	97G58152
file55464	IDNUM	133	143	97G581527M
file55464	PATIENT	145	164	BIEDERWOLF, Teodoro
file55464	IDNUM	8	18	97G581527M
file55464	MEDICALRECORD	27	35	97258152
file55612	CITY	194	199	JUNEE
file55612	DATE	2025	2034	9/11/2071	2071-11-09
file55612	DATE	5868	5877	17/9/2070	2070-09-17
file55612	DOCTOR	2060	2069	N Rollind
file55612	HOSPITAL	194	221	JUNEE MULTI PURPOSE SERVICE
file55612	HOSPITAL	45	64	BODDINGTON HOSPITAL
file55612	IDNUM	125	133	55C50268
file55612	IDNUM	134	142	55C50268
file55612	IDNUM	144	152	55C50268
file55612	IDNUM	144	154	55C502685V
file55612	PATIENT	156	171	Bracher, KAZUKO
file55612	IDNUM	8	18	55C502685V
file55612	MEDICALRECORD	27	33	550502
file55612	ORGANIZATION	4241	4260	United Technologies
file55612	DEPARTMENT	4273	4291	Molecular Oncology
file55713	CITY	198	209	MARYBOROUGH
file55713	DATE	2224	2234	10/11/2071	2071-11-10
file55713	DATE	5021	5029	17/10/68	2068-10-17
file55713	DOCTOR	2257	2265	Y Birkey
file55713	HOSPITAL	198	218	MARYBOROUGH HOSPITAL
file55713	HOSPITAL	45	71	CRAIGIEBURN HEALTH SERVICE
file55713	IDNUM	132	140	97L80449
file55713	IDNUM	141	149	97L80449
file55713	IDNUM	151	159	97L80449
file55713	IDNUM	151	161	97L804492R
file55713	PATIENT	132	140	97L80449
file55713	PATIENT	141	149	97L80449
file55713	PATIENT	151	159	97L80449
file55713	PATIENT	151	161	97L804492R
file55713	IDNUM	8	18	97L804492R
file55713	MEDICALRECORD	27	33	974804
file55801	DATE	2871	2881	19/10/2068	2068-10-19
file55801	DOCTOR	2905	2912	M. Crew
file55801	HOSPITAL	198	225	BROADMEADOWS HEALTH SERVICE
file55801	HOSPITAL	45	60	MALDON HOSPITAL
file55801	IDNUM	121	129	45H82445
file55801	IDNUM	130	138	45H82445
file55801	IDNUM	140	148	45H82445
file55801	IDNUM	140	150	45H824450A
file55801	PATIENT	152	175	Tatsch, GUADALUPE LYMAN
file55801	IDNUM	8	18	45H824450A
file55801	MEDICALRECORD	27	33	452824
file55898	CITY	200	211	CASTLEMAINE
file55898	DATE	3563	3572	23/9/2070	2070-09-23
file55898	DATE	6199	6209	26/10/2071	2071-10-26
file55898	DOCTOR	3595	3604	K Molands
file55898	DOCTOR	6264	6274	K Cacatian
file55898	DATE	6275	6282	23.5.71	2071-05-23
file55898	HOSPITAL	200	218	CASTLEMAINE HEALTH
file55898	HOSPITAL	46	65	YARRA RANGES HEALTH
file55898	IDNUM	127	135	30I27571
file55898	IDNUM	136	144	30I27571
file55898	IDNUM	146	154	30I27571
file55898	IDNUM	146	156	30I275718G
file55898	PATIENT	158	177	COPPERSMITH, Foster
file55898	IDNUM	8	18	30I275718G
file55898	MEDICALRECORD	27	34	3032757
file56011	CITY	186	194	COOKTOWN
file56011	DATE	1774	1784	23/10/2067	2067-10-23
file56011	DOCTOR	1807	1815	U. Axsom
file56011	DOCTOR	639	655	JOSEFINE Daghita
file56011	TIME	669	684	4pm on 20/10/67	2067-10-20T16:00
file56011	HOSPITAL	186	203	COOKTOWN HOSPITAL
file56011	HOSPITAL	46	64	FAIRFIELD HOSPITAL
file56011	IDNUM	126	134	72R57742
file56011	IDNUM	136	144	72R57742
file56011	IDNUM	136	146	72R577425C
file56011	PATIENT	148	163	Plaugher, Titus
file56011	IDNUM	8	18	72R577425C
file56011	MEDICALRECORD	27	34	7265774
file56053	CITY	203	212	NEWCASTLE
file56053	CITY	46	52	CAMDEN
file56053	DATE	2113	2123	24/10/2070	2070-10-24
file56053	DATE	2692	2702	27/10/2070	2070-10-27
file56053	DOCTOR	2148	2158	I. Llewlyn
file56053	HOSPITAL	189	221	CALVARY MATER NEWCASTLE HOSPITAL
file56053	HOSPITAL	46	61	CAMDEN HOSPITAL
file56053	IDNUM	123	131	39N59757
file56053	IDNUM	133	141	39N59757
file56053	IDNUM	133	143	39N597573L
file56053	PATIENT	145	166	FORTNEY, Caden MIQUEL
file56053	IDNUM	8	18	39N597573L
file56053	MEDICALRECORD	27	34	3955975
file56053	ZIP	2119	2123	2070
file56053	ZIP	2698	2702	2070
file56053	ZIP	375	379	2070
file56166	CITY	46	57	MEEKATHARRA
file56166	DATE	2004	2013	29/9/2070	2070-09-29
file56166	DATE	296	304	19 years	2066-09-19
file56166	DATE	4335	4344	11/1/2067	2067-11-11
file56166	DATE	4847	4854	11.7.70	2070-11-07
file56166	DOCTOR	2035	2042	S Kytle
file56166	DOCTOR	4832	4840	S Stoldt
file56166	HOSPITAL	186	203	MORANBAH HOSPITAL
file56166	HOSPITAL	46	66	MEEKATHARRA HOSPITAL
file56166	IDNUM	128	136	71W79939
file56166	IDNUM	138	146	71W79939
file56166	IDNUM	138	148	71W7993903
file56166	PATIENT	150	163	Knake, OLIVER
file56166	IDNUM	8	18	71W7993903
file56166	MEDICALRECORD	27	34	7187993
file56166	ZIP	4782	4786	2018
file56166	ZIP	4796	4800	2018
file56286	CITY	198	209	MARYBOROUGH
file56286	CITY	45	58	TENNANT CREEK
file56286	DATE	2874	2884	11/11/2070	2070-11-11
file56286	DATE	4586	4596	15/11/2067	2067-11-15
file56286	DOCTOR	2910	2919	Q. Dumeny
file56286	HOSPITAL	198	218	MARYBOROUGH HOSPITAL
file56286	HOSPITAL	45	67	TENNANT CREEK HOSPITAL
file56286	IDNUM	128	136	66W23055
file56286	IDNUM	137	145	66W23055
file56286	IDNUM	147	155	66W23055
file56286	IDNUM	147	157	66W230558O
file56286	PATIENT	159	175	Schofell, VIOLET
file56286	IDNUM	8	18	66W230558O
file56286	MEDICALRECORD	27	33	668230
file56286	ORGANIZATION	4655	4671	MED/SURGERY WARD
file56286	PATIENT	3059	3065	Fundus
file56362	CITY	47	56	GLADSTONE
file56362	DATE	4254	4264	19/11/2071	2071-11-19
file56362	DATE	6647	6657	24/10/2067	2067-10-24
file56362	DOCTOR	4288	4296	F Jurich
file56362	DOCTOR	735	747	F. Schettler
file56362	HOSPITAL	184	205	QUORN HEALTH SERVICES
file56362	HOSPITAL	47	65	GLADSTONE HOSPITAL
file56362	IDNUM	128	136	14T25160
file56362	IDNUM	138	146	14T25160
file56362	IDNUM	138	148	14T251606W
file56362	PATIENT	150	161	Vele, CRAIG
file56362	IDNUM	8	18	14T251606W
file56362	MEDICALRECORD	27	35	14725160
file56474	DATE	1806	1816	29/10/2067	2067-10-29
file56474	DATE	4232	4241	11/1/2070	2070-11-11
file56474	DOCTOR	1841	1852	P Lelacheur
file56474	DOCTOR	585	592	Theatre
file56474	DOCTOR	603	613	P. Ellison
file56474	TIME	617	636	1:35 pm on 26.10.68	68-10-26T13:35
file56474	HOSPITAL	205	226	MOUNT DRUITT HOSPITAL
file56474	HOSPITAL	46	77	WERRIS CREEK COMMUNITY HOSPITAL
file56474	IDNUM	139	147	56B45241
file56474	IDNUM	149	157	56B45241
file56474	IDNUM	149	159	56B452412T
file56474	PATIENT	161	182	GRYGIEL, Fausto Darin
file56474	IDNUM	8	18	56B452412T
file56474	MEDICALRECORD	27	34	5604524
file56634	CITY	891	897	WEIGHT
file56634	ZIP	899	904	1073g
file56634	DATE	176	184	4/2/2071	2071-04-04
file56634	DATE	5464	5472	7/2/2071	2071-07-02
file56634	DOCTOR	2259	2267	D. Rival
file56634	DOCTOR	5510	5525	MDT 05-Jan-2071
file56634	DOCTOR	733	739	D Osol
file56634	HOSPITAL	245	275	CULCAIRN MULTI PURPOSE SERVICE
file56634	HOSPITAL	47	65	TUMBY BAY HOSPITAL
file56634	IDNUM	186	194	14Y57347
file56634	IDNUM	196	204	14Y57347
file56634	IDNUM	196	206	14Y573471B
file56634	PATIENT	208	222	TITLER, Wilber
file56634	IDNUM	8	18	14Y573471B
file56634	MEDICALRECORD	27	35	14957347
file56780	DATE	2151	2159	7/1/2071	2071-01-07
file56780	DATE	4624	4632	8/1/2072	2072-01-08
file56780	DOCTOR	2183	2194	B. Ferandez
file56780	DOCTOR	566	570	Nyin
file56780	DOCTOR	603	615	B. Streicher
file56780	DOCTOR	5111	5117	B Sink
file56780	HOSPITAL	193	231	PETER MACCALLUM CANCER CENTRE HOSPITAL
file56780	HOSPITAL	45	72	JOYCE PALMER HEALTH SERVICE
file56780	IDNUM	133	141	09Z92463
file56780	IDNUM	143	151	09Z92463
file56780	IDNUM	143	153	09Z924639H
file56780	PATIENT	155	170	Faddis, SPENCER
file56780	IDNUM	8	18	09Z924639H
file56780	MEDICALRECORD	27	33	099924
file56780	TIME	5078	5091	36: 2105-2122	2066-02-36
file56780	ZIP	5059	5063	2018
file56780	ZIP	5073	5077	2018
file56947	DATE	2092	2100	7/1/2072	2072-01-07
file56947	DATE	5729	5737	8/1/2072	2072-01-08
file56947	DATE	6261	6268	19.2.72	2072-02-19
file56947	DOCTOR	2123	2133	L. Holdren
file56947	DOCTOR	287	291	DCIS
file56947	TIME	334	338	2054	2054
file56947	DOCTOR	671	673	Wm
file56947	DOCTOR	700	710	L. Zwanzig
file56947	DOCTOR	6243	6254	L Schmierer
file56947	HOSPITAL	219	234	WONDAI HOSPITAL
file56947	HOSPITAL	45	97	BEAUFORT & SKIPTON HEALTH SERVICES - BEAUFORT CAMPUS
file56947	IDNUM	159	167	41H22544
file56947	IDNUM	169	177	41H22544
file56947	IDNUM	169	179	41H225445E
file56947	PATIENT	181	196	Angotti, Buster
file56947	IDNUM	8	18	41H225445E
file56947	MEDICALRECORD	27	33	413225
file56947	ZIP	6193	6197	2018
file56947	ZIP	6207	6211	2018
file57116	DATE	4425	4434	24/2/2072	2072-02-24
file57116	DATE	8332	8341	23/2/2071	2071-02-23
file57116	DATE	8951	8958	24.1.68	2068-01-24
file57116	DOCTOR	4457	4462	Z Har
file57116	DOCTOR	8417	8432	HANS Abe Kathan
file57116	DOCTOR	8434	8443	INNISFAIL
file57116	DOCTOR	8936	8943	Z Petti
file57116	HOSPITAL	195	218	SCOTT MEMORIAL HOSPITAL
file57116	HOSPITAL	45	65	GNOWANGERUP HOSPITAL
file57116	IDNUM	126	134	99D24650
file57116	IDNUM	135	143	99D24650
file57116	IDNUM	145	153	99D24650
file57116	PATIENT	157	172	PARANADA, CESAR
file57116	IDNUM	8	18	99D2465034
file57116	MEDICALRECORD	27	33	991246
file57116	ZIP	8885	8889	2018
file57116	ZIP	8899	8903	2018
file57237	DATE	2004	2013	19/2/2069	2069-02-19
file57237	DATE	4815	4824	22/1/2072	2072-01-22
file57237	DOCTOR	2039	2048	X Flinner
file57237	HOSPITAL	212	249	CLERMONT MULTI-PURPOSE HEALTH SERVICE
file57237	HOSPITAL	45	83	MONASH MEDICAL CENTRE - CLAYTON CAMPUS
file57237	IDNUM	144	152	94E68776
file57237	IDNUM	153	161	94E68776
file57237	IDNUM	163	171	94E68776
file57237	IDNUM	163	173	94E687761S
file57237	PATIENT	175	189	SYLVEST, Devon
file57237	IDNUM	8	18	94E687761S
file57237	MEDICALRECORD	27	33	941687
file57346	DATE	2918	2928	10/12/2067	2067-12-10
file57346	DATE	5351	5361	17.12.2070	2070-12-17
file57346	DOCTOR	2951	2966	H Aschenbrenner
file57346	HOSPITAL	202	219	MITCHELL HOSPITAL
file57346	HOSPITAL	46	70	SOUTH GIPPSLAND HOSPITAL
file57346	IDNUM	132	140	98I56937
file57346	IDNUM	141	149	98I56937
file57346	IDNUM	151	159	98I56937
file57346	IDNUM	151	161	98I5693786
file57346	PATIENT	163	179	Galetti, Elliott
file57346	IDNUM	8	18	98I5693786
file57346	MEDICALRECORD	27	34	9835693
file57346	PATIENT	3039	3045	Fundus
file57481	CITY	45	53	CESSNOCK
file57481	DATE	2141	2151	19/12/2067	2067-12-19
file57481	DATE	5370	5379	22/1/2071	2071-01-22
file57481	DOCTOR	2177	2186	W Rampley
file57481	HOSPITAL	199	220	ONSLOW HEALTH SERVICE
file57481	HOSPITAL	45	71	CESSNOCK DISTRICT HOSPITAL
file57481	IDNUM	132	140	83J90953
file57481	IDNUM	141	149	83J90953
file57481	IDNUM	151	159	83J90953
file57481	IDNUM	151	161	83J909536X
file57481	PATIENT	163	176	ASPEN, Kelvin
file57481	IDNUM	8	18	83J909536X
file57481	MEDICALRECORD	27	33	833909
file57481	PATIENT	2330	2336	Fundus
file57619	CITY	202	213	LEIGH CREEK
file57619	CITY	45	50	Perth
file57619	DOCTOR	4576	4584	G. Rogas
file57619	HOSPITAL	202	229	LEIGH CREEK HEALTH SERVICES
file57619	HOSPITAL	45	71	Perth Childrens Hospital
file57619	IDNUM	132	140	25S10134
file57619	IDNUM	141	149	25S10134
file57619	IDNUM	151	159	25S10134
file57619	IDNUM	151	161	25S101343U
file57619	IDNUM	8	18	25S101343U
file57619	MEDICALRECORD	27	33	257101
file57670	CITY	233	240	MARGATE
file57670	CITY	47	56	BALRANALD
file57670	DATE	2934	2941	14/4/71	2071-04-14
file57670	DATE	710	719	13/4/2070	2070-04-13
file57670	DOCTOR	2973	2983	U Verhulst
file57670	DOCTOR	4712	4720	U Kallen
file57670	DOCTOR	4644	4652	Overseas
file57670	HOSPITAL	47	78	BALRANALD MULTI PURPOSE SERVICE
file57670	IDNUM	403	411	73O23240
file57670	IDNUM	4311	4319	73O23240
file57670	IDNUM	8	18	73O232401C
file57670	MEDICALRECORD	27	35	73523240
file57759	DATE	1577	1584	21/6/67	2067-06-21
file57759	DOCTOR	1587	1599	S Leferation
file57759	HOSPITAL	45	60	WONDAI HOSPITAL
file57759	IDNUM	8	18	78P672669I
file57759	MEDICALRECORD	27	33	786672
file57869	DATE	2662	2669	27/5/71	2071-05-27
file57869	DOCTOR	2701	2713	G Mollenkopf
file57869	DOCTOR	2731	2739	G Weiker
file57869	HOSPITAL	47	72	MACLEAN DISTRICT HOSPITAL
file57869	IDNUM	8	18	26L693727R
file57869	MEDICALRECORD	27	35	26469372
file57948	DATE	2059	2066	30/6/70	2070-06-30
file57948	DOCTOR	2098	2107	Q Degrand
file57948	DOCTOR	528	534	Tommie
file57948	HOSPITAL	45	72	HENTY MULTI PURPOSE SERVICE
file57948	IDNUM	283	291	68U99543
file57948	IDNUM	5594	5602	68U99543
file57948	IDNUM	5607	5615	68U99543
file57948	IDNUM	8	18	68U995434N
file57948	MEDICALRECORD	27	33	687995
file57948	PATIENT	4135	4142	Jejunum
file57948	ZIP	259	263	2068
file58042	DOCTOR	1934	1943	O Diiorio
file58042	DOCTOR	1967	1974	O Lurie
file58042	HOSPITAL	46	64	KATANNING HOSPITAL
file58042	IDNUM	8	18	53V346792T
file58042	MEDICALRECORD	27	34	5383467
file58138	DOCTOR	1628	1634	D Maso
file58138	HOSPITAL	46	75	CALVARY HEALTH CARE BETHLEHEM
file58138	IDNUM	8	18	11R466750C
file58138	MEDICALRECORD	27	34	1164667
file58170	DATE	1988	1995	17/7/71	2071-07-17
file58170	DOCTOR	2025	2036	N Goldstock
file58170	HOSPITAL	46	73	JOYCE PALMER HEALTH SERVICE
file58170	IDNUM	8	18	53A668567Y
file58170	MEDICALRECORD	27	34	5306685
file58251	DATE	4472	4480	21/10/68	2068-10-21
file58251	DOCTOR	353	362	B Homrich
file58251	DOCTOR	4513	4523	B Abrahams
file58251	DOCTOR	4537	4545	B Shimko
file58251	HOSPITAL	46	83	GLOUCESTER SOLDIERS MEMORIAL HOSPITAL
file58251	IDNUM	8	18	00W689615H
file58251	MEDICALRECORD	27	34	0086896
file58399	DATE	2737	2744	5/11/71	2071-11-05
file58399	DOCTOR	2776	2784	L Alsdon
file58399	HOSPITAL	47	69	IVANHOE HEALTH SERVICE
file58399	IDNUM	2931	2939	42F98132
file58399	IDNUM	4253	4261	42F98132
file58399	IDNUM	458	466	42F98132
file58399	IDNUM	8	18	42F981321D
file58399	MEDICALRECORD	27	35	42298132
file58549	DATE	2464	2471	5/10/71	2071-10-05
file58549	DOCTOR	2502	2509	A Susla
file58549	HOSPITAL	46	84	CLONCURRY MULTI-PURPOSE HEALTH SERVICE
file58549	IDNUM	8	18	00B901480M
file58549	MEDICALRECORD	27	34	0009014
file58582	DOCTOR	1713	1721	X Hussar
file58582	HOSPITAL	46	86	STRATHALBYN AND DISTRICT HEALTH SERVICES
file58582	IDNUM	1804	1812	95C34264
file58582	IDNUM	8	18	95C342648S
file58582	MEDICALRECORD	27	34	9503426
file58624	DATE	2692	2700	22/11/71	2071-11-22
file58624	DOCTOR	2731	2738	M Bandy
file58624	HOSPITAL	47	61	WEIPA HOSPITAL
file58624	IDNUM	8	18	43Y473706B
file58624	MEDICALRECORD	27	35	43947370
file58648	CITY	46	54	COOKTOWN
file58648	DATE	323	330	16/5/61	2061-05-16
file58648	DATE	981	988	23/8/67	2067-08-23
file58648	DOCTOR	1018	1027	W Vanhese
file58648	HOSPITAL	46	63	COOKTOWN HOSPITAL
file58648	IDNUM	8	18	85H674512X
file58648	MEDICALRECORD	27	34	8526745
file58760	DATE	5227	5234	13/9/68	2068-09-13
file58760	DOCTOR	2109	2118	U Pizzino
file58760	DOCTOR	5253	5261	U Modine
file58760	DOCTOR	5612	5624	U Hansbrough
file58760	HOSPITAL	46	63	BEVERLEY HOSPITAL
file58760	IDNUM	8	18	70I015770D
file58760	MEDICALRECORD	27	34	7030157
file58792	DOCTOR	1365	1372	E Staib
file58792	HOSPITAL	45	74	CONDOBOLIN RETIREMENT VILLAGE
file58792	IDNUM	2217	2225	12R31758
file58792	IDNUM	8	18	12R317587A
file58792	MEDICALRECORD	27	33	126317
file58852	DOCTOR	154	162	S Radway
file58852	DATE	164	173	25.9.2070	2070-09-25
file58852	DOCTOR	1707	1717	S Otanicar
file58852	DOCTOR	3943	3953	S Schenkel
file58852	DATE	3955	3964	25.9.2070	2070-09-25
file58852	HOSPITAL	46	64	TUMBY BAY HOSPITAL
file58852	IDNUM	8	18	70N338545I
file58852	MEDICALRECORD	27	34	7053385
file58950	DATE	1768	1775	9/11/71	2071-11-09
file58950	DOCTOR	1807	1813	Q Faul
file58950	DOCTOR	1821	1831	Q Zeringue
file58950	HOSPITAL	46	71	MACLEAN DISTRICT HOSPITAL
file58950	IDNUM	8	18	64O888803O
file58950	MEDICALRECORD	27	34	6458888
file58984	CITY	46	56	DENILIQUIN
file58984	DATE	1735	1742	11/1/71	2071-11-01
file58984	DOCTOR	1774	1784	R Dekenipp
file58984	HOSPITAL	46	65	DENILIQUIN HOSPITAL
file58984	IDNUM	8	18	69S650410N
file58984	MEDICALRECORD	27	34	6976504
file59027	DATE	3514	3522	26/10/70	2070-10-26
file59027	DOCTOR	1694	1701	P Greto
file59027	DOCTOR	299	310	P Maccheyne
file59027	DOCTOR	3554	3560	P Poux
file59027	HOSPITAL	45	83	BOYUP BROOK SOLDIERS MEMORIAL HOSPITAL
file59027	IDNUM	8	18	54T001678T
file59027	MEDICALRECORD	27	33	547001
file59066	DATE	1170	1177	18/1/68	2068-01-18
file59066	DOCTOR	1209	1216	D Ortea
file59066	DOCTOR	1234	1242	D Hancin
file59066	DOCTOR	807	813	D Lumb
file59066	HOSPITAL	46	63	THEODORE HOSPITAL
file59066	IDNUM	8	18	12P121736C
file59066	MEDICALRECORD	27	34	1251217
file59132	DATE	1262	1269	30/1/71	2071-01-30
file59132	DOCTOR	1301	1313	N Bonnifield
file59132	DOCTOR	2799	2809	N Mcgeever
file59132	DATE	2813	2820	19/2/68	2068-02-19
file59132	DOCTOR	2873	2879	N Goar
file59132	HOSPITAL	46	67	MOUNT MORGAN HOSPITAL
file59132	IDNUM	8	18	54Y323443Y
file59132	MEDICALRECORD	27	34	5493234
file59178	DEPARTMENT	3012	3025	MACQUARIEWARD
file59178	HOSPITAL	3012	3025	MACQUARIEWARD
file59178	DOCTOR	1766	1775	L Huisman
file59178	HOSPITAL	47	73	CRAIGIEBURN HEALTH SERVICE
file59178	IDNUM	8	18	49Z7647011
file59178	MEDICALRECORD	27	35	49976470
file59212	CITY	47	53	LEETON
file59212	DOCTOR	1813	1824	Z Wahlquist
file59212	DOCTOR	1848	1857	Z Dicarlo
file59212	HOSPITAL	47	71	LEETON DISTRICT HOSPITAL
file59212	IDNUM	8	18	97V8847695
file59212	MEDICALRECORD	27	35	97888476
file59254	CITY	226	232	ARARAT
file59254	DATE	1507	1516	25/5/2071	2071-05-25
file59254	DATE	2173	2182	27/6/2071	2071-06-27
file59254	DOCTOR	1538	1544	T Skog
file59254	HOSPITAL	194	232	EAST GRAMPIANS HEALTH SERVICE - ARARAT
file59254	HOSPITAL	46	62	MODBURY HOSPITAL
file59254	IDNUM	124	132	76I41677
file59254	IDNUM	134	142	76I41677
file59254	IDNUM	134	144	76I416775H
file59254	PATIENT	160	171	KELVIN-Emil
file59254	IDNUM	8	18	76I416775H
file59254	MEDICALRECORD	27	34	7634167
file59391	DATE	2185	2193	8/4/2068	2068-04-08
file59391	DATE	4026	4035	11/4/2070	2070-11-04
file59391	DATE	4749	4757	7.6.2069	2069-06-07
file59391	DOCTOR	2216	2225	H. Denley
file59391	DOCTOR	4137	4150	WELDON Maheux
file59391	DOCTOR	4734	4742	H Grumer
file59391	HOSPITAL	224	251	JOYCE PALMER HEALTH SERVICE
file59391	HOSPITAL	46	69	CARITAS CHRISTI HOSPICE
file59391	IDNUM	159	167	24E43773
file59391	IDNUM	168	176	24E43773
file59391	IDNUM	178	186	24E43773
file59391	PATIENT	190	201	KROMM, Sang
file59391	IDNUM	8	18	24E437734P
file59391	MEDICALRECORD	27	34	2414377
file59391	TIME	4703	4716	36: 2105-2122	2066-02-36
file59391	ZIP	4684	4688	2018
file59391	ZIP	4698	4702	2018
file59518	CITY	46	54	BATHURST
file59518	DATE	1935	1944	25/4/2070	2070-04-25
file59518	DATE	5430	5439	24/4/2070	2070-04-24
file59518	DOCTOR	1969	1980	R. Petrilli
file59518	HOSPITAL	199	220	MOUNT DRUITT HOSPITAL
file59518	HOSPITAL	46	68	BATHURST BASE HOSPITAL
file59518	IDNUM	130	138	66N73954
file59518	IDNUM	139	147	66N73954
file59518	IDNUM	149	157	66N73954
file59518	IDNUM	149	159	66N7395404
file59518	PATIENT	161	176	Wescovich, Adam
file59518	IDNUM	8	18	66N7395404
file59518	MEDICALRECORD	27	34	6657395
file59603	CITY	204	211	KYABRAM
file59603	DATE	3601	3612	19-Nov-2069	2069-09-19
file59603	DOCTOR	2846	2854	P Livasy
file59603	DOCTOR	606	620	WAGIN HOSPITAL
file59603	HOSPITAL	204	238	KYABRAM & DISTRICT HEALTH SERVICES
file59603	HOSPITAL	46	67	MOUNT MORGAN HOSPITAL
file59603	IDNUM	129	137	50O17970
file59603	IDNUM	138	146	50O17970
file59603	IDNUM	148	156	50O17970
file59603	IDNUM	148	158	50O179708S
file59603	PATIENT	160	181	Merchen, GIUSEPPE RON
file59603	IDNUM	8	18	50O179708S
file59603	MEDICALRECORD	27	34	5051797
file59726	CITY	45	50	YOUNG
file59726	DATE	2299	2307	7/6/2069	2069-06-07
file59726	DATE	4714	4723	24/6/2070	2070-06-24
file59726	DATE	4809	4816	9294715	2068-05-09
file59726	DOCTOR	2333	2346	Z. Hommerding
file59726	HOSPITAL	207	228	QUORN HEALTH SERVICES
file59726	HOSPITAL	45	68	YOUNG DISTRICT HOSPITAL
file59726	IDNUM	129	137	92X47151
file59726	IDNUM	138	146	92X47151
file59726	IDNUM	148	156	92X47151
file59726	IDNUM	148	158	92X4715155
file59726	PATIENT	160	175	Bitzer, EUGENIO
file59726	IDNUM	8	18	92X4715155
file59726	MEDICALRECORD	27	33	929471
file59791	CITY	45	53	PAKENHAM
file59791	DATE	3560	3568	6/9/2069	2069-09-06
file59791	DATE	3747	3756	16/6/2069	2069-06-16
file59791	DATE	6450	6459	13/7/2068	2068-07-13
file59791	DOCTOR	3591	3600	X. Aamodt
file59791	HOSPITAL	193	212	GLOUCESTER SOLDIERS
file59791	HOSPITAL	45	67	PAKENHAM HEALTH CENTRE
file59791	IDNUM	128	136	97Y82287
file59791	IDNUM	137	145	97Y82287
file59791	IDNUM	147	155	97Y82287
file59791	IDNUM	147	157	97Y8228737
file59791	PATIENT	159	170	COBO, DENNY
file59791	IDNUM	8	18	97Y8228737
file59791	MEDICALRECORD	27	33	979822
file59884	DATE	3105	3113	7/7/2070	2070-07-07
file59884	DATE	4767	4776	15/7/2068	2068-07-15
file59884	DOCTOR	3136	3149	H. Wennersten
file59884	HOSPITAL	213	242	CALVARY HEALTH CARE BETHLEHEM
file59884	HOSPITAL	45	81	BATLOW/ADELONG MULTI PURPOSE SERVICE
file59884	IDNUM	142	150	29H01358
file59884	IDNUM	151	159	29H01358
file59884	IDNUM	161	169	29H01358
file59884	IDNUM	161	171	29H0135806
file59884	PATIENT	173	190	BIEGEL, GUADALUPE
file59884	IDNUM	8	18	29H0135806
file59884	MEDICALRECORD	27	33	292013
file59884	PATIENT	371	393	R pelvic sentinel ndoe
file59981	DATE	2317	2326	11/6/2070	2070-06-11
file59981	DATE	3984	3991	16.7.71	2071-07-16
file59981	DATE	4810	4817	15.7.68	2068-07-15
file59981	DOCTOR	2351	2360	F Fjeseth
file59981	HOSPITAL	206	258	BEAUFORT & SKIPTON HEALTH SERVICES - BEAUFORT CAMPUS
file59981	HOSPITAL	45	72	HENTY MULTI PURPOSE SERVICE
file59981	IDNUM	133	141	24I56484
file59981	IDNUM	142	150	24I56484
file59981	IDNUM	152	160	24I56484
file59981	IDNUM	152	162	24I5648488
file59981	PATIENT	164	183	Armintrout, DARRELL
file59981	IDNUM	8	18	24I5648488
file59981	MEDICALRECORD	27	33	243564
file60101	CITY	47	54	KYABRAM
file60101	DATE	2836	2845	4/10/2069	2069-10-04
file60101	DATE	5118	5127	17/2/2070	2070-02-17
file60101	DOCTOR	2871	2879	P. Sovak
file60101	HOSPITAL	201	221	OBERON MULTI PURPOSE
file60101	HOSPITAL	47	81	KYABRAM & DISTRICT HEALTH SERVICES
file60101	IDNUM	143	151	56Q76655
file60101	IDNUM	153	161	56Q76655
file60101	IDNUM	153	163	56Q766554T
file60101	PATIENT	165	178	MCFADDEN, BUD
file60101	IDNUM	8	18	56Q766554T
file60101	MEDICALRECORD	27	35	56676655
file60224	DATE	3108	3116	8/5/2070	2070-08-05
file60224	DATE	5809	5817	6/5/2070	2070-06-05
file60224	DOCTOR	3142	3150	N Fallon
file60224	HOSPITAL	213	237	PEAK HILL HEALTH SERVICE
file60224	HOSPITAL	45	84	FINLEY HOSPITAL & COMMUNITY HEALTH CARE
file60224	IDNUM	145	153	51R20681
file60224	IDNUM	154	162	51R20681
file60224	IDNUM	164	172	51R20681
file60224	IDNUM	164	174	51R2068129
file60224	PATIENT	176	190	Coslow, ISRAEL
file60224	IDNUM	8	18	51R2068129
file60224	MEDICALRECORD	27	33	516206
file60338	DATE	3223	3232	16/9/2069	2069-09-16
file60338	DATE	4874	4883	18/8/2069	2069-08-18
file60338	DOCTOR	3256	3264	B. Norbo
file60338	HOSPITAL	201	219	TUMBY BAY HOSPITAL
file60338	HOSPITAL	45	80	BARWON HEALTH - ASHLEY MANOR CAMPUS
file60338	IDNUM	141	149	09N22787
file60338	IDNUM	151	159	09N22787
file60338	IDNUM	151	161	09N2278703
file60338	PATIENT	163	178	Rehart, Garrett
file60338	IDNUM	8	18	09N2278703
file60338	MEDICALRECORD	27	33	095227
file60438	CITY	196	203	KYABRAM
file60438	CITY	45	55	DENILIQUIN
file60438	DATE	2747	2756	20/9/2069	2069-09-20
file60438	DATE	3146	3155	16/5/2070	2070-05-16
file60438	DATE	3261	3270	19/9/2068	2068-09-19
file60438	DATE	6139	6146	24.9.69	2069-09-24
file60438	DOCTOR	3294	3304	L Mendivel
file60438	HOSPITAL	196	230	KYABRAM & DISTRICT HEALTH SERVICES
file60438	HOSPITAL	45	64	DENILIQUIN HOSPITAL
file60438	IDNUM	125	133	41W42968
file60438	IDNUM	134	142	41W42968
file60438	IDNUM	144	152	41W42968
file60438	PATIENT	156	173	Olewinski, BOOKER
file60438	IDNUM	8	18	41W429687E
file60438	MEDICALRECORD	27	33	418429
file60537	CITY	45	51	CAMDEN
file60537	DATE	1833	1841	1/6/2069	2069-06-01
file60537	DOCTOR	1867	1877	A. Roberto
file60537	HOSPITAL	184	201	ANGASTON HOSPITAL
file60537	HOSPITAL	45	60	CAMDEN HOSPITAL
file60537	IDNUM	121	129	08S55074
file60537	IDNUM	130	138	08S55074
file60537	IDNUM	140	148	08S55074
file60537	IDNUM	140	150	08S5507455
file60537	PATIENT	152	161	ALI, Dave
file60537	IDNUM	8	18	08S5507455
file60537	MEDICALRECORD	27	33	087550
file60590	CITY	45	53	SMITHTON
file60590	DATE	2293	2302	30/8/2069	2069-08-30
file60590	DATE	3579	3588	7/10/2070	2070-10-07
file60590	DOCTOR	2326	2334	K. Wantz
file60590	HOSPITAL	200	219	BRIDGETOWN HOSPITAL
file60590	HOSPITAL	45	71	SMITHTON DISTRICT HOSPITAL
file60590	IDNUM	132	140	30B74145
file60590	IDNUM	141	149	30B74145
file60590	IDNUM	151	159	30B74145
file60590	IDNUM	151	161	30B741452J
file60590	PATIENT	163	177	MODINE, Jordon
file60590	IDNUM	8	18	30B741452J
file60590	MEDICALRECORD	27	33	300741
file60708	CITY	188	197	BALRANALD
file60708	CITY	45	54	GLADSTONE
file60708	DATE	3009	3018	16/6/2070	2070-06-16
file60708	DATE	4969	4978	15/7/2068	2068-07-15
file60708	DATE	5851	5858	22.7.68	2068-07-22
file60708	HOSPITAL	188	219	BALRANALD MULTI PURPOSE SERVICE
file60708	HOSPITAL	45	63	GLADSTONE HOSPITAL
file60708	IDNUM	124	132	35C19271
file60708	IDNUM	133	141	35C19271
file60708	IDNUM	143	151	35C19271
file60708	IDNUM	143	153	35C192710P
file60708	PATIENT	155	161	Arturo
file60708	IDNUM	8	18	35C192710P
file60708	MEDICALRECORD	27	33	351192
file60708	ORGANIZATION	5060	5072	Allstate MED
file60708	DEPARTMENT	5069	5085	MED/SURGERY WARD
file60773	DATE	2290	2300	17/10/2070	2070-10-17
file60773	DATE	4137	4146	16.7.2070	2070-07-16
file60773	DEPARTMENT	3510	3525	Seals Pathology
file60773	IDNUM	3555	3565	83921-37SV
file60773	DOCTOR	2323	2330	W. Peth
file60773	HOSPITAL	196	220	HAWKER MEMORIAL HOSPITAL
file60773	HOSPITAL	45	59	LOGAN HOSPITAL
file60773	IDNUM	120	128	83Y21377
file60773	IDNUM	129	137	83Y21377
file60773	IDNUM	139	147	83Y21377
file60773	IDNUM	139	149	83Y213778Y
file60773	PATIENT	151	154	VAL
file60773	IDNUM	8	18	83Y213778Y
file60773	MEDICALRECORD	27	33	839213
file60836	DATE	2840	2849	15/9/2069	2069-09-15
file60836	DATE	4376	4386	21/10/2069	2069-10-21
file60836	DOCTOR	2874	2882	G Lieder
file60836	DOCTOR	730	731	F
file60836	DOCTOR	814	815	F
file60836	DOCTOR	826	835	Robertson
file60836	DOCTOR	881	890	Robertson
file60836	DOCTOR	923	932	G. Mcgann
file60836	HOSPITAL	194	216	BARADINE MULTI PURPOSE
file60836	HOSPITAL	45	58	YORK HOSPITAL
file60836	IDNUM	119	127	25H41558
file60836	IDNUM	128	136	25H41558
file60836	IDNUM	138	146	25H41558
file60836	IDNUM	138	148	25H4155857
file60836	IDNUM	8	18	25H4155857
file60836	MEDICALRECORD	27	33	252415
file60949	DATE	2834	2843	19/6/2068	2068-06-19
file60949	DATE	6486	6495	27.9.2068	2068-09-27
file60949	DOCTOR	2868	2877	U Mosconi
file60949	HOSPITAL	191	209	FAIRFIELD HOSPITAL
file60949	HOSPITAL	45	63	THE TWEED HOSPITAL
file60949	IDNUM	124	132	83D43564
file60949	IDNUM	133	141	83D43564
file60949	IDNUM	143	151	83D43564
file60949	IDNUM	143	153	83D435643D
file60949	PATIENT	155	168	Cueto, Cecila
file60949	IDNUM	8	18	83D435643D
file60949	MEDICALRECORD	27	33	831435
file61065	CITY	186	191	CLARE
file61065	DATE	3082	3092	28/10/2069	2069-10-28
file61065	DATE	6187	6196	11.4.2068	2068-11-04
file61065	DOCTOR	3116	3129	S Heathershaw
file61065	HOSPITAL	186	200	CLARE HOSPITAL
file61065	HOSPITAL	45	61	BELMONT HOSPITAL
file61065	IDNUM	122	130	78E98680
file61065	IDNUM	131	139	78E98680
file61065	IDNUM	141	149	78E98680
file61065	IDNUM	141	151	78E986801J
file61065	PATIENT	153	163	Rogol, Bob
file61065	IDNUM	8	18	78E986801J
file61065	MEDICALRECORD	27	33	781986
file61218	DOCTOR	2829	2840	H. Warholic
file61218	HOSPITAL	200	215	WONDAI HOSPITAL
file61218	HOSPITAL	45	60	WARREN HOSPITAL
file61218	IDNUM	121	129	26A90795
file61218	IDNUM	130	138	26A90795
file61218	IDNUM	140	148	26A90795
file61218	PATIENT	152	177	ASTUDILLO, BRODERICK Roxy
file61218	IDNUM	8	18	26A907959R
file61218	MEDICALRECORD	27	33	260907
file61218	ZIP	2929	2933	2020
file61347	CITY	65	71	SYDNEY
file61347	DATE	4171	4180	13/7/2070	2070-07-13
file61347	DOCTOR	399	405	Herman
file61347	DOCTOR	4203	4214	R. Kreisman
file61347	HOSPITAL	212	253	CENTRAL HIGHLANDS RURAL HEALTH - CRESWICK
file61347	HOSPITAL	45	75	CALVARY HEALTH CARE SYDNEY LTD
file61347	IDNUM	136	144	68J20866
file61347	IDNUM	145	153	68J20866
file61347	IDNUM	155	163	68J20866
file61347	IDNUM	155	165	68J208666O
file61347	PATIENT	167	176	Shacklett
file61347	IDNUM	8	18	68J208666O
file61347	MEDICALRECORD	27	33	683208
file61436	CITY	45	56	KURRI KURRI
file61436	DATE	2188	2198	28/11/2068	2068-11-28
file61436	DATE	6279	6289	28/10/2069	2069-10-28
file61436	DOCTOR	2224	2234	O. Mariner
file61436	HOSPITAL	197	214	BEVERLEY HOSPITAL
file61436	HOSPITAL	45	74	KURRI KURRI DISTRICT HOSPITAL
file61436	IDNUM	135	143	53K64992
file61436	IDNUM	145	153	53K64992
file61436	IDNUM	145	155	53K649924U
file61436	PATIENT	157	174	PADFIELD, Herbert
file61436	IDNUM	8	18	53K649924U
file61436	MEDICALRECORD	27	33	534649
file61638	CITY	46	54	GOULBURN
file61638	CITY	71	81	SHEPPARTON
file61638	DATE	1475	1484	11/3/2070	2070-11-03
file61638	DATE	1949	1959	29/11/2068	2068-11-29
file61638	DATE	3772	3779	10.4.72	2072-10-04
file61638	DATE	640	653	28.08.69 12pm	2069-08-28
file61638	DOCTOR	1984	1993	P Huesman
file61638	HOSPITAL	218	236	THE TWEED HOSPITAL
file61638	HOSPITAL	301	323	GOVE DISTRICT HOSPITAL
file61638	HOSPITAL	46	88	GOULBURN VALLEY HEALTH - SHEPPARTON CAMPUS
file61638	IDNUM	151	159	67O42153
file61638	IDNUM	161	169	67O42153
file61638	IDNUM	161	171	67O421530T
file61638	PATIENT	173	194	Ponti, ISAIAS Darleen
file61638	IDNUM	8	18	67O421530T
file61638	MEDICALRECORD	27	34	6754215
file61770	DATE	4310	4319	10/6/2069	2069-10-06
file61770	DATE	7102	7111	13/9/2068	2068-09-13
file61770	DOCTOR	4343	4352	N. Wassel
file61770	HOSPITAL	216	243	BANKSTOWN-LIDCOMBE HOSPITAL
file61770	HOSPITAL	46	82	ST VINCENT'S HOSPITAL (DARLINGHURST)
file61770	IDNUM	144	152	52P96179
file61770	IDNUM	153	161	52P96179
file61770	IDNUM	163	171	52P96179
file61770	IDNUM	163	173	52P961798Z
file61770	PATIENT	175	193	Di GEMMA, RAYMUNDO
file61770	IDNUM	5874	5882	52P96179
file61770	IDNUM	8	18	52P961798Z
file61770	MEDICALRECORD	27	34	5259617
file61770	PATIENT	4450	4456	Fundus
file61806	CITY	193	203	CANOWINDRA
file61806	DOCTOR	1556	1567	B. Riccelli
file61806	HOSPITAL	193	230	CANOWINDRA SOLDIERS MEMORIAL HOSPITAL
file61806	HOSPITAL	45	68	FLINDERS MEDICAL CENTRE
file61806	IDNUM	129	137	00L99285
file61806	IDNUM	139	147	00L99285
file61806	IDNUM	139	149	00L992857I
file61806	PATIENT	151	170	MCLAUGHLIN, Toccara
file61806	IDNUM	8	18	00L992857I
file61933	CITY	213	219	LOXTON
file61933	DATE	2762	2772	14/10/2068	2068-10-14
file61933	DATE	5193	5202	15/9/2070	2070-09-15
file61933	DOCTOR	2796	2805	M. Arendt
file61933	HOSPITAL	213	228	LOXTON HOSPITAL
file61933	HOSPITAL	45	83	CLONCURRY MULTI-PURPOSE HEALTH SERVICE
file61933	IDNUM	144	152	42U18456
file61933	IDNUM	153	161	42U18456
file61933	IDNUM	163	171	42U18456
file61933	IDNUM	163	173	42U1845631
file61933	PATIENT	175	190	Malbaurn, ROGER
file61933	IDNUM	8	18	42U1845631
file61933	MEDICALRECORD	27	33	427184
file61933	ORGANIZATION	5287	5290	E17
file61933	STREET	392	408	Pouch of Douglas
file62019	CITY	189	197	SMITHTON
file62019	CITY	45	54	REDCLIFFE
file62019	DATE	3553	3563	16/10/2068	2068-10-16
file62019	DOCTOR	3589	3597	J. Kitch
file62019	HOSPITAL	189	215	SMITHTON DISTRICT HOSPITAL
file62019	HOSPITAL	45	63	REDCLIFFE HOSPITAL
file62019	IDNUM	124	132	37V63582
file62019	IDNUM	133	141	37V63582
file62019	IDNUM	143	151	37V63582
file62019	IDNUM	143	153	37V6358214
file62019	IDNUM	8	18	37V6358214
file62019	MEDICALRECORD	27	33	378635
file62077	DATE	2517	2527	21/10/2068	2068-10-21
file62077	DATE	4235	4245	26/11/2068	2068-11-26
file62077	DATE	4398	4408	29/11/2069	2069-11-29
file62077	DOCTOR	2553	2562	Y. Erlich
file62077	HOSPITAL	224	242	KATANNING HOSPITAL
file62077	HOSPITAL	45	93	ROYAL REHABILITATION HOSPITAL - COORABEL/MOORONG
file62077	IDNUM	154	162	95R65588
file62077	IDNUM	163	171	95R65588
file62077	IDNUM	173	181	95R65588
file62077	IDNUM	173	183	95R6558897
file62077	PATIENT	185	201	Goodspeed, Dylan
file62077	IDNUM	8	18	95R6558897
file62077	MEDICALRECORD	27	33	956655
file62170	DATE	2410	2420	21/11/2070	2070-11-21
file62170	DATE	4168	4178	24/10/2068	2068-10-24
file62170	DOCTOR	2445	2453	I. Hirte
file62170	HOSPITAL	201	214	RYDE HOSPITAL
file62170	HOSPITAL	45	62	NARROGIN HOSPITAL
file62170	IDNUM	123	131	37A85769
file62170	IDNUM	132	140	37A85769
file62170	IDNUM	142	150	37A85769
file62170	IDNUM	142	152	37A8576965
file62170	PATIENT	154	178	GAGLIO, AIDAN Cristopher
file62170	IDNUM	8	18	37A8576965
file62170	MEDICALRECORD	27	33	370857
file62290	DATE	3008	3018	18/10/2068	2068-10-18
file62290	DATE	5414	5424	23/11/2069	2069-11-23
file62290	DATE	5449	5459	23/10/2068	2068-10-23
file62290	DATE	5636	5646	23/10/2068	2068-10-23
file62290	DOCTOR	3044	3053	W. Chruch
file62290	HOSPITAL	187	223	PINNAROO SOLDIERS' MEMORIAL HOSPITAL
file62290	HOSPITAL	45	59	TULLY HOSPITAL
file62290	IDNUM	120	128	85W97875
file62290	IDNUM	129	137	85W97875
file62290	IDNUM	139	147	85W97875
file62290	PATIENT	151	164	WYMAN, Dustin
file62290	IDNUM	8	18	85W978754Y
file62290	MEDICALRECORD	27	33	858978
file62373	DATE	3621	3630	20/2/2071	2071-02-20
file62373	DATE	5851	5860	22/2/2071	2071-02-22
file62373	DATE	6080	6087	26.2.70	2070-02-26
file62373	DOCTOR	3654	3663	Y Cansino
file62373	HOSPITAL	218	236	CARNARVON HOSPITAL
file62373	HOSPITAL	45	81	ST VINCENT'S HOSPITAL (DARLINGHURST)
file62373	IDNUM	142	150	94P43220
file62373	IDNUM	151	159	94P43220
file62373	IDNUM	161	169	94P43220
file62373	IDNUM	161	171	94P4322084
file62373	PATIENT	173	195	O&apos;CONNOR, HEATHER
file62373	IDNUM	8	18	94P4322084
file62373	MEDICALRECORD	27	33	945432
file62496	CITY	45	51	LOXTON
file62496	DATE	3004	3013	20/2/2071	2071-02-20
file62496	DATE	5981	5990	27/2/2070	2070-02-27
file62496	DOCTOR	3037	3049	U. Vignovich
file62496	HOSPITAL	201	215	LOGAN HOSPITAL
file62496	HOSPITAL	45	68	LOXTON HOSPITAL COMPLEX
file62496	IDNUM	129	137	70X32891
file62496	IDNUM	138	146	70X32891
file62496	IDNUM	148	156	70X32891
file62496	IDNUM	148	158	70X328912C
file62496	PATIENT	160	178	Selgrade, AGUSTINA
file62496	IDNUM	8	18	70X328912E
file62496	MEDICALRECORD	27	33	708328
file62496	ZIP	3138	3142	2020
file62619	CITY	194	199	YOUNG
file62619	DATE	6585	6594	28/2/2070	2070-02-28
file62619	DOCTOR	2461	2474	E. Petrauskas
file62619	HOSPITAL	194	217	YOUNG DISTRICT HOSPITAL
file62619	HOSPITAL	46	62	QUILPIE HOSPITAL
file62619	IDNUM	124	132	12G62072
file62619	IDNUM	133	141	12G62072
file62619	IDNUM	143	151	12G62072
file62619	IDNUM	143	153	12G6207290
file62619	PATIENT	155	171	Monsay, Reynaldo
file62619	IDNUM	8	18	12G6207290
file62619	MEDICALRECORD	27	34	1226207
file62619	ZIP	2552	2556	2020
file62670	CITY	197	202	JUNEE
file62670	DATE	2229	2238	23/1/2070	2070-01-23
file62670	DATE	2309	2317	3/1/2071	2071-01-03
file62670	DATE	3103	3111	3/1/2070	2070-01-03
file62670	DOCTOR	2342	2354	T. Vanhoutte
file62670	HOSPITAL	197	224	JUNEE MULTI PURPOSE SERVICE
file62670	HOSPITAL	46	69	CARITAS CHRISTI HOSPICE
file62670	IDNUM	131	139	79C64178
file62670	IDNUM	140	148	79C64178
file62670	IDNUM	150	158	79C64178
file62670	IDNUM	150	160	79C6417873
file62670	PATIENT	162	174	Honse, DEREK
file62670	IDNUM	8	18	79C6417873
file62670	MEDICALRECORD	27	34	7906417
file62798	CITY	46	53	STAWELL
file62798	DATE	2637	2646	29/1/2070	2070-01-29
file62798	DATE	7617	7625	6/1/2069	2069-01-06
file62798	DOCTOR	2669	2679	D. Graeser
file62798	HOSPITAL	200	237	CLERMONT MULTI-PURPOSE HEALTH SERVICE
file62798	HOSPITAL	46	69	STAWELL REGIONAL HEALTH
file62798	IDNUM	131	139	11L84359
file62798	IDNUM	140	148	11L84359
file62798	IDNUM	150	158	11L84359
file62798	IDNUM	150	160	11L843594F
file62798	PATIENT	162	177	Pouche, MARCELA
file62798	IDNUM	8	18	11L843594F
file62798	MEDICALRECORD	27	34	1148435
file62798	ZIP	3274	3278	2020
file62979	DATE	155	164	22/2/2069	2069-02-22
file62979	DATE	3136	3145	17/1/2070	2070-01-17
file62979	DATE	6117	6126	19/2/2071	2071-02-19
file62979	DATE	6152	6161	21/2/2069	2069-02-21
file62979	DATE	6649	6658	21/1/2069	2069-01-21
file62979	DOCTOR	3169	3180	R Rossignol
file62979	DOCTOR	584	590	Denver
file62979	DOCTOR	6634	6642	R Lemkau
file62979	HOSPITAL	226	269	ST MARGARETS REHABILITATION CENTRE HOSPITAL
file62979	HOSPITAL	45	73	SOUTH EAST REGIONAL HOSPITAL
file62979	IDNUM	166	174	69H96465
file62979	IDNUM	176	184	69H96465
file62979	IDNUM	176	186	69H9646525
file62979	PATIENT	188	202	LOETHEN, CESAR
file62979	IDNUM	8	18	69H9646525
file62979	MEDICALRECORD	27	33	692964
file62979	TIME	6603	6616	36: 2105-2122	2066-02-36
file62979	ZIP	6584	6588	2018
file62979	ZIP	6598	6602	2018
file63085	DATE	5831	5840	15/2/2071	2071-02-15
file63085	DOCTOR	5866	5875	P. Rhines
file63085	DOCTOR	849	858	P. Adcock
file63085	TIME	862	882	4:26pm on 13/02/2069	2069-02-13T16:26
file63085	HOSPITAL	204	236	ST MARYS COMMUNITY HEALTH CENTRE
file63085	HOSPITAL	45	68	CARITAS CHRISTI HOSPICE
file63085	IDNUM	129	137	54I30481
file63085	IDNUM	138	146	54I30481
file63085	IDNUM	148	156	54I30481
file63085	IDNUM	148	158	54I304810U
file63085	IDNUM	8	18	54I304810U
file63085	MEDICALRECORD	27	33	543304
file63184	DATE	2885	2894	14/1/2070	2070-01-14
file63184	DATE	5808	5817	18/1/2070	2070-01-18
file63184	DOCTOR	2917	2928	Z. Heimlich
file63184	HOSPITAL	185	207	BARADINE MULTI PURPOSE
file63184	HOSPITAL	45	66	WONGAN HILLS HOSPITAL
file63184	IDNUM	127	135	96Q50662
file63184	IDNUM	137	145	96Q50662
file63184	IDNUM	137	147	96Q506626Q
file63184	PATIENT	149	162	RATTIGAN, RON
file63184	IDNUM	8	18	96Q506626Q
file63184	MEDICALRECORD	27	33	966506
file63308	CITY	226	234	COOKTOWN
file63308	DATE	146	155	26/1/2071	2071-01-26
file63308	DATE	1592	1601	19/2/2069	2069-02-19
file63308	DATE	3681	3690	22/2/2069	2069-02-22
file63308	DATE	3715	3724	24/2/2070	2070-02-24
file63308	DATE	3888	3897	25/1/2069	2069-01-25
file63308	DOCTOR	1623	1632	N Marquez
file63308	DOCTOR	577	587	N Sheckler
file63308	TIME	589	596	18/1/72	2072-01-18
file63308	HOSPITAL	226	243	COOKTOWN HOSPITAL
file63308	HOSPITAL	45	64	BRIDGETOWN HOSPITAL
file63308	IDNUM	157	165	54N62767
file63308	IDNUM	167	175	54N62767
file63308	PATIENT	179	202	MACOMBER, Joel Nannette
file63308	IDNUM	8	18	54N627675Z
file63308	MEDICALRECORD	27	33	545627
file63439	DATE	1775	1784	24/1/2069	2069-01-24
file63439	DATE	4225	4232	26.2.73	2073-02-26
file63439	DATE	4367	4374	23.1.69	2069-01-23
file63439	DOCTOR	1808	1816	L Clague
file63439	DOCTOR	582	593	L. Helander
file63439	TIME	597	604	18.1.73	2073-01-18T18:00
file63439	HOSPITAL	182	198	QUILPIE HOSPITAL
file63439	HOSPITAL	45	60	DYSART HOSPITAL
file63439	IDNUM	121	129	49O07794
file63439	IDNUM	131	139	49O07794
file63439	IDNUM	131	141	49O077943F
file63439	PATIENT	143	159	SANDUSKY, MORTON
file63439	IDNUM	8	18	49O077943F
file63439	MEDICALRECORD	27	33	495077
file63551	DATE	146	153	10/8/71	2071-10-08
file63551	DATE	5321	5328	11/8/69	2069-11-08
file63551	DOCTOR	1301	1312	A Dromgoole
file63551	DOCTOR	2524	2532	A Steuck
file63551	DOCTOR	2540	2551	A Haeussler
file63551	DOCTOR	4915	4929	Clora SIMONTON
file63551	HOSPITAL	47	64	MERREDIN HOSPITAL
file63551	IDNUM	8	18	07K098991N
file63551	MEDICALRECORD	27	35	07309899
file63551	PATIENT	3919	3924	Weiss
file63645	DOCTOR	2404	2406	KN
file63645	DATE	2410	2416	7/7/72	2072-07-07
file63645	DOCTOR	2448	2460	K Siebenberg
file63645	HOSPITAL	45	86	MALLEE TRACK HEALTH AND COMMUNITY SERVICE
file63645	IDNUM	8	18	39T390707K
file63645	MEDICALRECORD	27	33	397390
file63697	DOCTOR	2359	2369	H Strebeck
file63697	DOCTOR	2377	2385	H Schley
file63697	HOSPITAL	46	71	MACLEAN DISTRICT HOSPITAL
file63697	IDNUM	8	18	33T730965Q
file63697	MEDICALRECORD	27	34	3377309
file63794	DATE	1594	1601	23/8/71	2071-08-23
file63794	DOCTOR	1633	1643	I Lembrick
file63794	DOCTOR	3501	3509	I Tadych
file63794	TIME	3513	3519	1/9/69	2069-09-01T13:00
file63794	HOSPITAL	46	72	CRAIGIEBURN HEALTH SERVICE
file63794	IDNUM	8	18	38X512572P
file63794	MEDICALRECORD	27	34	3895125
file63906	DATE	2533	2540	30/7/68	2068-07-30
file63906	DOCTOR	2572	2582	G Zurheide
file63906	DOCTOR	4466	4476	G Gennings
file63906	DOCTOR	4468	4476	Gennings
file63906	TIME	4480	4486	8/9/68	2068-09-08T14:09
file63906	DOCTOR	4918	4928	G Schleker
file63906	TIME	4932	4939	10/9/68	2068-10-09T14:00
file63906	HOSPITAL	47	69	IVANHOE HEALTH SERVICE
file63906	IDNUM	8	18	23Y063830V
file63906	MEDICALRECORD	27	35	23906383
file63984	CITY	46	54	SMITHTON
file63984	DOCTOR	923	925	LW
file63984	DATE	929	936	13/9/72	2072-09-13
file63984	DOCTOR	968	976	Q Liapis
file63984	HOSPITAL	46	72	SMITHTON DISTRICT HOSPITAL
file63984	IDNUM	8	18	65H255547R
file63984	MEDICALRECORD	27	34	6522555
file63984	PATIENT	2130	2137	LOBULES
file64010	DATE	587	595	13/10/68	2068-10-13
file64010	DOCTOR	627	638	O Natalizio
file64010	DOCTOR	656	667	O Konopacki
file64010	HOSPITAL	45	86	CENTRAL HIGHLANDS RURAL HEALTH - CRESWICK
file64010	IDNUM	8	18	50I705805X
file64010	MEDICALRECORD	27	33	503705
file64133	DATE	1640	1647	11/7/71	2071-07-11
file64133	DOCTOR	149	160	Y Spigelman
file64133	DATE	162	172	19.10.2069	2069-10-19
file64133	DOCTOR	1680	1692	Y Descoteaux
file64133	DOCTOR	3534	3547	Y Mccalanahan
file64133	DATE	3549	3559	15.11.2068	2068-11-15
file64133	HOSPITAL	47	65	FAIRFIELD HOSPITAL
file64133	IDNUM	8	18	92R907512U
file64133	MEDICALRECORD	27	35	92690751
file64205	DATE	2448	2455	10/6/69	2069-10-06
file64205	DOCTOR	2487	2495	W Friske
file64205	DOCTOR	4357	4366	W Koepsel
file64205	DATE	4370	4378	15/11/71	2071-11-15
file64205	HOSPITAL	45	66	WONGAN HILLS HOSPITAL
file64205	IDNUM	8	18	87S448879A
file64205	MEDICALRECORD	27	33	877448
file64270	DATE	1890	1897	29/1/73	2073-01-29
file64270	DATE	3689	3696	8.12.68	2068-12-08
file64270	DOCTOR	1929	1939	G Gallegoz
file64270	HOSPITAL	46	72	BASS COAST REGIONAL HEALTH
file64270	IDNUM	8	18	29B649696W
file64270	MEDICALRECORD	27	34	2906496
file64316	DATE	1779	1786	27/1/73	2073-01-27
file64316	DOCTOR	1816	1825	U Colborn
file64316	HOSPITAL	46	67	ORANGE HEALTH SERVICE
file64316	IDNUM	8	18	77X660644F
file64316	MEDICALRECORD	27	34	7786606
file64339	DOCTOR	729	738	S Huskins
file64339	HOSPITAL	46	61	DYSART HOSPITAL
file64339	IDNUM	8	18	72Y111802L
file64339	MEDICALRECORD	27	34	7291118
file64455	DATE	1533	1540	19/2/70	2070-02-19
file64455	DOCTOR	1573	1581	G Donten
file64455	HOSPITAL	47	74	BANKSTOWN-LIDCOMBE HOSPITAL
file64455	IDNUM	8	18	29U131960U
file64455	MEDICALRECORD	27	35	29713196
file64559	DATE	1258	1265	25/2/70	2070-02-25
file64559	DOCTOR	1297	1308	R Ingwerson
file64559	HOSPITAL	46	88	CAMPBELL TOWN HEALTH AND COMMUNITY SERVICE
file64559	IDNUM	8	18	61D333777Q
file64559	MEDICALRECORD	27	34	6113337
file64764	DATE	2828	2836	4/8/2069	2069-04-04
file64764	DATE	2902	2911	14/5/2070	2070-05-14
file64764	DATE	6758	6766	5/8/2070	2070-08-05
file64764	DATE	7287	7294	22.4.70	2070-04-22
file64764	DOCTOR	2933	2943	O. Shakoor
file64764	DOCTOR	695	701	Declan
file64764	DOCTOR	709	718	O. Penado
file64764	TIME	722	743	18:35 Hrs on 05.08.69	2069-08-05T18:35
file64764	DOCTOR	7273	7280	O Darst
file64764	HOSPITAL	206	242	BATLOW/ADELONG MULTI PURPOSE SERVICE
file64764	HOSPITAL	45	87	CAMPBELL TOWN HEALTH AND COMMUNITY SERVICE
file64764	IDNUM	148	156	56E87493
file64764	IDNUM	158	166	56E87493
file64764	IDNUM	158	168	56E8749358
file64764	PATIENT	170	183	WHETSELL, LEN
file64764	IDNUM	8	18	29Z4547359
file64764	MEDICALRECORD	27	33	561874
file64764	PATIENT	6648	6693	INVOLVED MEDIAL MARGIN, CLOSE INFERIOR MARGIN
file64764	TIME	485	501	0700 on 04.07.72	2072-07-04T09:00
file64764	TIME	7242	7255	36: 2105-2122	2066-02-36
file64764	ZIP	485	489	0700
file64764	ZIP	7223	7227	2018
file64764	ZIP	7237	7241	2018
file64900	CITY	182	189	LITHGOW
file64900	DATE	1960	1969	16/5/2069	2069-05-16
file64900	DATE	4836	4843	21.4.72	2072-04-21
file64900	DOCTOR	1993	1998	D Nin
file64900	DOCTOR	603	611	D. Monoz
file64900	DOCTOR	643	654	D. Castilla
file64900	TIME	615	635	6:08pm on 17/05/2069	2069-05-17T12:08
file64900	HOSPITAL	182	198	LITHGOW HOSPITAL
file64900	HOSPITAL	45	60	MALDON HOSPITAL
file64900	IDNUM	121	129	14A80509
file64900	IDNUM	131	139	14A80509
file64900	IDNUM	131	141	14A8050931
file64900	PATIENT	143	159	TARSKI, GEORGENE
file64900	IDNUM	8	18	14A8050931
file64900	MEDICALRECORD	27	33	140805
file65014	DATE	2067	2076	25/4/2069	2069-04-25
file65014	DATE	4188	4197	21/4/2071	2071-04-21
file65014	DOCTOR	2102	2111	N. Omelia
file65014	HOSPITAL	186	209	MONASH HEALTH COMMUNITY
file65014	HOSPITAL	45	59	OAKEY HOSPITAL
file65014	IDNUM	120	128	56I00670
file65014	IDNUM	129	137	56I00670
file65014	IDNUM	139	147	56I00670
file65014	IDNUM	139	149	56I0067000
file65014	PATIENT	151	163	HONGO, LENNA
file65014	IDNUM	8	18	56I0067000
file65014	MEDICALRECORD	27	33	563006
file65156	DATE	2183	2192	21/4/2071	2071-04-21
file65156	DATE	5350	5358	5/5/2069	2069-05-05
file65156	DOCTOR	2217	2225	L Graeff
file65156	DOCTOR	790	799	Santarpia
file65156	DOCTOR	807	814	L. Wilt
file65156	DOCTOR	810	814	Wilt
file65156	TIME	818	823	20.04	2070-04-20T12:00
file65156	HOSPITAL	201	226	MACLEAN DISTRICT HOSPITAL
file65156	HOSPITAL	45	74	CONDOBOLIN RETIREMENT VILLAGE
file65156	IDNUM	135	143	41J54706
file65156	IDNUM	145	153	41J54706
file65156	IDNUM	145	155	41J5470682
file65156	PATIENT	157	178	Matulewicz, Nathanael
file65156	IDNUM	8	18	41J5470682
file65156	MEDICALRECORD	27	33	413547
file65296	DATE	3131	3139	6/6/2070	2070-06-06
file65296	DOCTOR	3165	3173	L. Thain
file65296	DOCTOR	602	610	L. Ruple
file65296	HOSPITAL	186	212	CRAIGIEBURN HEALTH SERVICE
file65296	HOSPITAL	45	62	ATHERTON HOSPITAL
file65296	IDNUM	124	132	46N32967
file65296	IDNUM	134	142	46N32967
file65296	IDNUM	134	144	46N3296752
file65296	PATIENT	146	162	Lehner, Emmanuel
file65296	IDNUM	8	18	46N3296752
file65296	MEDICALRECORD	27	33	465329
file65437	DATE	2233	2241	6/5/2070	2070-06-06
file65437	DATE	4447	4455	6/7/2070	2070-06-06
file65437	DOCTOR	2267	2276	O Piggott
file65437	DOCTOR	632	640	Jefferey
file65437	DOCTOR	648	655	O. Wool
file65437	TIME	659	680	20.04.2069 at 2:46 pm	2069-04-20T14:46
file65437	HOSPITAL	187	227	STRATHALBYN AND DISTRICT HEALTH SERVICES
file65437	HOSPITAL	45	64	DONNYBROOK HOSPITAL
file65437	IDNUM	126	134	52G46079
file65437	IDNUM	136	144	52G46079
file65437	IDNUM	136	146	52G4607919
file65437	PATIENT	148	163	LUSKEY, Darleen
file65437	IDNUM	8	18	52G4607919
file65437	MEDICALRECORD	27	33	522460
file65622	DATE	2758	2766	7/6/2069	2069-06-07
file65622	DATE	5561	5569	6/5/2071	2071-06-06
file65622	DATE	6066	6074	11.02.22	2022-02-11
file65622	DOCTOR	2792	2801	D. Hemmer
file65622	DOCTOR	6051	6059	D Asplin
file65622	DOCTOR	707	712	Brice
file65622	TIME	716	736	3:45pm on 07/05/2071	2071-05-07T15:45
file65622	HOSPITAL	210	240	CULCAIRN MULTI PURPOSE SERVICE
file65622	HOSPITAL	45	81	FLINDERS ISLAND MULTI PURPOSE CENTRE
file65622	IDNUM	143	151	10C48184
file65622	IDNUM	153	161	10C48184
file65622	IDNUM	153	163	10C4818492
file65622	PATIENT	165	186	ZARLINGO, MINDA ISSAC
file65622	IDNUM	8	18	10C4818492
file65622	MEDICALRECORD	27	33	100481
file65622	TIME	6018	6031	36: 2105-2122	2066-02-36
file65622	ZIP	5999	6003	2018
file65622	ZIP	6013	6017	2018
file65693	DATE	2856	2865	11/4/2071	2071-04-11
file65693	DATE	4969	4978	13/4/2071	2071-04-13
file65693	DOCTOR	2890	2903	A Singuefield
file65693	HOSPITAL	209	250	CENTRAL HIGHLANDS RURAL HEALTH - CRESWICK
file65693	HOSPITAL	45	82	EAST WIMMERA HEALTH SERVICE - BIRCHIP
file65693	IDNUM	143	151	04D83200
file65693	IDNUM	153	161	04D83200
file65693	IDNUM	153	163	04D8320074
file65693	PATIENT	165	186	ROKOS, Faviola TREVOR
file65693	IDNUM	8	18	04D8320074
file65693	MEDICALRECORD	27	33	041832
file65816	DATE	2635	2644	13/6/2069	2069-06-13
file65816	DATE	5087	5096	15/5/2069	2069-05-15
file65816	DOCTOR	2706	2717	L. Gesualdo
file65816	DOCTOR	1022	1030	Augustus
file65816	DOCTOR	1062	1072	L. Favuzza
file65816	HOSPITAL	182	197	NEPEAN HOSPITAL
file65816	HOSPITAL	45	62	MITCHELL HOSPITAL
file65816	IDNUM	123	131	46M13381
file65816	IDNUM	133	141	46M13381
file65816	IDNUM	133	143	46M1338143
file65816	PATIENT	145	159	COLBAUGH, Hoyt
file65816	IDNUM	8	18	46M1338143
file65816	MEDICALRECORD	27	33	464133
file65947	DATE	2353	2362	16/5/2071	2071-05-16
file65947	DATE	2576	2585	16/6/2069	2069-06-16
file65947	DOCTOR	3159	3169	I Strutton
file65947	HOSPITAL	202	222	ROYAL REHABILITATION
file65947	HOSPITAL	45	72	HENTY MULTI PURPOSE SERVICE
file65947	IDNUM	133	141	31N57408
file65947	IDNUM	142	150	31N57408
file65947	IDNUM	152	160	31N57408
file65947	IDNUM	152	162	31N5740825
file65947	PATIENT	164	179	MIURA, Gilberto
file65947	IDNUM	8	18	31N5740825
file65947	MEDICALRECORD	27	33	315574
file65947	ZIP	3273	3277	2020
file66075	CITY	185	194	MILLICENT
file66075	DATE	2514	2523	16/5/2069	2069-05-16
file66075	DATE	4747	4756	20/5/2071	2071-05-20
file66075	DOCTOR	2547	2555	C Engels
file66075	DOCTOR	636	650	C. Bastianelli
file66075	DOCTOR	658	671	C. Hoisington
file66075	TIME	675	694	5.35 pm on 17/06/69	2063-06-17T15:35
file66075	HOSPITAL	185	216	MILLICENT AND DISTRICT HOSPITAL
file66075	HOSPITAL	45	66	RAVENSTHORPE HOSPITAL
file66075	IDNUM	127	135	00A29699
file66075	IDNUM	137	145	00A29699
file66075	IDNUM	137	147	00A296998I
file66075	PATIENT	149	162	ELLOUT, Cohen
file66075	IDNUM	8	18	00A296998I
file66075	MEDICALRECORD	27	33	000296
file66133	DATE	151	160	25/6/2071	2071-06-25
file66133	DATE	3670	3679	27/5/2071	2071-05-27
file66133	DATE	5850	5858	7/6/2071	2071-06-07
file66133	DATE	5883	5892	25/6/2069	2069-06-25
file66133	DATE	6199	6208	28/7/2070	2070-07-28
file66133	DOCTOR	3704	3713	M Desorcy
file66133	HOSPITAL	220	238	ST GEORGE HOSPITAL
file66133	HOSPITAL	45	69	WILCANNIA HEALTH SERVICE
file66133	IDNUM	161	169	42J49770
file66133	IDNUM	171	179	42J49770
file66133	IDNUM	171	181	42J497705F
file66133	PATIENT	183	197	Paton, DEREK M
file66133	IDNUM	8	18	42J497705F
file66133	MEDICALRECORD	27	33	423497
file66133	ORGANIZATION	5924	5945	Pathmark Stores SEALS
file66305	DATE	2155	2164	25/6/2069	2069-06-25
file66305	DOCTOR	2419	2428	K. Mirsky
file66305	DOCTOR	866	877	K Ellenwood
file66305	DOCTOR	881	891	K Weisheit
file66305	HOSPITAL	215	247	PORT BROUGHTON DISTRICT HOSPITAL
file66305	HOSPITAL	45	91	TRESILLIAN FAMILY CARE CENTRE - WOLLSTONECRAFT
file66305	IDNUM	152	160	37K94896
file66305	IDNUM	162	170	37K94896
file66305	IDNUM	162	172	37K948963L
file66305	PATIENT	174	192	Krajnovich, Conrad
file66305	IDNUM	8	18	37K948963L
file66305	MEDICALRECORD	27	33	373948
file66350	DATE	1659	1668	26/4/2071	2071-04-26
file66350	DATE	2100	2109	27/4/2071	2071-04-27
file66350	DOCTOR	1734	1743	Y. Raposo
file66350	HOSPITAL	192	212	OBERON MULTI PURPOSE
file66350	HOSPITAL	45	72	HENTY MULTI PURPOSE SERVICE
file66350	IDNUM	133	141	95G96902
file66350	IDNUM	143	151	95G96902
file66350	IDNUM	143	153	95G9690217
file66350	PATIENT	155	169	FRIEDEL, PEDRO
file66350	IDNUM	8	18	95G9690217
file66350	MEDICALRECORD	27	33	952969
file66457	DATE	2032	2041	13/6/2070	2070-06-13
file66457	DOCTOR	2101	2110	I. Fauset
file66457	DOCTOR	617	622	Jarod
file66457	DOCTOR	630	639	I. Keifer
file66457	TIME	643	659	3:52 on 09.07.70	2070-07-09T15:52
file66457	HOSPITAL	193	215	BARADINE MULTI PURPOSE
file66457	HOSPITAL	45	73	ALPINE HEALTH (MOUNT BEAUTY)
file66457	IDNUM	134	142	37P16183
file66457	IDNUM	144	152	37P16183
file66457	IDNUM	144	154	37P161838Q
file66457	PATIENT	156	170	Mannello, Deon
file66457	IDNUM	8	18	37P161838Q
file66457	MEDICALRECORD	27	33	375161
file66968	CITY	205	213	GOULBURN
file66968	CITY	230	240	SHEPPARTON
file66968	DATE	2184	2193	30/6/2069	2069-06-30
file66968	DATE	2264	2272	5/7/2071	2071-07-05
file66968	DATE	3892	3901	8/10/2069	2069-10-08
file66968	DOCTOR	1407	1422	ARCHIE Marrotte
file66968	DOCTOR	1426	1429	Drs
file66968	DOCTOR	2297	2307	G Mccarter
file66968	HOSPITAL	205	247	GOULBURN VALLEY HEALTH - SHEPPARTON CAMPUS
file66968	HOSPITAL	45	62	BEVERLEY HOSPITAL
file66968	IDNUM	124	132	22Q60109
file66968	IDNUM	133	141	22Q60109
file66968	IDNUM	143	151	22Q60109
file66968	IDNUM	143	153	22Q6010968
file66968	PATIENT	155	181	Gallante, ANIBAL HERIBERTO
file66968	IDNUM	8	18	22Q6010968
file66968	MEDICALRECORD	27	33	226601
file66968	TIME	1462	1481	3:17 pm on 28.05.69	206905.69=>206905.69
