1093	 25	 Episode No:  48B915480A	 IDNUM:48B915480A
1093	 37	 4809154.WAA	 MEDICALRECORD:4809154.WAA
1093	 58	 Otterbine, Laverne	 PATIENT:Otterbine, Laverne
1093	 85	 Lab No:  48B91548,48B91548	 IDNUM:48B91548
1093	 85	 Lab No:  48B91548,48B91548	 IDNUM:48B91548
1093	 98	 Legend Manor	 STREET:Legend Manor
1093	 122	 NORTHAM  Tasmania  2207	 CITY:NORTHAM
1093	 122	 NORTHAM  Tasmania  2207	 STATE:Tasmania
1093	 122	 NORTHAM  Tasmania  2207	 ZIP:2207
1093	 148	 Specimen: Washings,Tissue	 PHI:Null
1093	 166	 D.O.B:  20/6/1989	 DATE:20/6/1989=>1989-06-20
1093	 174	 Sex:  F	 PHI:Null
1093	 200	 Collected: 28/8/2063 at :	 DATE:28/8/2063=>2063-08-28
1093	 244	 Location:  Envoi Specialist - ROMA HOSPITAL	 DEPARTMENT:Envoi Specialist
1093	 244	 Location:  Envoi Specialist - ROMA HOSPITAL	 HOSPITAL:ROMA HOSPITAL
1093	 264	 DR Anh LYNNE Detore	 DOCTOR:Anh LYNNE Detore
1093	 290	 Distribution:   FILE-COPY	 PHI:Null
1093	 300	 CLINICAL:	 PHI:Null
1093	 403	 Post menopausal bleeding.  Grade III endometrial cancer.  Family history; aunt breast cancer in 65s.	 AGE:65
1093	 416	 MACROSCOPIC:	 PHI:Null
1093	 1307	 A.Specimen labelled "Uterus tubes and right ovary" consists of a uterus with attached right fallopian tube and right ovary weighing 54g in total.  The uterus measures 60 x 40 x 30mm and has a smooth shiny serosal surface.  The ectocervix measures 27 x 18mm and has an unremarkable surface.  On sectioning the endometrium has an exophytic tan mass on the posterior body and fundus and in the left cornu.  This measures 30 x 28mm.  The anterior endometrium is unremarkable.  The myometrium is 9mm in maximum thickness and the tumour invades into the outer half of the myometrium.  The right fallopian tube is in two lengths (previous tubal ligation).  The proximal tube is a blind ending segment which is 9mm in length x 5 x 4mm in maximum dimension.  The distal segment is 42mm in length x 7 x7mm in maximum dimension.  The right ovary is 30 x 18 x 10mm and has a haemorrhagic cut surface.	 PHI:Null
1093	 1640	 Blocks:  1 & 2 - full longitudinal section of anterior body and cervix; 3 to 5 - full longitudinal section of posterior body and cervix; 6 to 8 - representative tumour (80% all embedded); 9 - proximal fallopian tube segment; 10 - distal right fallopian tube segment; 11 - right ovary; 12 - left parametrial tissue ?fallopian tube.	 PHI:Null
1093	 1843	 B.  Specimen labelled "Right external iliac lymph nodes" consists of a piece of fibrofatty tissue measuring 70 x 35 x 10mm.  There are three lymph nodes identified from 5 to 15mm in maximum dimension.	 PHI:Null
1093	 1914	 Blocks:  1 - one lymph node; 2 - one lymph node; 3 - one lymph node.	 PHI:Null
1093	 2127	 C.  Specimen labelled "Left external iliac lymph node" consists of a piece of fibrofatty tissue measuring 80 x 45 x 10mm.  There are three lymph nodes identified measuring from 10mm to20mm in maximum dimension.	 PHI:Null
1093	 2197	 Blocks:  1 - one lymph node; 2- one lymph node; 3 - one lymph node.	 PHI:Null
1093	 2402	 D.  Specimen labelled "Right obturator lymph nodes" consists of a piece of fibrofatty tissue measuring 50 x 40 x 10mm.  There are two lymphnodes identified measuring from 5 to 15mm in maximum dimension.	 PHI:Null
1093	 2491	 Blocks:  1- one lymph node; 2- one lymph node bisected; 3 - rest of fibrofatty tissue.	 PHI:Null
1093	 2496	 AE.	 PHI:Null
1093	 2688	 E.  Specimen labelled "Left obturator lymph nodes" consists of a piece of fibrofatty tissue measuring 55 x 40 x 8mm.  There is one lymph node identified measuring 50mm in maximum dimension.	 PHI:Null
1093	 2753	 Blocks:1- one lymph node; 2 - fibrofatty tissue.  AE 2 blocks.	 PHI:Null
1093	 2948	 F.  Specimen labelled "Right common iliac lymph node" consists of a piece of fibrofatty tissue measuring 35 x 20 x 6mm.  There is one lymph node identified measuring 20mm in maximum dimension.	 PHI:Null
1093	 3001	 Blocks:  1 - one lymph node; 2- fibrofatty tissue.	 PHI:Null
1093	 3172	 G.  Specimen labelled "Left common iliac lymph node" consists of two pieces of fibrofatty tissue containing a lymph node each measuring 15 x 10 x 5mm and 15 x 10 x 6mm.	 PHI:Null
1093	 3246	 Blocks:  1 - one lymph node; 2- one lymph node.  (TO: JL; JL/mm 29.8.63)	 DATE:29.8.63=>2063-08-29
1093	 3289	 MICROSCOPIC (reported by Dr M Vandevsen):	 DOCTOR:M Vandevse
1093	 3869	 A.  Sections of the cervix are unremarkable.  Sections of the endometrial tumour show a grade 2 endometroid adenocarcinoma (architecture grade 1, cytology grade 3, overall grade 2).  There is deep myometrial invasion.  Greatest depth of myometrial invasion is 12mm out of a total myometrial thickness of 15mm.  No lymphovascular invasion is identified.  There is no cervical involvement.  Asmall leiomyoma is noted in the cervix.  Sections of the right ovary show a serous cystadenoma; the ovary is otherwise unremarkable.  Sections of the right fallopian tube are unremarkable.	 PHI:Null
1093	 3925	 B.  Sections show three lymph nodes.No tumour is seen.	 PHI:Null
1093	 3982	 C.  Sections show three lymph nodes.  No tumour is seen.	 PHI:Null
1093	 4036	 D.  Sections show two lymph nodes. No tumour is seen.	 PHI:Null
1093	 4088	 E.  Sections show one lymph node.No tumour is seen.	 PHI:Null
1093	 4142	 F.  Sections show one lymph node.  No tumour is seen.	 PHI:Null
1093	 4197	 G.  Sections show two lymph nodes.  No tumour is seen.	 PHI:Null
1093	 4210	 DIAGNOSIS:	 PHI:Null
1093	 4261	 A.  Uterus,right fallopian tube and right ovary:	 PHI:Null
1093	 4359	 1.  Grade 2 endometroid adenocarcinoma of endometrium showing deep myometrial invasion, stage 1B.	 PHI:Null
1093	 4397	 2.  Serous cystadenoma right ovary.	 PHI:Null
1093	 4453	 .  Right external iliac lymph nodes:  No tumour (0/3).	 PHI:Null
1093	 4508	 C.  Left external iliac lymph nodes:  No tumour (0/3).	 PHI:Null
1093	 4560	 D.  Right obturator lymph nodes:  No tumour (0/2).	 PHI:Null
1093	 4609	 E.  Left obturator lymph node:   Notumour (0/1).	 PHI:Null
1093	 4662	 F.  Right common iliac lymph node:  No tumour (0/1).	 PHI:Null
1093	 4718	 G.  Left common iliac lymph nodes:  No tumour (0/2).	 PHI:Null
1093	 4720	 	 PHI:Null
1094	 24	 Episode No:  06X936548J	 IDNUM:06X936548J
1094	 36	 0699365.LVJ	 MEDICALRECORD:0699365.LVJ
1094	 59	 Tommolino, Boleslaws	 PATIENT:Tommolino, Boleslaws
1094	 86	 Lab No:  06X93654,06X93654	 IDNUM:06X93654
1094	 86	 Lab No:  06X93654,06X93654	 IDNUM:06X93654
1094	 94	 Tandera	 STREET:Tandera
1094	 117	 BONNY HILLS  ACT  1169	 CITY:BONNY HILLS
1094	 117	 BONNY HILLS  ACT  1169	 STATE:ACT
1094	 117	 BONNY HILLS  ACT  1169	 ZIP:1169
1094	 143	 Specimen: Washings,Tissue	 PHI:Null
1094	 160	 D.O.B:  8/7/2019	 DATE:8/7/2019=>2019-07-08
1094	 168	 Sex:  F	 PHI:Null
1094	 194	 Collected: 21/8/2063 at :	 DATE:21/8/2063=>2063-08-21
1094	 245	 Location:3HR STAY SURGICAL UNIT - IPSWICH HOSPITAL	 DEPARTMENT:3HR STAY SURGICAL UNIT
1094	 245	 Location:3HR STAY SURGICAL UNIT - IPSWICH HOSPITAL	 HOSPITAL:IPSWICH HOSPITAL
1094	 267	 DR Ismael RICKEY Durk	 DOCTOR:Ismael RICKEY Durk
1094	 316	 Distribution:   FILE-COPY,   NSW-CANCER-REGISTRY	 PHI:Null
1094	 347	 SUPPLEMENTARY REPORT (6.9.63):	 DATE:6.9.63=>2063-09-06
1094	 358	 CLINICAL:	 PHI:Null
1094	 672	 Left adnexal cyst removed at caesarean section 10/5/13.Borderline with endometroid adenocarcinoma .  TAH/BSO today.  2 x1cm indurated nodule in anterior parietal peritoneum just above the bladder.  5mm nodule on fold of peritoneum between bladder and cervix.  Lymph nodes not enlarged.  Omentum appeared normal.	 DATE:today=>2063-08-21
1094	 685	 MACROSCOPIC:	 PHI:Null
1094	 1882	 A.  Specimenlabelled "Uterus / cx / L&R tubes and ovaries" consists of a uterus with attached cervix, bilateral fallopian tubes and ovaries weighing 375g in total.  The uterus measures 110x 70 x 45mm and has a smooth shiny serosal surface.  The ectocervix measures 35 x 25mm and has an unremarkable surface.  The endometrium has a tan exophytic mass over the posterior surface measuring 30 x 27mm in area.  This mass is 70mm from the cervical os, 5mm from the left cornu and at the right cornu.  The endometrium anteriorly is haemorrhagic with a roughened surface.  The rest ofthe endometrium is 2mm in maximum thickness and the myometrium is 20mm in maximum thickness.  The myometrium appears to have thickened sclerotic blood vessels throughout, otherwise appears unremarkable.  The right fallopian tube is 70mm in length x 15 x 10mm in maximum dimension.  The right ovary measures 33 x 20 x 15mm and the cut surface shows multiple thin walled cysts from 4mm to 10mm in maximum dimension.  The left fallopian tube is 60mm in length x 10 x 8mm in maximum dimension.  The left ovary measures 30 x 25 x 18mm and contains multiple smooth lined cysts measuring from 2mm to 7mm in maximum dimension.	 PHI:Null
1094	 2259	 Blocks: 1 to 4 - full LS of anterior body and cervix; 5 to 8 - full LS posterior body and cervix; 9 to 14 - mass (AE); 15 - right ovary; 16 - right fallopian tube; 17 - left ovary; 18 - left fallopian tube; 19 to 20 - remainder of left ovary (AE).  Re-select 21,22, 29, 30 - vascular pedicle, left adnexa; 23 to 28 - mucoid nodule lower left anterior peritoneum; JE (4.9.63).	 DOCTOR:JE
1094	 2259	 Blocks: 1 to 4 - full LS of anterior body and cervix; 5 to 8 - full LS posterior body and cervix; 9 to 14 - mass (AE); 15 - right ovary; 16 - right fallopian tube; 17 - left ovary; 18 - left fallopian tube; 19 to 20 - remainder of left ovary (AE).  Re-select 21,22, 29, 30 - vascular pedicle, left adnexa; 23 to 28 - mucoid nodule lower left anterior peritoneum; JE (4.9.63).	 DATE:4.9.63=>2063-09-04
1094	 2262	 	 PHI:Null
1094	 2444	 B.  Specimen labelled "Omentum" consists of a piece of fibrofatty tissue measuring 235 x 55 x 10mm.  No lymph nodes or tumour deposits are identified.  Representative in 3 blocks.	 PHI:Null
1094	 2680	 C.  Specimen labelled "Anterior peritoneal nodule" consists of a piece of fibrofatty tissue measuring 30 x 30 x 20mm.  On sectioning there is a tan lesion measuring 10 x 5 x 4mm within the subcutaneous tissue.  Representative 3 blocks.	 PHI:Null
1094	 2684	 	 PHI:Null
1094	 2832	 D.  Specimen labelled "Pouch ofDouglas peritoneum" consists of a two pieces of tantissue measuring 4 and 8mm in maximum dimension.    AE 1 block.	 PHI:Null
1094	 2834	 	 PHI:Null
1094	 2949	 E.  Specimen labelled "Sigmoid fat" consists of a piece of subcutaneous fat measuring 7 x 6 x 4mm.   AE 1 block.	 PHI:Null
1094	 2951	 	 PHI:Null
1094	 3069	 F.  Specimen labelled "Left paracolic gutter" consists of a tan piece of tissue measuring 15 x 7 x 3mm.   AE 1 block.	 PHI:Null
1094	 3074	 	 PHI:Null
1094	 3391	 G.  Specimen labelled "Appendix" consists of an appendix measuring 35mm in length x 7 x 6mm in maximum dimension.  There is an attached piece of mesoappendix to a depth of 20mm.  The serosal surface is smooth and shiny.  The wall thickness is 2mm in maximum thickness.  The mucosa appears unremarkable.  AE 3 blocks.	 PHI:Null
1094	 3508	 Blocks: 1 - proximal surgical margin and proximal appendix; 2 - three TS mid; 3 - two LS distal.   (BA/ta 22/8/63)	 DOCTOR:BA
1094	 3508	 Blocks: 1 - proximal surgical margin and proximal appendix; 2 - three TS mid; 3 - two LS distal.   (BA/ta 22/8/63)	 DATE:22/8/63=>2063-08-22
1094	 3511	 	 PHI:Null
1094	 3555	 MICROSCOPIC (Reported by Dr A Mctarnaghan):	 DOCTOR:A Mctarnagha
1094	 3594	 The previous report 06X93654 is noted.	 IDNUM:06X93654
1094	 3888	 A.  The ectocervix and endocervix are unremarkable.  The posterior endometrium and myometrium shows a mass like area of involuting post partum vessels.  The endometrium otherwise appears proliferative.  The left ovary shows no residual tumour.  The right ovary and both tubes are unremarkable.	 PHI:Null
1094	 3938	 B, D, E & F.  There is no evidence of malignancy.	 PHI:Null
1094	 4020	 C.  Sections show changes of recent surgery.  There is no evidence of malignancy.	 PHI:Null
1094	 4108	 G.  The appendix shows no significant abnormality.  There is no evidence of malignancy.	 PHI:Null
1094	 4119	 DIAGNOSIS:	 PHI:Null
1094	 4150	 No residual tumour identified.	 PHI:Null
1094	 4199	 SUPPLEMENTARY REPORT (6.9.63, Dr A Santamarina):	 DATE:6.9.63=>2063-09-06
1094	 4199	 SUPPLEMENTARY REPORT (6.9.63, Dr A Santamarina):	 DOCTOR:A Santamarina
1094	 4709	 A.  Concern was raised at the Gynaecologic Oncology Meeting on 3.9.63 about the nature of a nodule on a fold of peritoneum between the bladder and cervix, which had not been sectioned.  The specimen was therefore re-examined.  A mucoid nodule around 10mm diameter was identified in the flap of peritoneum on the anterior endocervix, left side, and sections were taken (blocks A23 - A28).  The sections show only oedematous and inflammatory tissue with suture material from previous surgery; no tumour is seen.	 DATE:3.9.63=>2063-09-03
1094	 4766	 This result was communicated to Prof A Fedde on 5.9.63.	 DOCTOR:A Fedde
1094	 4766	 This result was communicated to Prof A Fedde on 5.9.63.	 DATE:5.9.63=>2063-09-05
1095	 24	 Episode No:  27O537406U	 IDNUM:27O537406U
1095	 36	 2755374.ARU	 MEDICALRECORD:2755374.ARU
1095	 54	 Jacome, Joaquin	 PATIENT:Jacome, Joaqui
1095	 81	 Lab No:  27O53740,27O53740	 IDNUM:27O53740
1095	 81	 Lab No:  27O53740,27O53740	 IDNUM:27O53740
1095	 91	 Sandering	 STREET:Sandering
1095	 129	 BARWON HEADS  Western Australia  6906	 CITY:BARWON HEADS
1095	 129	 BARWON HEADS  Western Australia  6906	 STATE:Western Australia
1095	 129	 BARWON HEADS  Western Australia  6906	 ZIP:6906
1095	 155	 Specimen: Washings,Tissue	 PHI:Null
1095	 173	 D.O.B:  12/8/1999	 DATE:12/8/1999=>1999-08-12
1095	 181	 Sex:  F	 PHI:Null
1095	 207	 Collected: 11/9/2063 at :	 DATE:11/9/2063=>2063-09-11
1095	 271	 Location:  SA Pathology - SHOALHAVEN DISTRICT MEMORIAL HOSPITAL	 DEPARTMENT:SA Pathology
1095	 271	 Location:  SA Pathology - SHOALHAVEN DISTRICT MEMORIAL HOSPITAL	 HOSPITAL:SHOALHAVEN DISTRICT MEMORIAL HOSPITAL
1095	 294	 DR VIVIANNE Eora Basta	 DOCTOR:VIVIANNE Eora Basta
1095	 343	 Distribution:   FILE-COPY,   NSW-CANCER-REGISTRY	 PHI:Null
1095	 353	 CLINICAL:	 PHI:Null
1095	 502	 69 yr old women with grade 3 endometrioid adeno-carcinoma of uterus.  TAH, BSO, washings, bilateral external and internal pelvic nodal dissection.	 AGE:69
1095	 515	 MACROSCOPIC:	 PHI:Null
1095	 1427	 A.  Specimen labelled "Uterus, cervix, bilateral tubes and ovaries", consists of total hysterectomy with attached tubes and ovaries the uterus measures 95 x 50 x 20mm andweighs 70g. and has a smooth and shiny serosal surface, the cervix measures 20 x 20mm and has an unremarkable surface.  The endometrial cavity it totally filled an exophytic friable tumour.  The endometrium has a maximum thickness of 10mm and the myometrium at the level of the tumour has a maximum thickness of 3mm.  The right fallopian tube and fimbrial measure 50mm in length and 5mm in maximum diameter and appears unremarkable.  The right ovary measures 30 x 15 x 15mmon sectioning there is a cyst filled with yellow creamy material, the cyst measures 20mm in maximum diameter.  The right fallopian tube and fimbrial measure 55mm in length and 5mm in maximum diameter.  The left ovary measures 30 x 15 x 15mm and appears unremarkable.	 PHI:Null
1095	 1962	 Blocks: 1 to 4 - one full longitudinal section of anterior body and cervix; 5and 6 - two representative sections of anterior endomyometrium; 7 to 11 - one full longitudinal section of posterior body and cervix; 11 and 12- two representative sections of posterior endomyometrium; 13 - right cornu; 14 - left cornu; 15 - right parametrial tissue; 16 - left parametrial tissue; 17 - 2LS right fimbria and 1TS right fallopian tube; 18 - 2LS left fimbria and 1TS left fallopian tube; 19 to 21 ovary with cystic lesion; 22 - left ovary; AE.	 PHI:Null
1095	 2090	 B.  Specimen labelled "Right obturator lymph node", consists of a large fatty lymph node measuring 40 x 10 x 10mm AE 3 blocks.	 PHI:Null
1095	 2241	 C.  Specimen labelled "Left external iliac lymph node", consists of a piece of fatty tissue containing two lymph nodes 5 and 15mm in maximum diameter.	 PHI:Null
1095	 2324	 Blocks: 1 - one lymph node; 2 - one bisected lymph node; 3 - rest of fatty tissue.	 PHI:Null
1095	 2451	 D.  Specimen labelled "Left obturator lymph node", consists of four lymph nodes measuring from 10 to 35mm in maximum diameter.	 PHI:Null
1095	 2538	 Blocks: 1 - two lymph nodes; 2 - one bisected lymph node; 3 - one bisected lymph node.	 PHI:Null
1095	 2699	 E.  Specimen labelled "Right external lymph node", consists of a piece of fatty tissue 50 x 10 x 10mm containing five lymph nodes 5 to 10mm in maximum diameter.	 PHI:Null
1095	 2777	 Blocks: 1 - three lymph nodes; 2 - two lymph nodes; 3 - rest of fatty tissue.	 PHI:Null
1095	 2800	 (TO: TZ;GQ/vo 12.9.63)	 DOCTOR:TZ
1095	 2800	 (TO: TZ;GQ/vo 12.9.63)	 DOCTOR:GQ
1095	 2800	 (TO: TZ;GQ/vo 12.9.63)	 DATE:12.9.63=>2063-09-12
1095	 2840	 MICROSCOPIC (Reported by Dr F Loftin):	 DOCTOR:F Lofti
1095	 3125	 A. Sections show a grade 2 endometrioid adenocarcinoma involving the anterior and posterior uterine walls. 80% of the lesion has a complex glandular architecture and 20% of the lesion has a solid architecture. There is no convincing severe nuclear atypia, in keeping with agrade of 2.	 PHI:Null
1095	 3232	 At the deepest point of invasion in the anterior wall, the lesion has invaded 6 mm into a wall 10mm thick.	 PHI:Null
1095	 3309	 There is no evidence of lymphovascular invasion or invasion into the cervix.	 PHI:Null
1095	 3372	 Theovaries and fallopian tubes show no evidence of malignancy.	 PHI:Null
1095	 3500	 A 20mm mature cystic teratoma composed of a cyst lined by squamous epithelium and adipose tissue is present in the right ovary.	 PHI:Null
1095	 3538	 Adenomyosis is seen in themyometrium.	 PHI:Null
1095	 3595	 There is no evidence of CIN or HPV effect in the cervix.	 PHI:Null
1095	 3619	 Shown to Dr Dewey GEDE.	 DOCTOR:Dewey GEDE
1095	 3661	 Mismatch Repair Deficiency (MMRD) Status	 PHI:Null
1095	 3694	 MLH1  Preserved nuclear staining	 PHI:Null
1095	 3727	 PMS2  Preserved nuclear staining	 PHI:Null
1095	 3760	 MSH2  Preserved nuclear staining	 PHI:Null
1095	 3881	 MSH6  Loss of nuclear staining (repeated twice, satisfactory staining seen in   internal and external positive controls)	 SET:twice=>R2
1095	 3890	 Comment:	 PHI:Null
1095	 4158	 Absence (loss) of nuclear staining for any of the mismatch repair enzymes MLH1, PMS2, MSH2 or MSH6 is associated with microsatellite instability phenotype (MSI), and may reflect the presence of a germline mutation or somatic inactivation of that mismatch repair gene.	 PHI:Null
1095	 4220	 B. Sections show 1 lymph node with no evidence of malignancy.	 PHI:Null
1095	 4283	 C. Sections show 2 lymph nodes with no evidence of malignancy.	 PHI:Null
1095	 4346	 D. Sections show 4 lymph nodes with no evidence of malignancy.	 PHI:Null
1095	 4409	 E. Sections show 5 lymph nodes with no evidence of malignancy.	 PHI:Null
1095	 4419	 DIAGNOSIS	 PHI:Null
1095	 4477	 A. Uterus, cervix, bilateral fallopian tubes and ovaries:	 PHI:Null
1095	 4628	 - Grade 2 endometrioid adenocarcinoma, invading the outer half of the uterine wall (6mm into a wall 10mm thick), no lymphovascular invasion identified	 PHI:Null
1095	 4697	 - Cervix, ovaries and fallopian tubes with no evidence of malignancy	 PHI:Null
1095	 4749	 - Mature cystic teratoma (dermoid cyst) right ovary	 PHI:Null
1095	 4887	 B to E. Right obturator, left external iliac, left obturator and right external lymph nodes: 12lymph nodes with no evidence of malignancy	 PHI:Null
1096	 25	 Episode No:  48G138354F	 IDNUM:48G138354F
1096	 37	 4821383.OMF	 MEDICALRECORD:4821383.OMF
1096	 51	 Wald, Derek	 PATIENT:Wald, Derek
1096	 78	 Lab No:  48G13835,48G13835	 IDNUM:48G13835
1096	 78	 Lab No:  48G13835,48G13835	 IDNUM:48G13835
1096	 93	 Pleasant Chase	 STREET:Pleasant Chase
1096	 116	 CAMDEN HAVEN  SA  4492	 CITY:CAMDEN HAVEN
1096	 116	 CAMDEN HAVEN  SA  4492	 STATE:SA
1096	 116	 CAMDEN HAVEN  SA  4492	 ZIP:4492
1096	 142	 Specimen: Washings,Tissue	 PHI:Null
1096	 160	 D.O.B:  3/11/1982	 DATE:3/11/1982=>1982-11-03
1096	 168	 Sex:  F	 PHI:Null
1096	 199	 Collected: 25/06/2013 at 18:09	 TIME:25/06/2013 at 18:09=>2013-06-25T18:09
1096	 237	 Location:PARKES8 - LONGREACH HOSPITAL	 DEPARTMENT:PARKES8
1096	 237	 Location:PARKES8 - LONGREACH HOSPITAL	 HOSPITAL:LONGREACH HOSPITAL
1096	 258	 DR Sybil Sherley KET	 DOCTOR:Sybil Sherley KET
1096	 284	 Distribution:   FILE-COPY	 PHI:Null
1096	 315	 SUPPLEMENTARY REPORT (6.9.63):	 DATE:6.9.63=>2063-09-06
1096	 317	 	 PHI:Null
1096	 327	 CLINICAL:	 PHI:Null
1096	 349	 Endometrial cancer.	 PHI:Null
1096	 362	 MACROSCOPIC:	 PHI:Null
1096	 1824	 A.  Specimen labelled "Uterus, tubes, ovaries, cervix", consists of a uterus with attached bilateral fallopian tubes and ovaries weighing 101g in total.  The uterus measures 80 x 45 x 45mm and has a smooth shiny serosal surface apart from an area on the posterior surface which appears dull and roughened (15 x 20mm).   The ectocervix measures 35 x 20mm and has a haemorrhagic surface.  The endometrium has an exophytic tan polypoid tumour over the anterior and posterior surfaces of the body and fundus.  The protrusions are over an area of 40 x 60mm (posterior) and 40 x 35mm (anterior).  The polyps measure up to 30mm tall by 40mm diameter.  Deep to the point of attachment of the polyps there is apparent tumour invasion into the superficial myometrium.  The endometrium away from the polyps is 2mm in maximum thickness and the myometrium is 12mm in maximum thickness.  The myometrium is unremarkable.  The right fallopian tube measures 48mm in length by 5 x 5mm in maximum diameter.  The right ovary measures 20 x 15 x 8mm andhas an unremarkable cut surface.  The left fallopian tube measures 58mm in length x 5 x 4mm in maximum diameter.  The left ovary is 15 x 12 x 10mm and has an unremarkable cut surface.  Blocks 1-3 - full LS of anterior body and cervix; 4-8 - anterior body polyps, AE; 9-11 - full LS of posterior body and cervix; 12-19 - posterior polyps, AE; 20 -right fallopian tube; 21 - right ovary; 22 - left fallopian tube; 23 - left ovary.	 PHI:Null
1096	 2117	 B.  Specimen labelled "Right external iliac lymph nodes", consists of a piece of fibrofatty tissue measuring 90 x 50 x 10mm.  There are three lymph nodes identified measuringfrom 5-28mm in maximum dimension.  Block 1 & 2 - paired blocks one lymph node; 3 - one lymph node; 4 - one lymph node.	 PHI:Null
1096	 2380	 C. Specimen labelled "Left external iliac lymph nodes", consists of a piece of fibrofatty tissue measuring 75 x 40 x 10mm.  There are four lymph nodes identified from 3-28mm in maximum dimension.  Block 1 - three lymph nodes; 2 & 3- paired blocks one lymph node.	 PHI:Null
1096	 2731	 D.  Specimen labelled "Right obturator lymph nodes", consists of two pieces of fibrofatty tissue measuring 50 x 35 x 12mm and 25 x 10 x 5mm.  The largest fragment has one lymph node, 40mm in maximum dimension. The smaller fragment has one lymph node 20mm in maximum dimension.  Blocks 1 & 2- paired blocks one lymph node; 3 - one lymph node bisected.	 PHI:Null
1096	 2998	 E.  Specimen labelled "Left obturator lymph node", consists of a piece of fibrofatty tissue measuring 35 x 25 x 10mm.  There is one lymph node identified measuring 25mm in maximum dimension.  Block 1 & 2- paired blocksone lymph node; 3 - rest of fibrofatty tissue.	 PHI:Null
1096	 3149	 F.  Specimen labelled "Left obturator suspicious node", consists of a lymph node covered in fibrofatty tissue measuring 15 x 10 x 6mm.  Specimen TAE.	 PHI:Null
1096	 3173	 (TO: JL;JL/ec 29.8.63)	 DATE:29.8.63=>2063-08-29
1096	 3175	 	 PHI:Null
1096	 3215	 MICROSCOPIC: (Reported by Dr K Vizarro)	 DOCTOR:K Vizarro
1096	 3738	 A.  Sections show a grade 3 endometroid adenocarcinoma of endometrium.  This involves all the described polypoid tissue and invades superficially into myometrium.  The tumour is architectural grade 2 but cytologic grade 3, overall grade 3.  Maximum depth of myometrial invasion is 2mm where total myometrial thickness is 15mm.  No lymphovascular invasion is seen.  There is no cervical involvement.  Endometrium away from the tumour is thin and inactive.  Sections of the ovaries and fallopian tubes are unremarkable.	 PHI:Null
1096	 3796	 B.  Sections show three lymph nodes.  No tumour is seen.	 PHI:Null
1096	 3852	 C.  Sections show four lymph nodes.  No tumour is seen.	 PHI:Null
1096	 3908	 D.  Sections show two lymph nodes.  No tumour is seen.	 PHI:Null
1096	 3963	 E.  Sections show one lymph node.  No tumour is seen.	 PHI:Null
1096	 4019	 F.  Sections show one lymph node.  No tumour is seen.	 PHI:Null
1096	 4032	 DIAGNOSIS:	 PHI:Null
1096	 4176	 A.  Uterus, ovaries and fallopian tubes:  Grade 3 endometroid adenocarcinoma of endometrium with superficial myometrial invasion.  Stage 1A.	 PHI:Null
1096	 4234	 B.  Right external iliac lymph nodes:  No tumour (0/3).	 PHI:Null
1096	 4289	 C.  Left external iliac lymph nodes:  No tumour (0/4).	 PHI:Null
1096	 4340	 D.  Right obturator lymph nodes:  No tumour (0/2).	 PHI:Null
1096	 4390	 E.  Left obturator lymph node:  No tumour (0/1).	 PHI:Null
1096	 4442	 F.  Left obturator lymph node:  No tumour (0/1).	 PHI:Null
1096	 4473	 SUPPLEMENTARY REPORT (6.9.63):	 DATE:6.9.63=>2063-09-06
1096	 4524	 A.  Immunostains have been performed as requested.	 PHI:Null
1096	 4560	 MLH1:   Preserved nuclear staining.	 PHI:Null
1096	 4596	 PMS2:   Preserved nuclear staining.	 PHI:Null
1096	 4632	 MSH2:   Preserved nuclear staining.	 PHI:Null
1096	 4668	 MSH6:   Preserved nuclear staining.	 PHI:Null
1096	 4840	 Preserved nuclear staining of a carcinoma for the mismatch repair enzymes MLH1, PMS2,MSH2 and MSH6 indicates a low likelihood of microsatellite instabilityphenotype (MSI).	 PHI:Null
1096	 5096	 Concern was also raised at the Gynaecologic Oncology Multidisciplinary meeting on 3.9.63 about the low number of lymph nodes found.  Thelymph node specimens with remaining tissue (specimens B, C and D) weretherefore re-examined and further sections taken.	 DATE:3.9.63=>2063-09-03
1096	 5188	 One further node was found in specimen B (right external iliac) and this is free of tumour.	 PHI:Null
1096	 5288	 Two further nodes were found in specimen C (left external iliac) and these are both free of tumour.	 PHI:Null
1096	 5349	 No further nodes were found in specimen D (right obturator).	 PHI:Null
1096	 5351	 	 PHI:Null
1096	 5354	 	 PHI:Null
1096	 5356	 	 PHI:Null
1098	 24	 Episode No:  96C259313O	 IDNUM:96C259313O
1098	 36	 9602593.DIO	 MEDICALRECORD:9602593.DIO
1098	 62	 ZULKOWSKI, Chi Georgine	 PATIENT:ZULKOWSKI, Chi Georgine
1098	 80	 Lab No:  96C25931	 IDNUM:96C25931
1098	 89	 Roseglen	 STREET:Rosegle
1098	 114	 BACCHUS MARSH  VIC  2258	 CITY:BACCHUS MARSH
1098	 114	 BACCHUS MARSH  VIC  2258	 STATE:VIC
1098	 114	 BACCHUS MARSH  VIC  2258	 ZIP:2258
1098	 131	 Specimen: Tissue	 PHI:Null
1098	 149	 D.O.B:  17/1/2003	 DATE:17/1/2003=>2003-01-17
1098	 157	 Sex:  F	 PHI:Null
1098	 183	 Collected: 9/10/2063 at :	 DATE:9/10/2063=>2063-09-10
1098	 229	 Location:  MACQUARIE WARD - BARALABA HOSPITAL	 DEPARTMENT:MACQUARIE WARD
1098	 229	 Location:  MACQUARIE WARD - BARALABA HOSPITAL	 HOSPITAL:BARALABA HOSPITAL
1098	 254	 DR Kiesha Gracia LIEGLER	 DOCTOR:Kiesha Gracia LIEGLER
1098	 303	 Distribution:   FILE-COPY,   NSW-CANCER-REGISTRY	 PHI:Null
1098	 330	 ADDITIONAL REPORT (9/2/63)	 DATE:9/2/63=>2063-09-02
1098	 341	 CLINICAL:	 PHI:Null
1098	 438	 Laparotomy.  Debulking procedure.  Tumour debulking of recurrence of ovarian cancer 23yrs ago.	 DURATION:23yrs=>P23Y
1098	 451	 MACROSCOPIC:	 PHI:Null
1098	 717	 A.  Specimen labelled "Pelvic peritoneum" specimen received fresh for frozen section and consists of one piece of tissue measuring 50 x 15 x 10mm with multiple small nodules measuring up to 6mm in maximum diameter.  Two small nodules are sampled for frozen section.	 PHI:Null
1098	 778	 Blocks: 1 - frozen section; 2 & 3 - rest of frozensection.	 PHI:Null
1098	 801	 FROZEN SECTION REPORT:	 PHI:Null
1098	 848	 Papillary serous carcinoma.  Adenocarcinoma.	 PHI:Null
1098	 900	 Result to Surgical Fellow at 3.40pm by Dr Z Buzard	 TIME:at 3.40pm=>15:40
1098	 900	 Result to Surgical Fellow at 3.40pm by Dr Z Buzard	 DOCTOR:Z Buzard
1098	 903	 	 PHI:Null
1098	 1112	 B.  Specimen labelled "Left peritoneal side wall nodule" consists of anodular piece of tissue measuring 45 x 40 x 15mm.  On sectioning there is a large nodular gritty mass.  Representative sections 1 block.	 PHI:Null
1098	 1384	 C.  Specimen labelled "Omentum" consists of a large piece of omentum with multinodular appearance.  On sectioning multiple white gritty nodules are identified.  Representative sections 2 blocks.  (GM/ta  9/11/63)  ;3 to 7 - five more representative sections from omentum.	 DOCTOR:GM
1098	 1384	 C.  Specimen labelled "Omentum" consists of a large piece of omentum with multinodular appearance.  On sectioning multiple white gritty nodules are identified.  Representative sections 2 blocks.  (GM/ta  9/11/63)  ;3 to 7 - five more representative sections from omentum.	 DATE:9/11/63=>2063-09-11
1098	 1388	 	 PHI:Null
1098	 1564	 D.  Specimen labelled "Nodule sub umbilical " consists of a nodular piece of tissue 30 x 20 x 10mm.  The cut surface is white and gritty.  Representative sections in 1 block.	 PHI:Null
1098	 1757	 E.  Specimen labelled "Peritoneal nodule" consists of multiple nodular pieces of tissue measuring up to 10mm.  The cut surface is white, solid and gritty.  Representative sections in 1 block.	 PHI:Null
1098	 1951	 F.  Specimen labelled "Tumour descending colon" consists of a large nodule measuring 50 x 40 x 20mm.  The cut surface is white, solid with gritty consistence.  Representative sections 1 block.	 PHI:Null
1098	 2331	 G.  Specimen labelled "Rectal sigmoid colon and pelvic tumour" consists of an orientated segment of colon measuring 210mm (proximal to distal) x up to 70mm in maximum diameter.  The pericolic fat is multinodular.  The mucosal surface of the colon is unremarkable.  On sectioning the pericolic fat has multiple white and gritty nodules.  Two representative sections in 2 blocks.	 PHI:Null
1098	 2481	 H.  Specimen labelled "Liver capsule lesion" consists of a nodular piece of tissue 20 x 15 x 10mm.  The cut surface is white andgritty.   AE 1 block.	 PHI:Null
1098	 2613	 I.  Specimen labelled "Duodenal nodule" consists of a nodular piece of tissue 10 x 10  x 7mm.  Representative sections in 1 block.	 PHI:Null
1098	 3078	 J.  Specimen labelled "Terminal ileum and caecum" consists of a segment of looped  terminal ileum and caecum measuring 250mm in length and up to 70mm in maximum diameter.  On sectioning the pericolic fat has multiple white, firm nodules.  The mucosal surface of the terminal ileum and the caecum is unremarkable.  Onsectioning the nodules of the pericolic fat are white gritty and solid.  Representative sections in 4 blocks (1 - small bowel, 2to 4 large bowel).	 PHI:Null
1098	 3232	 K.  Specimen labelled "Donut" consists of a donut of intestinemeasuring 5mm in length and up to 15mm in maximum diameter.  AE 1 block.  (JO/ta  9/11/63)	 DOCTOR:JO
1098	 3232	 K.  Specimen labelled "Donut" consists of a donut of intestinemeasuring 5mm in length and up to 15mm in maximum diameter.  AE 1 block.  (JO/ta  9/11/63)	 DATE:9/11/63=>2063-09-11
1098	 3272	 MICROSCOPIC (Reported by Dr Z Brokke):	 DOCTOR:Z Brokke
1098	 3570	 A to F, H and I. Sections show deposits of well differentiated serous adenocarcinoma within fat and also on the peritoneal surface.The lesion is composed of papillae lined by columnar tumour cells with mild to moderate atypia, surrounded by desmoplastic stroma.  Numerous psammoma bodies are seen.	 PHI:Null
1098	 3757	 G. Sections show well differentiated serous adenocarcinoma in pericolic fat.  The lesion is abutting the muscularis propria.  There is no evidence of direct invasion into the bowel wall.	 PHI:Null
1098	 3977	 J. Sections show differentiated serous adenocarcinoma. The lesion has invaded through the muscularis propria, into the submucosa of the terminal ileum. Invasion into the muscularis propria of the caecum is also present.	 PHI:Null
1098	 4118	 K. Sections show a microscopic deposit of well differentiated serous adenocarcinoma, measuring 1.5 mm, in the pericolic fibroadipose tissue.	 PHI:Null
1098	 4146	 Shown to Dr KATHRYN Tehney.	 DOCTOR:KATHRYN Tehney
1098	 4157	 DIAGNOSIS:	 PHI:Null
1098	 4356	 A to J. Pelvic peritoneum, left peritoneal side wall nodule, omentum, sub-umbilical nodule, peritoneal nodule, descending colon, recto-sigmoid: and pelvic tumour, liver capsule and duodenal nodule:	 PHI:Null
1098	 4400	 - Well differentiated serous adenocarcinoma	 PHI:Null
1098	 4495	 K. Donut: microscopic deposit of well differentiated serous adenocarcinoma in pericolic tissue	 PHI:Null
1098	 4524	 ADDITIONAL REPORT (18/9/63)	 DATE:18/9/63=>2063-09-18
1098	 4574	 Immunohistochemistry performed on request by MDT:	 PHI:Null
1098	 4589	 ER:   Positive	 PHI:Null
1098	 4614	 100 % of nuclei stained	 PHI:Null
1098	 4658	 predominant intensity of staining:  strong	 PHI:Null
1098	 4673	 PR:   Positive	 PHI:Null
1098	 4697	 20 % of nuclei stained	 PHI:Null
1098	 4743	 predominant intensity of staining:  moderate	 PHI:Null
1098	 4770	 ADDITIONAL REPORT (9/2/63)	 DATE:9/2/63=>2063-09-02
1098	 4813	 Mismatch Repair Deficiency (MMRD) Status	 PHI:Null
1098	 4846	 MLH1  Preserved nuclear staining	 PHI:Null
1098	 4879	 PMS2  Preserved nuclear staining	 PHI:Null
1098	 4912	 MSH2  Preserved nuclear staining	 PHI:Null
1098	 4945	 MSH6  Preserved nuclear staining	 PHI:Null
1098	 4954	 Comment:	 PHI:Null
1098	 5094	 Preserved nuclear staining of a carcinoma for MLH1, PMS2, MSH2 and MSH6 indicates a low likelihood of microsatellite instability phenotype.	 PHI:Null
1099	 25	 Episode No:  17T850261Z	 IDNUM:17T850261Z
1099	 37	 1778502.SDZ	 MEDICALRECORD:1778502.SDZ
1099	 54	 WANKE, ORIELLA	 PATIENT:WANKE, ORIELLA
1099	 81	 Lab No:  17T85026,17T85026	 IDNUM:17T85026
1099	 81	 Lab No:  17T85026,17T85026	 IDNUM:17T85026
1099	 94	 Forest Knoll	 STREET:Forest Knoll
1099	 136	 TAREE  Australian Capital Territory  3792	 CITY:TAREE
1099	 136	 TAREE  Australian Capital Territory  3792	 STATE:Australian Capital Territory
1099	 136	 TAREE  Australian Capital Territory  3792	 ZIP:3792
1099	 162	 Specimen: Washings,Tissue	 PHI:Null
1099	 180	 D.O.B:  24/1/2002	 DATE:24/1/2002=>2002-01-24
1099	 188	 Sex:  F	 PHI:Null
1099	 214	 Collected: 17/9/2063 at :	 DATE:17/9/2063=>2063-09-17
1099	 255	 Location:  SA Pathology -GYMPIE HOSPITAL	 DEPARTMENT:SA Pathology
1099	 255	 Location:  SA Pathology -GYMPIE HOSPITAL	 HOSPITAL:GYMPIE HOSPITAL
1099	 280	 DR BRITNEY Shonda Morenz	 DOCTOR:BRITNEY Shonda Morenz
1099	 329	 Distribution:   FILE-COPY,   NSW-CANCER-REGISTRY	 PHI:Null
1099	 361	 SUPPLEMENTARY REPORT (11.3.64):	 DATE:11.3.64=>2064-03-11
1099	 363	 	 PHI:Null
1099	 373	 CLINICAL:	 PHI:Null
1099	 495	 Large pelvic mass of ? origin.  RA.  Previous stroke.  En block resection of uterus, upper vagina and adnexae and rectum.	 PHI:Null
1099	 695	 Further information obtained:  The two separate segments of bowel in specimen B are in continuity, the smaller being distal.  Residual tumour present in the pelvis extensively surrounding specimen.	 PHI:Null
1099	 708	 MACROSCOPIC:	 PHI:Null
1099	 843	 A.  Specimen labelled "Pelvic mass", consists of two tan solid fragments 25 x 20 x 10mm in aggregate.  AE 2 blocks for frozen section.	 PHI:Null
1099	 866	 FROZEN SECTION REPORT:	 PHI:Null
1099	 950	 Carcinoma - differential diagnosismalignant Brenner or transitional cell carcinoma.	 PHI:Null
1099	 1033	 Phone result to fellow (gynae/onc) by Dr E Thornburg/E Ziegler at 3:30 on 15.07.13	 DOCTOR:E Thornburg
1099	 1033	 Phone result to fellow (gynae/onc) by Dr E Thornburg/E Ziegler at 3:30 on 15.07.13	 DOCTOR:E Ziegler
1099	 1033	 Phone result to fellow (gynae/onc) by Dr E Thornburg/E Ziegler at 3:30 on 15.07.13	 TIME:3:30 on 15.07.13=>2013-07-15T03:30
1099	 2979	 B.  Specimen labelled "Uterus, cervix, tubes, ovaries, rectosigmoid", consists of a specimen of uterus (80 x 60 x 40mm) with attached cervix (ectocervix 45 x 25mm), upper vagina (60 x 30mm), a segment of rectum (210mm in length). There is a solid friable tumour extending from serosal surface of the uterus to the wall of the rectum measuring approximately 110 x 90 x 85mm.  The tumour is seen at the distal cut end of the rectal segment and adjacent to the resection margin of the vagina.  There is a separate segment of rectum 60mm in length with tumour attached to its serosal surface measuring 75 x 70 x 55mm.  The tumour has a pale and friable cut surface.  The ? left fallopian tube is 42mm in length and up to 12mm in diameter.  The left ovary measures 28 x 25 x 20mm and is 4mm from the tumour.  The left ovary has a solid cut surface.  Theright ovary measures 28 x 25 x 15mm and has a solid cut surface.  The right ovary is adjacent to the tumour. The right fallopian tube is not identified.  Within the larger segment the tumour appears to be abutting the rectal serosa butis not infiltrating through the muscularis propria. Within the smaller piece the tumour appears to have penetrated through the muscularis propria but is not involving the mucosa.   Block 1 - proximal rectal margin; 2 - LS,distal rectal cut end (the larger piece); 3 & 4- LS, vaginal margin; 5-7 - full LS of anterior body and cervix (part of the posterior myometrium is also included); 8-13 - full LS of posterior body and cervix showing serosaladherence of tumour; 14 - ? left fallopian tube; 15-17 - sections of left ovary and adjacent tumour; 18 & 19 - right ovary and tumour; 20 - section of rectum and adjacent tumour, larger piece; 21 - section of tumour, reserve block; 22 - one rectal mesenteric lymph node; 23 & 24 - LS, two cut ends of the rectum in the smaller piece; 25 & 26 - representative smaller piece; 27 - peripheral margin, smaller piece.	 PHI:Null
1099	 3112	 C.  Specimen labelled "Omentum", consists of a piece of omental fatty tissue 175 x 95 x 12mm.  On slicing no nodules are identified.	 PHI:Null
1099	 3147	 Blocks: 1 to 3 - random sections;	 PHI:Null
1099	 3323	 D.  Specimen labelled "Left external iliac lymph node", consists of fatty tissue 45 x 45 x 10mm in aggregate containing one lymph nodes the largest 20mm in maximum dimensions.	 PHI:Null
1099	 3369	 Blocks: 1 & 2 - lymph nodes.  (HM/ec 19.9.63)	 DATE:19.9.63=>2063-09-19
1099	 3427	 MICROSCOPIC (reported by Dr E Bourgeois & Dr E Heriford):	 DOCTOR:E Bourgeois
1099	 3427	 MICROSCOPIC (reported by Dr E Bourgeois & Dr E Heriford):	 DOCTOR:E Heriford
1099	 3488	 A.  Sections show sections show transitional cell carcinoma.	 PHI:Null
1099	 4678	 B.Sections show transitional cell carcinoma with malignant cells arranged in papillae and solid nests with widespread necrosis.  Carcinoma extensively surrounds the uterus, cervix, vagina cuff, adnexal structures and bowel, extending to peripheral margins over a broad front.  The carcinoma extends through the colorectal muscularis propria and submucosa into the lamina propria but does not breach the epithelium.  Tumour is present at all the colorectal cut ends except the proximal margin.  The carcinoma infiltrates the submucosal stroma of the vagina and is focally present at the disrupted vaginal cuff margin.  Sections of uterus show infiltration of carcinoma through the serosa and into the myometrium posteriorly.  Incidental foci of adenomyosis are present.  Both ovaries are identified and although extensively surrounded by tumour, otherwise appear normal.  No benign Brenner tumour is identified.  The fallopian tubes show no significant abnormality.  The endometrium is proliferative and the cervix shows no significant abnormality.  The mesenteric lymph node identified shows no evidence of malignancy.  The tumour shows positive staining with CK7 and is negative for CK20.	 PHI:Null
1099	 4919	 COMMENT:  The primary site of tumour cannot be determined and the ovaries appear normal.  The immunohistochemical profile is consistent with agynaecological primary however, bladder transitional cell carcinoma should be excluded clinically.	 PHI:Null
1099	 5013	 C.  Sections of omentum show no significant abnormality.  There is no evidence of malignancy.	 PHI:Null
1099	 5122	 D.  The six (6) lymph nodes identified show no significant abnormality.  There is no evidence of malignancy.	 PHI:Null
1099	 5133	 DIAGNOSIS:	 PHI:Null
1099	 5237	 A - D.  Pelvic mass, uterus, cervix, ovaries and fallopian tubes, bowel, omentum and iliac lymph nodes:	 PHI:Null
1099	 5347	 - Transitional cell carcinoma, primary site undetermined (see comment)Positive bowel and vaginal cuff margins	 PHI:Null
1099	 5382	 - Positive circumferential margins	 PHI:Null
1099	 5401	 - Omentum negative	 PHI:Null
1099	 5430	 - Seven negative lymph nodes	 PHI:Null
1099	 5476	 SUPPLEMENTARY REPORT (11.3.64, Dr E Eriksen):	 DATE:11.3.64=>2064-03-11
1099	 5476	 SUPPLEMENTARY REPORT (11.3.64, Dr E Eriksen):	 DOCTOR:E Erikse
1099	 5555	 B.  Immunostains for mismatch repair enzymes have been performed as requested.	 PHI:Null
1099	 5591	 MLH1:   Preserved nuclear staining.	 PHI:Null
1099	 5627	 PMS2:   Preserved nuclear staining.	 PHI:Null
1099	 5663	 MSH2:   Preserved nuclear staining.	 PHI:Null
1099	 5699	 MSH6:   Preserved nuclear staining.	 PHI:Null
1099	 5873	 Preserved nuclear staining of a carcinoma for the mismatch repair enzymes MLH1, PMS2, MSH2 and MSH6 indicates a low likelihood of microsatellite instability phenotype (MSI).	 PHI:Null
1100	 25	 Episode No:  75Q870329I	 IDNUM:75Q870329I
1100	 37	 7568703.HZI	 MEDICALRECORD:7568703.HZI
1100	 55	 Hysinger, Kaila	 PATIENT:Hysinger, Kaila
1100	 73	 Lab No:  75Q87032	 IDNUM:75Q87032
1100	 84	 North Napa	 STREET:North Napa
1100	 132	 TEA GARDENS  Australian Capital Territory  6957	 CITY:TEA GARDENS
1100	 132	 TEA GARDENS  Australian Capital Territory  6957	 STATE:Australian Capital Territory
1100	 132	 TEA GARDENS  Australian Capital Territory  6957	 ZIP:6957
1100	 149	 Specimen: Tissue	 PHI:Null
1100	 168	 D.O.B:  26/11/2004	 DATE:26/11/2004=>2004-11-26
1100	 176	 Sex:  F	 PHI:Null
1100	 202	 Collected: 26/9/2063 at :	 DATE:26/9/2063=>2063-09-26
1100	 265	 Location:  PaLMS - WESTERN DISTRICT HEALTH SERVICE - PENSHURST	 DEPARTMENT:PaLMS
1100	 265	 Location:  PaLMS - WESTERN DISTRICT HEALTH SERVICE - PENSHURST	 HOSPITAL:WESTERN DISTRICT HEALTH SERVICE - PENSHURST
1100	 295	 DR JACINTO EMMANUEL Cianflone	 DOCTOR:JACINTO EMMANUEL Cianflone
1100	 344	 Distribution:   FILE-COPY,   NSW-CANCER-REGISTRY	 PHI:Null
1100	 354	 CLINICAL:	 PHI:Null
1100	 549	 Adenocarcinoma - metastatic ovarian.  Uterus, bilateral ovaries and cervix from interval debulking after 3 cycles of chemo for adenocarcinoma - metastatic ovarian, diagnosed from paracentesis.	 PHI:Null
1100	 562	 MACROSCOPIC:	 PHI:Null
1100	 2056	 A.  Specimen labelled "Uterus, tubes, ovaries, cervix" consists of a uterus with attached cervix, bilateral fallopian tubes and ovaries weighing 282g in total.  The uterus measures 75 x 40 x 24mm and has an unremarkable serosal surface.  The ectocervix measures 32 x 22mm and has an unremarkable surface.  On sectioning the endometrium is 2mm and the myometrium is 14mm in maximum thickness.  The myometrium anteriorly has a cystic structure measuring 6 x 5 x 3mm; this is filled with papillary projections.  The rest of the myometrium is unremarkable.  The posterior cervix has fibrofatty tissue attached to the midline and leftside posteriorly; this measures 50 x 50 x 20mm and it contains around ten solid tan nodules ranging from 6mm to 25mm in maximum dimension.  The nodules are well circumscribed.  The right fallopian tube measures 60mm in length x 6 x 6mmin maximum diameter.  The right ovary measures 70 x 50 x 48mm and has multiple solid and cystic areas.  On sectioning the ovary has multiple smooth lined cystic spaces filled with haemorrhagic serous fluid with more solid cystic areas filled with pale solid and papillary excrescences.  The left fallopian tube is 70mm in length and 7 x 5mm in maximum diameter.  The left ovary is 105 x 70 x 45mm and has a nodular cystic appearance.  The cut surface shows dilated cystic spaces filled with blood stained serous fluid and tan papillary projections, and also solid areas.  The cystic spaces range from 3mm to 25mm in diameter.	 PHI:Null
1100	 2544	 Blocks:  1 to 4 - full longitudinal section of anterior body and cervix; 5 to8 - full longitudinal section of posterior body, cervix and posterior soft tissue; 9 - right fallopian tube; 10 to 15 - representative right ovary; 16 - left fallopian tube; 17 to 26 - representative left ovary; 27 to 33 - nodules/lymph nodes (27- one lymph node bisected, 28 - three lymph nodes; 29 - one lymph node; 30 - three lymph nodes; 31 - one lymph node trisected; 32 & 33 - one lymph node trisected.	 PHI:Null
1100	 2836	 B.  Specimen labelled "Omentum" consists of apiece of fibrofatty tissue measuring 290 x 55 x 20mm.  No discrete nodules or lymph nodes are identified.  There is one pale nodule 2mm in maximum dimension found in the periphery of the omentum; this is in block 2.  Representative in 3 blocks.	 PHI:Null
1100	 2951	 C  Specimen labelled "Rectal nodule" consists of a grey/tan piece of tissue measuring 8 x 6 x 3mm.  BAE 1 block.	 PHI:Null
1100	 3094	 D.  Specimen labelled "Pouch of Douglas" consists of a grey/tan piece of tissue measuring 15 x 8 x 5mm.  AE 1 block.  (TO: JL; JL/mm 26.9.63)	 DATE:26.9.63=>2063-09-26
1100	 3134	 MICROSCOPIC (reported by Dr S Jordan):	 DOCTOR:S Jorda
1100	 3610	 A.  A section of the posterior cervix shows a deposit of metastatic moderately differentiated serous carcinoma on the adventitial surface.  The cervix is otherwise unremarkable.  Sections of the described nodules in the fat attached to the posterior cervix show that these are deposits of metastatic moderately differentiated serous carcinoma.  There are numerous psammoma bodies.  No histologic features of lymph nodes are seen in association with these tumour deposits.	 PHI:Null
1100	 3844	 Sections of the endometrium show small areas of involvement by serous carcinoma on the anterior and posterior walls; nodefinite myometrial invasion from the endometrial tumour is seen.The endometrium elsewhere is thin and inactive.	 PHI:Null
1100	 3978	 In the outermyometrium and in subserosal tissue of the anterior uterus there are several deposits of metastatic serous carcinoma.	 PHI:Null
1100	 4531	 Sections of the right fallopian tube are unremarkable.  Sections of the right ovary show extensive involvement by moderately differentiated serous carcinoma.  Tumour is presenton the serosa of the ovary.  Sections of the right fallopian tube show serous carcinoma involving the fimbrial end and also part of the more proximal tube.  Sections of the left ovary show extensive involvement by moderately differentiated serous carcinoma.  There is evidence of only mild chemotherapy effect on the tumour in the ovaries, left fallopian tube and elsewhere.	 PHI:Null
1100	 4774	 B.  Sections of the described nodule show a deposit of metastatic serous carcinoma.  There is some evidence of chemotherapy effect with between 10 and 50% replacement of tumour by fibroblastic tissue.  The omentum elsewhere is unremarkable.	 PHI:Null
1100	 4958	 C.  Sections show fibrous tissue with a probable mesothelial surface.  Within the tissue there is a deposit of metastatic serous carcinoma with prominent psammomatous calcification.	 PHI:Null
1100	 5020	 D.  Sections show a deposit of metastatic serous carcinoma.	 PHI:Null
1100	 5031	 DIAGNOSIS:	 PHI:Null
1100	 5074	 A.  Uterus, ovaries and fallopian tubes:	 PHI:Null
1100	 5291	 -  Moderately differentiated serous carcinoma involving both ovaries, left fallopian tube, uterine serosa and outer myometrium, endometrium, adventitia of posterior cervix and fibrofat attached to posterior cervix.	 PHI:Null
1100	 5306	 B.  Omentum:	 PHI:Null
1100	 5346	 -  Focal metastatic serous carcinoma.	 PHI:Null
1100	 5366	 C.  Rectal nodule:	 PHI:Null
1100	 5399	 -  Metastatic serous carcinoma.	 PHI:Null
1100	 5421	 D.  Pouch of Douglas:	 PHI:Null
1100	 5455	 -  Metastatic serous carcinoma.	 PHI:Null
1101	 24	 Episode No:  49Z720639D	 IDNUM:49Z720639D
1101	 36	 4997206.IXD	 MEDICALRECORD:4997206.IXD
1101	 59	 Katona, NAIA Thurman	 PATIENT:Katona, NAIA Thurma
1101	 86	 Lab No:  49Z72063,49Z72063	 IDNUM:49Z72063
1101	 86	 Lab No:  49Z72063,49Z72063	 IDNUM:49Z72063
1101	 93	 Gobind	 STREET:Gobind
1101	 132	 SANCTUARY POINT  New South Wales  3387	 CITY:SANCTUARY POINT
1101	 132	 SANCTUARY POINT  New South Wales  3387	 STATE:New South Wales
1101	 132	 SANCTUARY POINT  New South Wales  3387	 ZIP:3387
1101	 158	 Specimen: Washings,Tissue	 PHI:Null
1101	 175	 D.O.B:  5/7/2004	 DATE:5/7/2004=>2004-07-05
1101	 183	 Sex:  F	 PHI:Null
1101	 210	 Collected: 14/10/2063 at :	 DATE:14/10/2063=>2063-10-14
1101	 264	 Location:  Hereditary - COOTAMUNDRA DISTRICT HOSPITAL	 DEPARTMENT:Hereditary
1101	 264	 Location:  Hereditary - COOTAMUNDRA DISTRICT HOSPITAL	 HOSPITAL:COOTAMUNDRA DISTRICT HOSPITAL
1101	 284	 DR GRAIG Rothermich	 DOCTOR:GRAIG Rothermich
1101	 320	 Distribution:   FILE-COPY, DR Clair	 DOCTOR:Clair
1101	 382	 ***SUPPLEMENTARY REPORT: MSI IMMUNOHISTOCHEMISTRY (28.5.2064)	 DATE:28.5.2064=>2064-05-28
1101	 393	 CLINICAL:	 PHI:Null
1101	 551	 64 yr old woman with endometrioid adenocarcinoma of uterus.  Total laparoscopic hysterectomy and BSO performed.  Myometrial invasion and cervix unaffected.	 AGE:64
1101	 564	 MACROSCOPIC:	 PHI:Null
1101	 1473	 Specimen labelled "Uterus, tubes and ovaries" consists of a uterus with attached cervix and bilateral tubes and ovaries weighing in total 94g.  The uterus measures 80 x 55 x 38g and has a shiny and a smooth serosal surface.  The ectocervix measures 28 x 28mm andhas an unremarkable surface.  In the posterior wall of the endometrial cavity there is a large exophytic and fungating lesion 40mm from proximal to distal.  On sectioning the endometrium has a maximum thickness of 15mm and the myometrium 10mm.  The right fallopian tube and fimbria measure 40mm in length and 5mm in maximum diameter.  It has features of previous ligation.  The right ovary is 25 x 15 x 15mm and has an unremarkable serosal surface and cut surface.  The left fallopian tube and fimbria is 50 x 5 x 5mm with features of previous ligation.  The left ovary is 25 x 20 x 10mm and has an unremarkable serosal surface and cut surface.	 PHI:Null
1101	 1865	 Blocks:  1 to 3 - one full longitudinal section of posterior body and cervix; 4 - one representative section of posterior endomyometrium; 5 to 7 - one fulllongitudinal section of anterior body and cervix; 8 - right cornu; 9 - left cornu; 10 - right parametrial tissue; 11 - left parametrial tissue; 12 - right fimbria; 13 - right ovary; 14 - left fimbria; 15 - left ovary.  (YG/mm 15.10.63)	 DOCTOR:YG
1101	 1865	 Blocks:  1 to 3 - one full longitudinal section of posterior body and cervix; 4 - one representative section of posterior endomyometrium; 5 to 7 - one fulllongitudinal section of anterior body and cervix; 8 - right cornu; 9 - left cornu; 10 - right parametrial tissue; 11 - left parametrial tissue; 12 - right fimbria; 13 - right ovary; 14 - left fimbria; 15 - left ovary.  (YG/mm 15.10.63)	 DATE:15.10.63=>2063-10-15
1101	 1905	 MICROSCOPIC:  (Reported by Dr G Pinion)	 DOCTOR:G Pinio
1101	 2638	 Sections of the endometrial tumour show a FIGO Grade 1 endometrioid endometrial adenocarcinoma. The adenocarcinoma consists predominantly of complex, crowded glands with minimal intervening stroma lined by moderately pleomorphic carcinoma cells (FIGA architecture grade 1; nuclear grade 2 = overall grade 1). No significant solid component is identified. The carcinoma infiltrates up to 12mm into a uterine wall 20mm in thickness. There is focal lymphovascular space invasion. No serosal or several involvement by carcinoma is seen. The myometrium shows patchy adenomyosis. The cervix shows no convincing HPV effect, CIN or significant glandular dysplasia. The bilateral ovaries and fallopian tubes show no significant abnormality.	 PHI:Null
1101	 2740	 Markers of microsatellite instability are being performed and a supplementary report will be issued.	 PHI:Null
1101	 2751	 DIAGNOSIS:	 PHI:Null
1101	 2788	 Uterus, ovaries and fallopian tubes:	 PHI:Null
1101	 2842	 FIGO Grade 1 endometrioid endometrial adenocarcinoma.	 PHI:Null
1101	 2901	 Carcinoma infiltrates 12mm into a uterine wall 20mm thick.	 PHI:Null
1101	 2971	 No evidence of serosal, cervical or ovarian involvement by carcinoma.	 PHI:Null
1101	 3022	 Markers of microsatellite instability are pending.	 PHI:Null
1101	 3024	 	 PHI:Null
1101	 3086	 ***SUPPLEMENTARY REPORT: MSI IMMUNOHISTOCHEMISTRY (28.5.2064)	 DATE:28.5.2064=>2064-05-28
1101	 3097	 Dr G Henly	 DOCTOR:G Henly
1101	 3189	 Immunohistochemical staining for MSI proteins was performed and the results are as follows:	 PHI:Null
1102	 24	 Episode No:  44D592246C	 IDNUM:44D592246C
1102	 35	 441592.HKP	 MEDICALRECORD:441592.HKP
1102	 54	 JAMASON, BRIGIDA	 PATIENT:JAMASON, BRIGIDA
1102	 81	 Lab No:  44D59224,44D59224	 IDNUM:44D59224
1102	 81	 Lab No:  44D59224,44D59224	 IDNUM:44D59224
1102	 88	 Cabban	 STREET:Cabba
1102	 117	 KIAMA  South Australia  5134	 CITY:KIAMA
1102	 117	 KIAMA  South Australia  5134	 STATE:South Australia
1102	 117	 KIAMA  South Australia  5134	 ZIP:5134
1102	 140	 Specimen: Fluid,Tissue	 PHI:Null
1102	 158	 D.O.B:  22/5/1988	 DATE:22/5/1988=>1988-05-22
1102	 166	 Sex:  F	 PHI:Null
1102	 192	 Collected: 6/11/2063 at :	 DATE:6/11/2063=>2063-11-06
1102	 239	 Location:  DICKINSON 3 SOUTH - INJUNE HOSPITAL	 DEPARTMENT:DICKINSON 3 SOUTH
1102	 239	 Location:  DICKINSON 3 SOUTH - INJUNE HOSPITAL	 HOSPITAL:INJUNE HOSPITAL
1102	 253	 DR COY LOLLAR	 DOCTOR:COY LOLLAR
1102	 302	 Distribution:   FILE-COPY,   NSW-CANCER-REGISTRY	 PHI:Null
1102	 334	 SUPPLEMENTARY REPORT (15.1.63):	 DATE:15.1.63=>2063-01-15
1102	 336	 	 PHI:Null
1102	 346	 CLINICAL:	 PHI:Null
1102	 404	 Right ovarian mass.  Ovarian cancer.  PHx hysterectomy.	 PHI:Null
1102	 417	 MACROSCOPIC:	 PHI:Null
1102	 687	 A.  Specimen labelled "Right ovarian mass" consists of a red/tan haemorrhagic disrupted tumour measuring 120 x 65 x 40mm.  The cut surface is soft and fleshy with small cystic areas approximately 3 to 10mm in diameter.  Two representative sections for frozen section.	 PHI:Null
1102	 767	 Blocks:  1- frozen section 1; 2 - frozen section 2; 3-12- representative tumour	 PHI:Null
1102	 790	 FROZEN SECTION REPORT:	 PHI:Null
1102	 813	 Carcinosarcoma (MMMT).	 PHI:Null
1102	 875	 Phone result to Dr Dowdy by Dr L Lenoci at 3.36pm on 0408.13.	 DOCTOR:Dowdy
1102	 875	 Phone result to Dr Dowdy by Dr L Lenoci at 3.36pm on 0408.13.	 DOCTOR:L Lenoci
1102	 875	 Phone result to Dr Dowdy by Dr L Lenoci at 3.36pm on 0408.13.	 TIME:at 3.36pm on 0408.13=>2013-04-08T15:36
1102	 1284	 B.  Specimen labelled "Right tube" consists of ragged haemorrhagic and cream tissue measuring 60 x40 x20mm. There is an attached fallopian tube which measures 50mm in length with a maximum diameter of 10mm.  An ovary is present measuring 25 x 20 x 10mm.  On sectioning the ovary appears unremarkable. A possible tumour deposit is identified on the fimbrial end of the fallopian tube measuring 10 x 5 x 5mm.	 PHI:Null
1102	 1442	 Blocks:  1 & 2 - LS of the fimbrial end of the fallopian tube; 3 - representative TS fallopian tube; 4 to 6 - ovary AE; 7 & 8 - representative soft tissue.	 PHI:Null
1102	 1678	 C.  Specimen labelled "Remaining of right ovary" consists of disrupted soft cream and haemorrhagic tissue measuring 150 x 130 x 50mm.  The tissue has the same morphologic appearance as specimen A. Representative sections in 8 blocks.	 PHI:Null
1102	 1936	 D.  Specimen labelled "Left tube and ovary" consists of an ovary which measures 35 x 20 x 10mm.  There is attached fibrofatty tissue which measures 30 x 20 x 20mm.  No definite fallopian tube tissue is identified.  On sectioning the ovary is unremarkable.	 PHI:Null
1102	 2007	 Blocks:  1 to 3 - ovary AE; 4 to 6 - possible fallopian tube tissue.	 PHI:Null
1102	 2176	 E.Specimen labelled "Omentum" consists of a piece of omentum which measures 200 x 70 x 10mm.  No tumour deposits are identified.  Representative sections in 3 blocks.	 PHI:Null
1102	 2290	 F.  Specimen labelled "Descending colon" consists of firm cream tissue which measures 30 x 30 x 4mm.  AE 1 block.	 PHI:Null
1102	 2403	 G.  Specimen labelled "Pouch of Douglas" consists of firm cream tissue which measure 15 x 10 x 3mm.  AE 1 block.	 PHI:Null
1102	 2560	 H.  Specimen labelled "Bladder peritoneum" consists of fibrofatty tissue which measures 40 x 20 x 10mm in aggregate.  AE 3 blocks.  (TO: ZI: UK/mm 7.11.63)	 DOCTOR:ZI
1102	 2560	 H.  Specimen labelled "Bladder peritoneum" consists of fibrofatty tissue which measures 40 x 20 x 10mm in aggregate.  AE 3 blocks.  (TO: ZI: UK/mm 7.11.63)	 DOCTOR:UK
1102	 2560	 H.  Specimen labelled "Bladder peritoneum" consists of fibrofatty tissue which measures 40 x 20 x 10mm in aggregate.  AE 3 blocks.  (TO: ZI: UK/mm 7.11.63)	 DATE:7.11.63=>2063-11-07
1102	 2602	 MICROSCOPIC (reported by Dr L Menietto):	 DOCTOR:L Menietto
1102	 3186	 A.  Sections show tumour and also the fimbrial endof a fallopian tube.  No normal ovarian tissue is seen.  The tumour is a malignant mixed Mullerian tumour, roughly 50% carcinoma and 50% sarcoma.  The carcinoma has features most in keeping with a grade 3 endometrioid adenocarcinoma.  The sarcoma consists of undifferentiated cells with large, irregular nuclei and a variable amount of generally pale cytoplasm.  Mitoses are very frequent and there is patchy tumour necrosis.  No heterologous elements are identified.  The included fimbrial end of the fallopian tube is unremarkable.	 PHI:Null
1102	 3190	 	 PHI:Null
1102	 3513	 B.  Sections show ovary and fallopian tube.  There is some malignant mixed tumour attached to the fimbrial end of the tube.  The tube elsewhere also does not show any significant abnormality.  Sections of the ovary show malignant mixed tumour in adherent tissue on the serosal surface.  The ovary itself is unremarkable.	 PHI:Null
1102	 3799	 C.  Sections show malignant mixed Mullerian tumour.  This is mostly similar to specimen A but a minor component of rhabdomyosarcoma is identified in the stromal component.  No other heterologous elements are seen.   No normal ovarian tissue is seen.  There is patchy tumour necrosis.	 PHI:Null
1102	 4041	 D.  Sections show ovary and fallopian tube.  There is some malignant mixed Mullerian tumour present within, and on the serosa, of tissue adjacent to the ovary but the ovary itself is not involved.  No definite fallopian tube is identified.	 PHI:Null
1102	 4134	 E.  Sections of omentum show some patchy surface mesothelial reaction.  No tumour is seen.	 PHI:Null
1102	 4251	 F.  Sections show tumour tissue including both epithelial and malignant stromal components, similar to specimen A.	 PHI:Null
1102	 4403	 G.  Sections show fibrous tissue with associated tumour.  The tumour includes both malignant epithelialand stromal components, similar to specimen A.	 PHI:Null
1102	 4641	 H.  Sections show mesothelium with underlying fibrofat.  The tissue is haemorrhagic and congested.  There is some tumour present on the serosal surface, including both epithelial and malignant stromal components, similar to specimen A.	 PHI:Null
1102	 4654	 DIAGNOSIS:	 PHI:Null
1102	 4715	 A.  Right ovarian mass:  Malignant mixed Mullerian tumour.	 PHI:Null
1102	 4805	 B.  Right tube:  Malignant mixed tumour at fimbrial end of tube and on serosa of ovary.	 PHI:Null
1102	 4917	 C.  Remainder of right ovary:  Malignant mixed Mullerian tumour with heterologous element (rhabdomyosarcoma).	 PHI:Null
1102	 4982	 D.  Left ovary:  Malignant mixed tumour in paraovarian tissue.	 PHI:Null
1102	 5009	 E.  Omentum:  No tumour.	 PHI:Null
1102	 5066	 F.  Descending colon:  Malignant mixed tumour present.	 PHI:Null
1102	 5123	 G.  Pouch of Douglas:  Malignant mixed tumour present.	 PHI:Null
1102	 5182	 H.  Bladder peritoneum:  Malignant mixed tumour present.	 PHI:Null
1102	 5214	 SUPPLEMENTARY REPORT (15.1.63):	 DATE:15.1.63=>2063-01-15
1102	 5293	 A.  Immunostains for mismatch repair enzymes have been performed as requested.	 PHI:Null
1102	 5330	 MLH1:    Preserved nuclear staining.	 PHI:Null
1102	 5367	 PMS2:    Preserved nuclear staining.	 PHI:Null
1102	 5403	 MSH2:   Preserved nuclear staining.	 PHI:Null
1102	 5439	 MSH6:   Preserved nuclear staining.	 PHI:Null
1102	 5613	 Preserved nuclear staining of a carcinoma for the mismatch repair enzymes MLH1, PMS2, MSH2 and MSH6 indicates a low likelihood of microsatellite instability phenotype (MSI).	 PHI:Null
1103	 25	 Episode No:  17N342645X	 IDNUM:17N342645X
1103	 37	 1753426.LOX	 MEDICALRECORD:1753426.LOX
1103	 57	 Piantedosi, Misha	 PATIENT:Piantedosi, Misha
1103	 84	 Lab No:  17N34264,17N34264	 IDNUM:17N34264
1103	 84	 Lab No:  17N34264,17N34264	 IDNUM:17N34264
1103	 93	 Capertee	 STREET:Capertee
1103	 114	 GOLD COAST  WA  2842	 CITY:GOLD COAST
1103	 114	 GOLD COAST  WA  2842	 STATE:WA
1103	 114	 GOLD COAST  WA  2842	 ZIP:2842
1103	 140	 Specimen: Washings,Tissue	 PHI:Null
1103	 157	 D.O.B:  2/2/1972	 DATE:2/2/1972=>1972-02-02
1103	 165	 Sex:  F	 PHI:Null
1103	 192	 Collected: 23/12/2063 at :	 DATE:23/12/2063=>2063-12-23
1103	 248	 Location:  MEDIC/SURGERYWARD-NATHALIA DISTRICT HOSPITAL	 DEPARTMENT:MEDIC/SURGERYWARD
1103	 248	 Location:  MEDIC/SURGERYWARD-NATHALIA DISTRICT HOSPITAL	 HOSPITAL:NATHALIA DISTRICT HOSPITAL
1103	 266	 DR NICKOLAS LENZE	 DOCTOR:NICKOLAS LENZE
1103	 292	 Distribution:   FILE-COPY	 PHI:Null
1103	 302	 CLINICAL:	 PHI:Null
1103	 407	 Endometrial cancer, type 2 DM, breast cancer right partial mastectomy, endometrial cancer, hypertension.	 PHI:Null
1103	 420	 MACROSCOPIC:	 PHI:Null
1103	 1412	 Specimen labelled "Uterus, bilateral tubes and ovaries + cervix" consists of a uterus with attached cervix, bilateral fallopian tubes and ovaries weighing 130g in total.  The uterus measures 125x 70 x 50mm and has a smooth, shiny serosal surface.  The soft tissue margin of uterus is inked blue.  The ectocervix measures 35 x 25mm and has an unremarkable surface.  There is a T-shaped plastic intrauterine device within the endometrial cavity.  There is a fungating, extensively necrotic solid tumour filling most of the endometrial cavity.  The tumour measures approximately 80 x 70 x 40mm and is friable.  The myometrium is 28mm in maximum thickness and has one fibroid 8mm in maximum dimension.  The right ovary measures 25 x 15 x 7mm and has an unremarkable cut surface.  The right fallopian tube is 35mm in length and 6mm in diameter.  The left ovary measures 30 x 12 x 8mm and has an unremarkable cut surface.  The left fallopian tube measures 30mm in length and up to 7mm in diameter.	 PHI:Null
1103	 1714	 Blocks:  1 to 7 - full LS of anterior body and cervix (6 and 7 are paired); 8 to 13 - full LS of posterior body and cervix (11 and 12 are paired, 12 is the reserved block); 14 & 15 - sections of tumour; 16 - right fallopian tube and ovary; 17 - left fallopian tube and ovary.  (TO: HM; HM/rt 24.12.63)	 DATE:24.12.63=>2063-12-24
1103	 1753	 MICROSCOPIC (Reported by Dr E Dalman):	 DOCTOR:E Dalma
1103	 2634	 Sections of the endometrial tumour show a grade 3 endometrioid adenocarcinoma.  It is architectural grade 2 but much of it shows high grade cytologic atypia and pleomorphism so overall it is grade 3.  There is a prominent villoglandular architecture and also some solid component and .squamous differentiation.  There is focal superficial myometrial invasion; maximum depth of myometrial invasion is 1mm out of a total myometrial thickness of 16mm.  There is a single focus of possiblelymphovascular invasion in the superficial myometrium (block 15).There is prominent tumour involvement of the surface of the endocervix and also a part of the ectocervix, but no stromal invasion of the cervix is identified.  Tumour involving the surface of the lower endocervix is present 10mm from the ectocervical excision margin.  Sections of the ovaries and fallopian tubes are unremarkable.	 PHI:Null
1103	 2694	 Representative slides have also been viewed by Dr E Juvera.	 DOCTOR:E Juvera
1103	 2705	 DIAGNOSIS:	 PHI:Null
1103	 2847	 Uterus, ovaries and fallopian tubes:  Grade 3 endometrioid adenocarcinoma of endometrium.  Focal superficial myometrial invasion.  Stage 1A.	 PHI:Null
1103	 2849	 	 PHI:Null
1108	 24	 Episode No:  75J362603F	 IDNUM:75J362603F
1108	 36	 7533626.BKF	 MEDICALRECORD:7533626.BKF
1108	 54	 MINION, Florrie	 PATIENT:MINION, Florrie
1108	 81	 Lab No:  75J36260,75J36260	 IDNUM:75J36260
1108	 81	 Lab No:  75J36260,75J36260	 IDNUM:75J36260
1108	 94	 P. O. BOX 15	 LOCATION-OTHER:P. O. BOX 15
1108	 112	 ORBOST  VIC  2388	 CITY:ORBOST
1108	 112	 ORBOST  VIC  2388	 STATE:VIC
1108	 112	 ORBOST  VIC  2388	 ZIP:2388
1108	 138	 Specimen: Washings,Tissue	 PHI:Null
1108	 156	 D.O.B:  24/6/2015	 DATE:24/6/2015=>2015-06-24
1108	 164	 Sex:  F	 PHI:Null
1108	 190	 Collected: 26/2/2063 at :	 DATE:26/2/2063=>2063-02-26
1108	 244	 Location:  Peter Mac - KANGAROO ISLAND HEALTH SERVICE	 DEPARTMENT:Peter Mac
1108	 244	 Location:  Peter Mac - KANGAROO ISLAND HEALTH SERVICE	 HOSPITAL:KANGAROO ISLAND HEALTH SERVICE
1108	 270	 DR Sterling Jude SHROEDER	 DOCTOR:Sterling Jude SHROEDER
1108	 296	 Distribution:   FILE-COPY	 PHI:Null
1108	 328	 SUPPLEMENTARY REPORT (20.4.64):	 DATE:20.4.64=>2064-04-20
1108	 330	 	 PHI:Null
1108	 361	 SUPPLEMENTARY REPORT (3.4.64):	 DATE:3.4.64=>2064-03-04
1108	 363	 	 PHI:Null
1108	 373	 CLINICAL:	 PHI:Null
1108	 546	 53 year old, endometrial cancer, TAH done, refused BSO and nodal dissection.  Large fibroid uterus.  Endometrial cancer.  Menorrhagia.  Type 2 DM.  Obesity.  Hypertension.	 AGE:53
1108	 559	 MACROSCOPIC:	 PHI:Null
1108	 1446	 A.  Specimen labelled "Uterus and cervix", consists of a uterus with attached cervix weighing 2300g.  The uterus measures 180 x 170 x 160mm and has a smooth shiny serosal surface.  The ectocervix measuring 25 x 22mm and has an unremarkable surface.  The body of the uterus is distorted by large fibroid.  Within the upper half of the endometrial cavity there is a polypoid ill defined friable mass measuring approximately 80 x 75 x 30mm.  The tumour has a pale cut surface.  The myometrium varies in thickness, up to 125mm in thickness including a large fibroid.  Where the tumour is closest to the serosal surface the myometrium is 30mm in thickness.  There are multiple fibroids within the body of uterus ranging from 7 to 120mm in maximum dimension.  The fibroids have whorled grey cut surfaces; no necrosis is seen.  Within the largest fibroid there are patchy haemorrhagic areas.	 PHI:Null
1108	 1936	 Blocks: 1 to 3 - cervix; 4 - TS junction of cervix and body of uterus; 5 to 7 - continuous sections of tumour and myometrium; 8 and 9 - paired sections of tumour and myometrium; 10 and 11 - paired sections of tumour and myometrium; 12 - section of tumour, reserved block; 13 and 14 - paired sections (LS) of tumour and adjacent endometrium; 15 to 18 - sections of the largest fibroid. Re-select 19 to 25 - further sections of main myometrial mass and other myometrial masses (DP 2.5.63).	 DOCTOR:DP
1108	 1936	 Blocks: 1 to 3 - cervix; 4 - TS junction of cervix and body of uterus; 5 to 7 - continuous sections of tumour and myometrium; 8 and 9 - paired sections of tumour and myometrium; 10 and 11 - paired sections of tumour and myometrium; 12 - section of tumour, reserved block; 13 and 14 - paired sections (LS) of tumour and adjacent endometrium; 15 to 18 - sections of the largest fibroid. Re-select 19 to 25 - further sections of main myometrial mass and other myometrial masses (DP 2.5.63).	 DATE:2.5.63=>2063-02-05
1108	 2095	 B.  Specimen labelled "Omental biopsy", consists of a piece of omental fatty tissue 100 x 40 x 15mm.  Specimen is serially sliced.  No nodules are identified.	 PHI:Null
1108	 2153	 Blocks: 1 to 3 - random sections.  (TO: WD;SY/vo 2.4.63)	 DOCTOR:WD
1108	 2153	 Blocks: 1 to 3 - random sections.  (TO: WD;SY/vo 2.4.63)	 DOCTOR:SY
1108	 2153	 Blocks: 1 to 3 - random sections.  (TO: WD;SY/vo 2.4.63)	 DATE:2.4.63=>2063-02-04
1108	 2193	 MICROSCOPIC (Reported by Dr T Peasley):	 DOCTOR:T Peasley
1108	 2619	 A.  Sections of the cervix are unremarkable.  Sections of the endometrial tumour show a grade 1 endometrioid adenocarcinoma.  There is some squamous differentiation.  The tumour invades deeplyinto myometrium.  Maximum depth of myometrial invasion is 9mm out of a total myometrial thickness of 15mm.  There is focal lymphovascular invasion in the myometrium.  Endometrium adjacent tumour shows complex hyperplasia with atypia.	 PHI:Null
1108	 2942	 Sections of the largest myometrial tumour show a leiomyosarcoma.  There is extensive infarct-like necrosis but there is also at least focal coagulative necrosis.  The tumour is cellular and shows diffuse, severe cytologic atypia.  Mitoses number up to 16 per 10 high power fields and numerous abnormal mitoses are noted.	 PHI:Null
1108	 3129	 Immunostains for mismatch repair enzymes will be performed on the endometrial tumour and further sections of the myometrial tumours will be taken.  A supplementary report will be issued.	 PHI:Null
1108	 3185	 B.  Sections show unremarkable fat.  No tumour is seen.	 PHI:Null
1108	 3187	 	 PHI:Null
1108	 3198	 DIAGNOSIS:	 PHI:Null
1108	 3210	 A.  Uterus:	 PHI:Null
1108	 3309	 1.  Grade 1 endometrioid adenocarcinoma of endometrium showing deep myometrial invasion, stage 1B.	 PHI:Null
1108	 3345	 2.  Leiomyosarcoma, 120mm diameter.	 PHI:Null
1108	 3379	 B.  Omental biopsy:  No tumour.	 PHI:Null
1108	 3410	 SUPPLEMENTARY REPORT (3.4.64):	 DATE:3.4.64=>2064-03-04
1108	 3459	 A.  Immunostains on endometrioid adenocarcinoma:	 PHI:Null
1108	 3495	 MLH1:   Preserved nuclear staining.	 PHI:Null
1108	 3531	 PMS2:   Preserved nuclear staining.	 PHI:Null
1108	 3567	 MSH2:   Preserved nuclear staining.	 PHI:Null
1108	 3601	 MSH6:   Loss of nuclear staining.	 PHI:Null
1108	 3858	 Loss of nuclear staining of a carcinoma for any of the mismatch repair enzymes MLH1, PMS2, MSH2 or MSH6 is associated with microsatellite instability phenotype (MSI), and may reflect a germline mutation or somatic inactivation of that mismatch repair gene.	 PHI:Null
1108	 4096	 Further sections of the leiomyosarcoma, and other myometrial masses, have been taken.  The leiomyosarcoma hassome epithelioid areas but is otherwise as reported above.  Other sections of myometrium show adenomyosis and benign leiomyomas.	 PHI:Null
1108	 4128	 SUPPLEMENTARY REPORT (20.4.64):	 DATE:20.4.64=>2064-04-20
1108	 4208	 Stains for hormone receptors have been performed on both tumours, as requested.	 PHI:Null
1108	 4237	 Endometrioid adenocarcinoma:	 PHI:Null
1108	 4304	 Oestrogen receptor:  Positive.  80% oftumour cells stain positive.	 PHI:Null
1108	 4382	 Predominant intensity of staining:  Strong.	 PHI:Null
1108	 4453	 Progesterone receptor:  Positive.  80% of tumour cells stain positive.	 PHI:Null
1108	 4537	 Predominant intensity of staining:  Strong.	 PHI:Null
1108	 4553	 Leiomyosarcoma:	 PHI:Null
1108	 4621	 Oestrogen receptor:  Positive.  20% of tumour cells stain positive.	 PHI:Null
1108	 4701	 Predominant intensity of staining:  Moderate.	 PHI:Null
1108	 4804	 Progesterone receptor:  Positive.  90% of tumour cells stain positive.intensity of staining:  Strong.	 PHI:Null
1108	 4806	 	 PHI:Null
1108	 4808	 	 PHI:Null
1117	 25	 Episode No:  96A063552Q	 IDNUM:96A063552Q
1117	 37	 9600635.PFQ	 MEDICALRECORD:9600635.PFQ
1117	 54	 WHITCOME, Abel	 PATIENT:WHITCOME, Abel
1117	 72	 Lab No:  96A06355	 IDNUM:96A06355
1117	 79	 Kamena	 STREET:Kamena
1117	 99	 WAUCHOPE  TAS  3179	 CITY:WAUCHOPE
1117	 99	 WAUCHOPE  TAS  3179	 STATE:TAS
1117	 99	 WAUCHOPE  TAS  3179	 ZIP:3179
1117	 116	 Specimen: Tissue	 PHI:Null
1117	 134	 D.O.B:  10/5/1989	 DATE:10/5/1989=>1989-10-05
1117	 142	 Sex:  M	 PHI:Null
1117	 166	 Collected: Unknown at :	 PHI:Null
1117	 220	 Location:  DAYSURGERY UNIT-HESSE RURAL HEALTH SERVICE	 DEPARTMENT:DAYSURGERY UNIT
1117	 220	 Location:  DAYSURGERY UNIT-HESSE RURAL HEALTH SERVICE	 HOSPITAL:HESSE RURAL HEALTH SERVICE
1117	 238	 DR Louie Darrisaw	 DOCTOR:Louie Darrisaw
1117	 264	 Distribution:   FILE-COPY	 PHI:Null
1117	 274	 CLINICAL:	 PHI:Null
1117	 405	 Descending colon cancer, anterior resection.  AF, CABG, lung Ca, Rt upper lobectomy, anaemia, type 2 diabetes, cardiac ablation.	 PHI:Null
1117	 418	 MACROSCOPIC:	 PHI:Null
1117	 1185	 Specimen labelled "Left hemicolectomy" consists of a segment of colon, 110mm long and up to 70mm in circumference with attached mesenteric fat, 125 x 70 x 40mm.  There is circumferential tumour with a polypoid/fungating appearance, 44 x 65 x 20mm.  The tumour is 26mm from one resection margin and 55mm from the other resection margin.It is well clear of the radial resection margin. The tumour has a firm cut surface with mucoid areas (approximately 40 to 50% of the tumour).  The serosa overlying the tumour is smooth.  Extra muscular extension of tumour appears to bepresent focally (block 16).  There is a sessile polyp 10mm in maximum dimension, 15mm from the tumour and 32mm from the a resection margin. There are several lymph nodes within the mesenteric fat.	 PHI:Null
1117	 1860	 Blocks:  1 - margin further from the tumour (shave margin); 2 - margin closer to the tumour (LS); 3 - sessile polyp bisected; 4 & 5 - transverse sections of tumour and serosa; 6 - longitudinal section of tumour and adjacent mucosa; 7 - TS tumour and adjacent lymph node; 8- TS tumour and adjacent lymph node (same lymph node as in block 7); 9 - TS tumour; 10 - one lymph node sliced; 11 - apical lymph node trisected; 12 - one bisected lymph node; 13 - one sliced lymph node; 14 - one bisected lymph node; 15- nodes as seen; 16 - transverse section tumour; 17 - TS tumour, reserved block for tumour banking.  (HM/mm 14.6.62) 18 & 19 Additional nodes, each one node bisected.	 DATE:14.6.62=>2062-06-14
1117	 1900	 MICROSCOPIC:  (Reported by Dr Y Menitz)	 DOCTOR:Y Menitz
1117	 2034	 Sections show an ulcerated moderately differentiated invasive mucinous adenocarcinoma.  A synoptic report forcolon carcinoma follows:	 PHI:Null
1117	 2058	 Macroscopic Description	 PHI:Null
1117	 2095	 Site of tumour:   Descending colon	 PHI:Null
1117	 2153	 Maximum tumour diameter:                            65 mm	 PHI:Null
1117	 2199	 Distance of tumour to nearer cut end:    26mm	 PHI:Null
1117	 2222	 Tumour perforation: No	 PHI:Null
1117	 2246	 Microscopic Description	 PHI:Null
1117	 2252	 Type	 PHI:Null
1117	 2276	 Mucinous adenocarcinoma	 PHI:Null
1117	 2278	 	 PHI:Null
1117	 2314	 Differentiation by predominant area	 PHI:Null
1117	 2559	 Moderately differentiatied: the tumour is composed predominantly of well formed glands plus nest and cords of malignant cells within an abundant extracellular mucinous stroma (>50% mucinous).  No significant signet ring differentiation is seen.	 PHI:Null
1117	 2574	 Local invasion	 PHI:Null
1117	 2604	 pT3 Beyond muscularis propria	 PHI:Null
1117	 2668	 The tumour contiguously extends into mesocolic fat (eg block 9)	 PHI:Null
1117	 2698	 Tumour involvement of margins	 PHI:Null
1117	 2721	 Cut ends: Not involved	 PHI:Null
1117	 2764	 Non peritonealised circumferential margin:	 PHI:Null
1117	 2780	 Not applicable	 PHI:Null
1117	 2803	 Lymphocytic infiltrate	 PHI:Null
1117	 2816	 Not assessed	 PHI:Null
1117	 2828	 Lymph nodes	 PHI:Null
1117	 2864	 Number of lymph nodes present:  12	 PHI:Null
1117	 2919	 Number of lymph nodes involved:  4 (blocks 8, 10, 15)	 PHI:Null
1117	 3059	 One (1) of the involved lymph nodes shows a focus of extranodal extension 0.3mm in diameter extending 0.3mm beyond the lymph node (block8).	 PHI:Null
1117	 3087	 Apical lymph node: negative	 PHI:Null
1117	 3122	 pN2a Metastases in 4-6 regional LN	 PHI:Null
1117	 3146	 Lymphovascular invasion	 PHI:Null
1117	 3153	 Absent	 PHI:Null
1117	 3173	 Perineural invasion	 PHI:Null
1117	 3180	 Absent	 PHI:Null
1117	 3224	 Histologically confirmed distant metastases	 PHI:Null
1117	 3262	 pMX Cannot be assessed histologically	 PHI:Null
1117	 3287	 Background abnormalities	 PHI:Null
1117	 3391	 Adenomas Type: Tubulovillous adenoma with moderate to high grade dysplasia (32mm from resection margin)	 PHI:Null
1117	 3418	 Number:           One (1)	 PHI:Null
1117	 3441	 Residual tumour status	 PHI:Null
1117	 3463	 R0 No residual tumour	 PHI:Null
1117	 3495	 Summary - TNM 7th Edition 2010	 PHI:Null
1117	 3517	 pT3 pN2a pMx (cM) R0	 PHI:Null
1117	 3559	 Mismatch Repair Deficiency (MMRD) Status	 PHI:Null
1117	 3641	 Immunoperoxidase stains for MSI proteins (Sealed Air Corporation SARINA HOSPITAL)	 ORGANIZATION:Sealed Air Corporation
1117	 3641	 Immunoperoxidase stains for MSI proteins (Sealed Air Corporation SARINA HOSPITAL)	 HOSPITAL:SARINA HOSPITAL
1117	 3646	 	 PHI:Null
1117	 3688	 MLH1  Loss of staining (abnormal)	 PHI:Null
1117	 3730	 PMS2  Loss of staining (abnormal)	 PHI:Null
1117	 3758	 MSH2  Staining (normal)	 PHI:Null
1117	 3786	 MSH6  Staining (normal)	 PHI:Null
1117	 3795	 Comment:	 PHI:Null
1117	 4083	 Absence (loss) of nuclear staining for any of the mismatch repair enzymes MLH1, PMS2, MSH2 or MSH6, as in this case,  is associated with microsatellite instability phenotype (MSI), and may reflect the presence of a germline mutation or somatic inactivation of that mismatch repair gene.	 PHI:Null
1117	 4093	 SUMMARY:	 PHI:Null
1117	 4115	 -  Left hemicolectomy	 PHI:Null
1117	 4162	 -  Mucinous adenocarcinoma in descending colon	 PHI:Null
1117	 4202	 -  TNM Stage 7th Edition: pT3, pN2a, Mx	 PHI:Null
1117	 4243	 -  One (1) focus of extranodal extension	 PHI:Null
1117	 4270	 -  Residual tumour (R):  0	 PHI:Null
1117	 4318	 -  Microsatellite instability phenotype present	 PHI:Null
1117	 4378	 -  One (1) tubulovillous adenoma with high grade dysplasia.	 PHI:Null
1117	 4381	 	 PHI:Null
1118	 24	 Episode No:  17S6644100	 IDNUM:17S6644100
1118	 35	 176664.MDB	 MEDICALRECORD:176664.MDB
1118	 51	 UECKER, Glady	 PATIENT:UECKER, Glady
1118	 69	 Lab No:  17S66441	 IDNUM:17S66441
1118	 77	 Wahnita	 STREET:Wahnita
1118	 93	 MULWALA    3691	 CITY:MULWALA
1118	 93	 MULWALA    3691	 ZIP:3691
1118	 110	 Specimen: Tissue	 PHI:Null
1118	 128	 D.O.B:  4/12/2011	 DATE:4/12/2011=>2011-12-04
1118	 136	 Sex:  F	 PHI:Null
1118	 167	 Collected: 21/05/2012 at 09:21	 TIME:21/05/2012 at 09:21=>2012-05-21T09:21
1118	 223	 Location:  Radiation Oncology-MILTON ULLADULLA HOSPITAL	 DEPARTMENT:Radiation Oncology
1118	 223	 Location:  Radiation Oncology-MILTON ULLADULLA HOSPITAL	 HOSPITAL:MILTON ULLADULLA HOSPITAL
1118	 247	 DR ARLIE MICHAEL Hincks	 DOCTOR:ARLIE MICHAEL Hincks
1118	 273	 Distribution:   FILE-COPY	 PHI:Null
1118	 305	 SUPPLEMENTARY REPORT, 23.3.2064	 DATE:23.3.2064=>2064-03-23
1118	 307	 	 PHI:Null
1118	 317	 CLINICAL:	 PHI:Null
1118	 400	 No clinical history provided.  [Whipple + inferior mesenteric artery lymph nodes].	 PHI:Null
1118	 413	 MACROSCOPIC:	 PHI:Null
1118	 497	 A.  Specimen labelled "IMA node" consists of two nodes, 5 and 13mm.  AE one block.	 PHI:Null
1118	 1393	 B.  Specimen labelled "Whipple's specimen" consists of a Whipple's specimen including gallbladder, hepatic duct, common bile duct, distal stomach, duodenum and head of pancreas.  The duodenum and stomach together measure 160mm in length.  The attached pancreatic head measures 55 x 55 x 35mm.  The pancreatic resection margins are inked as follows; surgical margin yellow, portal vein groove blue, superoanterior black, anteroinferior green, posteroinferior red.  The cut surface reveals a cream poorly defined firm tumour which is obstructing the ampulla, measuring 20 x 17 x 15mm.  The main pancreatic duct appears dilated.  The macroscopic distance from margins is as follows: posterior 3mm, anterior 15mm,superior 30mm, portal vein groove 26mm, pancreatic resection margin 40mm.  Focally the tumour appears to extend out of the pancreas posteriorly but does not reach the posterior margin.	 PHI:Null
1118	 1448	 The common bile duct has a maximum diameter of 10mm.	 PHI:Null
1118	 1748	 The gallbladder measures 85mm in length with a maximum open circumference of 35mm.  The serosa appears unremarkable.  The maximum thickness of the gallbladder wall is 12mm.  The lumen contains sludge and small gallstones.  The mucosa is yellow and appears trabeculated through the entire specimen.	 PHI:Null
1118	 1870	 Several lymph nodes are identified in the periportal, inferior pancreatic and superior pancreatic areas from 3 to 40mm.	 PHI:Null
1118	 2023	 A separate piece of omentum is included withthe specimen; this measures 350mm in maximum dimension.  One 13mm nodule is identified within the omentum.	 PHI:Null
1118	 2548	 Blocks:  1 & 2 - margins; 3 - hepatic duct margin; 4 - shave of pancreatic resection margin; 5 & 6 - representative tumour to margins; 7 - tumour to anterior margin; 8 & 9 - one periportal node serially sectioned; 10 & 11 - inferior pancreatic lymph nodes; 12 & 13 - one inferior pancreatic lymph node serially sectioned; 14 - one inferior pancreatic lymph node serially sectioned; 15 - one superior pancreatic lymph node; 16 & 17 - gallbladder; 18 & 19 - omentum and nodule; 20 - tumourfor tumour banking.  (CX/bl 25/7/62)	 DOCTOR:CX
1118	 2548	 Blocks:  1 & 2 - margins; 3 - hepatic duct margin; 4 - shave of pancreatic resection margin; 5 & 6 - representative tumour to margins; 7 - tumour to anterior margin; 8 & 9 - one periportal node serially sectioned; 10 & 11 - inferior pancreatic lymph nodes; 12 & 13 - one inferior pancreatic lymph node serially sectioned; 14 - one inferior pancreatic lymph node serially sectioned; 15 - one superior pancreatic lymph node; 16 & 17 - gallbladder; 18 & 19 - omentum and nodule; 20 - tumourfor tumour banking.  (CX/bl 25/7/62)	 DATE:25/7/62=>2062-07-25
1118	 2746	 C.  Specimen labelled "Part of Whipple's specimen" consists of two pieces of fibrofatty tissue 15 and 25mm in maximum dimension.  One piece has a small 5mm cyst.  AE one block.    (SG/cc  23/7/62)	 DOCTOR:SG
1118	 2746	 C.  Specimen labelled "Part of Whipple's specimen" consists of two pieces of fibrofatty tissue 15 and 25mm in maximum dimension.  One piece has a small 5mm cyst.  AE one block.    (SG/cc  23/7/62)	 DATE:23/7/62=>2062-07-23
1118	 2748	 	 PHI:Null
1118	 2788	 MICROSCOPIC (Reported by Dr D Heglin):	 DOCTOR:D Hegli
1118	 2843	 A.  Sectionsshow two lymph nodes.  No tumour is seen.	 PHI:Null
1118	 3543	 B.  Sections show a moderately differentiated ductal adenocarcinoma of head of pancreas.  The tumour consists of irregular crowded glands lined by malignant cells with large, pleomorphic nuclei and a variable amount of eosinophilic cytoplasm. Many of the nuclei have a single prominent nucleolus.  There is a prominent associated desmoplastic stroma.  The tumour has an infiltrative appearance. It invades through thewall of the adjacent duodenum, extending into submucosa and focally into duodenal mucosa.  There is lymphovascular invasion in the tumour, both within capillary sized vessels and within small muscular arteries and veins.  There is also focal perineural invasion within the tumour.	 PHI:Null
1118	 3910	 All excision margins appear to be free of tumour.  Tumour is 0.5mm from the nearest anterior serosal surface, 2mm from the posterior margin and greater than 10mm from the portal vein groove. It is well away from the pancreatic resection margin.  The proximal and distal margins of the duodenum are free of tumour and the proximal bile duct margin is free of tumour.	 PHI:Null
1118	 4096	 The pancreatic ducts in the vicinity of the tumour show atypiaof their lining epithelium consistent with PanIN-2. The pancreatic duct at the resection margin shows changes of PanIN-2.	 PHI:Null
1118	 4507	 There is direct tumour invasion into two lymph nodes posterior to the head of pancreas.  One lymph node anterior to the head of pancreas is free of tumour.  One node at the porta hepatis is free oftumour.  One node superior to the head of pancreas and seven nodes inferior to the head of pancreas are all free of tumour.  Sections of the gallbladder show changes of chronic cholecystitis and cholesterolosis.	 PHI:Null
1118	 4668	 Sections of the omentum show no significant abnormality; the described nodule is an old, fibrotic and partly calcified nodule which has no evidence of tumour.	 PHI:Null
1118	 4766	 C.  Sections show fibrofat with a small mesothelial cyst.  There is no evidence of tumour.  (ec)	 PHI:Null
1118	 4779	 DIAGNOSES:	 PHI:Null
1118	 4841	 A.  Inferior mesenteric artery lymph nodes:  No tumour (0/2).	 PHI:Null
1118	 4944	 .  Whipple's resection: Moderately differentiated ductal adenocarcinoma of head of pancreas, pT3 N1.	 PHI:Null
1118	 5000	 C.  Tissue from Whipple's specimen:  Mesothelial cyst.	 PHI:Null
1118	 5032	 SUPPLEMENTARY REPORT, 23.3.2064	 DATE:23.3.2064=>2064-03-23
1118	 5180	 Immunostains for MMR enzymes were performed at GULARGAMBONE MULTI PURPOSE SERVICE's Pathology at the request of Prof D Niblack.  Dr D Gede reports:	 HOSPITAL:GULARGAMBONE MULTI PURPOSE SERVICE
1118	 5180	 Immunostains for MMR enzymes were performed at GULARGAMBONE MULTI PURPOSE SERVICE's Pathology at the request of Prof D Niblack.  Dr D Gede reports:	 DOCTOR:D Niblack
1118	 5180	 Immunostains for MMR enzymes were performed at GULARGAMBONE MULTI PURPOSE SERVICE's Pathology at the request of Prof D Niblack.  Dr D Gede reports:	 DOCTOR:D Gede
1118	 5249	 1:  Positive nuclear staining, indicating presence of intact enzyme.	 PHI:Null
1118	 5322	 PMS 2:  Positive nuclear staining, indicating presence of intact enzyme.	 PHI:Null
1118	 5395	 MSH 2:  Positive nuclear staining, indicating presence of intact enzyme.	 PHI:Null
1118	 5475	 MSH 6:  Positive nuclear staining (weak), indicating presence of intact enzyme.	 PHI:Null
1118	 5565	 In the view of the intact staining for MLH 1/PMS 2, staining for V600E was not performed.	 PHI:Null
1121	 25	 Episode No:  65O685578K	 IDNUM:65O685578K
1121	 37	 6556855.SWK	 MEDICALRECORD:6556855.SWK
1121	 55	 THELL, MITCHELL	 PATIENT:THELL, MITCHELL
1121	 72	 LabNo:  65O68557	 IDNUM:65O68557
1121	 79	 Rocher	 STREET:Rocher
1121	 99	 TERRANORA  NT  2660	 CITY:TERRANORA
1121	 99	 TERRANORA  NT  2660	 STATE:NT
1121	 99	 TERRANORA  NT  2660	 ZIP:2660
1121	 116	 Specimen: Tissue	 PHI:Null
1121	 134	 D.O.B:  30/1/2007	 DATE:30/1/2007=>2007-01-30
1121	 142	 Sex:  M	 PHI:Null
1121	 173	 Collected: 14/01/2013 at 09:03	 TIME:14/01/2013 at 09:03=>2013-01-14T09:03
1121	 227	 Location:ACUTE CARE WARD-PENOLA WAR MEMORIAL HOSPITAL	 DEPARTMENT:ACUTE CARE WARD
1121	 227	 Location:ACUTE CARE WARD-PENOLA WAR MEMORIAL HOSPITAL	 HOSPITAL:PENOLA WAR MEMORIAL HOSPITAL
1121	 252	 DR Brody CODY KANEHOLANI	 DOCTOR:Brody CODY KANEHOLANI
1121	 301	 Distribution:   FILE-COPY,   NSW-CANCER-REGISTRY	 PHI:Null
1121	 311	 CLINICAL:	 PHI:Null
1121	 376	 Right hemicolectomy perforated cancer with associated abscess.	 PHI:Null
1121	 389	 MACROSCOPIC:	 PHI:Null
1121	 1501	 Specimen labelled "Extended Rt hemicolectomy" consists of a right hemicolectomy; 290mm in length with a section of terminal ileum included measuring 65mm in length and unremarkable appendix attached measuring 50mm in length with a maximum diameter of 10mm.  80mm from the distal resection margin there is a soft polypoid tumour measuring 25 x 20mm which appears to take up approximately 50% of the circumference of the bowel.  The tumour appears to invade into the muscularis propria with ill defined creamtissue running to the serosal surface ?further invasion ?reaction to perforation.  Just distal to the presumed tumour there is a full thickness defect within the wall with an associated large mass of fibrinopurulent exudate around themesenteric side of the bowel measuring 90 x 70 x 40mm.  Multiple small diverticula are identified proximal to the tumour.  The remainder of the mucosa appears unremarkable.  A piece of ?omentum, 280 x 100 x 15mm is included in the specimen.  No suspicious lesions are identified in the omentum.  Multiple lymph nodes are identified in the mesenteric fat from 3 to 15mm.	 PHI:Null
1121	 1732	 Blocks:  1 to 9 - ?tumour with deepest point of invasion; 10 & 11 - ?site of perforation; 12 - proximal colonic diverticula; 13 - margins; 14 - appendix; 15 to 18 - lymph nodes; 19 to 21 - representative omentum.  (RR/mm 17.3.63)	 DATE:17.3.63=>2063-03-17
1121	 1787	 MICROSCOPIC (reported by Dr R Almsteadt & Dr R Unick):	 DOCTOR:R Almsteadt
1121	 1787	 MICROSCOPIC (reported by Dr R Almsteadt & Dr R Unick):	 DOCTOR:R Unick
1121	 1973	 Sections show moderately differentiated adenocarcinoma of the right colon.  Macroscopic perforation is seen, and on this basis the tumour is staged as pT4.  The features are as follows:	 PHI:Null
1121	 1997	 Macroscopic Description	 PHI:Null
1121	 2028	 Site of tumour:  Right colon	 PHI:Null
1121	 2059	 Maximum tumour diameter:  25mm	 PHI:Null
1121	 2111	 Distance of tumour to nearer cut end:  80mm(distal)	 PHI:Null
1121	 2142	 Tumour perforation:  Yes (pT4)	 PHI:Null
1121	 2166	 Microscopic Description	 PHI:Null
1121	 2172	 Type	 PHI:Null
1121	 2191	 Adenocarcinoma NOS	 PHI:Null
1121	 2227	 Differentiation by predominant area	 PHI:Null
1121	 2236	 Moderate	 PHI:Null
1121	 2251	 Local invasion	 PHI:Null
1121	 2283	 pT3 - Beyond muscularis propria	 PHI:Null
1121	 2313	 Tumour involvement of margins	 PHI:Null
1121	 2337	 Cut ends:  Not involved	 PHI:Null
1121	 2349	 Lymph nodes	 PHI:Null
1121	 2384	 Number of lymph nodes present:  21	 PHI:Null
1121	 2420	 Number of lymph nodes involved:  0	 PHI:Null
1121	 2452	 pN0 - No regional LN metastasis	 PHI:Null
1121	 2476	 Lymphovascular invasion	 PHI:Null
1121	 2483	 Absent	 PHI:Null
1121	 2503	 Perineural invasion	 PHI:Null
1121	 2511	 Present	 PHI:Null
1121	 2555	 Histologically confirmed distant metastases	 PHI:Null
1121	 2595	 pMX - Cannot be assessed histologically	 PHI:Null
1121	 2635	 Background abnormalities/other comments	 PHI:Null
1121	 2678	 Appendix shows no significant abnormality.	 PHI:Null
1121	 2720	 Extensive peritumoural abscess formation.	 PHI:Null
1121	 2743	 Residual tumour status	 PHI:Null
1121	 2767	 R0 - No residual tumour	 PHI:Null
1121	 2809	 Mismatch Repair Deficiency (MMRD) Status	 PHI:Null
1121	 2842	 MLH1  Preserved nuclear staining	 PHI:Null
1121	 2906	 PMS2  Preserved nuclear stainingSH2  Preserved nuclear staining	 PHI:Null
1121	 2939	 MSH6  Preserved nuclear staining	 PHI:Null
1121	 2948	 Comment:	 PHI:Null
1121	 3216	 Absence (loss) of nuclear staining for any of the mismatch repair enzymes MLH1, PMS2, MSH2 or MSH6 is associated with microsatellite instability phenotype (MSI), and may reflect the presence of a germline mutation or somatic inactivation of that mismatch repair gene.	 PHI:Null
1121	 3356	 Preserved nuclear staining of a carcinoma for MLH1, PMS2, MSH2 and MSH6 indicates a low likelihood of microsatellite instability phenotype.	 PHI:Null
1121	 3382	 Summary - TNM 7th Edition	 PHI:Null
1121	 3405	 pT4pN0     pMX     R0	 PHI:Null
1122	 24	 Episode No:  86F2864278	 IDNUM:86F2864278
1122	 36	 8622864.HSV	 MEDICALRECORD:8622864.HSV
1122	 52	 JAYME, DILLON	 PATIENT:JAYME, DILLON
1122	 70	 Lab No:  86F28642	 IDNUM:86F28642
1122	 80	 Sea Chase	 STREET:Sea Chase
1122	 99	 SMITHTON  SA  7307	 CITY:SMITHTON
1122	 99	 SMITHTON  SA  7307	 STATE:SA
1122	 99	 SMITHTON  SA  7307	 ZIP:7307
1122	 116	 Specimen: Tissue	 PHI:Null
1122	 134	 D.O.B:  30/1/2007	 DATE:30/1/2007=>2007-01-30
1122	 142	 Sex:  M	 PHI:Null
1122	 173	 Collected: 08/03/2013 at 15:54	 TIME:08/03/2013 at 15:54=>2013-03-08T15:54
1122	 212	 Location:  RECOVERY-BALAKLAVA HOSPITAL	 DEPARTMENT:RECOVERY
1122	 212	 Location:  RECOVERY-BALAKLAVA HOSPITAL	 HOSPITAL:BALAKLAVA HOSPITAL
1122	 241	 DR Fernando Dewayne Vosburgh	 DOCTOR:Fernando Dewayne Vosburgh
1122	 290	 Distribution:   FILE-COPY,   NSW-CANCER-REGISTRY	 PHI:Null
1122	 301	 CLINICAL:	 PHI:Null
1122	 375	 Colorectal cancer, liver mets. Dev delay. Transverse colon tumour, stoma.	 PHI:Null
1122	 388	 MACROSCOPIC:	 PHI:Null
1122	 823	 A. Specimen labelled "Gallbladderattached liver" consists of a previously unopened gallbladder 70mm in length and up to 110mm in circumference with a piece of attached liver tissue 30 x 25 x 17mm. The surface of the liver tissue is inked green. The mucosal surface is green and granular. No gallstones are seen. There is a likely cystic duct lymph node 7mm in maximum dimension. The attached liver tissue has a pale brown cut surface.	 PHI:Null
1122	 983	 Blocks: 1 - cystic duct margin and ?cystic duct lymph node; 2 - TS neck; 3 to 5 - representatives body of gallbladder and attached liver tissue; 6 - LS fundus.	 PHI:Null
1122	 1263	 B. Specimen labelled "Liver resection section segment 7" consists of a piece of liver tissue 115 x 90 x 34mm. The liver is serially sliced. There is a 38 x 37 x 25mm pale yellow firm nodule abutting the capsular surface. The nodule is 15mm away from the closest resection margin.	 PHI:Null
1122	 1440	 Blocks: 1 & 2 - paired sections of the nodule (capsule in block: 1 and margin in block: 2);3 - tumour in relation to capsule, reserve block; 4 - tumour in relation to capsule;	 PHI:Null
1122	 1492	 5 - liver away from the tumour(Masson's requested).	 PHI:Null
1122	 1945	 C. Specimen labelled "Ileostomy" consists of two fragments of bowel. Fragment 1 is 50mm long and 25mm in diameter and mesenteric fatty tissue up to 35mm across. It has one stapled end and one opened end. Fragment 2 is ragged and measures 55 x 10 x 10mm with attached mesenteric fatty tissue 35mm in maximum dimension. It is stapled along on edge. The mucosa in both fragments appears normal. No lymph nodes are seen in the mesenteric fat of fragment 2.	 PHI:Null
1122	 2156	 Blocks: 1 - shaved stapled end of fragment 1; 2 - LS open end of fragment 1; 3 - two likely lymph nodes fragment 1; 4 - one bisected lymph node fragment 1; 5 - shaved stapled end of fragment 2. (LP/bl 15/12063)	 DOCTOR:LP
1122	 2156	 Blocks: 1 - shaved stapled end of fragment 1; 2 - LS open end of fragment 1; 3 - two likely lymph nodes fragment 1; 4 - one bisected lymph node fragment 1; 5 - shaved stapled end of fragment 2. (LP/bl 15/12063)	 DATE:15/12063=>2063-01-15
1122	 2211	 MICROSCOPIC (reported by Dr W Tyrrell & Dr W Grattan):	 DOCTOR:W Tyrrell
1122	 2211	 MICROSCOPIC (reported by Dr W Tyrrell & Dr W Grattan):	 DOCTOR:W Gratta
1122	 2666	 A. Sections show gallbladder with no significant abnormality. The attached liver shows mild steatosis with noactive inflammation. There is a very mild non-specific chronic inflammatory cell infiltrate within the portal tracts with no interface hepatitis. There is a prominent multinucleated giant cell reaction adjacent to the liver, possibly related to previous abdominal surgery. One benign lymph node is identified. There is no evidence of malignancy.	 PHI:Null
1122	 2911	 B.Sections of liver show a single 38mm deposit of metastatic adenocarcinoma with luminal necrosis consistent with a colorectal primary.  Large areas of necrosis are present centrally within thetumour. The tumour abuts but does no extend through	 PHI:Null
1122	 3140	 the liver capsule. The surgical resections margins are well clear of the tumour. The surrounding liver shows mildto moderate steatosis with an intact lobular architecture. There is no active inflammation seen within the lobules.	 PHI:Null
1122	 3298	 C. Sections show ileum with focal prolapse changes consistent with an ileostomy. Three benign lymph nodes are identified. There is no evidence of malignancy.	 PHI:Null
1122	 3308	 DIAGNOSIS	 PHI:Null
1122	 3335	 A. Gallbladder and liver:	 PHI:Null
1122	 3357	 - Normal gallbladder.	 PHI:Null
1122	 3381	 - Foreign body reaction	 PHI:Null
1122	 3407	 - One negative lymph node	 PHI:Null
1122	 3427	 B. Liver segment 7:	 PHI:Null
1122	 3506	 - Metastatic adenocarcinoma consistent with colorectal primary, margins clear	 PHI:Null
1122	 3569	 - Mild to moderate steatosis with intact lobular architecture.	 PHI:Null
1122	 3612	 C. Ileostomy: - No significant abnormality	 PHI:Null
1124	 24	 Episode No:  44B207485E	 IDNUM:44B207485E
1124	 36	 4402074.WNE	 MEDICALRECORD:4402074.WNE
1124	 55	 Spillett, CONNIE	 PATIENT:Spillett, CONNIE
1124	 73	 Lab No:  44B20748	 IDNUM:44B20748
1124	 82	 Blue Cow	 STREET:Blue Cow
1124	 105	 CAMDEN HAVEN  NT  5067	 CITY:CAMDEN HAVEN
1124	 105	 CAMDEN HAVEN  NT  5067	 STATE:NT
1124	 105	 CAMDEN HAVEN  NT  5067	 ZIP:5067
1124	 122	 Specimen: Tissue	 PHI:Null
1124	 139	 D.O.B:  9/4/1983	 DATE:9/4/1983=>1983-04-09
1124	 147	 Sex:  F	 PHI:Null
1124	 171	 Collected: Unknown at :	 PHI:Null
1124	 238	 Location:  Laverty - MERCY HEALTH - O'CONNELL FAMILY CENTRE CAMPUS	 DEPARTMENT:Laverty
1124	 238	 Location:  Laverty - MERCY HEALTH - O'CONNELL FAMILY CENTRE CAMPUS	 HOSPITAL:MERCY HEALTH - O'CONNELL FAMILY CENTRE CAMPUS
1124	 264	 DR Prince Landon Brazzell	 DOCTOR:Prince Landon Brazzell
1124	 313	 Distribution:   FILE-COPY,   NSW-CANCER-REGISTRY	 PHI:Null
1124	 323	 CLINICAL:	 PHI:Null
1124	 525	 Paget's disease vulva.  Invasion post vulva.  (L) groin node.  Left medial inguinal lymph node.  Paget's disease vulva with biopsy proven invasion.  Radical vulvectomy and left groin lymphadenectomy.	 PHI:Null
1124	 611	 1.  Medial lymph nodes.  2.  Lateral lymph nodes.  3.  Radical vulvectomy specimen.	 PHI:Null
1124	 624	 MACROSCOPIC:	 PHI:Null
1124	 820	 A.  Specimen labelled "Left medial inguinal lymph node" consists of a piece of fatty tissue 40mm in maximum dimension containing a tan rubbery lymph node 20mm.  Two TS taken for frozen section.	 PHI:Null
1124	 892	 Blocks:  1 - frozen section; 2- remainder of lymph node all embedded.	 PHI:Null
1124	 914	 FROZENSECTION REPORT:	 PHI:Null
1124	 924	 Negative.	 PHI:Null
1124	 988	 Phone result to anaesthetist by Dr L Wu at 12.45pm on 17.04.13.	 DOCTOR:L Wu
1124	 988	 Phone result to anaesthetist by Dr L Wu at 12.45pm on 17.04.13.	 TIME:at 12.45pm on 17.04.13=>2013-04-17T12:45
1124	 1701	 B.  Specimen labelled "Radical vulvectomy stitch left anterior" consists of an orientated irregular piece of vulva with a stitch attached to one end designated anterior left measuring 135mm (anterior to posterior) x95mm (left to right) to a depth of 25mm.  Over large areas of the vulva there is an irregular ulcerated lesion measuring 115 x 67mm which comes close to the left and right margins.  There is a full thickness disruption around the anterior portion which goes into the centre of the specimen.  The left margin is inked black and the right margin is inked blue.  Specimen serially sectioned in the left to right plane and AE 109 blocks from anterior to posterior.  Please refer to attached diagram.	 PHI:Null
1124	 1911	 C.  Specimen labelled "Posterior vulva fat" consists of fragments of irregular fatty tissue from 5 to 40mm in maximal dimension.  No definite lymph nodes are identified.  Representative sections in 3 blocks.	 PHI:Null
1124	 2099	 D.  Specimen labelled "Left lateral inguinal lymph node" consists of a piece of unorientated fatty tissue 50mm in maximal dimension.  Multiple lymph nodes are identified from 3 to 18mm.	 PHI:Null
1124	 2163	 Blocks:  1 & 2 - lymph nodes; 3 -further tissue ?lymph nodes.	 PHI:Null
1124	 2335	 E.  Specimen labelled "Left medial inguinal lymph node" consists of an unorientated piece 65mm in maximum dimension.  Multiple lymph nodes are identified from 2 to 22mm.	 PHI:Null
1124	 2425	 Blocks:  1 & 2 - lymph nodes; 3 - one lymph node bisected; 4 & 5 - further lymph nodes.	 PHI:Null
1124	 2558	 F.  Specimen labelled "Left femoral node" consists of a piece of tan and fatty tissue 12mm.  AE 1 block.  (TO:  HP:  ND/mm 20.6.63)	 DOCTOR:HP
1124	 2558	 F.  Specimen labelled "Left femoral node" consists of a piece of tan and fatty tissue 12mm.  AE 1 block.  (TO:  HP:  ND/mm 20.6.63)	 DOCTOR:ND
1124	 2558	 F.  Specimen labelled "Left femoral node" consists of a piece of tan and fatty tissue 12mm.  AE 1 block.  (TO:  HP:  ND/mm 20.6.63)	 DATE:20.6.63=>2063-06-20
1124	 2598	 MICROSCOPIC (reported by Dr L Gammage):	 DOCTOR:L Gammage
1124	 2653	 A.  Sections show one lymph node.  No tumour is seen.	 PHI:Null
1124	 3270	 B.  Sections show skin and squamous mucosa with underlying tissue.  There is extensive Paget's disease involving the epidermis and squamous mucosa and extending down skin appendage structures.  There is also an invasive poorly differentiated adenocarcinoma present.  This is on the left side in the mid part of the specimen (blocks 50, 53, 56, 59, 62).  It measures around 23mm in maximum diameter.  Maximum depth of invasion is 4mm.  There is mucin in the cytoplasm of some tumour cells.  No lymphovascular or perineural invasion is identified.  The invasive carcinomais greater than 10mm from all excision margins.	 PHI:Null
1124	 3549	 Changes of Paget's disease extend to the anterior and posterior excision margins, the right lateral margin (blocks B8, B64, B84), the right introital margin (blocks B18, B22, B57), the left introital margin (blocks B4, B10) and the left lateral margin (blocks B3, B23, B40).	 PHI:Null
1124	 3622	 C.  Sections show fat only.  No tumour is seen.  No lymph node is seen.	 PHI:Null
1124	 3679	 D.  Sections show eight lymph nodes.  No tumour is seen.	 PHI:Null
1124	 3734	 E.  Sections show ten lymph nodes.  No tumour is seen.	 PHI:Null
1124	 3797	 F.  Sections show one lymph node.  No tumour is seen.    (ec)	 PHI:Null
1124	 3811	 DIAGNOSIS:	 PHI:Null
1124	 3867	 A.  Left medial inguinal lymph node:  No tumour (0/1).	 PHI:Null
1124	 3970	 B.  Radical vulvectomy:  Extensive Paget's disease and invasive poorly differentiated adenocarcinoma.	 PHI:Null
1124	 4008	 C.  Posterior vulva fat:  No tumour.	 PHI:Null
1124	 4065	 D.  Left lateral inguinal lymph nodes:  No tumour (0/8).	 PHI:Null
1124	 4122	 E.  Left medial inguinal lymph nodes:  No tumour (0/10).	 PHI:Null
1124	 4164	 F.  Left femoral node:  No tumour (0/1).	 PHI:Null
1126	 25	 Episode No:  65T9073436	 IDNUM:65T9073436
1126	 36	 657907.JKJ	 MEDICALRECORD:657907.JKJ
1126	 52	 WALSTAD, ELIA	 PATIENT:WALSTAD, ELIA
1126	 70	 Lab No:  65T90734	 IDNUM:65T90734
1126	 83	 East Olivera	 STREET:East Olivera
1126	 101	 ORBOST  TAS  6221	 CITY:ORBOST
1126	 101	 ORBOST  TAS  6221	 STATE:TAS
1126	 101	 ORBOST  TAS  6221	 ZIP:6221
1126	 118	 Specimen: Tissue	 PHI:Null
1126	 137	 D.O.B:  11/12/2004	 DATE:11/12/2004=>2004-11-12
1126	 145	 Sex:  F	 PHI:Null
1126	 171	 Collected: 23/7/2062 at :	 DATE:23/7/2062=>2062-07-23
1126	 243	 Location:  Hunter Area Pathology-CLONCURRY MULTI-PURPOSE HEALTH SERVICE	 DEPARTMENT:Hunter Area Pathology
1126	 243	 Location:  Hunter Area Pathology-CLONCURRY MULTI-PURPOSE HEALTH SERVICE	 HOSPITAL:CLONCURRY MULTI-PURPOSE HEALTH SERVICE
1126	 274	 DR Otha Lawrence WESTON-Valant	 DOCTOR:Otha Lawrence WESTON-Valant
1126	 323	 Distribution:   FILE-COPY,   NSW-CANCER-REGISTRY	 PHI:Null
1126	 333	 CLINICAL:	 PHI:Null
1126	 462	 Left breast lesion.  IDC left breast 2 o'cl - wide local excision.  SLNB.  Suture - short superior, long lateral, medium medial.	 PHI:Null
1126	 475	 MACROSCOPIC:	 PHI:Null
1126	 650	 A.  Specimen labelled "Left axillary sentinel node bx", received fresh, consists of fibrofatty tissue 55 x 20 x 9mm containing a lymph node 25 x 12 x 9mm.  Two imprints done.	 PHI:Null
1126	 681	 Blocks:1 & 2 - one lymph node.	 PHI:Null
1126	 706	 IMPRINT CYTOLOGY REPORT:	 PHI:Null
1126	 731	 One negative lymph node.	 PHI:Null
1126	 798	 Phone result to anaesthetist by Dr Q Riggens at 1635hr on 21/5/12.	 DOCTOR:Q Riggens
1126	 798	 Phone result to anaesthetist by Dr Q Riggens at 1635hr on 21/5/12.	 TIME:1635hr on 21/5/12=>2012-05-21T16:35
1126	 1794	 B.  Specimen labelled "Left breast lesion; long lateral, short superior, medium medial" consists of a piece of firm breast tissue measuring 110mm (lateral-medial) x 45mm (superior-inferior) x 90mm (superficial-deep).  The skin ellipse on the superficial aspect is 70 x 15mm and appears normal.  Three marking sutures are present as described.  The superior surface is inked red, the inferior surface is inked green and the deep surface is inked black.  The specimen is serially sliced from lateral to medial into eighteen slices.  There is an indurated tumour with a pale cut surface measuring 22 x 18 x 13mm.  There are haemorrhagic areas within the tumour.  The tumour is 56mm from lateral, 45mm from medial, 12mmfrom superior, 3mm from inferior, 20mm from superficial and 50mm from deep margins.  The remainder of the breast tissue is fatty and unremarkable.  Within the specimen jar, there is a separate piece of fibrofatty tissue measuring 12 x 10x 5mm.  Its outer surface is inked green.	 PHI:Null
1126	 2392	 Blocks:  1 & 2 - middle third of slice 10 (block 1 - tumour and superficial margin); 3 to 10 - all of slice 11 blocked from deep to superficial (block 7 - ER, PR, HER2, Ki-67); 11 to19 - all of slice 12 blocked from deep to superficial (block 15 - reserved block for tumour banking); 20 & 21 - middle third of slice 13; 22 & 23 - middle third of slice 9; 24 & 25 - paired sections from slice 15; 26 - representative sections slice 1 (lateral margin); 27 - representative sections slice 18 (medial margin); 28 - separate piece of tissue bisected; 29 - another section from slice 18 (medial margin).	 PHI:Null
1126	 2627	 Further tissue: Block 30-37 - slice 16 AE from deep to superficial clockwise; 38-45 - slice 7 AE from deep to superficial clockwise; 46-49 - remainder slice 18 from deep to superficial.   Please see attached diagram.   (HM/cc 24/7/62)	 DATE:24/7/62=>2062-07-24
1126	 2629	 	 PHI:Null
1126	 2668	 MICROSCOPIC (Reported by Dr Q Fazio):	 DOCTOR:Q Fazio
1126	 2928	 A.  One lymph node is identified.  The tumour is involved by a small deposit of metastatic ductal carcinoma (isolated tumour cells, measuring less than 0.2mm).  This is detected by both H&E and immunohistochemical examinations.  There is no extranodal spread.	 PHI:Null
1126	 3024	 B.  Two separate invasive tumours are identified.  Pleasesee synoptic report below for details.	 PHI:Null
1126	 3061	 Synoptic Report for Breast Carcinoma	 PHI:Null
1126	 3071	 Tumour 1	 PHI:Null
1126	 3091	 Invasive carcinoma:	 PHI:Null
1126	 3110	 Site:  Left breast	 PHI:Null
1126	 3148	 Type:  Invasive ductal carcinoma, NOS	 PHI:Null
1126	 3176	 Invasive tumour size:  22mm	 PHI:Null
1126	 3216	 Grade (Modified Bloom & Richardson):  3	 PHI:Null
1126	 3284	 Tubules: 2     Nuclei: 3     Mitoses: 3     Mitotic rate: 16/10hpf.	 PHI:Null
1126	 3330	 Lymphovascular invasion:  Present (extensive)	 PHI:Null
1126	 3336	 	 PHI:Null
1126	 3354	 DCIS component:	 PHI:Null
1126	 3368	 DCIS:  Absent	 PHI:Null
1126	 3388	 Excision Margins:	 PHI:Null
1126	 3570	 Invasive component:  The invasive carcinoma is 2mm from inferior margin (block B20), is 15mm from superior margin (block 16) and is well clear of the other margins (more than 15mm).	 PHI:Null
1126	 3605	 In-situ component:  Not applicable	 PHI:Null
1126	 3628	 Receptors (Block B7):	 PHI:Null
1126	 3642	 ER:  Positive	 PHI:Null
1126	 3665	 95% of nuclei stained	 PHI:Null
1126	 3708	 predominant intensity of staining: strong	 PHI:Null
1126	 3729	 PR:  Weakly positive	 PHI:Null
1126	 3751	 5% of nuclei stained	 PHI:Null
1126	 3797	 predominant intensity of staining:  moderate	 PHI:Null
1126	 3846	 HER-2 (Novocastra 10A7):  Negative (1+ staining)	 PHI:Null
1126	 3864	 Ki-67 index:  35%	 PHI:Null
1126	 3873	 Tumour 2	 PHI:Null
1126	 3893	 Invasive carcinoma:	 PHI:Null
1126	 3912	 Site:  Left breast	 PHI:Null
1126	 3946	 Type:  Invasive lobular carcinoma	 PHI:Null
1126	 3974	 Invasive tumour size:  24mm	 PHI:Null
1126	 4014	 Grade (Modified Bloom & Richardson):  1	 PHI:Null
1126	 4081	 Tubules: 3     Nuclei: 1     Mitoses: 1     Mitotic rate: 1/10hpf.	 PHI:Null
1126	 4114	 Lymphovascular invasion:  Absent	 PHI:Null
1126	 4120	 	 PHI:Null
1126	 4138	 DCIS component:	 PHI:Null
1126	 4152	 DCIS:  Absent	 PHI:Null
1126	 4172	 Excision Margins:	 PHI:Null
1126	 4372	 Invasive component:  The invasive lobular carcinoma focally involves the medial margin (block B48) and is 3.5mm to the inferior margin (block B36).  The other margins are well clear (more than 10mm).	 PHI:Null
1126	 4407	 In-situ component:  Not applicable	 PHI:Null
1126	 4431	 Receptors (Block B36):	 PHI:Null
1126	 4446	 ER:  To follow	 PHI:Null
1126	 4461	 PR:  To follow	 PHI:Null
1126	 4497	 HER-2 (Novocastra 10A7):  To follow	 PHI:Null
1126	 4521	 Ki-67 index:  To follow	 PHI:Null
1126	 4545	 Nipple:  Not applicable	 PHI:Null
1126	 4566	 LCIS / ALH:  Absent	 PHI:Null
1126	 4581	 Miscellaneous:	 PHI:Null
1126	 4763	 - The small separate piece of tissue embedded in block B28 is a lymph node.  This is counted as an axillary lymph node.  The lymph node is involved by metastatic ductal carcinoma.	 PHI:Null
1126	 4876	 - 2 of 2 lymph nodes are involved by metastatic ductal carcinoma.  The tumour cells are positive for E-Cadherin.	 PHI:Null
1126	 4944	 - The invasive ductal carcinoma is present in slice 10 to slice 13.	 PHI:Null
1126	 5056	 - The invasive lobular carcinoma is present in slice 15 to slice 19 measuring 24mm in diameter microscopically.	 PHI:Null
1126	 5080	 Sentinel lymph node(s):	 PHI:Null
1126	 5124	 Number of sentinel lymph nodes examined:  1	 PHI:Null
1126	 5178	 Number of sentinel lymph nodes involved by tumour:  1	 PHI:Null
1126	 5230	 Number of sentinel nodes with metastases >2.0mm:  0	 PHI:Null
1126	 5293	 Number of sentinel nodes with isolated tumour cells <0.2mm:  1	 PHI:Null
1126	 5312	 Detected by:  H&E	 PHI:Null
1126	 5339	 Extranodal spread:  Absent	 PHI:Null
1126	 5361	 Axillary/other nodes:	 PHI:Null
1126	 5405	 Number of axillary lymph nodes examined:  1	 PHI:Null
1126	 5459	 Number of axillary lymph nodes involved by tumour:  1	 PHI:Null
1126	 5511	 Number of axillary nodes with metastases >2.0mm:  0	 PHI:Null
1126	 5563	 Number of axillary nodes with metastases <2.0mm:  1	 PHI:Null
1126	 5626	 Number of axillary nodes with isolated tumour cells <0.2mm:  0	 PHI:Null
1126	 5653	 Extranodal spread:  Absent	 PHI:Null
1126	 5671	 Lymph node total:	 PHI:Null
1126	 5741	 Total number of lymph nodes examined (including sentinel node(s)):  2	 PHI:Null
1126	 5811	 Total number of involved lymph nodes (including sentinel node(s)):  2	 PHI:Null
1126	 5820	 SUMMARY:	 PHI:Null
1126	 5848	 A & B.  Left breast lesion	 PHI:Null
1126	 5871	 Two separate tumours;	 PHI:Null
1126	 5946	 Tumour 1: Invasive ductal carcinoma (22mm, grade 3), completely excised;	 PHI:Null
1126	 5994	 ER positive/PR weakly positive/HER-2 negative;	 PHI:Null
1126	 6049	 Tumour 2: Invasive lobular carcinoma (24mm, grade 1);	 PHI:Null
1126	 6109	 Focally involves the medial margin (see text for details);	 PHI:Null
1126	 6133	 ER/PR/HER-2 to follow;	 PHI:Null
1126	 6194	 2 of 2 lymph nodes involved by metastatic ductal carcinoma.	 PHI:Null
1126	 6323	 The HER-2 ISH test will be performed at BIGGENDEN MULTIPURPOSE HEALTH SERVICE Hospital and an additional report will be issued.	 HOSPITAL:BIGGENDEN MULTIPURPOSE HEALTH SERVICE
1126	 6358	 SUPPLEMENTARY REPORT (22/8/2062):	 DATE:22/8/2062=>2062-08-22
1126	 6468	 Please see report of 65T90734 for hormonal status (ER/PR/HER-2/Ki-67) regarding tumour 2 (lobular carcinoma).	 IDNUM:65T90734
1126	 6499	 ADDITIONAL REPORT (27/8/2062):	 DATE:27/8/2062=>2062-08-27
1126	 6601	 Blocks were sent to NORTH WEST REGIONAL HOSPITAL Hospital for Her-2 CISH analysis, Dr Q Aben reports:	 HOSPITAL:NORTH WEST REGIONAL HOSPITAL
1126	 6601	 Blocks were sent to NORTH WEST REGIONAL HOSPITAL Hospital for Her-2 CISH analysis, Dr Q Aben reports:	 DOCTOR:Q Abe
1126	 6610	 Tumour 1	 PHI:Null
1126	 6690	 Her 2 in situ hybridisation: (Her2 CISH Invitrogen SPOT-Light assay, block B7)	 PHI:Null
1126	 6742	 Her2 CISH result: NEGATIVE (non-amplified, diploid)	 PHI:Null
1126	 6779	 Mean Her2 copy number per cell: 1.75	 PHI:Null
1126	 6788	 Tumour 2	 PHI:Null
1126	 6869	 Her 2 in situ hybridisation: (Her2 CISH Invitrogen SPOT-Light assay, block B36)	 PHI:Null
1126	 6921	 Her2 CISH result: NEGATIVE (non-amplified, diploid)	 PHI:Null
1126	 6958	 Mean Her2 copy number per cell: 1.80	 PHI:Null
1126	 7003	 SCORING CRITERIA (ASCO/CAP recommendations):	 PHI:Null
1126	 7047	 1 to <2.5 copies:   Non amplified (diploid)	 PHI:Null
1126	 7092	 2.5 to <4 copies:   Nonamplified (polysomy)	 PHI:Null
1126	 7119	 4 to 6 copies:  Equivocal	 PHI:Null
1126	 7163	 >6 but < 10 copies: Low level amplification	 PHI:Null
1126	 7207	 10 or more copies:  High level amplified.	 PHI:Null
1127	 13	 3917577.MIK	 MEDICALRECORD:3917577.MIK
1127	 26	 Dillin, Dora	 PATIENT:Dillin, Dora
1127	 35	 39C75774	 IDNUM:39C75774
1127	 68	 Last edited : 1/7/2062  Page: 2	 DATE:1/7/2062=>2062-07-01
1127	 78	 CLINICAL:	 PHI:Null
1127	 289	 Liver metastasis.  Ca bowel.  Central liver resection.Previous anal carcinoma.  Liver met.  Please note a 5mm wedge of tumour was excised from the middle of the tumour capsule for the liver tumour bank at UNSW.	 PHI:Null
1127	 302	 MACROSCOPIC:	 PHI:Null
1127	 1022	 Specimen labelled "Central liver" consists of a liver resection 140 x 45 x 68mm with an attached 84mm gallbladder (30mm in diameter), weighing 278g in total.  The capsular surface is extended by tumour over a 75 x 64mm area although the tumour does not appear to breach the capsule macroscopically.  A 7mm square of tumour has been removed from this capsular surface.  On section, thetumour appears to abut the gallbladder wall but does not extend into gallbladder.  The cystic duct lymph node measures 20mm and appears involved by tumour.  The gallbladder mucosa shows diffuse cholesterolosis.  The tumour measures 9mm fromthe nearest liver resection margin.  The uninvolved liver appears macroscopically unremarkable.	 PHI:Null
1127	 1335	 Blocks:  1 - tumour and nearest resection margin; 2 - tumour and gallbladder wall; 3 - tumour and capsule; 4 - 5 - further representative tumour; 6 - cystic duct, neck and lymph node; 7 - gallbladder body and fundus; 8 - representative uninvolved liver away from tumour; reselect block 9 - tumour reserve block.	 PHI:Null
1127	 1351	 (VA/bl 27/7/62)	 DOCTOR:VA
1127	 1351	 (VA/bl 27/7/62)	 DATE:27/7/62=>2062-07-27
1127	 1390	 MICROSCOPIC (Reported by Dr I Gosier):	 DOCTOR:I Gosier
1127	 2111	 The sections show moderately differentiated squamous cell carcinoma. The tumour is 2mm from the closest resection margin (block 2).   Tumour emboli are present in thin walled dilated lymphovascular channels.  The tumour abuts large bile ducts and occasional tumour nests invade into bile ducts (block 5).  The tumour does not invade into the gallbladder.  The tumour is close (< 0.1mm) to the capsular surface but does not breach the capsule.   Metastatic squamous cell carcinomareplaces most of the cystic duct lymph node but without extracapsular spread (block 6).  The uninvolved liver shows patchy mild chronic inflammation in the portal tracts.  The gallbladder shows cholesterolosis and mild chronic cholecystitis.	 PHI:Null
1127	 2312	 Immunoperoxidase stains show strong P16 and keratin 19 antigen expression in the tumour cells.  There is no convincing expression of keratin 7, oestrogen and progesterone antigens in the tumour cells.	 PHI:Null
1127	 2323	 CONCLUSION	 PHI:Null
1127	 2500	 Liver (central liver resection): Metastatic squamous cell carcinoma, 2mm from closest resection margin; lymphovascular spread present, tumour deposit in cystic duct lymph node.	 PHI:Null
1128	 24	 Episode No:  34G5293503	 IDNUM:34G5293503
1128	 36	 3425293.OAJ	 MEDICALRECORD:3425293.OAJ
1128	 56	 SIRACUSE, BRENDON	 PATIENT:SIRACUSE, BRENDON
1128	 74	 Lab No:  34G52935	 IDNUM:34G52935
1128	 86	 Platt House	 STREET:Platt House
1128	 114	 KURRI KURRI  Victoria  3166	 CITY:KURRI KURRI
1128	 114	 KURRI KURRI  Victoria  3166	 STATE:Victoria
1128	 114	 KURRI KURRI  Victoria  3166	 ZIP:3166
1128	 131	 Specimen: Tissue	 PHI:Null
1128	 149	 D.O.B:  27/3/1998	 DATE:27/3/1998=>1998-03-27
1128	 157	 Sex:  M	 PHI:Null
1128	 188	 Collected: 24/05/2012 at 14:58	 TIME:24/05/2012 at 14:58=>2012-05-24T14:58
1128	 254	 Location:  SEALS central-BALLARAT HEALTH SERVICES (BASE HOSPITAL)	 DEPARTMENT:SEALS central
1128	 254	 Location:  SEALS central-BALLARAT HEALTH SERVICES (BASE HOSPITAL)	 HOSPITAL:BALLARAT HEALTH SERVICES (BASE HOSPITAL)
1128	 276	 DR Del Garrett Mataka	 DOCTOR:Del Garrett Mataka
1128	 325	 Distribution:   FILE-COPY,   NSW-CANCER-REGISTRY	 PHI:Null
1128	 335	 CLINICAL:	 PHI:Null
1128	 507	 Posterior right neck large SCC involving skin.  1. Wide local excision large mass right posterior triangle (modified radical neck dissection).  2. Remainder level 5 nodes.	 PHI:Null
1128	 522	 PH SCC pinna.	 PHI:Null
1128	 535	 MACROSCOPIC:	 PHI:Null
1128	 1079	 A.  Specimen labelled "Right wide local excision posterior triangle SCC" consists of an oval piece of skin 110 x 90mm attached to subcutaneous fat and skeletal muscle measuring 130 x118 x 35mm in total.  The skin bears an ulcerated nodule 55 x 35mm, macroscopically well clear of margins.  Sectioning reveals a lymph node involved by tumour deep to nodule.  Thetumour involved lymph node extends to within 4mm of the deep margin and 2mm of the inferior margin.  Further sectioning reveals other involved lymph nodes within the neck dissection.	 PHI:Null
1128	 1455	 Blocks:  1 - anterior skin margin; 2 - posterior skin margin; 3 - superior skin margin; 4 - inferior skin margin; 5 - deep margin of nodule deep to skin; 6 to 14 - lymph nodes as seen from superior to inferior (block 7 - one lymph node bisected); 15 & 16 - tumour reserve blocks; 17 to 19 - extra sections from the deep margin; 20 & 21 - extra sections from the skin surface.	 PHI:Null
1128	 1616	 B.  Specimen labelled "Remainder right level 5 node" consists of unorientated fibroadipose tissue 75 x 40 x 14mm, attached to a small amount of skeletal muscle.	 PHI:Null
1128	 1666	 Blocks:  1 to 7 -lymph nodes.   (CT/cc  27/7/62)	 DOCTOR:CT
1128	 1666	 Blocks:  1 to 7 -lymph nodes.   (CT/cc  27/7/62)	 DATE:27/7/62=>2062-07-27
1128	 1668	 	 PHI:Null
1128	 1708	 MICROSCOPIC: (Reported by Dr J Clarida)	 DOCTOR:J Clarida
1128	 2242	 A.  Sections show a large poorly differentiated squamous cell carcinoma extending from skin to underlying fascia and skeletal muscle. The carcinoma is ulcerated and appears to show an epidermal origin ie. it is most likely a primary. The deep excision margin is doubtful because of the discohesiveness of the carcinoma and the possibility of floaters atthe deep margin. The peripheral skin and soft tissue margins appear clear of tumour.  The carcinoma abuts the parotid gland and an intraparotid lymph node identified is uninvolved.	 PHI:Null
1128	 2437	 Five (5) of the twenty six (26) right cervical nodes identified contain or are largely replaced by metastatic squamous cell carcinoma, and two of these show focal perinodal infiltration (0.5mm).	 PHI:Null
1128	 2516	 B.  The twenty one (21) lymph nodes identified are negative for tumour.  (ec)	 PHI:Null
1128	 2529	 DIAGNOSIS:	 PHI:Null
1128	 2580	 A.  Right wide local excision, posterior triangle:	 PHI:Null
1128	 2663	 -    Poorly differentiated squamous cell carcinoma, size 55 x 35 x 35mm, doubtful	 PHI:Null
1128	 2740	 deep excision margin, peripheral margins clear, no perineural invasion.	 PHI:Null
1128	 2816	 -    Metastatic squamous cell carcinoma in 5/26 level 5 lymph nodes, focal	 PHI:Null
1128	 2849	 perinodal invasion (0.5mm).	 PHI:Null
1128	 2890	 B.  Remainder right level 5 lymph nodes:	 PHI:Null
1128	 2932	 -Lymph nodes (x21) negative for tumour.	 PHI:Null
1129	 25	 Episode No:  08Q379659E	 IDNUM:08Q379659E
1129	 36	 086379.QPZ	 MEDICALRECORD:086379.QPZ
1129	 60	 ABALOZ, CHAD Teresita	 PATIENT:ABALOZ, CHAD Teresita
1129	 87	 Lab No:  08Q37965,08Q37965	 IDNUM:08Q37965
1129	 87	 Lab No:  08Q37965,08Q37965	 IDNUM:08Q37965
1129	 95	 Nicanoa	 STREET:Nicanoa
1129	 123	 LARA  New South Wales  6564	 CITY:LARA
1129	 123	 LARA  New South Wales  6564	 STATE:New South Wales
1129	 123	 LARA  New South Wales  6564	 ZIP:6564
1129	 149	 Specimen: Washings,Tissue	 PHI:Null
1129	 167	 D.O.B:  22/6/1989	 DATE:22/6/1989=>1989-06-22
1129	 175	 Sex:  F	 PHI:Null
1129	 206	 Collected: 28/05/2012 at 08:12	 TIME:28/05/2012 at 08:12=>2012-05-28T08:12
1129	 261	 Location:  PARKES 9 EAST - PEEL HEALTH CAMPUS - PUBLIC	 DEPARTMENT:PARKES 9 EAST
1129	 261	 Location:  PARKES 9 EAST - PEEL HEALTH CAMPUS - PUBLIC	 HOSPITAL:PEEL HEALTH CAMPUS - PUBLIC
1129	 288	 DR NERISSA Bea Padarebones	 DOCTOR:NERISSA Bea Padarebones
1129	 337	 Distribution:   FILE-COPY,   NSW-CANCER-REGISTRY	 PHI:Null
1129	 370	 SUPPLEMENTARY REPORT (28.10.63):	 DATE:28.10.63=>2063-10-28
1129	 372	 	 PHI:Null
1129	 404	 SUPPLEMENTARY REPORT (8.11.62):	 DATE:8.11.62=>2062-11-08
1129	 406	 	 PHI:Null
1129	 416	 CLINICAL:	 PHI:Null
1129	 542	 78 year old woman with pelvic mass and elevated CA 125.  Hypercholesterolemia. Depression.  Hypothyroidism.  Omentalnodule.	 AGE:78
1129	 555	 MACROSCOPIC:	 PHI:Null
1129	 694	 A.  Specimen labelled "Omental nodule", consists of a nodular solid tumour measuring 50 x 30 x 16mm.  Two representative sections for FS.	 PHI:Null
1129	 731	 Block 1 &2 - FS; 3 & 4- rest of FS.	 PHI:Null
1129	 795	 FROZEN SECTION:  Poorly differentiated large cell malignancy.	 PHI:Null
1129	 852	 Result to Dr C Vant by Dr C Kugel at 9:35am on 28.5.12.	 DOCTOR:C Vant
1129	 852	 Result to Dr C Vant by Dr C Kugel at 9:35am on 28.5.12.	 DOCTOR:C Kugel
1129	 852	 Result to Dr C Vant by Dr C Kugel at 9:35am on 28.5.12.	 TIME:9:35am on 28.5.12=>2012-05-28T09:35
1129	 1523	 B.  Specimen labelled "Uterus, tubes, ovaries and sigmoid", consists of a uterus with a large tumour mass attachedand a segment of sigmoid colon attached.  The specimen  measures in 230 x 160 x 100mm.  The uterus measures 100 x 70 x 50mm.  The cervix measures 40 x 30 x 30mm.  The large and necrotic mass is located on the right and posterior aspects of the uterus and also extends inferior to the cervix.  The posterior surface of the mass is necrotic and very irregular and ragged but in the right adnexal region the mass mostly hasa smooth outer surface.  The segment of colon is attached to the left aspect of the uterus by multiple adhesions and the necrotic mass.	 PHI:Null
1129	 2083	 The endometrium measures 1mm in maximum thickness. The myometrium measures 30mm in maximum thickness and is infiltrated by the tumour mass from the posterior aspect.  The right fallopian tube and ovary are not identified.  The left fallopian tube measures 55mm in length and 5mm in maximum diameter and appears macroscopically unremarkable.  The left ovary measures 30 x 20 x 20mm and is adherent to the tumour mass.  On sectioning the cut surface appears totally replaced by tumour.  The cut surface of the tumour mass is necrotic, haemorrhagic and friable.	 PHI:Null
1129	 2332	 Blocks 1-4 - 1full LS anterior body and cervix; 5-11 - 1 full LS posterior body and cervix with tumour; 12-16 - 5 representative sections from the right adnexal tumour; 17 - 1TS from the right cornu; 18 - 2LS left Fimbria.; 19 - TS Fallopian tube	 PHI:Null
1129	 2565	 20 - 1TS left ovary; 21 - proximal margin of colon; 22 - distal margin of colon; 23-25 - colon with tumour; 26 - pericolic fat with tumorous deposit; 27 - tumour for tumour bank (taken from the right ovary); 28, 29 - further cervix.	 PHI:Null
1129	 2865	 C.  Specimen labelled "Omental cake", consists ofa piece of omentum with multiple tumour deposits.  It measures 350 x 130 x 50mm. The largest tumour deposit measures 110 x 80 x 50mm.  On sectioning of the tumour deposits are necrotic with areas of haemorrhage.  Representative sections in 3 blocks.	 PHI:Null
1129	 3259	 D.  Specimen labelled "Ileum", consists of a segment of ileum measuring 55mm in length and up to 30mm in maximum diameter.  The serosal surface has a ragged area measuring 20 x 15mm. The mucosal surface is unremarkable.  Proximal and distal section margins are inked blue and black.  Blocks 1-4 - 4LS of the specimen including distal and proximal margin with areas of ragged serosal surface.	 PHI:Null
1129	 3275	 (PG/ec 1.7.62)	 DATE:1.7.62=>2062-07-01
1129	 3314	 MICROSCOPIC: (Reported by Dr C Eggert)	 DOCTOR:C Eggert
1129	 3559	 A.  Sections show a deposit of poorly differentiated, high grade serous carcinoma.  This consists mainly of sheets of cells with large, pleomorphic nuclei and a variable amount of amphophilic cytoplasm.  There is some gland formation focally.	 PHI:Null
1129	 4272	 B.  Sections of the mass show a poorly differentiated (grade 3) serous carcinoma. Some of it consists of sheets of cells but there are patchy areas showing formation of slit-like glands.  There is patchy, prominent tumour necrosis.  Tumour is confirmed to invade the myometrium, and also invades the upper posterior endocervix, from the posterior aspect of the uterus and cervix.  There is very widespread lymphovascular invasion in the myometrium and in the cervix.  Sections of the cervix are otherwise unremarkable, apart from the tumour invasion of deep stroma of the upper posterior endocervix, and the extensive lymphovascular invasion.  Sections of the endometrium show that this is thin and inactive.	 PHI:Null
1129	 4635	 Sections of the right adnexal mass show similar tumour.  No definite ovarian tissue, and no fallopian tube, are identified in association with the right adnexal tumour in the sections examined.  Sectionsof the left fallopian tube are unremarkable.  Sections of the left ovary show tumour on the seroeal surface but with minimal involvement of the ovary itself.	 PHI:Null
1129	 5042	 Sections of the sigmoid colon show tumour on the serosal aspect and invading through the wall, focally into submucosa, but the mucosa appears intact.  Tumour is identified in seven out of seven (7/7) lymph nodes which were identified in the attached mesentery, and there is also prominent lymphovascular invasion in the mesentery. The proximal and distal excision margins of the colon are free of tumour.	 PHI:Null
1129	 5178	 C.  Sections of the omentum show extensive involvement by poorly differentiated serous carcinoma.  There is prominent tumour necrosis.	 PHI:Null
1129	 5418	 D.  Sections show small intestinal wall. There is serosal involvement by serous carcinoma.  The mucosa, submucosa and muscle layers are not involved. The proximal and distal resection margins of the bowel segment are free of tumour.  (ec)	 PHI:Null
1129	 5427	 Comment:	 PHI:Null
1129	 5553	 It seems most likely that the tumour has arisen in the right ovary, with the right ovary and tube now completely obliterated.	 DATE:now=>2065-07-30
1129	 5566	 DIAGNOSIS:	 PHI:Null
1129	 5627	 A.  Omental nodule:  Poorly differentiated serous carcinoma.	 PHI:Null
1129	 5959	 B.  Uterus, ovaries, fallopian tubes and sigmoid colon:  Poorly differentiated serous carcinoma involving right adnexa and surface of left ovary, invading posterior uterus and upper endocervix, and invading through wall of sigmoid colon into submucosa.  Widespread lymphovascular invasion.  Mesenteric lymph node metastases (7/7).	 PHI:Null
1129	 5996	 C.  Omental cake:  Serous carcinoma.	 PHI:Null
1129	 6049	 D.  Ileum:Serosal involvement by serous carcinoma.	 PHI:Null
1129	 6081	 SUPPLEMENTARY REPORT (8.11.62):	 DATE:8.11.62=>2062-11-08
1129	 6140	 B.  Immunostains for MMR have been performed as requested.	 PHI:Null
1129	 6177	 MSH2:    Preserved nuclear staining.	 PHI:Null
1129	 6214	 MSH6:    Preserved nuclear staining.	 PHI:Null
1129	 6251	 MLH1:    Preserved nuclear staining.	 PHI:Null
1129	 6288	 PMS2:    Preserved nuclear staining.	 PHI:Null
1129	 6427	 Preserved nuclear staining of a carcinoma for MLH1, PMS2, MSH2 and MSH6 indicates a low likelihood of microsatellite instabilityphenotype.	 PHI:Null
1129	 6460	 SUPPLEMENTARY REPORT (28.10.63):	 DATE:28.10.63=>2063-10-28
1129	 6519	 B.  Further immunostains have been performed as requested.	 PHI:Null
1129	 6550	 Oestrogen receptor:  Positive.	 PHI:Null
1129	 6628	 80% of tumour cells show positive staining.	 PHI:Null
1129	 6710	 Predominant intensity of staining:  Moderate.	 PHI:Null
1129	 6744	 Progesterone receptor:  Positive.	 PHI:Null
1129	 6826	 4% of tumour cells show positive staining.	 PHI:Null
1129	 6912	 Predominant intensity of staining:  Moderate.	 PHI:Null
1129	 6914	 	 PHI:Null
1129	 6916	 	 PHI:Null
1130	 12	 664499.SEU	 MEDICALRECORD:664499.SEU
1130	 27	 PITTA, VIRGINA	 PATIENT:PITTA, VIRGINA
1130	 36	 66M49971	 IDNUM:66M49971
1130	 69	 Last edited : 7/3/2062  Page: 2	 DATE:7/3/2062=>2062-07-03
1130	 79	 CLINICAL:	 PHI:Null
1130	 219	 R lobe papillary thyroid ca + Hashimoto's.  L lobe, R lobe, pre cricoid tissue, central neck dissection, L parathyroid LN-> superior pole.	 PHI:Null
1130	 232	 MACROSCOPIC:	 PHI:Null
1130	 956	 A.  Specimen labelled "Right thyroid", consists of a 26g thyroid lobe 55 x 44 x 35mm. The external surface is inked blue posteriorly and black anteriorly. The specimen is serially sliced from upper to lower pole. There is a tan indurated tumour occupying most of the thyroid lobe 38 x 24 x 23mm.  It abuts the inked margins. Obvious extra thyroid lobe extension is not seen.  It appears to be clear of the isthmus surgical margin.  Block 1 - upper pole; 2-11 - representative sections from upper towards lower pole; 12-14 - representative sections of the lower pole (4 & 5 - paired sections; 6-8 - paired sections; 9-11 - paired sections; 6 - reserved block for tumour banking) approximately 60% of the specimen is blocked.	 PHI:Null
1130	 1087	 B.  Specimen labelled "Left parathyroid lymph node superior", consists of a 15mg piece of nodular tissue 4 x 4 x 2mm. AE 1 block.	 PHI:Null
1130	 1501	 C.  Specimen labelled "Left hemithyroid, stitch at 12 o'clock", consists of a 13g thyroid lobe 45 x 25 x 13mm.  There is a suture marking 12 o'clock. The external surface is inked blue posteriorly and black anteriorly.  The specimen is serially sliced from 12-6 o'clock.  There is a pale nodule with a rubbery consistency extending from upper to mid lobe 25 x 15 x 8mm.  AE from 12 towards 6 o'clock, blocks 1-11.	 PHI:Null
1130	 1615	 D.  Specimen labelled "Pre cricoid lymph node", consists of a 15 x 10 x 6mm nodular piece of tissue. BAE 1 block.	 PHI:Null
1130	 1903	 E.  Specimen labelled "Central neck", consists of four fragments of fibrofatty tissue 60 x 40 x 22mm in aggregate.  Several lymph nodes are present.  Block1- three lymph nodes; 2 & 3 - comprise one bisected lymph node; 4 - two lymph nodes; 5-7 - comprise one lymph node.  (XV/ec  7.1.62)	 DOCTOR:XV
1130	 1903	 E.  Specimen labelled "Central neck", consists of four fragments of fibrofatty tissue 60 x 40 x 22mm in aggregate.  Several lymph nodes are present.  Block1- three lymph nodes; 2 & 3 - comprise one bisected lymph node; 4 - two lymph nodes; 5-7 - comprise one lymph node.  (XV/ec  7.1.62)	 DATE:7.1.62=>2062-07-01
1130	 1942	 MICROSCOPIC: (Reported by Dr Q Sidman)	 DOCTOR:Q Sidma
1130	 2197	 A. Sections show a 38mm papillary carcinoma. The lesion has a papillary architecture and is composed of tumour cells with nuclear clearing and nuclear grooves.  Psammoma bodies and intranuclear inclusions are seen.  Focal oncocytic change is identified.	 PHI:Null
1130	 2384	 The lesion is < 0.1 mm from the superficial margin and is 0.1 mm from tracheal margin.  There is no evidence of extrathyroid spread.  No convincing lymphovascular invasion is identified.	 PHI:Null
1130	 2451	 Two lymph nodes near the isthmus show no evidence of malignancy.	 PHI:Null
1130	 2647	 A prominent lymphoid infiltrate with germinal centres is seen in the adjacent thyroid gland, in keeping with the clinical history of Hashimoto's thyroiditis.  No parathyroid tissue is identified.	 PHI:Null
1130	 2709	 B. Sections show a lymph node with no evidence of malignancy.	 PHI:Null
1130	 2971	 C. Sections show a 4 mm papillary microcarcinoma in the superior pole. The lesion has a similar morphology to the nodule in the right thyroid and is 3.5 mm from the nearest tracheal margin.  There is noevidence of lymphovascular invasion or extrathyroid spread.	 PHI:Null
1130	 3090	 The adjacent thyroid gland show changes in keeping with Hashimoto's thyroiditis.  No parathyroid tissue is identified.	 PHI:Null
1130	 3152	 D. Sections show a lymph node with no evidence of malignancy.	 PHI:Null
1130	 3226	 E. Sections show 5 lymph nodes and thymus with no evidence of malignancy.	 PHI:Null
1130	 3237	 DIAGNOSIS	 PHI:Null
1130	 3259	 A. Right hemithyroid:	 PHI:Null
1130	 3286	 - 38mm papillary carcinoma	 PHI:Null
1130	 3312	 - Hashimoto's thyroiditis	 PHI:Null
1130	 3359	 - 2 lymph nodes with no evidence of malignancy	 PHI:Null
1130	 3444	 B. Left parathyroid lymph node superior: 1 lymph node with no evidence of malignancy	 PHI:Null
1130	 3465	 C. Left hemithyroid:	 PHI:Null
1130	 3510	 - 4mm papillary microcarcinoma superior pole	 PHI:Null
1130	 3536	 - Hashimoto's thyroiditis	 PHI:Null
1130	 3607	 D. Pre-cricoid lymph node: 1 lymph node with no evidence of malignancy	 PHI:Null
1130	 3691	 E. Central neck dissection: 5 lymph nodes and thymus with no evidence of malignancy	 PHI:Null
1131	 25	 Episode No:  87D090676Y	 IDNUM:87D090676Y
1131	 37	 8710906.SPY	 MEDICALRECORD:8710906.SPY
1131	 53	 LOMANTO, NIDA	 PATIENT:LOMANTO, NIDA
1131	 71	 Lab No:  87D09067	 IDNUM:87D09067
1131	 84	 Kimball Hill	 STREET:Kimball Hill
1131	 106	 LAUNCESTON  QLD  1314	 CITY:LAUNCESTON
1131	 106	 LAUNCESTON  QLD  1314	 STATE:QLD
1131	 106	 LAUNCESTON  QLD  1314	 ZIP:1314
1131	 123	 Specimen: Tissue	 PHI:Null
1131	 141	 D.O.B:  28/7/1997	 DATE:28/7/1997=>1997-07-28
1131	 149	 Sex:  F	 PHI:Null
1131	 180	 Collected: 29/05/2012 at 20:52	 TIME:29/05/2012 at 20:52=>2012-05-29T20:52
1131	 225	 Location:  StVincent - THE FORENSIC HOSPITAL	 DEPARTMENT:StVincent
1131	 225	 Location:  StVincent - THE FORENSIC HOSPITAL	 HOSPITAL:THE FORENSIC HOSPITAL
1131	 257	 DR Francine CATHARINE KIRCHHERR	 DOCTOR:Francine CATHARINE KIRCHHERR
1131	 306	 Distribution:   FILE-COPY,   NSW-CANCER-REGISTRY	 PHI:Null
1131	 338	 SUPPLEMENTARY REPORT (17.5.64):	 DATE:17.5.64=>2064-05-17
1131	 349	 CLINICAL:	 PHI:Null
1131	 389	 Total abdominal hysterectomy and BSO.	 PHI:Null
1131	 402	 MACROSCOPIC:	 PHI:Null
1131	 1309	 A.  Specimen labelled "Uterus, cervix, left tube and ovary" consists of a uterus with attached cervix and left fallopian tube and ovary weighing 174g in total.  The uterus measures 90 x 50 x 40mm and has a smooth shiny serosal surface.  The ectocervix measures 35 x 30 x 20mm and has an unremarkable surface.  On sectioning the endometrium is 2mm in maximum thickness and the myometrium is 40mm in maximum thickness.  The myometrium contains foci of adenomyosis.  Two intramural fibroids ranging from 2 to 5mm are identified.  On the posterior surface of the endometrial cavity there are two polyps measuring 30 and 15mm in maximum diameter.The fallopian tube measures 50mm in length and 5mm in maximum diameter.  The serosal surface is unremarkable.  The ovary measures 40 x 20 x 10mm and has a cyst with white creamy material measuring 15 x 15 x 10mm.  The rest of the ovarianparenchyma is unremarkable.	 PHI:Null
1131	 1879	 Blocks: 1 to 4 - one full longitudinal section of anterior body and cervix; 5 to 8 - one full longitudinal section of posterior body and cervix; 9 - one representative section of posterior endomyometrium with areas of adenomyosis; 10 - two endometrial polyps; 11 - one representative section of the intramural fibroid; 12 - two LS left fimbria; 13 - one TS left fallopian tube; 14 to 16 - three representative sections of ovary with cyst; 17 - two representative sections of left ovary; ADDITIONAL BLOCKS; 18 to 25 - anterior cervix AE;  26 to 31 - posterior cervix AE.	 PHI:Null
1131	 2415	 B.  Specimen labelled "Right tube and ovary" consists of a fallopian tube and attached ovary.  The fallopian tube measures 50mm inlength and up to 5mm in maximum diameter.  The serosal surface is unremarkable.  The ovary is enlarged and has a cystic appearance.  It measures 45 x 30 x 20mm.  On sectioning, a unilocular cyst with serous fluid is identified measuring 25x 25 x 20mm.  Apart from this, a nodular area with a fibrotic cut surface is identified measuring 20 x 10 x 10mm.  The rest of the ovarian parenchyma is unremarkable.	 PHI:Null
1131	 2659	 Blocks:  1 - two LS fimbria and one TS fallopian tube; 2 & 3 - composite of one longitudinal full face of ovary; 4 & 5 - composite of one longitudinal section of the ovary; 6 & 7 - representative sections of ovary with cyst and nodular lesion.	 PHI:Null
1131	 2799	 C.  Specimen labelled "Posterior vaginal cuff" consists of an irregular piece of fibrofatty tissue measuring 25 x 10 x 5mm.  AE one block.	 PHI:Null
1131	 2995	 D.  Specimen labelled "Greater omentum" consists of a piece of adipose tissue measuring 10 x 10 x 5mm.  On sectioning, a glistening yellow nodule measuring 5 x 5mm is identified.  BAE one block.	 PHI:Null
1131	 3167	 E.  Specimen labelled "External iliac lymph node" consists of a piece of fatty tissue10 x 7 x 5mm.  A node measuring 5mm in maximum diameter is identified.  AE one block.	 PHI:Null
1131	 3316	 F.  Specimen labelled "Omentum" consists of a piece of omentum measuring 300 x 100 x 10mm.  Three nodules are identified measuring from 5 to 15mm.	 PHI:Null
1131	 3432	 Blocks:  1 - three representative sections of omentum; 4 - tissue from one nodule for tissue bank.   (PG/cc 7/2/62)	 DATE:7/2/62=>2062-07-02
1131	 3434	 	 PHI:Null
1131	 3475	 MICROSCOPIC (Reported by Dr V Simbeck):	 DOCTOR:V Simbeck
1131	 3828	 A.  Sections show moderately differentiated serous carcinoma of the left ovary also involving the uterine serosa.  The ectocervix and endocervix show no significant abnormality.  The endometrium is inactive and contains two small benign polyps.  The myometrium shows adenomyosis and several small leiomyomas.  The tube shows no significant abnormality.	 PHI:Null
1131	 3961	 B.  Sections show moderately differentiated serous carcinoma involving the right ovary.  The tube shows no significant abnormality.	 PHI:Null
1131	 3997	 C.  Sections show serous carcinoma.	 PHI:Null
1131	 4049	 D.  One lymph node shows no evidence of malignancy.	 PHI:Null
1131	 4101	 E.  One lymph node shows no evidence of malignancy.	 PHI:Null
1131	 4167	 F.  The omentum shows moderately differentiated serous carcinoma.	 PHI:Null
1131	 4296	 DIAGNOSIS:differentiated serous carcinoma of both ovaries also involving the omentum, uterine serosa and posterior vaginal cuff.	 PHI:Null
1131	 4337	 ADDITIONAL REPORT 8/10/62 (Dr V Foesch):	 DATE:8/10/62=>2062-08-10
1131	 4337	 ADDITIONAL REPORT 8/10/62 (Dr V Foesch):	 DOCTOR:V Foesch
1131	 4398	 Additional clinical information:  ?SCC cervix (see 87D09067)	 IDNUM:87D09067
1131	 4676	 In view of this, the entire cervix was embedded and examined.  There is no evidence of CIN, AIS or squamous cell carcinoma.  A p16 stain is negative.  Moderately differentiated serous carcinoma identical to the above ovarian tumour is noted on the paracervical serosal surface.	 PHI:Null
1131	 5142	 The previous cervical biopsy (87D09067) has been reviewed again and compared to the current ovarian tumour.  The previous cervical biopsy has no resemblance to the current serous carcinoma: it is a poorly differentiated carcinoma, arranged in solid sheets, with no glandular differentiation.  Whilst it's morphology is more squamous than adenocarcinoma, it is possible that it may represent endometrioid or transitional differentiation of the same ovarian tumour.	 IDNUM:87D09067
1131	 5144	 	 PHI:Null
1131	 5188	 SUPPLEMENTARY REPORT (17.5.64, Dr V Enno):	 DATE:17.5.64=>2064-05-17
1131	 5188	 SUPPLEMENTARY REPORT (17.5.64, Dr V Enno):	 DOCTOR:V Enno
1131	 5343	 This is to clarify that moderately differentiated serous carcinoma is a high grade serous carcinoma in the two tier grading system (low grade/high grade).	 PHI:Null
1131	 5445	 A supplementary report has also been issued on the cervical biopsy specimen from 2061 (see 87D09067).	 DATE:2061=>2061
1131	 5445	 A supplementary report has also been issued on the cervical biopsy specimen from 2061 (see 87D09067).	 IDNUM:87D09067
1131	 5448	 	 PHI:Null
1132	 24	 Episode No:  08V691424J	 IDNUM:08V691424J
1132	 36	 0886914.HLJ	 MEDICALRECORD:0886914.HLJ
1132	 67	 SHUMSKI, Lionel CLAIR Dudley	 PATIENT:SHUMSKI, Lionel CLAIR Dudley
1132	 85	 Lab No:  08V69142	 IDNUM:08V69142
1132	 94	 Bramston	 STREET:Bramsto
1132	 115	 THIRLMERE  TAS  5273	 CITY:THIRLMERE
1132	 115	 THIRLMERE  TAS  5273	 STATE:TAS
1132	 115	 THIRLMERE  TAS  5273	 ZIP:5273
1132	 132	 Specimen: Tissue	 PHI:Null
1132	 150	 D.O.B:  23/7/2004	 DATE:23/7/2004=>2004-07-23
1132	 158	 Sex:  M	 PHI:Null
1132	 182	 Collected: Unknown at :	 PHI:Null
1132	 244	 Location:  DARLING POINT-MIDLANDS MULTI PURPOSE HEALTH CENTRE	 DEPARTMENT:DARLING POINT
1132	 244	 Location:  DARLING POINT-MIDLANDS MULTI PURPOSE HEALTH CENTRE	 HOSPITAL:MIDLANDS MULTI PURPOSE HEALTH CENTRE
1132	 267	 DR Boyce RAYMON Sodini	 DOCTOR:Boyce RAYMON Sodini
1132	 327	 Distribution:   FILE-COPY,   NSW-CANCER-REGISTRY, DR Reglin	 DOCTOR:Regli
1132	 338	 CLINICAL:	 PHI:Null
1132	 427	 Right liver resection for metastatic colorectal Ca.  Gallbladder specimen ?malignancy.	 PHI:Null
1132	 538	 (PH gastric GIST with lymph nodes and recurrence many years ago - not at WIMMERA HEALTH CARE GROUP - HORSHAM)	 HOSPITAL:WIMMERA HEALTH CARE GROUP - HORSHAM
1132	 573	 (PH of carcinoma colon - 08V69142)	 IDNUM:08V69142
1132	 587	 MACROSCOPIC:	 PHI:Null
1132	 1186	 A.  Specimen labelled "Right lobe liver" consists of right lobe liver measuring 180 x 160 x 70mm and weighing 1150g.  Sequential sectioning shows two distinct lesions.  Thelargest lesion is a well circumscribed, soft and haemorrhagic tumour 65 x 50 x 48mm.  The tumour abuts the resection margin (inked blue) over a broad front.  The second lesion shows an irregular outline and has a brownish honeycomb cutsurface.  It measures 45 x 45 x 28mm.  There are patchy pale tan/grey areas within this lesion. The tumour is at least 8mm from resection margin.  The background liver appears unremarkable.	 PHI:Null
1132	 1527	 Blocks:  1 to 4 - largest tumour (block1 tumour and capsule, 2 & 3 - tumour and resection margin; 4 - tumour and adjacent liver; 5 - reserved block for tumour bank; 6 to 8 - full face section of the second largest tumour; 9 to11 - tumour two (block 9 from closest margin); 12- tumour two; 13 - non neoplastic liver (special stains ordered).	 PHI:Null
1132	 1843	 B.  Specimen labelled "Gallbladder" consists of anintact gallbladder, 110mm in length and 48mm in diameter at fundus.  The serosa appears smooth and shiny.  The mucosa appears trabecular and the wall is up to 3mm in thickness.  No stones are identified.  There is a 10mm lymph node adjacent to cystic duct margin.	 PHI:Null
1132	 1924	 Blocks:  1 - lymph node, margin and neck; 2 - body; 3 - fundus.  (ZW/mm 3.7.62)	 DOCTOR:ZW
1132	 1924	 Blocks:  1 - lymph node, margin and neck; 2 - body; 3 - fundus.  (ZW/mm 3.7.62)	 DATE:3.7.62=>2062-07-03
1132	 1967	 MICROSCOPIC:  (Reported by Dr A Stibbins):	 DOCTOR:A Stibbins
1132	 2618	 A.   The large tumour deposit (65 x 50 x 48mm) is a metastatic epithelioid tumour which has a trabecular and neuroendocrine - like growth pattern.  The tumour is well circumscribed and is seen very close to the resection margin (clearance 0.1mm). There are scattered mitoses plus necrosis and haemorrhage. The Ki67 is 5%. The tumour shows strong positive staining for CD34 and C-kit (CD117) and the Hepar-1 and CD10 are negative. The tumour shows positive staining with CD56 but the chromogranin A and synaptophysin are negative. The CEA and S100 are negative. The cytokeratin stains (AE 1/3, CAM 5.2) as well as the SMA and desmin are also negative.	 PHI:Null
1132	 2736	 The second liver tumour (size 45 x 45 x 28mm) is a cavernous haemangioma which is 6mm clear of the resection margin.	 PHI:Null
1132	 2801	 The liver away from the two tumours appears essentially normal.	 PHI:Null
1132	 2944	 B.  The gallbladder shows mild chronic cholelithiasis plus mild thickening of the muscularis. The cystic duct lymph node appears normal. (ec)	 PHI:Null
1132	 2957	 DIAGNOSIS:	 PHI:Null
1132	 2999	 A, B.  Right lobe liver plus gallbladder:	 PHI:Null
1132	 3088	 -   Single deposit of metastatic GIST (gastro-intestinal stromal tumour), size 65 x 50 x	 PHI:Null
1132	 3139	 48mm, close surgical margin (clearance 0.1mm).	 PHI:Null
1132	 3203	 -   Cavernous haemangioma, size 45 x 45 x 28mm, margins clear.	 PHI:Null
1132	 3237	 -   Mild chronic cholecystitis.	 PHI:Null
1132	 3245	 	 PHI:Null
1133	 24	 Episode No:  29M292382U	 IDNUM:29M292382U
1133	 35	 294292.JVH	 MEDICALRECORD:294292.JVH
1133	 50	 Lucio, Corey	 PATIENT:Lucio, Corey
1133	 68	 Lab No:  29M29238	 IDNUM:29M29238
1133	 78	 Sewickley	 STREET:Sewickley
1133	 96	 KYABRAM  WA  6970	 CITY:KYABRAM
1133	 96	 KYABRAM  WA  6970	 STATE:WA
1133	 96	 KYABRAM  WA  6970	 ZIP:6970
1133	 113	 Specimen: Tissue	 PHI:Null
1133	 131	 D.O.B:  26/1/2004	 DATE:26/1/2004=>2004-01-26
1133	 139	 Sex:  F	 PHI:Null
1133	 164	 Collected: 6/8/2062 at :	 DATE:6/8/2062=>2062-08-06
1133	 220	 Location:  PRINCE OF WALES PRIVATE-CHARLEVILLE HOSPITAL	 DEPARTMENT:PRINCE OF WALES PRIVATE
1133	 220	 Location:  PRINCE OF WALES PRIVATE-CHARLEVILLE HOSPITAL	 HOSPITAL:CHARLEVILLE HOSPITAL
1133	 239	 DR Mack Jess Henly	 DOCTOR:Mack Jess Henly
1133	 288	 Distribution:   FILE-COPY,   NSW-CANCER-REGISTRY	 PHI:Null
1133	 298	 CLINICAL:	 PHI:Null
1133	 581	 62yo female with hx abdo pain.  Gastroscopy (N).  CT - large soft tissue mass in greater curvature of stomach + ?peritoneal nodule.  Laparoscopy for dx ?GIST.  Large ?GIST from stomach.  Pre-op PET ?2' on diaphragm on (R): No mass seen, just adhesions between (R) diaphragm + liver.	 AGE:62
1133	 604	 FROZEN SECTION REPORT:	 PHI:Null
1133	 638	 Spindle cell tumour, favour GIST.	 PHI:Null
1133	 710	 Phone result to Prof F Wierenga by Dr F Mahrenholz at 0955hr on 4/6/12.	 DOCTOR:F Wierenga
1133	 710	 Phone result to Prof F Wierenga by Dr F Mahrenholz at 0955hr on 4/6/12.	 DOCTOR:F Mahrenholz
1133	 710	 Phone result to Prof F Wierenga by Dr F Mahrenholz at 0955hr on 4/6/12.	 TIME:at 0955hr on 4/6/12=>2012-06-04T09:55
1133	 723	 MACROSCOPIC:	 PHI:Null
1133	 1042	 A.  Specimen labelled "Gastric tumour", received fresh for frozen section opinion, consists of a lobulated mass 120 x 100 x 70mm with attached pouch of stomach 50 x 40 x 20mm.  The cut surface shows tan tissue with central haemorrhage plus some necrosis.  The mucosal margin is inked black.  The mucosa appears normal.	 PHI:Null
1133	 1261	 Blocks:  1 & 2 - frozen section tissue; 3 to 5- sections of mucosal margin in relation to tumour; 6 to 8 - sections of tumour and its capsule (block 7 - reserved for tumour banking); 9 & 10 - furthersections of tumour.	 PHI:Null
1133	 1427	 B.  Specimen labelled "Gastric tumour" consists of a piece of tan solid tissue, 18 x 16 x 7mm.  The external surface is inked blue.  Serially sliced.  AE one block.	 PHI:Null
1133	 1577	 C.  Specimen labelled "Right diaphragmatic biopsy" consists of two pieces of solid red tissue 8 x 5 x 3 and 9 x 3 x 3mm.  AE one block.(XB/cc 8/7/62)	 DOCTOR:XB
1133	 1577	 C.  Specimen labelled "Right diaphragmatic biopsy" consists of two pieces of solid red tissue 8 x 5 x 3 and 9 x 3 x 3mm.  AE one block.(XB/cc 8/7/62)	 DATE:8/7/62=>2062-08-07
1133	 1579	 	 PHI:Null
1133	 1628	 MICROSCOPIC: (Reported by Dr P Salaz/Dr P Mccra)	 DOCTOR:P Salaz
1133	 1628	 MICROSCOPIC: (Reported by Dr P Salaz/Dr P Mccra)	 DOCTOR:P Mccra
1133	 2771	 A & B.  Specimens A and B show similar histopathologicalfeatures. The gastric tumour is a 120mm gastrointestinal stromal tumour (GIST). The GIST is adherent to and expands themuscularis propria and has a lobulated appearance. The tumour is variably moderately to highly cellular and is composed of plump to moderately atypical spindled cells arranged in interweaving fascicles with areas of nuclear palisading. In areas, the tumour cells show moderate cytologic atypia, including nuclear enlargement, vesicular chromatin and prominent nucleoli. Foci of myxoid degeneration, haemorrhage and oedema are present throughout the tumour. Mitoses are present, with up to 49 mitoses per 50 high power fields. A focus of possible incipient tumour associated necrosis isseen. The tumour appears clear of the gastric resection margin. Although much of the tumour largely surrounded by a thin rim of fibrous tissue and some attenuated muscularis propria, focally the tumour extends to the inked (serosal) surface. There is no involvement of the overlying gastric submucosa or mucosa, which shows features of a patchy mild non-specific chronic gastritis.	 PHI:Null
1133	 2845	 Immunohistochemical stains were performed and the results are as follows:	 PHI:Null
1133	 2884	 Tumour cells positive for:CD117, CD34.	 PHI:Null
1133	 2934	 Tumour cells negative for: SMA, Desmin and S100.	 PHI:Null
1133	 3023	 The Ki-67 immunoproliferative index highlights approximately 15% of tumour cell nuclei.	 PHI:Null
1133	 3144	 C. The specimen shows fragments of organising haemorrhage and fibrous tissue. There is no convincing evidence of tumour.	 PHI:Null
1133	 3154	 COMMENT:	 PHI:Null
1133	 3741	 The gastric tumour shows morphologic and immunohistochemical features consistent with a gastrointestinal stromal tumour (GIST). Although the behaviour of these tumours can be unpredictable, individual tumours greater than 100mm in size and with a high mitotic rate (greater than 10/50hpf), are typically associated with a high risk of aggressive behaviour (7th edition of the AJCC/TNM). This tumour shows variably prominent moderate nuclear pleomorphism, which is of uncertain clinical significance, as cytologic atypia is not a reliable predictor of tumour behaviour in these tumours.	 PHI:Null
1133	 3752	 DIAGNOSIS:	 PHI:Null
1133	 3776	 A & B. Gastric tumour:	 PHI:Null
1133	 3836	 120mm Gastrointestinal Stromal Tumour (GIST) (see comment).	 PHI:Null
1133	 3931	 Tumour appears clear of the gastric margin but extends focally to the inked "serosal" surface.	 PHI:Null
1133	 3965	 C.  Right diaphragmatic biopsy:	 PHI:Null
1133	 4008	 Organising haemorrhage and fibrous tissue.	 PHI:Null
1133	 4031	 No evidence of tumour.	 PHI:Null
1133	 4033	 	 PHI:Null
1133	 4035	 	 PHI:Null
1134	 25	 Episode No:  76I313441D	 IDNUM:76I313441D
1134	 36	 763313.LKC	 MEDICALRECORD:763313.LKC
1134	 54	 Lipovsky, Mason	 PATIENT:Lipovsky, Maso
1134	 72	 Lab No:  76I31344	 IDNUM:76I31344
1134	 81	 Walburgh	 STREET:Walburgh
1134	 107	 DEVONPORT  Victoria  8003	 CITY:DEVONPORT
1134	 107	 DEVONPORT  Victoria  8003	 STATE:Victoria
1134	 107	 DEVONPORT  Victoria  8003	 ZIP:8003
1134	 124	 Specimen: Tissue	 PHI:Null
1134	 142	 D.O.B:  22/7/1980	 DATE:22/7/1980=>1980-07-22
1134	 150	 Sex:  M	 PHI:Null
1134	 181	 Collected: 05/06/2012 at 12:07	 TIME:05/06/2012 at 12:07=>2012-06-05T12:07
1134	 216	 Location:  Orana-RICHMOND HOSPITAL	 DEPARTMENT:Orana
1134	 216	 Location:  Orana-RICHMOND HOSPITAL	 HOSPITAL:RICHMOND HOSPITAL
1134	 244	 DR CHRIS JARRETT Villeneuve	 DOCTOR:CHRIS JARRETT Villeneuve
1134	 293	 Distribution:   FILE-COPY,   NSW-CANCER-REGISTRY	 PHI:Null
1134	 343	 ***SUPPLEMENTARY REPORT (14.8.2062): MSI MARKERS	 DATE:14.8.2062=>2062-08-14
1134	 354	 CLINICAL:	 PHI:Null
1134	 503	 Omentum - adherent to tumour.  Right colon cancer with attached abdominal wall.  Transverse colon, ?diverticular disease.  Diverticulitis.  HT, IHD.	 PHI:Null
1134	 516	 MACROSCOPIC:	 PHI:Null
1134	 669	 A.  Specimen labelled "Omentum", consists of a piece of omentum 90 x 55 x 12mm.  No definite lesions are identified. Representative sections in4 blocks.	 PHI:Null
1134	 1734	 B.  Specimen labelled "Right colon", consists of a right hemicolectomy including caecum and right colon 170mm in length with attached terminal ileum 55mm.  An unremarkable appendix 60mm in length is also identified. Within the caecum, and involving the ileocaecal valve, is a circumferential ulcerated tumour, 60mm in maximum dimension. The proximal margin is 45mm from the tumour. The tumour invades through the muscularis propria at the ileocaecal valve, and into adipose tissue, to a maximum depth of 20mm.  Overlying the tumour atthe caecum, is an attached roughened area of muscle. Sectioning through the tumour shows a tan cut surface with invasion through muscularis propria into the overlying adherent abdominal wall tissue, where it comes close to the margin.  The colonic mucosa distal to the tumour appears markedly thinned and several diverticula are noted.  One 5mm polyp is also identified within the distal colon.  Multiple lymph nodes are identified in the pericolic fat from 2-40mm, some of which show features suspicious for tumour involvement.	 PHI:Null
1134	 2084	 Block 1 - margins; 2 &3 - tumour at ileocaecal valve; 5-7 - representative tumour; 8 - tumour to normal mucosa; 9 - representative colonic mucosa; 10- polyp; 11 - appendix tip; 12- lymph nodes; 13 - representative one macroscopically involved node; 14 - representative two macroscopically involved nodes; 15 - nodes; 16 - tumour for tumour banking.	 PHI:Null
1134	 2377	 C.   Specimen labelled "Transverse colon", consists of a section of colon 80mm in length.  Several diverticula are identified throughout the mucosa.  No suspicious areas are identified.  Block 1 - margins; 2-4 - representative diverticula; 5-7 - representative pericolic fat.  (RR/ec 8.8.62)	 DATE:8.8.62=>2062-08-08
1134	 2379	 	 PHI:Null
1134	 2419	 MICROSCOPIC: (Reported by Dr U Abeita)	 DOCTOR:U Abeita
1134	 2532	 A.  Sections of omentum show mature adipose tissue with focal fat necrosis. There is no evidence of malignancy.	 PHI:Null
1134	 2534	 	 PHI:Null
1134	 2666	 B.  The caecal/ileocaecal valve tumour is a moderately differentiated adenocarcinoma. A synoptic report for adenocarcinoma follows:	 PHI:Null
1134	 2704	 SYNOPTIC REPORT FOR COLONIC CARCINOMA	 PHI:Null
1134	 2728	 Macroscopic Description	 PHI:Null
1134	 2785	 Site of tumour: Caecum including the ileocaecal valve.	 PHI:Null
1134	 2816	 Maximum tumour diameter: 60mm.	 PHI:Null
1134	 2871	 Distance of tumour to nearer cut end: 45mm (proximal).	 PHI:Null
1134	 2902	 Tumour perforation: Yes (pT4).	 PHI:Null
1134	 2927	 Microscopic Description	 PHI:Null
1134	 2932	 Type	 PHI:Null
1134	 2952	 Adenocarcinoma NOS.	 PHI:Null
1134	 3252	 The adenocarcinoma shows extensivefull thickness infiltration of the bowel wall into the surrounding pericolic adipose tissue. Sections through the overlying adherent abdominal wall tissues, show adenocarcinoma invading fibrous tissue and skeletal muscle, and it is 1.6mmfrom the soft tissue margin.	 PHI:Null
1134	 3288	 Differentiation by predominant area	 PHI:Null
1134	 3297	 Moderate	 PHI:Null
1134	 3312	 Local invasion	 PHI:Null
1134	 3386	 pT4b Tumour directly invades or is adherent to other organs or structures	 PHI:Null
1134	 3416	 Tumour involvement of margins	 PHI:Null
1134	 3440	 Cut ends: Not involved.	 PHI:Null
1134	 3491	 Abdominal wall tissue (soft tissue margin): 1.6mm.	 PHI:Null
1134	 3503	 Lymph nodes	 PHI:Null
1134	 3542	 Number of lymph nodes present: Nine.	 PHI:Null
1134	 3587	 Number of lymph nodes involved: Five (5/9).	 PHI:Null
1134	 3627	 pN2 Metastases in 4 or more regional LN	 PHI:Null
1134	 3651	 Lymphovascular invasion	 PHI:Null
1134	 3660	 Present	 PHI:Null
1134	 3680	 Perineural invasion	 PHI:Null
1134	 3696	 Not identified.	 PHI:Null
1134	 3740	 Histologically confirmed distant metastases	 PHI:Null
1134	 3778	 pMX Cannot be assessed histologically	 PHI:Null
1134	 3818	 Background abnormalities/other comments	 PHI:Null
1134	 3863	 Adenoma: A tubulovillous adenoma is present.	 PHI:Null
1134	 3947	 The representative section of appendix shows no significant histologic abnormality.	 PHI:Null
1134	 3970	 Residual tumour status	 PHI:Null
1134	 4017	 R0 No residual tumour (margins appear clear).	 PHI:Null
1134	 4059	 Mismatch Repair Deficiency (MMRD) Status	 PHI:Null
1134	 4068	 Pending.	 PHI:Null
1134	 4116	 Stage (pTNM 7thEdition): STAGE IIIC (pT4bN2aMx)	 PHI:Null
1134	 4251	 C.  Sections of transverse colon show uncomplicated diverticular disease. There is no convincing dysplasia or evidence of malignancy.	 PHI:Null
1134	 4262	 DIAGNOSIS:	 PHI:Null
1134	 4302	 A.  Omentum: No evidence of malignancy.	 PHI:Null
1134	 4322	 B.  Right colon:	 PHI:Null
1134	 4481	 60mm, Stage IIIC, moderately differentiated adenocarcinoma of the caecum (including ileocaecal valve) with lymphovascular space invasion and clear of margins.	 PHI:Null
1134	 4619	 Adenocarcinoma extends into the overlying adherent abdominal wall tissue, and is clear of the abdominal wall soft tissue margin by 1.6mm.	 PHI:Null
1134	 4721	 Five of nine lymph nodes show metastatic adenocarcinoma with up to 0.56mm extranodal extension (5/9).	 PHI:Null
1134	 4753	 Microsatellite markers pending.	 PHI:Null
1134	 4812	 C.  Transverse colon: Uncomplicated diverticular disease.	 PHI:Null
1134	 4915	 Markers of microsatellite instability are being performed and a supplementary report will be issued.	 PHI:Null
1134	 4917	 	 PHI:Null
1134	 4966	 ***SUPPLEMENTARY REPORT (14.8.2062): MSI MARKERS	 DATE:14.8.2062=>2062-08-14
1134	 4979	 Dr U Dalomba	 DOCTOR:U Dalomba
1134	 5021	 Immunoperoxidase stains for MSI proteins	 PHI:Null
1136	 24	 Episode No:  97A914399O	 IDNUM:97A914399O
1136	 36	 9709143.YYO	 MEDICALRECORD:9709143.YYO
1136	 56	 Enger, Calvin IAN	 PATIENT:Enger, Calvin IAN
1136	 74	 Lab No:  97A91439	 IDNUM:97A91439
1136	 87	 Gunnels Wood	 STREET:Gunnels Wood
1136	 106	 SAN REMO  WA  2069	 CITY:SAN REMO
1136	 106	 SAN REMO  WA  2069	 STATE:WA
1136	 106	 SAN REMO  WA  2069	 ZIP:2069
1136	 123	 Specimen: Tissue	 PHI:Null
1136	 141	 D.O.B:  5/10/2006	 DATE:5/10/2006=>2006-05-10
1136	 149	 Sex:  M	 PHI:Null
1136	 180	 Collected: 10/06/2012 at 06:48	 TIME:10/06/2012 at 06:48=>2012-06-10T06:48
1136	 222	 Location:  CPC Pathology-ANGLISS HOSPITAL	 DEPARTMENT:CPC Pathology
1136	 222	 Location:  CPC Pathology-ANGLISS HOSPITAL	 HOSPITAL:ANGLISS HOSPITAL
1136	 248	 DR OSWALDO ARLIE Laorange	 DOCTOR:OSWALDO ARLIE Laorange
1136	 297	 Distribution:   FILE-COPY,   NSW-CANCER-REGISTRY	 PHI:Null
1136	 307	 CLINICAL:	 PHI:Null
1136	 454	 Caecal perforation secondary to distension from obstructing sigmoid tumour.  Subtotal colectomy performed from terminal ileum to proximal rectum.	 PHI:Null
1136	 467	 MACROSCOPIC:	 PHI:Null
1136	 1866	 Specimen labelled "Subtotal colectomy", consists of a subtotalcolectomy comprising of a segment of terminal ileum measuring 70mm in length with an open circumference of 85mm at the proximal resection margin in continuity with the caecum, ascending colon, transverse colon,descending colon, sigmoid colon and proximal rectum, measuring 980mm in length.  The open circumference of the colon is 140mm at the ascending colon, 100mm at the transverse colon, 95mm at the descending colon, 70mm at the sigmoid colon and 45mm at the distal resection margin. The bowel shows two separate areas of full thickness wall defect approximately 280mm apart. The more proximal wall defect is situated at the junction between the caecum and the ascending colon and measures 45 x 35mm and is approximately 80mm from the proximal resection margin. The more distal wall defect is situated in the transverse colon and measures 30 x 25mm.  Situated in the sigmoid 120mm from the distal resection margin there is a circumferential fungating tumour measuring 50 x 45mm. The tumour invades through the bowel wall into the pericolic fat. Multiple sessile to pedunculated polyps measuring from 3mm in maximal extent to 20 x 16 x 5mm are identified throughoutthe colonic mucosa. The appendix is identified measuring 55mm in length, 5mm in external diameter.  Mesenteric lymph nodes are identified measuring from 2-10mm across.	 PHI:Null
1136	 2544	 Block 1 - proximal resection margin; 2 - distal resection margin; 3 - one caecal polyp; 4 - four ascending colon polyps; 5 - one transverse colon polyp; 6-11 - one transverse colon polyp divided into six; 12 - one descending colon polyp; 13 & 14 - one sigmoid polyp in each; 15- two sigmoid polyps; 16 - one rectal polyp; 17 - one rectal polyp bisected; 18-20 - one rectal polyp trisected; 21-26 - tumour; 27 - appendix; 28 - sigmoid apical nodes; 29-33 - sigmoid nodes; 34 - two rectal nodes; 35 & 36 - transverse and descending colon nodes; 37-40 - caecal and ascending colon nodes; 41 - research block; 42 - proximal wall defect; 43 - distal wall defect.   (VO/ec 14.8.62)	 DOCTOR:VO
1136	 2544	 Block 1 - proximal resection margin; 2 - distal resection margin; 3 - one caecal polyp; 4 - four ascending colon polyps; 5 - one transverse colon polyp; 6-11 - one transverse colon polyp divided into six; 12 - one descending colon polyp; 13 & 14 - one sigmoid polyp in each; 15- two sigmoid polyps; 16 - one rectal polyp; 17 - one rectal polyp bisected; 18-20 - one rectal polyp trisected; 21-26 - tumour; 27 - appendix; 28 - sigmoid apical nodes; 29-33 - sigmoid nodes; 34 - two rectal nodes; 35 & 36 - transverse and descending colon nodes; 37-40 - caecal and ascending colon nodes; 41 - research block; 42 - proximal wall defect; 43 - distal wall defect.   (VO/ec 14.8.62)	 DATE:14.8.62=>2062-08-14
1136	 2583	 MICROSCOPIC: (Reported by Dr Z Bucio)	 DOCTOR:Z Bucio
1136	 2707	 Sections of the circumferential sigmoid tumour show a moderately differentiated adenocarcinoma.  A synoptic report follows:	 PHI:Null
1136	 2731	 Macroscopic Description	 PHI:Null
1136	 2764	 Site of tumour:  Sigmoid colon	 PHI:Null
1136	 2795	 Maximum tumour diameter:  50mm	 PHI:Null
1136	 2840	 Distance of tumour to nearer cut end:  120mm	 PHI:Null
1136	 2864	 Tumour perforation:  No	 PHI:Null
1136	 2888	 Microscopic Description	 PHI:Null
1136	 2894	 Type	 PHI:Null
1136	 2913	 Adenocarcinoma NOS	 PHI:Null
1136	 2949	 Differentiation by predominant area	 PHI:Null
1136	 2958	 Moderate	 PHI:Null
1136	 2973	 Local invasion	 PHI:Null
1136	 3005	 pT3 - Beyond muscularis propria	 PHI:Null
1136	 3035	 Tumour involvement of margins	 PHI:Null
1136	 3059	 Cut ends:  Not involved	 PHI:Null
1136	 3116	 Non-peritonealised circumferential margin:  Not involved	 PHI:Null
1136	 3190	 Histological measurement from tumour to non-peritonealised margin:  >10mm	 PHI:Null
1136	 3202	 Lymph nodes	 PHI:Null
1136	 3237	 Number of lymph nodes present:  39	 PHI:Null
1136	 3273	 Number of lymph nodes involved:  1	 PHI:Null
1136	 3308	 pN1a - Metastases in 1 regional LN	 PHI:Null
1136	 3332	 Lymphovascular invasion	 PHI:Null
1136	 3339	 Absent	 PHI:Null
1136	 3359	 Perineural invasion	 PHI:Null
1136	 3366	 Absent	 PHI:Null
1136	 3410	 Histologically confirmed distant metastases	 PHI:Null
1136	 3449	 pMX -Cannot be assessed histologically	 PHI:Null
1136	 3489	 Background abnormalities/other comments	 PHI:Null
1136	 3742	 Elsewhere in the specimen there are 7 tubular adenomas with low grade dysplasia, one tubulovillous adenoma with focal high grade dysplasia, and one sessile serrated polyp with dysplasia (sessile serrated adenoma).  4 hyperplastic polyps are also noted.	 PHI:Null
1136	 3765	 Residual tumour status	 PHI:Null
1136	 3789	 R0 - No residual tumour	 PHI:Null
1136	 3831	 Mismatch Repair Deficiency (MMRD) Status	 PHI:Null
1136	 3865	 MLH1 - Preserved nuclear staining	 PHI:Null
1136	 3899	 PMS2 - Preserved nuclear staining	 PHI:Null
1136	 3933	 MSH2 - Preserved nuclear staining	 PHI:Null
1136	 3967	 MSH6 - Preserved nuclear staining	 PHI:Null
1136	 3976	 Comment:	 PHI:Null
1136	 4116	 Preserved nuclear staining of a carcinoma for MLH1, PMS2, MSH2 and MSH6 indicates a low likelihood of microsatellite instability phenotype.	 PHI:Null
1136	 4118	 	 PHI:Null
1136	 4127	 Summary	 PHI:Null
1136	 4181	 1.  Adenocarcinoma, pT3 pN1a pMX R0 (TNM 7th Edition)	 PHI:Null
1136	 4323	 2.  One tubulovillous adenoma with focal high grade dysplasia, 7 tubular adenomas with low grade dysplasia, and one sessile serrated adenoma.	 PHI:Null
1136	 4325	 	 PHI:Null
1136	 4327	 	 PHI:Null
1136	 4329	 	 PHI:Null
1137	 25	 Episode No:  55W935357X	 IDNUM:55W935357X
1137	 36	 558935.KOT	 MEDICALRECORD:558935.KOT
1137	 51	 MANI, GARRET	 PATIENT:MANI, GARRET
1137	 69	 Lab No:  55W93535	 IDNUM:55W93535
1137	 80	 Westporter	 STREET:Westporter
1137	 92	 BEGA  VIC	 CITY:BEGA
1137	 92	 BEGA  VIC	 STATE:VIC
1137	 114	 Specimen: Swab,Tissue	 PHI:Null
1137	 132	 D.O.B:  19/5/1998	 DATE:19/5/1998=>1998-05-19
1137	 140	 Sex:  M	 PHI:Null
1137	 171	 Collected: 16/06/2012 at 19:48	 TIME:16/06/2012 at 19:48=>2012-06-16T19:48
1137	 236	 Location:  Hunter Area Pathology-COONABARABRAN DISTRICT HOSPITAL	 DEPARTMENT:Hunter Area Pathology
1137	 236	 Location:  Hunter Area Pathology-COONABARABRAN DISTRICT HOSPITAL	 HOSPITAL:COONABARABRAN DISTRICT HOSPITAL
1137	 268	 DR Raymond ANTONY DEGRAFFENRIED	 DOCTOR:Raymond ANTONY DEGRAFFENRIED
1137	 294	 Distribution:   FILE-COPY	 PHI:Null
1137	 304	 CLINICAL:	 PHI:Null
1137	 334	 Whipple.  Hepatic artery LN.	 PHI:Null
1137	 347	 MACROSCOPIC:	 PHI:Null
1137	 531	 A.Specimen labelled "Hepatic lymph node" consists of a nodular piece of solid tissue 30 x 16 x 12mm with a minimal amount of attached fatty tissue.  Serially sliced and AE two blocks.	 PHI:Null
1137	 1887	 B.  Specimen labelled "Gallbladder, duodenum, pancreas" consists of a specimen of distal pancreas (75 x 50 x 38mm), distal stomach and duodenum (180mm long), gallbladder (130mm in length and up to 90mm in circumference) and a small amount of peripancreatic fatty tissue.There is fatty tissue sutured to the neck margin of the pancreas. The portal vein bed is inked red, posterior pancreatic margin black, peri uncinate margin green, pancreatic neck green and anterior pancreatic capsule blue.  There is a tan indurated tumour within the head of the pancreas, 27 x 25 x 24mm, adjacent to the pancreatic duct and 25mm from the ampulla of Vater.  The tumour is 30mm from proximal gastric margin, 140mm from distal duodenal margin, 20mm from hepatic duct margin, 7mm from portal vein bed, 10mm from anterior capsule, 3mm from posterior pancreatic and 55mm from peri uncinate margins and 17mm from the pancreatic neck margin. There are several lymph nodes within the peripancreatic soft tissue. The hepatic duct is up to 10mm wide.  The gallbladder wall is up to 3mm in thickness.  The mucosa of the gallbladder is green and granular and shows areas of cholesterosis. A cystic duct lymph node is not identified. There is a separate piece of omental fat 280 x 150 x 20mm.  The omental fat is thinly sliced.  There are no lymph nodes within this separate piece.	 PHI:Null
1137	 3303	 Blocks:  1 - hepatic duct margin; 2 - proximal gastric margin; 3 - distal duodenal margin; 4 & 5 - paired sections (shave) pancreatic neck margin; 6 - section from ampulla of  Vater; 7 & 8 -paired sections of tumour in relation to portal vein bed anterior margin and duodenal mucosa; 9 & 10 - paired sections of the tumour in relation to anterior margin and portal ring bed;11 & 12 - paired sections of tumour in relation to posterior and portal vein bed margins; 13 - tumour in relation to posterior margins 14 - tumour in relation to posterior and portal vein bed margins; 13 & 14 - paired sections; 15 - tumour and adjacent lymph node and posterior and portal vein bed margins; 16 - tumour and posterior margin; 17 to 19 - the remainder of the lymph node in block 15; 20 -LS to neck of the pancreas after shaving the margin; 21 - representative section of peri uncinate margin; 22 - representative transverse section of duodenum away from tumour; 23 - one bisected lymph node anterior pancreas; 24 - one anterior pancreatic lymph node; 25 - one bisected lymph node anterior pancreas; 26 - three likely lymph nodes posterior pancreas; 27 - one bisected lymph node  posterior pancreas; 28 - one TS neck of gallbladder; 29 - one TS body of gallbladder and one LS fundus of gallbladder; 30 & 31 - representative from the omental fat. [15& 16 paired sections] [14 - reserved block for tumour banking]  (HM/ta 20/8/62)	 DATE:20/8/62=>2062-08-20
1137	 3360	 MICROSCOPIC: (Reported by Dr N Wormington/Dr N Clanton)	 DOCTOR:N Wormington
1137	 3360	 MICROSCOPIC: (Reported by Dr N Wormington/Dr N Clanton)	 DOCTOR:N Clanto
1137	 3438	 A.  Sections of the hepatic lymph node show no evidence of malignancy (0/1).	 PHI:Null
1137	 3568	 B.  The pancreatic head tumour is a moderately differentiated adenocarcinoma. A synoptic report for pancreatic carcinoma follows:	 PHI:Null
1137	 3632	 SYNOPTIC REPORT FOR WHIPPLE'S RESECTION (PANCREATIC CARCINOMA)	 PHI:Null
1137	 3666	 Tumour location: Pancreatic head.	 PHI:Null
1137	 3721	 Histologic type (WHO classification): Adenocarcinoma.	 PHI:Null
1137	 3787	 Histologic grade (TNMgrading system): Moderately differentiated.	 PHI:Null
1137	 3820	 Tumour size: 27mm (macroscopic).	 PHI:Null
1137	 3979	 Extension out of pancreas: Yes. Carcinoma extends into peripancreatic fibroadipose tissue and into the overlying small bowel muscularis propria and submucosa.	 PHI:Null
1137	 4027	 Lymphovascular space invasion: Present - focal.	 PHI:Null
1137	 4061	 Perineural invasion: Multifocal.	 PHI:Null
1137	 4113	 Distance of invasive tumour from resection margins:	 PHI:Null
1137	 4168	 Pancreatic neck: Clear of tumour (17mm - macroscopic).	 PHI:Null
1137	 4232	 Periuncinate soft tissue: Clear of tumour (55mm - macroscopic).	 PHI:Null
1137	 4303	 Posterior retroperitoneal: Positive margin (B16).vein bed: 0.6mm (B15)	 PHI:Null
1137	 4337	 Anterior soft tissue: 0.56mm (B8)	 PHI:Null
1137	 4389	 Hepatic duct: Clear of tumour (20mm - macroscopic).	 PHI:Null
1137	 4515	 Gastric resection margin: Clear of tumour (30mm - macroscopic).bowel resection margin: Clear of tumour (140mm - macroscopic).	 PHI:Null
1137	 4558	 Lymph nodes from main resection specimen:	 PHI:Null
1137	 4596	 Fourteen lymph nodes are identified.	 PHI:Null
1137	 4690	 One of the fourteen lymph nodes shows involvement by carcinoma through direct spread (1/14).	 PHI:Null
1137	 4735	 Highest grade of Pan-In present: Pan-IN 1B.	 PHI:Null
1137	 4799	 Grade of Pan-In at pancreatic neck resection margin: Pan-In 1B.	 PHI:Null
1137	 4820	 Additional findings:	 PHI:Null
1137	 5153	 Sections of gastric wall show a mild to moderate non-specific chronic gastritis. No convincing Helicobacter organisms are seen. Sections of the small bowel ampulla shows prominent mucosal autolysis. The remaining uninvolved small bowel mucosa shows no significant histologic abnormality. The gallbladder shows chronic cholecystitis.	 PHI:Null
1137	 5223	 Pathologic Staging (pTNM, AJCC 7th edition 2010): Stage IIB (pT3N1Mx)	 PHI:Null
1137	 5263	 Staged as: Pancreatic ductal carcinoma.	 PHI:Null
1137	 5270	 pT: T3	 PHI:Null
1137	 5336	 pN: N1 (One of fourteen lymph nodes involved by direct extension)	 PHI:Null
1137	 5342	 pM: x	 PHI:Null
1137	 5351	 SUMMARY:	 PHI:Null
1137	 5409	 A.  Hepatic lymph node: No evidence of malignancy (0/1).	 PHI:Null
1137	 5436	 B.  Whipple's resection:	 PHI:Null
1137	 5485	 27mm, pTNM Stage IIB, pancreatic adenocarcinoma.	 PHI:Null
1137	 5636	 Focal lymphovascular space invasion, multifocal perineural invasion and direct involvement of the overlying small bowel submucosa/ muscularis propria.	 PHI:Null
1137	 5770	 Carcinoma extends to the posterior margin and is very close to the portal vein bed and anterior soft tissue margin (less than 0.6mm).	 PHI:Null
1137	 5855	 One of fourteen lymph nodes show involvement by carcinoma (direct extension) (1/14).	 PHI:Null
1137	 5857	 	 PHI:Null
1138	 24	 Episode No:  29F784757R	 IDNUM:29F784757R
1138	 35	 292784.SPS	 MEDICALRECORD:292784.SPS
1138	 53	 ALCIVAR, Coleen	 PATIENT:ALCIVAR, Colee
1138	 80	 Lab No:  29F78475,29F78475	 IDNUM:29F78475
1138	 80	 Lab No:  29F78475,29F78475	 IDNUM:29F78475
1138	 96	 Richland Valley	 STREET:Richland Valley
1138	 141	 RICHMOND  Australian Capital Territory  6609	 CITY:RICHMOND
1138	 141	 RICHMOND  Australian Capital Territory  6609	 STATE:Australian Capital Territory
1138	 141	 RICHMOND  Australian Capital Territory  6609	 ZIP:6609
1138	 164	 Specimen: Urine,Tissue	 PHI:Null
1138	 183	 D.O.B:  26/10/2006	 DATE:26/10/2006=>2006-10-26
1138	 191	 Sex:  F	 PHI:Null
1138	 222	 Collected: 18/06/2012 at 12:06	 TIME:18/06/2012 at 12:06=>2012-06-18T12:06
1138	 283	 Location:  Douglass Hanly Moir - TASMAN MULTI-PURPOSE CENTRE	 DEPARTMENT:Douglass Hanly Moir
1138	 283	 Location:  Douglass Hanly Moir - TASMAN MULTI-PURPOSE CENTRE	 HOSPITAL:TASMAN MULTI-PURPOSE CENTRE
1138	 302	 DR Kurtis Czarnota	 DOCTOR:Kurtis Czarnota
1138	 328	 Distribution:   FILE-COPY	 PHI:Null
1138	 338	 CLINICAL:	 PHI:Null
1138	 458	 Recurrent endometrial carcinoma.  1. Superior wound sheath.  2. Abdominal wall mass, suture at 12 o'clock.  3. Omentum.	 PHI:Null
1138	 471	 MACROSCOPIC:	 PHI:Null
1138	 1291	 A.  Specimen labelled "Abdominal wall tumour, stitch at 12 o'clock" consists of a piece of fibrofatty tissue with a suture at 12 o'clock.  A peritoneal surface is identified on part of the posterior surface of the specimen.  The anterior surface consists of muscle and adipose tissue.  The specimen measures 90mm (12 to 6 o'clock) x 70mm (3 to 9 o'clock) x 50mm (anterior to posterior).  The anterior margin is inked blue, posterior margin black, right lateral margin (9 o'clock) red, left lateral margin (3 o'clock) yellow.  The specimen is serially sectioned from 12 to 6 o'clock into nine slices.  On sectioning it is almost totally replaced by a solid tumour with a variegated appearance, with areas of haemorrhage and necrosis.  Macroscopically the tumour abuts the posterior margin and the right lateral margin.	 PHI:Null
1138	 1520	 Blocks:  1 - one LS 12 o'clock margin (superior); 2 to 6 - one full TS of tumour; 7 - tumour abutting left lateral margin; 8 - tumour abutting posterior margin; 9 - LS 6 o'clock margin (inferior); 10 - tumour for tissue banking.	 PHI:Null
1138	 1668	 B.  Specimen labelled "Apex wound" consists of two irregular pieces of fibrofatty tissue measuring 20 and 10mm in maximum diameter.  AE one block.	 PHI:Null
1138	 1799	 C.  Specimen labelled "Omentum" consists of a fragment of adipose tissue measuring 20 x 15 x 3mm.  AE one block.   (RU/cc 21/8/62)	 DOCTOR:RU
1138	 1799	 C.  Specimen labelled "Omentum" consists of a fragment of adipose tissue measuring 20 x 15 x 3mm.  AE one block.   (RU/cc 21/8/62)	 DATE:21/8/62=>2062-08-21
1138	 1801	 	 PHI:Null
1138	 1840	 MICROSCOPIC (Reported by Dr G Kross):	 DOCTOR:G Kross
1138	 2442	 A.  Sections show fibrofat and skeletal muscle.  Some of the tissue is apparent old scar tissue.  Within this tissue there is a deposit of moderately differentiated adenocarcinoma consistent with endometrioid adenocarcinoma, grade 2.  There is focal lymphovascular invasion at the periphery of the mass (Block A6).  Excision appears complete.  Tumour is 0.5mm from the nearest posterior margin (away from the peritoneal tissue), 3mm from the nearest right lateral margin, 1mm from the nearest anterior margin and 2mm from the nearest left lateral margin.  Superior and inferior margins are well clear.	 PHI:Null
1138	 2515	 B.  Sections show dense fibrous tissue and some fat.  No tumour is seen.	 PHI:Null
1138	 2718	 C.  Sections show fat.  There are distorted fragments of tumour present but not in association with intacttissue; these distorted fragments are interpreted as artefactual carry-over.  No tumour is seen.	 PHI:Null
1138	 2729	 DIAGNOSIS:	 PHI:Null
1138	 2796	 A.  Abdominal wall tumour:  Metastatic endometrioidadenocarcinoma.	 PHI:Null
1138	 2824	 B.  Apex wound:  No tumour.	 PHI:Null
1138	 2849	 C.  Omentum:  No tumour.	 PHI:Null
1138	 2909	 SUPPLEMENTARY REPORT (28.8.2062, reported by Dr G Kashner)	 DATE:28.8.2062=>2062-08-28
1138	 2909	 SUPPLEMENTARY REPORT (28.8.2062, reported by Dr G Kashner)	 DOCTOR:G Kashner
1138	 3220	 Hormone receptor (immunoperoxidase) studies were requested at the Gynae Oncology Tumour Board meeting on 27.8.2062.   Oestrogen receptor antigen is strongly or moderately expressed by almost all the tumour cells while progesterone receptor antigen is weakly or moderately expressed in about 3% of tumour cells.	 DATE:27.8.2062=>2062-08-27
1139	 24	 Episode No:  40X485615D	 IDNUM:40X485615D
1139	 35	 408485.PDO	 MEDICALRECORD:408485.PDO
1139	 55	 CRANK, Margherita	 PATIENT:CRANK, Margherita
1139	 73	 Lab No:  40X48561	 IDNUM:40X48561
1139	 87	 West Railroad	 STREET:West Railroad
1139	 110	 WILLIAMSTOWN  NT  1234	 CITY:WILLIAMSTOWN
1139	 110	 WILLIAMSTOWN  NT  1234	 STATE:NT
1139	 110	 WILLIAMSTOWN  NT  1234	 ZIP:1234
1139	 127	 Specimen: Tissue	 PHI:Null
1139	 146	 D.O.B:  11/10/2009	 DATE:11/10/2009=>2009-10-11
1139	 154	 Sex:  F	 PHI:Null
1139	 180	 Collected: 21/8/2062 at :	 DATE:21/8/2062=>2062-08-21
1139	 258	 Location:  DARLING POINT-GIPPSLAND SOUTHERN HEALTH SERVICE - LEONGATHA CAMPUS	 DEPARTMENT:DARLING POINT
1139	 258	 Location:  DARLING POINT-GIPPSLAND SOUTHERN HEALTH SERVICE - LEONGATHA CAMPUS	 HOSPITAL:GIPPSLAND SOUTHERN HEALTH SERVICE - LEONGATHA CAMPUS
1139	 283	 DR Alonso Ferdinand Sump	 DOCTOR:Alonso Ferdinand Sump
1139	 332	 Distribution:   FILE-COPY,   NSW-CANCER-REGISTRY	 PHI:Null
1139	 342	 CLINICAL:	 PHI:Null
1139	 431	 Hx (L) paraspinal soft tissue mass for excision post chemoradiotherapy ?desmoid/sarcoma.	 PHI:Null
1139	 444	 MACROSCOPIC:	 PHI:Null
1139	 953	 Specimen labelled "Left paraspinal soft tissue mass, ?desmoid/sarcoma; short stitch superior, medium stitch medial, long stitch lateral" consists of an irregular piece of skeletal muscle and fibrofatty tissue measuring 70mm (medial-lateral) x 80mm (superior-inferior) x 35mm (superficial-deep). An 8 mm bony tissue is attached at the medial aspect.  Sutures orientate the specimen as follows: short superior, medium medial, long lateral.  Thesuperficial margin is inked black, superior green and deep blue.	 PHI:Null
1139	 1026	 The cut surface shows two circumscribed firm cream tumours 18mm apart.	 PHI:Null
1139	 1274	 Tumour 1 (Slice 1 to 3) measures 18 x 25 x 12mm.  It is 1mm from the deep margin, 1mm from the lateral margin, 25mm from the superior margin, 10mm from the inferior margin, 19mm from the superficial margin and is well clear of the medial margin.	 PHI:Null
1139	 1519	 Tumour 2 (Slice 7 to 11) measures 24 x 50 x 27mm.  It is 4mm from the deepmargin, 5mm from the superficial margin, 2mm from the superior margin, 1mm from the inferior margin, 4mm from the medial margin and is well clear of the lateral margin.	 PHI:Null
1139	 1662	 The specimen is parasagittally sectioned from lateral to medial into eleven consecutive slices.  Representative sections in thirty-one blocks.	 PHI:Null
1139	 1967	 Blocks:  1 to 3 - slice 1 lateral margin; 4 & 5 - slice 2; 6 to 9 - slice 3 AE; 10 - slice 4; 11 & 12 - slice 5; 13 & 14 - slice 6; 15 to 18 - slice 7; 19 & 20 - slice 8; 21 to 27 - slice 9 AE; 28 & 29 - slice 10 (block 29 research block); 30 & 31 - slice 11 medial resection margin.    (WT/cc  22/8/62)	 DOCTOR:WT
1139	 1967	 Blocks:  1 to 3 - slice 1 lateral margin; 4 & 5 - slice 2; 6 to 9 - slice 3 AE; 10 - slice 4; 11 & 12 - slice 5; 13 & 14 - slice 6; 15 to 18 - slice 7; 19 & 20 - slice 8; 21 to 27 - slice 9 AE; 28 & 29 - slice 10 (block 29 research block); 30 & 31 - slice 11 medial resection margin.    (WT/cc  22/8/62)	 DATE:22/8/62=>2062-08-22
1139	 2008	 MICROSCOPIC (Reported by Dr L Gargano):	 DOCTOR:L Gargano
1139	 2624	 Sections show two foci of desmoid tumour infiltrating and surrounding adjacent skeletal muscle.  The smaller deposit towards the lateral end of the specimen measures approximately 25mm across and involves the lateral and deep margins over a broad front.  Other margins are well clear. The larger deposit measures approximately 60mm across and is situated towards the medial end of the specimen.  This tumour focally extends to the superior resection margin.  The deep and superficial margins are 3mm clear, the inferior margin is 7mm clear and the medial margin is 2mm clear.  No definite treatment effect is seen.	 PHI:Null
1139	 2637	 DIAGNOSIS:	 PHI:Null
1139	 2682	 Left paraspinal:  Desmoid, margins involved.	 PHI:Null
1139	 2755	 CYTOGENETICS REPORT PLANTAGENE3/9 JENNIE COX CLOSE's Pathology (5/9/62):	 HOSPITAL:PLANTAGENET HOSPITAL
1139	 2755	 CYTOGENETICS REPORT PLANTAGENE3/9 JENNIE COX CLOSE's Pathology (5/9/62):	 DEPARTMENT:3/9 JENNIE COX CLOSE
1139	 2755	 CYTOGENETICS REPORT PLANTAGENE3/9 JENNIE COX CLOSE's Pathology (5/9/62):	 DATE:5/9/62=>2062-09-05
1139	 2777	 Specimen Type: Tumour	 PHI:Null
1139	 2790	 Preparation:	 PHI:Null
1139	 2794	 S-1	 PHI:Null
1139	 2798	 S-2	 PHI:Null
1139	 2802	 S-3	 PHI:Null
1139	 2806	 S-4	 PHI:Null
1139	 2816	 Analysis:	 PHI:Null
1139	 2828	 Karyotype:	 PHI:Null
1139	 2872	 No dividing cells seen (6 slides examined).	 PHI:Null
1139	 2881	 Comment:	 PHI:Null
1139	 3084	 Regrettably, no mitoses were available for cytogenetic analysis. Please advise the laboratory (8382 9154) should interphase FISH on formalin-fixed paraffin-embedded tissue be of assistance in this case.	 PHONE:8382 9154
1139	 3138	 Reported By: L. Striplin Validated By: Dr L. Comiskey	 DOCTOR:L. Striplin
1139	 3138	 Reported By: L. Striplin Validated By: Dr L. Comiskey	 DOCTOR:L. Comiskey
1140	 24	 Episode No:  98T406673L	 IDNUM:98T406673L
1140	 36	 9874066.SJL	 MEDICALRECORD:9874066.SJL
1140	 53	 MAGSBY, Jolene	 PATIENT:MAGSBY, Jolene
1140	 80	 Lab No:  98T40667,98T40667	 IDNUM:98T40667
1140	 80	 Lab No:  98T40667,98T40667	 IDNUM:98T40667
1140	 88	 Reddall	 STREET:Reddall
1140	 138	 ENCOUNTER BAY  Australian Capital Territory  3783	 CITY:ENCOUNTER BAY
1140	 138	 ENCOUNTER BAY  Australian Capital Territory  3783	 STATE:Australian Capital Territory
1140	 138	 ENCOUNTER BAY  Australian Capital Territory  3783	 ZIP:3783
1140	 161	 Specimen: Fluid,Tissue	 PHI:Null
1140	 179	 D.O.B:  12/3/2019	 DATE:12/3/2019=>2019-12-03
1140	 187	 Sex:  F	 PHI:Null
1140	 212	 Collected: 22/8/2062 at:	 DATE:22/8/2062=>2062-08-22
1140	 267	 Location:  Anatomical Pathology - OMEO DISTRICT HEALTH	 DEPARTMENT:Anatomical Pathology
1140	 267	 Location:  Anatomical Pathology - OMEO DISTRICT HEALTH	 HOSPITAL:OMEO DISTRICT HEALTH
1140	 288	 DR Neida HEIDY LETKO	 DOCTOR:Neida HEIDY LETKO
1140	 360	 Distribution:   FILE-COPY,   NSW-CANCER-REGISTRY,   NSW-CANCER-REGISTRY	 PHI:Null
1140	 370	 CLINICAL:	 PHI:Null
1140	 523	 Pelvic mass, elevated CA19.9 and CEA.  Large right ovarian mass.  Elevated CEA18, CA19-9: 9980, CA125: 581.  Frozen section:  mucinous adenocarcinoma.	 PHI:Null
1140	 536	 MACROSCOPIC:	 PHI:Null
1140	 1043	 A.   Specimen labelled "Right tube and ovary", consists of a nodular mass with smooth external surface measuring 110 x 90 x 75mm, an unremarkable fallopian tube including fimbria measuring 65 x 7mm, together weighing 160g.  The cut surface shows solid and cystic tan grey cut surface with areas of areas of necrosis.  Two sections for FS and fresh tissue for tissue bank. Blocks 1 & 2- FS; 3-11 - 14 representative sections from the tumour (11 - tissue banking; 12 - 2LS fimbria; 13 - 1 TS fallopian tube).	 PHI:Null
1140	 1077	 FROZEN SECTION:  Adenocarcinoma.	 PHI:Null
1140	 1139	 Result to Dr Z Stemler by Dr Z Zellman at 1:25pm on 20.6.12.	 DOCTOR:Z Stemler
1140	 1139	 Result to Dr Z Stemler by Dr Z Zellman at 1:25pm on 20.6.12.	 DOCTOR:Z Zellman
1140	 1139	 Result to Dr Z Stemler by Dr Z Zellman at 1:25pm on 20.6.12.	 TIME:at 1:25pm on 20.6.12=>201-06-20T13:25
1140	 1915	 B.  Specimen labelled "Uterus + left tube + left ovary", consists of a uterus with attached cervix, left fallopian tube and ovary weighing in total 105g.  The uterus measures 55 x 40 x 20mm and has a smooth and shiny appearance.  The ectocervix measures 35 x 35mm. The cervical mucosa is unremarkable.  On sectioning the endometrium is 2mm in maximum thickness. The myometrium is 20mm in maximum thickness.  The myometrium is unremarkable. The left fallopian tube measures 35 x 5 x 5mm. The fimbria is identified. The left ovary measures 50 x 25 x 20mm.  Onsectioning it has several haemorrhagic cysts and cysts filled with fluid.  Blocks 1-3 - 1 full LS anterior body and cervix; 4-6 - 1 full LS posterior body and cervix; 7-11 - ovary; 12 - 2LS fimbria, 1TS fallopian tube.	 PHI:Null
1140	 2046	 C.  Specimen labelled "Ovarian adhesion", consists of an irregular piece of tan friable tissue measuring 20 x 7 x 3mm. AE 1 block.	 PHI:Null
1140	 2168	 D.  Specimen labelled "Omentum nodule no 1", consists of  a piece of adipose tissue 10 x 5 x 5mm.  Bisected, AE 1 block.	 PHI:Null
1140	 2285	 E.  Specimen labelled "Omentum nodule no 2", consists of a piece of fat tissue 10 x 10 x 5mm. Bisected, AE 1 block.	 PHI:Null
1140	 2443	 F.  Specimen labelled "Omentum", consists of a piece of omentum 210 x 120 x 10mm.  No tumour deposits are identified.  3 representative sections in 3 blocks.	 PHI:Null
1140	 2594	 G.  Specimen labelled "Appendix", consists of an appendix measuring 40mm in length and5mm in maximum diameter. The external surface is unremarkable.	 PHI:Null
1140	 2678	 Block 1- 2TS proximal appendix; 2 - 2TS mid appendix; 3 - 2LS distal appendix (AE).	 PHI:Null
1140	 2855	 H.  Specimen labelled "Sigmoid colon nodule", consists of a nodular piece of tissue 10 x 10 x 5mm.  On sectioning the cut surface is white and fibrotic.  Bisected, AE 1 block.	 PHI:Null
1140	 3105	 I.    Specimen labelled "Right paracolic gutter", consists of a piece of fibrous and elastic tissue measuring 50 x 40 x 2mm.  One of the surfaces is covered by adipose tissue, the other is covered by blood clot.  Representative sections in 1 block.	 PHI:Null
1140	 3365	 J.   Specimen labelled "Left paracolic gutter", consists of a piece of fibrous and elastic tissue measuring 50 x 30 x 2mm. One surface is covered by fibroadipose tissue, the other is covered by blood clot.  Representative sections in 1 block. (ZJ/ec 23.8.62)	 DOCTOR:ZJ
1140	 3365	 J.   Specimen labelled "Left paracolic gutter", consists of a piece of fibrous and elastic tissue measuring 50 x 30 x 2mm. One surface is covered by fibroadipose tissue, the other is covered by blood clot.  Representative sections in 1 block. (ZJ/ec 23.8.62)	 DATE:23.8.62=>2062-08-23
1140	 3403	 MICROSCOPIC (Reported by Dr Z Gaunt):	 DOCTOR:Z Gaunt
1140	 3729	 A.  Sections show mucinous adenocarcinoma involving the right ovary.  Most of the tumour is poorly differentiated, however there are areas which resemble benign and borderline mucinous ovarian tumours.  A small deposit of poorly differentiated adenocarcinoma is noted on the right fimbriae.  The tube is otherwise uninvolved.	 PHI:Null
1140	 3894	 The tumour is diffusely strongly positive for CK7, positive for CK20 in the well differentiated areas and weakly positive for CDX2 in the well differentiated areas.	 PHI:Null
1140	 4190	 B.  The ectocervix and endocervix show no significant abnormality.  The endometrium is secretory.  The myometrium is unremarkable.The left ovary shows a benign mixed mucinous and serous cystadenoma as well as follicular cysts.  The left tube is unremarkable.  There is no evidence of malignancy.	 PHI:Null
1140	 4304	 C.  Sections show pus and histiocytes.  A small amount ofmucin is noted but no definite carcinoma cells are seen.	 PHI:Null
1140	 4405	 D, E, F, H, I & J.  Sections show poorly differentiated adenocarcinoma cells admixed with adhesions.	 PHI:Null
1140	 4504	 G.  Sections of the appendix show no significant abnormality.  There is no evidence of malignancy.	 PHI:Null
1140	 4513	 COMMENT:	 PHI:Null
1140	 4685	 It is uncertain whether the mucinous adenocarcinoma is ovarian in origin or metastatic.  A stomach or pancreatic primary (less likely colorectum) should first be excluded.	 PHI:Null
1140	 4890	 As requested, immunoperoxidase stains for MSI proteins were performed.  MLH1, PMS2, MSH2, MSH6 all showpreserved nuclear staining.  This indicates a low likelihood of microsatellite instability phenotype.	 PHI:Null
1140	 4901	 DIAGNOSIS:	 PHI:Null
1140	 5050	 Poorly differentiated mucinous adenocarcinoma involving the right ovary, right fimbriae, omentum, sigmoid colon and paracolic gutters (SEE COMMENT).	 PHI:Null
1140	 5111	 SUPPLEMENTARY REPORT (28.8.2062, reported by Dr Z Goldstein)	 DATE:28.8.2062=>2062-08-28
1140	 5111	 SUPPLEMENTARY REPORT (28.8.2062, reported by Dr Z Goldstein)	 DOCTOR:Z Goldstei
1140	 5327	 Her-2 immunoperoxidase stain was requested at the Gynae OncologyTumour Board meeting on 27.8.62.  There is weak focal membrane staining of tumour cells with Her-2 antibody and the result is considered negative (0).	 DATE:27.8.62=>2062-08-27
1141	 24	 Episode No:  19K007521W	 IDNUM:19K007521W
1141	 36	 1940075.HFW	 MEDICALRECORD:1940075.HFW
1141	 50	 Settle, WES	 PATIENT:Settle, WES
1141	 68	 Lab No:  19K00752	 IDNUM:19K00752
1141	 74	 Emack	 STREET:Emack
1141	 93	 CURLEWIS  WA  7321	 CITY:CURLEWIS
1141	 93	 CURLEWIS  WA  7321	 STATE:WA
1141	 93	 CURLEWIS  WA  7321	 ZIP:7321
1141	 110	 Specimen: Tissue	 PHI:Null
1141	 128	 D.O.B:  5/11/1999	 DATE:5/11/1999=>1999-11-05
1141	 136	 Sex:  M	 PHI:Null
1141	 167	 Collected: 22/06/2012 at 12:44	 TIME:22/06/2012 at 12:44=>2012-06-22T12:44
1141	 209	 Location:  Pathwest-WAR MEMORIAL HOSPITAL	 DEPARTMENT:Pathwest
1141	 209	 Location:  Pathwest-WAR MEMORIAL HOSPITAL	 HOSPITAL:WAR MEMORIAL HOSPITAL
1141	 231	 DR Robby PORTER PRANG	 DOCTOR:Robby PORTER PRANG
1141	 280	 Distribution:   FILE-COPY,   NSW-CANCER-REGISTRY	 PHI:Null
1141	 290	 CLINICAL:	 PHI:Null
1141	 305	 Gallbladder.	 PHI:Null
1141	 352	 Cholecystectomy/segment 4b/5 liver resection.	 PHI:Null
1141	 365	 MACROSCOPIC:	 PHI:Null
1141	 1480	 Specimen labelled "Cholecystectomy plus liver resection", consists of a segment of liver, 60 x 60 x 55mm, with attached gallbladder 78mm long and 39mm in diameter at the fundus, and a small amount of fat attached to the gallbladder 50 x 45 x 10mm, together weighing 101g.  The gallbladder has been opened prior to receipt.  The liver resection margin is inked black.  The mucosa in the neck region and in most of the fundus appears unremarkable and the wall is 1-2mm in thickness.  However a firm masswith a granular surface is noted in the body, resulting in severe narrowing of the lumen. The serosal surface shows puckering in this area with fibroadipose tissue adhesions.  Sectioning through the tumour shows a circumferential, firm, irregular, off white tumour measuring approximately 33 x 30 x 17mm.  The tumour involves the full thickness of the gallbladder wall and appears to infiltrate the attached fat as well.  The tumour shows sharp borders with the underlying liver and is at least 7mm from the liver resection margin.  The liver appears macroscopically unremarkable.  No lymph nodes are identified.	 PHI:Null
1141	 1815	 Block 1 - cystic duct margin and 2TS neck; 2 - 3TS body close to tumour; 3 - fundus close to the tumour; 4 - fundus further from tumour; 5 & 6 - paired blocks of full face of tumour; 7 & 8 - tumour and adjacent mucosa; 9 - tumour and adjacent fatty tissue; 11 - reserved block for tumour banking. Photographs taken.  (OQ/ec  27.8.62)	 DOCTOR:OQ
1141	 1815	 Block 1 - cystic duct margin and 2TS neck; 2 - 3TS body close to tumour; 3 - fundus close to the tumour; 4 - fundus further from tumour; 5 & 6 - paired blocks of full face of tumour; 7 & 8 - tumour and adjacent mucosa; 9 - tumour and adjacent fatty tissue; 11 - reserved block for tumour banking. Photographs taken.  (OQ/ec  27.8.62)	 DATE:27.8.62=>2062-08-27
1141	 1854	 MICROSCOPIC: (Reported by Dr F Rullan)	 DOCTOR:F Rulla
1141	 2639	 Sections show a poorly differentiated adenocarcinoma of gallbladder.  This appears to be of biliary type.  There is some gland formation but much of the tumour consists of solid cords and trabeculae of cells.  The tumour cells have medium sized and large, vesicular nuclei and amoderate amount of pale eosinophilic cytoplasm.  The tumour invades through the gallbladder wall and extends into adherent fat.  It extends to just beneath the serosal surface of the gallbladder and adherent fat.  It also focally invades into the attached liver segment but the hepatic resection margin is well clear.  Lymphovascular and perineural invasion are identified within the tumour but not outside the main mass.  The vascular invasion includes involvement of at least one small muscular artery.	 PHI:Null
1141	 2785	 Some of the gallbladder adjacent to and away from the tumourshows high grade dysplasia.  The cystic duct margin is free of tumour and dysplasia.	 PHI:Null
1141	 3287	 A section of liver away from the tumour shows some mild, non-specific inflammatory changes.  There is no hepatic fibrosis.  A perl stain shows an increase in stainable iron in hepatocytes (grade 2+ out of 4).  The hepatocytes with increased iron aremainly periportal.  The possibility of hereditary haemochromatosis should be considered.  A rhodanine stain shows no increase in copper, no alpha one antitrypsin globules are seen, and an orcein stain for hepatitis B surface antigen is negative.	 PHI:Null
1141	 3300	 DIAGNOSIS:	 PHI:Null
1141	 3348	 Gallbladder and segment 4b/5 liver resection:	 PHI:Null
1141	 3413	 1.  Poorly differentiated adenocarcinoma of gallbladder, pT3 Nx.	 PHI:Null
1141	 3481	 2.  Increased stainable iron in periportal hepatocytes, see text.	 PHI:Null
1141	 3483	 	 PHI:Null
1141	 3485	 	 PHI:Null
1142	 25	 Episode No:  77G028680F	 IDNUM:77G028680F
1142	 36	 772028.QWA	 MEDICALRECORD:772028.QWA
1142	 51	 PAKE, Britta	 PATIENT:PAKE, Britta
1142	 69	 Lab No:  77G02868	 IDNUM:77G02868
1142	 80	 Fort Foote	 STREET:Fort Foote
1142	 97	 GOOLWA  WA  1138	 CITY:GOOLWA
1142	 97	 GOOLWA  WA  1138	 STATE:WA
1142	 97	 GOOLWA  WA  1138	 ZIP:1138
1142	 114	 Specimen: Tissue	 PHI:Null
1142	 132	 D.O.B:  /426/1984	 DATE:/426/1984=>1984-426
1142	 140	 Sex:  M	 PHI:Null
1142	 171	 Collected: 25/06/2012 at 09:48	 TIME:25/06/2012 at 09:48=>2012-06-25T09:49
1142	 224	 Location:  SEALS Central-ST HELENS DISTRICT HOSPITAL	 DEPARTMENT:SEALS Central
1142	 224	 Location:  SEALS Central-ST HELENS DISTRICT HOSPITAL	 HOSPITAL:ST HELENS DISTRICT HOSPITAL
1142	 254	 DR Geoffrey Charley AUCHMOODY	 DOCTOR:Geoffrey Charley AUCHMOODY
1142	 312	 Distribution:  Dr. UNKNOWN,  FILE-COPY, DR GARY, DR Tauer	 DOCTOR:GARY
1142	 312	 Distribution:  Dr. UNKNOWN,  FILE-COPY, DR GARY, DR Tauer	 DOCTOR:Tauer
1142	 322	 CLINICAL:	 PHI:Null
1142	 351	 Rectosigmoid colon cancer.	 PHI:Null
1142	 390	 Low high anterior resection  + donut.	 PHI:Null
1142	 403	 MACROSCOPIC:	 PHI:Null
1142	 1299	 A.  Specimen labelled "Sigmoid colon", consists of an intact segment of lower sigmoid colon/upper rectum, 240mm in length and 30mm in diameter, with attached mesosigmoid up to 95mm in width, as well as, perirectal fat up to 45mm.  The entire anterior surface is covered by serosa and the anterior peritoneal reflection is not seen.  The pericolic fat appears complete.  A circumferential poorly circumscribed tumour is identified 45mm from the distal resection margin.  The tumour is 33mm in length, 37mm in width and appears to infiltrate the full thickness of bowel and probably invading the pericolonic fat. The tumour is up to 14mm in thickness.  The pericolic fat is at least 16mm inthickness around the tumour and the tumour appears 15mm from radial resection margin. Several uncomplicated diverticula are identified in the adjacent bowel wall.  No polyps or additional lesions are seen.	 PHI:Null
1142	 1690	 Block 1 - proximal margin; 2 - distal margin; 3-6 - full face of tumour; 7 - tumour deepest invasion; 8 & 9 - tumour and adjacent colon; 10 - diverticulae; 11 - four nodes; 12 - one node bisected; 13 - three nodes; 14- five nodes; 15 - one node bisected; 16 - one node bisected; 17 - three nodes; 18-20 - high point of resection with possible nodes; 21 - reserved block for tissue banking.	 PHI:Null
1142	 1856	 B.  Specimen labelled "Distal donut", consists of a donut 17mm in diameter and up to 7mm in length.  Macroscopically no distinct lesions are identified. AE 1 block.	 PHI:Null
1142	 1874	 (VU/ec  27.8.62)	 DOCTOR:VU
1142	 1874	 (VU/ec  27.8.62)	 DATE:27.8.62=>2062-08-27
1142	 1913	 MICROSCOPIC: (Reported by Dr T Knipe)	 DOCTOR:T Knipe
1142	 2062	 A.  The lower sigmoid colon tumour is a moderately to poorly differentiated colonic adenocarcinoma. A synoptic report for colonic carcinoma follows:	 PHI:Null
1142	 2101	 SYNOPTIC REPORT FOR COLONIC CARCINOMA	 PHI:Null
1142	 2125	 Macroscopic Description	 PHI:Null
1142	 2165	 Site of tumour: Distal sigmoid colon.	 PHI:Null
1142	 2196	 Maximum tumour diameter: 37mm.	 PHI:Null
1142	 2256	 Distance of tumour to nearer cut end: 45mm(distal margin).	 PHI:Null
1142	 2281	 Tumour perforation:  No.	 PHI:Null
1142	 2343	 Relation of tumour to anterior peritoneal reflection:  Above.	 PHI:Null
1142	 2367	 Microscopic Description	 PHI:Null
1142	 2372	 Type	 PHI:Null
1142	 2391	 Adenocarcinoma NOS	 PHI:Null
1142	 2427	 Differentiation by predominant area	 PHI:Null
1142	 2464	 Moderately to poorly differentiated.	 PHI:Null
1142	 2479	 Local invasion	 PHI:Null
1142	 2509	 pT3 Beyond muscularis propria	 PHI:Null
1142	 2823	 Carcinoma extends through the muscularis propria and into the subserosal fibroadipose tissue. Although tumour comes close to the free serosal surface, including a focal reactive mesothelial cell hyperplasia and granulation type tissue, no convincing direct tumour involvement is seen on multiple levels examined.	 PHI:Null
1142	 2853	 Tumour involvement of margins	 PHI:Null
1142	 2875	 Cutends: Not involved	 PHI:Null
1142	 2931	 Non-peritonealised circumferential margin: Not involved	 PHI:Null
1142	 3003	 Macroscopic measurement from tumour to non-peritonealised margin: 15mm.	 PHI:Null
1142	 3015	 Lymph nodes	 PHI:Null
1142	 3059	 Number of lymph nodes present: Twenty-one.	 PHI:Null
1142	 3105	 Number of lymph nodes involved: Three (3/21).	 PHI:Null
1142	 3140	 pN1b Metastases in 2-3 regional LN	 PHI:Null
1142	 3164	 Lymphovascular invasion	 PHI:Null
1142	 3173	 Present	 PHI:Null
1142	 3193	 Perineural invasion	 PHI:Null
1142	 3210	 Present - focal.	 PHI:Null
1142	 3254	 Histologically confirmed distant metastases	 PHI:Null
1142	 3292	 pMX Cannot be assessed histologically	 PHI:Null
1142	 3332	 Background abnormalities/other comments	 PHI:Null
1142	 3383	 A tumour associated peri-colic abscess is present.	 PHI:Null
1142	 3457	 The presence of an uncomplicateddiverticulum is confirmed histologically.	 PHI:Null
1142	 3480	 Residual tumour status	 PHI:Null
1142	 3502	 R0 No residual tumour	 PHI:Null
1142	 3534	 Response to neoadjuvent therapy	 PHI:Null
1142	 3550	 Not applicable.	 PHI:Null
1142	 3592	 Mismatch Repair Deficiency (MMRD) Status	 PHI:Null
1142	 3625	 MLH1  Preserved nuclear staining	 PHI:Null
1142	 3658	 PMS2  Preserved nuclear staining	 PHI:Null
1142	 3691	 MSH2  Preserved nuclear staining	 PHI:Null
1142	 3724	 MSH6  Preserved nuclear staining	 PHI:Null
1142	 3864	 Preserved nuclear staining of a carcinoma for MLH1, PMS2, MSH2 and MSH6 indicates a low likelihood of microsatellite instability phenotype.	 PHI:Null
1142	 3893	 pTNM Stage 7th Edition: IIIB	 PHI:Null
1142	 3895	 	 PHI:Null
1142	 4049	 B.  Sections of bowel wall donuts show changes suggestive of a focal hyperplastic type polyp. Thereis no convincing dysplasia or evidence of malignancy.	 PHI:Null
1142	 4051	 	 PHI:Null
1142	 4062	 DIAGNOSIS:	 PHI:Null
1142	 4081	 A.  Sigmoid colon:	 PHI:Null
1142	 4196	 37mm, pTNM Stage IIIB, moderately to poorly differentiated adenocarcinoma of the sigmoid colon, clear of margins.	 PHI:Null
1142	 4319	 There is focal lymphvascular space andperineural invasion and a localized pericolic tumour associated abscess is present.	 PHI:Null
1142	 4390	 Three of twenty-one lymph nodes show metastatic adenocarcinoma (3/21).	 PHI:Null
1142	 4446	 Lowlikelihood of microsatellite instability phenotype.	 PHI:Null
1142	 4555	 B.  Bowel wall donuts: Changes suggestive of a hyperplastic polyp. No evidence of dysplasia or malignancy.	 PHI:Null
1142	 4557	 	 PHI:Null
1143	 24	 Episode No:  98Y628548Q	 IDNUM:98Y628548Q
1143	 36	 9896285.KVQ	 MEDICALRECORD:9896285.KVQ
1143	 51	 JESKA, Erich	 PATIENT:JESKA, Erich
1143	 69	 Lab No:  98Y62854	 IDNUM:98Y62854
1143	 76	 Shupin	 STREET:Shupi
1143	 108	 URRAWEEN  New South Wales  2559	 CITY:URRAWEEN
1143	 108	 URRAWEEN  New South Wales  2559	 STATE:New South Wales
1143	 108	 URRAWEEN  New South Wales  2559	 ZIP:2559
1143	 125	 Specimen: Tissue	 PHI:Null
1143	 143	 D.O.B:  23/9/1974	 DATE:23/9/1974=>1974-09-23
1143	 151	 Sex:  M	 PHI:Null
1143	 182	 Collected: 26/06/2012 at 12:01	 TIME:26/06/2012 at 12:01=>2012-06-26T12:01
1143	 248	 Location:  Forensic Medicine-BEACONSFIELD DISTRICT HEALTH SERVICE	 DEPARTMENT:Forensic Medicine
1143	 248	 Location:  Forensic Medicine-BEACONSFIELD DISTRICT HEALTH SERVICE	 HOSPITAL:BEACONSFIELD DISTRICT HEALTH SERVICE
1143	 270	 DR RICKIE Weston SOLE	 DOCTOR:RICKIE Weston SOLE
1143	 319	 Distribution:   FILE-COPY,   NSW-CANCER-REGISTRY	 PHI:Null
1143	 329	 CLINICAL:	 PHI:Null
1143	 474	 High anterior resection for suspected colon cancer.  Smallfirm subcapsular nodule in seg IVB of liver.  H/T, IDH (CABG 15 years ago), AF, T2DM.	 DURATION:15 years=>P5Y
1143	 487	 MACROSCOPIC:	 PHI:Null
1143	 1098	 A.  Specimen labelled "Anterior resection (sigmoid colon)", consists of a segment of unoriented large bowel 175mm in length and 55mm in open circumference with attachedmesosigmoid up to 100mm in width and 30mm in thickness.  A circumferential, constrictive tumour is identified 55mm from one resection margin. The tumour measures 30mm in length and 45mm in width.  The tumour appears to invade underlying mesosigmoid and it is up to 17mm in thickness. There are no serosal tumour deposits. Six polyps are identified measuring from 2-12mm. There are also several diverticulae, one of themcontaining faecolith.	 PHI:Null
1143	 1589	 Blocks 1 & 2- resection margin; 3 & 4 - paired blocks deepest invasion; 5 - tumour closest to serosa; 6 & 7 - tumour with adjacent non-neoplastic colon; 8 - one polyp trisected; 9 - three polyps; 10 - one polypbisected; 11 - reserved block for tissue bank; 12 - diverticulum; 13 -  apical node; 14 - high point of resection with possible nodes; 15 - four lymph nodes; 16 - three nodes; 17 - three nodes; 18 - one node bisected; 19 - four nodes; 20 ? tumour, ? lymph node.  (MI/ec  29.8.62)	 DOCTOR:MI
1143	 1589	 Blocks 1 & 2- resection margin; 3 & 4 - paired blocks deepest invasion; 5 - tumour closest to serosa; 6 & 7 - tumour with adjacent non-neoplastic colon; 8 - one polyp trisected; 9 - three polyps; 10 - one polypbisected; 11 - reserved block for tissue bank; 12 - diverticulum; 13 -  apical node; 14 - high point of resection with possible nodes; 15 - four lymph nodes; 16 - three nodes; 17 - three nodes; 18 - one node bisected; 19 - four nodes; 20 ? tumour, ? lymph node.  (MI/ec  29.8.62)	 DATE:29.8.62=>2062-08-29
1143	 1782	 B.  Specimen labelled "Segment IVB liver biopsy" consists of a piece of hard tan tissue 7 x 5 x 4mm.  AE one block.  [The specimen will be processed after decalcification].   (ZE/cc  30/8/62)	 DOCTOR:ZE
1143	 1782	 B.  Specimen labelled "Segment IVB liver biopsy" consists of a piece of hard tan tissue 7 x 5 x 4mm.  AE one block.  [The specimen will be processed after decalcification].   (ZE/cc  30/8/62)	 DATE:30/8/62=>2062-08-30
1143	 1784	 	 PHI:Null
1143	 1828	 MICROSCOPIC: (Reported by Dr Y Funderbunk)	 DOCTOR:Y Funderbunk
1143	 2160	 A.  Sections show a moderately differentiated adenocarcinoma of the sigmoid colon.  The carcinoma has infiltrated through the full thickness of the bowel wall and shows invasion of the mesosigmoid for a distance of approximately 7mm.  Carcinoma infiltrates to the peritoneal surface which appears to have been breached by tumour.	 PHI:Null
1143	 2442	 Five (5) polyps have been identified and the largest of these (size 9mm) is a malignant polyp which shows submucosal invasion by moderately differentiated adenocarcinoma .  Three (3) of the polyps are tubular adenomas with low grade dysplasia and the 4th is a hyperplastic polyp.	 PHI:Null
1143	 2616	 The seventeen (17) lymph nodes identified are free of metastatic carcinoma (one of the nodes close to the tumour shows direct involvement but there is no metastatic spread).	 PHI:Null
1143	 2771	 The sigmoid also shows uncomplicated diverticular disease and the colonic mucosa away from the tumours and diverticula shows no significant abnormality.	 PHI:Null
1143	 2926	 B.  Sections show dense fibrous tissue showing nodular dystrophic calcification.  There is only minimal liver tissue present which shows no abnormality.	 PHI:Null
1143	 2939	 DIAGNOSIS:	 PHI:Null
1143	 2961	 Sigmoid Colectomy:	 PHI:Null
1143	 2985	 Macroscopic Description	 PHI:Null
1143	 3018	 Site of tumour:  Sigmoid colon	 PHI:Null
1143	 3052	 Maximum tumour diameter:     45mm	 PHI:Null
1143	 3099	 Distance of tumour to nearer cut end:     55mm	 PHI:Null
1143	 3124	 Tumour perforation:   No	 PHI:Null
1143	 3148	 Microscopic Description	 PHI:Null
1143	 3154	 Type	 PHI:Null
1143	 3173	 Adenocarcinoma NOS	 PHI:Null
1143	 3210	 Differentiation by predominant area	 PHI:Null
1143	 3219	 Moderate	 PHI:Null
1143	 3235	 Local invasion	 PHI:Null
1143	 3296	 pT4a Tumour penetrates the surface ofthe visceral peritoneum	 PHI:Null
1143	 3327	 Tumour involvement of margins	 PHI:Null
1143	 3350	 Cut ends: Not involved	 PHI:Null
1143	 3362	 Lymph nodes	 PHI:Null
1143	 3397	 Number of lymph nodes present: 17	 PHI:Null
1143	 3431	 Number of lymph nodes involved:0	 PHI:Null
1143	 3461	 pN0 No regional LN metastasis	 PHI:Null
1143	 3486	 Lymphovascular invasion	 PHI:Null
1143	 3493	 Absent	 PHI:Null
1143	 3513	 Perineural invasion	 PHI:Null
1143	 3520	 Absent	 PHI:Null
1143	 3564	 Histologically confirmed distant metastases	 PHI:Null
1143	 3602	 pMX Cannot be assessed histologically	 PHI:Null
1143	 3642	 Background abnormalities/other comments	 PHI:Null
1143	 3698	 Adenomas: Tubular adenoma (x3), hyperplastic polyp (x1)	 PHI:Null
1143	 3775	 Synchronous carcinomas - 9mm malignant polyp with submucosal invasion (pT1)	 PHI:Null
1143	 3798	 Residual tumour status	 PHI:Null
1143	 3820	 R0 No residual tumour	 PHI:Null
1143	 3862	 Mismatch Repair Deficiency (MMRD) Status	 PHI:Null
1143	 3895	 MLH1  Preserved nuclear staining	 PHI:Null
1143	 3928	 PMS2  Preserved nuclear staining	 PHI:Null
1143	 3961	 MSH2  Preserved nuclear staining	 PHI:Null
1143	 3995	 MSH6  Preserved nuclear staining	 PHI:Null
1143	 4135	 Preserved nuclear staining of a carcinoma for MLH1, PMS2, MSH2 and MSH6 indicates a low likelihood of microsatellite instability phenotype.	 PHI:Null
1143	 4161	 Summary - TNM 7th Edition	 PHI:Null
1143	 4187	 pT4a   pN0     pMX    RO	 PHI:Null
1143	 4189	 	 PHI:Null
1143	 4192	 	 PHI:Null
1144	 24	 Episode No:  19P329496B	 IDNUM:19P329496B
1144	 36	 1963294.YRB	 MEDICALRECORD:1963294.YRB
1144	 56	 POIRIER, MARYANNA	 PATIENT:POIRIER, MARYANNA
1144	 74	 Lab No:  19P32949	 IDNUM:19P32949
1144	 87	 Rocky Spring	 STREET:Rocky Spring
1144	 118	 BOWEN  Western Australia  7022	 CITY:BOWEN
1144	 118	 BOWEN  Western Australia  7022	 STATE:Western Australia
1144	 118	 BOWEN  Western Australia  7022	 ZIP:7022
1144	 135	 Specimen: Tissue	 PHI:Null
1144	 153	 D.O.B:  16/1/1991	 DATE:16/1/1991=>1991-01-16
1144	 161	 Sex:  F	 PHI:Null
1144	 192	 Collected: 28/06/2012 at 14:03	 TIME:28/06/2012 at 14:03=>2012-06-28T14:03
1144	 237	 Location:  St Vincent-KERANG DISTRICT HEALTH	 DEPARTMENT:St Vincent
1144	 237	 Location:  St Vincent-KERANG DISTRICT HEALTH	 HOSPITAL:KERANG DISTRICT HEALTH
1144	 264	 DR RANDOLPH FERMIN PIERATT	 DOCTOR:RANDOLPH FERMIN PIERATT
1144	 313	 Distribution:   FILE-COPY,   NSW-CANCER-REGISTRY	 PHI:Null
1144	 323	 CLINICAL:	 PHI:Null
1144	 357	 R cystic renal tumour.  R kidney.	 PHI:Null
1144	 370	 MACROSCOPIC:	 PHI:Null
1144	 1000	 Specimen labelled "Right kidney" consists of a 285g radical nephrectomy comprising the kidney (125 x 75 x 55mm), the ureter (100mm long and up to 4mm in diameter) and patchy perinephric fat (up to 12mm in thickness).  There is a tumour occupying the lower to middle poles of the kidney 70 x 55 x 52mm.  The cut surface is multilocular and cystic/solid.  The solid areas constitute approximately 20% of the tumour.  The tumour appears to be encapsulated and is 1mm clear of the renal capsule margin.  The tumour is pushing against but does not appear to be involving the pelvicalyceal system.  The adrenal gland is not identified.	 PHI:Null
1144	 1463	 Blocks:  1 - distal urethral shaved margin; 2 - renal artery and vein shaved margins; 3 to 5 - sections of tumour in relation to renal capsule and perinephric fat (in block 5); 6 - tumour and pelvicalyceal system; 7 - tumour in relation to pelviureteric junction; 8 - interface of tumour and normal renal parenchyma; 9 - tumour and renal capsule; 10 - section of tumour, reserved block for tumour banking; 11 - section ofkidney away from tumour.   (FL/cc 1/8/62)	 DOCTOR:FL
1144	 1463	 Blocks:  1 - distal urethral shaved margin; 2 - renal artery and vein shaved margins; 3 to 5 - sections of tumour in relation to renal capsule and perinephric fat (in block 5); 6 - tumour and pelvicalyceal system; 7 - tumour in relation to pelviureteric junction; 8 - interface of tumour and normal renal parenchyma; 9 - tumour and renal capsule; 10 - section of tumour, reserved block for tumour banking; 11 - section ofkidney away from tumour.   (FL/cc 1/8/62)	 DATE:1/8/62=>2062-08-01
1144	 1465	 	 PHI:Null
1144	 1505	 MICROSCOPIC (Reported by Dr D Temples):	 DOCTOR:D Temples
1144	 2006	 Sections show a renal cell carcinoma, clear cell type.  The tumour measures 70x 55 x 52mm and has a variable appearance with areas resembling multilocular cystic renal cell carcinoma and solid areas.  The nuclei are Fuhrman grade 3 and there is prominent lymphovascular invasion at the periphery of the tumour, particularly where the carcinoma shows capsular invasion.  There is prominent capsular invasion for a distance of about 5mm.  There is no invasion of the renal vein or pelvicalyceal system.	 PHI:Null
1144	 2072	 The carcinoma is 1mm clear of the perirenal fat resection margin.	 PHI:Null
1144	 2164	 The tumour shows strong positive staining for CD10 and the Ki67 is 20% in the worst areas.	 PHI:Null
1144	 2218	 The kidney away from the tumour shows no abnormality.	 PHI:Null
1144	 2242	 KIDNEY TUMOUR PROFORMA:	 PHI:Null
1144	 2302	 Position of tumour:  Right kidney (lower and middle poles)	 PHI:Null
1144	 2340	 Dimensions of tumour:  70 x 55 x 52mm	 PHI:Null
1144	 2369	 Tumour type:  Clearcell type	 PHI:Null
1144	 2437	 Fuhrman grade:  Grade 3 - nucleoli prominent at 100x magnification	 PHI:Null
1144	 2473	 Sarcomatoid differentiation: Absent	 PHI:Null
1144	 2506	 Rhabdoid differentiation: Absent	 PHI:Null
1144	 2523	 Necrosis: Absent	 PHI:Null
1144	 2557	 Tumour spread beyond kidney:  Yes	 PHI:Null
1144	 2600	 Tumour extends beyond Gerota's fascia:  No	 PHI:Null
1144	 2630	 Tumourin renal sinus fat:  No	 PHI:Null
1144	 2702	 Tumour in renal vein or its segmental (muscle containing branches):  No	 PHI:Null
1144	 2744	 Lymphovascular invasion:  Yes (extensive)	 PHI:Null
1144	 2800	 Tumour in adrenal gland:  No (no adrenal gland present)	 PHI:Null
1144	 2846	 Lymph node status:  Number of lymph nodes:  0	 PHI:Null
1144	 2887	 Involvement of surgical margins:  Absent	 PHI:Null
1144	 2939	 Site of nearest margin:  Extracapsular spread (1mm)	 PHI:Null
1144	 2967	 AJCC tumour stage (7th Ed.)	 PHI:Null
1144	 3136	 pT3a - Tumour extends into the renal vein or its segmental (muscle containing) branches, or tumour invades perirenal and/or renal sinus fat but notbeyond Gerota fascia.	 PHI:Null
1144	 3183	 pNX - Regional lymph nodes cannot be assessed.	 PHI:Null
1144	 3223	 pMX - Cannot be assessed histologically	 PHI:Null
1144	 3322	 Scoring Algorithm to Predict Metastases after Radical Nephrectomy (Leibovich et al., Cancer, 2003)	 PHI:Null
1144	 3371	 Primary tumour status score (pathologic T stage)	 PHI:Null
1144	 3379	 pT3a  4	 PHI:Null
1144	 3422	 Regional lymph node status (N stage) score	 PHI:Null
1144	 3429	 pNx  0	 PHI:Null
1144	 3446	 Tumour size (cm)	 PHI:Null
1144	 3454	 < 10  0	 PHI:Null
1144	 3474	 Nuclear grade score	 PHI:Null
1144	 3479	 3  1	 PHI:Null
1144	 3512	 Histologic tumour necrosis score	 PHI:Null
1144	 3518	 No  0	 PHI:Null
1144	 3546	 Total score (out of 11):  5	 PHI:Null
1144	 3556	 DIAGNOSIS	 PHI:Null
1144	 3574	 Left nephrectomy:	 PHI:Null
1144	 3666	 - 70mm clear cell renal cell carcinoma, Fuhrman grade 3, extensive lymphovascular invasion;	 PHI:Null
1144	 3723	 - Tumour invades perirenal fat (estimated distance 5mm);	 PHI:Null
1144	 3770	 - Margins clear (clearance perirenal fat 1mm);	 PHI:Null
1144	 3818	 - No invasion of renal sinus fat or renal vein;	 PHI:Null
1144	 3822	 -a.	 PHI:Null
1144	 3824	 	 PHI:Null
1145	 25	 Episode No:  83Z179706W	 IDNUM:83Z179706W
1145	 37	 8391797.AQW	 MEDICALRECORD:8391797.AQW
1145	 61	 Nevius, AUGUST LYNDON	 PATIENT:Nevius, AUGUST LYNDON
1145	 79	 Lab No:  83Z17970	 IDNUM:83Z17970
1145	 88	 Manolete	 STREET:Manolete
1145	 107	 ALDGATE  TAS  3576	 CITY:ALDGATE
1145	 107	 ALDGATE  TAS  3576	 STATE:TAS
1145	 107	 ALDGATE  TAS  3576	 ZIP:3576
1145	 124	 Specimen: Tissue	 PHI:Null
1145	 142	 D.O.B:  11/3/2006	 DATE:11/3/2006=>2006-11-03
1145	 150	 Sex:  M	 PHI:Null
1145	 181	 Collected: 03/07/2012 at 16:11	 TIME:03/07/2012 at 16:11=>2012-07-03T16:11
1145	 222	 Location:  PATHOLOGYWEST-BAMAGA HOSPITAL	 DEPARTMENT:PATHOLOGYWEST
1145	 222	 Location:  PATHOLOGYWEST-BAMAGA HOSPITAL	 HOSPITAL:BAMAGA HOSPITAL
1145	 249	 DR Clemente WILFRED KRIEGH	 DOCTOR:Clemente WILFRED KRIEGH
1145	 298	 Distribution:   FILE-COPY,   NSW-CANCER-REGISTRY	 PHI:Null
1145	 308	 CLINICAL:	 PHI:Null
1145	 350	 Right hemicolectomy for adenocarcinoma.	 PHI:Null
1145	 363	 MACROSCOPIC:	 PHI:Null
1145	 966	 Specimen labelled "Right hemicolectomy" consists of a specimen of terminal ileumstump (35mm long), caecum and ascending colon (110mm long), vermiform appendix (70mm long and up to 7mm in diameter) and pericolonic fatty tissue (110 x 55 x 20mm).  There is a fungating tumour in the posteriorwall of the ascending colon occupying 60% of its circumference and measuring 45 x 40 x 18mm.  The tumour is 55mm from proximal and 50mm from distal resection margins.  The tumourappears to have infiltrated through the muscularis propria focally.  The serosal surface of the appendix appears slightly congested.	 PHI:Null
1145	 1488	 Blocks: 1 - shaved proximal margin; 2 - distal margin; 3 & 4 - representative TS of tumour, the deepest penetration; 5 - representative LS of the tumour; 6 - representative TS of tumour, reserve block for tumour bank; 7 - TS of tumour and serosa; 8 - one LS tip of the appendix and twoTS; 9 - the apical lymph node bisected; 10 - one lymph node bisected; 11 - one bisected lymph node; 12 - one bisected lymph node; 13 - up to four lymph nodes; 14 - up to five lymph nodes; 15 - one bisected lymph node.   (CN/ta 9/4/62)	 DOCTOR:CN
1145	 1488	 Blocks: 1 - shaved proximal margin; 2 - distal margin; 3 & 4 - representative TS of tumour, the deepest penetration; 5 - representative LS of the tumour; 6 - representative TS of tumour, reserve block for tumour bank; 7 - TS of tumour and serosa; 8 - one LS tip of the appendix and twoTS; 9 - the apical lymph node bisected; 10 - one lymph node bisected; 11 - one bisected lymph node; 12 - one bisected lymph node; 13 - up to four lymph nodes; 14 - up to five lymph nodes; 15 - one bisected lymph node.   (CN/ta 9/4/62)	 DATE:9/4/62=>2062-09-04
1145	 1529	 MICROSCOPIC (reported by Dr R Pusateri):	 DOCTOR:R Pusateri
1145	 1615	 Sections show moderately differentiated adenocarcinoma.  The features are as follows:	 PHI:Null
1145	 1639	 Macroscopic Description	 PHI:Null
1145	 1674	 Site of tumour:  Ascending colon	 PHI:Null
1145	 1705	 Maximum tumour diameter:  45mm	 PHI:Null
1145	 1758	 Distance of tumour to nearer cut end:  50mm (distal)	 PHI:Null
1145	 1782	 Tumour perforation:  No	 PHI:Null
1145	 1806	 Microscopic Description	 PHI:Null
1145	 1812	 Type	 PHI:Null
1145	 1831	 Adenocarcinoma NOS	 PHI:Null
1145	 1867	 Differentiation by predominant area	 PHI:Null
1145	 1876	 Moderate	 PHI:Null
1145	 1891	 Local invasion	 PHI:Null
1145	 1925	 pT3     Beyond muscularis propria	 PHI:Null
1145	 1955	 Tumour involvement of margins	 PHI:Null
1145	 1979	 Cut ends:  Not involved	 PHI:Null
1145	 2036	 Non-peritonealised circumferential margin:  Not involved	 PHI:Null
1145	 2048	 Lymph nodes	 PHI:Null
1145	 2084	 Number of lymph nodes present:  15	 PHI:Null
1145	 2120	 Number of lymph nodes involved:  0	 PHI:Null
1145	 2149	 pN0No regional LN metastasis	 PHI:Null
1145	 2173	 Lymphovascular invasion	 PHI:Null
1145	 2180	 Absent	 PHI:Null
1145	 2200	 Perineural invasion	 PHI:Null
1145	 2207	 Absent	 PHI:Null
1145	 2251	 Histologically confirmed distant metastases	 PHI:Null
1145	 2293	 pMX     Cannot be assessed histologically	 PHI:Null
1145	 2333	 Background abnormalities/other comments	 PHI:Null
1145	 2380	 The appendix shows no significant abnormality	 PHI:Null
1145	 2403	 Residual tumour status	 PHI:Null
1145	 2429	 R0     No residual tumour	 PHI:Null
1145	 2471	 Mismatch Repair Deficiency (MMRD) Status	 PHI:Null
1145	 2504	 MLH1  Preserved nuclear staining	 PHI:Null
1145	 2537	 PMS2  Preserved nuclear staining	 PHI:Null
1145	 2570	 MSH2  Preserved nuclear staining	 PHI:Null
1145	 2603	 MSH6  Preserved nuclear staining	 PHI:Null
1145	 2612	 Comment:	 PHI:Null
1145	 2880	 Absence (loss) of nuclear staining for any of the mismatch repair enzymes MLH1, PMS2, MSH2 or MSH6 is associated with microsatellite instability phenotype (MSI), and may reflect the presence of a germline mutation or somatic inactivation of that mismatch repair gene.	 PHI:Null
1145	 3020	 Preserved nuclear staining of a carcinoma for MLH1, PMS2, MSH2 and MSH6 indicates a low likelihood of microsatellite instability phenotype.	 PHI:Null
1145	 3046	 Summary - TNM 7th Edition	 PHI:Null
1145	 3073	 pT3     pN0     pMX     R0	 PHI:Null
1146	 24	 Episode No:  88D941303V	 IDNUM:88D941303V
1146	 36	 8819413.CIV	 MEDICALRECORD:8819413.CIV
1146	 54	 HOBKIRK, STACEY	 PATIENT:HOBKIRK, STACEY
1146	 72	 Lab No:  88D94130	 IDNUM:88D94130
1146	 85	 Holy Harbour	 STREET:Holy Harbour
1146	 111	 MILDURA  Queensland  6038	 CITY:MILDURA
1146	 111	 MILDURA  Queensland  6038	 STATE:Queensland
1146	 111	 MILDURA  Queensland  6038	 ZIP:6038
1146	 128	 Specimen: Tissue	 PHI:Null
1146	 146	 D.O.B:  16/4/2011	 DATE:16/4/2011=>2011-04-16
1146	 154	 Sex:  F	 PHI:Null
1146	 185	 Collected: 04/07/2012 at 13:47	 TIME:04/07/2012 at 13:47=>2012-07-04T13:47
1146	 224	 Location:  Orana - PORT PIRIE HOSPITAL	 DEPARTMENT:Orana
1146	 224	 Location:  Orana - PORT PIRIE HOSPITAL	 HOSPITAL:PORT PIRIE HOSPITAL
1146	 242	 DR OMER JAY ADAME	 DOCTOR:OMER JAY ADAME
1146	 291	 Distribution:   FILE-COPY,   NSW-CANCER-REGISTRY	 PHI:Null
1146	 301	 CLINICAL:	 PHI:Null
1146	 379	 56yr old woman with advanced vulvar cancer with bulky groin and pelvic nodes.	 AGE:56
1146	 392	 MACROSCOPIC:	 PHI:Null
1146	 601	 A.  Specimen labelled "Left medial inguinal lymph node" consists of a piece of fibrofatty tissue with seven lymph nodes.  The largest one measuring 50 x 30 x 20mm.  The smallest one measuring 10 x 10 x 10mm.	 PHI:Null
1146	 641	 Blocks: 1 to 7 - one lymph node each.	 PHI:Null
1146	 836	 B.  Specimen labelled "Right medial inguinal lymph node" consists of a piece of tissue measuring 70 x 70 x 10mm.  Three lymph nodes are identified measuring 10,20,and 60mm in maximum diameter.	 PHI:Null
1146	 901	 Blocks: 1 to 3 - onerepresentative section from each lymph node.	 PHI:Null
1146	 1067	 C.  Specimen labelled "Left external iliac lymph node" consists of a piece of fibrofatty tissue with three lymph nodes measuring 10, 10and 25mm in maximum diameter.	 PHI:Null
1146	 1165	 Blocks: 1 & 2 - one bisected lymph node; 3 - representative sections with the largest lymph node.	 PHI:Null
1146	 1338	 D.  Specimen labelled "Right external iliac lymph node" consists of two lymph nodes measuring 20 and 25mm in maximum diameter.  On sectioning they are replaced by tumour.	 PHI:Null
1146	 1402	 Blocks: 1 & 2 - representative sections of a lymph node each.	 PHI:Null
1146	 1578	 E.  Specimen labelled "Right obturator lymph nodes" consists of two lymph nodes measuring 15and 30mm in maximum diameter.  On sectioning they are totally replaced by tumour.	 PHI:Null
1146	 1642	 Blocks: 1 & 2 - representative sections of a lymph node each.	 PHI:Null
1146	 1645	 	 PHI:Null
1146	 1776	 F.  Specimen labelled "Right lateral inguinal lymph node" consists of two lymph nodes measuring 15 and 20mm in maximum diameter.	 PHI:Null
1146	 1925	 Blocks: 1 - bisected lymph node; 2 - representative sections of a lymph node; 3 - lymph node with tumour selected for tissue bank.   (XF/ta  57/12)	 DOCTOR:XF
1146	 1928	 	 PHI:Null
1146	 1967	 MICROSCOPIC (reported by Dr X Lemish):	 DOCTOR:X Lemish
1146	 2084	 A.  Four of seven lymph nodes show metastatic squamous cell carcinoma.  No definite extracapsular spread is present.	 PHI:Null
1146	 2190	 B.  Three lymph nodes show metastatic squamous cell carcinoma.  No definite extracapsular spread is seen.	 PHI:Null
1146	 2304	 C.  One of three lymph nodes shows metastatic squamous cell carcinoma.  No definite extracapsular spread is seen.	 PHI:Null
1146	 2406	 D.  One of two lymph nodes show metastatic squamous cell carcinoma.  Extracapsular spread is present.	 PHI:Null
1146	 2510	 E.  Two lymph nodes show metastatic squamous cell carcinoma.  No definite extracapsular spread is seen.	 PHI:Null
1146	 2621	 F.  One of two lymph nodes shows metastatic squamouscell carcinoma.  No definite extracapsular spread is seen.	 PHI:Null
1146	 2632	 DIAGNOSIS:	 PHI:Null
1146	 2715	 Twelve of nineteen (12 of 19) lymph nodes show metastatic squamous cell carcinoma.	 PHI:Null
1147	 24	 Episode No:  62M791612Q	 IDNUM:62M791612Q
1147	 35	 624791.RDH	 MEDICALRECORD:624791.RDH
1147	 54	 NESBY, TOM BERRY	 PATIENT:NESBY, TOM BERRY
1147	 72	 Lab No:  62M79161	 IDNUM:62M79161
1147	 80	 Oxendon	 STREET:Oxendo
1147	 102	 SILVERDALE  VIC  7248	 CITY:SILVERDALE
1147	 102	 SILVERDALE  VIC  7248	 STATE:VIC
1147	 102	 SILVERDALE  VIC  7248	 ZIP:7248
1147	 119	 Specimen: Tissue	 PHI:Null
1147	 136	 D.O.B:  7/7/1985	 DATE:7/7/1985=>1985-07-07
1147	 144	 Sex:  F	 PHI:Null
1147	 175	 Collected: 09/07/2012 at 09:14	 TIME:09/07/2012 at 09:14=>2012-07-09T09:14
1147	 225	 Location:  CORONARY CARE UNIT-NARRANDERA HOSPITAL	 DEPARTMENT:CORONARY CARE UNIT
1147	 225	 Location:  CORONARY CARE UNIT-NARRANDERA HOSPITAL	 HOSPITAL:NARRANDERA HOSPITAL
1147	 251	 DR SETH WILLIAMS Kreidler	 DOCTOR:SETH WILLIAMS Kreidler
1147	 288	 Distribution:  DR Arhart,  FILE-COPY	 DOCTOR:Arhart
1147	 298	 CLINICAL:	 PHI:Null
1147	 334	 Caecal + transverse colon cancer.	 PHI:Null
1147	 347	 MACROSCOPIC:	 PHI:Null
1147	 545	 Specimen labelled "Right colon" consists of a right hemicolectomy with terminal ileum 35mm in length attached to caecum and colon 208mm in length.  The attachedmesocolon measures 310 x 95 x 30mm.	 PHI:Null
1147	 869	 On opening, two tumours are identified.  The first tumour is an ulcerated, sessile polyp within caecum, involving approximately 80% of the caecal circumference.  This tumour abuts the ileocaecalvalve and is 39mm from the nearest (proximal) resection margin.  The tumour measures 70 x 30 x 15mm and is clear of the serosa.	 PHI:Null
1147	 1071	 The second tumour is a sessile ulcerated polyp within transverse colon, 52 x 55 x 14mm.  This tumour is120mm from the nearest (distal) resection margin. There is no obvious invasion into the submucosa.	 PHI:Null
1147	 1158	 Multiple mucosal polyps up to 7mm are present within ascending and transverse colon.	 PHI:Null
1147	 1315	 A 3mm area of mucosal scarring is present 60mm from the distal resection margin, with black pigmentation deep to the area of scarring (?polypectomy site).	 PHI:Null
1147	 1399	 The mucosa of the terminal ileum is unremarkable.  The appendix is not identified.	 PHI:Null
1147	 1909	 Blocks:  1 - proximal resection margin; 2 - distal resection margin; 3 to 5 - caecal tumour (tumour 1); 6 to 8 - transverse colon tumour (tumour 2); 9 & 10 - colonic polyps; 11 - representative colonic mucosa; 12 - representative terminal ileum; 13 - one apical node bisected; 14 to 18 - mesocolonic lymph nodes; 19 - representative area of mucosal scarring; 20 - tumour 1 reserve block; 21 - tumour 2 reserve block; 22 to 33 - remainder of large transverse colon polypAE.  (RZ/mm/ta 9/11/62) (WN/cc 12/9/62)	 DOCTOR:RZ
1147	 1909	 Blocks:  1 - proximal resection margin; 2 - distal resection margin; 3 to 5 - caecal tumour (tumour 1); 6 to 8 - transverse colon tumour (tumour 2); 9 & 10 - colonic polyps; 11 - representative colonic mucosa; 12 - representative terminal ileum; 13 - one apical node bisected; 14 to 18 - mesocolonic lymph nodes; 19 - representative area of mucosal scarring; 20 - tumour 1 reserve block; 21 - tumour 2 reserve block; 22 to 33 - remainder of large transverse colon polypAE.  (RZ/mm/ta 9/11/62) (WN/cc 12/9/62)	 DATE:9/11/62=>2062-09-11
1147	 1909	 Blocks:  1 - proximal resection margin; 2 - distal resection margin; 3 to 5 - caecal tumour (tumour 1); 6 to 8 - transverse colon tumour (tumour 2); 9 & 10 - colonic polyps; 11 - representative colonic mucosa; 12 - representative terminal ileum; 13 - one apical node bisected; 14 to 18 - mesocolonic lymph nodes; 19 - representative area of mucosal scarring; 20 - tumour 1 reserve block; 21 - tumour 2 reserve block; 22 to 33 - remainder of large transverse colon polypAE.  (RZ/mm/ta 9/11/62) (WN/cc 12/9/62)	 DOCTOR:WN
1147	 1909	 Blocks:  1 - proximal resection margin; 2 - distal resection margin; 3 to 5 - caecal tumour (tumour 1); 6 to 8 - transverse colon tumour (tumour 2); 9 & 10 - colonic polyps; 11 - representative colonic mucosa; 12 - representative terminal ileum; 13 - one apical node bisected; 14 to 18 - mesocolonic lymph nodes; 19 - representative area of mucosal scarring; 20 - tumour 1 reserve block; 21 - tumour 2 reserve block; 22 to 33 - remainder of large transverse colon polypAE.  (RZ/mm/ta 9/11/62) (WN/cc 12/9/62)	 DATE:12/9/62=>2062-09-12
1147	 1949	 MICROSCOPIC (reported by Dr L Pirieda):	 DOCTOR:L Pirieda
1147	 2062	 Sections of the caecal lesion show a moderately differentiated adenocarcinoma, invading the pericolic fat (pT3).	 PHI:Null
1147	 2233	 The entire polyp in the transverse colon has been embedded.  Sections show a tubulovillous adenoma with low grade dysplasia.  There is no evidence of invasive malignancy.	 PHI:Null
1147	 2401	 At 60 mm from distal margin, there is an area of transmural scarring associated with tattoo pigment.  The adjacent mucosa shows no evidence of dysplasia or malignancy.	 PHI:Null
1147	 2482	 Also present in the colon are 5 small tubular adenomas with low grade dysplasia.	 PHI:Null
1147	 2492	 SUMMARY	 PHI:Null
1147	 2517	 Site of tumour: Caecum	 PHI:Null
1147	 2551	 Maximum tumour diameter:     70mm	 PHI:Null
1147	 2609	 Distance of tumour to nearer cut end:     39mm (proximal)	 PHI:Null
1147	 2636	 Tumour perforation:     No	 PHI:Null
1147	 2641	 Type	 PHI:Null
1147	 2660	 Adenocarcinoma NOS	 PHI:Null
1147	 2696	 Differentiation by predominant area	 PHI:Null
1147	 2705	 Moderate	 PHI:Null
1147	 2720	 Local invasion	 PHI:Null
1147	 2750	 pT3 Beyond muscularis propria	 PHI:Null
1147	 2779	 Tumour involvement ofmargins	 PHI:Null
1147	 2802	 Cut ends: Not involved	 PHI:Null
1147	 2814	 Lymph nodes	 PHI:Null
1147	 2850	 Number of lymph nodes present:  17	 PHI:Null
1147	 2886	 Number of lymph nodes involved:  0	 PHI:Null
1147	 2916	 pN0 No regional LN metastasis	 PHI:Null
1147	 2940	 Lymphovascular invasion	 PHI:Null
1147	 2947	 Absent	 PHI:Null
1147	 2967	 Perineural invasion	 PHI:Null
1147	 2974	 Absent	 PHI:Null
1147	 3018	 Histologically confirmed distant metastases	 PHI:Null
1147	 3056	 pMX Cannot be assessed histologically	 PHI:Null
1147	 3096	 Background abnormalities/other comments	 PHI:Null
1147	 3187	 A large tubulovillous adenoma with low grade dysplasia is present in the transverse colon.	 PHI:Null
1147	 3260	 Five other small tubular adenomas with low grade dysplasia also present.	 PHI:Null
1147	 3363	 At 60mm from the distalmargin, there is an area of transmural scarring associated with tattoo pigment.	 PHI:Null
1147	 3386	 Residual tumour status	 PHI:Null
1147	 3408	 R0 No residual tumour	 PHI:Null
1147	 3450	 Mismatch Repair Deficiency (MMRD) Status	 PHI:Null
1147	 3483	 MLH1  Preserved nuclear staining	 PHI:Null
1147	 3516	 PMS2  Preserved nuclear staining	 PHI:Null
1147	 3549	 MSH2  Preserved nuclear staining	 PHI:Null
1147	 3582	 MSH6  Preserved nuclear staining	 PHI:Null
1147	 3591	 Comment:	 PHI:Null
1147	 3731	 Preserved nuclear staining of a carcinoma for MLH1, PMS2, MSH2 and MSH6 indicates a low likelihood of microsatellite instability phenotype.	 PHI:Null
1147	 3757	 Summary - TNM 7th Edition	 PHI:Null
1147	 3784	 pT3     pN0     pMX     R0	 PHI:Null
1147	 3794	 DIAGNOSIS	 PHI:Null
1147	 3815	 Right hemicolectomy:	 PHI:Null
1147	 3916	 Moderately differentiated adenocarcinoma in the caecum invading pericolic fat (pT3), margins clear.	 PHI:Null
1147	 3991	 Large tubulovillous adenoma with low grade dysplasia in transverse colon.	 PHI:Null
1147	 4045	 17 lymph nodes with no evidence of malignancy (pN0).	 PHI:Null
1147	 4047	 	 PHI:Null
1147	 4049	 	 PHI:Null
1148	 25	 Episode No:  10J811771Z	 IDNUM:10J811771Z
1148	 37	 1038117.SCZ	 MEDICALRECORD:1038117.SCZ
1148	 59	 Konma, NYREE JEREMY	 PATIENT:Konma, NYREE JEREMY
1148	 86	 Lab No:  10J81177,10J81177	 IDNUM:10J81177
1148	 86	 Lab No:  10J81177,10J81177	 IDNUM:10J81177
1148	 91	 Boat	 STREET:Boat
1148	 113	 TENTERFIELD  SA  4493	 CITY:TENTERFIELD
1148	 113	 TENTERFIELD  SA  4493	 STATE:SA
1148	 113	 TENTERFIELD  SA  4493	 ZIP:4493
1148	 136	 Specimen: Fluid,Tissue	 PHI:Null
1148	 154	 D.O.B:  11/2/1988	 DATE:11/2/1988=>1988-02-11
1148	 162	 Sex:  F	 PHI:Null
1148	 192	 Collected:09/07/2012 at 15:42	 TIME:09/07/2012 at 15:42=>2012-07-09T15:42
1148	 240	 Location:  ACUTECARE WARD - PORT PIRIE HOSPITAL	 DEPARTMENT:ACUTECARE WARD
1148	 240	 Location:  ACUTECARE WARD - PORT PIRIE HOSPITAL	 HOSPITAL:PORT PIRIE HOSPITAL
1148	 265	 DR Bryanna Rebekah Aspri	 DOCTOR:Bryanna Rebekah Aspri
1148	 314	 Distribution:   FILE-COPY,   NSW-CANCER-REGISTRY	 PHI:Null
1148	 324	 CLINICAL:	 PHI:Null
1148	 370	 73yo woman with recurrent endometrial cancer.	 PHI:Null
1148	 383	 MACROSCOPIC:	 PHI:Null
1148	 993	 A.  Specimen labelled "Pelvic mass & rectosigmoid" consists of an unorientated segment of colon measuring 130mm in length and up to 30mm in maximum diameter.  Attached to it there is a large fungating and necrotic lesion measuring 100x 90 x 40mm.  The mucosal surface of the colon is unremarkable.  The surgical margins are inked black and blue.  On sectioning, the tumourous mass has a variegated appearance withareas of necrosis and haemorrhage.  White solid areas are identified.  Macroscopically the tumour appears to be attached to the serosal surface of the colon but does not infiltrate the colon wall.	 PHI:Null
1148	 1232	 Blocks:  1 & 2 - LS from surgical resection margins; 3 to 5 - representative sections of colon with tumour; 6 - one representative section of tumour; 7 - tissue selected for tissue bank; 8 to 10 - eight lymph nodes from the pericolic fat.	 PHI:Null
1148	 1333	 B.  Specimen labelled "Sigmoid adhesion" consists of a piece of tissue 10 x 5 x 2mm.  AE one block.	 PHI:Null
1148	 1492	 C.  Specimen labelled "Omental biopsy" consists of a piece of omentum 35 x 30 x 15mm.  The cut surface isunremarkable.  Representative sections in 2 blocks.	 PHI:Null
1148	 1509	 (WY/mm 13.9.62)	 DOCTOR:WY
1148	 1509	 (WY/mm 13.9.62)	 DATE:13.9.62=>2062-09-13
1148	 1691	 D.  Specimen labelled "Left anterior abdominal wall" consists of an irregular piece of fibrofatty tissue 20 x 15 x 10mm.  On sectioning it has a fibrotic appearance.  AE one block.	 PHI:Null
1148	 1835	 E.  Specimen labelled "Left pelvic side wall mass" consists of two pieces of fibrofatty tissue 25 and 20mm in maximum diameter.  AE one block.	 PHI:Null
1148	 1953	 F.  Specimen labelled "Donuts proximal and distal" consists of two donuts measuring 20 x 15 x 10mmand 10 x 5 x 5mm.	 PHI:Null
1148	 1986	 Blocks:  1 & 2 - one donut each.	 PHI:Null
1148	 2174	 G.  Specimen labelled "Appendix" consists of an appendix measuring 55 x 5 x 5mm.  The external surface is unremarkable.  On sectioning, it is unremarkable.  The specimen is AE as follows:	 PHI:Null
1148	 2316	 Blocks:  1 - two LS and one TS distal appendix; 2 - two LS and one TS mid appendix; 3 - two LS and one TS proximal appendix.  (YZ/cc 12/9/62)	 DOCTOR:YZ
1148	 2316	 Blocks:  1 - two LS and one TS distal appendix; 2 - two LS and one TS mid appendix; 3 - two LS and one TS proximal appendix.  (YZ/cc 12/9/62)	 DATE:12/9/62=>2062-09-12
1148	 2318	 	 PHI:Null
1148	 2363	 MICROSCOPIC (Reported by Dr E Manginelli):	 DOCTOR:E Manginelli
1148	 3169	 A.  Sections of the mass show high grade carcinoma.  Around 30% of the tumour sampled shows features of a moderately differentiated serous carcinoma with well formed papillary structures and glands.  The remainder is undifferentiated, comprising sheets of cells with large nuclei and a variable amount of amphophilic oreosinophilic cytoplasm.  The undifferentiated component shows extensive necrosis.  The moderately differentiated component invades into and focally through the muscularis propria of the bowel, into the submucosa, but the mucosa is intact.  The undifferentiated component is mainly on the serosal aspect.  Lymphovascular invasion by tumour is noted in sub serosal tissue.  There is distorted tumour present focally within disrupted serosal tissue at one of the end marginsof the bowel.	 PHI:Null
1148	 3357	 B.  Sections show mesothelium with underlying fibrofat and some smooth muscle.  There is focal high grade carcinoma, consistent with serous carcinoma, within the submesothelial tissue.	 PHI:Null
1148	 3492	 C.  Random sections show scattered small deposits of metastatic carcinoma consistent with moderately differentiated serous carcinoma.	 PHI:Null
1148	 3716	 D.  Sections show fibrofat.  There are multifocal tumour deposits within the tissue.  Most of these have features of moderately differentiated serous carcinoma but some have features of grade 2 endometroid adenocarcinoma.	 PHI:Null
1148	 3956	 E.  Sections show piece of mesothelium with underlying fibrofat.  There are multifocal deposits of carcinoma present, most consistent with moderately differentiated serous carcinoma.  An uninvolved small lymph node is also noted focally.	 PHI:Null
1148	 4034	 F.  Sections of each donut show large intestinal wall.  No tumour is seen.	 PHI:Null
1148	 4168	 G.  Sections show appendix.  There are focal psammoma bodies with associated inflammation in the serosa but no tumour is identified.	 PHI:Null
1148	 4223	 Representative slides have also been viewed byDr E La.	 DOCTOR:E La
1148	 4236	 DIAGNOSIS:	 PHI:Null
1148	 4350	 A.  Pelvic mass and rectosigmoid:  Undifferentiated carcinoma and moderately differentiated serous carcinoma.	 PHI:Null
1148	 4399	 B.  Sigmoid adhesion:  Focal serous carcinoma.	 PHI:Null
1148	 4458	 C.  Omental biopsy:  Small deposits of serous carcinoma.	 PHI:Null
1148	 4544	 D.  Left anterior abdominal wall:  High grade serous and endometroid adenocarcinoma.	 PHI:Null
1148	 4592	 E.  Left pelvic side wall:  Serous carcinoma.	 PHI:Null
1148	 4637	 F.  Proximal and distal donuts:  No tumour.	 PHI:Null
1148	 4665	 G.  Appendix:  No tumour.	 PHI:Null
1148	 4668	 	 PHI:Null
1148	 4673	 	 PHI:Null
1149	 24	 Episode No:  31A412629K	 IDNUM:31A412629K
1149	 36	 3104126.HYK	 MEDICALRECORD:3104126.HYK
1149	 60	 BRAINERD, CAROL ARDEN	 PATIENT:BRAINERD, CAROL ARDEN
1149	 78	 Lab No:  31A41262	 IDNUM:31A41262
1149	 91	 South Tinnin	 STREET:South Tinni
1149	 122	 BEGA  Northern Territory  2559	 CITY:BEGA
1149	 122	 BEGA  Northern Territory  2559	 STATE:Northern Territory
1149	 122	 BEGA  Northern Territory  2559	 ZIP:2559
1149	 139	 Specimen: Tissue	 PHI:Null
1149	 158	 D.O.B:  24/10/2004	 DATE:24/10/2004=>2004-10-24
1149	 166	 Sex:  F	 PHI:Null
1149	 197	 Collected: 11/07/2012 at 10:29	 TIME:11/07/2012 at 10:29=>2012-07-11T10:29
1149	 262	 Location:  ST GEORGE PRIVATE - BELLINGER RIVER DISTRICT HOSPITAL	 DEPARTMENT:ST GEORGE PRIVATE
1149	 262	 Location:  ST GEORGE PRIVATE - BELLINGER RIVER DISTRICT HOSPITAL	 HOSPITAL:BELLINGER RIVER DISTRICT HOSPITAL
1149	 289	 DR JANIECE Britteny Baiera	 DOCTOR:JANIECE Britteny Baiera
1149	 338	 Distribution:   FILE-COPY,   NSW-CANCER-REGISTRY	 PHI:Null
1149	 348	 CLINICAL:	 PHI:Null
1149	 507	 Previoushysterectomy.  Endometrial stromal nodule on that specimen.  Vaginal mass noted on recent examination and biopsy showed endometrial stromal sarcoma.	 PHI:Null
1149	 520	 MACROSCOPIC:	 PHI:Null
1149	 861	 A.  Specimen labelled "Vaginal mass" consists of a nodule measuring 35 x 35 x 20mm and is partially covered by fat tissue and shiny mucosa.  On sectioning the cut surface is solid and fibrotic.  In some areas the tumour abuts the surgical margin, inked blue.  Representative sections in 4 blocks.  Block 5 tissue selected for tissue bank.	 PHI:Null
1149	 1172	 B.  Specimen labelled "Left tube and ovary" consists of a fallopian tube with ovary attached.  The fimbria is present and the fallopian tube measures 40 x 5 x 5mm.  Macroscopically it is unremarkable.The ovary measures 30 x 15 x 10mm.  On sectioning there is a round glistening nodule measuring 10 x 7 x 7mm.	 PHI:Null
1149	 1251	 Blocks: 1 & 2 - three LS of the fimbriaand one TS of the tube; 3 & 4 - ovary.	 PHI:Null
1149	 1548	 C.  Specimen labelled "Right tubeand ovary" consists of a ovary with a fragment of round ligament attached.  Thefallopian tube is not identified.  The specimen measures 35 x 30 x 5mm.  The external surface of the ovary is unremarkable and is serially sectioned and AE 3 blocks.  (OH/ta  14/9/62)	 DOCTOR:OH
1149	 1548	 C.  Specimen labelled "Right tubeand ovary" consists of a ovary with a fragment of round ligament attached.  Thefallopian tube is not identified.  The specimen measures 35 x 30 x 5mm.  The external surface of the ovary is unremarkable and is serially sectioned and AE 3 blocks.  (OH/ta  14/9/62)	 DATE:14/9/62=>2062-09-14
1149	 1588	 MICROSCOPIC (reported by Dr J Dechart):	 DOCTOR:J Dechart
1149	 2086	 A.  Sections of vaginal squamous mucosa show extensive involvement by endometrial stromal sarcoma (low grade).  Focal perineural and lymphovascular invasion are seen.  Sarcoma penetrates the full thickness of the vaginal wall and infiltrates perivaginal adipose tissue producing a fibroblastic reaction.  Sarcoma focally involves the deep resection margin.  Sarcoma falls just short of the peripheral resection margins in the representative sections examined.  The ER and PR stains are positive.	 PHI:Null
1149	 2263	 B.  Sections of the left ovary show a 10mm deposit of endometrial stromal sarcoma (low grade).  The remainder of the ovary and fallopian tube show no significant abnormality.	 PHI:Null
1149	 2410	 C.  Sections of the ovary show a number of benign serous cysts.  The right fallopian tube is not identified.  There is noevidence of malignancy.	 PHI:Null
1149	 2421	 DIAGNOSIS:	 PHI:Null
1149	 2435	 A.  Vagina:	 PHI:Null
1149	 2479	 -  Endometrial stromal sarcoma (low grade).	 PHI:Null
1149	 2504	 -  Positive deep margin.	 PHI:Null
1149	 2569	 B.  Left fallopian tube and ovary:  Endometrial stromal sarcoma.	 PHI:Null
1149	 2615	 C.  Right ovary:  No significant abnormality.	 PHI:Null
1150	 25	 Episode No:  51R013587V	 IDNUM:51R013587V
1150	 37	 5160135.VUV	 MEDICALRECORD:5160135.VUV
1150	 56	 STANDARD, Tomasa	 PATIENT:STANDARD, Tomasa
1150	 83	 Lab No:  51R01358,51R01358	 IDNUM:51R01358
1150	 83	 Lab No:  51R01358,51R01358	 IDNUM:51R01358
1150	 94	 Midge Hall	 STREET:Midge Hall
1150	 114	 NEWCASTLE  WA  2316	 CITY:NEWCASTLE
1150	 114	 NEWCASTLE  WA  2316	 STATE:WA
1150	 114	 NEWCASTLE  WA  2316	 ZIP:2316
1150	 140	 Specimen: Washings,Tissue	 PHI:Null
1150	 158	 D.O.B:  24/4/1997	 DATE:24/4/1997=>1997-04-24
1150	 164	 Sex:F	 PHI:Null
1150	 195	 Collected: 07/04/2014 at 17:40	 TIME:07/04/2014 at 17:40=>2014-04-07T17:40
1150	 259	 Location:  PARKES 9 EAST - EIDSVOLD MULTIPURPOSE HEALTH SERVICE	 DEPARTMENT:PARKES 9 EAST
1150	 259	 Location:  PARKES 9 EAST - EIDSVOLD MULTIPURPOSE HEALTH SERVICE	 HOSPITAL:EIDSVOLD MULTIPURPOSE HEALTH SERVICE
1150	 279	 DR Roy FRITZ Reilly	 DOCTOR:Roy FRITZ Reilly
1150	 316	 Distribution:    NSW-CANCER-REGISTRY	 PHI:Null
1150	 326	 CLINICAL:	 PHI:Null
1150	 391	 Endometrial high grade endometrial cancer.  Hypertension. GORD.	 PHI:Null
1150	 404	 MACROSCOPIC:	 PHI:Null
1150	 1708	 A.  Specimen labelled "Uterus, cervix, bilateral tubes & ovaries", consists of a uterus with attached cervix, bilateral fallopian tubes and ovaries weighing 88g in total.  The uterus measures 85 x50 x 60mm and has a smooth and shiny serosal surface.  The ectocervix measures 20 x 18mm and has an unremarkable surface. On sectioning the endometrial cavity is filled by an exophytic and friable tumour measuring up to 7mm in thickness. The myometrium is 13mm in maximum thickness. The myometrium contains one fibroid 10mm in maximum diameter. The right fallopian tube measures 50mm in length and 5mm in maximum diameter.  The right ovary measures 20 x 10 x 10mm and has an unremarkable cut surface.  The left fallopian tube measures 50mm in length and 5mm in maximum diameter. The left ovary measures 20 x 10 x 10mm.  Blocks 1-4 - one full LS anterior body and cervix; 5 - representative section of anterior endomyometrium; 6- representative section of anterior fibroid; 7-10 - one full LS of posterior body and cervix; 11- one representative section anterior endomyometrium; 12 - right cornu; 13 - left cornu; 14 - right parametrial tissue; 15 - left parametrial tissue; 16 - 2LS right fimbria and1TS fallopian tube; 17 - right ovary, AE; 18 - left ovary, AE; 19- 2LS left fimbria and 2TS fallopian tube.	 PHI:Null
1150	 1868	 B.  Specimen labelled "Omentum biopsy", consists of a piece of omentum 60 x 30 x 2mm.  On sectioning it is unremarkable.  Representative sections in 3 blocks.	 PHI:Null
1150	 2058	 C.  Specimen labelled "Right external iliac lymph node", consists of a piece of fatty tissue containing multiple lymph nodes 10-15mm.  Block 1- onebisected lymph node; 2 to 5 - lymph nodes.	 PHI:Null
1150	 2257	 D.  Specimen labelled "Right obturator lymph node", consists of a piece of fatty tissue containing several lymph nodes 10mm in maximum diameter. Block 1- two lymph nodes; 2 & 3 - rest of tissue. AE.	 PHI:Null
1150	 2428	 E.  Specimen labelled "Left external iliac lymph node", consists of a piece of fatty tissue containing several lymph nodes ranging from 5-10mm.  Blocks 1-3 - lymph nodes.	 PHI:Null
1150	 2650	 F.  Specimen labelled "Left obturator lymph node", consists of a large lymph node 35mm in maximum diameter and scant fibrofatty tissue containing one possible lymph node.  Block 1 & 2 - one lymph node; 3 - rest of tissue.	 PHI:Null
1150	 2806	 G.  Specimen labelled "Left common iliac lymph node", consists of a piece of fatty tissue containing one lymph node 10mm in maximum diameter. BAE 1 block.	 PHI:Null
1150	 2961	 H.  Specimen labelled "Right common iliac lymph node", consists of a piece of fatty tissue containing two lymph nodes 7mm in maximum diameter. AE1 block.	 PHI:Null
1150	 2980	 (TE/ec   6.10.64)	 DOCTOR:TE
1150	 2980	 (TE/ec   6.10.64)	 DATE:6.10.64=>2064-06-10
1150	 2983	 	 PHI:Null
1150	 3053	 MICROSCOPIC (Reported by Dr O Strangstalien & registrar Dr O Barrio):	 DOCTOR:O Strangstalien
1150	 3053	 MICROSCOPIC (Reported by Dr O Strangstalien & registrar Dr O Barrio):	 DOCTOR:O Barrio
1150	 3466	 A.  Sections show a grade 3 endometrioid adenocarcinoma of the endometrium.  The carcinoma shows minimal glandular formation and focal squamous metaplasia.  Carcinoma invades to a depth of 4mm through a wall thickness of 14mm.  No lymphovascular invasion is seen and the endocervix is not involved.  The ectocervix and endocervix show no significant abnormality.  Several benign leiomyomas are also identified.	 PHI:Null
1150	 3668	 The left ovary shows a serous cystadenoma and several benign serous inclusion cysts.  The right ovary shows several benign serous inclusion cysts.  The fallopian tubes show no significant abnormality.	 PHI:Null
1150	 3767	 B.  Sections of the omentum show no significant abnormality.  There is no evidence of malignancy.	 PHI:Null
1150	 3882	 C.  Section show seven (7) lymph nodes which show no significant abnormality. There is no evidence of malignancy.	 PHI:Null
1150	 3996	 D.  Section show six (6) lymph nodes which show no significant abnormality.  There is no evidence of malignancy.	 PHI:Null
1150	 4110	 E.  Section show nine (9) lymph nodes which show no significant abnormality.  There is no evidence of malignancy.	 PHI:Null
1150	 4222	 F.  Section show one (1) lymph node which show no significant abnormality.  There is no evidence of malignancy.	 PHI:Null
1150	 4334	 G.  Section show one (1) lymph node which show no significant abnormality.  There is no evidence of malignancy.	 PHI:Null
1150	 4446	 H.  Section show two (2) lymph nodes which show no significant abnormality. There is no evidence of malignancy.	 PHI:Null
1150	 4459	 DIAGNOSIS:	 PHI:Null
1150	 4565	 A - H.  Uterus and cervix, bilateral fallopian tubes and ovaries, pelvis and iliac lymph nodes, omentum:	 PHI:Null
1150	 4624	 - Grade 3 endometrioid adenocarcinoma of the endometrium.	 PHI:Null
1150	 4688	 - Invasion to a depth of 4mm through a wall thickness of 14mm.	 PHI:Null
1150	 4730	 - No lymphovascular invasion identified.	 PHI:Null
1150	 4770	 - Twenty six (26) negative lymph nodes.	 PHI:Null
1150	 4789	 - Omentum negative	 PHI:Null
1151	 24	 Episode No:  19N034545E	 IDNUM:19N034545E
1151	 36	 1950345.KPE	 MEDICALRECORD:1950345.KPE
1151	 56	 VERPLANCK, ANSLEY	 PATIENT:VERPLANCK, ANSLEY
1151	 74	 Lab No:  19N03454	 IDNUM:19N03454
1151	 81	 Armand	 STREET:Armand
1151	 127	 WATERFORD  Australian Capital Territory  3758	 CITY:WATERFORD
1151	 127	 WATERFORD  Australian Capital Territory  3758	 STATE:Australian Capital Territory
1151	 127	 WATERFORD  Australian Capital Territory  3758	 ZIP:3758
1151	 144	 Specimen: Tissue	 PHI:Null
1151	 162	 D.O.B:  3/10/2012	 DATE:3/10/2012=>2012-10-03
1151	 170	 Sex:  F	 PHI:Null
1151	 201	 Collected: 21/03/2014 at 08:19	 TIME:21/03/2014 at 08:19=>2014-03-21T08:19
1151	 286	 Location:  Hunter Area-MOSSMAN HOSPITAL (DOUGLAS SHIRE MULTI PURPOSE HEALTH SERVICE)	 DEPARTMENT:Hunter Area
1151	 286	 Location:  Hunter Area-MOSSMAN HOSPITAL (DOUGLAS SHIRE MULTI PURPOSE HEALTH SERVICE)	 HOSPITAL:MOSSMAN HOSPITAL (DOUGLAS SHIRE MULTI PURPOSE HEALTH SERVICE)
1151	 311	 DR Carson Shayne Dannels	 DOCTOR:Carson Shayne Dannels
1151	 360	 Distribution:   FILE-COPY,   NSW-CANCER-REGISTRY	 PHI:Null
1151	 370	 CLINICAL:	 PHI:Null
1151	 483	 Re-excision of sarcoma right posterior chest wall.  Deep margin excised separately.  Marking suture superficial.	 PHI:Null
1151	 659	 Further history:  Previous excision of right loin fibrosarcoma which appeared to arise within a dermatofibrosarcoma protuberans (INTENSIVE CARE UNIT December 2062 19-5034545).	 DEPARTMENT:INTENSIVE CARE UNIT
1151	 659	 Further history:  Previous excision of right loin fibrosarcoma which appeared to arise within a dermatofibrosarcoma protuberans (INTENSIVE CARE UNIT December 2062 19-5034545).	 DATE:December 2062=>2062-12
1151	 659	 Further history:  Previous excision of right loin fibrosarcoma which appeared to arise within a dermatofibrosarcoma protuberans (INTENSIVE CARE UNIT December 2062 19-5034545).	 IDNUM:19-5034545
1151	 672	 MACROSCOPIC:	 PHI:Null
1151	 1735	 A.  Specimen labelled "Soft tissue tumour right posterior chest wall" consists of an excision of skin and underlying skeletal muscle measuring 155 x 115 x 45mm.  There is a suture at one end designated 12 o'clock.  Running from 10 towards 4 o'clock of the skin oval is a mature scar 95mm in length.  There is a partial area of disruption over the 6 o'clock aspect of the deep margin, spanning an area 25mm across.  The 3 o'clock half inked blue, 9 o'clock red and deep margin black.  On sectioning there is a circumscribed tumour 145 x 92 x 54mm.  The tumour has a predominately tan and fleshy appearance.  Haemorrhagic areas are seen within the 9 o'clock half of the tumour, near 12 o'clock.  The largest haemorrhagic area is 35mm across.  Within the 6 o'clock half of the tumour there is possible necrosis, 35mm across.  The tumourappears to abut the deep margin over a 35mm front.  The tumour is 4mm clear of the 12 o'clock margin and 7mm clear of the 6 o'clock margin.  The tumour is 2mm clear of the 3 o'clockmargin and 6mm clear of the 9 o'clock margin.	 PHI:Null
1151	 2212	 Blocks: 1 & 2 - tumour with 12 o'clock margin; 3 - tumour abutting deep skeletal muscle; 4 & 5 - haemorrhagic areas of tumour; 6 - tumour with close deep/9 o'clock margin; 7 - tumour with 3 o'clock margin; 8 & 9 - tumour with deep margin; 10 - myxoid area of tumour; 11 - tumour with 3 o'clock/deep margin; 12 & 13 - full thickness section of tumour with deep margin in block 13;14 & 15 - tumour with 6 o'clock margin.  Please refer to attached photograph and block diagram.	 PHI:Null
1151	 2214	 	 PHI:Null
1151	 2539	 B.  Specimen labelled "Re-excision deep margin stitch at superficial margin" consists of two sheet like pieces of skeletal muscle and attached fat measuring 45 x 35 x 8mm and 45 x 27 x 8mm.  Each piece has a suture on one surface indicating the superficial margin.  The superficial margin is inked blue, deep margin black.	 PHI:Null
1151	 2664	 Blocks: 1 to 6 - largest fragment serially embedded; 7 to 11 - smaller fragment serially embedded.  AE.  (TO: CU/ta23/5/64)	 DOCTOR:CU
1151	 2664	 Blocks: 1 to 6 - largest fragment serially embedded; 7 to 11 - smaller fragment serially embedded.  AE.  (TO: CU/ta23/5/64)	 DATE:23/5/64=>2064-05-23
1151	 2666	 	 PHI:Null
1151	 2718	 MICROSCOPIC: (Reported by Dr C Liest and Dr C Gunn)	 DOCTOR:C Liest
1151	 2718	 MICROSCOPIC: (Reported by Dr C Liest and Dr C Gunn)	 DOCTOR:C Gu
1151	 3323	 A.  The sections show a 145mm spindle cell sarcoma with morphologic features consistent with fibrosarcoma. The tumour appears centred in the deep subcutis/skeletal muscle and has a smooth pushing border. The tumour is composed of slender spindle cells arranged in elongated fascicles. Areas with prominent herringbone architecture are seen.  A moderate degree ofnuclear pleomorphism is seen.  There is a focal area of necrosis.  Mitoses are brisk, with at least 24 mitoses per 10 high power fields.  No significant abnormality of the overlying skin is identified.  The margins of excision are as follows:	 PHI:Null
1151	 3394	 Deep margin: Tumour present at the margin (over an 11mm front) (A8).	 PHI:Null
1151	 3424	 12 o'clock margin: 1.1mm (A1)	 PHI:Null
1151	 3458	 3 o'clock margin: 0.25mm (A11).	 PHI:Null
1151	 3488	 9 o'clock margin: 4.4mm (A6).	 PHI:Null
1151	 3513	 6 o'clock margin: 5.5mm.	 PHI:Null
1151	 3587	 Immunohistochemical stains were performed and the results are as follows:	 PHI:Null
1151	 3640	 Tumour cells positive for: Vimentin, CD34 and BCL-2.	 PHI:Null
1151	 3737	 Tumour cells negative for: SMA, HMB45, AE1/AE3, desmin, myogenin, S100, melanA and MIC2 (CD99).	 PHI:Null
1151	 3797	 MNF116 (pancytokeratin) shows focal non-specific staining.	 PHI:Null
1151	 3909	 B.  The sections show unremarkable fibroadipose tissue and skeletal muscle. There is no evidence of malignancy.	 PHI:Null
1151	 3918	 COMMENT:	 PHI:Null
1151	 4241	 The 145mm right posterior chest wall lesion shows features consistent with (metastatic) fibrosarcoma. The morphology and pattern of immunohistochemical staining is similar to that in the previously described right loin fibrosarcoma (Pathology West 19-5034545) arising within an underlying dermatofibrosarcoma protuberans.	 DEPARTMENT:Pathology West
1151	 4241	 The 145mm right posterior chest wall lesion shows features consistent with (metastatic) fibrosarcoma. The morphology and pattern of immunohistochemical staining is similar to that in the previously described right loin fibrosarcoma (Pathology West 19-5034545) arising within an underlying dermatofibrosarcoma protuberans.	 IDNUM:19-5034545
1151	 4252	 DIAGNOSIS:	 PHI:Null
1151	 4367	 A.  Re-excision of right posterior chest wall lesion: Consistent with (metastatic) fibrosarcoma, margin involved.	 PHI:Null
1151	 4427	 B.  Re-excision of deep margin: No evidence of malignancy.	 PHI:Null
1151	 4429	 	 PHI:Null
1151	 4431	 	 PHI:Null
1152	 13	 2027354.YLP	 MEDICALRECORD:2027354.YLP
1152	 34	 ADOMAITIS, Maria Ira	 PATIENT:ADOMAITIS, Maria Ira
1152	 43	 20F73549	 IDNUM:20F73549
1152	 77	 Last edited : 13/6/2064  Page: 2	 DATE:13/6/2064=>2064-06-13
1152	 87	 CLINICAL:	 PHI:Null
1152	 129	 Left pelvic pain.  ?Left ovarian remnant.	 PHI:Null
1152	 142	 MACROSCOPIC:	 PHI:Null
1152	 298	 Specimen labelled "Left ovary" consists of a piece of fibrous tissue 30 x 20 x 15mm.  The cut surface is dusky and fibrotic.  AE 3 blocks.  (TY/rt 12.6.64)	 DOCTOR:TY
1152	 298	 Specimen labelled "Left ovary" consists of a piece of fibrous tissue 30 x 20 x 15mm.  The cut surface is dusky and fibrotic.  AE 3 blocks.  (TY/rt 12.6.64)	 DATE:12.6.64=>2064-06-12
1152	 337	 MICROSCOPIC (Reported by Dr H Rakers):	 DOCTOR:H Rakers
1152	 481	 Sections show remnant ovarian tissue with focal haemorrhage.  No other significant abnormalities are seen.  There is no evidence of malignancy.	 PHI:Null
1152	 492	 DIAGNOSIS:	 PHI:Null
1152	 522	 Left ovary remnant confirmed.	 PHI:Null
1154	 12	 4183363.NGA	 MEDICALRECORD:4183363.NGA
1154	 35	 DEMAINE, Katelin SABRA	 PATIENT:DEMAINE, Katelin SABRA
1154	 44	 41W33635	 IDNUM:41W33635
1154	 78	 Last edited : 19/4/2064  Page: 2	 DATE:19/4/2064=>2064-04-19
1154	 89	 CLINICAL:	 PHI:Null
1154	 214	 Re-excision of right breast DCIS.  Superior border excised and extended.  Short - superior, medium - medial, long - lateral.	 PHI:Null
1154	 227	 MACROSCOPIC:	 PHI:Null
1154	 1057	 Specimen labelled "Re-excision of right breast lesion" consists of a piece of fibrofatty tissue weighing 21g.  The specimen is 61mm (from medial to lateral) x 46mm (from superficial to deep) x 25mm (from superior to inferior).  Orienting sutures are present as per specimen request form.  The superficial margin is inked red, superior blue and inferior black.  The inferior surface is covered by a layer of grey connective tissue, in keeping with previous excision cavity.  The specimen was sectioned from medial towards lateral into twelve slices.  The inferior margin is partially deficientin slice five adjacent to the superficial margin.  The cut surfaces show prominent areas of fat necrosis adjacent to the inferior margin.  An area of soft grey tissue 10mm across is seen in slices 7 - 9.  No focal lesions are identified.	 PHI:Null
1154	 1442	 Blocks:  1 - slice one medial margin; 2 - slice two bisected; 3 - slice three bisected; 4 - slice four bisected; 5 - slice five bisected; 6 & 7 - slice six; 8 & 9 - slice seven;10 & 11 - slice eight; 12 & 13 - slice nine; 14 to 16 - slice ten; 17 & 18 - slice eleven; 19 & 20 - slice twelve lateral margin.  Slices embedded from superficial towards deep.  AE.  (TO: MR; SI/rt 15.4.64)	 DOCTOR:MR
1154	 1442	 Blocks:  1 - slice one medial margin; 2 - slice two bisected; 3 - slice three bisected; 4 - slice four bisected; 5 - slice five bisected; 6 & 7 - slice six; 8 & 9 - slice seven;10 & 11 - slice eight; 12 & 13 - slice nine; 14 to 16 - slice ten; 17 & 18 - slice eleven; 19 & 20 - slice twelve lateral margin.  Slices embedded from superficial towards deep.  AE.  (TO: MR; SI/rt 15.4.64)	 DOCTOR:SI
1154	 1442	 Blocks:  1 - slice one medial margin; 2 - slice two bisected; 3 - slice three bisected; 4 - slice four bisected; 5 - slice five bisected; 6 & 7 - slice six; 8 & 9 - slice seven;10 & 11 - slice eight; 12 & 13 - slice nine; 14 to 16 - slice ten; 17 & 18 - slice eleven; 19 & 20 - slice twelve lateral margin.  Slices embedded from superficial towards deep.  AE.  (TO: MR; SI/rt 15.4.64)	 DATE:15.4.64=>2064-04-15
1154	 1482	 MICROSCOPIC:  (Reported by Dr W Tangri)	 DOCTOR:W Tangri
1154	 1820	 Sections of the right breast show changes consistent with a recent surgical cavity. The surrounding breast tissue show proliferative changes including focal florid epithelial hyperplasia, fibrocystic change, apocrine metaplasia and columnar cell change. There is no convincing atypical ductal hyperplasia, DCIS or evidence of malignancy.	 PHI:Null
1154	 1831	 DIAGNOSIS:	 PHI:Null
1154	 1846	 Right breast:	 PHI:Null
1154	 1896	 Changes consistent with a recent surgical cavity.	 PHI:Null
1154	 1945	 No evidence of ADH, DCIS or invasive carcinoma.	 PHI:Null
1154	 1947	 	 PHI:Null
1154	 1949	 	 PHI:Null
1155	 13	 0973564.CBJ	 MEDICALRECORD:0973564.CBJ
1155	 31	 CRANDELL, MICHEAL	 PATIENT:CRANDELL, MICHEAL
1155	 40	 09S35640	 IDNUM:09S35640
1155	 74	 Last edited : 19/4/2064  Page: 2	 DATE:19/4/2064=>2064-04-19
1155	 84	 CLINICAL:	 PHI:Null
1155	 181	 Right breast lumpectomy.  FNAB - atypical cells.  Short-supeiror, medium-medial, long-lateral.	 PHI:Null
1155	 194	 MACROSCOPIC:	 PHI:Null
1155	 771	 Specimen labelled "Right breast lump", consists of a piece of fibrofatty tissue with orientating sutures per request form.  The specimen is 35mm from superficial to deep, 28mm from medial to lateral and 18mm from superior to inferior.  The medial margin is inked red, superior margin blue and inferior margin black.  The specimen was sectioned from superficial to deep into eight slices.  The cut surfaces of all slices show an ill-defined grey fibrous area, 22 x 16 x 35mm, extending to all margins.  There is a small amount of adipose tissue adjacent to the superior aspect.	 PHI:Null
1155	 944	 Blocks: 1 one superficial margin; 2 - slice two; 3 - slice three; 4 - slice four; 5 - slice five; 6 - slice six; 7 - slice seven; 8 - slice eight deep margin.  Specimen AE.	 PHI:Null
1155	 961	 (PY/vo 15.4.64)	 DOCTOR:PY
1155	 961	 (PY/vo 15.4.64)	 DATE:15.4.64=>2064-04-15
1155	 1005	 MICROSCOPIC (Reported by Dr B Monterrubio):	 DOCTOR:B Monterrubio
1155	 1103	 Sections show benign fibrocystic change.  There is no evidence of in-situ or invasive malignancy.	 PHI:Null
1155	 1114	 DIAGNOSIS:	 PHI:Null
1155	 1161	 Right breast lump - Benign fibrocystic change.	 PHI:Null
1157	 13	 7301067.DAE	 MEDICALRECORD:7301067.DAE
1157	 25	 Durett, SIU	 PATIENT:Durett, SIU
1157	 34	 73C10671	 IDNUM:73C10671
1157	 67	 Last edited : 6/9/2064  Page: 2	 DATE:6/9/2064=>2064-06-09
1157	 77	 CLINICAL:	 PHI:Null
1157	 199	 Subacute onset of eye pain and ophthalmoparesis in right.  Scans show large sellar lesion invading intocavernous sinus.	 PHI:Null
1157	 212	 MACROSCOPIC:	 PHI:Null
1157	 360	 Specimen labelled "Right sphenoid tumour" consists of three fragments of tan tissue less than 1mm to 3mm across.  AE 1 block.   (TO: OP/ta 6/5/64)	 DOCTOR:OP
1157	 360	 Specimen labelled "Right sphenoid tumour" consists of three fragments of tan tissue less than 1mm to 3mm across.  AE 1 block.   (TO: OP/ta 6/5/64)	 DATE:6/5/64=>2064-06-05
1157	 362	 	 PHI:Null
1157	 400	 MICROSCOPIC (Reported by Dr T Holk):	 DOCTOR:T Holk
1157	 827	 Sections show fragments of tumour tissue. The tumour is moderately cellular and consists of cells with medium sized and large nuclei, andgenerally abundant pale cytoplasm, within a basophilic, mucoid stroma.  The cells are arranged in irregular groups and cords.  There is mild cytologic atypia and pleomorphism.  No mitoses are identified.  Some cells have multiple cytoplasmic vacuoles.  The appearances are of a chordoma.	 PHI:Null
1157	 955	 The tumour cells stain strongly positive for pancytokeratin, epithelial membrane antigen and S100, consistent with chordoma.	 PHI:Null
1157	 966	 DIAGNOSIS:	 PHI:Null
1157	 1002	 Right sphenoid tumour:  Chordoma.	 PHI:Null
1158	 24	 Episode No:  94T807668P	 IDNUM:94T807668P
1158	 36	 9478076.SWP	 MEDICALRECORD:9478076.SWP
1158	 60	 KROPIDLOWSKI, GONZALO	 PATIENT:KROPIDLOWSKI, GONZALO
1158	 78	 Lab No:  94T80766	 IDNUM:94T80766
1158	 86	 Goswell	 STREET:Goswell
1158	 122	 BANORA POINT  South Australia  6220	 CITY:BANORA POINT
1158	 122	 BANORA POINT  South Australia  6220	 STATE:South Australia
1158	 122	 BANORA POINT  South Australia  6220	 ZIP:6220
1158	 139	 Specimen: Tissue	 PHI:Null
1158	 156	 D.O.B:  4/9/1983	 DATE:4/9/1983=>1983-04-09
1158	 164	 Sex:  F	 PHI:Null
1158	 190	 Collected: 6/11/2064 at :	 DATE:6/11/2064=>2064-06-11
1158	 233	 Location:  Envoi pathology - TARA HOSPITAL	 DEPARTMENT:Envoi pathology
1158	 233	 Location:  Envoi pathology - TARA HOSPITAL	 HOSPITAL:TARA HOSPITAL
1158	 255	 DR Wiley HANK KOHATSU	 DOCTOR:Wiley HANK KOHATSU
1158	 304	 Distribution:  DR Jorstad,   NSW-CANCER-REGISTRY	 DOCTOR:Jorstad
1158	 314	 CLINICAL:	 PHI:Null
1158	 424	 Recurrent Paget's disease of the vulva.  Previous invasive.  Hypertension.  Type 2 DM.  Hypercholesterolemia.	 PHI:Null
1158	 437	 MACROSCOPIC:	 PHI:Null
1158	 948	 A.  Specimen labelled "Perineum stitch anterior" consists of a ellipse of skin with one suture for the orientation marking the anterior margin(taken at 12 o'clock).  Specimen measures 35 x 25 x 5mm.  On the surface of the skin there is a ulcerated area measuring 15 x 10mm.  The 12 o'clock margin is inked blue.  The 6 o'clock margin is inked black.  The specimen is serially sectioned from 3 o'clock to 9 o'clock in seven slices.  Slice one 9 o'clock margin, slice seven 3 o'clock margin.  The specimen is AE.	 PHI:Null
1158	 1061	 Blocks:  1 - two LS 9 o'clock margin;2 to 4 - serial sections from 9 to 3 o'clock; 5 - five TS 3 o'clock margin.	 PHI:Null
1158	 1554	 B.  Specimen labelled "Right perianal skin stitch 12 o'clock margin" consists of a piece of skin with one suture for the orientation marking the 12 o'clock margin.  It measures 60 x 35 x 5mm.  The surface of the skin has a large and elevated lesion with pale surface and areas ofhaemorrhage.  The 3 o'clock margin is inked blue.  The 9 o'clock margin is inked black.  Specimen is serially sectioned from 12 to 6 o'clock in twelve slices.  The specimen is AE according to the attached diagram.	 PHI:Null
1158	 1667	 Blocks:  1 - TS of 12 o'clock margin; 2 to 9 - serial section from 12 to 6 o'clock; 10 - TS of 6 o'clock margin.	 PHI:Null
1158	 2191	 C.  Specimen labelled "Left perianal stitch 12 o'clock" consists of a oval piece of skin with stitch for the orientation marking the12 o'clock margin.  It measures 55 x 30 x 5mm.  The 3 o'clock margin is inked blue.  The 9 o'clock margin is inked black.  The surface of the skin is pale and patchy in an area measuring 30 x 25mm.  Specimen is serially sectioned from 12 o'clock to 6 o'clock in twelve slices.  Slice number one 12 o'clock margin; 12 - 6 o'clock margin.  The specimen is AE according to the attached diagram.	 PHI:Null
1158	 2305	 Blocks:  1 - two LS 12 o'clock margin; 2 to 6 - serial section from 12 to 6 o'clock; 7 & 8 - LS 6 o'clock margin.	 PHI:Null
1158	 2576	 D.  Specimen labelled "Right deep margin" consists of an irregular piece of unorientated adipose tissue measuring 35 x 30 x 5mm.  The specimen is serially sectionedand AE.  The specimen is inked blue on surface and black the opposite one. The specimen is AE in 5 blocks.	 PHI:Null
1158	 2701	 E.  Specimen labelled "Right superior deep margin" consists of one piece of tissue 5mm.  AE 1 block.  (TO: OR; VA/rt 5.5.64)	 DOCTOR:OR
1158	 2701	 E.  Specimen labelled "Right superior deep margin" consists of one piece of tissue 5mm.  AE 1 block.  (TO: OR; VA/rt 5.5.64)	 DOCTOR:VA
1158	 2701	 E.  Specimen labelled "Right superior deep margin" consists of one piece of tissue 5mm.  AE 1 block.  (TO: OR; VA/rt 5.5.64)	 DATE:5.5.64=>2064-05-05
1158	 2741	 MICROSCOPIC (Reported byDr U Landfair):	 DOCTOR:U Landfair
1158	 2780	 The previous report 78G07832 is noted.	 IDNUM:78G07832
1158	 3063	 A.  The entire specimen has been examined.  Extensive Paget's disease is present, all of which appears in situ.  This is associated with ulceration and changes suggestive of previous surgery.  Paget's involves the 3 o'clock and 12 o'clock margins.  There is no evidence of invasion.	 PHI:Null
1158	 3320	 B.  The entire specimen has been examined.  Extensive Paget's disease is present, all of which appears in situ.  This is associated with marked chronic inflammation.  Paget's involves the 3 o'clock and 12 o'clock margins.  There is no evidence of invasion.	 PHI:Null
1158	 3507	 C.  The entire specimen has been examined.  Extensive Paget's disease is present, all of which appears in situ.  Paget's involves the 9 o'clock margin.  There is no evidence of invasion.	 PHI:Null
1158	 3598	 D.  Sections show unremarkable vascular fatty tissue.  There is no evidence of malignancy.	 PHI:Null
1158	 3699	 E.  Sections show Paget's disease involving margins (unoriented).  There is no evidence of invasion.	 PHI:Null
1158	 3710	 DIAGNOSIS:	 PHI:Null
1158	 3773	 A, B, C & E.  Extensive Paget's diease (see above re margins).	 PHI:Null
1159	 25	 Episode No:  52P828726X	 IDNUM:52P828726X
1159	 36	 526828.SHR	 MEDICALRECORD:526828.SHR
1159	 52	 Grissam, RUMI	 PATIENT:Grissam, RUMI
1159	 70	 Lab No:  52P82872	 IDNUM:52P82872
1159	 79	 Belcourt	 STREET:Belcourt
1159	 99	 BUNINYONG  NT  4034	 CITY:BUNINYONG
1159	 99	 BUNINYONG  NT  4034	 STATE:NT
1159	 99	 BUNINYONG  NT  4034	 ZIP:4034
1159	 116	 Specimen: Tissue	 PHI:Null
1159	 135	 D.O.B:  29/10/2032	 DATE:29/10/2032=>2032-10-29
1159	 143	 Sex:  F	 PHI:Null
1159	 174	 Collected: 06/04/2014 at 19:01	 TIME:06/04/2014 at 19:01=>2014-04-06T19:01
1159	 237	 Location:  ST VINCENT'S PATHOLOGY-PENOLA WAR MEMORIAL HOSPITAL	 DEPARTMENT:ST VINCENT'S PATHOLOGY
1159	 237	 Location:  ST VINCENT'S PATHOLOGY-PENOLA WAR MEMORIAL HOSPITAL	 HOSPITAL:PENOLA WAR MEMORIAL HOSPITAL
1159	 261	 DR JARDI SHELDON ISAACS	 DOCTOR:JARDI SHELDON ISAACS
1159	 312	 Distribution:  DR Mac OLIVE,   NSW-CANCER-REGISTRY	 DOCTOR:Mac OLIVE
1159	 322	 CLINICAL:	 PHI:Null
1159	 411	 Whipple's.  Multiple liver resections.  Para aortic lymph node dissection.  ? G2 P NETS.	 PHI:Null
1159	 424	 MACROSCOPIC:	 PHI:Null
1159	 1885	 A.  Specimen labelled "Whipple's", consists of a Whipple's specimen including distal stomach, duodenum, pancreas and gallbladder.  The length of stomach and bowel measures 180mm in length including an area of distal stomach 15mm in length.  The attached gallbladder measures 70mm in length with a maximum external diameter of 38mm.  The serosa of the gallbladder appears unremarkable.  The attached pancreas measures 65 x 60 x 55mm.  The common bile duct is able to be probed along its length.  The anterior margin is inked red, the portal vein margin is inked black, the uncinate process margin is inked blue and the posterior margin is inked green.  The pancreatic neck resection margin is removed and the underlyingtissue after removal is inked red.  The cut surface of the pancreas reveals a large firm cream poorly circumscribed tumour within the pancreas and centred near the uncinate process and extending into the anterior pancreas measuring 38 x 25 x 18mm.  The tumour abuts the uncinate process margin.  The tumour is 15mm from the anterior margin and 1mm from the posterior pancreatic margin and well clear (>20mm) from the pancreatic neck resection margin. The portal vein margin appears clear of the tumour by 15mm.  Numerous lymph nodes which are involved with cream tumour are identified around the inferior pancreas.  Large numbers appear macroscopically involved with the tumour.  One pericystic duct lymph node is identified measuring 5mm.	 PHI:Null
1159	 2260	 Blocks: 1- resection margins; 2 - common bile duct resection margin; 3 and 4 - representative gallbladder;5 - shave of pancreatic neck resection margin; 6 and 7 - full face through tumour to margins; 8 - LS through pancreatic neck resection margin; 10 - tumour to portal vein margin; 11 to 13 - representativeinvolved nodes from inferior pancreas; 14 - pericystic duct node.	 PHI:Null
1159	 2482	 B.  Specimen labelled "Segment 2 liver", consists of a wedge of liver 32 x 18 x 10mm.  A cream nodule measuring 10mm in maximum dimension is identified abutting the capsular surface and is 3mm from the resection margin.	 PHI:Null
1159	 2553	 Blocks: 1 - entire nodule embedded; 2 - representative further liver.	 PHI:Null
1159	 2931	 C.  Specimen labelled "Segment 3 liver", consists of a section of liver 42 x 30 x 28mm.  The cut surface reveals and ill-defined cream firm area measuring 8 x 7 x 5mm which is 7mm from the resection margin and 3mm from the capsular surface.  A further 10mm cream nodule is identified up to 3mm from theresection margin.  The remainder of the cut surface appears unremarkable.	 PHI:Null
1159	 3309	 D.  Specimen labelled "Segment 4 B liver", consists of a section of liver 70 x 42 x 35mm.  The cut surface reveals a firm cream well circumscribed lesion measuring 28 x 22 x 20mm.  The lesion appears to abut the capsular surface and comes to 5mm from the resection margin.  A further cream nodule is identified in fat adherent to the liver measuring 6mm in maximum dimension.	 PHI:Null
1159	 3400	 Blocks: 1 to 3 - representative liver mass; 4 - representative tissue attached to liver.	 PHI:Null
1159	 3847	 E.  Specimen labelled "Segment 5/6 liver", consists of a segment of liver measuring 90 x 55 x 50mm.  The cut surface reveals acream firm well circumscribed lesion measuring 28 x 23 x 18mm.  The lesion appears to come within 1mm from the capsular surface and is 8mm from the resection margin.  A further ill defined cream area is identified measuring 5 x 4 x 3mm which is well clear of the surgical margin and appears to abut the capsular surface.	 PHI:Null
1159	 3932	 Blocks: 1 to 3 - representative large tumour; 4 - representative small white nodule.	 PHI:Null
1159	 4354	 F.  Specimen labelled "Segment 8 liver", consists of a section of liver measuring 30 x 25 x 15mm.  On the capsular surface there is a cream area measuring 12 x 11mm.  The cut surface reveals a cream firm well circumscribed lesion underlying the cream area on the capsular surface measuring 12 x 10 x 7mm.  The lesion abuts the capsular surface and is 3mm from the resection margin.  Representative sections in 2 blocks.	 PHI:Null
1159	 4530	 G.  Specimen labelled "Greater omentum", consists of a piece of omental tissue 370 x 120 x 15mm.  No suspicious lesions are identified.  Representative sections in 3 blocks.	 PHI:Null
1159	 4800	 H.  Specimen labelled "Aortic nodes", consists of four fragments of cream tan fatty tissue from 25 x 70mm.  Numerous lymph nodes are identified up to 45mm in maximum dimension.  The majority of the lymph nodes appear macroscopically involved with a cream firm tumour.	 PHI:Null
1159	 5026	 Blocks: 1 - one lymph node bisected; 2 - one lymph node bisected; 3 one involved node; 4 - one representative involved node; 5 - representative one involved node; 6 - representative one involved node; 7 - further lymph nodes.	 PHI:Null
1159	 5219	 I.  Specimen labelled "Iliac lymph node left", consists of two cream tan pieces of tissue 15 and 20mm.  Both pieces of tissue appear to be lymph nodes which are replaced by firm cream tumour.	 PHI:Null
1159	 5308	 Blocks: 1 - one lymph node bisected; 2 - representative other node involved with tumour.	 PHI:Null
1159	 5543	 J.  Specimen labelled "Celiac lymph node", consists of apiece of cream tan fatty tissue 55 x 30 x 15mm.  Multiple lymph nodes are identified from 3 to 18mm.  The majority of the lymph nodes appear macroscopically involved with tumour.	 PHI:Null
1159	 5631	 Blocks: 1 - lymph nodes; 2 - representative three lymph nodes all involved with tumour.	 PHI:Null
1159	 5872	 K.  Specimen labelled "Nodes between aorta and RVC upper region", consists of a piece of tan fatty cream tissue 35 x 25 x 20mm.  The cut surface reveals the specimen is a mass ofmatted nodes three involved nodes are identified up to 25mm.	 PHI:Null
1159	 5921	 Blocks: 1 - representative three involved nodes.	 PHI:Null
1159	 5944	 (TO: MI;KV/vo 6.9.64)	 DOCTOR:MI
1159	 5944	 (TO: MI;KV/vo 6.9.64)	 DOCTOR:KV
1159	 5944	 (TO: MI;KV/vo 6.9.64)	 DATE:6.9.64=>2064-06-09
1159	 6013	 MICROSCOPIC (Reported by A/Prof N Pontonio & registrar Dr N Haines):	 DOCTOR:N Pontonio
1159	 6013	 MICROSCOPIC (Reported by A/Prof N Pontonio & registrar Dr N Haines):	 DOCTOR:N Haines
1159	 6436	 A.  Sections show a 35mm pancreatic neuroendocrine tumour which is centred in the uncinate process of the pancreas. Lymphovascular and perineural invasion is present and the tumour extends into peripancreatic tissue.  The tumour cells are arranged in trabeculae, aggregates and rosette-like arrangements. No necrosis is identified and nuclear pleomorphism is moderate. There are approximately 13 mitosis seen per 50 hpf.	 PHI:Null
1159	 6567	 Immunonhistochemical stains show strong diffuse staining for Cam 5.2 and CD56 and patchy staining with somatostatin and glucagon.	 PHI:Null
1159	 6708	 There is negative staining for insulin. The Ki67 staining is varied throughout the tumour but the maximal staining is approximately 15-20%.	 PHI:Null
1159	 6798	 The overall features are consistent with a WHO grade 2 pancreatic neuroendocrine tumour.	 PHI:Null
1159	 7127	 Theuncinate process margin is positive across a broad front and the tumour is 1-2 mm from the posterior pancreatic margin. The pancreatic neck, portal vein and anterior margins are well clear. The portal vein margin clearance is approximately 4mm. A lymph node metastasis is present within the portal vein margin section. (1/1).	 PHI:Null
1159	 7271	 Eleven (11) of the fourteen (14) peripancreatic lymph nodes are positive for tumour. The one (1) pericystic lymph node is positive for tumour.	 PHI:Null
1159	 7366	 Small deposits of tumour are also identified within adipose tissue between the positive nodes.	 PHI:Null
1159	 7423	 The surrounding pancreatic tissue appears unremarkable.	 PHI:Null
1159	 7507	 The gallbladder appears unremarkable and the cystic duct margin is clearof tumour.	 PHI:Null
1159	 7700	 B.  Sections show a deposit of metastatic pancreatic neuroendocrine tumour. The tumour abuts the capsule and is well clear of the resection margin. The surrounding liver appears unremarkable.	 PHI:Null
1159	 7855	 C.  Sections show two metastatic pancreatic neuroendocrine tumour deposits. The tumour is clear of thecapsule and is well clear of the resection margin.	 PHI:Null
1159	 7900	 Foci of vascular space invasion are present.	 PHI:Null
1159	 7945	 The surrounding liver appears unremarkable.	 PHI:Null
1159	 8193	 D.  Sections show a deposit of metastatic pancreatic neuroendocrine tumour. The tumour is 1mm from the capsule and is well clear of the resection margin. The attached nodule shows sclerotic tissueonly. The surrounding liver appears unremarkable.	 PHI:Null
1159	 8411	 E.  Sections show two metastatic pancreatic neuroendocrine tumour deposits. The smaller deposit abuts the capsule while both deposits arewell clear of the resection margin. The surrounding liver appears unremarkable.	 PHI:Null
1159	 8599	 F.  Sections show a deposit of metastatic pancreatic neuroendocrine tumour. The tumour abuts the capsule and is 1mm from the resection margin. The surrounding liver appears unremarkable.	 PHI:Null
1159	 8670	 G.  Sections from the greater omentum show no significant abnormality.	 PHI:Null
1159	 8769	 H.  All of the eight (8) lymph nodes are positive for metastatic pancreatic neuroendocrine tumour.	 PHI:Null
1159	 8869	 I.  Two (2)of the two (2) lymph nodes are positive for metastatic pancreatic neuroendocrine tumour.	 PHI:Null
1159	 8974	 J.  Eight (8) of the eight (8) lymph nodes are positive for metastatic pancreatic neuroendocrine tumour.	 PHI:Null
1159	 9078	 K.  Three (3) of thethree (3) lymph nodes are positive for metastatic pancreatic neuroendocrine tumour.	 PHI:Null
1159	 9086	 Comment	 PHI:Null
1159	 9567	 The primary tumour is a WHO grade 2 pancreatic neuroendocrine tumour, however in several of the metastases (specimens D and E) the mitotic count is up to30/50hpf and the Ki67 stains up to 40% of tumour cells. Nuclear pleomorphism is also more pronounced within these areas. Therefore, there appears to be a component of high grade tumour (WHO grade 3) within the metastatic foci. Even withinthese high grade foci, Ki67 expression is still highly variable between different areas.	 PHI:Null
1159	 9578	 DIAGNOSIS:	 PHI:Null
1159	 9615	 A. Whipple's resection of pancreas:	 PHI:Null
1159	 9685	 - 35mm grade 2 pancreatic neuroendocrine tumour (intermediate grade)	 PHI:Null
1159	 9721	 - Positive uncinate process margin	 PHI:Null
1159	 9771	 - 13 of 16 lymph nodes contain metastatic tumour	 PHI:Null
1159	 9809	 B - F. Liver segments 2, 3, 4, 5/6, 8	 PHI:Null
1159	 9856	 - Metastatic pancreatic neuroendocrine tumour	 PHI:Null
1159	 9873	 - Margins clear	 PHI:Null
1159	 10001	 - Increased staining of Ki67 in specimens D and E consistent with a grade 3     pancreatic neuroendocrine tumour (high grade).	 PHI:Null
1159	 10049	 G. Greater omentum: No significant abnormality.	 PHI:Null
1159	 10124	 H. Aortic lymph nodes: Eight (8) of the eight (8) lymph nodes are positive	 PHI:Null
1159	 10199	 I. left iliac lymph nodes: Two (2) of the two (2) lymph nodes are positive	 PHI:Null
1159	 10275	 J. Coeliac lymph nodes: Eight (8) of the eight (8) lymph nodes are positive	 PHI:Null
1159	 10359	 K.Nodes between aorta and RVC: Three (3) of the three (3) lymph nodes are positive	 PHI:Null
1160	 24	 Episode No:  73H429585J	 IDNUM:73H429585J
1160	 36	 7324295.VNJ	 MEDICALRECORD:7324295.VNJ
1160	 52	 RASCO, GENARO	 PATIENT:RASCO, GENARO
1160	 70	 Lab No:  73H42958	 IDNUM:73H42958
1160	 82	 St Vincents	 STREET:St Vincents
1160	 107	 ARMIDALE  Victoria  3797	 CITY:ARMIDALE
1160	 107	 ARMIDALE  Victoria  3797	 STATE:Victoria
1160	 107	 ARMIDALE  Victoria  3797	 ZIP:3797
1160	 124	 Specimen: Tissue	 PHI:Null
1160	 142	 D.O.B:  21/1/1987	 DATE:21/1/1987=>1987-01-21
1160	 150	 Sex:  M	 PHI:Null
1160	 181	 Collected: 03/04/2014 at 11:26	 TIME:03/04/2014 at 11:26=>2014-04-03T11:26
1160	 239	 Location:  DICKINSON 3 SOUTH-DUMBLEYUNG MEMORIAL HOSPITAL	 DEPARTMENT:DICKINSON 3 SOUTH
1160	 239	 Location:  DICKINSON 3 SOUTH-DUMBLEYUNG MEMORIAL HOSPITAL	 HOSPITAL:DUMBLEYUNG MEMORIAL HOSPITAL
1160	 261	 PRO Alonzo Huey CHARM	 DOCTOR:Alonzo Huey CHARM
1160	 310	 Distribution:   FILE-COPY,   NSW-CANCER-REGISTRY	 PHI:Null
1160	 321	 HISTORY:	 PHI:Null
1160	 482	 PHx of CRC. Liver mets. Frozen section. (1) Left upper quadrant tissue; (2) Lump right upper quadrant; (3) Superior mesenteric vein node; (4) sigmoid mesocolon.	 PHI:Null
1160	 497	 MACROSCOPIC:	 PHI:Null
1160	 584	 A. "LEFT UPPER QUADRANT". Fat, 15x5x5mm with a pale yellow nodule 5mm and at one end.	 PHI:Null
1160	 603	 F/S: "NEOM, fat".	 PHI:Null
1160	 658	 (1 frozen section tissue; 2 remaining tissue).AE (M-2)	 PHI:Null
1160	 803	 B. "LUMP RIGHT UPPER QUADRANT". Fat, 20x10x10mm with 10cm firm grey nodule at one end. Consists of mucoid fluid in lesion with pale cut surface.	 PHI:Null
1160	 816	 F/S: "NEOM".	 PHI:Null
1160	 872	 (1 frozen section tissue; 2 remaining tissue). AE (M-2)	 PHI:Null
1160	 1004	 C. "SUPERIOR MESENTERIC VEIN NODE". Fat, 40x20x10mm consists of pale ?vessel 5x15mm long with a possible ?pale node 8mm next to it.	 PHI:Null
1160	 1023	 F/S: "NEOM" (V+N).	 PHI:Null
1160	 1058	 (1 frozen section tissue).RS (M-1)	 PHI:Null
1160	 1134	 D. "SIGMOID MESOCOLON". Two pieces of firm red tissue 5mm and 3mm diameter.	 PHI:Null
1160	 1213	 F/S: "NEOM. (Results to Anaesthetic Registrar Theatre 5 11.23pm 3/4/14 Kaplun)	 TIME:11.23pm 3/4/14=>2014-04-03T23:23
1160	 1213	 F/S: "NEOM. (Results to Anaesthetic Registrar Theatre 5 11.23pm 3/4/14 Kaplun)	 DOCTOR:Kaplu
1160	 1249	 (1 frozen section tissue). RS (M-1)	 PHI:Null
1160	 2034	 E. "OMENTUM, GALLBLADDER, RIGHT COLON". A portion of colon measuring 210mm in total length. There is omentum attached measuring up to 370x200x20mm. On opening, the portion of colon midway there is an anastomosis. Part of the colon 125mm in length consists of small bowel and the remaining portion appears to be large bowel. At the area of anastomosis, there is a further anastomosis and section of bowel 55mm in length. The mucosa is unremarkable. The mesentery shows rough areas ?adhesions.  There is a gallbladder separate in the container measuring 95mm in length and 40mm in maximal external diameter. The external surface has some haemorrhagic areas, it is otherwise smooth and shiny. On opening, the gallbladder is filled with bile and the mucosa shows diffuse cholesterolosis.	 PHI:Null
1160	 2211	 (1-3 LS resection margin; 4-7 representative mucosa; 8 cystic duct resection margin; 9 TS gallbladder body; 10 LS gallbladder fundus; 11 mesenteric ?tumour deposits). RS (M-11)	 PHI:Null
1160	 2415	 (Further tissue: 12&13 one sectioned node; 14 three possible nodes; 15 - 17 one possible node each; 18 ?mesenteric adhesions with possible node; 19 omental cyst; 20 - 22 representative omentum) RS (M-22)	 PHI:Null
1160	 2729	 F. "LIVER LESION - SEGMENT EIGHT". Four pieces of liver, measuring 40x30x20mm, 35x20x20mm, 35x25x20mm and 40x15x10mm. The pieces collectively weigh 38g. Some of the pieces have capsular surface. Margins inked black. On sectioning, the piece without capsule there is an irregularpale lesion 8mm in maximal extent.	 PHI:Null
1160	 2884	 (1 & 2 representative slice piece one; 3 representative slice piece two; 4 representative slice piece three; 5 pale irregular nodule piece four). RS (M-5)	 PHI:Null
1160	 3168	 G. "LIVER LESION - SEGMENT THREE". A wedge of liver 38g measuring 70x55x40mm. There is capsule covering two surfaces. Resection margin inked blue. On sectioning, there is a pale irregular lesion located within 2mm of the resection margin [inked black]. It measures up to 15x14x10mm.	 PHI:Null
1160	 3285	 (1 & 2 paired lesion; 3 representative lesion; 4 representative lesion; 5 representative uninvolved liver). RS (M-5)	 PHI:Null
1160	 3550	 H. "LIVER LESION - SEGMENT SIX". A portion of liver weighing 10g and measuring 35x25x25mm. There is a capsular surface on one edge with tumour suture. The surface shows a pale area. Margins inked black. On sectioning, there is a pale lesion 8mm in maximal extent.	 PHI:Null
1160	 3650	 (1 pale lesion; 2 pale area andcapsular surface; 3 representative uninvolved liver). RS (M-3/CT/cy)	 DOCTOR:CT
1160	 3680	 MICROSCOPIC:   (Dr S Arris)	 DOCTOR:S Arris
1160	 3765	 A.  Sections show unremarkable fibrofatty tissue. There is noevidence of malignancy.	 PHI:Null
1160	 3880	 B.  Sections show fibrofatty tissue with foreign body granulomatous reaction.  There is no evidence of malignancy.	 PHI:Null
1160	 4034	 C.  Sections show fibrofatty tissue with an occluded vessel with surrounding nerve trunks and an inactive lymph node. There is no evidence of malignancy.	 PHI:Null
1160	 4145	 D.  Sections show fibrofatty tissue with foreign body giant cell reaction. There is no evidence of malignancy.	 PHI:Null
1160	 4529	 E.  Sections show smallbowel anastomosed to colon with no significant abnormality. Local lymph nodes examined show reactive changes.   Sections through the gallbladder show no significant abnormality. Sections through theomentum show scattered areas of foreign body giant cell reaction and otherwise no significant abnormality.  No tumour is seen. There is no evidence of malignancy.	 PHI:Null
1160	 4957	 F,G,H.  Sections show metastatic moderately differentiated adenocarcinoma in keeping with origin from a colorectal primary.  Focal lymphovascular invasion by the carcinoma is seen.  The rest of the liver parenchyma shows no intrinsic abnormality.  Local excision of the metastatic adenocarcinoma deposit appears complete apart from specimen F, where disruption of the specimen precludes accurate assessment of surgical margins.	 PHI:Null
1160	 4970	 DIAGNOSIS:	 PHI:Null
1160	 4993	 LEFT UPPER QUADRANT :	 PHI:Null
1160	 5023	 -UNREMARKABLE ADIPOSE TISSUE.	 PHI:Null
1160	 5052	 LUMP RIGHT UPPER QUADRANT :	 PHI:Null
1160	 5087	 -FOREIGN BODY GIANT CELL REACTION.	 PHI:Null
1160	 5120	 SUPERIOR MESENTERIC VEIN NODE :	 PHI:Null
1160	 5165	 -INACTIVELYMPH NODE AND OBLITERATED VESSELS.	 PHI:Null
1160	 5185	 SIGMOID MESOCOLON :	 PHI:Null
1160	 5220	 -FOREIGN BODY GIANT CELL REACTION.	 PHI:Null
1160	 5259	 OMENTUM, GALLBLADDER AND RIGHT COLON :	 PHI:Null
1160	 5276	 -NO TUMOUR SEEN.	 PHI:Null
1160	 5352	 LIVER LESION SEGMENT 8, LIVER LESION SEGMENT 3 AND LIVER LESION SEGMENT 6 :	 PHI:Null
1160	 5427	 -METASTATIC ADENOCARCINOMA IN KEEPING WITH ORIGIN FROM COLORECTAL PRIMARY.	 PHI:Null
1160	 5438	 6/9/64 ank	 DATE:6/9/64=>2064-06-09
1161	 25	 Episode No:  94Y020433U	 IDNUM:94Y020433U
1161	 37	 9490204.JJU	 MEDICALRECORD:9490204.JJU
1161	 66	 OLIN, DINAH ROSENDO SANTOS	 PATIENT:OLIN, DINAH ROSENDO SANTOS
1161	 84	 Lab No:  94Y02043	 IDNUM:94Y02043
1161	 91	 Sylmar	 STREET:Sylmar
1161	 124	 HOWLONG  Western Australia  5724	 CITY:HOWLONG
1161	 124	 HOWLONG  Western Australia  5724	 STATE:Western Australia
1161	 124	 HOWLONG  Western Australia  5724	 ZIP:5724
1161	 141	 Specimen: Tissue	 PHI:Null
1161	 159	 D.O.B:  25/6/2017	 DATE:25/6/2017=>2017-06-25
1161	 167	 Sex:  F	 PHI:Null
1161	 198	 Collected: 27/03/2014 at 18:48	 TIME:27/03/2014 at 18:48=>2014-03-27T18:48
1161	 239	 Location:  Hunter Area-LAVERTON HOSPITAL	 DEPARTMENT:Hunter Area
1161	 239	 Location:  Hunter Area-LAVERTON HOSPITAL	 HOSPITAL:LAVERTON HOSPITAL
1161	 263	 PRO Wandjoo Ned Herpich	 DOCTOR:Wandjoo Ned Herpich
1161	 312	 Distribution:   FILE-COPY,   NSW-CANCER-REGISTRY	 PHI:Null
1161	 323	 HISTORY:	 PHI:Null
1161	 426	 Appendix cancer redo peritonectomy.  Redo (Rt colon), small bowel, peritoneum, lymph node (mesentery).	 PHI:Null
1161	 441	 MACROSCOPIC:	 PHI:Null
1161	 539	 A.  "RIGHT COLON, PERITONEAL DISEASE, SMALL BOWEL".  Specimen consists of seven pieces of tissue.	 PHI:Null
1161	 551	 Specimen 1:	 PHI:Null
1161	 801	 Piece of Bowel 150x50mm.  No abnormalities are seen except for an area 50mm in diameter where the bowel wall is 2mm in thickness. The remaining bowel wall is approximately 3-4mm in thickness. No lesions are present on the external, internal surface.	 PHI:Null
1161	 813	 Specimen 2:	 PHI:Null
1161	 1137	 Two pieces of bowel joined longitudinally.  One piece of bowel is 100mm in length and 50mm in diameter. The other piece of bowel is 150mm in length and 50mm in diameter.  Both specimens have normal external surface and mucosa.  Within the mesenteric fat of the ? small bowel there is a white hard nodule 15mm in diameter.	 PHI:Null
1161	 1149	 Specimen 3:	 PHI:Null
1161	 1207	 An irregularly shaped piece of bowel tissue 30x30x25mm.	 PHI:Null
1161	 1219	 Specimen 4:	 PHI:Null
1161	 1310	 An irregularly shaped piece of bowel 30x30x25mm within which there are numerous staples.	 PHI:Null
1161	 1324	 Specimen 5-7:	 PHI:Null
1161	 1377	 Pieces of fibrous tissue each approximately 25x15mm.	 PHI:Null
1161	 1724	 (1 specimen 1 resection margins; 2-10 specimen 2; 3 small piece of bowel; 4 fatty tissue alongside this bowel; 5 longer piece of bowel [resection margins]; 6-10 fatty tissue alongside this bowel; 11 third piece of bowel RS; 12 fourth piece of bowel RS; 13 entire piece of fibrofatty tissue specimen 5; 14 specimen 6; 15&16 specimen 7).  RS (M-16)	 PHI:Null
1161	 1881	 B.  "APICAL NODE MESENTERIC RESECTION".  Piece of tissue 25x10x10mm within each there is a ? lymph node 10x10mm.  All lymph nodes embedded.  AE (4-2/BI/ank)	 PHI:Null
1161	 1907	 MICROSCOPIC:  (X. Keimig)	 DOCTOR:X. Keimig
1161	 2583	 A.  Sections show deposits of mucinous tumour comprising of lakes ofextracellular mucin associated with mildly to moderately atypical mucinous epithelium including areas of desmoplastic stroma in keeping with well differentiated mucinous adenocarcinoma.  The depositsof tumour are seen in the mesentery of the longest segment of small bowel and in the mesentery, muscularis and submucosa of one of the smaller segments of small bowel.  Similar tumour deposits are also present in separately submitted fragments of fibrous tissue.  Sections through segments of colon show no significant abnormality.  Local lymph nodes examined from all bowel segments show reactive changes.	 PHI:Null
1161	 2753	 B.  Sections show fibrofatty tissue containing an inactive lymph node.  Numerous nerve trunks are also present in the adipose tissue. There is no evidence of malignancy.	 PHI:Null
1161	 2766	 DIAGNOSIS:	 PHI:Null
1161	 2813	 RIGHT COLON, PERITONEAL DISEASE, SMALL BOWEL :	 PHI:Null
1161	 2963	 -DEPOSITS OF WELL DIFFERENTIATED MUCINOUS ADENOCARCINOMA INVOLVING MESENTERY AND WALL OF SMALL BOWEL AND SEPARATELY SUBMITTED PERITONEAL FRAGMENTS.	 PHI:Null
1161	 2998	 APICAL NODE MESENTERIC RESECTION :	 PHI:Null
1161	 3022	 -NO EVIDENCE OF TUMOUR.	 PHI:Null
1161	 3033	 6/3/64 ank	 DATE:6/3/64=>2064-06-03
1162	 24	 Episode No:  42U140591C	 IDNUM:42U140591C
1162	 36	 4281405.YEC	 MEDICALRECORD:4281405.YEC
1162	 54	 Cimeno, Renaldo	 PATIENT:Cimeno, Renaldo
1162	 72	 Lab No:  42U14059	 IDNUM:42U14059
1162	 86	 Juniper Point	 STREET:Juniper Point
1162	 120	 MORANBAH  Western Australia  6181	 CITY:MORANBAH
1162	 120	 MORANBAH  Western Australia  6181	 STATE:Western Australia
1162	 120	 MORANBAH  Western Australia  6181	 ZIP:6181
1162	 137	 Specimen: Tissue	 PHI:Null
1162	 154	 D.O.B:  6/2/1989	 DATE:6/2/1989=>1989-02-06
1162	 162	 Sex:  F	 PHI:Null
1162	 193	 Collected: 04/04/2014 at 10:17	 TIME:04/04/2014 at 10:17=>2014-04-04T10:17
1162	 249	 Location:  ANATOMICAL PATHOLOGY-MATER MOTHER'S HOSPITAL	 DEPARTMENT:ANATOMICAL PATHOLOGY
1162	 249	 Location:  ANATOMICAL PATHOLOGY-MATER MOTHER'S HOSPITAL	 HOSPITAL:MATER MOTHER'S HOSPITAL
1162	 277	 PRO Ashley FREDDIE Rositano	 DOCTOR:Ashley FREDDIE Rositano
1162	 303	 Distribution:   FILE-COPY	 PHI:Null
1162	 332	 SUPPLEMENTARY REPORT 12/6/64	 DATE:12/6/64=>2064-06-12
1162	 344	 HISTORY:	 PHI:Null
1162	 407	 Colorectal cancer. ?liver mets. Frozen section. Liver surface.	 PHI:Null
1162	 422	 MACROSCOPIC:	 PHI:Null
1162	 536	 A. "LIVER SURFACE". An irregular piece of tissue, 5x4x2mm, majority embedded for F/S in two pieces (fragmented).	 PHI:Null
1162	 647	 /S: "Benign fibrovascular tissue" reported by Dr L Rodnguez per phone to Barge (fellow) at 10:15am on 4/4/14.	 DOCTOR:L Rodnguez
1162	 647	 /S: "Benign fibrovascular tissue" reported by Dr L Rodnguez per phone to Barge (fellow) at 10:15am on 4/4/14.	 DOCTOR:Barge
1162	 647	 /S: "Benign fibrovascular tissue" reported by Dr L Rodnguez per phone to Barge (fellow) at 10:15am on 4/4/14.	 TIME:10:15am on 4/4/14=>2014-04-04T10:15
1162	 657	 AE (M-2).	 PHI:Null
1162	 831	 B. "PERICOLECTOMY, SPLEEN, GALLBLADDER, UTERUS, OMENTUM". Spleen, gallbladder, uterus (body), omentum and haemorrhagic tissue. No peritoneal tissue is seen macroscopically.	 PHI:Null
1162	 1062	 The spleen is 100x60x25mm and weighs 125g. On the external surface and extending to the superficial parenchyma there are three well-demarcated white hard nodules up to 10mm in diameter. The rest of the parenchyma is unremarkable.	 PHI:Null
1162	 1219	 The gallbladder is 95x35mm and has a smooth and shiny serosal surface, a wall 2mm in thickness and a green granular mucosal surface. No stones are present.	 PHI:Null
1162	 1699	 The uterus has been ---at the isthmus and consists of a uterine body with attachedfallopian tubes and ovaries. The right fallopian tube is 50x6mm and the right ovary 20x15x10mm weighing 2g. The left fallopian tube is 50x6mm and the left ovary 20x10x8mm weighing 3g. The uterine body is 45mm from fundus to isthmus and 40mm wide and 30mm from anterior to posterior. The endometrium is less than 1mm in thickness and the myometrium is 12mm in thickness with trabeculation present.	 PHI:Null
1162	 1926	 The omentum is irregularly shaped and approximately 300x130x10mm. A ?metastatic nodule 15mm in diameter is present in the omentum. Two other nodules comprised of ?thrombus are also present each approximately 20mm in diameter.	 PHI:Null
1162	 2186	 (1-3 spleen; 4 cystic duct and body; 5 fundus of gallbladder; 6right ovary and fallopian tube; 7 left ovary and fallopian tube; 8 & 9 endometrium and resection margin; 10 endometrium and fundus; 11 ?thrombus x 2; 12 ?metastatic deposit and omentum). RS (M-12)	 PHI:Null
1162	 2237	 C. "GASTRIC NODULES". A white nodule 5mm. AE (1-1)	 PHI:Null
1162	 2462	 D. "LIVER SEGMENT FOUR". A wedge of liver approximately 50x40x30mm which has been sliced at prior to resection and has a friable incomplete surface. The section has been closely sliced and no focal lesions are seen. RS (5-5)	 PHI:Null
1162	 2551	 E. "LIVER LESION SEGMENTB". A wedge of liver 15x15x15mm. No lesions seen. AE (4-2/QS/cy)	 DOCTOR:QS
1162	 2579	 MICROSCOPIC:  (Dr L Lutjen)	 DOCTOR:L Lutje
1162	 2634	 A. Frozen sections confirm fibrovascular tissue only.	 PHI:Null
1162	 2999	 . Sections of spleen confirm multiple deposits of moderately to poorly differentiated metastatic adenocarcinoma. Each of the deposits abuts the splenic capsule, but no invasion through the capsule is seen. There are areas of central necrosis. The adjacent non-involved spleen appears unremarkable. Each of the deposits appears clear of the splenic excision margin.	 PHI:Null
1162	 3159	 Sections of gallbladder show features of mild chronic cholecystitis, with no evidence of malignancy. No metastatic deposits are identified in the gallbladder.	 PHI:Null
1162	 3296	 Sections of right and left fallopian tube and right and left ovaries show changes consistent with age, with no evidence of involvement.	 PHI:Null
1162	 3395	 Sections of uterus show atrophic endometrium. The myometrium and serosal surface is unremarkable.	 PHI:Null
1162	 3555	 Sections of the omentum confirm a deposit of metastatic adenocarcinoma with a similar appearance to those seen within the spleen. Central necrosis is present.	 PHI:Null
1162	 4275	 C. Sections show smooth muscle consistent with muscularis propria, which merges with a cellular spindle cell nodule which appears circumscribed but unencapsulated. Within the nodule, the bland spindle cells show cigar-shaped nuclei arranged in intersecting fascicles.  This nodule is 4mm in maximal extent. There is no significant nuclear atypia, no necrosis, and no mitotic activity detected. The features raise a differential diagnosis of a small gastrointestinal stromal tumour (GIST), versus a leiomyoma, with the appearance on the routine stain favouring a small gastrointestinal stromal tumour. Immunohistochemical stains are in progress to differentiate these two lesions, with a supplementary report to follow.	 PHI:Null
1162	 4415	 D. Sections of liver show mild macrovesicular steatosis. No involvement by metastatic tumour is seen in the representative tissue examined.	 PHI:Null
1162	 4529	 E. The specimen has been completely embedded and examined, and no involvement by metastatic tumour is identified.	 PHI:Null
1162	 4542	 DIAGNOSIS:	 PHI:Null
1162	 4561	 A. LIVER SURFACE:	 PHI:Null
1162	 4586	 -  FIBROVASCULAR TISSUE.	 PHI:Null
1162	 4643	 B. PERICOLECTOMY, SPLEEN, GALLBLADDER, UTERUS, OMENTUM:	 PHI:Null
1162	 4703	 - METASTATIC ADENOCARCINOMA WITHIN THE SPLEEN AND OMENTUM.	 PHI:Null
1162	 4722	 C. GASTRIC NODULE:	 PHI:Null
1162	 4865	 - A 4mm SPINDLE CELL NODULE (? GIST ?LEIOMYOMA). IMMUNOHISTOCHEMICAL STAINS TO CONFIRM ARE IN PROGRESS, WITH A SUPPLEMENTARY REPORT TO FOLLOW.	 PHI:Null
1162	 4888	 D. LIVER SEGMENT FOUR:	 PHI:Null
1162	 4911	 - NO INVOLVEMENT SEEN.	 PHI:Null
1162	 4938	 E. LIVER LESION SEGMENT B:	 PHI:Null
1162	 4961	 - NO INVOLVEMENT SEEN.	 PHI:Null
1162	 4972	 10/6/64 cy	 DATE:10/6/64=>2064-06-10
1162	 5001	 SUPPLEMENTARY REPORT 12/6/64	 DATE:12/6/64=>2064-06-12
1162	 5066	 C. Immunohistochemical stain results on 4mm spindle cell lesion.	 PHI:Null
1162	 5091	 CD117 and CD34: positive	 PHI:Null
1162	 5133	 Desmin and smooth muscle actin: negative.	 PHI:Null
1162	 5206	 This immunoprofile is in keeping with a gastrointestinal stromal tumour.	 PHI:Null
1162	 5240	 Supplementary report by Dr L Mudd	 DOCTOR:L Mudd
1162	 5251	 12/6/64 ld	 DATE:12/6/64=>2064-06-12
1163	 24	 Episode No:  63M741450O	 IDNUM:63M741450O
1163	 35	 634741.LNA	 MEDICALRECORD:634741.LNA
1163	 50	 Dado, Edison	 PATIENT:Dado, Ediso
1163	 68	 Lab No:  63M74145	 IDNUM:63M74145
1163	 77	 Northome	 STREET:Northome
1163	 93	 TINONEE    6327	 CITY:TINONEE
1163	 93	 TINONEE    6327	 ZIP:6327
1163	 110	 Specimen: Tissue	 PHI:Null
1163	 129	 D.O.B:  29/12/1992	 DATE:29/12/1992=>1992-12-29
1163	 137	 Sex:  F	 PHI:Null
1163	 168	 Collected: 11/07/2012 at 09:10	 TIME:11/07/2012 at 09:10=>2012-07-11T09:10
1163	 200	 Location:  SYDPATH-AYR HOSPITAL	 DEPARTMENT:SYDPATH
1163	 200	 Location:  SYDPATH-AYR HOSPITAL	 HOSPITAL:AYR HOSPITAL
1163	 233	 DR Jerome Andres YARRAN-Sanjurjo	 DOCTOR:Jerome Andres YARRAN-Sanjurjo
1163	 281	 Distribution:  FILE-COPY,   NSW-CANCER-REGISTRY	 PHI:Null
1163	 291	 CLINICAL:	 PHI:Null
1163	 425	 Right breast carcinoma 9-10 o'cl - wide local excision & sentinel node biopsy.  Suture - short superior, long lateral, medium medial.	 PHI:Null
1163	 438	 MACROSCOPIC:	 PHI:Null
1163	 583	 A.  Specimen labelled "Rightaxilla sentinel node" consists of a 17mm piece of fatty tissue.  One 13mm lymph node is identified.  BAE one block.	 PHI:Null
1163	 1556	 B.  Specimen labelled "Right breast lesion; long lateral, short superior, medium medial" consists of an orientated wide local excision 65mm (medial-lateral) x 35mm (inferior-superior) x 95mm (superficial-deep).  The inferior margin is inked black, the superior margin is inked blue and the medial margin is inked green.  There is a hookwire entering the specimen from the superficial aspect.  There are three sutures in situ as designated.  The specimen is serially sectioned in the coronal plane into thirteen slices from slice 1 (deep) to slice 13 (superficial).  The hookwire is seen to insert into slice 6.  There is a firm cream poorly circumscribed tumour identified in slices 7 and 8 measuring 10mm (medial-lateral) x 8mm (inferior-superior) x 10mm (superficial-deep).  The distance from margins is as follows:lateral 10mm, superior 11mm, inferior 22mm, medial 40mm and well clear of both the superficial and deep margins.  No other suspicious areas are identified.	 PHI:Null
1163	 2168	 Blocks:  1 to 4 - slice 8; 5 to 9 - slice 7; 10 & 11 - lateral part of slice 9; 12 & 13 - lateral part of slice 6; 14 - lateral part of slice 4; 15 - lateral part of slice 11; 16 & 17 - deep margin; 18 to 20 - superficial margin; 21 - tumour for tumour banking; 22 - remainder of slice 1; 23 & 24 - slice 2; 25 to 27 - slice 3; 28 & 29 - slice 4; 30 to 33 - slice 5; 34 & 35 - remainder slice 6; 36 & 37 - remainder of slice 9; 38 to40 - slice 10; 41 to 43 - remainder of slice 11; 44 to 46 - slice 12; 47 to 49 - remainder of slice 13.  AE.  Tumour markers on block 1. AE.  Please refer to attached diagram.	 PHI:Null
1163	 2186	 (XZ/cc  13/9/62)	 DOCTOR:XZ
1163	 2186	 (XZ/cc  13/9/62)	 DATE:13/9/62=>2062-09-13
1163	 2188	 	 PHI:Null
1163	 2226	 MICROSCOPIC (Reported by DrA Amphy):	 DOCTOR:A Amphy
1163	 2297	 A.  The lymph node is negative for tumour.  The CAM 5.2 is negative.	 PHI:Null
1163	 2586	 B.  Sections show a grade 2 infiltrating ductal carcinoma in slices 7 and 8.  The carcinoma measures 10 x 8 x 10mm and there is no lymphovascular invasion.  The tumour is clear of the excision margins (the superior and lateral margins are 7mm clear and the other margins are well clear.	 PHI:Null
1163	 2842	 There is a focus of high grade ductal carcinoma in situ (DCIS) (cribriform/solid and  apocrine) at the superficial margin (positive margin).  The ductal carcinoma in situ (DCIS) is in the most superficial slice (slice 13) and its size is estimated at 5mm.	 PHI:Null
1163	 2964	 There is a second 2.5mm focus of intermediate ductal carcinoma in situ (DCIS) in slice 5, 3mm from the superior margin.	 PHI:Null
1163	 2966	 	 PHI:Null
1163	 2977	 DIAGNOSIS:	 PHI:Null
1163	 3038	 A & B.  (R) breast wide local excision plus sentinel node.	 PHI:Null
1163	 3058	 Invasive carcinoma:	 PHI:Null
1163	 3101	 Site:  Right breast wide local excision.	 PHI:Null
1163	 3129	 Type:  Infiltrating ductal.	 PHI:Null
1163	 3168	 Invasive tumour size:  10 x 8 x 10mm.	 PHI:Null
1163	 3207	 Grade 2 (Modified Bloom & Richardson):	 PHI:Null
1163	 3270	 Tubules:  2  Nuclei:  2  Mitoses:  3  Mitotic rate:  30/10hpf.	 PHI:Null
1163	 3304	 Lymphovascular invasion:  Absent.	 PHI:Null
1163	 3310	 	 PHI:Null
1163	 3328	 DCIS component:	 PHI:Null
1163	 3344	 DCIS:  Present.	 PHI:Null
1163	 3425	 Maximum extent of DCIS:  5mm (second 2.5mm focus of intermediate DCIS inslice 5)	 PHI:Null
1163	 3447	 Nuclear grade:  High.	 PHI:Null
1163	 3484	 Architecture:  Solid and cribriform.	 PHI:Null
1163	 3503	 Necrosis:  Absent.	 PHI:Null
1163	 3527	 Calcification:  Absent.	 PHI:Null
1163	 3568	 Degree of DCIS in tumour:  None/minimal.	 PHI:Null
1163	 3604	 DCIS in adjacent tissue:  Present.	 PHI:Null
1163	 3624	 Excision Margins:	 PHI:Null
1163	 3644	 Invasive component:	 PHI:Null
1163	 3660	 Superior - 7mm.	 PHI:Null
1163	 3675	 Lateral - 7mm.	 PHI:Null
1163	 3701	 Other margins well clear.	 PHI:Null
1163	 3720	 In-situ component:	 PHI:Null
1163	 3776	 High grade DCIS, size 5mm, positive superficial margin.	 PHI:Null
1163	 3841	 Intermediate grade DCIS, size 2.5mm, 3mm from superior margin.	 PHI:Null
1163	 3851	 Receptors	 PHI:Null
1163	 3866	 ER:  Positive.	 PHI:Null
1163	 3890	 >95% of nuclei stained	 PHI:Null
1163	 3935	 predominant intensity of staining:  Strong.	 PHI:Null
1163	 3950	 PR:  Positive.	 PHI:Null
1163	 3973	 10% of nuclei stained	 PHI:Null
1163	 4016	 predominant intensity of staining:  Weak.	 PHI:Null
1163	 4055	 (Novocastra 10A7):  Negative (0/1+).	 PHI:Null
1163	 4099	 Slides sent to KALEEYA HOSPITAL for CISH.	 HOSPITAL:KALEEYA HOSPITAL
1163	 4151	 Ki-67 index:  The Ki67 is 20% in the worst areas.	 PHI:Null
1163	 4164	 Nipple:  N/A	 PHI:Null
1163	 4181	 LCIS / ALH:  Nil	 PHI:Null
1163	 4205	 Sentinel lymph node(s):	 PHI:Null
1163	 4249	 Number of sentinel lymph nodes examined:  1	 PHI:Null
1163	 4297	 Number of sentinel nodes involved by tumour:  0	 PHI:Null
1163	 4319	 Axillary/other nodes:	 PHI:Null
1163	 4363	 Number of axillary lymph nodes examined:  0	 PHI:Null
1163	 4381	 Lymph node total:	 PHI:Null
1163	 4451	 Total number of lymph nodes examined (including sentinel node(s)):  1	 PHI:Null
1163	 4521	 Total number of involved lymph nodes (including sentinel node(s)):  0	 PHI:Null
1163	 4551	 ADDITIONAL REPORT:  (27.9.62)	 DATE:27.9.62=>2062-09-27
1163	 4656	 Blocks were sent to QUEANBEYAN DISTRICT HOSPITAL Hospital for Her2 CISH analysis, Dr A Grismore reports:	 HOSPITAL:QUEANBEYAN DISTRICT HOSPITAL
1163	 4656	 Blocks were sent to QUEANBEYAN DISTRICT HOSPITAL Hospital for Her2 CISH analysis, Dr A Grismore reports:	 DOCTOR:A Grismore
1163	 4737	 Her 2 in situ hybridisation: (Her2 CISH Invitrogen SPOT-Light assay, block B1).	 PHI:Null
1163	 4790	 Her2 CISH result: NEGATIVE (non-amplified, diploid).	 PHI:Null
1163	 4828	 Mean Her2 copy number per cell: 1.25.	 PHI:Null
1163	 4873	 SCORING CRITERIA (ASCO/CAP recommendations):	 PHI:Null
1163	 4917	 1 to <2.5 copies:   Non amplified (diploid)	 PHI:Null
1163	 4963	 2.5 to <4 copies:   Non amplified (polysomy)	 PHI:Null
1163	 4990	 4 to 6 copies:  Equivocal	 PHI:Null
1163	 5034	 >6 but < 10 copies: Low level amplification	 PHI:Null
1163	 5078	 10 or more copies:  High level amplified.	 PHI:Null
1163	 5080	 	 PHI:Null
1164	 25	 Episode No:  21I762408W	 IDNUM:21I762408W
1164	 36	 213762.MCV	 MEDICALRECORD:213762.MCV
1164	 54	 Sorlie, KENDALL	 PATIENT:Sorlie, KENDALL
1164	 72	 Lab No:  21I76240	 IDNUM:21I76240
1164	 90	 Lower Matchaponix	 STREET:Lower Matchaponix
1164	 115	 WAUCHOPE  Tasmania  7305	 CITY:WAUCHOPE
1164	 115	 WAUCHOPE  Tasmania  7305	 STATE:Tasmania
1164	 115	 WAUCHOPE  Tasmania  7305	 ZIP:7305
1164	 132	 Specimen: Tissue	 PHI:Null
1164	 151	 D.O.B:  21/11/1986	 DATE:21/11/1986=>1986-11-21
1164	 159	 Sex:  M	 PHI:Null
1164	 185	 Collected: 13/9/2062 at :	 DATE:13/9/2062=>2062-09-13
1164	 227	 Location:  SEALS Central-REDLAND HOSPITAL	 DEPARTMENT:SEALS Central
1164	 227	 Location:  SEALS Central-REDLAND HOSPITAL	 HOSPITAL:REDLAND HOSPITAL
1164	 251	 DR Tarka Williams Krahn	 DOCTOR:Tarka Williams Krah
1164	 300	 Distribution:   FILE-COPY,   NSW-CANCER-REGISTRY	 PHI:Null
1164	 328	 ADDITIONAL REPORT (1/12/62)	 DATE:1/12/62=>2062-12-01
1164	 339	 CLINICAL:	 PHI:Null
1164	 412	 Dediff'd liposarcoma in (L) proximal thigh- previous chemo-radiotherapy.	 PHI:Null
1164	 425	 MACROSCOPIC:	 PHI:Null
1164	 942	 Specimen labelled "Sarcoma left thigh - long stitch lateral, medium stitch medial, short stitch superior" consists of a 90 x 21mm ellipse of skin attached to fat and skeletal muscle 180 x 120 x 95mm in total.  The skin bears an 80mm horizontal surgical defect.  The sutures designated long for lateral, medium for medial and short for superior are attached.  A well circumscribed, nodular tumour is present superiorly within the specimen, measuring approximately 135 x 120 x 95mm.  Lateral inked blue, medial black.	 PHI:Null
1164	 1235	 The specimen is sectioned from superior to inferior into twelve slices.The cut surfaces of the tumour have a fleshy and myxoid appearance superiorly, becoming more lipomatous inferiorly.  The estimated macroscopic tumour necrosis is 40%, and is seen within the fleshy and myxoid components.	 PHI:Null
1164	 1500	 The tumour measures 1mm from the superficial margin, 2mm from the deep margin, 5mm from the superior margin, 5mm from the medial margin, 15mm from the lateral margin and is macroscopically well clear of the inferior margin.  The tumour appears well clear of skin.	 PHI:Null
1164	 2280	 Blocks:  1 & 2 - representative superior margin; 3 - representative deep margin; 4 - representative medial margin; 5 - representative superficial margin; 6 to 15 - further representative tumour; 16 - tumour reserve block (differentiated); 17 - tumour reserve block (undifferentiated); 18 & 19 - representative inferior margin.  Please see attached diagram.    (SC/cc  14/9/62); 20 - further representative slice 1 (superior margin); 21 - representativelateral margin (slice 3) showing ?differentiated area and de-diffed area; 22 - further representative de margin (slice 5); 23 - further representative lateral margin (slice 6); 24 - further representative lateral margin (slice 7) ?differentiated area; 25-27 - representative skin, subcutis and skeletal muscle. (SC/mm 15.9.62)	 DATE:14/9/62=>2062-09-14
1164	 2280	 Blocks:  1 & 2 - representative superior margin; 3 - representative deep margin; 4 - representative medial margin; 5 - representative superficial margin; 6 to 15 - further representative tumour; 16 - tumour reserve block (differentiated); 17 - tumour reserve block (undifferentiated); 18 & 19 - representative inferior margin.  Please see attached diagram.    (SC/cc  14/9/62); 20 - further representative slice 1 (superior margin); 21 - representativelateral margin (slice 3) showing ?differentiated area and de-diffed area; 22 - further representative de margin (slice 5); 23 - further representative lateral margin (slice 6); 24 - further representative lateral margin (slice 7) ?differentiated area; 25-27 - representative skin, subcutis and skeletal muscle. (SC/mm 15.9.62)	 DATE:15.9.62=>2062-09-15
1164	 2321	 MICROSCOPIC (Reported by Dr F Zermeno):	 DOCTOR:F Zermeno
1164	 4529	 Sections show a dedifferentiated liposarcoma, 135mm in maximum dimension. The subfascial tumour has a multinodular configuration and shows a predominantly abrupt transition from well differentiated lipoma-like and sclerosing liposarcoma to dedifferentiated myxoid malignant fibrous histiocytoma (myxoid MFH)-like areas. The skin and subcutis are uninvolved.  The transition between the well and dedifferentiated components is generally abrupt, however, focal intermingled areas (block 13) are also noted.  Although most of the tumour is well demarcated by a fibrous pseudocapsule and/or adjacent atrophic muscle, well differentiated tumour infiltrates skeletal muscle superficially and laterally (blocks5 &13).  The moderately cellular dedifferentiated component (approximately 60% of the tumour) is composed of moderate to markedly pleomorphic spindled, stellate and multinucleated cells with hyperchromatic, often angulated nuclei, occasionally prominent eosinophilic nucleoli and a variable amount of eosinophilic cytoplasm, some with intracytoplasmic hyaline globules. The pleomorphic tumour cells are arranged in a storiform pattern and haphazardly.  The stroma of the dedifferentiated component is fibromxyoid and contains a supporting capillary-like vasculature which focally appears plexiform and there is patchy mild associated chronic inflammation.   In the latter areas, the tumour shows features superficially resembling myxoid liposarcoma, however, the degree of nuclear atypia and association with a well differentiated liposarcoma component excludes that diagnosis.  The dedifferentiated component shows broad areas (estimated 40% of the total tumour volume) of therapy-related coagulative necrosis.  Mitoses are generally inconspicuous but, in the most proliferative areas, number up to 4 per 10 HPF including atypical forms.  Within the well differentiated areas, enlarged hyperchromatic angulated stromal cells and multivacuolated lipoblasts are easily identified.  Focally fibrous scar tissue and foreign body type giant cells are noted adjacent to tumour.  The dedifferentiated component of the tumour shows similar histological features to the previous incisional biopsy (21I76240).	 IDNUM:21I76240
1164	 4533	 	 PHI:Null
1164	 5048	 Close to the superficialmargin moderately cellular pleomorphic dedifferentiated tumour merges with less cellular, less pleomorphic mitotically active atypical spindled and stellate ganglion-like cells. The latter component, favoured to represent dedifferentiated tumour over a reactive proliferation of myofibroblasts, infiltrates skeletal muscle and reaches the inked resection margin. The superficial margin is therefore regarded as suspicious for involvement by sarcoma. The remaining margins aredetailed below.	 PHI:Null
1164	 5072	 Immunohistochemistry:	 PHI:Null
1164	 5249	 The dedifferentiated tumour cells show patchystaining with desmin but are negative for myogenin, myoglobin, SMA and S100. The Ki67 proliferation index is approximately 5-10%.	 PHI:Null
1164	 5300	 A synoptic report for soft tissue sarcoma follows:	 PHI:Null
1164	 5312	 PROCEDURE:	 PHI:Null
1164	 5334	 Wide local excision	 PHI:Null
1164	 5340	 SITE:	 PHI:Null
1164	 5384	 Anatomical location:  Proximal lower limb	 PHI:Null
1164	 5386	 	 PHI:Null
1164	 5405	 Laterality:  Left	 PHI:Null
1164	 5439	 Compartment:  Deep, subfascial.	 PHI:Null
1164	 5441	 	 PHI:Null
1164	 5467	 PRIMARY TUMOUR DIAGNOSIS:	 PHI:Null
1164	 5524	 Histological type:  Dedifferentiated liposarcoma.	 PHI:Null
1164	 5531	 	 PHI:Null
1164	 5574	 SIZE: 135 x 120 x 95 mm (gross estimate).	 PHI:Null
1164	 5634	 HISTOLOGICAL GRADE:  (Not applicable - post chemoradiation)	 PHI:Null
1164	 5636	 	 PHI:Null
1164	 5659	 TUMOUR GROWTH PATTERN:	 PHI:Null
1164	 5733	 Predominantly pushing with areas of infiltrative growth (blocks 5, 13).	 PHI:Null
1164	 5735	 	 PHI:Null
1164	 5780	 EXTENT OF TUMOUR:  (Compartment involvement)	 PHI:Null
1164	 5814	 Confined within compartment  Yes	 PHI:Null
1164	 5852	 Extracompartmental spread  Not seen.	 PHI:Null
1164	 5899	 Visceral involvement   Not applicable (N/A).	 PHI:Null
1164	 5937	 Neurovascular involvement  Not seen.	 PHI:Null
1164	 5966	 Skip metastases   Not seen.	 PHI:Null
1164	 6023	 Lymph node metastases  No lymph nodes identified.	 PHI:Null
1164	 6029	 	 PHI:Null
1164	 6102	 MARGINS OF EXCISION:  Suspicious for involvement - Superficial (block 5)	 PHI:Null
1164	 6153	 Closest margin   Superficial (see body of report)	 PHI:Null
1164	 6190	 Distance to closest margin (mm) 0mm	 PHI:Null
1164	 6295	 Distance to other margins (mm) Deep (block 12) 0.5mm - (well differentiated); 1mm - (dedifferentiated).	 PHI:Null
1164	 6370	 Lateral (block 23) 1.1mm - (well diff.); well clear >10mm - (dediff.).	 PHI:Null
1164	 6416	 Medial (block 4) -  3.4mm - (well diff.);	 PHI:Null
1164	 6440	 5.5 mm - (dediff.).	 PHI:Null
1164	 6482	 Superior (block 1)at least 3mm clear.	 PHI:Null
1164	 6517	 Inferior (block18) well clear.	 PHI:Null
1164	 6522	 	 PHI:Null
1164	 6578	 RESPONSE TO NEOADJUVANT THERAPY:  Prior chemoradiation.	 PHI:Null
1164	 6628	 Percentage tumour necrosis:  Approximately 40%.	 PHI:Null
1164	 6653	 TNM STAGE:  Tumour  pT2b	 PHI:Null
1164	 6667	 Nodes   cN0	 PHI:Null
1164	 6685	 Metastases  cN0	 PHI:Null
1164	 6687	 	 PHI:Null
1164	 6720	 MISCELLANEOUS ANCILLARY STUDIES:	 PHI:Null
1164	 6836	 Tissue will be sent to TASMAN MULTI-PURPOSE CENTRE's hospital for FISH analysis and a supplementary report issued.	 HOSPITAL:TASMAN MULTI-PURPOSE CENTRE
1164	 6869	 OTHER FINDINGS: Nil significant.	 PHI:Null
1164	 6880	 DIAGNOSIS:	 PHI:Null
1164	 6919	 Excision tumour left proximal thigh:	 PHI:Null
1164	 6974	 -  Dedifferentiated liposarcoma (post chemoradiation).	 PHI:Null
1164	 7055	 -  Superficial margin suspicious for involvement (see report for other margins).	 PHI:Null
1164	 7074	 -  pT2b, cN0, cM0.	 PHI:Null
1164	 7197	 Tissue will be sent to THE CHILDREN'S HOSPITAL AT WESTMEAD's hospital for FISH analysis and a supplementary report issued.	 HOSPITAL:THE CHILDREN'S HOSPITAL AT WESTMEAD
1164	 7199	 	 PHI:Null
1164	 7227	 ADDITIONAL REPORT, 1/12/62:	 DATE:1/12/62=>2062-12-01
1164	 7326	 FLUORESCENCE IN SITU HYBRIDISATION reported by F Christophe/ Dr F Maycock, ST VINCENT'S PATHOLOGY.	 DOCTOR:F Christophe
1164	 7326	 FLUORESCENCE IN SITU HYBRIDISATION reported by F Christophe/ Dr F Maycock, ST VINCENT'S PATHOLOGY.	 DOCTOR:F Maycock
1164	 7326	 FLUORESCENCE IN SITU HYBRIDISATION reported by F Christophe/ Dr F Maycock, ST VINCENT'S PATHOLOGY.	 DEPARTMENT:ST VINCENT'S PATHOLOGY
1164	 7347	 "Nature of Specimen:	 PHI:Null
1164	 7383	 PET: 21I76240 Somoza block 4 and 16	 IDNUM:21I76240
1164	 7383	 PET: 21I76240 Somoza block 4 and 16	 DOCTOR:Somoza
1164	 7395	 FISH Probe:	 PHI:Null
1164	 7472	 DDIT3 (12q13) dual colour breakapart rearrangement probe (Abbott Molecular).	 PHI:Null
1164	 7545	 MDM2 (12q15),D12Z3 (12 centromere) loci-specific probe set (ZytoVision).	 PHI:Null
1164	 7671	 FUS(16p11) dual colour breakapart rearrangement probe (Abbott Molecular). CDK4(12q13),SE12(12 centromere) (Kreatech Poseidon)	 PHI:Null
1164	 7723	 GLI (12q13),SE12(12 centromere) (Kreatech Poseidon)	 PHI:Null
1164	 7737	 FISH Results:	 PHI:Null
1164	 7746	 Block 4:	 PHI:Null
1164	 7859	 nuc ish dim amp(D12Z3),dim amp(3'DDIT3,5'DDIT3),dim amp(CDK4), (MDM2x3-8),(5'FUS,3'FUS)X2-4(5'FUS con 3'FUSx2-4)	 PHI:Null
1164	 7869	 Block 16:	 PHI:Null
1164	 7979	 nuc ish dim amp (D12Z3),dim amp(3'DDlT3,5'DDIT3),(MDM2x3-10) (GLIx2-4),(5'FUS,3'FUS)x2-7(5'FUS con 3'FUSx2-7)	 PHI:Null
1164	 7990	 Comment: -	 PHI:Null
1164	 8034	 Block 4. DDlT3, FUS, MDM2,12cen, CDK4,12cen	 PHI:Null
1164	 8501	 Interphase FISH detected amplification of the DDIT3, CDK4 and 12 centromere probes, but with a diminished signal intensity to that of the corresponding normal chromosome copies of these loci.  lnterphase FISH detected copy number gain relative to the chromosome 12 centromere of MDM2, but not amplification of this locus.  lnterphase FISH detected no evidence of rearrangement of FUS.  Two to four (2-4) copies of non-rearranged FUS were seen in the nuclei examined.	 PHI:Null
1164	 8551	 Block 16: DDIT3,12cen, FUS, MDM2,12cen, GLI,12cen	 PHI:Null
1164	 8853	 Interphase FISH detected amplification of the DDIT3 and 12 centromere probes, but with a diminished signal intensity to that of the corresponding normal chromosome copies of these loci.  Interphase FISH detected copy number gain relative to the chromosome 12 centromere of MDM2, but not amplification.	 PHI:Null
1164	 9157	 Summary: The unusual signal patterns for CDK4,DDIT3 and 12 centromere are suggestive of, but not conclusive for an amplification event at 12q13. Amplification of 12 centromere and CDK4 without MDM2 amplification has been reported as a rare observation in WD/DD liposarcoma, with the same "faint" pattern	 PHI:Null
1164	 9290	 described (Modern Pathology (2012) 15 June: 1-13).  In most cases, both MDM2 and CDK4 are amplified (Int J Cancer (2008);122: 2233).	 PHI:Null
1164	 9453	 FISH detected no evidence of rearrangement of the FUS locus.  Two to seven (2-7) copies were detected in the nuclei scored. Please correlate with other findings."	 PHI:Null
1165	 24	 Episode No:  42Z363366H	 IDNUM:42Z363366H
1165	 35	 429363.KQQ	 MEDICALRECORD:429363.KQQ
1165	 52	 Bottin, CLAUDE	 PATIENT:Bottin, CLAUDE
1165	 70	 Lab No:  42Z36336	 IDNUM:42Z36336
1165	 78	 Fawkham	 STREET:Fawkham
1165	 102	 HOWLONG  Victoria  4012	 CITY:HOWLONG
1165	 102	 HOWLONG  Victoria  4012	 STATE:Victoria
1165	 102	 HOWLONG  Victoria  4012	 ZIP:4012
1165	 119	 Specimen: Tissue	 PHI:Null
1165	 137	 D.O.B:  30/9/2005	 DATE:30/9/2005=>2005-09-30
1165	 145	 Sex:  M	 PHI:Null
1165	 171	 Collected: 14/9/2062 at :	 DATE:14/9/2062=>2062-09-14
1165	 196	 Location:  SEALS Central	 DEPARTMENT:SEALS Central
1165	 218	 DR TED Bernie ESPOSTO	 DOCTOR:TED Bernie ESPOSTO
1165	 267	 Distribution:   FILE-COPY,   NSW-CANCER-REGISTRY	 PHI:Null
1165	 277	 CLINICAL:	 PHI:Null
1165	 342	 (L) lower lobe adenocarcinoma.  Brain met.  (L) lower lobectomy.	 PHI:Null
1165	 355	 MACROSCOPIC:	 PHI:Null
1165	 1056	 A.  Specimen labelled "Left lower lung lobe" consists of a lobe of lung 140 x 135 x 70mm weighing 208g when fresh.  There is an area of pale puckering of the pleural surface over an area of 35 x 30mm.  There is a stapled resection margin 55mm which is inked black.  The remainder of the hilar resection margin is inked blue.  Several anthracotic lymph nodes are identified in the hilum.  The cut surface of the area of puckering shows a cream firm poorly circumscribed tumour 50 x 45 x 35mm.  The tumour appears to extend to the pleural surface and abuts the main bronchus.  The tumour appears to come to within 5mm of the bronchial resection margin.  The remainder of the lung appears unremarkable.	 PHI:Null
1165	 1339	 Blocks:  1 - lymph nodes; 2 - bronchial resection margins; 3 - ?vascular margins; 4 - tumour to bronchial resection margin; 5 & 6 - tumour to pleural surface; 7 - tumour along bronchus; 8 - tumour to black inked resection margin; 9 - uninvolved lung; 10 - tumour for tumour banking.	 PHI:Null
1165	 1445	 B.  Specimen labelled "Hilar lymph node" consists of one 13mm piece of tan/black tissue.  BAE one block.	 PHI:Null
1165	 1525	 C.  Specimen labelled "AP lymph node" consists of an 18mm piece of fattytissue.	 PHI:Null
1165	 1581	 Blocks:  1 - ?small lymph nodes; 2 - larger lymph node.	 PHI:Null
1165	 1700	 D.  Specimen labelled "Posterior mediastinal lymph node" consists of one 12mm anthracotic lymph node.  BAE one block.	 PHI:Null
1165	 1907	 E.  Specimen labelled "Inferior pulmonary ligament" consists of a 12mm piece of fatty tan tissue and one 22mm piece of fatty black tissue.  The larger piece of tissue includes two lymph nodes, 5 and 12mm.	 PHI:Null
1165	 1978	 Blocks:  1 - smaller piece of tissue; 2 - larger piece of tissue, BAE.	 PHI:Null
1165	 1996	 (XW/cc  15/9/62)	 DOCTOR:XW
1165	 1996	 (XW/cc  15/9/62)	 DATE:15/9/62=>2062-09-15
1165	 1998	 	 PHI:Null
1165	 2039	 MICROSCOPIC (Reported by Dr K Grassle):	 DOCTOR:K Grassle
1165	 2592	 A.  Sections show a moderately differentiated adenocarcinoma of the left lower lobe.  The tumour hasa macroscopic size of 50mm and abuts the pleural surface.  Small deposits of tumour are seen within lymphatics at the pleural surface however no tumour cells are seen on the visceral pleura (PL1).  Tumour does not invade the nearby bronchus and comes to within approximately 5mm of the bronchial resection margin.  Four (4) hilar lymph nodes identified show no evidence of malignancy and the remaining lung parenchyma shows no significant abnormality.	 PHI:Null
1165	 2666	 B.  Thesingle (1) lymph node identified shows no evidence of malignancy.	 PHI:Null
1165	 2741	 C.  The single (1) lymph node identified shows no evidence of malignancy.	 PHI:Null
1165	 2816	 D.  The single (1) lymph node identified shows no evidence of malignancy.	 PHI:Null
1165	 2890	 E.   The three (3) lymph nodes identified show no evidence of malignancy.	 PHI:Null
1165	 2903	 DIAGNOSIS:	 PHI:Null
1165	 2955	 A.   Left lowerlobe lung plus thoracic lymph nodes:	 PHI:Null
1165	 3009	 - Moderately differentiated adenocarcinoma, size 50mm	 PHI:Null
1165	 3049	 - Pleural lymphatics involved by tumour	 PHI:Null
1165	 3076	 - Ten negative lymph nodes	 PHI:Null
1165	 3093	 - Stage T2aPL1N0	 PHI:Null
1166	 24	 Episode No:  16J102766C	 IDNUM:16J102766C
1166	 35	 163102.SSP	 MEDICALRECORD:163102.SSP
1166	 58	 Pushard, RUEBEN Miki	 PATIENT:Pushard, RUEBEN Miki
1166	 76	 Lab No:  16J10276	 IDNUM:16J10276
1166	 85	 Colemans	 STREET:Colemans
1166	 102	 MOAMA  QLD  1156	 CITY:MOAMA
1166	 102	 MOAMA  QLD  1156	 STATE:QLD
1166	 102	 MOAMA  QLD  1156	 ZIP:1156
1166	 119	 Specimen: Tissue	 PHI:Null
1166	 137	 D.O.B:  17/6/1988	 DATE:17/6/1988=>1988-06-17
1166	 145	 Sex:  M	 PHI:Null
1166	 176	 Collected: 12/07/2012 at 22:14	 TIME:12/07/2012 at 22:14=>2012-07-12T22:14
1166	 229	 Location:  HAPS-SWAN HILL DISTRICT HEALTH [SWAN HILL	 DEPARTMENT:HAPS
1166	 229	 Location:  HAPS-SWAN HILL DISTRICT HEALTH [SWAN HILL	 HOSPITAL:SWAN HILL DISTRICT HEALTH [SWAN HILL
1166	 253	 DR JIMMY Brenton Hulton	 DOCTOR:JIMMY Brenton Hulto
1166	 279	 Distribution:   FILE-COPY	 PHI:Null
1166	 289	 CLINICAL:	 PHI:Null
1166	 331	 Small tumour at incisura.  Gastrectomy.	 PHI:Null
1166	 344	 MACROSCOPIC:	 PHI:Null
1166	 1133	 Specimen labelled "Stomach" consists of a stomach which was received open at the proximal margin and measures 170mm with a maximum open circumference of 110mm.  The greater curve measures 190mm whilethe lesser curve measures 140mm.  On the anterior wall at the greater curve there is an area of mucosal flattening and possible ulceration measuring 30 x 28mm.  In the distal stomach near the lesser curve there is a poorly defined thickened area in the wall, 20mm diameter.  In the antrum the mucosa has a few small pale nodules up to 4mm diameter.  The proximal gastric mucosa appears oedematous.  A piece of omentum 240mm in length is attached to the greater curve.  The omental fat is unremarkable.  Several lymph nodes are identified in fat attached to the greater and lesser curves.	 PHI:Null
1166	 1624	 Blocks: 1& 2 - shave of proximal resection margin in area closest to tumour; 3 - representative further proximal margin; 4 & 5 - distal resection margin; 6 to 9 - abnormal area anterior greater curve; 10 & 11 - representative distal stomach in areas of nodularity; 12 - representative oedematous proximal stomach; 13 & 1 4 - lesser curve nodes; 15 & 16 - greater curve nodes; 17 - tumour for tumour banking; 18 to 47 - further blocks of distal stomach including incisura.   (WG/ta  15/9/62)	 DOCTOR:WG
1166	 1624	 Blocks: 1& 2 - shave of proximal resection margin in area closest to tumour; 3 - representative further proximal margin; 4 & 5 - distal resection margin; 6 to 9 - abnormal area anterior greater curve; 10 & 11 - representative distal stomach in areas of nodularity; 12 - representative oedematous proximal stomach; 13 & 1 4 - lesser curve nodes; 15 & 16 - greater curve nodes; 17 - tumour for tumour banking; 18 to 47 - further blocks of distal stomach including incisura.   (WG/ta  15/9/62)	 DATE:15/9/62=>2062-09-15
1166	 1627	 	 PHI:Null
1166	 1667	 MICROSCOPIC (reported by Dr D Goodner):	 DOCTOR:D Goodner
1166	 2532	 The tumour was not definitely identified macroscopically and numerous sections have been examined of the specimen, mainly of the distal stomach.  In two of the sections (blocks 37, 38) there is a small area of well differentiated adenocarcinoma identified.  In the sections the invasive adenocarcinoma measures around 6mm in main diameter.  It is intestinal type and invades into submucosa.  It has a circumscribed, pushing margin and no lymphovascular or perineural invasion isseen.  The distal and proximal excision margins of the stomach are free of tumour.  The mucosa elsewhere throughout the stomach shows extensive intestinal metaplasia and features of a chronic gastritis.  The mucosa overlying, and immediately adjacent to, the tumour shows low grade and focal high grade dysplasia; the dysplastic area is very localised.  No Helicobacter is identified.	 PHI:Null
1166	 2769	 A total of sixteen (16) lymph nodes were identified in fat attached to the lesser curve and theseare all free of tumour.  A total of seven (7) nodes were identified in fat attached to the greater curve and these are all free of tumour.	 PHI:Null
1166	 2782	 DIAGNOSIS:	 PHI:Null
1166	 2793	 Stomach:	 PHI:Null
1166	 2878	 1.  Well differentiated adenocarcinoma of intestinal type, 6mm in diameter, invading	 PHI:Null
1166	 2938	 submucosa.  No lymph node metastases (0/23).   pT1 N0.	 PHI:Null
1166	 2989	 2.  Chronic gastritis and intestinal metaplasia.	 PHI:Null
1166	 2992	 	 PHI:Null
1167	 25	 Episode No:  63F233724L	 IDNUM:63F233724L
1167	 37	 6322337.HLL	 MEDICALRECORD:6322337.HLL
1167	 63	 Colabella, ULVA Florida	 PATIENT:Colabella, ULVA Florida
1167	 90	 Lab No:  63F23372,63F23372	 IDNUM:63F23372
1167	 90	 Lab No:  63F23372,63F23372	 IDNUM:63F23372
1167	 99	 Glenview	 STREET:Glenview
1167	 135	 NEWCASTLE  Northern Territory  4372	 CITY:NEWCASTLE
1167	 135	 NEWCASTLE  Northern Territory  4372	 STATE:Northern Territory
1167	 135	 NEWCASTLE  Northern Territory  4372	 ZIP:4372
1167	 158	 Specimen: Fluid,Tissue	 PHI:Null
1167	 176	 D.O.B:  12/2/1994	 DATE:12/2/1994=>1994-12-02
1167	 184	 Sex:  F	 PHI:Null
1167	 215	 Collected: 16/07/2012 at 08:21	 TIME:16/07/2012 at 08:21=>2012-07-16T08:21
1167	 269	 Location:  Radiation Oncology - ROYAL DARWIN HOSPITAL	 DEPARTMENT:Radiation Oncology
1167	 269	 Location:  Radiation Oncology - ROYAL DARWIN HOSPITAL	 HOSPITAL:ROYAL DARWIN HOSPITAL
1167	 296	 DR Margaret Azzie WENDROTH	 DOCTOR:Margaret Azzie WENDROTH
1167	 345	 Distribution:   FILE-COPY,   NSW-CANCER-REGISTRY	 PHI:Null
1167	 355	 CLINICAL:	 PHI:Null
1167	 508	 72yo woman with bilateral adnexal masses and enlarged inguinal lymph nodes and elevated Ca125.  FNAB of groin nodes:  metastatic large cell carcinoma.	 AGE:72
1167	 521	 MACROSCOPIC:	 PHI:Null
1167	 667	 A.  Specimen labelled "Left inguinal lymph node" consists of a fatty piece of tissue, 45 x 35 x 20mmwith five nodes from 7mm to 37 x 20 x 20mm.	 PHI:Null
1167	 879	 Blocks:  1 & 2 - frozen section; 3 - one representative section from the largest lymph node; 4 - three lymph nodes; 5 - one bisected lymph node; 6 - tissue from the largest lymph node selected for tissue bank.	 PHI:Null
1167	 902	 FROZEN SECTION REPORT:	 PHI:Null
1167	 931	 Metastatic serous carcinoma.	 PHI:Null
1167	 991	 Phone result to Dr R Potolsky by Dr R Mellors at 10.20am.	 DOCTOR:R Potolsky
1167	 991	 Phone result to Dr R Potolsky by Dr R Mellors at 10.20am.	 DOCTOR:R Mellors
1167	 1869	 B.  Specimen labelled "Uterus, left tube and ovary" consists of a uterus with cervix and a large cystic mass attached to the left aspect of the specimen.  The specimen weighs 198g.  The uterus measures 80 x 30 x 20mm.  The serosal surface is ragged and dusky.  At the fundus there is a large, heavily calcified subserosal fibroid measuring 50 x 40 x 30mm.  The endometrium measures 2mm in thickness, the myometrium measures 15mm in thickness.  The left tube and ovary are replaced by a cystic mass measuring 80 x 40 x 40mm.  The external surface is shiny and congested with small solid nodules measuring from 3mm up to 7mm diameter.  A papillary area measuring 20 x 15 x 10mm is identified on the outer surface.  On sectioning the tumour mass has a variegated appearance with cystic and solid areas, areas of necrosis, areas of haemorrhage and several papillary excrescences.	 PHI:Null
1167	 2217	 Blocks:  1 to 3 - one full longitudinal section of anterior body and cervix; 4 to 6 - one full longitudinal section of posterior body and cervix; 7 & 8 - three LS of ?fimbria with tumour; 9 to 12 - full representative sections from the tumour; 13 - tumoral deposit from the serosal surface of the calcified fibroma; 14 - left parametrial tissue.	 PHI:Null
1167	 2621	 C.  Specimen labelled "Right tube and ovary" consists of a cystic tumour measuring 110 x 100 x 70mm.  The external surface has multiple solid nodules measuring from 5 up to 25mm.  On sectioning it has a variegated appearance with cystic and solid areas.  The cystic areas are lined by papillary excrescences.  The fallopian tube is not identified.  Representative sections from the tumour in 4 blocks.	 PHI:Null
1167	 2803	 D.  Specimen labelled "Right inguinal lymph node" consists of a lymph node measuring 30 x 20 x 15mm.On sectioning it is involved by tumour.  One representative section in 1 block.	 PHI:Null
1167	 2972	 E.  Specimen labelled "Right common iliac lymph node" consists of one piece of fatty tissue with one lymph node measuring 15 x 10 x 5mm.  The specimen is BAE 1 block.	 PHI:Null
1167	 3206	 F.  Specimen labelled "Sigmoid appendix" consists of a nodular piece of fatty tissue measuring 45 x 15 x 5mm with a tumour deposit 10 x 10 x 5mm.  One representative section from the appendix with tumour in 1 block.  (PG/mm 18.9.62)	 DATE:18.9.62=>2062-09-18
1167	 3335	 G.  Specimen labelled "Omentum" consists of a piece of omentum, 350 x 250 x 10mm with a tumour deposit measuring 40 x 40 x 20mm.	 PHI:Null
1167	 3456	 Blocks:  1 - one representative section from the tumoral deposit; 2 & 3 - other representative sections.(PG/mm 18.9.62)	 DATE:18.9.62=>2062-09-18
1167	 3496	 MICROSCOPIC (reported by Dr R Shivel):	 DOCTOR:R Shivel
1167	 3790	 A.  Sections show five lymph nodes, three of which are completely replaced by metastatic moderately differentiated serous carcinoma.  Tumour involvement of small vessels in adjacent fat is also noted.  There is also direct spread of tumour from the largest node into extranodal soft tissue.	 PHI:Null
1167	 4869	 B.  A section of the anterior cervix shows high grade serous carcinoma on the serosal and adventitial surface.  No tumour is seen on the adventitial surfaceat the inferior resection margin of the cervix, and the sections of cervix are otherwise unremarkable.  Sections of the endometrium show that this is thin and inactive.  There is a deposit of moderately differentiated serous carcinoma on the serosal surface of the described subserosal leiomyoma, and invading into the leiomyoma.  The myometrium is otherwise unremarkable.  Sections of the left adnexal mass show moderately differentiated serous carcinoma.  This consists of papillary structures, slit-like glands and some more solid sheets of cells.  The tumour cells have large, pleomorphic nuclei and a variable amount of eosinophilic cytoplasm.  Mitoses are frequent.  Tumour involves the serosal surface of the mass.  Tumour is seen involving ovarian tissue and also adnexal soft tissue.  The fallopian tube is not definitely identified on the sections.  Lymphovascular invasion is noted in the adnexal soft tissue.	 PHI:Null
1167	 5075	 C.  Sections show ovary with a moderately differentiated serous carcinoma, similar to specimen B.  There is tumour on the serosal surface of the mass.  The fallopian tube is not identified in the sections.	 PHI:Null
1167	 5213	 D.  Sections show a lymph node which is almost completely replaced by metastatic serous carcinoma.  No extranodal spread is identified.	 PHI:Null
1167	 5269	 E.  Sections show one lymph node.  No tumour is seen.	 PHI:Null
1167	 5557	 F.  Sections show fibrofat with a mesothelial surface.  Within the tissue there is a multicystic mass.  The cysts are lined by plump histiocytes and there are also numerous histiocytes in the adjacent tissue.  The features are most consistent with old fat necrosis.  No tumour is seen.	 PHI:Null
1167	 5753	 G.  Sections of the describedmass confirm a deposit of metastatic moderately differentiated serous carcinoma.  Two other random sections also show small deposits of metastatic serous carcinoma.	 PHI:Null
1167	 5764	 DIAGNOSIS:	 PHI:Null
1167	 5870	 A.  Left inguinal lymph node:  Metastatic serous carcinoma in three nodes (3/5) with extranodal spread.	 PHI:Null
1167	 6039	 B.  Uterus, left ovary and fallopian tube:  Moderately differentiated serous carcinoma involving left adnexa, serosa/adventitia of anterior cervix and uterine serosa.	 PHI:Null
1167	 6112	 C.  Right tube and ovary:  Moderately differentiated serous carcinoma.	 PHI:Null
1167	 6181	 D.  Right inguinal lymph node:  Metastatic serous carcinoma (1/1).	 PHI:Null
1167	 6236	 E.  Right common iliac lymph node:  No tumour (0/1).	 PHI:Null
1167	 6290	 F.  Sigmoid appendix:  Old fat necrosis, no tumour.	 PHI:Null
1167	 6335	 G.  Omentum:  Metastatic serous carcinoma.	 PHI:Null
1168	 24	 Episode No:  84W834682W	 IDNUM:84W834682W
1168	 35	 848834.RVG	 MEDICALRECORD:848834.RVG
1168	 51	 CHUBA, Jerome	 PATIENT:CHUBA, Jerome
1168	 69	 Lab No:  84W83468	 IDNUM:84W83468
1168	 74	 Auld	 STREET:Auld
1168	 103	 COBAR  South Australia  2070	 CITY:COBAR
1168	 103	 COBAR  South Australia  2070	 STATE:South Australia
1168	 103	 COBAR  South Australia  2070	 ZIP:2070
1168	 120	 Specimen: Tissue	 PHI:Null
1168	 137	 D.O.B:  6/1/1990	 DATE:6/1/1990=>1990-06-01
1168	 145	 Sex:  M	 PHI:Null
1168	 171	 Collected: 20/9/2062 at :	 DATE:20/9/2062=>2062-09-20
1168	 203	 Location:  3/9 JENNIE COX CLOSE	 DEPARTMENT:3/9 JENNIE COX CLOSE
1168	 229	 DR WOODROW SYDNEY DEROUIN	 DOCTOR:WOODROW SYDNEY DEROUIN
1168	 255	 Distribution:   FILE-COPY	 PHI:Null
1168	 265	 CLINICAL:	 PHI:Null
1168	 284	 SCC lung Ca RUL.	 PHI:Null
1168	 297	 MACROSCOPIC:	 PHI:Null
1168	 1007	 A.  Specimen labelled "Right upper lobe" consists of a 150g lobectomy, measuring 140 x 65 x 40mm.  At the hilar resection margin, there are two bronchial lymph nodes 30mm and 14mm in maximum dimension.  The larger lymph node is obscuring the bronchial margin.  The bronchial margin is inked green after removing the lymph nodes.  On the cut surfaces, there is a 48 x 38 x 35mm cavitating lesion within the lung parenchyma.  There is a large cavity at the centre of the lesion and pale solid tumour is present at the periphery of the cavity.  The main tumour is 10mm from the bronchial margin after removing the larger lymph node.  The tumour is 2mm from the pleural surface.  The rest of lung is unremarkable.	 PHI:Null
1168	 1312	 Block: 1 - the smaller lymph node at hilar margin, 2 & 3 -  the larger lymph node at hilar margin, 4 - tumour and bronchial resection margin (after removing the lymph nodes); 5 - 8 - tumour and closest pleural surface; 9 - tumour banking; 10 & 11 - representative lungaway from tumour.  (CC/ec  21.9.62)	 DOCTOR:CC
1168	 1312	 Block: 1 - the smaller lymph node at hilar margin, 2 & 3 -  the larger lymph node at hilar margin, 4 - tumour and bronchial resection margin (after removing the lymph nodes); 5 - 8 - tumour and closest pleural surface; 9 - tumour banking; 10 & 11 - representative lungaway from tumour.  (CC/ec  21.9.62)	 DATE:21.9.62=>2062-09-21
1168	 1314	 	 PHI:Null
1168	 1504	 B.  Specimen labelled "(R) paratracheal lymph node" consists of fragments of adipose tissue, 40 x 30 x 10mm in aggregate.  There are three lymph nodes from 5 to 18mm in maximum dimension.	 PHI:Null
1168	 1575	 Blocks:  1 - largest lymph node bisected; 2 - other two lymph nodes.	 PHI:Null
1168	 1761	 C.  Specimen labelled "(R) upper lobe" consists of a bronchial lymph node.  Three fragments of tan tissue from 2 to 14mm in maximum dimension and 14 x 7 x 5mm in aggregate.  AE 1 block.	 PHI:Null
1168	 1855	 D.  Specimen labelled "Hilar lymph node" consists of a 13 x 8 x 7mm lymph node.  BAE 1 block.	 PHI:Null
1168	 2042	 E.  Specimen labelled "Paraoesophageal lymph node" consists of a 10 x 7x 4mm lymph node with a small amount of surrounding fatty tissue.  The lymph node is BAE 1 block.  (NE/mm 21.9.62)	 DOCTOR:NE
1168	 2042	 E.  Specimen labelled "Paraoesophageal lymph node" consists of a 10 x 7x 4mm lymph node with a small amount of surrounding fatty tissue.  The lymph node is BAE 1 block.  (NE/mm 21.9.62)	 DATE:21.9.62=>2062-09-21
1168	 2084	 MICROSCOPIC (Reported by Dr W Wegener):	 DOCTOR:W Wegener
1168	 3225	 A.  Sections of lungshow a poorly differentiated adenosquamous carcinoma with a central cavity, measuring 48mm in diameter.  The carcinoma shows a continuum of histological heterogeneity with both squamous cell and adenocarcinoma differentiation.  45% of tumour shows poorly differentiated large cell carcinoma with solid sheet-like appearance.  20% of tumour shows usual adenocarcinoma appearance with well formed glands and 20% of tumour shows prominent clear cell adenocarcinoma appearance.  15% of tumour shows squamous cell carcinoma appearance with presence of unequivocal keratin and intracellular bridges.  All the tumour cells are strongly positive for CK7.  The squamous cells are positive for CK5/6 and p63.  The stains for CK20 and TTF-1 are negative for all tumour cells.  Lymphovascular invasion is present (block A4) and no perineural invasion is seen.  The tumour is clear of the visceral pleura.  The main tumour mass is 8mm clear of the bronchial resection margin (block A4).  However, the two lymph nodes identified at the hilar resection margin are involved by tumour metastasis.  The rest of lung tissue isunremarkable.	 PHI:Null
1168	 3330	 B.  Three (3) lymph nodes are identified.  One of three lymph nodes is involved by metastatic carcinoma.	 PHI:Null
1168	 3438	 C.  One (1) lymph node is identified.  The lymph node is unremarkable.  There is no evidence of malignancy.	 PHI:Null
1168	 3546	 D.  One (1) lymph node is identified.  The lymph node is unremarkable.  There is no evidence of malignancy.	 PHI:Null
1168	 3660	 E.  Three (3) lymph nodes are identified.  The lymph nodes are unremarkable.  There is no evidence of malignancy.	 PHI:Null
1168	 3692	 Summary - TNM 7th Edition, 2009	 PHI:Null
1168	 3709	 T2     N2     MX	 PHI:Null
1168	 3711	 	 PHI:Null
1168	 3722	 DIAGNOSIS:	 PHI:Null
1168	 3792	 A.  Right upper lobe - Poorly differentiated adenosquamous carcinoma.	 PHI:Null
1168	 3890	 B.  Right paratracheal lymph node - One of three lymph nodes involved by tumour metastasis (1/3).	 PHI:Null
1168	 3946	 C.  Right upper lobe - No evidence of malignancy (0/1).	 PHI:Null
1168	 4002	 D.  Hilar lymph node - No evidence of malignancy (0/1).	 PHI:Null
1168	 4068	 E.  Paraoesophageal lymph node - No evidence of malignancy (0/3).	 PHI:Null
1169	 13	 0554355.JCH	 MEDICALRECORD:0554355.JCH
1169	 29	 MAILLOUX, STEVE	 PATIENT:MAILLOUX, STEVE
1169	 38	 05O43553	 IDNUM:05O43553
1169	 72	 Last edited : 27/9/2062  Page: 2	 DATE:27/9/2062=>2062-09-27
1169	 83	 CLINICAL:	 PHI:Null
1169	 131	 Recurrent colorectal cancer.  Liver resection.	 PHI:Null
1169	 144	 MACROSCOPIC:	 PHI:Null
1169	 710	 Specimen labelled "Right posterior liver resection", consists of a piece of liver measuring 70 x 60 x 30mm. The surgical margin isragged and haemorrhagic.  The serosal surface is dusky and smooth. The surgical margin is inked.  On section, there is a subcapsular white and solid tumour measuring 40 x 25 x 23mm.  It is located 12mm from the surgical margin. The rest of the parenchyma is unremarkable.  Blocks 1-4 - representative sections from the tumour; 5 - 1 representative section of non-tumoral liver; 6 - tissue selected for tissue banking.  (QA/ec 25.9.62)	 DOCTOR:QA
1169	 710	 Specimen labelled "Right posterior liver resection", consists of a piece of liver measuring 70 x 60 x 30mm. The surgical margin isragged and haemorrhagic.  The serosal surface is dusky and smooth. The surgical margin is inked.  On section, there is a subcapsular white and solid tumour measuring 40 x 25 x 23mm.  It is located 12mm from the surgical margin. The rest of the parenchyma is unremarkable.  Blocks 1-4 - representative sections from the tumour; 5 - 1 representative section of non-tumoral liver; 6 - tissue selected for tissue banking.  (QA/ec 25.9.62)	 DATE:25.9.62=>2062-09-25
1169	 751	 MICROSCOPIC: (Reported by Dr B Montane)	 DOCTOR:B Montane
1169	 1319	 The sections show metastatic adenocarcinoma consistent with colorectal adenocarcinoma.  The lesion is about 3mm from the resection margin and reaches close to the liver capsule.  The uninvolved liver shows moderate macrovesicular steatosis and moderate chronic inflammation in the portal tracts.  The tumour cells express CDX2 and keratin 20 antigens by the immunoperoxidase method.  Keratin 7 antigen is expressed in biliary cells and some adjacent hepatocytes but not in the tumour cells. The immunophenotype is consistent with metastatic colorectal adenocarcinoma.	 PHI:Null
1169	 1330	 CONCLUSION	 PHI:Null
1169	 1398	 Liver (right posterior liver resection): Metastatic adenocarcinoma.	 PHI:Null
1170	 24	 Episode No:  63K456699Q	 IDNUM:63K456699Q
1170	 36	 6344566.YXQ	 MEDICALRECORD:6344566.YXQ
1170	 53	 RAUNER, Wesley	 PATIENT:RAUNER, Wesley
1170	 71	 Lab No:  63K45669	 IDNUM:63K45669
1170	 84	 West Bolivar	 STREET:West Bolivar
1170	 110	 WINDSOR  Queensland  5014	 CITY:WINDSOR
1170	 110	 WINDSOR  Queensland  5014	 STATE:Queensland
1170	 110	 WINDSOR  Queensland  5014	 ZIP:5014
1170	 127	 Specimen: Tissue	 PHI:Null
1170	 145	 D.O.B:  30/5/2025	 DATE:30/5/2025=>2025-05-30
1170	 153	 Sex:  M	 PHI:Null
1170	 177	 Collected: Unknown at :	 PHI:Null
1170	 198	 Location:  Peter Mac	 DEPARTMENT:Peter Mac
1170	 224	 DR Keith Wesley LANDKAMER	 DOCTOR:Keith Wesley LANDKAMER
1170	 273	 Distribution:   FILE-COPY,   NSW-CANCER-REGISTRY	 PHI:Null
1170	 283	 CLINICAL:	 PHI:Null
1170	 354	 Leiomyosarcoma excised from sternum 2060.  Chemo x 20cycles post op.	 DATE:2060=>2060
1170	 367	 MACROSCOPIC:	 PHI:Null
1170	 460	 A.  Specimen labelled "Hilar lymph node" consists of a 10 x 7 x 4mm lymph node.  AE 1 block.	 PHI:Null
1170	 558	 B.  Specimen labelled "Subcarinal lymph node" consists of a 15 x 12 x 8mm nodule.  TAE 1 block.	 PHI:Null
1170	 1257	 C.  Specimen labelled "Lower lobe right" consists of a lobectomy 120 x 105 x 85mm and weighing 340g (after formalin infusion).  The pleural surface appears slightly roughened around the bronchial margin but otherwise appear unremarkable.  Sectioning shows a well circumscribed, soft cream/pink tumour 25 x 25 x 21mm.  The tumour is at least 20mm from bronchial resection margin.  Thereis no intrabronchial component.  Focally the tumour abuts a large vessel but there is no intramural involvement.  The tumour shows patchy areas of haemorrhage.  The pleural surfaceappears well clear of tumour and the remaining lung appears unremarkable, there is no evidence of bronchiectasis or mucous plaques.	 PHI:Null
1170	 1491	 Blocks: 1 - bronchial margin; 2 - vascular margins; 3 - full face of tumour and adjacent large vessel; 4 & 5 - paired blocks, tumour; 6 - tumour reserved block for tissue bank; 7 - pleural surface closest to tumour; 8 - random lung.	 PHI:Null
1170	 1669	 D.  Specimen labelled "Pericardial cyst" consists of a bilocular cream/grey cyst 40 x 25 x 6mm with an attached strip of fibrous tissue 75mm in length and up to 5mm in width.	 PHI:Null
1170	 1743	 Blocks: 1 - cyst and roll of fibrous strip; 2 - cyst.   (IP/ta  26/9/62)	 DOCTOR:IP
1170	 1743	 Blocks: 1 - cyst and roll of fibrous strip; 2 - cyst.   (IP/ta  26/9/62)	 DATE:26/9/62=>2062-09-26
1170	 1783	 MICROSCOPIC (reported by Dr Q Fuertes):	 DOCTOR:Q Fuertes
1170	 1827	 A.  The lymph node is negative for tumour.	 PHI:Null
1170	 1870	 B.  The lymph node is negative for tumour.	 PHI:Null
1170	 2155	 C.  Sections show a single 25mm deposit of metastatic leiomyosarcoma. The tumour shows strong positive staining for SMA, desmin and vimentin and all other immunoperoxidase stains (AE1/3, CAM 5.2, HMB45, Melan A, Mic 2, Myogenin and S100) are negative.  There is no vascular invasion.	 PHI:Null
1170	 2361	 The tumour is well circumscribed and is not endobronchial.  The pleura is not involved and the excision margin is well clear of the lesion.  The lung parenchyma away from the tumour shows no abnormality.	 PHI:Null
1170	 2386	 FNCLCC system - grading:	 PHI:Null
1170	 2419	 Tumour differentiation: Score 1.	 PHI:Null
1170	 2451	 Mitoses:   Score 3 (24/10 HPF).	 PHI:Null
1170	 2492	 Tumour necrosis:  Score 0 (no necrosis).	 PHI:Null
1170	 2518	 ie. histological grade 2.	 PHI:Null
1170	 2652	 D.  Sections show a pericardial cyst which has a thin wall of dense fibrous tissue and is lined by focally hyperplastic mesothelium.	 PHI:Null
1170	 2665	 DIAGNOSIS:	 PHI:Null
1170	 2687	 A.  Hilar lymph node:	 PHI:Null
1170	 2729	 -    Lymph node (x1) negative for tumour.	 PHI:Null
1170	 2756	 B.  Subcarinal lymph node:	 PHI:Null
1170	 2798	 -    Lymph node (x1) negative for tumour.	 PHI:Null
1170	 2825	 C.  Right lower lobectomy:	 PHI:Null
1170	 2900	 -    Single deposit metastatic leiomyosarcoma, size 25mm, grade 2 (FNCLCC	 PHI:Null
1170	 2915	 system).	 PHI:Null
1170	 2954	 -    Excision margins clear of tumour.	 PHI:Null
1170	 2976	 D.  Pericardial cyst:	 PHI:Null
1170	 3011	 -    Benign pericardial cyst. (ec)	 PHI:Null
1171	 24	 Episode No:  84B157557B	 IDNUM:84B157557B
1171	 35	 840157.NNT	 MEDICALRECORD:840157.NNT
1171	 53	 Fallert, Grayce	 PATIENT:Fallert, Grayce
1171	 71	 Lab No:  84B15755	 IDNUM:84B15755
1171	 88	 Marjorie Jackson	 STREET:Marjorie Jackso
1171	 107	 BLAYNEY  QLD  2126	 CITY:BLAYNEY
1171	 107	 BLAYNEY  QLD  2126	 STATE:QLD
1171	 107	 BLAYNEY  QLD  2126	 ZIP:2126
1171	 124	 Specimen: Tissue	 PHI:Null
1171	 143	 D.O.B:  12/12/1990	 DATE:12/12/1990=>1990-12-12
1171	 151	 Sex:  F	 PHI:Null
1171	 182	 Collected: 25/07/2012 at 13:05	 TIME:25/07/2012 at 13:05=>2012-07-25T13:05
1171	 263	 Location:  Tissue Pathology and Diagnostic Oncology-WEST COAST DISTRICT HOSPITAL	 DEPARTMENT:Tissue Pathology and Diagnostic Oncology
1171	 263	 Location:  Tissue Pathology and Diagnostic Oncology-WEST COAST DISTRICT HOSPITAL	 HOSPITAL:WEST COAST DISTRICT HOSPITAL
1171	 287	 DR DHIRRI HARRIS Birkes	 DOCTOR:DHIRRI HARRIS Birkes
1171	 336	 Distribution:   FILE-COPY,   NSW-CANCER-REGISTRY	 PHI:Null
1171	 347	 CLINICAL:	 PHI:Null
1171	 505	 Hx of 1.1mm mucosal melanoma in maxilla with (L) partial maxillectomy presented with enlarging (L) neck nodes for L Level 1, II, III and V neck dissection.	 PHI:Null
1171	 518	 MACROSCOPIC:	 PHI:Null
1171	 1274	 A.  Specimen labelled "Left suprapara neck dissection, marking stitch short submental, double stitch level Va" consists of a piece of fatty tissue and muscle with two stitches for orientation, short submental and double stitch level Va.  The specimen measures 140mm in length and 30mm in maximum diameter.  Two lymph nodes are identified in level I measuring 3 and 5mm.  In level 2 a salivary gland is identified, it measures 30 x 20 x 15mm.  No lymph nodes are identified.  In level 3 there are three small lymph nodes measuring 2, 5 and 5mm.  In level 2 and 5 there is a large cystic lymph node measuring 40 x 20 x 10mm.  On sectioning it appears involved by tumour.  Three more lymph nodes are identified in level 5 measuring 3mm in maximum diameter.	 PHI:Null
1171	 1665	 Blocks:  1 - two lymph nodes from level I; 2 - one representative section from the salivary gland; 3 & 4 - rest of adipose tissuefrom level 2; 5 - three lymph nodes from level 3; 6 & 7 - rest of adipose tissue from level 3; 8 - one representative section from the cystic lymph node; 9 - three more lymph nodes from level 5; 10 - tissue selected from the largest lymphnode for tissue bank.	 PHI:Null
1171	 1823	 B.  Specimen labelled "Left facial artery lymph node" consists of a piece of fat tissue,10 x 5 x 5mm and a small nodule 2mm in maximum diameter.  AE 1 block.	 PHI:Null
1171	 1939	 C.  Specimen labelled "External left jugular lymph node" consists of two nodules, 5 and 10mm in maximum diameter.	 PHI:Null
1171	 2010	 Blocks:  1 - bisected lymph node; 2- one lymph node.  (NJ/mm 28.9.62)	 DOCTOR:NJ
1171	 2010	 Blocks:  1 - bisected lymph node; 2- one lymph node.  (NJ/mm 28.9.62)	 DATE:28.9.62=>2062-09-28
1171	 2012	 	 PHI:Null
1171	 2056	 MICROSCOPIC:  (Reported by Dr V Daughtery):	 DOCTOR:V Daughtery
1171	 2697	 A.  The submandibular gland and two (2) level 1 & 2 lymph nodes identified appear normal.  The four (4) level 3 lymph nodes identified are also free of tumour and the piece of parotid gland present appears normal.  The large 40mm node identified at level 2 and 5 is largely replaced by metastatic malignant melanoma which is pleomorphic, lightly pigmented and shows central cystic necrosis.  The involved node appearscompletely excised.  The tumour shows focal perinodal spread for a distance of 0.5mm in the sections.  Five (5) small adjacent lymph nodes are negative for tumour.  A further three (3) normal level 5 nodes are identified.	 PHI:Null
1171	 2743	 .  Sections show one small normal lymph node.	 PHI:Null
1171	 2791	 C.  Sections show two (2) normal lymph nodes.	 PHI:Null
1171	 2802	 DIAGNOSIS:	 PHI:Null
1171	 2847	 A.  Left neck dissection, level 1,2,3 and 5:	 PHI:Null
1171	 2951	 -  Metastatic malignant melanoma in one (1) of thirteen (13) lymph nodes with perinodal infiltration.	 PHI:Null
1171	 2979	 B.  Left facial lymph node:	 PHI:Null
1171	 3021	 -  Lymph node (x1) negative for tumour.	 PHI:Null
1171	 3059	 C.  External left jugular lymph node:	 PHI:Null
1171	 3100	 -  Lymph node (x2) negative for tumour.	 PHI:Null
1171	 3102	 	 PHI:Null
1172	 25	 Episode No:  05T758305M	 IDNUM:05T758305M
1172	 36	 057758.KBP	 MEDICALRECORD:057758.KBP
1172	 52	 Rater, Harley	 PATIENT:Rater, Harley
1172	 70	 Lab No:  05T75830	 IDNUM:05T75830
1172	 79	 N Kaspar	 STREET:N Kaspar
1172	 94	 GOOLWA    6705	 CITY:GOOLWA
1172	 94	 GOOLWA    6705	 ZIP:6705
1172	 111	 Specimen: Tissue	 PHI:Null
1172	 128	 D.O.B:  3/3/1997	 DATE:3/3/1997=>1997-03-03
1172	 136	 Sex:  F	 PHI:Null
1172	 167	 Collected: 25/07/2012 at 19:49	 TIME:25/07/2012 at 19:49=>2012-07-25T19:49
1172	 211	 Location:  Envoi pathology-EXMOUTH HOSPITAL	 DEPARTMENT:Envoi pathology
1172	 211	 Location:  Envoi pathology-EXMOUTH HOSPITAL	 HOSPITAL:EXMOUTH HOSPITAL
1172	 232	 DR Junior Jason DICE	 DOCTOR:Junior Jason DICE
1172	 281	 Distribution:   FILE-COPY,   NSW-CANCER-REGISTRY	 PHI:Null
1172	 291	 CLINICAL:	 PHI:Null
1172	 358	 Lung cancer.  Left lung with AP (illegible) lymph node attached.	 PHI:Null
1172	 371	 MACROSCOPIC:	 PHI:Null
1172	 1486	 A.  Specimen labelled no labelled as to site or nature.  Consists of a left lung measuring 220mm (superior to inferior) x 150 (anterior to posterior) x 100mm (medial to lateral).  In the upper pole there is an area of pleural puckering measuring 50 x 30mm.  The rest of the subpleural surface is unremarkable.  Attached to the hilum there is a large node measuring 30 x 20 x 20mm.  On sectioning of the upper lobe and in the area of pleural puckering there is a well defined soft tan tumour measuring 30 x 30 x 35mm.  A second nodule is identified at the level of the hilum ?lymph node involved by tumour measuring 22 x 15 x 15mm it is located 4mm away from the main tumour.  The main tumour is located 25mm from the hilum margin the second nodular tumour is located 7mm from the surgical margin.  The rest of the parenchyma is unremarkable. The lower lobe is unremarkable.  On sectioning of the nodule attached to the hilum it appears totally replaced bytumour.  A second node is identified measuring 15mm in maximum diameter and it appears to be involved by tumour.  Nine intralobar lymph nodes are identified.	 PHI:Null
1172	 1969	 Blocks: 1 - bronchial surgical margin; 2 - vascular margin; 3 to 5 - tumour; 6 & 7 - a composite of main tumour with second nodule ?metastatic lymph node close to the surgical margin; 8 - non tumoral tissue from the upper lobe; 9 - non tumoral tissue from the lower lobe; 10 to 12 - intralobar lymph nodes; 13 - one representative section from the large nodule attached to the hilum; 14 - one bisected lymph node; 15 - one representative section from the tumour for the tissue bank.	 PHI:Null
1172	 2069	 B.  Specimen labelled "Left hilum node" consists of a lymph node measuring 5mm across.  AE 1 block.	 PHI:Null
1172	 2071	 	 PHI:Null
1172	 2191	 C.  Specimen labelled "Posterior mediastinal node" consists of a lymph node 7mm across.  AE 1 block.  (PG/ta  28/9/62)	 DATE:28/9/62=>2062-09-28
1172	 2193	 	 PHI:Null
1172	 2264	 MICROSCOPIC: (Reported by Dr A Dunkentell/Dr A Royce Cowie - 3.9.2062)	 DOCTOR:A Dunkentell
1172	 2264	 MICROSCOPIC: (Reported by Dr A Dunkentell/Dr A Royce Cowie - 3.9.2062)	 DOCTOR:A Royce Cowie
1172	 2264	 MICROSCOPIC: (Reported by Dr A Dunkentell/Dr A Royce Cowie - 3.9.2062)	 DATE:3.9.2062=>2062-09-03
1172	 2416	 A .  The 35mm left lung tumour is a moderately to poorly differentiated basaloid squamous cell carcinoma. A synoptic report for lung carcinoma follows:	 PHI:Null
1172	 2460	 SYNOPTIC REPORT FOR INVASIVE LUNG CARCINOMA	 PHI:Null
1172	 2492	 Site and laterality: Left lung.	 PHI:Null
1172	 2526	 Specimen type:Left pneumonectomy.	 PHI:Null
1172	 2560	 Tumour location: Left upper lobe.	 PHI:Null
1172	 2582	 Number of tumours: 1.	 PHI:Null
1172	 2616	 Tumour size: 35mm (macroscopic).	 PHI:Null
1172	 2704	 Contiguous spread: Tumour abuts subpleural soft tissue, but does not breach the pleura.	 PHI:Null
1172	 2722	 Bronchialmargin:	 PHI:Null
1172	 2770	 Distance from main tumour: 25mm (macroscopic).	 PHI:Null
1172	 2833	 Distance from involvedlymph node at hilum: 7mm (macroscopic).	 PHI:Null
1172	 2855	 MICROSCOPIC FEATURES	 PHI:Null
1172	 2908	 Histological type: Basaloid squamous cell carcinoma	 PHI:Null
1172	 3161	 Grade: Moderately to poorly differentiated (the tumour consists predominantly of infiltrative nests of basaloid squamous cell surrounding a central area of necrosis. Scattered foci of keratinisation and clear cell change are present within the tumour).	 PHI:Null
1172	 3195	 Vessel invasion: Not identified.	 PHI:Null
1172	 3306	 Visceral pleural invasion: Tumour focally abuts the subpleural fibrous tissue, but does not breach the pleura.	 PHI:Null
1172	 3395	 Bronchial margin: Free of tumour (25mm); note involved lymph node is 7mm to the margin).	 PHI:Null
1172	 3429	 Vascular margin: Free of tumour.	 PHI:Null
1172	 3457	 Contiguous structures: Nil.	 PHI:Null
1172	 3492	 Carcinoma in-situ: Not identified.	 PHI:Null
1172	 3670	 Lymph nodes: Twenty-one lymph nodes sampled (including intra-pulmonary nodes (from main specimen), lefthilum lymph node (specimen B) and posterior mediastinal node (specimen C).	 PHI:Null
1172	 3821	 Intrapulmonary nodes: 3/19 lymph nodes show metastatic carcinoma (one shows possible direct invasion by tumour), no convincing extracapsular spread.	 PHI:Null
1172	 3903	 Left hilum lymph node (specimen B): No evidence of malignancy in one lymph node.	 PHI:Null
1172	 3996	 Posterior mediastinal lymph node (specimen C): No evidence of malignancy in one lymph node.	 PHI:Null
1172	 4478	 Non-neoplastic lung: The adjacent non-neoplastic lung shows patchy carbon pigment deposition, focal emphysematous change and very occasional intra-alveolar hyaline-membranes are seen. Occasional intra-alveolar multinucleated giant cells, some of which are associated with foreign material, are also present. Thereis a wedge shaped area of subpleural fibrosis at the apex, consisting of collapsed alveoli and areas of fibroelastosis, suggestive ofa pulmonary apical cap (block A3).	 PHI:Null
1172	 4524	 pTNM (AJCC 2010) Tumour stage: IIA (pT2N1Mx)	 PHI:Null
1172	 4581	 Representative slides shown to Drs Jamie and Kantarian.	 DOCTOR:Jamie
1172	 4581	 Representative slides shown to Drs Jamie and Kantarian.	 DOCTOR:Kantaria
1172	 4593	 DIAGNOSIS:	 PHI:Null
1172	 4672	 A - C.  Left lung, left hilar lymph node and posterior mediastinal lymph node:	 PHI:Null
1172	 4806	 35mm, pTNM Stage IIA, basaloid squamous cell carcinoma, clear of bronchial and vascular margins, with no convincing breach of pleura.	 PHI:Null
1172	 4937	 Metastatic carcinoma is present in three of nineteen intrapulmonary/hilar lymph nodes (specimen A), including by direct extension.	 PHI:Null
1172	 5023	 The left hilar and posterior mediastinal lymph nodes show no evidence of malignancy.	 PHI:Null
1172	 5025	 	 PHI:Null
1173	 24	 Episode No:  53P778463V	 IDNUM:53P778463V
1173	 35	 535778.LQK	 MEDICALRECORD:535778.LQK
1173	 68	 Nascimento, YOUNG JOSUE Danilo	 PATIENT:Nascimento, YOUNG JOSUE Danilo
1173	 86	 Lab No:  53P77846	 IDNUM:53P77846
1173	 96	 Main Line	 STREET:Main Line
1173	 138	 MOURA  Australian Capital Territory  6910	 CITY:MOURA
1173	 138	 MOURA  Australian Capital Territory  6910	 STATE:Australian Capital Territory
1173	 138	 MOURA  Australian Capital Territory  6910	 ZIP:6910
1173	 155	 Specimen: Tissue	 PHI:Null
1173	 173	 D.O.B:  18/1/1987	 DATE:18/1/1987=>1987-01-18
1173	 181	 Sex:  M	 PHI:Null
1173	 207	 Collected: 27/9/2062 at :	 DATE:27/9/2062=>2062-09-27
1173	 249	 Location:  Pathwest-THE FORENSIC HOSPITAL	 DEPARTMENT:Pathwest
1173	 249	 Location:  Pathwest-THE FORENSIC HOSPITAL	 HOSPITAL:THE FORENSIC HOSPITAL
1173	 277	 DR Alphonse Raleigh PICCONE	 DOCTOR:Alphonse Raleigh PICCONE
1173	 326	 Distribution:   FILE-COPY,   NSW-CANCER-REGISTRY	 PHI:Null
1173	 336	 CLINICAL:	 PHI:Null
1173	 349	 Lung cancer.	 PHI:Null
1173	 428	 Additional information obtained:  Lung lobe not adherent to a parietal pleura.	 PHI:Null
1173	 441	 MACROSCOPIC:	 PHI:Null
1173	 846	 A.  Specimen labelled "Right upper lobe" consists of a right upper lobe measuring 150 x 110 x 55mm.  In the apex of the lobe there is an area of pleural puckering measuring 30 x 20mm.  On sectioning in the area of pleural puckering there is a white ill defined and fleshy tumour measuring 60 x 40 x 35mm.  Tumour comes to within 5mm of the bronchial margin.  The rest of the parenchyma is unremarkable.	 PHI:Null
1173	 1194	 Blocks:1 - bronchial and brachial resection margin; 2- hilar lymph node; 3 to 5 - tumour; 6 - tumour with normal lung; 7 - one representative section from normal lung; 8 to 10 - interlobular lymph nodes; 11 - interlobular lymph node; 12 - tissue for tissue bank; reselect blocks 13-16 -representative sections of the tumour close to the pleura.	 PHI:Null
1173	 1422	 B.  Specimen labelled "Paratracheal lymph node" consists of a piece of fatty tissue, 50 x 20 x 10mm with a lymph node, 15 x 10 x 10mm.  On sectioning the lymph node is black and friable.  Four more lymph nodes are identified.	 PHI:Null
1173	 1529	 Blocks:  1 & 2 - largest lymph node; 3 - three lymph nodes; 4 - one bisected lymph node.  (JU/mm 28.9.62)	 DOCTOR:JU
1173	 1529	 Blocks:  1 & 2 - largest lymph node; 3 - three lymph nodes; 4 - one bisected lymph node.  (JU/mm 28.9.62)	 DATE:28.9.62=>2062-09-28
1173	 1571	 MICROSCOPIC (reported by Dr O Broussard):	 DOCTOR:O Broussard
1173	 2288	 A.  Sections show a moderately differentiated adenocarcinoma of the right upper lobe.  The tumour measures approximately 60mm across and comes to within 4mm of the bronchial and vascular resection margins at the hilum.  Tumour is seen to completely fill the lumen of a large bronchial artery and tumour can also been seen in occasional veins.  No definite invasion of the elastic layer of the pleura is seen and no tumour is seen on the surface of the visceral pleura.  Focally carcinoma is present in areas in which the pleura is ragged and appears stripped from the lung.  The fourteen (14) lymph nodes identified show no evidence of malignancy.  The remaining lung parenchyma shows scattered emphysematous change.	 PHI:Null
1173	 2360	 B.  The five (5) lymph nodes identified show no evidence of malignancy.	 PHI:Null
1173	 2371	 DIAGNOSIS:	 PHI:Null
1173	 2426	 A & B.  Right upper lobe and paratracheal lymph nodes:	 PHI:Null
1173	 2494	 - Moderately differentiated adenocarcinoma, size approximately 60mm	 PHI:Null
1173	 2533	 - Arterial and venous invasion present	 PHI:Null
1173	 2587	 - Very close bronchial and vascular resection margins	 PHI:Null
1173	 2624	 - No definite pleural invasion (PL0)	 PHI:Null
1173	 2661	 - Nineteen (19) negative lymph nodes	 PHI:Null
1173	 2677	 - Stage: T2bN0.	 PHI:Null
1173	 2707	 ADDITIONAL REPORT (10/11/62):	 DATE:10/11/62=>2062-10-11
1173	 2801	 TARGETED EGFR MUTATION DETECTION, SPRINGWOOD HOSPITAL's Hospital, reported by Dr O Kosofsky.	 HOSPITAL:SPRINGWOOD HOSPITAL
1173	 2801	 TARGETED EGFR MUTATION DETECTION, SPRINGWOOD HOSPITAL's Hospital, reported by Dr O Kosofsky.	 DOCTOR:O Kosofsky
1173	 2817	 "TUMOUR SAMPLE:	 PHI:Null
1173	 2847	 Date of collection: 27/9/2062	 DATE:27/9/2062=>2062-09-27
1173	 2872	 Date Received: 10/5/2062	 DATE:10/5/2062=>2062-10-05
1173	 2936	 Specimen Received: I x FFPE block labelled 53P77846 A5 Weikert	 IDNUM:53P77846
1173	 2936	 Specimen Received: I x FFPE block labelled 53P77846 A5 Weikert	 PATIENT:Weikert
1173	 2982	 Nature of specimen: Resected Tumour from Lung	 PHI:Null
1173	 3033	 Clinical History: Adenocarcinoma Right Lung, T2bN0	 PHI:Null
1173	 3085	 Slide examined by Dr O Nusz (FRCPA) Date: 10/8/2062	 DOCTOR:O Nusz
1173	 3085	 Slide examined by Dr O Nusz (FRCPA) Date: 10/8/2062	 DATE:10/8/2062=>2062-10-08
1173	 3124	 Microscopic Diagnosis: Adenocarcinoma	 PHI:Null
1173	 3241	 Proportion of malignant cells as% of all viable cells within marked area on slide: 40% Macro-Dissection Required Yes	 PHI:Null
1173	 3262	 EGFR MUTATION TEST:	 PHI:Null
1173	 3286	 Date Tested: 10/10/2062	 DATE:10/10/2062=>2062-10-10
1173	 3294	 RESULT:	 PHI:Null
1173	 3368	 Targeted EGFR mutation analysis on DNA extracted from FFPE tumour tissue:	 PHI:Null
1173	 3377	 NEGATIVE	 PHI:Null
1173	 3399	 MUTATION NOT DETECTED	 PHI:Null
1173	 3416	 Interpretation:	 PHI:Null
1173	 3596	 The tumour sample from Kieran LAMAR CLYDE Moriarty DOES NOT CARRY a mutation of clinical significancein the regions of the EGFR gene targeted in this analysis (see comment below).	 PATIENT:Kieran LAMAR CLYDE Moriarty
1173	 3604	 METHOD:	 PHI:Null
1173	 3698	 * DNA was extracted from FFPE tumour tissue using the Roche cobas DNA Sample Preparation kit.	 PHI:Null
1173	 3818	 * The presence of EGFR gene mutations was analyzed using the Roche cobos 4800 EGFR Mutation Test kit (ARTG Id: 535778).	 IDNUM:535778
1173	 3828	 COMMENTS:	 PHI:Null
1173	 3973	 *This testdoes not diagnose cancer. It is intended as an adjunct to other prognostic and predictive factors to aid clinical treatment decisions.	 PHI:Null
1173	 4287	 The cobas EGFR Mutation Test detects 41 common mutations in exons 18 to 21 of the EGFR gene, but may not specify the EGFR gene mutation detected (a list of EGFR mutations detected is available from our laboratory). Other mutations, either in the EGFR gene or in other genes, will not be detected by this analysis.	 PHI:Null
1173	 4561	 * This test hasbeen shown in our laboratory to detect at least 5% mutant EGFR alleles in a background of normal DNA. Therefore a negative result should be interpreted with caution, as it does not exclude the presence of low levels of a clinically significant EGFR mutation.	 PHI:Null
1173	 4924	 * The analytical sensitivity and specificity of this test are 98.5% and 98.8%, respectively (determined by manufacturer). PCR inhibitors or rare mutations affecting the binding sites of PCR primers and/or probesused in this assay may cause a false negative result * This test has been processed as a Level 1 genetic test according to the NPAAC guidelines (2007).	 PHI:Null
1173	 5042	 * This test is not currently covered by our NATA scope of accreditationand results should be interpreted accordingly"	 PHI:Null
1174	 24	 Episode No:  27Y518763Q	 IDNUM:27Y518763Q
1174	 36	 2795187.SJQ	 MEDICALRECORD:2795187.SJQ
1174	 57	 Dickow, GAIL JAMIE	 PATIENT:Dickow, GAIL JAMIE
1174	 75	 Lab No:  27Y51876	 IDNUM:27Y51876
1174	 84	 Wokindon	 STREET:Wokindo
1174	 107	 DENMAN  Tasmania  4383	 CITY:DENMAN
1174	 107	 DENMAN  Tasmania  4383	 STATE:Tasmania
1174	 107	 DENMAN  Tasmania  4383	 ZIP:4383
1174	 124	 Specimen: Tissue	 PHI:Null
1174	 142	 D.O.B:  27/6/1992	 DATE:27/6/1992=>1992-06-27
1174	 150	 Sex:  M	 PHI:Null
1174	 176	 Collected: 28/9/2062 at :	 DATE:28/9/2062=>2062-09-28
1174	 243	 Location:  MEDIC/SURGERY WARD-WEST WIMMERA HEALTH SERVICE - KANIVA	 DEPARTMENT:MEDIC/SURGERY WARD
1174	 243	 Location:  MEDIC/SURGERY WARD-WEST WIMMERA HEALTH SERVICE - KANIVA	 HOSPITAL:WEST WIMMERA HEALTH SERVICE - KANIVA
1174	 267	 DR Quade Edison Jenness	 DOCTOR:Quade Edison Jenness
1174	 316	 Distribution:   FILE-COPY,   NSW-CANCER-REGISTRY	 PHI:Null
1174	 327	 CLINICAL:	 PHI:Null
1174	 419	 (L) renal lesion, RCC.  (L) kidney.  Intrarenal small left renal mass previously biopsied.	 PHI:Null
1174	 432	 MACROSCOPIC:	 PHI:Null
1174	 614	 A.  Specimen labelled "Left renal lesion", consists of a ragged piece of tissue 35 x 20 x 15mm containing a 12mm well circumscribed nodule with a golden, haemorrhagic cut surface.	 PHI:Null
1174	 741	 Blocks:  1 - 1 TS for FS; 2-4 - tumour and adjacent kidney; 5 - non-tumoral kidney; 6 - reserved block for tissue banking.	 PHI:Null
1174	 766	 FROZEN SECTION REPORT:	 PHI:Null
1174	 789	 Clear cell carcinoma.	 PHI:Null
1174	 857	 Phone result to Anaesthetist byDr H Mounger at 13:12pm on 26.7.12.	 DOCTOR:H Mounger
1174	 857	 Phone result to Anaesthetist byDr H Mounger at 13:12pm on 26.7.12.	 TIME:at 13:12pm on 26.7.12=>2012-07-26T13:12
1174	 1070	 B.  Specimen labelled "Upper margin of tumour left kidney", consists of six pieces of irregularly shaped and distorted tan brownish tissue fragments ranging between 3-15mm in greatest dimension.  AE 2 blocks.	 PHI:Null
1174	 1225	 C.  Specimen labelled "Cyst wall",consists of a piece of tan grey membranous tissue with attached fat 13 x 10 x up to 2mm.  TAE 1 block. (LV/ec  29.9.62)	 DOCTOR:LV
1174	 1225	 C.  Specimen labelled "Cyst wall",consists of a piece of tan grey membranous tissue with attached fat 13 x 10 x up to 2mm.  TAE 1 block. (LV/ec  29.9.62)	 DATE:29.9.62=>2062-09-29
1174	 1267	 MICROSCOPIC: (Reported by Dr H Durisseau)	 DOCTOR:H Durisseau
1174	 1751	 A.  Sections show a subcapsular renal cell carcinoma, clear cell type.  The tumour measures approximately 12mm in size and the nuclei show features of Fuhrman grade 2.  The tumour has a uniform appearance although many of the cells have acidophilic inclusions.  There is a fibrous capsule of variable thickness which focally is deficient and tumour protrudes through the deficient capsule.  The adjacent kidney shows no significant abnormality and there is no extracapsular spread.	 PHI:Null
1174	 1829	 B.  Sections show fragments of renal parenchyma.  There is no tumour present.	 PHI:Null
1174	 1961	 C.  The "cyst wall" consists of renal cortex, capsule, perirenal fat and part of a fibromuscular wall.  There is no tumour present.	 PHI:Null
1174	 1972	 DIAGNOSIS:	 PHI:Null
1174	 2044	 A, B & C.  Left renal lesion plus upper margin of tumour and cyst wall:	 PHI:Null
1174	 2113	 - Renal cell carcinoma, clear cell type, size 12mm, Fuhrman grade 2;	 PHI:Null
1174	 2144	 - Excision margins - see text.	 PHI:Null
1174	 2200	 ADDITIONAL REPORT (reported by Dr H Woodfolk, 10/10/62)	 DOCTOR:H Woodfolk
1174	 2200	 ADDITIONAL REPORT (reported by Dr H Woodfolk, 10/10/62)	 DATE:10/10/62=>2062-10-10
1174	 2279	 The slides were reviewed with A/Prof SHARLA Carrithers and Dr Janyce Meshanko.	 DOCTOR:SHARLA Carrithers
1174	 2279	 The slides were reviewed with A/Prof SHARLA Carrithers and Dr Janyce Meshanko.	 DOCTOR:Janyce Meshanko
1174	 2505	 Where tumour is seen on the edge of the section, there is no surgical crush artefact or ink to suggest the presence of a true surgical margin. This is likely to be related to be an incision made at the time of frozen section.	 PHI:Null
1174	 2662	 Tumour is seen at 0.2mm from the nearest inked renal parenchymal margin, and is separated from this margin by a thin fibrous capsule surrounding the tumour.	 PHI:Null
1174	 2691	 Leibovich Score: 0 out of 11	 PHI:Null
1174	 2702	 DIAGNOSIS:	 PHI:Null
1174	 2724	 A. Left renal lesion:	 PHI:Null
1174	 2793	 - Renal cell carcinoma, clear cell type, size 12mm, Fuhrman grade 2;	 PHI:Null
1174	 2851	 - 0.2 mm from the nearest inked renal parenchymal margin.	 PHI:Null
1174	 2939	 B. Upper margin of tumour left kidney: renal parenchyma with no evidence of malignancy.	 PHI:Null
1174	 2978	 C.Cyst wall: no evidence of malignancy	 PHI:Null
1175	 25	 Episode No:  48Q219621B	 IDNUM:48Q219621B
1175	 37	 4862196.GEB	 MEDICALRECORD:4862196.GEB
1175	 61	 MORREALE, NORA Melvin	 PATIENT:MORREALE, NORA Melvi
1175	 79	 Lab No:  48Q21962	 IDNUM:48Q21962
1175	 88	 N Cumnor	 STREET:N Cumnor
1175	 128	 COONABARABRAN  Northern Territory  4505	 CITY:COONABARABRAN
1175	 128	 COONABARABRAN  Northern Territory  4505	 STATE:Northern Territory
1175	 128	 COONABARABRAN  Northern Territory  4505	 ZIP:4505
1175	 145	 Specimen: Tissue	 PHI:Null
1175	 163	 D.O.B:  21/9/2002	 DATE:21/9/2002=>2002-09-21
1175	 171	 Sex:  F	 PHI:Null
1175	 202	 Collected: 26/07/2012 at 11:59	 TIME:26/07/2012 at 11:59=>2012-07-26T11:59
1175	 245	 Location:  West-TALLANGATTA HEALTH SERVICE	 DEPARTMENT:West
1175	 245	 Location:  West-TALLANGATTA HEALTH SERVICE	 HOSPITAL:TALLANGATTA HEALTH SERVICE
1175	 260	 DR JERE GUEITS	 DOCTOR:JERE GUEITS
1175	 309	 Distribution:   FILE-COPY,   NSW-CANCER-REGISTRY	 PHI:Null
1175	 319	 CLINICAL:	 PHI:Null
1175	 422	 Hx of recurrent leiomyosarcoma with R lower back mass.  FNA showed spindle cell lesion for excision.	 PHI:Null
1175	 443	 R lower back mass.	 PHI:Null
1175	 456	 MACROSCOPIC:	 PHI:Null
1175	 1443	 Specimen labelled "Lower back sarcoma short superior, long lateral" consists of a piece of fibrofatty tissue with two marking sutures (short superior, long lateral) measuring 70mm (medial to lateral), 68mm (superior to inferior) and 37mm (superficial to deep), weighing 54g.  A vertical ellipse of unremarkable skin is present 60 x 12mm.  The lateral aspect of superficial margin inked green, the medial superficial margin inked blue with the deep margin inked black.  The specimen is sequentially sectioned from superior to inferior to reveal a wellcircumscribed firm cream off white tumour measuring 30mm (medial to lateral), 37mm (superior to inferior) and 28mm (superficial to deep).  The tumour has a solid cut surface with patchy areas of haemorrhage.  The tumour focally abuts the deep margin.  It is 2mm from the medial superficial margin, 6mm from lateral superficial margin,5mm from the inferior margin and is well clear of superior margin.  No other lesions are identified.	 PHI:Null
1175	 1686	 Blocks: 1 - superior margin; 2 - tumour and inferior margin; 3 - tumour and medial/superficial margin; 4 - tumour with overlying skin and closest lateralmargin; 5 & 6 - tumour deep margin; 7 - tumour random; 8 - reserve block for tissue bank.	 PHI:Null
1175	 1703	 (KJ/ta 29/9/62)	 DATE:29/9/62=>2062-09-29
1175	 1745	 MICROSCOPIC (reported by A/Prof M Adair):	 DOCTOR:M Adair
1175	 2128	 The sections show a circumscribed malignant spindle cell tumour, bounded by a thin fibrous capsule. The tumour measures 37mm in maximum diameter (macroscopic measurement) and is composed of fasciclesof spindle cells with nuclear pleomorphism and coarse chromatin admixed with large pleomorphic cells with prominent nucleoli. Numerous abnormal mitoses are seen (up to 11 per 10 hpr).	 PHI:Null
1175	 2202	 Focal necrosisis also present, possibly relating to previous FNA biopsy.	 PHI:Null
1175	 2273	 The tumoral cells show positive cytoplasmic stain for SMA and Desmin.	 PHI:Null
1175	 2330	 The Ki67 proliferation index is approximately 25 - 30%.	 PHI:Null
1175	 2413	 The surrounding fibroadipose tissue and the skin show nosignificant abnormality.	 PHI:Null
1175	 2421	 Margins	 PHI:Null
1175	 2442	 -Deep margin: 0.22mm	 PHI:Null
1175	 2466	 -Inferior margin: 2.2mm	 PHI:Null
1175	 2502	 -Medial/superficial margin:  5.5mm	 PHI:Null
1175	 2524	 -Lateral margin: 10mm	 PHI:Null
1175	 2555	 -Superior margin: Well clear.	 PHI:Null
1175	 2682	 The microscopic features and immunohistochemical profile are consistent with the clinical history of recurrent leiomyosarcoma.	 PHI:Null
1175	 2693	 DIAGNOSIS:	 PHI:Null
1175	 2721	 LOWER BACK. LEIOMYOSARCOMA.	 PHI:Null
1176	 24	 Episode No:  06M240780K	 IDNUM:06M240780K
1176	 35	 064240.TVA	 MEDICALRECORD:064240.TVA
1176	 53	 Farfalla, JESUS	 PATIENT:Farfalla, JESUS
1176	 71	 Lab No:  06M24078	 IDNUM:06M24078
1176	 78	 Cernan	 STREET:Cerna
1176	 115	 GOONDIWINDI  Western Australia  6997	 CITY:GOONDIWINDI
1176	 115	 GOONDIWINDI  Western Australia  6997	 STATE:Western Australia
1176	 115	 GOONDIWINDI  Western Australia  6997	 ZIP:6997
1176	 132	 Specimen: Tissue	 PHI:Null
1176	 150	 D.O.B:  9/11/1994	 DATE:9/11/1994=>1994-11-09
1176	 158	 Sex:  M	 PHI:Null
1176	 189	 Collected: 01/08/2012 at 19:33	 TIME:01/08/2012 at 19:33=>2012-08-01T19:33
1176	 237	 Location:  CORONARYCARE UNIT-TOTTENHAM HOSPITAL	 DEPARTMENT:CORONARYCARE UNIT
1176	 237	 Location:  CORONARYCARE UNIT-TOTTENHAM HOSPITAL	 HOSPITAL:TOTTENHAM HOSPITAL
1176	 261	 DR Birrunga BRAD OMLAND	 DOCTOR:Birrunga BRAD OMLAND
1176	 310	 Distribution:   FILE-COPY,   NSW-CANCER-REGISTRY	 PHI:Null
1176	 320	 CLINICAL:	 PHI:Null
1176	 335	 Lung cancer.	 PHI:Null
1176	 348	 MACROSCOPIC:	 PHI:Null
1176	 544	 A.  Specimen labelled "Paratracheal lymph node", consists of a piece of fat tissue 30 x 25 x 10mm.  Four black lymph nodes measuring from 5-20mm.  Block 1 - three lymph nodes; 2 - one lymph node.	 PHI:Null
1176	 1194	 B.  Specimen labelled "Right upper lobe lung", consists of a right upper lobe measuring 30mm medial to lateral, 150mm anterior to posterior and 160mm superior to inferior.  In the lateral and superior aspect of the specimen there is an area of pleural puckering measuring 20 x 15mm.  The rest of the serosal surface is dusky.  On sectioning and in the area of pleural puckering there is a well circumscribed grey/ black and solid tumour 15 x 15 x 20mm.  It is located 50mm away from the bronchial margin.  The rest of the parenchyma is unremarkable.  A small area with subpleural bullae measuring 30 x 10 x 19mm.  Representative sections as follows:	 PHI:Null
1176	 1407	 Block 1 - bronchial margin; 2 - vascular margin; 3 - one hilar lymph node; 4-6 - tumour AE; 8 - representative sections from the subpleural bulla; 9 - normal lung;10 - one intralobar lymph node.  (IJ/ec 5.10.62)	 DOCTOR:IJ
1176	 1407	 Block 1 - bronchial margin; 2 - vascular margin; 3 - one hilar lymph node; 4-6 - tumour AE; 8 - representative sections from the subpleural bulla; 9 - normal lung;10 - one intralobar lymph node.  (IJ/ec 5.10.62)	 DATE:5.10.62=>2062-10-05
1176	 1450	 MICROSCOPIC (Reported by A/Prof A Saeler):	 DOCTOR:A Saeler
1176	 1588	 A.There is no evidence of malignancy in 4 lymph nodes. The nodes show nodular fibrosis and pigment deposition, consistent with silicosis.	 PHI:Null
1176	 1955	 B. The sections of lung show a moderately differentiated adenocarcinoma with a lepidic growthpattern and focal interstitial invasion. Within the centre of the tumour there is an area of consolidation and invasion, measuring approximately 12mm in diameter. Around this focus there is subtle, diffuse lepidic growth of tumour over a total area of approximately 25mm.	 PHI:Null
1176	 2118	 The carcinoma shows lepidic growth beneath the visceral pleura but no definite invasion through the viscera pleura is identified. An elastic stain is in progress.	 PHI:Null
1176	 2185	 The bronchial and vascular margins show no evidence of malignancy.	 PHI:Null
1176	 2247	 The further hilar lymph node shows no evidence of malignancy.	 PHI:Null
1176	 2258	 SUMMARY:	 PHI:Null
1176	 2344	 Histological type: Adenocarcinoma with lepidic growth pattern and areas of invasion.	 PHI:Null
1176	 2390	 Histological grade: Moderately differentiated	 PHI:Null
1176	 2600	 Visceral pleural invasion: Not seen. The tumour grows in close proximity to the visceral pleural surface, however, no definite involvement of the visceral pleura is identified. An elastic stain is in progress.	 PHI:Null
1176	 2627	 Vessel invasion: Not seen.	 PHI:Null
1176	 2659	 Bronchial margin: Not involved.	 PHI:Null
1176	 2689	 Vascular margin: Not involved	 PHI:Null
1176	 2741	 Contiguous structures: Parietal pleura not involved	 PHI:Null
1176	 2794	 Carcinoma in-situ: Not seen within bronchial mucosa.	 PHI:Null
1176	 2807	 Lymph nodes:	 PHI:Null
1176	 2838	 Paratracheal: 0/4 (Specimen A)	 PHI:Null
1176	 2862	 Hilar: 0/1 (Specimen B)	 PHI:Null
1176	 2943	 Non-neoplastic lung: Fibrosis and pigment deposition, consistent with silicosis.	 PHI:Null
1176	 2987	 Numerous emphysematous bullae are present.	 PHI:Null
1177	 12	 271830.QJV	 MEDICALRECORD:271830.QJV
1177	 32	 Takayama, Tomas ZOE	 PATIENT:Takayama, Tomas ZOE
1177	 50	 27D83063,27D83063	 IDNUM:27D83063
1177	 50	 27D83063,27D83063	 IDNUM:27D83063
1177	 84	 Last edited : 8/10/2062  Page: 2	 DATE:8/10/2062=>2062-10-08
1177	 94	 CLINICAL:	 PHI:Null
1177	 130	 Endometrial cancer on curettings.	 PHI:Null
1177	 143	 MACROSCOPIC:	 PHI:Null
1177	 1021	 Specimen labelled "Uterus, cervix bilateral tubes + ovaries" consists of a uterus with attached bilateral fallopian tubes and ovaries weighing 70g in total.  The uterus comprises of corpus and cervix measuring 78mm in length, 55mm in width and 40mm from anterior to posterior.  The serosa surface is smooth and shiny.  The ectocervix measures 28mm in diameter and has an unremarkable surface.  On sectioning, the endometrium appears to be thickened measuring up to 5mm in thickness.  The myometrium measures 20mm in maximal thickness.  Foci of adenomyosis are present.  The right fallopian tube measures 55mm in length and 5mm in diameter.  The right ovary is 23 x 15 x 12mm.  The right tube and ovary are unremarkable.  The left fallopian tube measures 58mm in length and up to 8mm in diameter.   The left ovary is 22 x 16 x 10mm.  Both left tube and ovary are unremarkable.	 PHI:Null
1177	 1447	 Blocks: 1 to 3 - full LS of anterior body and cervix; 4 to 7 - full LS of posterior and cervix; 8 - reserve block, tumour bank; 9 - representative sections right fallopian tube; 10 - representative section right ovary; 11 - representative section left fallopian tube; 12 - representative section left ovary; reselect blocks 13-24 - more sections of the uterus including all of the remaining endometrium.    (XP/ta 4/10/62)	 DOCTOR:XP
1177	 1447	 Blocks: 1 to 3 - full LS of anterior body and cervix; 4 to 7 - full LS of posterior and cervix; 8 - reserve block, tumour bank; 9 - representative sections right fallopian tube; 10 - representative section right ovary; 11 - representative section left fallopian tube; 12 - representative section left ovary; reselect blocks 13-24 - more sections of the uterus including all of the remaining endometrium.    (XP/ta 4/10/62)	 DATE:4/10/62=>2062-10-04
1177	 1487	 MICROSCOPIC (Reported by Dr F Dennard):	 DOCTOR:F Dennard
1177	 2036	 Sections of uterus show features of complex endometrial hyperplasia with atypia.  There is complex glandular formations and increased gland to stroma ratio.  Cytological atypia is present.  No definite foci of endometrioid adenocarcinoma are seen.  No invasion of myometrium is seen.  There is no evidence of lymphovascular invasion.  Benign adenomyosis is present in the background.  The cervix is unremarkable.  The serosa is unremarkable.  The lesion is completely excised.  Both fallopian tubes are unremarkable.  Both ovaries are unremarkable.	 PHI:Null
1177	 2085	 Representative slides are shown to Dr F Chaisty.	 DOCTOR:F Chaisty
1177	 2096	 DIAGNOSIS:	 PHI:Null
1177	 2150	 Uterus - Complex endometrial hyperplasia with atypia.	 PHI:Null
1177	 2187	 Cervix - No significant abnormality.	 PHI:Null
1178	 25	 Episode No:  75A861696D	 IDNUM:75A861696D
1178	 37	 7508616.ZRD	 MEDICALRECORD:7508616.ZRD
1178	 56	 Stapelton, Orval	 PATIENT:Stapelton, Orval
1178	 74	 Lab No:  75A86169	 IDNUM:75A86169
1178	 87	 Prairie Hill	 STREET:Prairie Hill
1178	 123	 DEVONPORT  Northern Territory  2879	 CITY:DEVONPORT
1178	 123	 DEVONPORT  Northern Territory  2879	 STATE:Northern Territory
1178	 123	 DEVONPORT  Northern Territory  2879	 ZIP:2879
1178	 140	 Specimen: Tissue	 PHI:Null
1178	 157	 D.O.B:  7/2/2005	 DATE:7/2/2005=>2005-07-02
1178	 165	 Sex:  M	 PHI:Null
1178	 191	 Collected: 10/3/2062 at :	 DATE:10/3/2062=>2062-10-03
1178	 260	 Location:  STGEORGE PRIVATE-HUNTER NEW ENGLAND MENTAL HEALTH SERVICE	 DEPARTMENT:STGEORGE PRIVATE
1178	 260	 Location:  STGEORGE PRIVATE-HUNTER NEW ENGLAND MENTAL HEALTH SERVICE	 HOSPITAL:HUNTER NEW ENGLAND MENTAL HEALTH SERVICE
1178	 286	 DR LEMUEL ULYSSES Fansler	 DOCTOR:LEMUEL ULYSSES Fansler
1178	 312	 Distribution:   FILE-COPY	 PHI:Null
1178	 322	 CLINICAL:	 PHI:Null
1178	 410	 Segment 5 liver resection.  HCC.  Hep C.  Segment 5 liver resection + cholecystectomy.	 PHI:Null
1178	 423	 MACROSCOPIC:	 PHI:Null
1178	 1044	 A.   Specimen labelled "Segment 5 liver tissue", consists of a cone shaped piece of liver 50 x 55 x 55mm.  The serosal surface has an area of puckering 10 x 10mm. The surgical margin is inked.  On sectioning there is a well defined yellow and fleshy tumour measuring 15 x 19 x 25mm.  It is located 10mm from the surgical margin. The rest of the parenchyma is unremarkable.  Block 1 - 1 representative section of the tumour with surgical margin; 2 - 1 representative section of tumour close to the capsule; 3 - representative tumour; 4 - representative tumour; 5 - tumour selected for tissue bank; 6 - liver other areas.	 PHI:Null
1178	 1450	 B.  Specimen labelled "Gallbladder", consists of a gallbladder 80 x 35 x 30mm.  The external surface is green and shiny. The cystic duct lymph node is present measuring 5mm in maximum diameter. The mucosal surface is green and velvety. The wall has a maximum thickness of 2mm.  No gallstones are identified.  Block 1 -1TS of neck and cystic duct lymph node; 2 - 1TS body; 3 - 1LS fundus.  (PG/ec 10.5.62)	 DATE:10.5.62=>2062-10-05
1178	 1494	 MICROSCOPIC (reported by A/Prof U Direnzo):	 DOCTOR:U Direnzo
1178	 2056	 A. Section of the liver show a hepatocellular carcinoma arising in a background of established cirrhosis. The tumour is 25mm in maximum diameter (macroscopic measurement) and is composed of nodulesof highly atypical hepatocytes separated by thick fibrous bands. The tumoral cells are arranged in a trabecular and acinar pattern, and show moderate variation in nuclear size and shape with prominent nucleoli. Numerous trabeculae are more than three cells thick and have irregular edges. Large cytoplasmic eosinophilic globules are present in many tumour cells.	 PHI:Null
1178	 2082	 Mitotic figures are rare.	 PHI:Null
1178	 2170	 Lymphovascular invasion is present at the interface between tumour and adjacent liver.	 PHI:Null
1178	 2479	 Immunohistochemistry:  CD34 is positive in endothelial cells lining sinusoids within the tumour. CK 7 is focally positive in tumoral cells, mainly within areas which have a foetal-liver like appearance. Alpha1 antitrypsin is positive in cytoplasmic granules. CEA and CD10 show a positive canalicular patter.	 PHI:Null
1178	 2525	 The Ki67 proliferation index is less than 5%.	 PHI:Null
1178	 2572	 The surgical margins area well clear of tumor.	 PHI:Null
1178	 2772	 B. The gallbladder shows focal thickening of the wall due to mild muscle hypertrophy.  Focal Rokitansky Aschoff sinus formation is present.  The appearance is consistent with chronic cholecystitis.	 PHI:Null
1178	 2821	 There is no evidence of dysplasia or malignancy.	 PHI:Null
1178	 2831	 DIAGNOSIS	 PHI:Null
1178	 2860	 A. SEGMENT FIVE LIVERLESION.	 PHI:Null
1178	 2914	 -MODERATELLY DIFFERENTIATED HEPATOCELLULAR CARCINOMA.	 PHI:Null
1178	 2925	 -CIRRHOSIS	 PHI:Null
1178	 2941	 B. GALLBLADER.	 PHI:Null
1178	 2965	 - CHRONIC CHOLECYSTITIS	 PHI:Null
1178	 2967	 	 PHI:Null
1179	 12	 966562.PNM	 MEDICALRECORD:966562.PNM
1179	 25	 Hasty, QUADE	 PATIENT:Hasty, QUADE
1179	 34	 96R56255	 IDNUM:96R56255
1179	 69	 Last edited : 10/12/2062  Page: 2	 DATE:10/12/2062=>2062-10-12
1179	 79	 CLINICAL:	 PHI:Null
1179	 248	 Anterior scalp lesion - likely SCC.  Anterior scalp SCC. Diathermy into tumour however developed a macroscopic clear plane deep to tumour. Deep tissue sent separately.	 PHI:Null
1179	 261	 MACROSCOPIC:	 PHI:Null
1179	 668	 A.  Specimen labelled "SCC scalp staple at 12", consists of a oval shaped piece of skin with one staple 12 o'clock. It measures 85mm 12-6 o'clock, 65mm 3-9 o'clock and 10mm in maximum diameter. On the surface of the skin there is a ulcerated lesion 50mm from 12-6 o'clock and 30mm from 3-9 o'clock. It is located 20mm from the closest margin (6 o'clock margin). Specimen inked blue 3 o'clock margin, black	 PHI:Null
1179	 802	 9 o'clock margin.  Block 1 - 1LS 12 o'clock margin; 2 - 1LS 6 o'clock margin; 3-5 - 3TS lesion; 6 - tissue selected fortissue bank.	 PHI:Null
1179	 937	 B.  Specimen labelled "Deep margin from scalp", consists of a strip of fibrofatty tissue 15 x 3 x 2mm.  AE 1 block.  (KL/ec 10.10.62)	 DOCTOR:KL
1179	 937	 B.  Specimen labelled "Deep margin from scalp", consists of a strip of fibrofatty tissue 15 x 3 x 2mm.  AE 1 block.  (KL/ec 10.10.62)	 DATE:10.10.62=>2062-10-10
1179	 977	 MICROSCOPIC (reported by Dr Z Feauto):	 DOCTOR:Z Feauto
1179	 1370	 A.  Sections show an extensively infiltrative moderately differentiated squamous cell carcinoma penetrating the subcutis.  Carcinoma extends to the deep resection margin over a front of approximately 4mm.  The closest lateral skin margin is 13mm clear (6 o'clock).  A focus of Bowen's disease is present adjacent to the main tumour which is clear of the 9 o'clock resection margin by 0.5mm.	 PHI:Null
1179	 1438	 B.  Sections of fibroadipose tissue show no evidence of malignancy.	 PHI:Null
1179	 1449	 DIAGNOSIS:	 PHI:Null
1179	 1462	 A.  Scalp:	 PHI:Null
1179	 1537	 - Moderately differentiated squamous cell carcinoma, positive deep margin;	 PHI:Null
1179	 1570	 - Bowen's disease, margin close.	 PHI:Null
1179	 1621	 B.  Deep margin scalp:  No evidence of malignancy.	 PHI:Null
1180	 25	 Episode No:  17I163403A	 IDNUM:17I163403A
1180	 36	 173163.MBI	 MEDICALRECORD:173163.MBI
1180	 54	 Mccoil, Haywood	 PATIENT:Mccoil, Haywood
1180	 72	 Lab No:  17I16340	 IDNUM:17I16340
1180	 82	 Stockdale	 STREET:Stockdale
1180	 113	 IPSWICH  South Australia  3111	 CITY:IPSWICH
1180	 113	 IPSWICH  South Australia  3111	 STATE:South Australia
1180	 113	 IPSWICH  South Australia  3111	 ZIP:3111
1180	 130	 Specimen: Tissue	 PHI:Null
1180	 149	 D.O.B:  24/10/2008	 DATE:24/10/2008=>2008-10-24
1180	 155	 Sex:F	 PHI:Null
1180	 181	 Collected: 9/10/2062 at :	 DATE:9/10/2062=>2062-10-09
1180	 226	 Location:  Immunology-ECHUCA REGIONAL HEALTH	 DEPARTMENT:Immunology
1180	 226	 Location:  Immunology-ECHUCA REGIONAL HEALTH	 HOSPITAL:ECHUCA REGIONAL HEALTH
1180	 247	 DR Roger CADEN Maier	 DOCTOR:Roger CADEN Maier
1180	 273	 Distribution:   FILE-COPY	 PHI:Null
1180	 305	 SUPPLEMENTARY REPORT (1.10.62):	 DATE:1.10.62=>2062-10-01
1180	 307	 	 PHI:Null
1180	 340	 SUPPLEMENTARY REPORT (23.10.62):	 DATE:23.10.62=>2062-10-23
1180	 342	 	 PHI:Null
1180	 352	 CLINICAL:	 PHI:Null
1180	 433	 Hx of right breast cancer 1 o'clock for WLE + SNBx + E/O multiple skin lesions.	 PHI:Null
1180	 446	 MACROSCOPIC:	 PHI:Null
1180	 557	 A.  Specimen labelled "Breast right sentinel node biopsy", consists of a lymph node 10 x 10 x 5mm. AE 1 block.	 PHI:Null
1180	 1359	 B.  Specimen labelled "Right breast mass short superior, medium medial, long lateral", consists of a piece of fibrofatty tissue with three sutures for orientation as above, measuring 55mm medial to lateral, 50mm superior to inferior, 40mm superficial to deep margin. On the superficial margin there is a ellipse of skin 20 x 2mm.  It is unremarkable.  Superior margin inked red, superficial margin blue, deep margin black. The specimen is serially sectioned from medial to lateral into seven slices.  Slice 1 (medial margin), slice 7 (lateral margin).  On sectioning and in slices 2-6 there is a well defined white and gritty tumour 25mm from medial to lateral, 30mm superior to inferior and up to 25mm from superficial to deep margin.  Representative sections taken according to the diagram attached.	 PHI:Null
1180	 1550	 Block 1 - 1 representative section from the medial margin; 2-5 - slice 3; 6-9 - slice 4; 10-13 - slice 5; 14-17 - slice 6; 18-22 - lateral margin; 24-27 - slice 2; 28-34 - rest of slice 1.	 PHI:Null
1180	 1700	 C.  Specimen labelled "Axillary node", consists of two lymph nodes 5 and 3mm in maximum diameter.  Block 1 - bisected lymph node; 2 - one lymph node.	 PHI:Null
1180	 1811	 D.  Specimen labelled "Left upper quadrant abdominal region", consists of a skin tag 5 x 4 x 2mm. AE 1 block.	 PHI:Null
1180	 2055	 E.  Specimen labelled "Abdominal region lower anterior chest wall lesion", consists of an ellipse of skin 10 x 5 x 2mm.  On the surface of the skin there is a skin coloured nodule 2mm in diameter. Block 1 - 1TS lesion; 2 - 4LS lateral margin.	 PHI:Null
1180	 2172	 F.  Specimen labelled "Epigastric lesion", consists of a small skin tag 3 x 2 x 1mm.  AE 1 block.  (PG/ec 10.10.62)	 DATE:10.10.62=>2062-10-10
1180	 2213	 MICROSCOPIC: (Reported by Dr E Brusser)	 DOCTOR:E Brusser
1180	 2471	 A - C.  Sections show breast tissue with a 35mm diameter grade 3 infiltrating ductal carcinoma.  Tumourextends close to superficial, inferior and superior excision margins.  There is metastatic tumour in the sentinel lymph node.  A synoptic report follows.	 PHI:Null
1180	 2491	 Invasive carcinoma:	 PHI:Null
1180	 2534	 Site: Right breast 1 o'clock  [UIQ]  [WLE]	 PHI:Null
1180	 2570	 Type: Infiltrating ductal carcinoma	 PHI:Null
1180	 2597	 Invasive tumour size: 35mm	 PHI:Null
1180	 2637	 Grade 3 (Modified Bloom & Richardson):	 PHI:Null
1180	 2706	 Tubules: 3     Nuclei: 3     Mitoses: 2     Mitotic rate:  11/10hpf.	 PHI:Null
1180	 2739	 Lymphovascular invasion:  Absent	 PHI:Null
1180	 2745	 	 PHI:Null
1180	 2763	 DCIS component:	 PHI:Null
1180	 2778	 DCIS:  present	 PHI:Null
1180	 2807	 Maximum extent of DCIS: 20mm	 PHI:Null
1180	 2828	 Nuclear grade: High	 PHI:Null
1180	 2849	 Architecture:  Solid	 PHI:Null
1180	 2869	 Necrosis:  Present	 PHI:Null
1180	 2891	 Calcification: Absent	 PHI:Null
1180	 2925	 Degree of DCIS intumour:  minimal	 PHI:Null
1180	 2956	 DCIS in adjacent tissue:  none	 PHI:Null
1180	 2976	 Excision Margins:	 PHI:Null
1180	 3077	 Invasive component:  Deep 4mm, superficial 2mm, inferior 2mm, superior 3mm, lateral 8mm, medial 5mm.	 PHI:Null
1180	 3106	 In-situ component:  All >5mm	 PHI:Null
1180	 3130	 Receptors (Block  B2):	 PHI:Null
1180	 3145	 ER:   positive	 PHI:Null
1180	 3169	 100% of nuclei stained	 PHI:Null
1180	 3213	 predominant intensity of staining:  strong	 PHI:Null
1180	 3227	 PR:  negative	 PHI:Null
1180	 3312	 0% of nuclei stained.  Stain to be repeated, a supplementary report will be issued.	 PHI:Null
1180	 3376	 HER2 (Novocastra 10A7):  2+ (equivocal)   Her-2 CISH to follow.	 PHI:Null
1180	 3393	 Ki-67 index: 25%	 PHI:Null
1180	 3406	 Nipple:  N/A	 PHI:Null
1180	 3429	 LCIS / ALH:  Absent	 PHI:Null
1180	 3453	 Sentinel lymph node(s):	 PHI:Null
1180	 3496	 Number of sentinel lymph nodes examined: 1	 PHI:Null
1180	 3553	 Number of sentinel lymph nodes NOT involved by tumour: 0	 PHI:Null
1180	 3615	 Number of sentinel lymph nodes involved by tumour:  1	 PHI:Null
1180	 3669	 Number of sentinel nodes with metastases >2.0mm: 1	 PHI:Null
1180	 3695	 Extranodal spread: absent	 PHI:Null
1180	 3717	 Axillary/other nodes:	 PHI:Null
1180	 3760	 Number of axillary lymph nodes examined: 2	 PHI:Null
1180	 3818	 Number of axillary lymph nodes NOT involved by tumour:  2	 PHI:Null
1180	 3878	 Number of axillary lymph noes involoved by tumour:0	 PHI:Null
1180	 3880	 	 PHI:Null
1180	 3882	 	 PHI:Null
1180	 3900	 Lymph node total:	 PHI:Null
1180	 3971	 Total number of lymph nodes examined (including sentinel node(s)):  3	 PHI:Null
1180	 4042	 Total number of involved lymph nodes (including sentinel node(s)):  1	 PHI:Null
1180	 4044	 	 PHI:Null
1180	 4046	 	 PHI:Null
1180	 4199	 D.  Sections show skin with an intradermal naevus.   There is no evidence of malignancy.   The naevus extends to the base of excision of the skin tag.	 PHI:Null
1180	 4411	 E.  Sections show skin.  Within the dermis there is a cavernous hemangioma.  The vessels have hyalinised walls.  There is no evidence of malignancy.  The hemangioma focally extends to the deep excision margin.	 PHI:Null
1180	 4525	 F.  Sections show skin with a cavernous hemangioma.  There is no evidenceof malignancy.   Excision is complete.	 PHI:Null
1180	 4538	 DIAGNOSIS:	 PHI:Null
1180	 4767	 A - C.  Wide local excision right breast, sentinel node biopsy and axillary lymph nodes:    35mm grade 3 infiltrating ductal carcinoma.   Metastasis in one sentinel node (1/1).  Other axillary nodes free of tumour (0/2).  pT2 N1	 PHI:Null
1180	 4821	 D.  Left upper quadrant abdomen:  Intradermal naevus.	 PHI:Null
1180	 4877	 E.  Lower anterior chest wall:  Cavernous hemangioma.	 PHI:Null
1180	 4918	 F.  Epigastric:  Cavernous hemangioma.	 PHI:Null
1180	 4951	 SUPPLEMENTARY REPORT (23.10.62):	 DATE:23.10.62=>2062-10-23
1180	 5089	 1.  The progesterone receptor stain has been repeated and the tumour cells are confirmed to be negative (with positive internal control).	 PHI:Null
1180	 5121	 SUPPLEMENTARY REPORT (1.10.62):	 DATE:1.10.62=>2062-10-01
1180	 5185	 HER-2 CISH has shown a negative (nonamplified, diploid) result.	 PHI:Null
1180	 5225	 Mean Her-2 copy number per cell:  1.75.	 PHI:Null
1180	 5255	 CISH reported by Dr E Kochis.	 DOCTOR:E Kochis
1181	 24	 Episode No:  81S903812V	 IDNUM:81S903812V
1181	 35	 817903.VDH	 MEDICALRECORD:817903.VDH
1181	 53	 LEBOEUF, Carter	 PATIENT:LEBOEUF, Carter
1181	 71	 Lab No:  81S90381	 IDNUM:81S90381
1181	 77	 Nimco	 STREET:Nimco
1181	 108	 GOSFORD  South Australia  2828	 CITY:GOSFORD
1181	 108	 GOSFORD  South Australia  2828	 STATE:South Australia
1181	 108	 GOSFORD  South Australia  2828	 ZIP:2828
1181	 125	 Specimen: Tissue	 PHI:Null
1181	 144	 D.O.B:  26/12/1984	 DATE:26/12/1984=>1984-12-26
1181	 152	 Sex:  F	 PHI:Null
1181	 179	 Collected: 10/10/2062 at :	 DATE:10/10/2062=>2062-10-10
1181	 234	 Location:  2.23HR STAY SURGICAL UNIT-CORRIGIN HOSPITAL	 DEPARTMENT:2.23HR STAY SURGICAL UNIT
1181	 234	 Location:  2.23HR STAY SURGICAL UNIT-CORRIGIN HOSPITAL	 HOSPITAL:CORRIGIN HOSPITAL
1181	 258	 DR ANTONE Horacio Miele	 DOCTOR:ANTONE Horacio Miele
1181	 307	 Distribution:    NSW-CANCER-REGISTRY,  FILE-COPY	 PHI:Null
1181	 318	 CLINICAL:	 PHI:Null
1181	 394	 R breast ca ductal.  Ca - 10 o'clock. R axillary lymph node.  17mm R Br Ca	 PHI:Null
1181	 485	 10 o'clock 7cm FN.  Right mastectomy.  Extra axillary tissue.  Extra medial corner skin.	 PHI:Null
1181	 498	 MACROSCOPIC:	 PHI:Null
1181	 716	 A.  Specimen labelled "Axillary sentinel node", consists of an irregular piece of fibroadipose tissue 50 x 30 x 10mm containing three lymph nodes 10, 12 and 15mm in maximum dimension. Two imprints made of each node.	 PHI:Null
1181	 797	 Block 1 - sentinel node 1, AE; 2 - sentinel node 2, AE; 3 - sentinel node 3, AE.	 PHI:Null
1181	 844	 IMPRINT CYTOLOGY:  Three negative lymph nodes.	 PHI:Null
1181	 896	 Result toDr Robt by Dr X Fei at 15:40pm on 8.8.12.	 DOCTOR:Robt
1181	 896	 Result toDr Robt by Dr X Fei at 15:40pm on 8.8.12.	 DOCTOR:X Fei
1181	 896	 Result toDr Robt by Dr X Fei at 15:40pm on 8.8.12.	 TIME:15:40pm on 8.8.12=>2012-08-08T15:40
1181	 1407	 B.  Specimenlabelled "Right breast tissue", consists of a mastectomy with a long suture attached (confirmed to be medial by phone with Dr X Chilo on 10.11.62).  The specimen measures 220mm medial to lateral x 160mm superior to inferior x 45mm superficial to deep and weighs 717g.  The attached skin ellipse measures 205 x 102mm and bears eccentrically (towards the medial pole) a retracted nipple.  A 25mm diameter area of contusion is present at approximately 10 o'clock.  Superficial inked blue, deep black.	 DOCTOR:X Chilo
1181	 1407	 B.  Specimenlabelled "Right breast tissue", consists of a mastectomy with a long suture attached (confirmed to be medial by phone with Dr X Chilo on 10.11.62).  The specimen measures 220mm medial to lateral x 160mm superior to inferior x 45mm superficial to deep and weighs 717g.  The attached skin ellipse measures 205 x 102mm and bears eccentrically (towards the medial pole) a retracted nipple.  A 25mm diameter area of contusion is present at approximately 10 o'clock.  Superficial inked blue, deep black.	 DATE:10.11.62=>2062-10-11
1181	 1822	 On sectioning a 22 x 20 x 17mm tumour is present within the upper outer quadrant at approximately 10 o'clock, 120mm from nipple. The tumourmeasures 6mm from the deep margin, 15mm from skin, 25mm from the medial margin, 26mm from the superior margin, 30mm from the inferior margin and is macroscopically well clear of the lateral margin. The remaining cut surfaces show macroscopically unremarkable breast tissue.	 PHI:Null
1181	 2220	 Block 1 - tumour and deep margin; 2 - tumour and skin; 3 - further representative tumour; 4 - representative upper outer quadrant; 5 - representative lower outer quadrant; 6 - representative lower inner quadrant; 7 - representative upper inner quadrant; 8 - representative 12 o'clock; 9 - representative 6 o'clock; 10 - representative nipple; 11 - tissue deep to nipple; 12 - tumour reserve block.	 PHI:Null
1181	 2390	 C.  Specimen labelled "Extra right axillary tissue", consists of unoriented fibroadipose tissue 38 x 30 x 10mm.  No macroscopic lymph nodes are identified.  AE 2 blocks.	 PHI:Null
1181	 2703	 D.  Specimen labelled "Right medial breast skin corner", consists of unoriented fibroadipose tissue 70 x 60 x 25mm with an attached unremarkable skin ellipse 95 x 25mm.  Superficial inked blue, deep black.  On sectioning no mass lesions are identified.  Representative sections blocks 1 & 2.   (BJ/ec  10.11.62)	 DOCTOR:BJ
1181	 2703	 D.  Specimen labelled "Right medial breast skin corner", consists of unoriented fibroadipose tissue 70 x 60 x 25mm with an attached unremarkable skin ellipse 95 x 25mm.  Superficial inked blue, deep black.  On sectioning no mass lesions are identified.  Representative sections blocks 1 & 2.   (BJ/ec  10.11.62)	 DATE:10.11.62=>2062-10-11
1181	 2742	 MICROSCOPIC: (Reported by Dr S Bille)	 DOCTOR:S Bille
1181	 2895	 A.  Two (2) of the three (3) sentinel nodes contain small subcapsular deposits of metastatic ductal carcinoma of the breast.  The CAM 5.2 is positive.	 PHI:Null
1181	 3180	 B.  Sections show a grade 2 infiltrating ductal carcinoma (t=2, n=2, m=2) of the right breast.  The carcinomameasures 22 x 20 x 17mm and is located in the upper outer quadrant, 120mm from the nipple.  The carcinoma is 5mm from the deep margin and the pectoral muscle is not invaded.	 PHI:Null
1181	 3479	 There is no DCIS and random sectioning from the quadrants show a small intraduct papilloma in the lower inner quadrant and no other abnormality.  The breast is otherwise atrophic and the nipple appears normal.There is a small focus of columnar cell change within breast tissue deep to the nipple.	 PHI:Null
1181	 3543	 C.  Sections show adipose tissue.  No lymph nodes identified.	 PHI:Null
1181	 3626	 D.Sections show skin plus underlying adipose tissue.  No lymph nodes identified.	 PHI:Null
1181	 3709	 A to D.  Right mastectomy plus sentinel nodes plus extra-axillary tissue and skin:	 PHI:Null
1181	 3729	 Invasive carcinoma:	 PHI:Null
1181	 3763	 Site:  Right breast mastectomy.	 PHI:Null
1181	 3803	 Type:  Infiltrating ductal carcinoma.	 PHI:Null
1181	 3842	 Invasive tumour size:  22 x 20 x 17mm.	 PHI:Null
1181	 3881	 Grade 2 (Modified Bloom & Richardson):	 PHI:Null
1181	 3944	 Tubules:  2  Nuclei:  2  Mitoses:  2  Mitotic rate:  10/10hpf.	 PHI:Null
1181	 3978	 Lymphovascular invasion:  Absent.	 PHI:Null
1181	 3997	 DCIS component:	 PHI:Null
1181	 4012	 DCIS:  Absent.	 PHI:Null
1181	 4032	 Excision Margins:	 PHI:Null
1181	 4052	 Invasive component:	 PHI:Null
1181	 4088	 Deep 5mm, other margins well clear.	 PHI:Null
1181	 4107	 In-situ component:	 PHI:Null
1181	 4112	 N/A.	 PHI:Null
1181	 4135	 Receptors (Block B2):	 PHI:Null
1181	 4152	 ER:  Positive.	 PHI:Null
1181	 4176	 >95% of nuclei stained	 PHI:Null
1181	 4221	 predominant intensity of staining:  Strong.	 PHI:Null
1181	 4236	 PR:  Positive.	 PHI:Null
1181	 4259	 90% of nuclei stained	 PHI:Null
1181	 4304	 predominant intensity of staining:  Strong.	 PHI:Null
1181	 4382	 HER2 (Novocastra 10A7):  Negative (0/1+).  Slides sent to St George for CISH.	 PHI:Null
1181	 4398	 The Ki67 is 5%.	 PHI:Null
1181	 4415	 Nipple:  Normal.	 PHI:Null
1181	 4437	 LCIS / ALH:  Absent.	 PHI:Null
1181	 4511	 Miscellaneous:  Focus of CCC (columnar cell change) deep to the nipple.	 PHI:Null
1181	 4536	 Sentinel lymph node(s):	 PHI:Null
1181	 4580	 Number of sentinel lymph nodes examined:  3	 PHI:Null
1181	 4633	 Number of sentinel lymphnodes involved by tumour:  2	 PHI:Null
1181	 4685	 Number of sentinel nodes with metastases >2.0mm:  0	 PHI:Null
1181	 4736	 Number of sentinel nodeswith metastases <2.0mm:  2	 PHI:Null
1181	 4763	 Detected by:  [H&E] [IHC]	 PHI:Null
1181	 4791	 Extranodal spread:  Absent.	 PHI:Null
1181	 4813	 Axillary/other nodes:	 PHI:Null
1181	 4857	 Number of axillary lymph nodes examined:  0	 PHI:Null
1181	 4875	 Lymph node total:	 PHI:Null
1181	 4945	 Total number of lymph nodes examined (including sentinel node(s)):  3	 PHI:Null
1181	 5015	 Total number of involved lymph nodes (including sentinel node(s)):  2	 PHI:Null
1181	 5046	 ADDITIONAL REPORT:  (30.10.62)	 DATE:30.10.62=>2062-10-30
1181	 5172	 Blocks were sent to GIPPSLAND SOUTHERN HEALTH SERVICE - LEONGATHA CAMPUS Hospital for Her2 CISH analysis, Dr S Emler reports:	 HOSPITAL:GIPPSLAND SOUTHERN HEALTH SERVICE - LEONGATHA CAMPUS
1181	 5172	 Blocks were sent to GIPPSLAND SOUTHERN HEALTH SERVICE - LEONGATHA CAMPUS Hospital for Her2 CISH analysis, Dr S Emler reports:	 DOCTOR:S Emler
1181	 5253	 Her 2 in situ hybridisation: (Her2 CISH Invitrogen SPOT-Light assay, block B2).	 PHI:Null
1181	 5306	 Her2 CISH result: NEGATIVE (non-amplified, diploid).	 PHI:Null
1181	 5343	 Mean Her2 copy number per cell: 1.8.	 PHI:Null
1181	 5388	 SCORING CRITERIA (ASCO/CAP recommendations):	 PHI:Null
1181	 5432	 1 to <2.5 copies:   Non amplified (diploid)	 PHI:Null
1181	 5478	 2.5 to <4 copies:   Non amplified (polysomy)	 PHI:Null
1181	 5505	 4 to 6 copies:  Equivocal	 PHI:Null
1181	 5549	 >6 but < 10 copies: Low level amplification	 PHI:Null
1181	 5593	 10 or more copies:  High level amplified.	 PHI:Null
1181	 5595	 	 PHI:Null
1182	 24	 Episode No:  95W7854197	 IDNUM:95W7854197
1182	 35	 958785.KFZ	 MEDICALRECORD:958785.KFZ
1182	 64	 BRUSKI, Floyd GAVIN SHELBY	 PATIENT:BRUSKI, Floyd GAVIN SHELBY
1182	 82	 Lab No:  95W78541	 IDNUM:95W78541
1182	 90	 Talbryn	 STREET:Talbry
1182	 104	 YAMBA    3158	 CITY:YAMBA
1182	 104	 YAMBA    3158	 ZIP:3158
1182	 121	 Specimen: Tissue	 PHI:Null
1182	 139	 D.O.B:  10/5/2029	 DATE:10/5/2029=>2029-10-05
1182	 147	 Sex:  M	 PHI:Null
1182	 178	 Collected: 09/08/2012 at 09:03	 TIME:09/08/2012 at 09:03=>2012-08-09T09:03
1182	 243	 Location:  POW L7 CONSULTING ROOMS-DORRIGO MULTI PURPOSE SERVICE	 DEPARTMENT:POW L7 CONSULTING ROOMS
1182	 243	 Location:  POW L7 CONSULTING ROOMS-DORRIGO MULTI PURPOSE SERVICE	 HOSPITAL:DORRIGO MULTI PURPOSE SERVICE
1182	 268	 DR Linwood Donny Duhamel	 DOCTOR:Linwood Donny Duhamel
1182	 317	 Distribution:   FILE-COPY,   NSW-CANCER-REGISTRY	 PHI:Null
1182	 327	 CLINICAL:	 PHI:Null
1182	 411	 Hepatectomy.  1. Left segment II/III.  2. Right segment VII/VIII, ?colorectal mets.	 PHI:Null
1182	 507	 Further information from Dr Panchal - Specimen B segment VII/VIII has an adhesion of diaphragm.	 DOCTOR:Panchal
1182	 602	 Further information from powerchart: In 2060 (95W78541) pT3, N1, MX mid rectal adenocarcinoma.	 DATE:2060=>2060
1182	 602	 Further information from powerchart: In 2060 (95W78541) pT3, N1, MX mid rectal adenocarcinoma.	 IDNUM:95W78541
1182	 615	 MACROSCOPIC:	 PHI:Null
1182	 877	 A.  Specimen labelled "Liver segment II/III" consists of a piece of liver 117 x 80 x 42mm weighing 120.4g.  Sectioning reveals a cream coloured tumour deposit 50 x 37 x 28mm, 10mm from the resection margin.  The uninvolved liver is macroscopically unremarkable.	 PHI:Null
1182	 1017	 Blocks:  1 - tumour and resection margin; 2 - further representative tumour; 3 - tumour reserve block; 4 - representative uninvolved liver.	 PHI:Null
1182	 1550	 B.  Specimen labelled "Liver segment VII/VIII" consists of a piece of liver 155 x 127 x 54mm, weighing 367.2g.  The specimen includes the bare area approximately 80 x 50mm. The capsular surface shows a 20x 20mm piece of ragged ?diaphragm adherent to underlying tumour nodules.  Sectioning reveals a partly necrotic cream/white tumour 60 x 55 x 30mm deep to the adherent diaphragm.  The tumour measures 18mm from the surgical resection margin and 5mm clear of the bare area. The uninvolved liver appears macroscopically unremarkable.	 PHI:Null
1182	 1789	 Blocks:  1 - tumour and adherent diaphragm; 2 - tumour andcapsule; 3 - further representative tumour; 4 - tumour reserve block; 5 - representative uninvolved liver. 6 & 7 more blocks ( 6 tumourand resection margin, 7 tumour and bare area)	 PHI:Null
1182	 2069	 C.  Specimen labelled "Gallbladder" consists of a76mm gallbladder with a diameter of up to 26mm.  The wall measures up to 3mm in thickness and the mucosa is macroscopically unremarkable.  The lumen contains bile.  No stones are identified within the lumen orspecimen container.	 PHI:Null
1182	 2147	 Blocks:  1 - cystic duct and neck; 2 - body; 3 - fundus.   (XM/cc  10/11/62)	 DOCTOR:XM
1182	 2147	 Blocks:  1 - cystic duct and neck; 2 - body; 3 - fundus.   (XM/cc  10/11/62)	 DATE:10/11/62=>2062-10-11
1182	 2149	 	 PHI:Null
1182	 2189	 MICROSCOPIC (Reported by Dr X Nalley):	 DOCTOR:X Nalley
1182	 2807	 A.  Approximately 10% of the 50mm tumour nodule described grossly is moderately differentiated adenocarcinoma.  The remainder of the nodule shows feature consistent with chemotherapy effect with broad areas of fibrosis, sheets of foamy histocytes, necrosis, scattered foreign body giant cells containing cholesterol clefts,foci of dystophic calcification and admixed chronic inflammation.  The residual carcinoma is present predominantly around the periphery of the nodule and is composed of moderately pleomorphic cells arranged in small single and anastomosing tubules.  No definite lymphovascular invasion is seen.	 PHI:Null
1182	 2976	 With immunohistochemistry the tumour cells express CK20 and CDX2 and are negative for CK7.  The morphology and immunoprofile are consistent with a colorectal primary.	 PHI:Null
1182	 3038	 The carcinoma is 9mm clear of the surgical resection margin.	 PHI:Null
1182	 3412	 The adjacent liver shows overall preservation of lobular architecture.  There are some reactive changes with focal mild fibrous expansion of portal tracts with focal portal to central linkage and a very mild mixed portal inflammatory infiltrate with focal minimal interface change.  There is mild predominately centrilobular macrovesicular steatosis but no steatohepatitis.	 PHI:Null
1182	 4177	 B.  Approximately 10% of the 60mm tumour nodule described is moderately differentiated adenocarcinoma. The remainder of the nodule shows features consistent with chemotherapy effect, similar to that described above.  The carcinoma shows similar morphology to that seen in specimen A, albeit with more complex branching glandular and cribriform structures, and a similar to the morphology of the primary rectal carcinoma (95W78541).  The residual carcinoma abuts but does not invade the adhesion described grossly, which comprises fibrovascular connective tissue (consistent with fibrous diaphragm).  There is also subcapsular tumour associated overlying organising haemorrhage however, no capsular penetration is seen.  No definite lymphovascular invasion is seen.	 IDNUM:95W78541
1182	 4270	 With immunohistochemistry the tumour cells express CK20 and CDX2 but are negative for CK7.	 PHI:Null
1182	 4339	 The morphology and immunoprofile is consistent with a rectal primary	 PHI:Null
1182	 4424	 The tumour is 16.5mm clear of the resection margin and 4mm clear of the bare area.	 PHI:Null
1182	 4889	 The liver away from the tumour shows preservation of lobular architecture without fibrous or inflammatory expansion of portal tracts, the latter containing normal portal structures.  There is mild, predominately centrilobular, macrovesicular steatosis but no steatohepatitis. The liver cell plates are one cell thick. There is patchy mild iron deposition in periportal hepatocytes of uncertain significance.  No stainable copper or dPAS positive globules are seen.	 PHI:Null
1182	 5184	 C.  Sections show very mild chronic cholecystitis with focal pseudopyloric metaplasia, mild hypertrophy of the muscularis, focal Rokitansky Aschoff sinus formation and very mild transmural chronic inflammation.  There is no evidence of malignancy.  A cystic duct lymph node is not identified.	 PHI:Null
1182	 5197	 DIAGNOSIS:	 PHI:Null
1182	 5221	 A.  Liver segment 2/3:	 PHI:Null
1182	 5282	 -  Metastatic adenocarcinoma consistent with rectal primary.	 PHI:Null
1182	 5311	 -  Surgical margin 9mmclear.	 PHI:Null
1182	 5336	 B.  Liver segment 7/8:	 PHI:Null
1182	 5397	 -  Metastatic adenocarcinoma consistent with rectal primary.	 PHI:Null
1182	 5430	 -  Surgical margin 16.5mm clear.	 PHI:Null
1182	 5454	 -  Bare area 4mm clear.	 PHI:Null
1182	 5500	 -  Uninvolved fibrous diaphragmatic adhesion.	 PHI:Null
1182	 5550	 -Mild steatosis, mild hepatocyte iron deposition.	 PHI:Null
1182	 5618	 C.  Gallbladder:  Very mild chronic cholecystitis, no gallstones.	 PHI:Null
1183	 14	 4378054.UUC	 MEDICALRECORD:4378054.UUC
1183	 31	 LAMSON, GUY-FINN	 PATIENT:LAMSON, GUY-FINN
1183	 40	 43S80547	 IDNUM:43S80547
1183	 75	 Last edited : 17/10/2062  Page: 2	 DATE:17/10/2062=>2062-10-17
1183	 85	 CLINICAL:	 PHI:Null
1183	 228	 Previous Ca bowel.  (R) upper lobe adeno.  (R) upper lobectomy.  (R) UL.  (R) hilar nodes.  (R) paratracheal nodes.  (R) para-oesophageal node	 PHI:Null
1183	 241	 MACROSCOPIC:	 PHI:Null
1183	 375	 A.  Specimen labelled "Hilarlymph node" consists of two pieces of dark brown tissue, 9mm and 15mm in greatest dimension.  AE 1 block.	 PHI:Null
1183	 526	 B.  Specimen labelled "Paratracheal lymph node" consists of two pieces of dark brown/yellowish tissue, 7mm and 8mm in greatest dimension.  AE 1 block.	 PHI:Null
1183	 696	 C.  Specimen labelled "Para-oesophageal lymph node" consists of two adjacent lymph nodes, 5mm and 12mm in greatest dimension with attached adipose tissue.  AE 1 block.	 PHI:Null
1183	 1337	 .  Specimen labelled "Upper right lobe of lung" consists of a lobectomy, 160 x 130 x 48mm and weighing 370g after formalin infusion.  The specimen has been incised over the lateral aspect (for tissue bank) to a length of 65mm anddepth of 37mm to expose a 35 x 25 x 20mm firm tumour.  The tumour is very close to the serosal surface but there are no tumour deposits overlying the serosa.  The tumour shows a nodular, grey off white cut surface.  A definite intrabronchial growth is not identified.  The bronchial resection margin is 28mm clear of tumour.  The remaining lung shows dilated air spaces particularly in the mid and lower third.	 PHI:Null
1183	 1580	 Blocks:  1 - bronchial margin; 2 - vascular margin; 3 -two lymph nodes; 4 - one node bisected; 5 & 6 - paired blocks; 7 - tumour random; 8 - reserved block for tissue bank; 9 - upper third; 10 - mid and lower third of lung.  (KJ/mm 15.10.62)	 DATE:15.10.62=>2062-10-15
1183	 1633	 MICROSCOPIC: (Reported by Dr M Curimao - 17.10.2062)	 DOCTOR:M Curimao
1183	 1633	 MICROSCOPIC: (Reported by Dr M Curimao - 17.10.2062)	 DATE:17.10.2062=>2062-10-17
1183	 1787	 A.  The hilar lymph node shows sinus histiocytosis and anthrasilicosis, with early silicotic nodule formation. There is no evidence of malignancy (0/1).	 PHI:Null
1183	 1912	 B.  The two paratracheal lymph nodes show sinus histiocytosis and anthrasilicosis. There is no evidence of malignancy (0/2).	 PHI:Null
1183	 2040	 C.  The two para-oesophageal lymph nodes showsinus histiocytosis and anthrasilicosis. There is no evidence of malignancy (0/2).	 PHI:Null
1183	 2223	 D.  The right upper lobe of lung tumour is a well to moderately differentiated adenocarcinoma showing mucinous differentiation. A synoptic report for invasive lung carcinoma follows:	 PHI:Null
1183	 2267	 SYNOPTIC REPORT FOR INVASIVE LUNG CARCINOMA	 PHI:Null
1183	 2295	 1.  Specimen type:Lobectomy	 PHI:Null
1183	 2324	 2.  Topography: R lung (RUL)	 PHI:Null
1183	 2357	 3.  Tumour location: Peripheral.	 PHI:Null
1183	 2392	 4.Tumour size: 35mm (macroscopic).	 PHI:Null
1183	 2521	 5.  Tumour type: Well to moderately differentiated adenocarcinoma, showing areas of mucinous differentiation and lepidic growth.	 PHI:Null
1183	 2552	 6.  Vessel invasion: Not seen.	 PHI:Null
1183	 2586	 7.  Perineural invasion: Notseen.	 PHI:Null
1183	 2667	 8.  Pleural involvement: Tumour abuts the visceral pleura but does not breach it	 PHI:Null
1183	 2734	 9.  Bronchial resection margin: Free of tumour (28mm macroscopic).	 PHI:Null
1183	 2782	 10.  Vascular resection margin: Free of tumour.	 PHI:Null
1183	 2927	 11.  Non-neoplastic lung: The adjacent non-neoplastic lung shows emphysematous change, anthracosis and patchy interstitial organising fibrosis.	 PHI:Null
1183	 3027	 12.  Lymph nodes (from main specimen): No evidence of malignancy in three hilar lymph nodes (0/3).	 PHI:Null
1183	 3096	 13.  Pathological Stage (pTNM AJCC/IUCC 7th Ed.): 1B  (pT2a pN0 pMx)	 PHI:Null
1183	 3226	 14.  Immunohistochemistry: the carcinoma shows TTF-1 and CK7 positivity and CK20 negativity, consistent with primary lung origin.	 PHI:Null
1183	 3237	 DIAGNOSIS:	 PHI:Null
1183	 3292	 A.  Hilar lymph node: No evidence of malignancy (0/1).	 PHI:Null
1183	 3355	 B.  Paratracheal lymph node: No evidence of malignancy (0/2).	 PHI:Null
1183	 3422	 C.  Para-oesophageal lymph node: No evidence of malignancy (0/2).	 PHI:Null
1183	 3454	 D.  Upper right lobe of lung:	 PHI:Null
1183	 3513	 35mm, pTNM Stage 1B, right upper lobe lung adenocarcinoma.	 PHI:Null
1183	 3571	 Carcinoma is clear of the bronchial and vascular margins.	 PHI:Null
1183	 3629	 Carcinoma abuts, butdoes not breach, the visceral pleura.	 PHI:Null
1183	 3698	 No evidence of malignancy in three sampled hilar lymph nodes (0/3).	 PHI:Null
1183	 3700	 	 PHI:Null
1183	 3702	 	 PHI:Null
1184	 24	 Episode No:  17C645887X	 IDNUM:17C645887X
1184	 36	 1706458.VTX	 MEDICALRECORD:1706458.VTX
1184	 53	 Ruman, Rodolfo	 PATIENT:Ruman, Rodolfo
1184	 71	 Lab No:  17C64588	 IDNUM:17C64588
1184	 78	 Hewins	 STREET:Hewins
1184	 113	 MOUNT ELIZA  South Australia  4213	 CITY:MOUNT ELIZA
1184	 113	 MOUNT ELIZA  South Australia  4213	 STATE:South Australia
1184	 113	 MOUNT ELIZA  South Australia  4213	 ZIP:4213
1184	 130	 Specimen: Tissue	 PHI:Null
1184	 149	 D.O.B:  30/11/1992	 DATE:30/11/1992=>1992-11-30
1184	 157	 Sex:  M	 PHI:Null
1184	 184	 Collected: 11/10/2062 at :	 DATE:11/10/2062=>2062-10-11
1184	 233	 Location:  MACQUARIEWARD-COBAR DISTRICT HOSPITAL	 DEPARTMENT:MACQUARIEWARD
1184	 233	 Location:  MACQUARIEWARD-COBAR DISTRICT HOSPITAL	 HOSPITAL:COBAR DISTRICT HOSPITAL
1184	 253	 DR Myron Theo Lozey	 DOCTOR:Myron Theo Lozey
1184	 279	 Distribution:   FILE-COPY	 PHI:Null
1184	 311	 SUPPLEMENTARY REPORT (6.11.62):	 DATE:6.11.62=>2062-11-06
1184	 313	 	 PHI:Null
1184	 323	 CLINICAL:	 PHI:Null
1184	 479	 Hx of large R retroperitoneal tumour wrapped around IVC andextending into lesser sacs and down to pelvis for resection.  Histopath + cytogenetics please.	 PHI:Null
1184	 556	 Small piece was divided from the larger specimen and sent for Cytogenetics.	 PHI:Null
1184	 569	 MACROSCOPIC:	 PHI:Null
1184	 1054	 A.   Specimen labelled "Left perigastric tumour", consists of three pieces of unorientated fatty tissue 60, 70 and 95mm in maximum dimension. The largest piece is smooth over approximately 50% of its surface. The cut surfaces of the largest piece have a few small darker cream areas. The remainder of the cut surfaces reveal unremarkable fatty tissue.  Blocks 1-6 - representative larger fragment; 7-9 - representative middle sized fragment; 10-12 - representative smallest fragment.	 PHI:Null
1184	 1368	 B.  Specimen labelled "Lesser sac tumour", consists of a piece of unoriented fatty tissue 140 x 105 x 45mm.  75% of the tissue has a smooth surface.  The cut surface reveals a few small focal areas of cream yellow.  The remainder of the tissue is unremarkable fatty tissue.  Representative sections in 8 blocks.	 PHI:Null
1184	 2235	 C.  Specimen labelled "Retroperitonealtumour", consists of an unoriented piece of predominantly fatty tissue measuring 390 x 245 x 180mm and weighing 7.93kg.  The majority of the specimen has a relatively well circumscribed smooth surface. There is also an attached small piece which has a more roughened surface; this is attached to the main part of the specimen by a strand of connective tissue.  The cut surface of the larger more circumscribed part of the specimen is yellow/cream and has focal tan firmer areas.  There are also focal cream areas which appear to come close to some margins.  The attached, smaller more fragmented piece has a more fatty yellow appearance and appears fairly homogeneous throughout.  Blocks 1-13 - representative larger piece; 14-18 - representativesmaller more fragmented piece; 19 - tumour for tumour banking.  (MY/ec  12.10.62)	 DOCTOR:MY
1184	 2235	 C.  Specimen labelled "Retroperitonealtumour", consists of an unoriented piece of predominantly fatty tissue measuring 390 x 245 x 180mm and weighing 7.93kg.  The majority of the specimen has a relatively well circumscribed smooth surface. There is also an attached small piece which has a more roughened surface; this is attached to the main part of the specimen by a strand of connective tissue.  The cut surface of the larger more circumscribed part of the specimen is yellow/cream and has focal tan firmer areas.  There are also focal cream areas which appear to come close to some margins.  The attached, smaller more fragmented piece has a more fatty yellow appearance and appears fairly homogeneous throughout.  Blocks 1-13 - representative larger piece; 14-18 - representativesmaller more fragmented piece; 19 - tumour for tumour banking.  (MY/ec  12.10.62)	 DATE:12.10.62=>2062-10-12
1184	 2279	 MICROSCOPIC: (Reported by Dr E Vanelderen)	 DOCTOR:E Vaneldere
1184	 2996	 A to C. The three specimens are similar.  Sections show a lipomatous tumour composed of variably sized adipocytes with scatteredhyperchromatic and vacuolated cells with features of atypical lipoblasts.  The appearances are most consistent with an atypical lipomatous tumour/well-differentiated liposarcoma,lipoma-like.  The majority of the tumour has a lipoma-like appearance. Patchy small areas of infiltration by foamy macrophages are noted.  Much of the tumour in specimen C shows apparent recent, and organising, infarct-like necrosis.  The described, attached smaller piece of fatty tissue attached by connective tissue to the main tumour in specimen C also shows features of well differentiated liposarcoma.	 PHI:Null
1184	 3274	 Sections including the described smooth surfaces on each specimen show tumour with an overlying thin rim of fibrous tissue.  Tumour extends to other excision margins of each specimen and adequacy of excision cannot be assessed because of the fragmented nature of the specimens.	 PHI:Null
1184	 3365	 Multiple sections have been examined and there is no evidence of tumour dedifferentiation.	 PHI:Null
1184	 3377	 DIAGNOSIS:	 PHI:Null
1184	 3531	 A to C.  Left perigastric tumour, lesser sac tumour and retroperitoneal tumour:  Atypical lipomatous tumour/well-differentiated liposarcoma, lipoma-like.	 PHI:Null
1184	 3563	 SUPPLEMENTARY REPORT (6.11.62):	 DATE:6.11.62=>2062-11-06
1184	 3625	 Cytogenetics was performed at MAROONDAH HOSPITAL's Pathology.	 HOSPITAL:MAROONDAH HOSPITAL
1184	 3649	 They report as follows:	 PHI:Null
1184	 4060	 "Although only 6 metaphases were obtained for analysis an abnormal clone was detected with lossof the Y chromosome and presence of a ring chromosome.  Interphase FISH showed amplification of MDM2 probe and of the 5' portion of the DDIT3 probe, consistent with an amplicon including loci from 12q13 and 12q15.  MDM2 amplification is associated with well differentiated liposarcoma/de-differentiatedliposarcoma."	 PHI:Null
1184	 4082	 Reported by E Pensis.	 DOCTOR:E Pensis
1184	 4086	 	 PHI:Null
1185	 24	 Episode No:  38T246735I	 IDNUM:38T246735I
1185	 36	 3872467.JPI	 MEDICALRECORD:3872467.JPI
1185	 52	 SHOOK, ELDORA	 PATIENT:SHOOK, ELDORA
1185	 70	 Lab No:  38T24673	 IDNUM:38T24673
1185	 79	 Strenger	 STREET:Strenger
1185	 110	 LISMORE  New South Wales  2559	 CITY:LISMORE
1185	 110	 LISMORE  New South Wales  2559	 STATE:New South Wales
1185	 110	 LISMORE  New South Wales  2559	 ZIP:2559
1185	 127	 Specimen: Tissue	 PHI:Null
1185	 145	 D.O.B:  24/2/1990	 DATE:24/2/1990=>1990-02-24
1185	 153	 Sex:  F	 PHI:Null
1185	 177	 Collected: Unknown at :	 PHI:Null
1185	 194	 Location:  Envoi	 DEPARTMENT:Envoi
1185	 218	 DR Harris ISMAEL CLYATT	 DOCTOR:Harris ISMAEL CLYATT
1185	 267	 Distribution:   FILE-COPY,   NSW-CANCER-REGISTRY	 PHI:Null
1185	 277	 CLINICAL:	 PHI:Null
1185	 324	 (R) lower lobectomy.  (R) flank skin lesion.	 PHI:Null
1185	 337	 MACROSCOPIC:	 PHI:Null
1185	 441	 A.  Specimen labelled "Hilar lymph node" consists of a dark brown lymph node, 8 x 6 x 3mm.  AE 1 block.	 PHI:Null
1185	 612	 B.  Specimen labelled "Paratracheal lymph node" consists of two pieces of adipose tissue, 5mm and 6mm in greatest dimension possibly containing a lymph node.  AE 1 block.	 PHI:Null
1185	 903	 C.  Specimen labelled "Skin lesion" consists of an ellipse of skin and underlying subcutis, 32 x 12 x 20mm.  A stitch is present at one end assigned as 12 o'clock, 3 o'clock margin inked green and 9 o'clock inked black.  There is a grey/brownish nodule on the skin surface, 12 x 10 x 3mm.	 PHI:Null
1185	 976	 Blocks:  1 - one TS lesion; 2 - one LS 12 o'clock; 3 - one LS 6 o'clock.	 PHI:Null
1185	 1524	 D.  Specimen labelled "Right lower lobe" consists of a lobectomy measuring 115 x 145 x 100mm and weighing 279g after formalin infusion.  The pleural surface shows focal puckering over the posterolateral aspect.  17mm from bronchial margin there is a solid firm off white tumour measuring 25 x 20 x 17mm.  The tumour appears very close to a segmental bronchus but a definite intrabronchial growth is not identified macroscopically.  Thebronchial margin appears slightly calcified.  Sectioning through the remaining lung shows no unusual features.	 PHI:Null
1185	 1771	 Blocks:  1- bronchial margin ; 2- vascular margin ; 3 & 4 - paired blocks one full face of tumour with adjacent bronchus and lung; 5 & 6 - tumour; 7 - reserved block for tissue banking; 8 - non neoplastic lung; 9 - ? firm area away from tumour.	 PHI:Null
1185	 1790	 (MY/mm 15.10.62)	 DOCTOR:MY
1185	 1790	 (MY/mm 15.10.62)	 DATE:15.10.62=>2062-10-15
1185	 1830	 MICROSCOPIC (reported by Dr J Progacz):	 DOCTOR:J Progacz
1185	 1970	 A. Sections show an anthracotic lymphnode with two deposits of metastatic adenocarcinoma, up to 2mm in size. There is no extranodal spread.	 PHI:Null
1185	 2045	 B. Sections show an anthracotic lymph node with no evidence of malignancy.	 PHI:Null
1185	 2157	 C. Sections show skin with a benignseborrhoeic keratosis, clear of margins. There is no evidence of malignancy.	 PHI:Null
1185	 2159	 	 PHI:Null
1185	 2207	 D.  SYNOPTIC REPORT FOR INVASIVE LUNG CARCINOMA	 PHI:Null
1185	 2235	 Specimen type:  Lobectomy	 PHI:Null
1185	 2238	 	 PHI:Null
1185	 2291	 Topography:  Medial basal segment, right lower lobe	 PHI:Null
1185	 2322	 Tumour location:  Peripheral	 PHI:Null
1185	 2342	 Tumour size:  25mm	 PHI:Null
1185	 2346	 	 PHI:Null
1185	 2489	 Tumour type (IASLC/ATS/ERS classification 2011) (1):  Adenocarcinoma, mixed subtype (60% acinar, 20 % micropapillary, 10% lepidic, 10% solid)	 PHI:Null
1185	 2492	 	 PHI:Null
1185	 2536	 Histological grade:  Poorly differentiated	 PHI:Null
1185	 2614	 Vessel invasion:  Lymphovascular invasion present  (occasional foci, D3, D7)	 PHI:Null
1185	 2646	 Perineural invasion:  Not seen	 PHI:Null
1185	 2755	 Pleural involvement:  Tumour invades beyond the elastic layer on elastic stain, pleural surface clear (PL1)	 PHI:Null
1185	 2793	 Resection margin:   17mm (bronchial)	 PHI:Null
1185	 2865	 Minimum distance between tumour and resection margin:  17mm (bronchial)	 PHI:Null
1185	 3035	 Other pathological features: There are 4 foci of atypical adenomatous hyperplasia, up to 4mm in size, clear of margins (D4 and 9).  The uninvolved lung is unremarkable.	 PHI:Null
1185	 3079	 12.  Pathological staging (AJCC 7th Ed.):	 PHI:Null
1185	 3113	 pT2 Invades visceral pleura (PL1)	 PHI:Null
1185	 3160	 pN1 Metastasis in ipsilateral hilar lymph node	 PHI:Null
1185	 3198	 pMX Cannot be assessed histologically	 PHI:Null
1185	 3209	 DIAGNOSIS:	 PHI:Null
1185	 3300	 A. Hilar lymph node:  metastatic carcinoma in 1 out of 1 lymph node, no extranodal spread.	 PHI:Null
1185	 3371	 B. Paratracheal lymph node: no evidence of malignancy in 1 lymph node.	 PHI:Null
1185	 3414	 C. Skin right flank: seborrhoeic keratosis	 PHI:Null
1185	 3440	 D. Right lower lobe lung:	 PHI:Null
1185	 3514	 - 25mm poorly differentiated adenocarcinoma, mixed subtype, margins clear	 PHI:Null
1185	 3553	 - Tumour invades visceral pleura (PL1)	 PHI:Null
1185	 3587	 - Lymphovascular invasion present	 PHI:Null
1185	 3835	 (1) Travis et al. International Association for the Study of Lung Cancer/American Thoracic Society/European Respiratory Society International Multidisciplinary Classification of Lung Adenocarcinoma. Journal of Thoracic Oncology 2011, 6(2), p.244.	 PHI:Null
1186	 25	 Episode No:  59K847594T	 IDNUM:59K847594T
1186	 36	 594847.PYK	 MEDICALRECORD:594847.PYK
1186	 56	 Trexler, ANNALISA	 PATIENT:Trexler, ANNALISA
1186	 74	 Lab No:  59K84759	 IDNUM:59K84759
1186	 82	 Quincey	 STREET:Quincey
1186	 121	 BACCHUS MARSH  Western Australia  5661	 CITY:BACCHUS MARSH
1186	 121	 BACCHUS MARSH  Western Australia  5661	 STATE:Western Australia
1186	 121	 BACCHUS MARSH  Western Australia  5661	 ZIP:5661
1186	 138	 Specimen: Tissue	 PHI:Null
1186	 157	 D.O.B:  27/12/1977	 DATE:27/12/1977=>1977-12-27
1186	 165	 Sex:  F	 PHI:Null
1186	 196	 Collected: 14/08/2012 at 09:17	 TIME:14/08/2012 at 09:17=>2012-08-14T09:17
1186	 231	 Location:  West-CALOUNDRA HOSPITAL	 DEPARTMENT:West
1186	 231	 Location:  West-CALOUNDRA HOSPITAL	 HOSPITAL:CALOUNDRA HOSPITAL
1186	 250	 DR MAURICE LETCHER	 DOCTOR:MAURICE LETCHER
1186	 320	 Distribution:   FILE-COPY, DR LINO, DR Suddath,   NSW-CANCER-REGISTRY	 DOCTOR:LINO
1186	 320	 Distribution:   FILE-COPY, DR LINO, DR Suddath,   NSW-CANCER-REGISTRY	 DOCTOR:Suddath
1186	 350	 ADDITIONAL REPORT:  (5.3.63)	 DATE:5.3.63=>2063-05-03
1186	 361	 CLINICAL:	 PHI:Null
1186	 408	 Ascending colon cancer.  Right hemicolectomy.	 PHI:Null
1186	 421	 MACROSCOPIC:	 PHI:Null
1186	 1269	 Specimen labelled "Bowel/right colon", consists of a right hemicolectomy comprising of a segment of terminal ileum measuring 40mm in length, 30mm in open circumference in continuity with caecum and ascending colon measuring 110mm in length with an open circumference of 60mm at the distal resection margin.  Situated on the ascending colon mucosa, 50mm from the proximal resection margin, there is a fungating tan tumour measuring 45 x 30mm. The cut surface of the tumour shows invasion through the bowel wall into the pericolic fat.  Appendix is identified measuring 55mm in length, 5mm in external diameter. Lymph nodes are identified measuring from 3-20mm across. Also included is a separate bowel segment with one staple edge measuring 20mm in length, 80mm in open circumference. A 10mm sessile polyp is present 10mm from the stapled margin.	 PHI:Null
1186	 1313	 Representative sections in fifteen blocks.	 PHI:Null
1186	 1602	 Block 1 - proximal margin; 2 - distal margin; 3-6 - tumour (3&4, 5&6 - full face); 7 - tumour research block; 8 - appendix;9 - apical lymph nodes; 10 - four lymph nodes; 11 - one lymph node bisected; 12 & 13 - four lymph nodes in each; 14 & 15 - separate bowel segment.  (FP/ec 16.10.62)	 DATE:16.10.62=>2062-10-16
1186	 1604	 	 PHI:Null
1186	 1644	 MICROSCOPIC: (Reported by Dr P Blovin)	 DOCTOR:P Blovi
1186	 1646	 	 PHI:Null
1186	 1679	 Site of tumour: Ascending colon	 PHI:Null
1186	 1712	 Maximum tumour diameter:   45 mm	 PHI:Null
1186	 1755	 Distance of tumour to nearer cut end:60 mm	 PHI:Null
1186	 1780	 Tumour perforation:   No	 PHI:Null
1186	 1785	 Type	 PHI:Null
1186	 1804	 Adenocarcinoma NOS	 PHI:Null
1186	 1840	 Differentiation by predominant area	 PHI:Null
1186	 1849	 Moderate	 PHI:Null
1186	 1864	 Local invasion	 PHI:Null
1186	 1894	 pT3 Beyond muscularis propria	 PHI:Null
1186	 1924	 Tumour involvement of margins	 PHI:Null
1186	 1947	 Cut ends: Not involved	 PHI:Null
1186	 1959	 Lymph nodes	 PHI:Null
1186	 1995	 Number of lymph nodes present:  14	 PHI:Null
1186	 2031	 Number of lymph nodes involved:  0	 PHI:Null
1186	 2061	 pN0 No regional LN metastasis	 PHI:Null
1186	 2085	 Lymphovascular invasion	 PHI:Null
1186	 2092	 Absent	 PHI:Null
1186	 2112	 Perineural invasion	 PHI:Null
1186	 2119	 Absent	 PHI:Null
1186	 2163	 Histologically confirmed distant metastases	 PHI:Null
1186	 2201	 pMX Cannot be assessed histologically	 PHI:Null
1186	 2241	 Background abnormalities/other comments	 PHI:Null
1186	 2421	 The separate piece of bowel shows a sessile serrated adenoma in the large bowel mucosa, 8mm clear the margin. There is no evidence of high-grade dysplasia or invasive malignancy.	 PHI:Null
1186	 2451	 The appendix is unremarkable.	 PHI:Null
1186	 2474	 Residual tumour status	 PHI:Null
1186	 2496	 R0 No residual tumour	 PHI:Null
1186	 2538	 Mismatch Repair Deficiency (MMRD) Status	 PHI:Null
1186	 2569	 MLH1  Loss of nuclear staining	 PHI:Null
1186	 2600	 PMS2  Loss of nuclear staining	 PHI:Null
1186	 2633	 MSH2  Preserved nuclear staining	 PHI:Null
1186	 2666	 MSH6  Preserved nuclear staining	 PHI:Null
1186	 2675	 Comment:	 PHI:Null
1186	 2943	 Absence (loss) of nuclear staining for any of the mismatch repair enzymes MLH1, PMS2, MSH2 or MSH6 is associated with microsatellite instability phenotype (MSI), and may reflect the presence of a germline mutation or somatic inactivation of that mismatch repair gene.	 PHI:Null
1186	 2969	 Summary - TNM 7th Edition	 PHI:Null
1186	 2995	 pT3    pN0     pMX     R0	 PHI:Null
1186	 3005	 DIAGNOSIS	 PHI:Null
1186	 3026	 Right hemicolectomy:	 PHI:Null
1186	 3130	 Moderately differentiated adenocarcinoma of the ascending colon, invading pericolic fat, margins clear	 PHI:Null
1186	 3177	 14 lymph nodes with no evidence of malignancy	 PHI:Null
1186	 3245	 Sessile serrated adenoma in separate bowel segment, margins clear	 PHI:Null
1186	 3247	 	 PHI:Null
1186	 3277	 ADDITIONAL REPORT:  (27.3.63)	 DATE:27.3.63=>2063-03-27
1186	 3376	 Report from CHERBOURG HOSPITAL Cancer Centre, Northern Territory:  Reported by:  WADJARRI STJAMES.	 HOSPITAL:CHERBOURG HOSPITAL
1186	 3376	 Report from CHERBOURG HOSPITAL Cancer Centre, Northern Territory:  Reported by:  WADJARRI STJAMES.	 STATE:Northern Territory
1186	 3376	 Report from CHERBOURG HOSPITAL Cancer Centre, Northern Territory:  Reported by:  WADJARRI STJAMES.	 DOCTOR:WADJARRI STJAMES
1186	 3400	 BRAF MUTATION ANALYSIS:	 PHI:Null
1186	 3411	 SPECIMEN:	 PHI:Null
1186	 3497	 Received from 8 GOOLAGONG CRESCENT Laboratory Service, 1 block labelled "59K84759.4".	 DEPARTMENT:8 GOOLAGONG CRESCENT
1186	 3497	 Received from 8 GOOLAGONG CRESCENT Laboratory Service, 1 block labelled "59K84759.4".	 IDNUM:59K84759.4
1186	 3508	 PATHOLOGY:	 PHI:Null
1186	 3545	 Histological Typing: Adenocarcinoma.	 PHI:Null
1186	 3669	 The sample was reviewed by a pathologist and was considered to have 70% tumour cells within the area selected for analysis.	 PHI:Null
1186	 3687	 TEST DESCRIPTION	 PHI:Null
1186	 4135	 The sample was analysed for mutations at or surrounding codon 600 within exon 15 of the BRAF gene encompassing the region containing 97% of all BRAF mutations, using high resolution melting (HRM) analysis (Catalogue of Somatic Mutations in Cancer [1]).  Abnormal HRM traces are subjected to DNA sequencing for characterisation.  This assay is capable of detecting BRAF mutations providing the mutant allele is present at a level of 10% or greater.	 PHI:Null
1186	 4163	 RESULT:   MUTATION DETECTED	 PHI:Null
1186	 4202	 BRAF: c.1799T>A: p.VaI600G1u (V600E)	 PHI:Null
1186	 4218	 INTERPRETATION	 PHI:Null
1186	 4375	 The p. Val600Glu (V600E) mutation in exon 15 of the BRAF gene was detected, which indicates that this tumour is unlikely to be sensitive to EGFR inhibitors.	 PHI:Null
1186	 4384	 Comments	 PHI:Null
1186	 4994	 BRAF mutations are found in 5-20% of colorectal cancers and 30-70% melanomas, in the majority of cases (90% in melanoma) the mutation results in the V600E protein change [1.2].  V600E specific BRAF inhibitors (e.g. Vemurafenib) have been developed to inhibit oncogenic BRAF in melanoma patients.  Trials of Vemurafenib have shown that melanoma patients with the BRAF V600K mutation may also benefit from treatment [3].  The presence of a BRAF mutation in colorectal cancer can be used to rule-out Lynch syndrome and it also indicates that the patient will be insensitive to EGFR inhibitors e.g. cetuximab [4].	 PHI:Null
1186	 5045	 Please note:  Synonymous changes are not reported.	 PHI:Null
1186	 5110	 Reference articles: 1) Catalogue of Somatic Mutations in Cancer:	 PHI:Null
1186	 5383	 http://sanger.ac.uk/genetics/CGP/cosmic/.2). 2)Gamett and Marais (2004) Cancer Cell; 6:313-319. 3) Chapman et al, (2011) N Engl I Med (364)26: 2507.16.4) Sharma et al, (2010) Arch Pathol Lab Med; 134: 1225-1228, Reference Sequence GenBankAccession Number: BRAF NM_004333.4	 PHI:Null
1186	 5495	 The nomenclature used is in accordance with the Human Genome Variation Society (HGVS) guidelines: www.hgvs.org.	 PHI:Null
1186	 5523	 ADDITIONAL REPORT, 5/7/63:	 DATE:5/7/63=>2063-05-07
1186	 5629	 Sections were sent to Lowy Pathology,QLD for BRAF Mutation Analysis, the results of which are as follows:	 DEPARTMENT:Lowy
1186	 5629	 Sections were sent to Lowy Pathology,QLD for BRAF Mutation Analysis, the results of which are as follows:	 STATE:QLD
1186	 5638	 Summary:	 PHI:Null
1186	 5882	 The somatic BRAF mutation V600E was PRESENT in tumour DNA from this patient. This finding indicates that methylation of the MLH1 gene promoter may be present but should be interpreted in association with other laboratory and clinical findings.	 PHI:Null
1186	 5898	 Type of study:	 PHI:Null
1186	 5919	 Somaticmutation test	 PHI:Null
1186	 5944	 Clinical details: cancer	 PHI:Null
1186	 5956	 Background:	 PHI:Null
1186	 6428	 Absence of MLH1 gene expression in a tumour can be due to heritable or somatic mutations in the MLH1 gene. Heritable mutations cause hereditary non-polyposis colorectal cancer (HNPCC, or Lynch syndrome) whereas somatic mutations cause non-familial cancers. A common type of somatic mutation involving the MLH1 gene is epigenetic silencing due to methylation of the promoter; epigenetic mutations are rarely familial. Hence the loss of MLH1 gene expression due to promoter	 PHI:Null
1186	 6523	 methylation makes if very unlikely that the patient has a heritable mutation in the MLH1 gene.	 PHI:Null
1186	 6898	 A specific somatic mutation in the BRAF gene, c.1799T>A (p.Val600Glu or V600E), is a useful surrogate marker for methylation of the MLH1 promoter in tumour tissue. The absence of the V600E mutation in tumour tissue is strongly associated (>95%) with absence of methylation of the MLH1 promoter. Absence of the V600E mutation is consistent with, but not diagnostic of, HNPCC.	 PHI:Null
1186	 7114	 The presence of the V600E mutation is associated (75%) with methylation of the MLH1 promoter. The presence of the V600E mutation indicates that HNPCC is unlikely but does not exclude other familial cancer syndromes.	 PHI:Null
1186	 7122	 Method:	 PHI:Null
1186	 7439	 Mutation testing is performed on DNA isolated from paraffin-embedded tumour tissue. A region including nucleotide 1799 is amplified by PCR and the presence of the T>Amutation is determined by a single nucleotide primer extension assay. This assay will detect a mutation that is present in 5% or more of cells tested.	 PHI:Null
1186	 7451	 References:	 PHI:Null
1186	 7494	 NCBI reference sequence BRAF: NM_004333.4.	 PHI:Null
1186	 7547	 Weisenberger DJ et al. Nature Genetics 2006;38:787.	 PHI:Null
1186	 7587	 Deng G et al. Clin Can Res 2004;10:191.	 PHI:Null
1186	 7596	 Results:	 PHI:Null
1186	 7778	 The tissue block 59 K84759 4 (Ameren Corporation) was used for this analysis. The tumour cell content was >70%. The BRAF mutation c.1799T>A (p.Val600Glu) was PRESENT in this sample.	 IDNUM:59 K84759 4
1186	 7778	 The tissue block 59 K84759 4 (Ameren Corporation) was used for this analysis. The tumour cell content was >70%. The BRAF mutation c.1799T>A (p.Val600Glu) was PRESENT in this sample.	 ORGANIZATION:Ameren Corporatio
1186	 7786	 P Ojano	 DOCTOR:P Ojano
1186	 7810	 Head, RENAL CLINIC Unit	 DEPARTMENT:RENAL CLINIC
1186	 7897	 Referral site: South Western Area Cancer Clinic, TIMBOON & DISTRICT HEALTHCARE SERVICE	 DEPARTMENT:South Western Area
1186	 7897	 Referral site: South Western Area Cancer Clinic, TIMBOON & DISTRICT HEALTHCARE SERVICE	 HOSPITAL:TIMBOON & DISTRICT HEALTHCARE SERVICE
1187	 24	 Episode No:  17H878652C	 IDNUM:17H878652C
1187	 36	 1728786.NGC	 MEDICALRECORD:1728786.NGC
1187	 59	 SPRIGGS, REINA JAGUN	 PATIENT:SPRIGGS, REINA JAGUN
1187	 86	 Lab No:  17H87865,17H87865	 IDNUM:17H87865
1187	 86	 Lab No:  17H87865,17H87865	 IDNUM:17H87865
1187	 92	 Rossi	 STREET:Rossi
1187	 125	 PORT ADELAIDE ENFIELD  TAS  4486	 CITY:PORT ADELAIDE ENFIELD
1187	 125	 PORT ADELAIDE ENFIELD  TAS  4486	 STATE:TAS
1187	 125	 PORT ADELAIDE ENFIELD  TAS  4486	 ZIP:4486
1187	 151	 Specimen: Washings,Tissue	 PHI:Null
1187	 168	 D.O.B:  8/4/1984	 DATE:8/4/1984=>1984-04-08
1187	 176	 Sex:  F	 PHI:Null
1187	 207	 Collected: 27/08/2012 at 11:34	 TIME:27/08/2012 at 11:34=>2012-08-27T11:34
1187	 291	 Location:  Southern IML - LISMORE BASE HOSPITAL - RIVERLANDS DRUG & ALCOHOL SERVICE	 DEPARTMENT:Southern IML
1187	 291	 Location:  Southern IML - LISMORE BASE HOSPITAL - RIVERLANDS DRUG & ALCOHOL SERVICE	 HOSPITAL:LISMORE BASE HOSPITAL - RIVERLANDS DRUG & ALCOHOL SERVICE
1187	 319	 DR Simran Charissa Huckabey	 DOCTOR:Simran Charissa Huckabey
1187	 395	 Distribution:   FILE-COPY, DR Jackie, DR Baj, DRKIRK,   NSW-CANCER-REGISTRY	 DOCTOR:Jackie
1187	 395	 Distribution:   FILE-COPY, DR Jackie, DR Baj, DRKIRK,   NSW-CANCER-REGISTRY	 DOCTOR:Baj
1187	 395	 Distribution:   FILE-COPY, DR Jackie, DR Baj, DRKIRK,   NSW-CANCER-REGISTRY	 DOCTOR:KIRK
1187	 405	 CLINICAL:	 PHI:Null
1187	 449	 Papillary serous carcinoma, ?primary.  NHL.	 PHI:Null
1187	 462	 MACROSCOPIC:	 PHI:Null
1187	 495	 Patient details checked by NJ/lj	 DOCTOR:NJ
1187	 1258	 A.  Specimen labelled "Uterus, cervix, both tubes and ovaries", consists of a uterus with attached cervix and fallopian tubes and ovaries weighing 62g.  The uterus measures 70 x 50 x 28mm and hasa smooth and shiny serosal surface. The cervix measures 30 x 20mm.  The cervical mucosa is unremarkable. The right ovary measures 30 x 10 x 10mm and appears unremarkable. The right fallopian tube measures 60x 5 x 5mm.  Close to the fimbria there is a yellow nodule, ? lipoma measuring 20 x 15 x 10mm. The left ovary measures 35 x 10 x 10mm and appears macroscopically unremarkable.  Theleft fallopian tube measures 60 x 5 x 5mm. On sectioning the endometrium is 1mm in maximum thickness with a small polyp 7 x 5 x 5mm. The myometrium is 10mm in maximum thickness.	 PHI:Null
1187	 1807	 Blocks 1-3 - 1 full LS of anterior body and cervix; 4-6 - 1 full LS of posterior body and cervix; 7 - 2 representative sections of posterior endomyometrium with polyp; 8 - right parametrial tissue; 9 - left parametrial tissue; 10 - right fimbria; 11 - right fallopian tube, right ovary; 12 - left fimbria; 13 - left ovary, left fallopian tube; 14 - remainder of the right ovary; 15-17 -remainder of the right fallopian tube; 18-20 - remainder of the left ovary; 21 & 22 - remainder of the left fallopian tube; 23-35 - remainder of the endometrium.	 PHI:Null
1187	 1943	 B.  Specimen labelled "Left diaphragm peritoneum", consists of a small piece of fibrofatty tissue 5mm in maximum dimension. AE 1block.	 PHI:Null
1187	 2206	 C.  Specimen labelled "Omental biopsy", consists of multiple pieces of omentum measuring in aggregate 100 x 50 x 30mm. A white and solid nodule is identified measuring 10 x 10 x 7mm. Block 1 - nodule; 2 & 3- other areas; 4-6 - extra sections.   (TG/ec 30.10.62)	 DOCTOR:TG
1187	 2206	 C.  Specimen labelled "Omental biopsy", consists of multiple pieces of omentum measuring in aggregate 100 x 50 x 30mm. A white and solid nodule is identified measuring 10 x 10 x 7mm. Block 1 - nodule; 2 & 3- other areas; 4-6 - extra sections.   (TG/ec 30.10.62)	 DATE:30.10.62=>2062-10-30
1187	 2208	 	 PHI:Null
1187	 2249	 MICROSCOPIC: (Reported by Dr D Sledge)	 DOCTOR:D Sledge
1187	 2756	 A.  Sections of the cervix are unremarkable.  Sections of the endometrial polyp show a small area of crowded glands which show tubal metaplasia; the featuresare most consistent with focal complex hyperplasia but there is no definite atypia and there is no evidence of malignancy.  The whole endometrium has been blocked and the endometrium away from the polyp is thin and inactive.  The myometrium is unremarkable.  The ovaries and fallopian tubes have been completely blocked and no abnormality is seen.	 PHI:Null
1187	 2832	 B.  Sections show fibrofat and some smooth muscle.  No abnormality is seen.	 PHI:Null
1187	 3024	 C.  Sections of the described nodule show that this consists of dense, collagenous fibrous tissue.  Elsewhere there is alsosome patchy fat necrosis in the omentum but no tumour is identified.	 PHI:Null
1187	 3098	 The slides of the endometrial polyp have also been viewed by Dr D Hersey.	 DOCTOR:D Hersey
1187	 3109	 DIAGNOSIS:	 PHI:Null
1187	 3224	 A.  Uterus, ovaries and fallopian tubes:  Endometrial polyp with focal complex hyperplasia.  No other abnormality.	 PHI:Null
1187	 3281	 B.  Left diaphragmatic peritoneum:  No abnormality seen.	 PHI:Null
1187	 3359	 C.  Omental biopsy:  Fibrotic nodule and patchy fat necrosis, no tumour seen.	 PHI:Null
1187	 3361	 	 PHI:Null
1188	 24	 Episode No:  38Y579500N	 IDNUM:38Y579500N
1188	 36	 3895795.BBN	 MEDICALRECORD:3895795.BBN
1188	 60	 Schlereth, Lirra Jami	 PATIENT:Schlereth, Lirra Jami
1188	 78	 Lab No:  38Y57950	 IDNUM:38Y57950
1188	 90	 Brindabella	 STREET:Brindabella
1188	 111	 LEONGATHA  ACT  5607	 CITY:LEONGATHA
1188	 111	 LEONGATHA  ACT  5607	 STATE:ACT
1188	 111	 LEONGATHA  ACT  5607	 ZIP:5607
1188	 128	 Specimen: Tissue	 PHI:Null
1188	 146	 D.O.B:  27/2/1988	 DATE:27/2/1988=>1988-02-27
1188	 154	 Sex:  F	 PHI:Null
1188	 181	 Collected: 17/10/2062 at :	 DATE:17/10/2062=>2062-10-17
1188	 231	 Location:  MEDIC/SURGERY WARD-LAKE GRACE HOSPITAL	 DEPARTMENT:MEDIC/SURGERY WARD
1188	 231	 Location:  MEDIC/SURGERY WARD-LAKE GRACE HOSPITAL	 HOSPITAL:LAKE GRACE HOSPITAL
1188	 256	 DR Trevor JARRETT Yokiel	 DOCTOR:Trevor JARRETT Yokiel
1188	 282	 Distribution:   FILE-COPY	 PHI:Null
1188	 292	 CLINICAL:	 PHI:Null
1188	 471	 Omentectomy and splenectomy.  Endometrial cancer.  Recurrent endometrial cancer, chemotherapy prior to surgery.  Please also comment on chemotherapy effect, and ER/PR receptors.	 PHI:Null
1188	 484	 MACROSCOPIC:	 PHI:Null
1188	 646	 A.  Specimen labelled "Right pelvic side wall", consists of two pieces of solid tissue 15 x 5 x 3mm and 7 x 6 x 3mm.  The larger piece is trisected, AE 1 block.	 PHI:Null
1188	 737	 B.  Specimen labelled "Small bowel nodule", consists of a 6 x 3 x 2mm nodule. AE 1 block.	 PHI:Null
1188	 870	 C.  Specimen labelled "Caecal nodule", consists of a nodular piece of fibrofatty tissue 15 x 12 x 6mm. Serially sliced, AE 1 block.	 PHI:Null
1188	 1159	 D.  Specimen labelled "Omentum", consists of a 65 x 45 x 20mm piece of omental tissue.  Most of the specimen is occupied by a 48 x 45 x 17mm indurated nodule with a yellow/tan lobulated cut surface.  Blocks 1 & 2- representative sections of the nodule; 2 - reserved block for tumour bank.	 PHI:Null
1188	 1752	 E.  Specimen labelled "Omentum plus spleen", consists of a 130 x 70 x 55mm spleen weighing 208g and a separate piece of omental fatty tissue 180 x 150 x 20mm.  Within the spleen there is a 70 x 65 x 35mm nodule.The cut surface of the nodule is partially necrotic and partially cystic. There are no nodules within the omental tissue.  Blocks 1 & 2 - representative sections the cystic area of the splenic nodule; 3 - representative sections the necrotic area of the nodule; 4 - interface of normal spleen and the nodule ; 5-7 - representative sections of the omental tissue.  (KH/ec  20.10.62)	 DOCTOR:KH
1188	 1752	 E.  Specimen labelled "Omentum plus spleen", consists of a 130 x 70 x 55mm spleen weighing 208g and a separate piece of omental fatty tissue 180 x 150 x 20mm.  Within the spleen there is a 70 x 65 x 35mm nodule.The cut surface of the nodule is partially necrotic and partially cystic. There are no nodules within the omental tissue.  Blocks 1 & 2 - representative sections the cystic area of the splenic nodule; 3 - representative sections the necrotic area of the nodule; 4 - interface of normal spleen and the nodule ; 5-7 - representative sections of the omental tissue.  (KH/ec  20.10.62)	 DATE:20.10.62=>2062-10-20
1188	 1795	 MICROSCOPIC (Reported by Dr I Majersky):	 DOCTOR:I Majersky
1188	 1903	 A.  Sections are of fibrofatty tissue with no significant abnormality.  There is no evidence of malignancy.	 PHI:Null
1188	 2097	 B. Sections show fibrofatty tissue with a small focus of metastatic adenocarcinoma, measuring 0.9mm.  The tumour shows poorly formed glands.  Calcification is focally present within the tumour.	 PHI:Null
1188	 2239	 C.  Sections of fibrofatty tissue show a small focus of necrosis.  No viable tumour components are seen.  There is no evidence of malignancy.	 PHI:Null
1188	 2674	 D.  Sections of the omental nodule show metastatic endometrioid adenocarcinoma.  Majority of tumour nodule shows extensive necrosis and fibrosis with numerous macrophages (more than 95%).  At the centre, several small foci of viable tumour are present, measuring up to 2mm in diameter.  The appearances are in keeping with those of previous neo-adjuvant therapy.  The tumour cells are positive for ER and the stain for PR is negative.	 PHI:Null
1188	 3184	 E.  Sections of the splenic nodule show metastatic endometrioid adenocarcinoma.  Majority of tumour nodule shows extensive necrosis and fibrosis with numerous macrophages (more than 95%).  At the edge of nodule/cyst, several small foci of viable tumour are present, each measuring less than 2mm in diameter.  The appearances are in keeping with those of previous neo-adjuvant therapy.  The rest of spleen shows no significant abnormality.  The separate piece of omental tissue shows no evidence of malignancy.	 PHI:Null
1188	 3232	 Representative slides are shown to Dr I Bosack.	 DOCTOR:I Bosack
1188	 3243	 DIAGNOSIS:	 PHI:Null
1188	 3299	 A.  Right pelvic side wall - No evidence of malignancy.	 PHI:Null
1188	 3365	 B.  Small bowel nodule - Metastatic endometrioid adenocarcinoma.	 PHI:Null
1188	 3412	 C.  Caecal nodule - No evidence of malignancy.	 PHI:Null
1188	 3467	 D.  Omentum - Metastatic endometrioid adenocarcinoma.	 PHI:Null
1188	 3533	 E.  Omentum plus spleen - Metastatic endometrioid adenocarcinoma.	 PHI:Null
1189	 13	 867599.PQW	 MEDICALRECORD:867599.PQW
1189	 29	 DISHONG, OVIDIA	 PATIENT:DISHONG, OVIDIA
1189	 38	 86U59966	 IDNUM:86U59966
1189	 73	 Last edited : 23/10/2062  Page: 2	 DATE:23/10/2062=>2062-10-23
1189	 84	 CLINICAL:	 PHI:Null
1189	 151	 Pseudomyxoma peritonei L pleural cavity.  Parietal pleura/tumour.	 PHI:Null
1189	 164	 MACROSCOPIC:	 PHI:Null
1189	 500	 Specimen labelled "Pleural debridement", consists of multiple pieces of irregularly shaped, thickened pleura with multiple cystic deposits containing mucin.  The tissue fragments measure from 25-135mm in maximum dimension and 210 x 200 x 35mm in aggregate, with a combined weight of 633.3g.  No normal pieces of pleura are identified.	 PHI:Null
1189	 584	 Blocks 1-5 - representative sections; 6 - tumour reserve block.  (SC/ec  19.10.62)	 DATE:19.10.62=>2062-10-19
1189	 625	 MICROSCOPIC: (Reported by Dr W Obstfeld)	 DOCTOR:W Obstfeld
1189	 1092	 The sections show thickened fibrous tissue withnumerous deposits of extracellular mucin.  There are small strips of atypical columnar epithelium at the edges of some mucin pools, showing intestinal differentiation and pseudostratification of nuclei with occasional papilliform structures.   The tumour shows low grade features with no areas of high grade adenocarcinoma.  There is a small amount of uninvolved fat, haemorrhagic lung and skeletal muscle at the edges.	 PHI:Null
1189	 1556	 Immunoperoxidase stains show expression of monoclonal CEA and cytokeratin 20 antigens in the neoplastic cells, which also show focal expression of CDX2 antigen.  Cytokeratin 7,oestrogen and progesterone receptor antigens are not expressed in the neoplastic cells, while mesothelial and lung cells express cytokeratin 7 and stromal cells express oestrogen receptor antigens.  The findings are consistent with mucinous neoplasm with intestinal type differentiation.	 PHI:Null
1189	 1567	 CONCLUSION	 PHI:Null
1189	 1605	 Pleura:  Low grade mucinous neoplasm.	 PHI:Null
1190	 24	 Episode No:  07L190417H	 IDNUM:07L190417H
1190	 35	 074190.MFS	 MEDICALRECORD:074190.MFS
1190	 52	 Reedus, KELLIE	 PATIENT:Reedus, KELLIE
1190	 70	 Lab No:  07L19041	 IDNUM:07L19041
1190	 79	 Monetary	 STREET:Monetary
1190	 103	 KYABRAM  Victoria  7000	 CITY:KYABRAM
1190	 103	 KYABRAM  Victoria  7000	 STATE:Victoria
1190	 103	 KYABRAM  Victoria  7000	 ZIP:7000
1190	 120	 Specimen: Tissue	 PHI:Null
1190	 137	 D.O.B:  3/5/2011	 DATE:3/5/2011=>2011-05-03
1190	 145	 Sex:  F	 PHI:Null
1190	 176	 Collected: 01/11/2012 at 09:11	 TIME:01/11/2012 at 09:11=>2012-11-01T09:11
1190	 217	 Location:  West-NAMBOUR GENERAL HOSPITAL	 DEPARTMENT:West
1190	 217	 Location:  West-NAMBOUR GENERAL HOSPITAL	 HOSPITAL:NAMBOUR GENERAL HOSPITAL
1190	 241	 DR DONALD Jeremiah Burg	 DOCTOR:DONALD Jeremiah Burg
1190	 290	 Distribution:   FILE-COPY,   NSW-CANCER-REGISTRY	 PHI:Null
1190	 300	 CLINICAL:	 PHI:Null
1190	 360	 Recurrent pseudomyxoma.  Peritonei and bowel obstruction.	 PHI:Null
1190	 399	 (Tumour shows origin from appendix).	 PHI:Null
1190	 452	 (Previous - low grade mucinous neoplasm - 07L19041).	 IDNUM:07L19041
1190	 465	 MACROSCOPIC:	 PHI:Null
1190	 1115	 A.  Specimen labelled "Small bowel" consists of a segment of small bowel measuring 225mm in length and up to 45mm in width.  The external surface of the small bowel is focally haemorrhagic and shows extensive fibrousadhesions some of which appear mucinous.  Approximately 30mm from one resection margin is an area of tumour invasion and stricture formation measuring 25 x 20mm.  Approximately 25mm from the other resection margin is a multicystic tumour, 6 x 10 x 5mm located within the serosal layer.  Three mucinous cystic nodules are also present within the small bowel mesentery.  Several small uninvolved nodes are present within the mesentery.	 PHI:Null
1190	 1498	 Blocks:  1- shave blue margin; 2- shave green margin; 3 to 5 - representative sections of wall tumour; 6 to 9 - representative sections of disrupted mucosal lesions; 10 - representative sections adhesions; 11 - two lymph nodes; 12 - two lymph nodes; 13 - six possible lymph nodes; 14 - five possible lymph nodes; 15 to 19 - representative mesenteric fat with possible lymph nodes.	 PHI:Null
1190	 1792	 B.  Specimen labelled "Intraabdominal tumour" consists of a tumour which is cystic in nature and filled with gelatinous material.  Thewall of the cyst measures up to 8mm.  There is a nodule on the cyst surface measuring up to 10mm.  The surrounding mucinous peritoneum shows mucinous deposits.	 PHI:Null
1190	 2017	 Blocks:  1 & 2 - representative sections of tumour including nodule area;3 - representative section of remainder of cyst; 4 to 7 - representative sections of attached peritoneum; (Blocks:  B8 & B9 - reserved tumour block).	 PHI:Null
1190	 2041	 -----------------------	 PHI:Null
1190	 2330	 B.  Specimen labelled "Intraabdominal tumour" consists of fibrous peritoneum with cyst attachedmeasuring up to 70mm in maximal diameter with multiple separate pieces of gelatinous material measuring in aggregate 100 x 100 x 50mm.  The peritoneum and cyst are covered in fibrous adhesions.	 PHI:Null
1190	 2351	 --------------------	 PHI:Null
1190	 2674	 C.  Specimen labelled "Gastric nodule" consists of a well circumscribed nodule measuring 34 x 27 x 20mm.  The external surface is smooth and glistening.  There is no mucosa but a small amount of fatty tissue attached.  On cut section it is uniformly nodular, glistening with transparent multicystic areas containing mucus.	 PHI:Null
1190	 2758	 Blocks:  1 to 3 - representative sections in 3 blocks (Blocks:  C3 -reserved block)	 PHI:Null
1190	 2774	 (VX/mm 3.1.62)	 DOCTOR:VX
1190	 2774	 (VX/mm 3.1.62)	 DATE:3.1.62=>2062-01-03
1190	 2815	 MICROSCOPIC:  (Reported by Dr C Hobbie):	 DOCTOR:C Hobbie
1190	 3206	 A.  The small bowel tumour, 30mm from one resection margin shows a low grade invasive mucinous tumour which has extended through the full thickness of the bowel wall and has replaced much of the mucosa in this area.  Tumour is also present within the adjacent serosa.  This tumour shows both architectural, cytological and invasive features of a well differentiated mucinous adenocarcinoma.	 PHI:Null
1190	 3497	 The multicystic tumour 25mm from the other resection margin shows a multicystic low grade mucinous neoplasm.  The nodules within the mesentery as well as the deposits within the serosal adhesions have a similar appearance. Several small lymph nodes  are identified and these appear normal.	 PHI:Null
1190	 3711	 B.  Sections show a low grade mucinous neoplasm with cyst formation.  The attached peritoneum also shows widespread invasion by low grade mucinous neoplasm and the tumour invades to the attached skeletal muscle.	 PHI:Null
1190	 3821	 C.  The gastric nodule shows low grade mucinous neoplasm attached to the muscularis externa of the stomach.	 PHI:Null
1190	 3832	 COMMENT:	 PHI:Null
1190	 4216	 The appearance of the small bowel tumour which has invaded through the full thickness of the wall and replaced the mucosa is that of a well differentiated mucinous adenocarcinoma.  This tumour appears to have progressed and has become more invasive and cellular compared with the previous recurrence.  The epithelium is proliferative and the invasive glands are of irregular shape.	 PHI:Null
1190	 4227	 DIAGNOSIS:	 PHI:Null
1190	 4307	 A, B & C.  Small bowel resection plus intraabdominal tumour and gastric nodule:	 PHI:Null
1190	 4376	 -  Well differentiated mucinous adenocarcinoma invading small bowel.	 PHI:Null
1190	 4540	 -  Low grade invasive mucinous neoplasm involving small bowel serosa and mesentery, intraabdominal tumour, peritoneum and gastric nodule (pseudomyxoma peritonei).	 PHI:Null
1190	 4542	 	 PHI:Null
1190	 4545	 	 PHI:Null
1190	 4548	 	 PHI:Null
1191	 25	 Episode No:  71V930826C	 IDNUM:71V930826C
1191	 37	 7189308.GRC	 MEDICALRECORD:7189308.GRC
1191	 60	 LANGEHENNIG, Leandra	 PATIENT:LANGEHENNIG, Leandra
1191	 78	 Lab No:  71V93082	 IDNUM:71V93082
1191	 94	 North Columbine	 STREET:North Columbine
1191	 118	 BATEMANS BAY  QLD  2623	 CITY:BATEMANS BAY
1191	 118	 BATEMANS BAY  QLD  2623	 STATE:QLD
1191	 118	 BATEMANS BAY  QLD  2623	 ZIP:2623
1191	 135	 Specimen: Tissue	 PHI:Null
1191	 153	 D.O.B:  10/2/1984	 DATE:10/2/1984=>1984-10-02
1191	 161	 Sex:  F	 PHI:Null
1191	 188	 Collected: 24/10/2062 at :	 DATE:24/10/2062=>2062-10-24
1191	 224	 Location:  HAPS - MUNGINDI HOSPITAL	 DEPARTMENT:HAPS
1191	 224	 Location:  HAPS - MUNGINDI HOSPITAL	 HOSPITAL:MUNGINDI HOSPITAL
1191	 240	 DR NATE Khokher	 DOCTOR:NATE Khokher
1191	 289	 Distribution:   FILE-COPY,   NSW-CANCER-REGISTRY	 PHI:Null
1191	 299	 CLINICAL:	 PHI:Null
1191	 320	 Peritoneal cancer.	 PHI:Null
1191	 333	 MACROSCOPIC:	 PHI:Null
1191	 1602	 A.  Specimen labelled "Uterus/tubes and ovaries" consists of a uterus with attached cervix, bilateral fallopian tubes and ovaries weighing 67g in total.  The uterus measures 80 x 50 x 35mm and has a smooth shiny serosal surface.  The ectocervix measures 40 x 33mm and has an unremarkable surface.  On sectioning the endometrium appears atrophic and the myometrium is 17mm in maximum thickness.  The myometrium contains four fibroids ranging from 5 to 7mm in maximum diameter.  The right fallopian tube is 45mm in length and up to 7mm in diameter.  The right ovary measures 20 x 17 x 12mm and has an unremarkable cut surface.  The left ovary measures 27 x 15 x 15mm and has an unremarkable cut surface.  The left fallopian tube is 45mm in length and up to 10mm in diameter.  There is a tan nodule attached to the fimbrial end of the left fallopian tube measuring 8 x 7 x 5mm.  :  1 to 3 - full longitudinal section of anterior body and cervix; 4 to 7 - full longitudinal section of posterior body and cervix; 8 - representative myometrial fibroid; 9 - representative right fallopian tube; 10 - representative right ovary; 11 - all of the fimbrial end of the left fallopian tube including the nodule; 12 - one TS left fallopian tube and representative of the left ovary.	 PHI:Null
1191	 1865	 B.  Specimen labelled "Omentum" consists of a piece of omental fatty tissue, 250 x 100 x 38mm.  There is an indurated area within the omental fat, 155 x 85 x 35mm.  The indurated area has a heterogenous cut surface varying from yellow to pale/mucoid in colour.	 PHI:Null
1191	 1977	 Blocks:  1 to 4 - representative sections of the tumour; 4 - reserved block for tumour bank.  (HM/mm 24.10.62)	 DATE:24.10.62=>2062-10-24
1191	 2021	 MICROSCOPIC:  (Reported by Dr U Gmernicki)	 DOCTOR:U Gmernicki
1191	 2289	 A.  Sections show small foci of moderately differentiated serous carcinoma involving the uterine serosa, the surface of both ovaries, the fimbrial ends of both tubes and the left paradexal soft tissue. The fimbrial end of the right tube also shows carcinoma in situ.	 PHI:Null
1191	 2367	 The ectocervix and endocervix are unremarkable.  The endometrium is atrophic.	 PHI:Null
1191	 2439	 B.  Sections show extensive moderately differentiated serous carcinoma.	 PHI:Null
1191	 2450	 DIAGNOSIS:	 PHI:Null
1191	 2682	 Moderately differentiated serous carcinoma of probable peritoneal origin extensively involving the omentum, also involving the surface of both ovaries, the fimbrial ends of both tubes, paradnexal soft tissue and the uterine serosa.	 PHI:Null
1193	 24	 Episode No:  92M631785N	 IDNUM:92M631785N
1193	 36	 9246317.UNN	 MEDICALRECORD:9246317.UNN
1193	 49	 Shan, Eddy	 PATIENT:Shan, Eddy
1193	 67	 Lab No:  92M63178	 IDNUM:92M63178
1193	 81	 Upper Montagu	 STREET:Upper Montagu
1193	 116	 ROCKHAMPTON  South Australia  6338	 CITY:ROCKHAMPTON
1193	 116	 ROCKHAMPTON  South Australia  6338	 STATE:South Australia
1193	 116	 ROCKHAMPTON  South Australia  6338	 ZIP:6338
1193	 133	 Specimen: Tissue	 PHI:Null
1193	 152	 D.O.B:  26/11/1997	 DATE:26/11/1997=>1997-11-26
1193	 160	 Sex:  F	 PHI:Null
1193	 191	 Collected: 29/08/2012 at 14:31	 TIME:29/08/2012 at 14:31=>2012-08-29T14:31
1193	 249	 Location:  UROLOGY DAY ONLY - CALVARY PUBLIC HOSPITAL ACT	 DEPARTMENT:UROLOGY DAY ONLY
1193	 249	 Location:  UROLOGY DAY ONLY - CALVARY PUBLIC HOSPITAL ACT	 HOSPITAL:CALVARY PUBLIC HOSPITAL ACT
1193	 269	 DR IRA Irwin PIGGIE	 DOCTOR:IRA Irwin PIGGIE
1193	 318	 Distribution:   FILE-COPY,   NSW-CANCER-REGISTRY	 PHI:Null
1193	 328	 CLINICAL:	 PHI:Null
1193	 356	 Recurrent ovarian cancer.	 PHI:Null
1193	 369	 MACROSCOPIC:	 PHI:Null
1193	 905	 A.  Specimen labelled "Terminal ileum", consists of a distorted segment of small bowel with multiple adhesions roughly 350mm in length.  In one of the areas of adhesion 50mm from the nearest resection margin, there is an indurated mesenteric area 25 x 25 x 20mm.  The mucosa appears normal. Blocks 1 & 2 - two resection margins (shaved margins); 3-6- the indurated mesenteric area; 7 - sections from area of adhesion; 8-11 - sections from areas of serosal roughening; 12 - ? lymph node; 13 - remainder of the indurated mesenteric area.	 PHI:Null
1193	 1627	 B.  Specimen labelled "Liver lobe", consists ofa partial hepatectomy 125 x 90 x 22mm with attached omental fatty tissue 100 x 70 x 30mm.  There is a tan indurated nodule within the liver 14 x 12 x 11mm.  The nodule abuts the capsule and is 10mm from the resection margin (inked blue).  The omental fatty tissue is adherent to the capsular surface of the liver adjacent to the nodule (block 1). There are two indurated nodules within the adherent fatty tissue from 5&20mm in maximum dimension.   Block 1- section of the nodule and the adherent omental fat; 2-3 - sections of the nodule in relation to the resection margin; 4 -section of liver away from the nodule; 5 & 6 - representatives, nodules within the fatty tissue.	 PHI:Null
1193	 1820	 C.  Specimen labelled "Right pararenal peritoneum", consists of a piece of fibrofatty tissue 55 x 40 x 35mm.  There is an indurated nodule 12mm in maximum dimension. Block 1 - nodule bisected.	 PHI:Null
1193	 2083	 D.  Specimen labelled "Coeliac node", consists of a piece of fibrofatty tissue 60 x 35 x 18mm.  The specimen is sliced. There are several lymph nodes within the specimen.  Block 1 - one bisected lymph node; 2 - up to four lymph nodes; 3 - two likely lymph nodes.	 PHI:Null
1193	 2449	 E.  Specimen labelled "Gallbladder", consists of a gallbladder 80mm in length and up to 70mm in circumference. The serosal surface is smooth.  The hepatic bed is inked blue.  The mucosal surface is green and granular. A cystic duct lymph node is not identified.  No gallstones or tumours are seen.  Block 1 - cystic duct margin; 2 - TS neck, TS body; 3 - LS fundus.	 PHI:Null
1193	 2764	 F.  Specimen labelled "Splenic mass", consists of a pieceof fatty tissue 55 x 45 x 30mm.  Most of the specimen is occupied by a 38 x 30 x 22mm nodule. The nodule has a necrotic cut surface.  Normal splenic tissue is not seen.  Blocks 1 & 2 -representative sections of the nodule; 2 - reserve block for tumour bank.	 PHI:Null
1193	 2977	 G.  Specimen labelled "Caecal adhesion", consists of threefragments of fibrofatty tissue 80 x 30 x 10mm in aggregate.  Specimen is serially sliced.  No indurated nodules are seen.  AE 6 blocks.  (UH/ec  10.2.62)	 DOCTOR:UH
1193	 2977	 G.  Specimen labelled "Caecal adhesion", consists of threefragments of fibrofatty tissue 80 x 30 x 10mm in aggregate.  Specimen is serially sliced.  No indurated nodules are seen.  AE 6 blocks.  (UH/ec  10.2.62)	 DATE:10.2.62=>2062-10-02
1193	 2979	 	 PHI:Null
1193	 3023	 MICROSCOPIC: (Reported by Dr Z Sterkenburg)	 DOCTOR:Z Sterkenburg
1193	 3270	 A.  Sections show small scattered foci of serous carcinoma within dense adhesions in the mesenteric fat.  The remainder of the bowel wall in uninvolved.  The surgical resection margins are free of tumour.  One mesenteric lymph node is negative.	 PHI:Null
1193	 3533	 B.  Sections show a partially necrotic focus of moderately differentiatedserous carcinoma (up to 14mm maximally) within the liver.  The carcinoma is well clear of the resection margin.  There is a second focus of serous carcinoma within the adherent omental fat.	 PHI:Null
1193	 3598	 The liver away from the tumour shows no significant abnormality.	 PHI:Null
1193	 3647	 C.  Sections show a deposit of serous carcinoma.	 PHI:Null
1193	 3851	 D.  One of six lymph nodes shows metastatic serous carcinoma.  No extracapsular spread is seen.  In addition the nodes show several scattered non-caseating granulomas, as previously reported in 92M63178.	 IDNUM:92M63178
1193	 3983	 E.  The gallbladder shows no significant abnormality.  The cystic duct lymph node is negative.  There is no evidence of malignancy.	 PHI:Null
1193	 4060	 F.  Sections show a deposit of serous carcinoma.  No splenic tissue is seen.	 PHI:Null
1193	 4105	 G.  Sections show no evidence of malignancy.	 PHI:Null
1193	 4116	 DIAGNOSIS:	 PHI:Null
1193	 4313	 Recurrent moderately differentiated serous carcinoma involving the small bowel mesentery, the liver and adherent omentalfat, right pararenal peritoneum, spleen and one of six (1 of 6) lymph nodes.	 PHI:Null
1193	 4372	 SUPPLEMENTARY REPORT (2.4.63, Reported by Dr Z Gugliotti)	 DATE:2.4.63=>2063-02-04
1193	 4372	 SUPPLEMENTARY REPORT (2.4.63, Reported by Dr Z Gugliotti)	 DOCTOR:Z Gugliotti
1193	 4540	 A three tier system is used for reporting serous carcinomas in our institution. Moderate and high grade serous carcinoma correspond to high grade in a two tier system.	 PHI:Null
1194	 25	 Episode No:  50J651733W	 IDNUM:50J651733W
1194	 36	 503651.UJI	 MEDICALRECORD:503651.UJI
1194	 54	 Lindemuth, HANK	 PATIENT:Lindemuth, HANK
1194	 72	 Lab No:  50J65173	 IDNUM:50J65173
1194	 82	 Burntside	 STREET:Burntside
1194	 127	 BEACONSFIELD UPPER  Northern Territory  3933	 CITY:BEACONSFIELD UPPER
1194	 127	 BEACONSFIELD UPPER  Northern Territory  3933	 STATE:Northern Territory
1194	 127	 BEACONSFIELD UPPER  Northern Territory  3933	 ZIP:3933
1194	 144	 Specimen: Tissue	 PHI:Null
1194	 163	 D.O.B:  28/12/2003	 DATE:28/12/2003=>2003-12-28
1194	 171	 Sex:  F	 PHI:Null
1194	 202	 Collected: 30/08/2012 at 09:20	 TIME:30/08/2012 at 09:20=>2012-08-30T09:20
1194	 268	 Location:  OBSTETRICS-WESTERN DISTRICT HEALTH SERVICE - PENSHURST	 DEPARTMENT:OBSTETRICS
1194	 268	 Location:  OBSTETRICS-WESTERN DISTRICT HEALTH SERVICE - PENSHURST	 HOSPITAL:WESTERN DISTRICT HEALTH SERVICE - PENSHURST
1194	 289	 DR Tobias ANDY GROSH	 DOCTOR:Tobias ANDY GROSH
1194	 338	 Distribution:   FILE-COPY,   NSW-CANCER-REGISTRY	 PHI:Null
1194	 348	 CLINICAL:	 PHI:Null
1194	 410	 High grade sarcoma (L) forefoot.  Cytogenetics (if possible).	 PHI:Null
1194	 423	 MACROSCOPIC:	 PHI:Null
1194	 1123	 Specimen labelled "Left forefoot" consists of a partial left forefoot amputation, 120mm (anterior to posterior), 105mm (right to left) and 52mm (superficial to deep).  Present on the medial aspect of the dorsum of foot there is an ulcerated nodule approximately 45mm in greatest dimension.Sectioning through the nodule shows a nodular, soft, pale tan/cream tumour extending from dermis to subcutis and on the length of tissue.  The tumour measures 40mm (medial to lateral), 30mm (superficial to deep) and 36mm (anterior to posterior).  The tumour appears well clear of resection margins.  The underside of the specimen lacks covering skin in most areas.   The underlying bone appears unremarkable.	 PHI:Null
1194	 1355	 Blocks:  1- tumour and medial/deep margin; 2 to 4 - one TS of tumour with closest medial/deep margin; 5&6 - one LS tumour and proximal margin; 7 - lateral soft tissue margin; 8 - reserved block for tissue bank.  (SZ/mm 30.10.62).	 DOCTOR:SZ
1194	 1355	 Blocks:  1- tumour and medial/deep margin; 2 to 4 - one TS of tumour with closest medial/deep margin; 5&6 - one LS tumour and proximal margin; 7 - lateral soft tissue margin; 8 - reserved block for tissue bank.  (SZ/mm 30.10.62).	 DATE:30.10.62=>2062-10-30
1194	 1668	 Additional blocks post decalcification:  9 & 10 - paired blocks LS proximal margin and underlying bone; 11 - tumour and underlying bone; 12 - lateral margin; 13 to 16 - full face of tumour including underlying bone deep and medial margins (block 15 - deep and medial margin; 16 - deep margin).  (LYc/mm 11.9.62)	 DOCTOR:LY
1194	 1668	 Additional blocks post decalcification:  9 & 10 - paired blocks LS proximal margin and underlying bone; 11 - tumour and underlying bone; 12 - lateral margin; 13 to 16 - full face of tumour including underlying bone deep and medial margins (block 15 - deep and medial margin; 16 - deep margin).  (LYc/mm 11.9.62)	 DATE:11.9.62=>2062-11-09
1194	 1706	 MICROSCOPIC: (Reported by Dr O Tipre)	 DOCTOR:O Tipre
1194	 2529	 The 40mm left forefoot tumour is a highgrade myxofibrosarcoma (myxoid MFH). The tumour has a similar appearance to the previously reported core and excisional biopsy specimens (50J65173 and 50J65173). The tumour expands the dermosubcutaneous tissue with a lobulated appearanceand consists of highly pleomorphic malignant cells, many of which have macronucleoli and prominent vacuolated cytoplasm, as well as, numerous bizarre multinucleated tumour cells. The tumour cells are surrounded by variably hyalinised fibromyxoid stroma. Mitoses are readily identified with up to 32 mitoses per 10 hpf, including atypical mitoses. Necrosis is inconspicuous. Tumour extends focally through the dermis into ulcerated epidermis. Towards its inferior aspect, thetumour infiltrates focally through periosteum and into bone (block 11).	 IDNUM:50J65173
1194	 2529	 The 40mm left forefoot tumour is a highgrade myxofibrosarcoma (myxoid MFH). The tumour has a similar appearance to the previously reported core and excisional biopsy specimens (50J65173 and 50J65173). The tumour expands the dermosubcutaneous tissue with a lobulated appearanceand consists of highly pleomorphic malignant cells, many of which have macronucleoli and prominent vacuolated cytoplasm, as well as, numerous bizarre multinucleated tumour cells. The tumour cells are surrounded by variably hyalinised fibromyxoid stroma. Mitoses are readily identified with up to 32 mitoses per 10 hpf, including atypical mitoses. Necrosis is inconspicuous. Tumour extends focally through the dermis into ulcerated epidermis. Towards its inferior aspect, thetumour infiltrates focally through periosteum and into bone (block 11).	 IDNUM:50J65173
1194	 2589	 The tumour appears clear of margins, which are as follows:	 PHI:Null
1194	 2619	 Medial margin: 5mm (block 2).	 PHI:Null
1194	 2652	 Lateral margin: >10mm (block 7).	 PHI:Null
1194	 2686	 Proximal margin: >10mm (block 6).	 PHI:Null
1194	 2735	 Inferior (deep margin): 10mm (blocks 15 and 16).	 PHI:Null
1194	 2752	 FNCLCC GRADE = 3	 PHI:Null
1194	 2778	 Tumour differentiation: 3	 PHI:Null
1194	 2795	 Mitotic count: 3	 PHI:Null
1194	 2807	 Necrosis: 1	 PHI:Null
1194	 2809	 	 PHI:Null
1194	 2820	 DIAGNOSIS:	 PHI:Null
1194	 2899	 Left forefoot: High grade myxofibrosarcoma (myxoid MFH), margins appear clear.	 PHI:Null
1194	 2901	 	 PHI:Null
1195	 24	 Episode No:  71A252691H	 IDNUM:71A252691H
1195	 35	 710252.RYE	 MEDICALRECORD:710252.RYE
1195	 52	 WIMAN, DERRICK	 PATIENT:WIMAN, DERRICK
1195	 70	 Lab No:  71A25269	 IDNUM:71A25269
1195	 79	 Casa Mia	 STREET:Casa Mia
1195	 114	 KINGAROY  Northern Territory  3137	 CITY:KINGAROY
1195	 114	 KINGAROY  Northern Territory  3137	 STATE:Northern Territory
1195	 114	 KINGAROY  Northern Territory  3137	 ZIP:3137
1195	 131	 Specimen: Tissue	 PHI:Null
1195	 149	 D.O.B:  30/3/2016	 DATE:30/3/2016=>2016-03-30
1195	 157	 Sex:  M	 PHI:Null
1195	 188	 Collected: 30/08/2012 at 09:19	 TIME:30/08/2012 at 09:19=>2012-08-30T09:19
1195	 255	 Location:  4 JABIRU PLACE-EAST WIMMERA HEALTH SERVICE - WYCHEPROOF	 DEPARTMENT:4 JABIRU PLACE
1195	 255	 Location:  4 JABIRU PLACE-EAST WIMMERA HEALTH SERVICE - WYCHEPROOF	 HOSPITAL:EAST WIMMERA HEALTH SERVICE - WYCHEPROOF
1195	 277	 DR Chase WYATT CAPRIA	 DOCTOR:Chase WYATT CAPRIA
1195	 303	 Distribution:   FILE-COPY	 PHI:Null
1195	 313	 CLINICAL:	 PHI:Null
1195	 465	 Cholecystectomy (gallbladder) + right hepatectomy (liver).  Lesion segment 5/7/8.  Patient HIV+ & Hep B +.  Previous chemo and XRT for anal SCC.  ?HCC.	 PHI:Null
1195	 478	 MACROSCOPIC:	 PHI:Null
1195	 1157	 A.  Specimen labelled "Liver" consists of theright part of a liver measuring 130 (medial to lateral) x 230mm (superior to inferior) x 90mm (superficial to deep).  In segment five, seven and eight there is a large white and fleshy tumour with areas of necrosis, fibrosisand haemorrhage and measures 120 x 90 x 70mm.  The tumour is located 25mm from the surgical margin.  Macroscopically vascular invasion in large vessels is present.  A second tumour is identified located in segment six measuring 10 x 10 x 10mm and is located more than 70mm from the surgical margin.  The second tumour is located 130mm from the main tumour.  The rest of the liver parenchyma shows cirrhosis.	 PHI:Null
1195	 1380	 Blocks: 1 to 6 - tumour (block 6 - tissue selected for tissue bank); 7 - tumour into big vessels; 8 - surgical margin close to the tumour; 9 - non tumoral liver; 10 & 11 - two representative sections fromthe second tumour.	 PHI:Null
1195	 1638	 B.  Specimen labelled "Gallbladder" consists of a gallbladder 80 x 50 x 30mm.  The external surface is green and shiny and filled with bile.  No gallstones are identified.   Mucosal surface is green and velvety and the wall has a maximum thickness of 2mm.	 PHI:Null
1195	 1706	 Blocks: 1 - TS mid; 2 - TS body; 3 - LS fundus.   (TC/ta 10/3/62)	 DOCTOR:TC
1195	 1706	 Blocks: 1 - TS mid; 2 - TS body; 3 - LS fundus.   (TC/ta 10/3/62)	 DATE:10/3/62=>2062-10-03
1195	 1708	 	 PHI:Null
1195	 1747	 MICROSCOPIC (Reported by Dr T Chadek):	 DOCTOR:T Chadek
1195	 2352	 A.  Sections of liver show two separate tumours with similar morphology.  The malignant tumour cells are arranged in a mixture of patterns including nodules, sheets, trabeculae and acini.  The tumour cells are markedly pleomorphic with large nuclei, prominent cherry red nucleoli and abundant eosinophilic cytoplasm.  The mitotic activity is brisk.  There is extensive lymphovascular invasion.  There is marked necrosis and fibrosis associated with the tumour.  The non neoplastic liver is cirrhotic.The tumours are completely excised and section from the surgical margin shows no evidence of malignancy.	 PHI:Null
1195	 2407	 Immunohistochemical stains are performed:5.2: positive	 PHI:Null
1195	 2435	 CD34: positive in sinusoids	 PHI:Null
1195	 2462	 HepPar-1: focally positive	 PHI:Null
1195	 2504	 CEA: shows a canalicular staining pattern	 PHI:Null
1195	 2534	 CK19:  weak patchy positivity	 PHI:Null
1195	 2588	 CDX-2, CK7, CK20, CK5/6, PSA, TTF-1 and p16: negative	 PHI:Null
1195	 2693	 The overall appearances are consistent with those of moderately differentiated hepatocellular carcinoma.	 PHI:Null
1195	 2806	 B.  Sections of the gallbladder show features of mild chronic inflammation.  There is no evidence of malignancy.	 PHI:Null
1195	 2817	 DIAGNOSIS:	 PHI:Null
1195	 2894	 A.  Liver - Hepatocellular carcinoma, two separate foci, completely excised.	 PHI:Null
1195	 2935	 B.  Gallbladder - Chronic cholecystitis.	 PHI:Null
1195	 2937	 	 PHI:Null
1196	 24	 Episode No:  92R853549S	 IDNUM:92R853549S
1196	 36	 9268535.MZS	 MEDICALRECORD:9268535.MZS
1196	 51	 LOEHRER, LES	 PATIENT:LOEHRER, LES
1196	 69	 Lab No:  92R85354	 IDNUM:92R85354
1196	 74	 Pugh	 STREET:Pugh
1196	 96	 CABOOLTURE  VIC  4821	 CITY:CABOOLTURE
1196	 96	 CABOOLTURE  VIC  4821	 STATE:VIC
1196	 96	 CABOOLTURE  VIC  4821	 ZIP:4821
1196	 113	 Specimen: Tissue	 PHI:Null
1196	 132	 D.O.B:  18/10/2010	 DATE:18/10/2010=>2010-10-18
1196	 140	 Sex:  M	 PHI:Null
1196	 166	 Collected: 2/10/2062 at :	 DATE:2/10/2062=>2062-10-02
1196	 238	 Location:  MEDIC/SURGERY WARD - TRESILLIAN FAMILY CARE CENTRE - BELMORE	 DEPARTMENT:MEDIC/SURGERY WARD
1196	 238	 Location:  MEDIC/SURGERY WARD - TRESILLIAN FAMILY CARE CENTRE - BELMORE	 HOSPITAL:TRESILLIAN FAMILY CARE CENTRE - BELMORE
1196	 262	 DR ORLIE Lloyd GRAUBARD	 DOCTOR:ORLIE Lloyd GRAUBARD
1196	 288	 Distribution:   FILE-COPY	 PHI:Null
1196	 313	 AMENDED REPORT (3/12/62)	 DATE:3/12/62=>2062-12-03
1196	 315	 	 PHI:Null
1196	 325	 CLINICAL:	 PHI:Null
1196	 462	 Very large bladder tumour occupying over 50% of bladder lumen.  Mixed solid and papillary elements seen.  Resection to fat in sections.	 PHI:Null
1196	 475	 MACROSCOPIC:	 PHI:Null
1196	 509	 Patient details checked by XO/tmc	 DOCTOR:XO
1196	 709	 Specimen labelled "Bladder tumour", consists of multiple pieces of soft tan tumour mixed with blood clot measuring in aggregate 120 x 90 x 40mm.  Representative sections in 8 blocks. (JC/ec 3.10.62)	 DOCTOR:JC
1196	 709	 Specimen labelled "Bladder tumour", consists of multiple pieces of soft tan tumour mixed with blood clot measuring in aggregate 120 x 90 x 40mm.  Representative sections in 8 blocks. (JC/ec 3.10.62)	 DATE:3.10.62=>2062-10-03
1196	 711	 	 PHI:Null
1196	 748	 MICROSCOPIC: (Reported by Dr H Wold)	 DOCTOR:H Wold
1196	 1125	 The sections show high grade (grade 3 out of 3) papillary transitional cell carcinoma with areas of necrosis and stromal invasion. There is smooth muscle invasion in some areas probably muscularis propria.  Most of the tissue submitted is replaced by tumour.  No definite lymphovascular invasion is identified.  Fragments of fat are present which are not involved by tumour.	 PHI:Null
1196	 1136	 CONCLUSION	 PHI:Null
1196	 1257	 Bladder tumour: High grade papillary transitional cell carcinoma with stromal invasion including smooth muscle invasion.	 PHI:Null
1196	 1298	 AMENDED REPORT (DrH Neidhardt, 3/12/62)	 DOCTOR:H Neidhardt
1196	 1298	 AMENDED REPORT (DrH Neidhardt, 3/12/62)	 DATE:3/12/62=>2062-12-03
1196	 1383	 The slides were reviewed with Dr BRUNO Bault, Dr Ian Kipling and Dr BARRIE Damewood.	 DOCTOR:BRUNO Bault
1196	 1383	 The slides were reviewed with Dr BRUNO Bault, Dr Ian Kipling and Dr BARRIE Damewood.	 DOCTOR:Ian Kipling
1196	 1383	 The slides were reviewed with Dr BRUNO Bault, Dr Ian Kipling and Dr BARRIE Damewood.	 DOCTOR:BARRIE Damewood
1196	 1672	 Sections show papillary urothelial carcinoma, high grade (WHO 2004).  There are 3 foci of superficial invasion, up to a depth of 0.3mm into the lamina propria (pT1), characterised by a single and small irregular clusters of highly atypical tumour cells, surrounded by desmoplastic stroma.	 PHI:Null
1196	 1817	 In block 8, there is a focal proliferation of smooth muscle fibres from the muscularis mucosae. No invasive malignancy is present in this focus.	 PHI:Null
1196	 1898	 Detrusor muscle and fat present in the specimen shows no evidence of malignancy.	 PHI:Null
1196	 1941	 There is no evidence of carcinoma in situ.	 PHI:Null
1196	 1960	 AMENDED DIAGNOSIS:	 PHI:Null
1196	 1976	 Bladder lesion:	 PHI:Null
1196	 2031	 Papillary urothelial carcinoma, high grade (WHO 2004)	 PHI:Null
1196	 2128	 Superficial invasion into lamina propria (pT1), no evidence of detrusor muscle invasion present	 PHI:Null
1196	 2130	 	 PHI:Null
1197	 25	 Episode No:  40O974608B	 IDNUM:40O974608B
1197	 36	 405974.QBV	 MEDICALRECORD:405974.QBV
1197	 61	 GIROLAMO, Robyn Patrice	 PATIENT:GIROLAMO, Robyn Patrice
1197	 79	 Lab No:  40O97460	 IDNUM:40O97460
1197	 84	 Haan	 STREET:Haa
1197	 106	 ROXBY DOWNS  SA  7268	 CITY:ROXBY DOWNS
1197	 106	 ROXBY DOWNS  SA  7268	 STATE:SA
1197	 106	 ROXBY DOWNS  SA  7268	 ZIP:7268
1197	 123	 Specimen: Tissue	 PHI:Null
1197	 141	 D.O.B:  29/5/2000	 DATE:29/5/2000=>2000-05-29
1197	 149	 Sex:  F	 PHI:Null
1197	 180	 Collected: 27/08/2012 at 09:21	 TIME:27/08/2012 at 09:21=>2012-08-27T09:21
1197	 227	 Location:  SYDPATH-TINGHA MULTIPURPOSE SERVICE	 DEPARTMENT:SYDPATH
1197	 227	 Location:  SYDPATH-TINGHA MULTIPURPOSE SERVICE	 HOSPITAL:TINGHA MULTIPURPOSE SERVICE
1197	 249	 DR Raul ERROL PAULHUS	 DOCTOR:Raul ERROL PAULHUS
1197	 329	 Distribution:  DR Mcinturff, DR NGARRINDJERI,  FILE-COPY,   NSW-CANCER-REGISTRY	 DOCTOR:Mcinturff
1197	 329	 Distribution:  DR Mcinturff, DR NGARRINDJERI,  FILE-COPY,   NSW-CANCER-REGISTRY	 DOCTOR:NGARRINDJERI
1197	 361	 SUPPLEMENTARY REPORT (1.10.62):	 DATE:1.10.62=>2062-10-01
1197	 363	 	 PHI:Null
1197	 373	 CLINICAL:	 PHI:Null
1197	 420	 Ascending colon cancer.  Right hemicolectomy.	 PHI:Null
1197	 433	 MACROSCOPIC:	 PHI:Null
1197	 463	 Patient details checked by GE	 DOCTOR:GE
1197	 1333	 Specimen labelled "Right colon", consists of a right hemicolectomy comprising a segment of terminal ileum measuring 70mm in length with an open circumference of 30mm at the proximal resection margin, in continuity with caecum and ascending colon measuring 170m in length with an external diameter of up to 60mm at the distal resection margin. Arising immediately inferior to the ileocaecal valve on the caecal mucosa there is a fungating tumour measuring 30 x 25mm. The tumour is 80mm from the proximal resection margin and 120mm from the distalresection margin. The cut surface of the tumour shows full thickness bowel wall involvement but there is no macroscopic evidence of invasion into the pericaecal fat.  The remainder of the bowel mucosa appears macroscopically normal. The appendix is not identified.  Lymph nodes are identified measuring from 2-20mm across.	 PHI:Null
1197	 1373	 Representative sections in 14 blocks.	 PHI:Null
1197	 1641	 Block 1 - proximal margin; 2 - distal margin; 3 & 4 - tumour to serosa; 5 & 6 - tumour to pericaecal fat; 7 - tumour research block; 8 - apical lymph node; 9 - next apical lymph node; 10 - one lymph node bisected; 11-14 - four lymph nodes in each.  (FR/ec  29.10.62)	 DOCTOR:FR
1197	 1641	 Block 1 - proximal margin; 2 - distal margin; 3 & 4 - tumour to serosa; 5 & 6 - tumour to pericaecal fat; 7 - tumour research block; 8 - apical lymph node; 9 - next apical lymph node; 10 - one lymph node bisected; 11-14 - four lymph nodes in each.  (FR/ec  29.10.62)	 DATE:29.10.62=>2062-10-29
1197	 1681	 MICROSCOPIC: (Reported by Dr M Wolff)	 DOCTOR:M Wolff
1197	 1819	 Sections show a moderately differentiated mucinous (colloid) carcinoma of caecum, arising in a villous adenoma. A synopticreport follows:	 PHI:Null
1197	 1843	 Macroscopic Description	 PHI:Null
1197	 1861	 Site of tumour:	 PHI:Null
1197	 1891	 Maximum tumour diameter: 30mm	 PHI:Null
1197	 1936	 Distance of tumour to nearer cut end:   80mm	 PHI:Null
1197	 1963	 Tumour perforation:     No	 PHI:Null
1197	 1987	 Microscopic Description	 PHI:Null
1197	 1993	 Type	 PHI:Null
1197	 2012	 Mucinous carcinoma	 PHI:Null
1197	 2048	 Differentiation by predominant area	 PHI:Null
1197	 2058	 Moderate.	 PHI:Null
1197	 2073	 Local invasion	 PHI:Null
1197	 2103	 pT3 Beyond muscularis propria	 PHI:Null
1197	 2133	 Tumour involvement of margins	 PHI:Null
1197	 2156	 Cut ends: Not involved	 PHI:Null
1197	 2212	 Non-peritonealised circumferential margin: Not involved	 PHI:Null
1197	 2284	 Histological measurementfrom tumour to non-peritonealised margin: >10mm	 PHI:Null
1197	 2296	 Lymph nodes	 PHI:Null
1197	 2331	 Number of lymph nodes present: 15	 PHI:Null
1197	 2367	 Number of lymph nodes involved:  0	 PHI:Null
1197	 2397	 pN0 No regional LN metastasis	 PHI:Null
1197	 2421	 Lymphovascular invasion	 PHI:Null
1197	 2428	 Absent	 PHI:Null
1197	 2448	 Perineural invasion	 PHI:Null
1197	 2455	 Absent	 PHI:Null
1197	 2499	 Histologically confirmed distant metastases	 PHI:Null
1197	 2537	 pMX Cannot be assessed histologically	 PHI:Null
1197	 2577	 Background abnormalities/other comments	 PHI:Null
1197	 2580	 No	 PHI:Null
1197	 2603	 Residual tumour status	 PHI:Null
1197	 2625	 R0 No residual tumour	 PHI:Null
1197	 2681	 Mismatch Repair Deficiency (MMRD) Status:  To follow.	 PHI:Null
1197	 2708	 Summary - TNM 7th Edition	 PHI:Null
1197	 2739	 (y)pT3     pN0     pMx     R0	 PHI:Null
1197	 2742	 	 PHI:Null
1197	 2753	 DIAGNOSIS:	 PHI:Null
1197	 2827	 Right hemicolectomy:  Mucinousadenocarcinoma of caecum.  pT3 pN0 pMx R0.	 PHI:Null
1197	 2858	 SUPPLEMENTARY REPORT(1.10.62):	 DATE:1.10.62=>2062-10-01
1197	 2924	 Immunostains for mismatch repair enzymes have now been performed.	 DATE:now=>2065-07-30
1197	 2960	 MLH1:   Preserved nuclear staining.	 PHI:Null
1197	 2995	 MSH2:  Preserved nuclear staining.	 PHI:Null
1197	 3030	 MSH6:  Preserved nuclear staining.	 PHI:Null
1197	 3065	 PMS2:  Preserved nuclear staining.	 PHI:Null
1197	 3074	 Comment:	 PHI:Null
1197	 3214	 Preserved nuclear staining of a carcinoma for MLH1, PMS2, MSH2 and MSH6 indicates a low likelihood of microsatellite instability phenotype.	 PHI:Null
1199	 12	 073905.RQQ	 MEDICALRECORD:073905.RQQ
1199	 34	 Sprake, Brigida LAURI	 PATIENT:Sprake, Brigida LAURI
1199	 43	 07K90566	 IDNUM:07K90566
1199	 77	 Last edited : 16/6/2064  Page: 2	 DATE:16/6/2064=>2064-06-16
1199	 87	 CLINICAL:	 PHI:Null
1199	 287	 Invasive ductal cancer.  Left breast (11 o'clock / 4cm FN).  Prior WLE and sentinel node.  Left mastectomy and level 2 axillary section.  Two specimens:  Breast and axilla to level 1.  Level 2 nodes.	 PHI:Null
1199	 300	 MACROSCOPIC:	 PHI:Null
1199	 1248	 A.  Specimen labelled "Left breast + left axilla level 1" consists of mastectomy specimen with axilla.  The entire specimen weighs 323g andmeasures 190mm from medial to lateral, 130mm from superior to inferior and 30mm from superficial to deep.  An ellipse of skin measuring 195 x 80mm, is present containing a nipple areola complex.  The diameter of the nipple is 15mm.  Theskin surface is unremarkable.  Axillary tissue measures 110 x 45 x 25mm.  The superior superficial surface is inked blue.  The inferior superficial surface is inked green.  The deep surface is inked black.  On the cut surface, a small well circumscribed tumour measuring 5mm in maximum extent is present at the medial aspect of upper inner quadrant (11 o'clock).  The tumour measures 15mm to the superficial margin and 25mm to the deep margin.  Remainder of the breast tissue is fibrofatty.  Multiplelymph nodes identified, including apical lymph node which measures 12mm.	 PHI:Null
1199	 1811	 Blocks:  1 to 4 - section of tumour with superficial and deep margin; 5 to 8 - another full face of tumour with the superficial and deep margin; 9& 10 - breast tissue medial to tumour with deep margin; 11 & 12 - breast tissue lateral to tumour without margins; 13 - RS upper inner quadrant with deep margin; 14 - RS lower inner quadrant with the superficial margin; 15 - RS upper outer quadrant with the deep margin; 16 - RS lower outer quadrant without margins; 17 - nipple; 18 - apical lymph node; 19 to 22 - lymph nodes as seen.  Multiple pieces in 22 blocks.	 PHI:Null
1199	 1927	 B.  Specimen labelled "Left axilla level 2" consists of unorientated mass of fatty tissue measuring 30 x 15 x 10mm.	 PHI:Null
1199	 2004	 Blocks:  1 - multiple lymph nodes; 2 - remainder fatty tissue.  AE 2 blocks.	 PHI:Null
1199	 2020	 (AR/rt 12.6.64)	 DOCTOR:AR
1199	 2020	 (AR/rt 12.6.64)	 DATE:12.6.64=>2064-06-12
1199	 2060	 MICROSCOPIC (Reported by Dr B Crofoot):	 DOCTOR:B Crofoot
1199	 2105	 A & B.  Synoptic Report for Breast Carcinoma	 PHI:Null
1199	 2125	 Invasive carcinoma:	 PHI:Null
1199	 2144	 Site:  Left breast	 PHI:Null
1199	 2178	 Type:  Invasive lobular carcinoma	 PHI:Null
1199	 2258	 Invasive tumour size:  two separate foci (block A6 and A12, measuring 3mm each)	 PHI:Null
1199	 2298	 Grade (Modified Bloom & Richardson):  1	 PHI:Null
1199	 2365	 Tubules: 3     Nuclei: 1     Mitoses: 1     Mitotic rate: 4/10hpf.	 PHI:Null
1199	 2398	 Lymphovascular invasion:  Absent	 PHI:Null
1199	 2404	 	 PHI:Null
1199	 2422	 DCIS component:	 PHI:Null
1199	 2436	 DCIS:  Absent	 PHI:Null
1199	 2456	 Excision Margins:	 PHI:Null
1199	 2579	 Invasive component:  The invasive carcinoma is 0.8mm to the deep margin (block A6) and is well clear of the other margins.	 PHI:Null
1199	 2613	 In-situ component:  Notapplicable	 PHI:Null
1199	 2637	 Receptors (Block A12):	 PHI:Null
1199	 2651	 ER:  Positive	 PHI:Null
1199	 2675	 100% of nuclei stained	 PHI:Null
1199	 2719	 predominant intensity of staining:  strong	 PHI:Null
1199	 2733	 PR:  Positive	 PHI:Null
1199	 2757	 100% of nuclei stained	 PHI:Null
1199	 2801	 predominant intensity of staining:  strong	 PHI:Null
1199	 2848	 HER2 (Novocastra 10A7):  Negative (0 staining)	 PHI:Null
1199	 2950	 HER SISH:  Performed at Boston Scientific, WENTWORTH DISTRICT HOSPITAL Hospital, see separate report.	 ORGANIZATION:Boston Scientific
1199	 2950	 HER SISH:  Performed at Boston Scientific, WENTWORTH DISTRICT HOSPITAL Hospital, see separate report.	 HOSPITAL:WENTWORTH DISTRICT HOSPITAL
1199	 3016	 Ki-67 index:  To follow and a supplementary report will be issued	 PHI:Null
1199	 3038	 Nipple:  Unremarkable	 PHI:Null
1199	 3059	 LCIS / ALH:  Absent	 PHI:Null
1199	 3074	 Miscellaneous:	 PHI:Null
1199	 3349	 There are two separate foci of invasive lobular carcinoma within the inner upper quadrant (in block A6 and A12, each measuring 3mm in diameter).  Both foci of tumour show identical morphology.  The tumour cells are negative are E-cadherin, in keeping with lobular carcinoma.	 PHI:Null
1199	 3510	 Ten (10) lymph nodes are identified in the specimen A (left breast and axilla level 1).  The lymph nodes are unremarkable.  There is no evidence of malignancy.	 PHI:Null
1199	 3660	 Five (5) lymph nodes are identified in the specimen B (left axilla level 2).  The lymph nodes are unremarkable.  There is no evidence of malignancy.	 PHI:Null
1201	 24	 Episode No:  28B506514V	 IDNUM:28B506514V
1201	 36	 2805065.FMV	 MEDICALRECORD:2805065.FMV
1201	 58	 RITSON, NYAH MARCUS	 PATIENT:RITSON, NYAH MARCUS
1201	 85	 Lab No:  28B50651,28B50651	 IDNUM:28B50651
1201	 85	 Lab No:  28B50651,28B50651	 IDNUM:28B50651
1201	 91	 Legra	 STREET:Legra
1201	 111	 MORANBAH  TAS  3636	 CITY:MORANBAH
1201	 111	 MORANBAH  TAS  3636	 STATE:TAS
1201	 111	 MORANBAH  TAS  3636	 ZIP:3636
1201	 137	 Specimen: Washings,Tissue	 PHI:Null
1201	 156	 D.O.B:  26/10/1983	 DATE:26/10/1983=>1983-10-26
1201	 164	 Sex:  F	 PHI:Null
1201	 190	 Collected: 11/6/2064 at :	 DATE:11/6/2064=>2064-06-11
1201	 229	 Location:  SYDPATH - WALLAROO HOSPITAL	 DEPARTMENT:SYDPATH
1201	 229	 Location:  SYDPATH - WALLAROO HOSPITAL	 HOSPITAL:WALLAROO HOSPITAL
1201	 254	 DR BRADLEY Armand RUFFER	 DOCTOR:BRADLEY Armand RUFFER
1201	 291	 Distribution:    NSW-CANCER-REGISTRY	 PHI:Null
1201	 301	 CLINICAL:	 PHI:Null
1201	 503	 85 year old with pelvic mass,looks like ovarian with raised Ca125, also thickened endometrium, and smear suggestive of invasion.  Hx of breast cancer previously on tamoxifen.  Pelvic mass - ?histopath.	 AGE:85
1201	 516	 MACROSCOPIC:	 PHI:Null
1201	 793	 A.  Specimen labelled "Right tube and ovary" consists of amultimodal solid mass 130 x 100 x 65 with attached tube 40mm in length.  Two representative sections are taken for frozen section.  On sectioning the tumour has a solid and lobular appearance with areas of haemorrhage.	 PHI:Null
1201	 915	 Blocks:  1 - frozen section; 2 to 11 - representative sections of the tumour; 12 - two LS fimbria, one TS fallopian tube.	 PHI:Null
1201	 938	 FROZEN SECTION REPORT:	 PHI:Null
1201	 983	 Adenocarcinoma with endometrioid appearance.	 PHI:Null
1201	 1052	 Result to Dr Dezenzo by Dr Gerald GUCWA at 1635pm on the 09.04.2014.	 DOCTOR:Dezenzo
1201	 1052	 Result to Dr Dezenzo by Dr Gerald GUCWA at 1635pm on the 09.04.2014.	 DOCTOR:Gerald GUCWA
1201	 1052	 Result to Dr Dezenzo by Dr Gerald GUCWA at 1635pm on the 09.04.2014.	 TIME:at 1635pm on the 09.04.2014=>2014-04-09T16:35
1201	 1682	 B.  Specimen labelled "Uterus, cervix, left tube and ovary" consists of a uterus with attached cervix and right fallopian tube and ovary weighing in total 80g.  The uterus measures 50 x 45 x 30mm and has a smooth shiny serosal surface.  The ectocervix measures 40 x 30mm and has a ragged and fibrotic mucosal surface.  The endometrium is 2mm in maximum thickness.  The myometrium is 15mm in maximum thickness.  The myometrium contains several fibroid 2 to 5mm in maximum diameter.  The left fallopian tube measures 40mm in length, 5mm in maximum diameter.  The left ovary measures 20 x 10 x 5mm.  The cut surface is unremarkable.	 PHI:Null
1201	 2123	 Blocks:  1 to 3 - full LS of anterior body and cervix; 4 - representative section of fibroids; 5 to 7 - full LS of posterior body and cervix; 8 - right parametrial tissue; 9 - left parametrial tissue; 10 - two LS right fimbria and one TS fallopian tube; 11 - ovary.  AE.Reselect blocks 12-19 - serial sections of anterior cervix, AE; 20-27 - serial sections of posterior cervix, AE.  Please see attached diagram.  (TO: TD: AL/ec   13.6.64)	 DOCTOR:TD
1201	 2123	 Blocks:  1 to 3 - full LS of anterior body and cervix; 4 - representative section of fibroids; 5 to 7 - full LS of posterior body and cervix; 8 - right parametrial tissue; 9 - left parametrial tissue; 10 - two LS right fimbria and one TS fallopian tube; 11 - ovary.  AE.Reselect blocks 12-19 - serial sections of anterior cervix, AE; 20-27 - serial sections of posterior cervix, AE.  Please see attached diagram.  (TO: TD: AL/ec   13.6.64)	 DOCTOR:AL
1201	 2123	 Blocks:  1 to 3 - full LS of anterior body and cervix; 4 - representative section of fibroids; 5 to 7 - full LS of posterior body and cervix; 8 - right parametrial tissue; 9 - left parametrial tissue; 10 - two LS right fimbria and one TS fallopian tube; 11 - ovary.  AE.Reselect blocks 12-19 - serial sections of anterior cervix, AE; 20-27 - serial sections of posterior cervix, AE.  Please see attached diagram.  (TO: TD: AL/ec   13.6.64)	 DATE:13.6.64=>2064-06-13
1201	 2289	 C.  Specimen labelled "Anterior margin" consists of an irregular piece of fibrous tissue measuring 20 x 10 x 5mm.  The specimen is serially sectioned and AE 1 block.	 PHI:Null
1201	 2449	 D.  Specimen labelled "Omentum" consists of a large piece of omentum 320 x 130 x 10mm.  On sectioning there are several tumour deposits ranging from 2 to 20mm.	 PHI:Null
1201	 2511	 Blocks:  1 to 3 - representative sections of tumour deposits.	 PHI:Null
1201	 2682	 E.  Specimen labelled "Right external iliac node" consists of a piece of fatty tissue 30 x 10 x 2mm.  No lymph nodes are identified.  AE 1 block.  (TO: NX; SG/rt 12.6.64)	 DOCTOR:NX
1201	 2682	 E.  Specimen labelled "Right external iliac node" consists of a piece of fatty tissue 30 x 10 x 2mm.  No lymph nodes are identified.  AE 1 block.  (TO: NX; SG/rt 12.6.64)	 DOCTOR:SG
1201	 2682	 E.  Specimen labelled "Right external iliac node" consists of a piece of fatty tissue 30 x 10 x 2mm.  No lymph nodes are identified.  AE 1 block.  (TO: NX; SG/rt 12.6.64)	 DATE:12.6.64=>2064-06-12
1201	 2723	 MICROSCOPIC (Reported by Dr G Caudillo):	 DOCTOR:G Caudillo
1201	 2866	 A.  Sections show a moderately differentiated adenocarcinoma of the ovary with both endometrioid and serous features.  The tube is uninvolved.	 PHI:Null
1201	 2939	 The tumour is strongly positive for CK7 and negative for CK20 and CDX-2.	 PHI:Null
1201	 3070	 B.  Sections show adenocarcinoma on the uterine serosa, in theleft parametrial soft tissue, and in the left ovary (2mm deposit).	 PHI:Null
1201	 3282	 The entire cervix has been examined.  In block 26 there is a focus of CIN 3.  There is no AIS or invasive carcinoma.  Much of the cervix is ulcerated and the vaginalmargin cannot be guaranteed to be free of CIN.	 PHI:Null
1201	 3343	 The endometrium is atrophic.  The left tube is unremarkable.	 PHI:Null
1201	 3443	 C.  Sections show very focal unremarkable squamous epithelium.  There is no evidence of malignancy.	 PHI:Null
1201	 3488	 .  Sections show extensive serous carcinoma.	 PHI:Null
1201	 3529	 E.  No nodes are present in this tissue.	 PHI:Null
1201	 3540	 DIAGNOSIS:	 PHI:Null
1201	 3718	 Moderately differentiated serous and endometrioid adenocarcinoma of the right ovary, also involving the left ovary, left parametrial soft tissue, the uterine serosa and omentum.	 PHI:Null
1201	 3748	 Small focus of CIN 3 present.	 PHI:Null
1203	 25	 Episode No:  49S107472G	 IDNUM:49S107472G
1203	 36	 497107.LTH	 MEDICALRECORD:497107.LTH
1203	 55	 Soloway, Rosetta	 PATIENT:Soloway, Rosetta
1203	 73	 Lab No:  49S10747	 IDNUM:49S10747
1203	 83	 Tarporley	 STREET:Tarporley
1203	 116	 NEWCASTLE  New South Wales  0871	 CITY:NEWCASTLE
1203	 116	 NEWCASTLE  New South Wales  0871	 STATE:New South Wales
1203	 116	 NEWCASTLE  New South Wales  0871	 ZIP:0871
1203	 133	 Specimen: Tissue	 PHI:Null
1203	 152	 D.O.B:  29/10/2032	 DATE:29/10/2032=>2032-10-29
1203	 160	 Sex:  F	 PHI:Null
1203	 191	 Collected: 06/04/2014 at 19:01	 TIME:06/04/2014 at 19:01=>2014-04-06T19:01
1203	 240	 Location:  INTENSIVECARE UNIT-NORMANTON HOSPITAL	 DEPARTMENT:INTENSIVECARE UNIT
1203	 240	 Location:  INTENSIVECARE UNIT-NORMANTON HOSPITAL	 HOSPITAL:NORMANTON HOSPITAL
1203	 273	 DR CLEVELAND CLIFTON KLIETHERMES	 DOCTOR:CLEVELAND CLIFTON KLIETHERMES
1203	 329	 Distribution:  DR RICHIE RAMARIZ,   NSW-CANCER-REGISTRY	 DOCTOR:RICHIE RAMARIZ
1203	 374	 ***** SUPPLEMENTARY REPORT - SEE BELOW *****	 PHI:Null
1203	 385	 CLINICAL:	 PHI:Null
1203	 473	 Whipple's.  Multiple liver resections.  Para aorticlymph node dissection.  ? G2 P NETS.	 PHI:Null
1203	 486	 MACROSCOPIC:	 PHI:Null
1203	 1945	 A.  Specimen labelled "Whipple's", consists of a Whipple's specimen including distal stomach, duodenum, pancreas and gallbladder.  The length of stomach and bowel measures 180mm in length including an area of distal stomach 15mm in length.  The attached gallbladder measures 70mm in length with a maximum external diameter of 38mm.  The serosa of the gallbladder appears unremarkable.  The attached pancreas measures 65 x 60 x 55mm.  The common bile duct is able to be probed along its length.  The anterior margin is inked red, the portal vein margin is inked black, the uncinate process margin is inked blue and the posterior margin is inked green.  The pancreaticneck resection margin is removed and the underlying tissue after removal is inked red.  The cut surface of the pancreas reveals a large firm cream poorly circumscribed tumour within the pancreas and centred near the uncinate process andextending into the anterior pancreas measuring 38 x 25 x 18mm.  The tumour abuts the uncinate process margin.  The tumour is 15mm from the anterior margin and 1mm from the posterior pancreatic margin and well clear (>20mm) from the pancreatic neck resection margin. The portal vein margin appears clear of the tumour by 15mm.  Numerous lymph nodes which are involved with cream tumour are identified around the inferior pancreas.  Large numbersappear macroscopically involved with the tumour.  One pericystic duct lymph node is identified measuring 5mm.	 PHI:Null
1203	 2322	 Blocks: 1- resection margins; 2 - common bile duct resection margin; 3 and 4 - representative gallbladder; 5 - shave of pancreatic neck resection margin; 6 and 7 - full face through tumour to margins; 8 - LS through pancreatic neck resection margin; 10 - tumour to portal vein margin; 11 to 13 - representative involved nodes from inferior pancreas; 14 - pericystic duct node.	 PHI:Null
1203	 2542	 B.  Specimen labelled "Segment 2 liver", consists of a wedge of liver 32 x 18 x 10mm.A cream nodule measuring 10mm in maximum dimension is identified abutting the capsular surface and is 3mm from the resection margin.	 PHI:Null
1203	 2613	 Blocks: 1 - entire nodule embedded; 2 - representative further liver.	 PHI:Null
